,comment_id,comment_parent_id,comment_body,comment_link_id,created,date
2737,gtyvqih,t3_mnharu,Redditor for 18 hours....LOL,t3_mnharu,2021-04-10 03:59:38,2021-04-10
2738,gtz1n5q,t3_mnharu,What a Bitchhhhh,t3_mnharu,2021-04-10 04:45:53,2021-04-10
2739,gtz6s6f,t3_mnharu,Silly Yam,t3_mnharu,2021-04-10 05:27:29,2021-04-10
2740,gtz8cn6,t3_mnharu,He’s 85% sure,t3_mnharu,2021-04-10 05:40:20,2021-04-10
2741,gtz8y5m,t3_mnharu,TLDR; OP was the scammer all along.,t3_mnharu,2021-04-10 05:45:19,2021-04-10
2742,gtzgzy7,t3_mnharu,If you give me 80BTC II'll give you $100,t3_mnharu,2021-04-10 06:53:50,2021-04-10
2743,gtzjvm1,t3_mnharu,Bro that escalated quickly. Me likey,t3_mnharu,2021-04-10 07:19:36,2021-04-10
2744,gtzjy2c,t3_mnharu,“redditor for 18 h”,t3_mnharu,2021-04-10 07:20:13,2021-04-10
2745,gtzl8l2,t3_mnharu,3rd world scammers know no boundaries bruh,t3_mnharu,2021-04-10 07:31:54,2021-04-10
2746,gtzpl5m,t3_mnharu,Looks like they blow at English and maths.,t3_mnharu,2021-04-10 08:11:35,2021-04-10
2747,gtzpqo4,t3_mnharu,I love playing with scammers.,t3_mnharu,2021-04-10 08:12:58,2021-04-10
2748,gtzqo9t,t3_mnharu,"As much as i like and support the philosophy behind bitcoin, crypto has the scummiest of scums when it comes to scammers",t3_mnharu,2021-04-10 08:21:27,2021-04-10
2749,gtzvs4o,t3_mnharu,Fella really likes the number 85,t3_mnharu,2021-04-10 09:07:53,2021-04-10
2750,gtzyseb,t3_mnharu,"“Only broke people say this”
*while trying to scam someone out of 100$ cos their poor*",t3_mnharu,2021-04-10 09:35:31,2021-04-10
2751,gtzz7pd,t3_mnharu,Sounds like a timeshare salesman,t3_mnharu,2021-04-10 09:39:30,2021-04-10
2752,gtzzo3g,t3_mnharu,Ban him!,t3_mnharu,2021-04-10 09:43:44,2021-04-10
2753,gtzzwjq,t3_mnharu,I can read the accent,t3_mnharu,2021-04-10 09:45:54,2021-04-10
2754,gu03e4b,t3_mnharu,"Scammer ""You are not paying any money to me,then probably you are broke""",t3_mnharu,2021-04-10 10:18:19,2021-04-10
2755,gu06iky,t3_mnharu,Lmao how quickly he got butthurt about not being given free money.,t3_mnharu,2021-04-10 10:48:14,2021-04-10
2756,gu07nwh,t3_mnharu,I’ll give someone ten dollars if they give me 100,t3_mnharu,2021-04-10 10:59:22,2021-04-10
2757,gu0a4n7,t3_mnharu,Creed Bratton special,t3_mnharu,2021-04-10 11:23:54,2021-04-10
2758,gu0amqt,t3_mnharu,"I’ve also had people message me trying to chat out of nowhere....so here’s my response to anyone trying to chat with me...FUCK YOU!!! Yeah, I have BTC, in fact I have a LOT of BTC...and I got that BTC from working hard, not scamming people online...I hope these scammers get their just desserts...I would say what I REALLY want to say, but Reddit will not allow me to say such things. Seriously, FUCK ALL SCAMMERS!!!",t3_mnharu,2021-04-10 11:28:58,2021-04-10
2759,gu0apda,t3_mnharu,He is not even a real scammer. Looks like some fake scammer is trying to scam you. Damn scam.,t3_mnharu,2021-04-10 11:29:42,2021-04-10
2760,gu0chq2,t3_mnharu,If you reply me shit I will report you - don't you fucking reply me shit,t3_mnharu,2021-04-10 11:48:47,2021-04-10
2761,gu0d5jo,t3_mnharu,"Me: *posts 1 question in r/BitcoinBeginners*

Every scammer within a 500 mile radius: hey there fellow stranger, i wanna help ya out!",t3_mnharu,2021-04-10 11:56:02,2021-04-10
2762,gu0dnym,t3_mnharu,Well that escelated quickly,t3_mnharu,2021-04-10 12:01:44,2021-04-10
2763,gu0ewa4,t3_mnharu,Lol.,t3_mnharu,2021-04-10 12:15:33,2021-04-10
2764,gu0kd3x,t3_mnharu,I like you a lot,t3_mnharu,2021-04-10 13:21:53,2021-04-10
2765,gu0pe2h,t3_mnharu,LOL... Indians.,t3_mnharu,2021-04-10 14:31:54,2021-04-10
2767,gtxyvyx,t3_mnharu,"You are a fool for not trusting a scammer, no wonder you are so poor.",t3_mnharu,2021-04-09 23:56:19,2021-04-09
2769,gty3rk9,t3_mnharu,Shut up OP. You are bad at math,t3_mnharu,2021-04-10 00:31:55,2021-04-10
2770,gtyotct,t3_mnharu,"this is hilarious: your (and others in this thread’s) reading comprehension is so bad that you didn’t even understand that the original statement is “receive $80 as your gain” which implies $180.

Of course “just trolling” right?",t3_mnharu,2021-04-10 03:06:29,2021-04-10
2772,gtxzlc0,t3_mnharu,"Even though he is a scammer , the other person is even dumber ,he did say a gain of 80 , so that means 80 plus 100.  But as I said that is a scammer. Both are dumb in their own fucked up ways ,🤷🏻‍♂️",t3_mnharu,2021-04-10 00:01:31,2021-04-10
2774,gtxu6r3,t3_mnharu,At least they should of said you give them 100 and then in 5 days time they will give you back 500 to your bank once the prince of Nigeria blesses this transaction,t3_mnharu,2021-04-09 23:22:15,2021-04-09
2785,gtxthvn,t3_mnharu,🤣🤣🤣,t3_mnharu,2021-04-09 23:17:12,2021-04-09
2786,gtxtybw,t3_mnharu,STOP SCAMMING ADULTS,t3_mnharu,2021-04-09 23:20:34,2021-04-09
2787,gtxuhz4,t3_mnharu,[Scambait](https://www.reddit.com/r/scambait/),t3_mnharu,2021-04-09 23:24:30,2021-04-09
2788,gtxuk71,t3_mnharu,"wow you turned down an 80% gain??? You must not want to feed your family. 

/s",t3_mnharu,2021-04-09 23:24:57,2021-04-09
2789,gtxulnb,t3_mnharu,"I'm fucking dead, he just added $85 to your 100 and then said hes 85% sure it will give a return. This has got to be a troll, not even scammers are this fucking stupid😂",t3_mnharu,2021-04-09 23:25:15,2021-04-09
2790,gtxva54,t3_mnharu,"Please, do as I do, and waste their time as much as possible. Ask them many questions and such. Then at the end tell them to fk off and that you hope you made them waste their time.",t3_mnharu,2021-04-09 23:30:13,2021-04-09
2791,gtxw26x,t3_mnharu,"I’ve gotten about six of those since the season began, and I don’t think I post anything that sounds remotely noobish. It’s a game of numbers. Don’t be the fool.",t3_mnharu,2021-04-09 23:35:56,2021-04-09
2792,gtxwany,t3_mnharu,OP you can post this on iamatotalpieceofshit,t3_mnharu,2021-04-09 23:37:37,2021-04-09
2793,gtxwczt,t3_mnharu,"This is cruel, so many scammers on here in general and then that behaviour. It‘s just disgusting. I never reply to those, it‘s just wasted time. But i hope ppl don‘t fall for that, but there are forsure some who do :/",t3_mnharu,2021-04-09 23:38:05,2021-04-09
2794,gtxx5gq,t3_mnharu,Silllllly yam,t3_mnharu,2021-04-09 23:43:50,2021-04-09
2795,gtxxk4n,t3_mnharu,"People like that are scum.

It's just sad that there are some people who would fall for it too.",t3_mnharu,2021-04-09 23:46:46,2021-04-09
2796,gtxxldb,t3_mnharu,Smite him,t3_mnharu,2021-04-09 23:47:01,2021-04-09
2797,gtxxyeu,t3_mnharu,This is great,t3_mnharu,2021-04-09 23:49:38,2021-04-09
2798,gtxy729,t3_mnharu,Sounds legit,t3_mnharu,2021-04-09 23:51:21,2021-04-09
2799,gtxyv7w,t3_mnharu,What happens next?!?!,t3_mnharu,2021-04-09 23:56:09,2021-04-09
2800,gtxzhes,t3_mnharu,What a silly yam,t3_mnharu,2021-04-10 00:00:42,2021-04-10
2801,gtxzw04,t3_mnharu,"Aw man I got excited to play along, but the account no longer exists :(",t3_mnharu,2021-04-10 00:03:44,2021-04-10
2802,gtxzw6s,t3_mnharu,"Your company has a website? I was unsure up to that point, but now? Shut up and take my money",t3_mnharu,2021-04-10 00:03:46,2021-04-10
2803,gtxzxh1,t3_mnharu,"""I’m not a scammer like you, only broke people say this."" Can this be interpreted as: If one is not a scammer, one is usually broke. hahaha you my friend was definitely raised to be a scammer.",t3_mnharu,2021-04-10 00:04:01,2021-04-10
2804,gty0ggv,t3_mnharu,Give me $100 and I'll give you $185 I promises.,t3_mnharu,2021-04-10 00:07:53,2021-04-10
2805,gty0swr,t3_mnharu,I would've played with him a bit more ;),t3_mnharu,2021-04-10 00:10:25,2021-04-10
2806,gty0v5o,t3_mnharu,"It’s crazy how little morals most people have now a days, scammers just show me how low the bar can really go",t3_mnharu,2021-04-10 00:10:53,2021-04-10
2807,gty13g9,t3_mnharu,I lost track of who was the OS (original scammer) and who was the RR (rebarbative redditor).,t3_mnharu,2021-04-10 00:12:35,2021-04-10
2808,gty158o,t3_mnharu,Aaand it seems like u/Silly_Yam7218 deleted their account. Figures.,t3_mnharu,2021-04-10 00:12:57,2021-04-10
2809,gty174v,t3_mnharu,"I’m not scamming you idiot, just give me your money",t3_mnharu,2021-04-10 00:13:21,2021-04-10
2810,gty1guh,t3_mnharu,Scammers are very prevalent on Reddit and Twitter. It's barely related to bitcoin.,t3_mnharu,2021-04-10 00:15:18,2021-04-10
2811,gty1poo,t3_mnharu,"Most of these guys are coming out of Nigeria. I've seen other people torment them in Yoruba, Igbo, or Awori (to name a few) and it really gets them in a twist like nothing else.",t3_mnharu,2021-04-10 00:17:04,2021-04-10
2812,gty1uow,t3_mnharu,"Bro, my DM is like that too, I have a ""Lady"" that's been hitting me up for a while now trying me to sign up on her website and deposit some money, this is crazy I don't even have too mucho money and still these people wants to break me up, no heart men be safe out here brothers",t3_mnharu,2021-04-10 00:18:04,2021-04-10
2813,gty1urg,t3_mnharu,I respect the reverse psychology of the scanner 😂,t3_mnharu,2021-04-10 00:18:05,2021-04-10
2814,gty1zu0,t3_mnharu,"Just like: ""Give me 1 Bitcoin, I'll give you 2 BTC back""",t3_mnharu,2021-04-10 00:19:06,2021-04-10
2815,gty20dp,t3_mnharu,I would be surprised if people actually fell for that,t3_mnharu,2021-04-10 00:19:13,2021-04-10
2816,gty2hoi,t3_mnharu,"Not just with Bitcoin, but other scammers also- seems that more of them now get upset when you call them on their scam.  Hilarious.",t3_mnharu,2021-04-10 00:22:38,2021-04-10
2817,gty2hvh,t3_mnharu,Could you set up a smart contract to enforce this? I actually think that that would be a reasonable suggestion that doesn't break any of the “rules” mr scammer has,t3_mnharu,2021-04-10 00:22:40,2021-04-10
2818,gty2ln0,t3_mnharu,"Didn't you hear, he has a website! Shut up and take my money.",t3_mnharu,2021-04-10 00:23:25,2021-04-10
2819,gty2p1j,t3_mnharu,That 0 karma shouts *scammer* louder than anything else.,t3_mnharu,2021-04-10 00:24:08,2021-04-10
2820,gty2pll,t3_mnharu,"Scammers get those that are greedy. My friend recently got scammed out of 3000$. Said they would give him 3k in return for 6k for some sort of scheme, and he didn’t listen to any of us saying it’s a scam, told us to F off and he just hit the jackpot... Now he’s got like negative 2k in his account lmao.",t3_mnharu,2021-04-10 00:24:14,2021-04-10
2821,gty2vs1,t3_mnharu,Why would any scammer have moral? 🤔,t3_mnharu,2021-04-10 00:25:29,2021-04-10
2822,gty2w1p,t3_mnharu,Lmao deal of the century right there!!,t3_mnharu,2021-04-10 00:25:32,2021-04-10
2823,gty309c,t3_mnharu,It’s okay he’s just having a bad day because this was first day of his job and he’s not good at it so he was frustrated,t3_mnharu,2021-04-10 00:26:24,2021-04-10
2824,gty3nfb,t3_mnharu,"I ask them what their grandmother would think of them if they knew what they are up to.

You know that knife goes deep.",t3_mnharu,2021-04-10 00:31:05,2021-04-10
2825,gty404x,t3_mnharu,Should of told him to trade these nutz,t3_mnharu,2021-04-10 00:33:40,2021-04-10
2826,gty4wp5,t3_mnharu,reported him,t3_mnharu,2021-04-10 00:40:10,2021-04-10
2827,gty5aiv,t3_mnharu,"Everyone's a scammer, some are just really really bad at it",t3_mnharu,2021-04-10 00:42:54,2021-04-10
2828,gty5nme,t3_mnharu,"In Hindi we call it ""ulta chor kotwal ko daante"".
Meaning : Thief scolding Police instead (Doesn't sound that good in English 🙃)",t3_mnharu,2021-04-10 00:45:30,2021-04-10
2829,gty5xey,t3_mnharu,"If your family is starving, would you steal from another starving family to feed your own?  Yes, though you may feel remorse.  Instead, how about the two starving families band together and go rob the rich family instead?",t3_mnharu,2021-04-10 00:47:26,2021-04-10
2830,gty6um0,t3_mnharu,"""You fool"" lmao",t3_mnharu,2021-04-10 00:54:02,2021-04-10
2831,gty70gn,t3_mnharu,can someone capy paste it its not readable words toooo small old reddit wont show it,t3_mnharu,2021-04-10 00:55:12,2021-04-10
2832,gty7gay,t3_mnharu,"I remember the old days where buying crypto was a nebulous process. Had to download a wallet, reach out to someone on reddit, send them your money through then Google Wallet with your crypto wallet address, and pray that they weren't going to run off with your money without sending your magic beans.  


Life seemed so simple back then",t3_mnharu,2021-04-10 00:58:20,2021-04-10
2833,gty7hee,t3_mnharu,The 1000th like 😌,t3_mnharu,2021-04-10 00:58:33,2021-04-10
2834,gty7uxh,t3_mnharu,The ugly side of power of anonymity.,t3_mnharu,2021-04-10 01:01:13,2021-04-10
2835,gty7xmg,t3_mnharu,He clearly has a fetiche with the number 85. I'm 85% sure.,t3_mnharu,2021-04-10 01:01:46,2021-04-10
2836,gty85lb,t3_mnharu,"""You Fool""",t3_mnharu,2021-04-10 01:03:23,2021-04-10
2837,gty89nz,t3_mnharu,"Be careful guys! I recently stopped doing any decent investment into anything without sufficient DeFI insurance like Nexus, Bridge Mutual, etc. Those 2 are my go for. There are more out there, but I don't always have time to pick a particular product. Soon there will be a Shield Finance platform, which aims to aggregate insurances at one place for users to choose the right insurance for a particular use case at the best price available atm. I am really looking forward to it.",t3_mnharu,2021-04-10 01:04:12,2021-04-10
2838,gty8dk9,t3_mnharu,They really gotta stop letting 11 year-olds get Reddit accounts.,t3_mnharu,2021-04-10 01:04:59,2021-04-10
2839,gty8e2k,t3_mnharu,"Do the math, Run the numbers. Then say F\*\*\* to scammers.",t3_mnharu,2021-04-10 01:05:05,2021-04-10
2840,gty8fru,t3_mnharu,I'm broke but you asking me for financial change 😂😂😂,t3_mnharu,2021-04-10 01:05:25,2021-04-10
2841,gty8h86,t3_mnharu,Should be allowed to mail them an IED labeled BTC.,t3_mnharu,2021-04-10 01:05:43,2021-04-10
2842,gty8rue,t3_mnharu,85% of the time it works every time,t3_mnharu,2021-04-10 01:07:50,2021-04-10
2843,gty92ik,t3_mnharu,Fucking scammer,t3_mnharu,2021-04-10 01:09:59,2021-04-10
2844,gty9qm8,t3_mnharu,"not only a POS scammer, he/she is also a moron.",t3_mnharu,2021-04-10 01:14:49,2021-04-10
2845,gty9yh9,t3_mnharu,Redditor for 12 hours,t3_mnharu,2021-04-10 01:16:25,2021-04-10
2846,gtyaao3,t3_mnharu,Where do I sign up ? LMFAO,t3_mnharu,2021-04-10 01:18:53,2021-04-10
2847,gtyakao,t3_mnharu,Should never respond to this scammer B.S.  play it safe,t3_mnharu,2021-04-10 01:20:48,2021-04-10
2848,gtyatux,t3_mnharu,"Yo. Best response. “I’m not a scammer fool, only broke people say this.”  Dead",t3_mnharu,2021-04-10 01:22:43,2021-04-10
2849,gtyb3x8,t3_mnharu,I want to invest. I never get these messages!,t3_mnharu,2021-04-10 01:24:46,2021-04-10
2850,gtyb59k,t3_mnharu,Love it,t3_mnharu,2021-04-10 01:25:03,2021-04-10
2851,gtyby62,t3_mnharu,Crazy how few brain cells these assholes have too!,t3_mnharu,2021-04-10 01:30:51,2021-04-10
2852,gtycbdq,t3_mnharu,Good thing \*google translate\* grammar ability is straight trash lolol,t3_mnharu,2021-04-10 01:33:36,2021-04-10
2853,gtycl6a,t3_mnharu,"Tell him that Yilly_Sam made you an offer to make 150% every 3 days and you already took it. And that it has been working great. If he wants to participate too he can just send 100 USD to ""insert btc adress"" and see for himself.",t3_mnharu,2021-04-10 01:35:34,2021-04-10
2854,gtydfk6,t3_mnharu,Hey if someone wants to turn $100 into $80 I am your guy!,t3_mnharu,2021-04-10 01:41:43,2021-04-10
2855,gtydpq1,t3_mnharu,"I think he meant you get 180 ..80 is just the gain .. 
Idk either ways I dont trust strangers xd",t3_mnharu,2021-04-10 01:43:47,2021-04-10
2856,gtye0h1,t3_mnharu,Oh you silly yam,t3_mnharu,2021-04-10 01:45:59,2021-04-10
2857,gtyec0v,t3_mnharu,im more impressed by this ticker.,t3_mnharu,2021-04-10 01:48:24,2021-04-10
2858,gtyeia6,t3_mnharu,You get 100$ + 80$ gain!!  Dude...  Seems legit...,t3_mnharu,2021-04-10 01:49:40,2021-04-10
2859,gtyf0kq,t3_mnharu,Love it.,t3_mnharu,2021-04-10 01:53:19,2021-04-10
2860,gtyf57h,t3_mnharu,Morals and scam is two different universe,t3_mnharu,2021-04-10 01:54:15,2021-04-10
2861,gtyflca,t3_mnharu,Imagine wasting your time like that .\_.,t3_mnharu,2021-04-10 01:57:29,2021-04-10
2862,gtyg8qq,t3_mnharu,I read this in an Indian accent,t3_mnharu,2021-04-10 02:02:12,2021-04-10
2863,gtyhhoj,t3_mnharu,Wtf... this is outrageous... but tbh that’s the problem with the anonymity of blockchain. These guys wander around scamming with no real chance of consequence. I bet a lot of newcomers fall for this crap... thanks for sharing. We really need to raise awareness.,t3_mnharu,2021-04-10 02:11:30,2021-04-10
2864,gtyhl75,t3_mnharu,Does he even English or Math ?,t3_mnharu,2021-04-10 02:12:14,2021-04-10
2865,gtyhpy5,t3_mnharu,Yeah crazy how low scammer's morals have gotten. What ever happened to all the scrupulous scammer's? 🤦🏼‍♂️,t3_mnharu,2021-04-10 02:13:12,2021-04-10
2866,gtyhuul,t3_mnharu,"Not gonna lie, I couldn’t tell which one was the scammer from the way both of you spoke Lol.",t3_mnharu,2021-04-10 02:14:13,2021-04-10
2867,gtyir15,t3_mnharu,what was their website? Time to do some hacking and find out who these scammers are,t3_mnharu,2021-04-10 02:20:52,2021-04-10
2868,gtyiwhd,t3_mnharu,"Scammers are getting stupider it seems, I mean this goon trying to scam with a 0 karma account 😂 this is good news for internet users.",t3_mnharu,2021-04-10 02:22:00,2021-04-10
2869,gtyj4av,t3_mnharu,That conversation made my day lol,t3_mnharu,2021-04-10 02:23:36,2021-04-10
2870,gtyjkvt,t3_mnharu,Did you get $185? I tried to message him but I guess he found all his investors,t3_mnharu,2021-04-10 02:27:01,2021-04-10
2871,gtyk9wi,t3_mnharu,"I unleashed my depression onto this scammer. I feel like if i kept going, he would have paid me.",t3_mnharu,2021-04-10 02:32:14,2021-04-10
2872,gtykk7b,t3_mnharu,"You fool I am not scammer you are scammer.
😭😭😭😭🤣🤣🤣🤣",t3_mnharu,2021-04-10 02:34:25,2021-04-10
2873,gtykv4b,t3_mnharu,Sociopaths gonna sociopath,t3_mnharu,2021-04-10 02:36:40,2021-04-10
2874,gtykvzk,t3_mnharu,*few morals,t3_mnharu,2021-04-10 02:36:51,2021-04-10
2875,gtylcm0,t3_mnharu,"I am a Nigerian princess. Send me 40 Bitcoin, a large stuff crust meat lovers pizza, a 12 pack of fat tire, and I’ll send you noodes..",t3_mnharu,2021-04-10 02:40:19,2021-04-10
2876,gtyo5rs,t3_mnharu,Obviously legit,t3_mnharu,2021-04-10 03:01:29,2021-04-10
2877,gtyp8wp,t3_mnharu,I would do it,t3_mnharu,2021-04-10 03:09:49,2021-04-10
2878,gtyp93f,t3_mnharu,it's ok. I'm not serious in life too,t3_mnharu,2021-04-10 03:09:52,2021-04-10
2879,gtypvfp,t3_mnharu,"I absolutely love scamming scammers, I would do this all day long lol",t3_mnharu,2021-04-10 03:14:40,2021-04-10
2880,gtyqgt7,t3_mnharu,lol he played the good old reverse trap card. Your face down magical cylinder didn't work this time,t3_mnharu,2021-04-10 03:19:13,2021-04-10
2881,gtyrvml,t3_mnharu,"""you FoOl""",t3_mnharu,2021-04-10 03:30:00,2021-04-10
2882,gtyt8uc,t3_mnharu,We actually need to wage war on these trash people. Literal parasites.,t3_mnharu,2021-04-10 03:40:24,2021-04-10
2883,gtyuj4g,t3_mnharu,Uno Reverse.,t3_mnharu,2021-04-10 03:50:21,2021-04-10
2884,gtyun4s,t3_mnharu,my scammer was very polite :),t3_mnharu,2021-04-10 03:51:12,2021-04-10
2885,gtyuovc,t3_mnharu,"This is silly








Yam",t3_mnharu,2021-04-10 03:51:34,2021-04-10
2886,gtyv4mk,t3_mnharu,"I read it in the same broken English and accent that I hear on the phone when the real IRS calls me.

It has to be real. I mean who could duplicate that dialect even in text?!

I think I might send them 100$!  Just like I gave that nice IRS agent my social and dob and mother’s maiden name.",t3_mnharu,2021-04-10 03:54:57,2021-04-10
2887,gtywk3k,t3_mnharu,"what? do you like scammers with high morals better?

{ facepalm }",t3_mnharu,2021-04-10 04:06:02,2021-04-10
2888,gtyx1wz,t3_mnharu,Today I learned: I’m a broke person!  Thanks Silly_Yam7218!,t3_mnharu,2021-04-10 04:09:54,2021-04-10
2889,gtyxvyd,t3_mnharu,🤔🤔,t3_mnharu,2021-04-10 04:16:25,2021-04-10
2890,gtyzwht,t3_mnharu,Now let’s talk about this free toaster,t3_mnharu,2021-04-10 04:32:09,2021-04-10
2891,gtyzy70,t3_mnharu,Bruh,t3_mnharu,2021-04-10 04:32:32,2021-04-10
2892,gtyzzc2,t3_mnharu,Shut up and take my 20 dollars,t3_mnharu,2021-04-10 04:32:46,2021-04-10
2893,gtz09cj,t3_mnharu,You bloody f#ck.,t3_mnharu,2021-04-10 04:35:00,2021-04-10
2894,gtz0fk4,t3_mnharu,"*If you reply me shit I will report you as a robot!* 

OOOOOOOOOOOOOOOOOOOOOOOOOOOOOOOOOOOOOOOOOOOOOOOOOOOOO",t3_mnharu,2021-04-10 04:36:22,2021-04-10
2895,gtz10aa,t3_mnharu,"""You fool I'm not a scammer like you only broke people say this""

Priceless.",t3_mnharu,2021-04-10 04:40:51,2021-04-10
2896,gtz1d8w,t3_mnharu,"Funny thing: I kept waiting a scammer for 6 months telling them I was gonna earn 20k $ and investing in their fake site.

Then they gave up",t3_mnharu,2021-04-10 04:43:42,2021-04-10
2897,gtz2vwi,t3_mnharu,He should rename his account to silly_scam,t3_mnharu,2021-04-10 04:55:45,2021-04-10
2898,gtz2w5b,t3_mnharu,"In 3 to 4 days, they will make sure to never answer your emails.",t3_mnharu,2021-04-10 04:55:48,2021-04-10
2899,gtz33ft,t3_mnharu,2 + 2 = 3,t3_mnharu,2021-04-10 04:57:25,2021-04-10
2900,gtz3l43,t3_mnharu,Sick gain bro 💪,t3_mnharu,2021-04-10 05:01:22,2021-04-10
2901,gtz51z5,t3_mnharu,They don't need morals. They're greed farming. They see it as the victim's own fault for being greedy.,t3_mnharu,2021-04-10 05:13:22,2021-04-10
2902,gtz56oh,t3_mnharu,"You’re.

...you’re.",t3_mnharu,2021-04-10 05:14:26,2021-04-10
2903,gtz6e8u,t3_mnharu,That’s great,t3_mnharu,2021-04-10 05:24:18,2021-04-10
2904,gtz6ilx,t3_mnharu,Loooool,t3_mnharu,2021-04-10 05:25:17,2021-04-10
2905,gtz801l,t3_mnharu,I’ve been getting a shit load of spam/scam messages lately.,t3_mnharu,2021-04-10 05:37:27,2021-04-10
2906,gtz8lzr,t3_mnharu,Well well well looks like this sub has our own regular Atomic Shrimp. Well done sir well done.,t3_mnharu,2021-04-10 05:42:29,2021-04-10
2907,gtz9y66,t3_mnharu,"Everyone thinks the ""be your own bank"" slogan (which is actually incorrect) is the hottest shit, until we realize what that means for your average gullible human.",t3_mnharu,2021-04-10 05:53:36,2021-04-10
2908,gtzbl3e,t3_mnharu,The account was created for 18 hours only,t3_mnharu,2021-04-10 06:07:20,2021-04-10
2909,gtzcbbq,t3_mnharu,$80 is just your gain which means you would receive $180 total if he's not out there eating pizza with your money.,t3_mnharu,2021-04-10 06:13:33,2021-04-10
2910,gtzctp5,t3_mnharu,You fool!,t3_mnharu,2021-04-10 06:17:56,2021-04-10
2911,gtzd7e6,t3_mnharu,You're not serious in life.,t3_mnharu,2021-04-10 06:21:09,2021-04-10
2912,gtzds6r,t3_mnharu,Lmao,t3_mnharu,2021-04-10 06:26:03,2021-04-10
2913,gtzeiar,t3_mnharu,"On Crypto Jebbs Youtube morning show today, they let everyone know that the Coin '**Apollo Fintech'** was a **scam** and keep clear of it. I wish the other shows would do more research into these scam coins and inform us all.",t3_mnharu,2021-04-10 06:32:14,2021-04-10
2914,gtzekvw,t3_mnharu,"Scammer: *robs people* 
Scammer: *calls you broke* 
😭😂😭😂",t3_mnharu,2021-04-10 06:32:52,2021-04-10
2915,gtzg4pw,t3_mnharu,He’s gaslighting you!,t3_mnharu,2021-04-10 06:46:14,2021-04-10
2916,gtzgkou,t3_mnharu,not even 500%... disgusting!,t3_mnharu,2021-04-10 06:50:07,2021-04-10
2917,gtzhuou,t3_mnharu,"I wanted to see his website. You know anyone with a website is automatically legit. In the same way anyone with a Reddit account, phone number, or email is 100% legit.

/s",t3_mnharu,2021-04-10 07:01:23,2021-04-10
2918,gtzjdrn,t3_mnharu,Lmao only broke people call out scammers?,t3_mnharu,2021-04-10 07:15:05,2021-04-10
2919,gtzjmxg,t3_mnharu,You fool!,t3_mnharu,2021-04-10 07:17:25,2021-04-10
2920,gtzlsc6,t3_mnharu,[“I am not a bot!”](https://youtu.be/zCGrAOF7J_M),t3_mnharu,2021-04-10 07:36:52,2021-04-10
2921,gtzmcxl,t3_mnharu,Redditor for 18 hours btw lol,t3_mnharu,2021-04-10 07:42:04,2021-04-10
2922,gtzn3uo,t3_mnharu,"I’D LIKE TO MAKE A MOTION:

Going forward, everyone respond to these types by trying to scam THEM in return. Try to get them to send YOU bitcoin. 

It’s actually really fun. I’ve been doing it for like a year now.

It takes them a while to realize they’re even being trolled and you can get some hilarious screenshots of them getting super frustrated. 

Imagine if everyone did this 😍",t3_mnharu,2021-04-10 07:48:56,2021-04-10
2923,gtznlli,t3_mnharu,Why use their services? I can do that pretty well on my own. Whenever I buy a shitcoin it tanks 20% just fine.,t3_mnharu,2021-04-10 07:53:24,2021-04-10
2924,gtznvbx,t3_mnharu,😆😆😆,t3_mnharu,2021-04-10 07:55:54,2021-04-10
2925,gtzo8z2,t3_mnharu,You FOOL,t3_mnharu,2021-04-10 07:59:23,2021-04-10
2926,gtzog6o,t3_mnharu,Kind of sounds like Gemini earn,t3_mnharu,2021-04-10 08:01:15,2021-04-10
2927,gtzpj4d,t3_mnharu,You fool,t3_mnharu,2021-04-10 08:11:04,2021-04-10
2928,gtzq8p0,t3_mnharu,what a silly little yam,t3_mnharu,2021-04-10 08:17:35,2021-04-10
2929,gtzq9ho,t3_mnharu,Such a silly ham,t3_mnharu,2021-04-10 08:17:47,2021-04-10
2930,gtzqcor,t3_mnharu,Every time I post here and at r/cryptocurrency i immediately get a pm,t3_mnharu,2021-04-10 08:18:36,2021-04-10
2931,gtzrcjo,t3_mnharu,there's a lot of this too on other platforms like telegram,t3_mnharu,2021-04-10 08:27:31,2021-04-10
2932,gtzrp5l,t3_mnharu,I want to be a scammer when I grow up 😃,t3_mnharu,2021-04-10 08:30:43,2021-04-10
2933,gtzsti7,t3_mnharu,Silly yam!!!,t3_mnharu,2021-04-10 08:40:52,2021-04-10
2934,gtztxiv,t3_mnharu,"I do get business proposals like this always 
Both on my IG and Facebook, but I have never fallen for them and I will never fall for them, we have to be very careful not to fall for this scammers.",t3_mnharu,2021-04-10 08:51:08,2021-04-10
2935,gtzu585,t3_mnharu,"Tbh maybe he's not scamming.
Maybe he genuinely just is hoping he will get to keep the $20.",t3_mnharu,2021-04-10 08:53:02,2021-04-10
