,comment_id,comment_parent_id,comment_body,comment_link_id,created,date
17,gszodjc,t3_mcd99v,OMG!! I am about to use ATM bitcoin and put it to [Blockchain.com](https://Blockchain.com) wallet as it is one of the wallet required to store Bitcoin by Localcoin.  Reddit is a scam saver.  Thanks for sharing.,t3_mcd99v,2021-04-01 11:15:02,2021-04-01
24,gsz3f7u,t3_mcd99v,It's very easy to test for this bug. Perhaps we should validate that you can indeed disable 2FA without 2FA protection before we start panicking.,t3_mcd99v,2021-04-01 08:06:15,2021-04-01
33,gszgw68,t3_mcd99v,Candidate for class action!!!,t3_mcd99v,2021-04-01 10:04:22,2021-04-01
51,gsxv76p,t3_mcd99v,Always test support before using any wallet.,t3_mcd99v,2021-04-01 02:08:36,2021-04-01
52,gsxwbrk,t3_mcd99v,Any idea if exodus wallet is okay?,t3_mcd99v,2021-04-01 02:17:16,2021-04-01
53,gsywng5,t3_mcd99v,"  

Over the past few days a certain platform;  [http://mycryptomixer.com/](http://mycryptomixer.com/) has been making False promises to help you make Bitcoin transactions anonymously with no trace of the transaction and after you send them your Bitcoin, They siphon it and pretend like you never ever made any transaction with them. An individualâ€™s 13 bitcoin was stolen by them just recently... (Read accounts here);

[https://bitcointalk.org/index.php?topic=5319713.0](https://bitcointalk.org/index.php?topic=5319713.0)

[https://www.reddit.com/r/Bitcoin/comments/lwerj8/user\_loses\_13\_btc650k\_to\_mycryptomixercom/](https://www.reddit.com/r/Bitcoin/comments/lwerj8/user_loses_13_btc650k_to_mycryptomixercom/)

Do not interact with them or their platform and anything they are associated with!",t3_mcd99v,2021-04-01 07:05:40,2021-04-01
54,gt03h6w,t3_mcd99v,Ok,t3_mcd99v,2021-04-01 14:11:53,2021-04-01
55,gt0cvrp,t3_mcd99v,https://youtube.com/watch?v=0OK3YV9VCms&feature=share,t3_mcd99v,2021-04-01 16:38:14,2021-04-01
63,gsxu7k9,t1_gs31nh8,Nothing personal just business.,t3_mcd99v,2021-04-01 02:01:01,2021-04-01
65,gt1ctaa,t1_gs31nh8,"It's a feature, not a flaw....for the hackers.",t3_mcd99v,2021-04-01 23:00:23,2021-04-01
74,gszur13,t1_gs5c80l,"Me too. I personally had no problems with blockchain. But I moved my coins from them was because of those hack news. I was paranoid, I think. Now I use Exodus and Trezor.",t3_mcd99v,2021-04-01 12:20:52,2021-04-01
85,gsz80c0,t1_gsz3f7u,[removed],t3_mcd99v,2021-04-01 08:46:45,2021-04-01
86,gt0ms47,t1_gsz3f7u,But this requires advanced hacking skills that not many people have.,t3_mcd99v,2021-04-01 18:44:42,2021-04-01
91,gsyypjb,t1_gsywng5,"You can see on their website that many reputable crypto publications endorse them.
If what you say is true, you should contact those publications and tell them about this and ask to rewrite the review.",t3_mcd99v,2021-04-01 07:24:12,2021-04-01
96,gsxzh62,t1_gslstd6,"peperidge farm remembers, that was a great one

and IIRC, the why it failed catastrophically is even worse: they were making the private keys from the ""guaranteed true randomness"" of a plaintext api call to random.org (!), but then random.org (dumb and dumber) disabled that api, and blockchain.info started making private keys derived from the error output",t3_mcd99v,2021-04-01 02:41:18,2021-04-01
111,gszf0xv,t1_gsz80c0,The Xmrs cryptocurrency's community is great. They are constantly improving it. I am investing in Xmrs coin for the long term and will recommend others too.,t3_mcd99v,2021-04-01 09:48:11,2021-04-01
115,gszizpt,t1_gsmi4wh,"> For those who are not aware, Roger Ver is a convicted felony.

This is COMPLETELY disingenuous. If people want to know the FACTUAL story I'll tell it. Rover Ver was a college age U.S. citizen, in the Silicon Valley area, I believe. At some point he ended up needing parts for his computer and noticed a difference between prices for a hard-drive online versus in local store ads. He realized he could buy and resell at a profit. He was instantly in business in e-commerce, before it was really a thing. Before Bitcoin ever started Roger Ver had made himself wealthy. To do so he branched out in things he could ""flip"" or sell at a profit. He looked for anything and everything, whatever could be resold marked up. He eventually even came across fireworks, things Americans love using for Fourth of July celebrations. This is where the criminal aspect comes up. I don't know the exact details but essentially the problem had to do with the illegality of shipping **explosives**. Of course something that's technically an explosive sounds highly illegal and scary, even if it's used just for entertainment purposes. Maybe Roger didn't take government warnings seriously enough (he has a strong libertarian leaning), but yes he ended up in jail over the matter. 

Now does this make Roger Ver an immoral scam artist as this poster suggests? There is nothing immoral about the way he went to jail. Anyway, Roger did his time and was so upset over it he left the U.S. and gave up his citizenship. I think he settled in Japan. Later he learned about Bitcoin, and became one of the first investors in early start-ups, like BitPay and Blockchain.com. 

As Bitcoin was evolving there was trouble brewing, because the technical limitation for transactions was seriously conflicting with the economic model which favored low fees. How the community would resolve this became a HUGE argument called the block size debates which spanned years and meant many people who had been working together suddenly became adversaries, sometimes hated enemies. The bottom line is there was a disagreement about how to handle a very real Bitcoin concern: growing fees. This remains an issue still today on BTC, with growing popularity and average fees often over $10 for a single transaction. The two sides became known as big-blockers and small-blockers. I won't go into what side I think was right, other than to say I think both had legitimate points. The problem is there was NO perfect answer, so perhaps the best thing WAS that the community split. Regardless of Bitcoin any market is better when there exists more options and competition, because it pressures builders to make the best product for end users/consumers. If that's true then it's GOOD that there are many coins competing for adoption and attention. I hope this helps set the record straight.",t3_mcd99v,2021-04-01 10:23:22,2021-04-01
119,gsy02tq,t1_gsxzh62,"from https://redd.it/37oxow:

> BUT! On some devices under some circumstances, the LinuxSecureRandom class doesn't get registered. This is likely because /dev/urandom doesn't exist or can't be accessed for some reason. Instead of screaming bloody murder like any sensible implementation would, they just ignore that and fall back to using the standard SecureRandom.

> If the above happens, there's a problem because the default implementation of SecureRandom#setSeed doesn't mix. If you set the seed, it replaces the entropy entirely. So now the entropy is coming solely from random.org.

> And the final mistake: They were using HTTP instead of HTTPS to make the webservice call to random.org. On Jan 4, random.org started enforcing HTTPS and returning a 301 Permanently Moved error for HTTP - see https://www.random.org/news/. So since that date, the entropy has actually been the error message (turned into bytes) instead of the expected 256-bit number. Using that seed, SecureRandom will generate the private key for address 1Bn9ReEocMG1WEW1qYjuDrdFzEFFDCq43F 100% of the time. Ouch. This is around the time that address first appears, so the timeline matches.",t3_mcd99v,2021-04-01 02:45:57,2021-04-01
120,gt0m1cv,t1_gsxzh62,"Holy shit, thats amazing.   


Every time I think I've heard the most incompetent thing you could ever imagine, blockchain(dot)info/com goes all ""hold my beer...""",t3_mcd99v,2021-04-01 18:35:52,2021-04-01
121,gsy612q,t1_gsxzh62,exactly,t3_mcd99v,2021-04-01 03:31:26,2021-04-01
139,gszpakq,t1_gszizpt,"The brief history of rBTC

A long time ago, there was only rBitcoin sub; rBTC was completely irrelevant to Bitcoin or cryptocurrency. At some stage, some people, in the name of scaling, began a coordinated propaganda of promoting a blocksize increase hardfork and bashing a softfork solution named SegWit, which had been implemented in the protocol but was not yet activated, in rBitcoin. These people mainly fell into two groups, one being shills of Bitmain, the biggest Bitcoin mining hardware manufacturer in the world, the other being altcoiners, mainly Ethereum stakeholders. There might be other Bitcoin haters, such as bankers and remittance companies, but their identities are hard to confirm. The first group promoted the blocksize increase hardfork instead of the activation of SegWit because SegWit unintendedly disabled Bitmain's secret cheat in mining (Covert AsicBoost), which helped make them the number one in the market. The second group wanted Ethereum to dethrone Bitcoin. The second group and the rest promoted the blocksize increase hardfork because 1) SegWit fixed some fundamental development-stalling bugs in Bitcoin and freed Bitcoin to the extent that it might render their coins worthless; 2) hardforks were inherently risky even when not under attack, could be easily attacked, could easily result in chain splits, which would devastatingly damage Bitcoin's value and people's belief in it; 3) hardfork blocksize increases could easily lead to centralization, which would destroy Bitcoin. They together disguised themselves as ""Bitcoiners with different opinions"".

For a period of time, these people spammed rBitcoin with lies and misinformation, oftentimes in an aggressive way. The mods did their job and stopped them. When their operations got hard, their leader, Roger Ver, who was an early Bitcoin adopter but believed to have become a secret Ethereum stakeholder therefore a Bitcoin hater later, somehow gained the ownership of rBTC. His paid employees became mods of it. They marketed rBTC as a Bitcoin sub with free speech. They claimed rBitcoin was censored and theirs wasn't. They mainly censored the sub by hiding the posts/comments they didn't like with massive downvoting (a feature of Reddit), which would result in negative karma of the posters/commenters, which would subsequently enable a 1 post per 10 minutes limitation (another feature of Reddit), effectively stopping them from freely expressing themselves. They claimed they wouldn't/didn't remove posts/comments and they wouldn't/didn't ban ""Bitcoiners with different opinions"". The truth is, they did both. A lot. With these configurations, rBTC became the nest of them all.

Before Bcash fork, what rBTC sub did was pretending to talk about Bitcoin while spreading lies and misinformation, such that hardforks were safe/good, hardfork blocksize increases were safe/good, softforks were bad, SegWit was evil, Bitcoin development was controlled by Blockstream, only Blockstream wanted SegWit, Blockstream was controlled by bankers, rBitcoin was censored, and things like that.

Then an epic battle in the community happened. Users pushed SegWit to be activated via User-Activated Soft Fork (UASF). Bitmain created Bcash, which was basically Bitcoin with SegWit removed, to preserve their mining privilege. SegWit was activated. Bcash forked away at the same time. Bitmain moved non-trivial proportion of their resources to Bcash. But the company saw Bcash as not Bitcoin. With SegWit activated and Bitmain moving on, the altcoiners and haters teamed up to push SehWit2x, a hard fork after SegWit activation, until it failed in all aspects. After that, they lost their directions for a while. They eventually came up with a new plan, which was to support Bcash, sell Bcash as Bitcoin (both figuratively and literally) and the idea that there could be many Bitcoin coins/chains/protocols.

It's worth noting that there aren't many actual Bcash supporters in rBTC. They pretend to support it in order to undetermine Bitcoin.

Fun facts: Vitalik Buterin (founder and spearhead of Ethereum) is popular in rBTC. Jorge Stolfi (\u\jstolfi), a well-known Bitcoin hater who publicly filed reports to authority claiming Bitcoin (but not other cryptocurrencies, including Ethereum!) a scam, is popular in rBTC.

Bonus facts: Besides rBTC, Roger Ver owns Bitcoin(dot)com website. It sells Bcash as Bitcoin by making their wallet app create Bcash wallet by default and with no clear indication. It's believed that he also owned @Bitcoin Twitter handle when it actively bashed Bitcoin, pushed Bcash, and blocked people who disagreed to prevent its followers from seeing its lies getting refuted. All of the three major Bitcoin resources are either known or believed to be purchased from other people. Purchasing subreddit is in violation of Reddit's Terms of Service.

TLDR: rBTC (as a Bitcoin-related sub) was created by a Bitcoin hater (an altcoiner); was filled with Bitcoin cheaters (miner's shills) and Bitcoin haters (altcoiners and so on); is filled with Bitcoin haters (altcoiners and so on). It is not a Bitcoin sub. It's an anti-Bitcoin sub.",t3_mcd99v,2021-04-01 11:24:05,2021-04-01
140,gszp9ls,t1_gszizpt,"Your comment is COMPLETELY disingenuous.

It's a fact that Roger is a convicted felony.

There are two groups of people who *used* blocksize as an excuse to attack Bitcoin:

1. Bitmain (Jihan Wu, to be specific).

2. Bitcoin haters, which most definitely include shitcoiners, and probably also include bankers.

The first group tried to stall the activation of SegWit because it would (unintentionally) disable their cheating advantage in mining (ASICBOOST, read below).

The second group simply hated everything that's done right in Bitcoin.

Both groups joined force and attacked Bitcoin in the name of blocksize/scaling.

Roger belongs to the second group. Besides that he has stakes in Ripple (a shitcoin), his btc sub is haunted with all sorts of Bitcoin haters, such as Ethereum supporters. There had been many chances that he was meant to reveal his stakes in Bitcoin, and he dodged them every time. He had long sold his Bitcoin. And the only reason he is ""in"" Bitcoin is to sabotage Bitcoin.

Read below about Bcash, which is related to Jihan Wu (Bitmain) and btc sub, which is related to Roger Ver. Both contain truths about this so-called blocksize debate.

--------

Bcash (BCH), aka Bitcoin Cash, is an incompatible fork from Bitcoin.

What was Bcash when it was created?

In a nutshell,

1. Bcash was basically a one-man's coin, although he had quite a few influential allies.

2. This man was Jihan Wu. He was CEO and co-founder of Bitmain, a mining hardware (aka miners) manufacturer that produced more miners than every other competitor and potential all of them combined in the world.

3. Bitmain's miners had a secretly embedded cheat named Covert AsicBoost, which gave their mining farms (but not their customers!) advantages in mining, which resulted in their monopoly in mining industry.

4. Covert AsicBoost was unintentionally disabled by SegWit, an update that fixed some critical development-stalling issues in Bitcoin but got intensively attacked and blocked from activation for a long time.

5. Bcash was live at the same time as the beginning of the activation of SegWit.

6. Bcash was basically 100% Bitcoin, with SegWit removed, plus a minor modification claimed to be a better scaling solution.

7. Besides Covert AsicBoost, Bitmain's miners had a secretly embedded backdoor named AntBleed. It gave Jihan the power to shutdown any Bitmain miners in the world remotely.

7. Jihan publicly stated he'd attack Bitcoin with his hashpower when Bcash was being created. (He controled a significant proportion of the overall hashpower.) He also implicated he'd use AntBleed in the attack.

Note that unlike the allegations about the devs who created SegWit, there was solid evidence of Covert AsicBoost and AntBleed, and both were acknowledged by Jihan/Bitmain.

By understanding who was behind Bcash and what he had done / what kind of person he was, you can draw a conclusion by yourself. This includes 1) why Bcash came into existence? 2) why they attacked SegWit?

Bcash had few developers, of which none is well recognized, and near zero development activities. On the other hand, Bitcoin had more than 400 developers, of which some were well recognized world leading cryptography/cryptocurrency experts. Bcash developers even failed to remove SegWit related code completely. Bcash's dynamic difficulty adjustment algorithm was so buggy that it took few seconds to mine a block, while it should be around 10 minutes, and lots of blocks were mined at that speed. It should be easy to draw the conclusion which was better without going into any technical detail.

The problem with Bcash is not about the technology at all, although its technology is inferior. It is not even about decentralization, which it fails totally, which makes it totally valueless. It's about it is created by a cheater (AsicBoost) and backdoorer (AntBleed). 

Contrary to some misinformation, Bcash did not resolve *any* problem in Bitcoin. It was an altcoin with virtually no users and every altcoin without many users has low fees and fast confirmation times.

It's important to note that, besides Jihan/Bitmain, there were another group of people who joined against SegWit. They are Bitcoin haters - mainly altcoiners, especially Ethereum stakeholders, who see Bitcoin as the biggest obstacle, but may also include bankers and people in remittance industry whose businesses are threatened by Bitcoin. They don't like Bitcoin to succeed and SegWit would bring Bitcoin to another level. Although Jihan Wu always referred to Bcash as *not* Bitcoin, they don't. The leader of the group is Roger Ver. He was an early Bitcoin adopter but is believed to have been secretly converted to Ethereum a long time ago. He uses his bitcoin[dot]com website, rBTC subreddit and @Bitcoin Twitter handle to sell Bcash as Bitcoin, call Bitcoin ""Bitcoin Core"", call Bcash the original Bitcoin, and propagate the idea that there can be many Bitcoin coins/chains/protocols. This is their latest strategy to undermine Bitcoin in order to destroy it.

There has been some developments in Bcash lately. The chain was split into two: BcashABC (BCH) and BcashSV (BSV). Bcash (BcashABC) was 51% attacked by two pools and its blockchain history was modified. It's a farce so bad that it no longer deserves any attention.",t3_mcd99v,2021-04-01 11:23:49,2021-04-01
155,gszwdri,t1_gswhc73,"> Yeah not a red flag for me. 

Me either, he did the crime and paid the time.  Fortunately nobody was hurt.

The red flag to me is lying about what actually happened to the point that even people like you repeat the lie..",t3_mcd99v,2021-04-01 12:39:42,2021-04-01
156,gsxlls8,t1_gswhc73,"> Unfortunately I've pribably put more people in danger by speeding over the years. 

You've basically just succeeded in proving that you, too, are a cunt.",t3_mcd99v,2021-04-01 00:56:36,2021-04-01
158,gszucun,t1_gswhuip,"Yes, they are marketplaces. Don't keep your coins in them for too long. Use Exodus or Trezor instead. I have them both, but prefer Trezor.",t3_mcd99v,2021-04-01 12:16:32,2021-04-01
160,gsxmh64,t1_gsxlls8,You've never sped in your entire life? That's quite a feat,t3_mcd99v,2021-04-01 01:03:06,2021-04-01
163,gt184g2,t1_gsxmh64,I used to speed when I was dumb selfish cunt,t3_mcd99v,2021-04-01 22:23:33,2021-04-01
164,gsxqjoa,t1_gsxmh64,I am unable to drive. I was hit by a speeding car when I was a teenager.,t3_mcd99v,2021-04-01 01:33:32,2021-04-01
811,gt03kpf,t3_mhoo6v,Those two concepts overlap by a lot.,t3_mhoo6v,2021-04-01 14:13:16,2021-04-01
812,gt0599m,t3_mhoo6v,freedom and wealth are highly correlated,t3_mhoo6v,2021-04-01 14:38:01,2021-04-01
813,gt0802m,t3_mhoo6v,When I'm rich I'll be free.,t3_mhoo6v,2021-04-01 15:20:34,2021-04-01
814,gt04b9o,t3_mhoo6v,"Fiat system punishes those who make long-term plans. Bitcoin, on the other hand, encourages long-term planning. https://storeoftime.com",t3_mhoo6v,2021-04-01 14:24:06,2021-04-01
815,gt06vew,t3_mhoo6v,"After knowing how big capital is investing on bitcoin and how bitcoin farming became the job of only a handful of companies I seriously challenge that idea that it was going to set us free, that is utter rubbish",t3_mhoo6v,2021-04-01 15:02:37,2021-04-01
816,gt0f5hx,t3_mhoo6v,I wouldnt mind getting rich in the process,t3_mhoo6v,2021-04-01 17:07:27,2021-04-01
817,gt03s8z,t3_mhoo6v,I hate that I cannot save money effectively because our government loves to inflate problems away at the expense of my savings... bitcoin and altcoins are our greatest hope in returning power back to working middle class people,t3_mhoo6v,2021-04-01 14:16:22,2021-04-01
818,gt0k9gg,t3_mhoo6v,"Then why so much money is being pumped into it , why was it even traded in exchanges still its value is based on fiat",t3_mhoo6v,2021-04-01 18:13:20,2021-04-01
819,gt072g9,t3_mhoo6v,That's like saying the internet wasn't created for Reddit. But here i am.,t3_mhoo6v,2021-04-01 15:05:42,2021-04-01
820,gt0bvc5,t3_mhoo6v,"Bitcoin was made to fight the system but most of the users in this sub suck the systems dick non stop. If your beliefs line up with giant corporations, Hollywood, big tech, politics etc you are the system. Massive problem today that people think are fighting the system pushing the systems message. If you think it's a good idea to need to scan a QR code so you are allowed to get groceries, or are against free speech and you are pro censorship you are the bad guy and the exact opposite of what bitcoin stands for.",t3_mhoo6v,2021-04-01 16:24:06,2021-04-01
821,gt0hwiq,t3_mhoo6v,Fuck that Iâ€™m in it for the Bugatti,t3_mhoo6v,2021-04-01 17:43:06,2021-04-01
822,gt0hbra,t3_mhoo6v,Bitcoin wasn't invented to make you rich; It was invented to stop you being forced into poverty.,t3_mhoo6v,2021-04-01 17:35:43,2021-04-01
823,gt0cntt,t3_mhoo6v,Eren should have just bought bitcoin then,t3_mhoo6v,2021-04-01 16:35:23,2021-04-01
824,gt0etti,t3_mhoo6v,Yes. And that includes financial independence.,t3_mhoo6v,2021-04-01 17:03:16,2021-04-01
825,gt0omgo,t3_mhoo6v,"Free to buy lambo, right?",t3_mhoo6v,2021-04-01 19:06:16,2021-04-01
826,gt12mh6,t3_mhoo6v,"And just like the internet was used for science papers, technology gets appropriated to other causes.

The liberty aspect is yet another pipe dream of crypto. The big boys will come in and run it and those of us who aren't pie in the sky libertarians won't be surprised or complain.

The freedom isn't from bitcoin its from taking power from banks, financial institutions, and others who exploit the workers. From taking the power of reserve currency from the biggest imperialist force in history. To make it so the IMF and other big US institutions can't economically oppress others bc their financial power.

I'm sure I'll get down voted but those who think bitcoin is only about personal liberty misses the bigger picture.",t3_mhoo6v,2021-04-01 21:36:36,2021-04-01
827,gt12wnr,t3_mhoo6v,I guess freedom is something i gotta lock away in cold storage for safekeeping.,t3_mhoo6v,2021-04-01 21:39:11,2021-04-01
829,gt0mk9l,t3_mhoo6v,"People think they will be free once they are rich but if your mentality is off, more money will just bring more problems.",t3_mhoo6v,2021-04-01 18:42:09,2021-04-01
830,gt01r4l,t3_mhoo6v,Free from what?,t3_mhoo6v,2021-04-01 13:47:50,2021-04-01
831,gt0xb5q,t3_mhoo6v,F that.  I am already free. I want to be rich.,t3_mhoo6v,2021-04-01 20:45:19,2021-04-01
832,gt0odmr,t3_mhoo6v,"I mean, im free now. Centralized banking doesn't hinder my life at all even when traveling and I dont purchase internationally.

BUT I like the side effect.",t3_mhoo6v,2021-04-01 19:03:20,2021-04-01
833,gt119uq,t3_mhoo6v,"The ""make you free"" part is gone and never coming back. The government and banks heavily involved now.",t3_mhoo6v,2021-04-01 21:24:16,2021-04-01
834,gt12tat,t3_mhoo6v,Soon. Freedom will be in high demand.,t3_mhoo6v,2021-04-01 21:38:21,2021-04-01
835,gt1471o,t3_mhoo6v,"Until crypto is recognised as an actual currency and not an investment. Then sure. I have to pay 30% capital gains tax on any withdrawn crypto to fiat despite already having payed 30% wage tax on the fiat currency I fucking earn to buy the crypto in the first place. Crypto""currency"" is considered an investment. Until everywhere you can buy things from, accepts crypto as legal tender and you can option to be paid in crypto from any employer agreement, then we still in early access baby.",t3_mhoo6v,2021-04-01 21:50:32,2021-04-01
836,gt19j6n,t3_mhoo6v,Oh ok. Take the rising price away and no one gives a fuck about bitcoin. Freedom my ass. Money makes you free nigga,t3_mhoo6v,2021-04-01 22:34:53,2021-04-01
851,gt0eipg,t3_mhoo6v,"Freedom is just an illusion, to become free you NEED to be rich. Can't be free and going to work everyday lol",t3_mhoo6v,2021-04-01 16:59:22,2021-04-01
852,gt0jnl6,t3_mhoo6v,"The words ""rich"" and ""free"" are synonymous as far as im concerned",t3_mhoo6v,2021-04-01 18:05:27,2021-04-01
853,gt0h8xz,t3_mhoo6v,This will get massively down voted but the fact people are cheering Elon Musk taking interest in Bitcoin showed me personally that the original ethos of Bitcoin is lost.,t3_mhoo6v,2021-04-01 17:34:48,2021-04-01
854,gt0drjc,t3_mhoo6v,"exactly bitcoin is a currency that saves us from stupid politicians and bankers, gives us freedom to spend our savings as we wish with out it losing its value over geography and time.",t3_mhoo6v,2021-04-01 16:49:41,2021-04-01
855,gt0acib,t3_mhoo6v,"If all the institutional investors boost the price up to unobtainable heights for retail investors, the later will never be free. 90% of my friends still have no BTC investment either due to ignorance or the fact that itâ€™s too high already. You donâ€™t want to be the only one at the top - itâ€™s lonely up there",t3_mhoo6v,2021-04-01 15:58:59,2021-04-01
