,comment_id,comment_parent_id,comment_body,comment_link_id,created,date
94,gnp7c5n,t3_krqrmf,Where can I buy bitcoin that has the lowest transaction fees?,t3_krqrmf,2021-02-17 06:44:52,2021-02-17
95,gnp9foa,t3_krqrmf,"Newbie question. I live in the uk and I previously bought Bitcoin via Coinbase before the “ban” by the FCA. Coinbase now say I cannot buy any. How do I now buy crypto in the uk?? Is there are any broker or platform that still allows purchase in the uk?
Thanks 🙏",t3_krqrmf,2021-02-17 07:01:38,2021-02-17
96,gnplveg,t3_krqrmf,"Noob question. I’m very confused about wallets and keys, do certain platforms give you a private key and other platforms don’t? Can you buy Bitcoin on crypto wallets like Exodus?",t3_krqrmf,2021-02-17 08:46:14,2021-02-17
97,gnr25qg,t3_krqrmf,Oh,t3_krqrmf,2021-02-17 18:18:41,2021-02-17
98,gnrnrvm,t3_krqrmf,"I'm totally new to bitcoin and stocks (got into stocks last week, into btc this week).

&#x200B;

I just purchased my first coins(?) of around $160. Didn't make much but watching the price hit 50K and watching the hype around it, I'm ready to jump in.

I'm going to be doing my own research but I had a question about risk.

\- Would keeping my BTC in Coinbase App (Android) be safe for now? I have a small amount of BTC ($160) and 30$ in ETH. I've been browsing this forum and found out about different ways to keep your crypto safe. I plan on getting a hard wallet eventually (are there safer ways to keep crypto?) but for now, is it safe to keep in Coinbase App alone? I figure if a hacker can get into my coinbase, they wouldnt get much for the effort anyway.",t3_krqrmf,2021-02-17 22:40:58,2021-02-17
199,gnny0no,t1_gnn6o33,"There are many more ways you could make a mistake and expose your keys, it's not advised.  Hardware wallets are for more than just secure key storage they also do secure transaction signing.  The moment you plug that USB into a computer to make a transaction you are potentially exposing your seed to theft.

Also, a piece of friendly advice, don't waste your time or money with shitcoins.",t3_krqrmf,2021-02-17 01:08:36,2021-02-17
200,gnp9eci,t1_gnp7c5n,just have to shop around.  Lowest would be to meet someone who was willing to sell to you at spot price.,t3_krqrmf,2021-02-17 07:01:20,2021-02-17
201,gnpag83,t1_gnp9foa,"Sure definitely Kraken or Bitstamp could do it, Gemini might also offer their services in the UK.",t3_krqrmf,2021-02-17 07:10:03,2021-02-17
202,gnr5lnx,t1_gnp9foa,">  I live in the uk and I previously bought Bitcoin via Coinbase before the “ban” by the FCA.

There is only a ban on derivative products, **not** on bitcoin buying/selling/holding itself.   

>  Coinbase now say I cannot buy any.  

This shouldn't be in relation to that law, see above. Most likely it is because of something else (did they close/restrict your account for some reason)? If this was the case (it isn't), you wouldn't be able to buy bitcoin anywhere else in the UK.  

You can also see other exchanges with GBP/BTC trading like Bitstamp, Kraken or Gemini, or use Bittylicious, or other p2p methods like: https://kycnot.me/  

https://github.com/cointastical/P2P-Trading-Exchanges  

Prepare to put in more effort and/or pay higher fees though, privacy is not free. Also consider other sources like bitcoin ATMs, earning bitcoin with your work or by selling goods for bitcoin etc.",t3_krqrmf,2021-02-17 19:14:54,2021-02-17
203,gnpqobr,t1_gnplveg,Yes places like robinhood and paypal will not give you your keys.  All the one in the where to buy bitcoin section above allow you to withdraw your bitcoin to a hardware wallet where you control the keys.  I'm not as familiar with exodus.,t3_krqrmf,2021-02-17 09:27:37,2021-02-17
212,gnp7ot6,t1_gibw9oh,Now that ladies and gentleman is German Shepard Simple! Kuddos needs to be an award. Just sayin!,t3_krqrmf,2021-02-17 06:47:40,2021-02-17
323,gnr26i6,t3_llof4g,Woke up and my stack is officially worth six figures. It cost me $9k. Amazing.,t3_llof4g,2021-02-17 18:19:04,2021-02-17
324,gnr5v05,t3_llof4g,"1. Sell ur btc for profits. 
2. buy cows
3. sell cow milk for btc instead of $
4. Enjoy mining bitcoin naturally",t3_llof4g,2021-02-17 19:19:00,2021-02-17
325,gnqprz1,t3_llof4g,I'm a half a millionaire now. I was making 17k per year in construction about 10 years ago. Thanks Bitcoin!,t3_llof4g,2021-02-17 15:07:44,2021-02-17
327,gnqplqf,t3_llof4g,Just want to see the 1 trillion market cap,t3_llof4g,2021-02-17 15:05:32,2021-02-17
328,gnqrvo8,t3_llof4g,"*When bitcoin went from $40k to $30k*

“welp boys, looks like that was the top. Good thing I sold and cut my losses at $33k. Everyone in here saying HODL is just trying to keep you in to save their bags. Good luck bagholding for another few years again”",t3_llof4g,2021-02-17 15:35:03,2021-02-17
331,gnr4y43,t3_llof4g,"It's funny that people treat bitcoin as a technology company, and not as the most secure censorship resistant global digital value transfer system backed by strong network effects.

The idea of bitcoin is so foreign to people that there are simply no good analogies that can be used to describe the actual value bitcoin brings to the table. 

You can compare it to the internet and gold, and say it's going to replace fiat money, but those comparisons don't really do bitcoin justice.",t3_llof4g,2021-02-17 19:04:33,2021-02-17
338,gnqpal1,t3_llof4g,"Bitcoin is going to 

1,zero! Zero! Zero!, zero! Zero! Zero!",t3_llof4g,2021-02-17 15:01:38,2021-02-17
339,gnr436x,t3_llof4g,"Once BTC pays for my kids through college, lets me pay off the mortgage and retire before 60 I’ll be happy. I’m not asking for much.",t3_llof4g,2021-02-17 18:50:41,2021-02-17
340,gnqr64a,t3_llof4g,"Ahhh yes, the old ""wake up to piss"" price check turned to ""no more sleep"" wide awake moment.",t3_llof4g,2021-02-17 15:25:45,2021-02-17
341,gnqurdd,t3_llof4g,"Im just some factory worker somewhere in Africa earning just enough to pay for the basics, the little i have left is going into Bitcoin. Been sacrificing for the past month, eating dry bread at work, going home to my mother for supper but I can see the bigger picture. Hodling for the next 5 years and just maybe I can retire and live a comfortable life. Thank You Bitcoin!",t3_llof4g,2021-02-17 16:15:18,2021-02-17
342,gnr0jnn,t3_llof4g,This isn't retail. It's massive OTC deals - hence you're not seeing Coinbase volume.,t3_llof4g,2021-02-17 17:51:01,2021-02-17
349,gnr49d1,t3_llof4g,"Whoever that one guy was, I haven't forgotten that you promised to shove a 12-inch dildo in your ass if it held $50k for 1 hour",t3_llof4g,2021-02-17 18:53:29,2021-02-17
350,gnqspwq,t3_llof4g,Another unproductive day at Homeoffice in 2021.,t3_llof4g,2021-02-17 15:46:20,2021-02-17
351,gnr0kzv,t3_llof4g,At $54k Bitcoin will officially have a market capitalization of $1 trillion.,t3_llof4g,2021-02-17 17:51:38,2021-02-17
352,gnrl56n,t3_llof4g,"BlackRock is now in bitcoin.

Game over. We won.",t3_llof4g,2021-02-17 22:17:54,2021-02-17
353,gnra0t6,t3_llof4g,"Every single executive and board of directors is going to wake up this morning to see Bitcoin sitting at $51k.


While they talk and debate and drag there feet, Michael Saylor and Elon Musk are laughing all the way to the bank.


The institutional mother of all FOMO runs is coming.",t3_llof4g,2021-02-17 20:18:57,2021-02-17
354,gnrfi67,t3_llof4g,"Should I spend $550 on bitcoin or on a prostitute named Coco?


Edit: I did both.",t3_llof4g,2021-02-17 21:23:11,2021-02-17
358,gnqse23,t3_llof4g,I don't get why people will sell bitcoin hoping for some soonish small dip to rebuy just to get a 3-5% gain and risk losing money when bitcoin already makes like 400% a year on average,t3_llof4g,2021-02-17 15:41:51,2021-02-17
359,gnr4r1n,t3_llof4g,Good fucking morning :D,t3_llof4g,2021-02-17 19:01:28,2021-02-17
360,gnr5qk6,t3_llof4g,Bitcoin is the ultimate drug. Let’s get high.,t3_llof4g,2021-02-17 19:17:01,2021-02-17
367,gnr9v1e,t3_llof4g,£50k is the new $50k,t3_llof4g,2021-02-17 20:16:51,2021-02-17
368,gnrcmxa,t3_llof4g,This just in: saylor going to sell his mom to buy more Bitcoin,t3_llof4g,2021-02-17 20:51:22,2021-02-17
374,gnqpw3y,t3_llof4g,I want my.  I want my.  I want my BTC.,t3_llof4g,2021-02-17 15:09:13,2021-02-17
375,gnqs57j,t3_llof4g,Looks like meat is back on the menu boys.,t3_llof4g,2021-02-17 15:38:34,2021-02-17
376,gnr0fze,t3_llof4g,"Feels like 55K coming by the weekend. Bought some more at 49.2K earlier today. Feeling good about it.

Hodl all the way.",t3_llof4g,2021-02-17 17:49:17,2021-02-17
377,gnraold,t3_llof4g,"Just over two months ago a couple of my friends laughed at me when I said bitcoin would hit over 100 k USD in 2021. They said it will never even hit 50 k USD and that it’s Monopoly money. Told me to come talk to them when it does. 

Well guess who just informed me they’re buying bitcoin 😂.",t3_llof4g,2021-02-17 20:27:35,2021-02-17
382,gnqv7e0,t3_llof4g,"Madness. If 51k is so unbelievable, can you imagine 100k? It’s odd, like the closer we get to 100, the more it feels out of reach cause each milestone seems so much more insane than the last. I will still hodl though.",t3_llof4g,2021-02-17 16:22:15,2021-02-17
383,gnr0kl3,t3_llof4g,put on your space suits,t3_llof4g,2021-02-17 17:51:27,2021-02-17
384,gnr3r4w,t3_llof4g,"50K is neat and stuff, but the real deal is when we cross 1 Trillion $ in marketcap. Soon.",t3_llof4g,2021-02-17 18:45:12,2021-02-17
385,gnr45hk,t3_llof4g,Who else still checks their old accounts from exchanges and wallets you once used to see if you didn't per chance forget a few bitcoins there?,t3_llof4g,2021-02-17 18:51:41,2021-02-17
386,gnr4w9b,t3_llof4g,I'm so glad to be part of this before it reaches 1trillion market cap and I don't even know why.,t3_llof4g,2021-02-17 19:03:47,2021-02-17
387,gnrpy7m,t3_llof4g,1 BTC is now worth 1 kilo of cocaine!,t3_llof4g,2021-02-17 22:58:59,2021-02-17
393,gnr7urf,t3_llof4g,I sacrificed my booty hole for 50k! Give me some love boys and girl!,t3_llof4g,2021-02-17 19:48:54,2021-02-17
394,gnrk0ym,t3_llof4g,Bitcoin is now closer to 100k than 0. Let that sink in.,t3_llof4g,2021-02-17 22:07:39,2021-02-17
395,gnqpgix,t3_llof4g,I had work tomorrow but thinking about retirement now with this breakout.,t3_llof4g,2021-02-17 15:03:41,2021-02-17
396,gnqtr9u,t3_llof4g,"Well, I wasn't expecting to wake up like that (UK).",t3_llof4g,2021-02-17 16:00:55,2021-02-17
397,gnqu0yr,t3_llof4g,"I ain’t selling til at least $170k during this bull run. It’ll probably be closer to $250k before I even consider tbh. Eh who knows, might never sell at this rate.",t3_llof4g,2021-02-17 16:04:47,2021-02-17
398,gnqum9j,t3_llof4g,Think about the following...we STILL have not had the $1.9 T stimulus...Plus we are now going to start tax season meaning people will have tax refunds...in other words...the moon is just a quick one stop towards something much BIGGER!,t3_llof4g,2021-02-17 16:13:14,2021-02-17
399,gnqweiq,t3_llof4g,bruh.. I only know how to say bruh now.. bruh,t3_llof4g,2021-02-17 16:41:48,2021-02-17
400,gnr07v8,t3_llof4g,"It’s amazing really, I last bought at $45k, at the time you’re always questioning yourself that you’re buying at too high a price, but a week or two goes by and suddenly it seems like a great deal.",t3_llof4g,2021-02-17 17:45:27,2021-02-17
401,gnr09qb,t3_llof4g,Holy shit fuck is 2021 > 2020...let’s goooooo,t3_llof4g,2021-02-17 17:46:20,2021-02-17
402,gnr12ux,t3_llof4g,My flatmates have started talking about Bitcoin. I've never brought it up to them before.,t3_llof4g,2021-02-17 18:00:10,2021-02-17
403,gnr37k9,t3_llof4g,"Doubled after I bought, so I bought again, and it fucking doubled again?! I'm seriously feeling like a doofus for holding any stock now. Oh well, going to cling to this half a coin forever.",t3_llof4g,2021-02-17 18:36:14,2021-02-17
404,gnr4ds9,t3_llof4g,"50k wall is officially broken, it held for an hour",t3_llof4g,2021-02-17 18:55:30,2021-02-17
415,gnqtsem,t3_llof4g,I gotta to to bed lmao,t3_llof4g,2021-02-17 16:01:22,2021-02-17
416,gnqutqp,t3_llof4g,I told my mom I invested in bitcoin and she asked how much it was and she gasped when I said 50k. I'm up ~50% but my parents told my brother that he wasn't allowed to buy bitcoin back when it was 600 dollars lol (he was 16 or something).,t3_llof4g,2021-02-17 16:16:18,2021-02-17
417,gnqvqrq,t3_llof4g,I’m a moron for not buying at 29K.,t3_llof4g,2021-02-17 16:31:03,2021-02-17
418,gnqz14a,t3_llof4g,[An $8.9 million short just got liquidated on bitmex](https://twitter.com/BXRekt/status/1361969749677252609),t3_llof4g,2021-02-17 17:25:19,2021-02-17
419,gnr1den,t3_llof4g,"Just 48 hours ago I said, like many others, 
HODL and believe in BTC,

Welll congratulations you all!

Well deserved and well done BTC

We love you !
🚀",t3_llof4g,2021-02-17 18:05:16,2021-02-17
420,gnr1fwn,t3_llof4g,I remember feeling uncomfortable about buying at 13k in november last year becaus it was too high. Absolutely kicking myself for not buying a lot more at the time. I bought the majority of mine at 21k.,t3_llof4g,2021-02-17 18:06:29,2021-02-17
421,gnr3cyj,t3_llof4g,"I'm still annoyed that I thought I was smart to trade at lower 30-40k levels. I would have had 1.4 btc more now, had i just held...",t3_llof4g,2021-02-17 18:38:42,2021-02-17
422,gnr84of,t3_llof4g,"Bought a nice cadillac on Monday. Not with bitcoin ofcourse, i'm holding onto that shit for dear life. I sold some index funds, and bitcoin helped justify selling them. So thanks bitcoin.",t3_llof4g,2021-02-17 19:52:58,2021-02-17
423,gnrerrc,t3_llof4g,I wish I bought more Bitcoin earlier!,t3_llof4g,2021-02-17 21:15:18,2021-02-17
424,gnreyls,t3_llof4g,I fucking love bitcoin. I would rather be homeless on the streets than ever sell a single satoshi,t3_llof4g,2021-02-17 21:17:20,2021-02-17
432,gnqr3qg,t3_llof4g,Y’all I was accidentally hanging out in yesterday’s thread wondering where all the hype about 51k was. Found you!,t3_llof4g,2021-02-17 15:24:53,2021-02-17
433,gnrc0nu,t3_llof4g,"YOOHOO u/ABOOZER  the guy that sold 10k and 30k and said that it would crash. And that bitcoin is internet magic beans. 

YOOOOOOOOOOOOOOO HOOOOOOOOOOOOOOOOOO",t3_llof4g,2021-02-17 20:44:09,2021-02-17
434,gnqqhw5,t3_llof4g,I dont have much.... but I'm in!,t3_llof4g,2021-02-17 15:16:59,2021-02-17
435,gnqsyud,t3_llof4g,I told my girlfriend to let me know when she sees TikToks about bitcoin. That’s how I’ll know it’s going mainstream and probably in a bubble,t3_llof4g,2021-02-17 15:49:48,2021-02-17
436,gnqtgyq,t3_llof4g,51k on binance rn!!!,t3_llof4g,2021-02-17 15:56:54,2021-02-17
437,gnqtlw8,t3_llof4g,Fuck it 52?,t3_llof4g,2021-02-17 15:58:51,2021-02-17
438,gnqywk0,t3_llof4g,"woooh, just crossed £37000! Appreciation of pound, bad for my US stocks great for my bitcoin holdings..",t3_llof4g,2021-02-17 17:23:12,2021-02-17
439,gnr1nqm,t3_llof4g,Please tell your lovers and friends that the little orange coin just had to do it again,t3_llof4g,2021-02-17 18:10:12,2021-02-17
440,gnraxlz,t3_llof4g,This consolidation forming over 50k is making me so erect,t3_llof4g,2021-02-17 20:30:44,2021-02-17
457,gnrd1km,t3_llof4g,"The most annoying people atm:
Have a “friend” who was telling me he would never buy btc etc. 
Then a few months later when btc was around the $30k he’s on Facebook announcing that he sold as there is a huge dip coming and has made a huge profit. Now he’s on again saying he’s glad he is a hodler and never sold. It’s annoying seeing all the people congratulating him even tho it’s clear he is full of shlt.",t3_llof4g,2021-02-17 20:55:59,2021-02-17
459,gnqpdj0,t3_llof4g,51 here we come,t3_llof4g,2021-02-17 15:02:37,2021-02-17
460,gnqrf0o,t3_llof4g,Boys r we in price discovery yet???,t3_llof4g,2021-02-17 15:29:02,2021-02-17
461,gnqs550,t3_llof4g,there’s no doubt about it I am fuckin loving this,t3_llof4g,2021-02-17 15:38:33,2021-02-17
462,gnqsap6,t3_llof4g,"DCAing in this climate sucks, especially when you’re doing it monthly. My last purchase was at $39k....",t3_llof4g,2021-02-17 15:40:38,2021-02-17
463,gnqtbun,t3_llof4g,Gonna be so much FOMO when most Americans wake up.,t3_llof4g,2021-02-17 15:54:51,2021-02-17
464,gnqtfif,t3_llof4g,51k!!!!!!!,t3_llof4g,2021-02-17 15:56:18,2021-02-17
465,gnqtn7m,t3_llof4g,I blinked and it was 51k,t3_llof4g,2021-02-17 15:59:23,2021-02-17
466,gnqtr6b,t3_llof4g,Just remove your sell orders bros. These sell “walls” don’t mean shit,t3_llof4g,2021-02-17 16:00:53,2021-02-17
467,gnqu0ld,t3_llof4g,"Bitcoin, I want to sleep tonight, why u do this?!?",t3_llof4g,2021-02-17 16:04:38,2021-02-17
468,gnqumn5,t3_llof4g,"Well I'm glad that the conversation has shifted from ""can it hold 50k?"" to ""can it hold 51k?"".

Still, my expectations are tempered in anticipation of the usual 2 to 5k dumps that Bitcoin likes to pull off.",t3_llof4g,2021-02-17 16:13:24,2021-02-17
469,gnqvuve,t3_llof4g,Missing bitcoin is like not buying Apple 20 years ago,t3_llof4g,2021-02-17 16:32:52,2021-02-17
470,gnqw1hq,t3_llof4g,Just bought more let’s gooooooo,t3_llof4g,2021-02-17 16:35:53,2021-02-17
471,gnqwqek,t3_llof4g,I'm not selling anyone my bitcoin for 50k....,t3_llof4g,2021-02-17 16:47:19,2021-02-17
472,gnr0ia4,t3_llof4g,seeing bitcoin move up without any news or rumours is realy satisfying,t3_llof4g,2021-02-17 17:50:23,2021-02-17
473,gnr0q4k,t3_llof4g,2021 has been every bit as carzy as anticipated. The price is catching up to the insanely positive news.,t3_llof4g,2021-02-17 17:54:04,2021-02-17
474,gnr1e0x,t3_llof4g,"50K already feeling like a long time ago...52K is knocking, let’s goooo!!!",t3_llof4g,2021-02-17 18:05:35,2021-02-17
475,gnr1u71,t3_llof4g,"Bitcoins chart personality has changed. Sharp up tick followed by a plateau for 1 to 3 days, small drop then sharp up tick higher followed by another plateau. To me this seem slightly more stable. Must be because large companies are putting in and staying. Low trading  volume however significant gains.",t3_llof4g,2021-02-17 18:13:16,2021-02-17
476,gnr3pbn,t3_llof4g,King BTC. What a handsome devil. 👑🚀🌕,t3_llof4g,2021-02-17 18:44:23,2021-02-17
477,gnr7ws7,t3_llof4g,Here comes the ATH again.,t3_llof4g,2021-02-17 19:49:44,2021-02-17
478,gnrakvk,t3_llof4g,42.5k euro is the new floor lol,t3_llof4g,2021-02-17 20:26:15,2021-02-17
479,gnrdf6x,t3_llof4g,"I bookmarked Coinbase Pro on my browser on 1/21/21
and the BTC price was 28k...
That's some serious movement in less than a month!",t3_llof4g,2021-02-17 21:00:15,2021-02-17
480,gnrdj02,t3_llof4g,Boom 💥 goes the dynamite 🧨,t3_llof4g,2021-02-17 21:01:26,2021-02-17
481,gnrn4ps,t3_llof4g,Exodus mobile wallet now lets their customers buy bitcoin using Apple pay. It has almost no fees. But the amount you can buy is $50-$500. It makes things so much easier for newbies!,t3_llof4g,2021-02-17 22:35:31,2021-02-17
496,gnqv0i7,t3_llof4g,It’s okay Bitcoin take ur time,t3_llof4g,2021-02-17 16:19:15,2021-02-17
500,gnqqw5q,t3_llof4g,"https://images.snapwi.re/75de/5c3cdbfecc5dcd5af2e120ed.w800.jpg

Click the link if you dare",t3_llof4g,2021-02-17 15:22:06,2021-02-17
501,gnqpcos,t3_llof4g,holy shit,t3_llof4g,2021-02-17 15:02:21,2021-02-17
502,gnqqoxi,t3_llof4g,guys it’s doing the thing,t3_llof4g,2021-02-17 15:19:30,2021-02-17
503,gnqqy41,t3_llof4g,51K is a sexy bitch ..,t3_llof4g,2021-02-17 15:22:48,2021-02-17
504,gnqt2mk,t3_llof4g,Too many good things happening with BTC and crypto in general for BTC not to go to 100K this bullrun.,t3_llof4g,2021-02-17 15:51:16,2021-02-17
505,gnqtisg,t3_llof4g,Just watched that 51 wall melt in real time.,t3_llof4g,2021-02-17 15:57:37,2021-02-17
506,gnqtk9i,t3_llof4g,"Please stop, I can only get so erect",t3_llof4g,2021-02-17 15:58:12,2021-02-17
507,gnqtkje,t3_llof4g,$51k saw a 13mil sell wall disappear fast!,t3_llof4g,2021-02-17 15:58:18,2021-02-17
508,gnqtntq,t3_llof4g,that 51k sell wall was bullshit lmao,t3_llof4g,2021-02-17 15:59:37,2021-02-17
509,gnqtppe,t3_llof4g,What is happened,t3_llof4g,2021-02-17 16:00:19,2021-02-17
510,gnqturh,t3_llof4g,#$51k is the new $50k,t3_llof4g,2021-02-17 16:02:19,2021-02-17
511,gnquqi7,t3_llof4g,"OMG the punches btc is taking at the moment!! 

Btc like: is that all you got???",t3_llof4g,2021-02-17 16:14:57,2021-02-17
512,gnqva4m,t3_llof4g,Literally shook. I checked prices and almost had a heart attack 😭,t3_llof4g,2021-02-17 16:23:28,2021-02-17
513,gnqvv7d,t3_llof4g,Expected to grow to 65k next week. Wowza.,t3_llof4g,2021-02-17 16:33:01,2021-02-17
514,gnqvw6v,t3_llof4g,Funny how 2013 holders paved the way for 2017/2018 holders and now 2017/2018 holders are paving the way for 2020/2021 holders,t3_llof4g,2021-02-17 16:33:27,2021-02-17
515,gnqyxyo,t3_llof4g,Got a sizeable tax refund today...little do they know where it is going 🤣,t3_llof4g,2021-02-17 17:23:50,2021-02-17
516,gnr0pg9,t3_llof4g,Keep trying to get back in but it keeps going up,t3_llof4g,2021-02-17 17:53:44,2021-02-17
517,gnr5ghe,t3_llof4g,Trillion is a funny word,t3_llof4g,2021-02-17 19:12:37,2021-02-17
518,gnrk3ct,t3_llof4g,"$30k, $40k, $50k. I just cant stop buying 🤷‍♂️",t3_llof4g,2021-02-17 22:08:17,2021-02-17
519,gnrkdbx,t3_llof4g,New ATH incoming....,t3_llof4g,2021-02-17 22:10:51,2021-02-17
520,gnrp0c6,t3_llof4g,Stop trying to time the market. I’m sure there are still people waiting to get in the 20s and 30s range. Just buy and hold. You’ll be better off mentally and financially,t3_llof4g,2021-02-17 22:51:13,2021-02-17
521,gnrp2qr,t3_llof4g,Anyone want to comment on the JP Morgan FUD this morning about BTC being too volatile to keep up it's run past 50k?,t3_llof4g,2021-02-17 22:51:46,2021-02-17
535,gnrcw5o,t3_llof4g,Every time America wakes up Bitcoin go down?,t3_llof4g,2021-02-17 20:54:18,2021-02-17
536,gnr0iu9,t3_llof4g,"Let’s be honest, we’re going to be a LOT more excited when BTC reaches $69,420 then $100,000 😅😅😅",t3_llof4g,2021-02-17 17:50:38,2021-02-17
537,gnqzdpa,t3_llof4g,"How do people not understand how limited the supply of coins is. Once the real FOMO kicks in the price is going to moon.

We're not even close to the end of this bull run.",t3_llof4g,2021-02-17 17:31:14,2021-02-17
539,gnqpdh9,t3_llof4g,[To celebrate 50k](https://youtu.be/gmMIMZc8zW0),t3_llof4g,2021-02-17 15:02:36,2021-02-17
540,gnqpdiz,t3_llof4g,"Everyone that has ever purchased Bitcoin and held it , has made money .

Buy Bitcoin , watch it grow",t3_llof4g,2021-02-17 15:02:37,2021-02-17
541,gnqpejw,t3_llof4g,"Hello there $51,000",t3_llof4g,2021-02-17 15:02:59,2021-02-17
542,gnqpfbq,t3_llof4g,Holy shit are we reaching 51 now,t3_llof4g,2021-02-17 15:03:15,2021-02-17
543,gnqphzh,t3_llof4g,Buckle up,t3_llof4g,2021-02-17 15:04:12,2021-02-17
544,gnqpj2t,t3_llof4g,Is using an electrum wallet on an old laptop who will never ever see the internet again called a cold wallet or do I miss something?,t3_llof4g,2021-02-17 15:04:35,2021-02-17
545,gnqpsvt,t3_llof4g,Would love to see it close above 50k on 4hr chart,t3_llof4g,2021-02-17 15:08:03,2021-02-17
546,gnqq90t,t3_llof4g,This is the one,t3_llof4g,2021-02-17 15:13:51,2021-02-17
547,gnqqujb,t3_llof4g,51k come onnnnn,t3_llof4g,2021-02-17 15:21:30,2021-02-17
548,gnqr2j1,t3_llof4g,51!k,t3_llof4g,2021-02-17 15:24:26,2021-02-17
549,gnqszw1,t3_llof4g,Fuck me for selling Riot blockchain at $49. At least I’ve never sold Bitcoin ever and I never will.,t3_llof4g,2021-02-17 15:50:12,2021-02-17
550,gnqthvv,t3_llof4g,51k!!!!!,t3_llof4g,2021-02-17 15:57:17,2021-02-17
551,gnqthw8,t3_llof4g,Yoooooooooo wtf,t3_llof4g,2021-02-17 15:57:17,2021-02-17
552,gnqti9a,t3_llof4g,51,t3_llof4g,2021-02-17 15:57:24,2021-02-17
553,gnqvs11,t3_llof4g,Guess I’m never gonna get to buy under 50k again rip,t3_llof4g,2021-02-17 16:31:36,2021-02-17
554,gnqwa8w,t3_llof4g,"No sleep till 51k! Okay, time for bed now.",t3_llof4g,2021-02-17 16:39:51,2021-02-17
555,gnqxopw,t3_llof4g,Bitcorn a’ poppin’,t3_llof4g,2021-02-17 17:02:59,2021-02-17
556,gnqxruo,t3_llof4g,51 club feels gooooood,t3_llof4g,2021-02-17 17:04:25,2021-02-17
557,gnqxszp,t3_llof4g,Happy 50k y'all,t3_llof4g,2021-02-17 17:04:55,2021-02-17
558,gnqyhz3,t3_llof4g,How TF am i supposed to sleep,t3_llof4g,2021-02-17 17:16:29,2021-02-17
559,gnqyoda,t3_llof4g,"Doubled my weekly DCA amount because this shit is just moving too fast these days 

For years I've advocated DCA'ing to non-hodlers. It's never steered me wrong. I continue to advise it. But god damn do I really wish I lump summed in July when I had the chance. That sum just sits around trickling in, and will be on the sidelines for a drop, I suppose -- but I don't think that drop is coming anymore. I don't think we'll ever drop below 30K again. 

Oh well. I'll be DCA'ing for the rest of my life regardless.",t3_llof4g,2021-02-17 17:19:27,2021-02-17
560,gnqyvf9,t3_llof4g,We out here lads! To all those doubters I say - here comes 60k baby!,t3_llof4g,2021-02-17 17:22:42,2021-02-17
561,gnqz4ht,t3_llof4g,52K is kinda close now!,t3_llof4g,2021-02-17 17:26:56,2021-02-17
562,gnr07sz,t3_llof4g,ding,t3_llof4g,2021-02-17 17:45:25,2021-02-17
563,gnr111a,t3_llof4g,We can say 50k is the new support ?,t3_llof4g,2021-02-17 17:59:18,2021-02-17
564,gnr2kxw,t3_llof4g,Bitcoin really only goes up,t3_llof4g,2021-02-17 18:25:45,2021-02-17
565,gnr3voy,t3_llof4g,"So what price is the moon then? I mean people have been saying to the moon since, what 3k? - surely we're at the moon and off somewhere else? (not a serious question, just a random Wednesday thought) :)",t3_llof4g,2021-02-17 18:47:15,2021-02-17
566,gnr6l2l,t3_llof4g,51K LETS GOOO,t3_llof4g,2021-02-17 19:29:59,2021-02-17
567,gnr8jsk,t3_llof4g,[deleted],t3_llof4g,2021-02-17 19:58:52,2021-02-17
568,gnr9ene,t3_llof4g,that is a lot of volume being thrown around,t3_llof4g,2021-02-17 20:10:43,2021-02-17
569,gnrjnmd,t3_llof4g,thinking bout buying more bitcoin... what do you think?,t3_llof4g,2021-02-17 22:04:07,2021-02-17
