,comment_id,comment_parent_id,comment_body,comment_link_id,created,date
38,gtc4bc8,t3_mcd99v,"I trust my old hardware trezor wallet, they just can't hack it out of nothing !",t3_mcd99v,2021-04-04 18:57:05,2021-04-04
39,gtcfdfo,t3_mcd99v,"Insider job for sure, just like how thiefs gets their hands on doing SIMs swap at Tmobile.",t3_mcd99v,2021-04-04 21:23:31,2021-04-04
65,gt9gn6p,t3_mcd99v,Blockchain is indeed controlled by the banks. It is destroying bitcoin culture.,t3_mcd99v,2021-04-04 01:17:30,2021-04-04
66,gta1z5o,t3_mcd99v,"Roger ver has been convicted of felony.. This indirectly tells you that there something fishy about blockchain.. 
It's not a bug.. It's a conscious action taken by the company to loot customers of their crypto's...",t3_mcd99v,2021-04-04 04:16:14,2021-04-04
67,gtbvpjs,t3_mcd99v,A good friend of mine had 20 BTC “dissapear” from his account on blockchain.com a while back. Definitely dodgy!,t3_mcd99v,2021-04-04 16:31:25,2021-04-04
81,gtc705o,t1_gs31nh8,It's always an inside job... MESSAGE!!!,t3_mcd99v,2021-04-04 19:38:21,2021-04-04
115,gtb7o6y,t1_gs43ows,You can't access the program just like that,t3_mcd99v,2021-04-04 11:00:58,2021-04-04
118,gtb7ti1,t1_gs3s5t3,Tell me about Roger ver,t3_mcd99v,2021-04-04 11:02:30,2021-04-04
136,gtav6ap,t1_gt6qtg3,Thank you for the thorough advice!,t3_mcd99v,2021-04-04 08:54:12,2021-04-04
148,gt9xdsl,t1_gsn3qny,"Same here,no wallet is save they all have one or two issues...🃏",t3_mcd99v,2021-04-04 03:36:43,2021-04-04
171,gt9d4wh,t1_gsy02tq,"Haha, thanks for the trip down memory lane.

That bitcointip I received for the comment would be worth $1200+ at today's rate >.>",t3_mcd99v,2021-04-04 00:47:11,2021-04-04
173,gt9x5ts,t1_gso0cdw,😂,t3_mcd99v,2021-04-04 03:34:52,2021-04-04
181,gtcfpr8,t1_gszpakq,Thats how exactly I remember it during early btc adoption with Roger Ver shilling bitcoin cash as the real stuff.,t3_mcd99v,2021-04-04 21:27:14,2021-04-04
182,gtcj9n8,t1_gt9d4wh,That's funny as hell man wtf how did you discover that?,t3_mcd99v,2021-04-04 22:05:23,2021-04-04
194,gt9gsas,t1_gt56shr,Blockchain is funded by the banks or technically it is controlled.,t3_mcd99v,2021-04-04 01:18:44,2021-04-04
236,gtchpgo,t3_mjwhag,Congratulations!,t3_mjwhag,2021-04-04 21:48:34,2021-04-04
237,gtchzlk,t3_mjwhag,Best of luck!! I wish you to succeed as much as humanly possible!!!,t3_mjwhag,2021-04-04 21:52:14,2021-04-04
238,gtcixfg,t3_mjwhag,"Buona fortuna! Sono Italiano ma vivo negli UK da 7 anni. 

This is the way my friend!",t3_mjwhag,2021-04-04 22:02:00,2021-04-04
240,gtci83k,t3_mjwhag,Good luck in your endeavours.,t3_mjwhag,2021-04-04 21:54:48,2021-04-04
242,gtcjzf8,t3_mjwhag,"Welcome to Bella Italia!

- a friendly Italian",t3_mjwhag,2021-04-04 22:12:28,2021-04-04
243,gtclx8z,t3_mjwhag,Im happy for you mate and Im glad bitcoin did something amazing in someones life! Crypto is literally a life saver👍,t3_mjwhag,2021-04-04 22:30:54,2021-04-04
245,gtci446,t3_mjwhag,"Awesome news and congratulations.

I hope your new life in Italy brings you everything you want from it.",t3_mjwhag,2021-04-04 21:53:33,2021-04-04
247,gtciokw,t3_mjwhag,Congratulations!   Way to work for your dream!,t3_mjwhag,2021-04-04 21:59:31,2021-04-04
249,gtcjadv,t3_mjwhag,Amazing. Best of luck to you. Keep us posted!,t3_mjwhag,2021-04-04 22:05:36,2021-04-04
257,gtcnjbd,t3_mjwhag,"Good stuff, maybe we can have a pizza lunch (paid in BTC), when I go to Italy during summer vacation!",t3_mjwhag,2021-04-04 22:45:50,2021-04-04
258,gtckwd1,t3_mjwhag,Big respect,t3_mjwhag,2021-04-04 22:21:14,2021-04-04
259,gtcl5fq,t3_mjwhag,Congratulations buddy! Best wishes for laying down a new foundation :),t3_mjwhag,2021-04-04 22:23:35,2021-04-04
260,gtcndtu,t3_mjwhag,Where do you wanna go live in Italy?,t3_mjwhag,2021-04-04 22:44:25,2021-04-04
261,gtcnm3z,t3_mjwhag,Good luck!,t3_mjwhag,2021-04-04 22:46:33,2021-04-04
273,gtco884,t3_mjwhag,Congrats!!,t3_mjwhag,2021-04-04 22:52:03,2021-04-04
305,gtcjljg,t3_mjwhag,Best of luck. Shortest way is to marry an italian woman / man.,t3_mjwhag,2021-04-04 22:08:39,2021-04-04
306,gtck5r2,t3_mjwhag,"Yes man well done!! I am from Italy though, and I recommend that as soon as you can you move to a better country (financially speaking) like France, Germany, Netherlands among others.",t3_mjwhag,2021-04-04 22:14:12,2021-04-04
308,gtco9kk,t3_mjwhag,Life changing stuff. That’s what it’s all about.,t3_mjwhag,2021-04-04 22:52:23,2021-04-04
309,gtcoin0,t3_mjwhag,"Congratulations, and good luck!",t3_mjwhag,2021-04-04 22:54:39,2021-04-04
320,gtcl8ts,t3_mjwhag,Hell yes man! Making shit happen! Congrats on your MOON!,t3_mjwhag,2021-04-04 22:24:28,2021-04-04
321,gtcm2f7,t3_mjwhag,Grazia! See you back in cryptos on Monday.,t3_mjwhag,2021-04-04 22:32:15,2021-04-04
323,gtcnxfr,t3_mjwhag,"Gratz man! I plan on selling once the unemployment runs out to pay off my car. If I sold now Id have to report it as income. I dont make the rules, they did.",t3_mjwhag,2021-04-04 22:49:23,2021-04-04
324,gtcjk4h,t3_mjwhag,Best wishes.,t3_mjwhag,2021-04-04 22:08:15,2021-04-04
325,gtcnami,t3_mjwhag,👍🏻🤟🏻💯,t3_mjwhag,2021-04-04 22:43:36,2021-04-04
326,gtco8wl,t3_mjwhag,I wish you the best of luck in your new life.  That is a worthy use of crypto.,t3_mjwhag,2021-04-04 22:52:13,2021-04-04
329,gtclhqo,t3_mjwhag,Do not hold the euro long term. It’s the worst currency mankind has ever seen.,t3_mjwhag,2021-04-04 22:26:50,2021-04-04
331,gtcn2tb,t3_mjwhag,"Congratulations, EU is awesome, you will love it. Upper or lower Italy?",t3_mjwhag,2021-04-04 22:41:38,2021-04-04
332,gtcl5qy,t3_mjwhag,"Meh, should have held for a few more months. Probably could have gained 50% more on your investment. But congratulations. Italy looks like a nice place.",t3_mjwhag,2021-04-04 22:23:40,2021-04-04
333,gtckt55,t3_mjwhag,You sold your crypto to make more money? #logic,t3_mjwhag,2021-04-04 22:20:22,2021-04-04
554,gtcm6g7,t1_gtchpgo,Thank you!,t3_mjwhag,2021-04-04 22:33:17,2021-04-04
555,gtcmbe7,t1_gtchzlk,Thanks so much!,t3_mjwhag,2021-04-04 22:34:34,2021-04-04
556,gtcma6b,t1_gtcixfg,"Grazie! I also dream to go to the UK one day, I like West Ham and want to go to a game 😂",t3_mjwhag,2021-04-04 22:34:15,2021-04-04
562,gtcmc4g,t1_gtci83k,Thank you!,t3_mjwhag,2021-04-04 22:34:46,2021-04-04
565,gtcmj9m,t1_gtcjzf8,Graziee!,t3_mjwhag,2021-04-04 22:36:36,2021-04-04
568,gtcmbvb,t1_gtci446,Thank you!,t3_mjwhag,2021-04-04 22:34:41,2021-04-04
570,gtcmcgs,t1_gtciokw,Thank you!,t3_mjwhag,2021-04-04 22:34:51,2021-04-04
572,gtcmi71,t1_gtcjadv,"Thank you! When I finish the second part I’ll definitely write again, it will be a very special time for me!",t3_mjwhag,2021-04-04 22:36:19,2021-04-04
581,gtcmksx,t1_gtcl5fq,"**Be the chief but never the lord.** *-Lao Tzu*

^(Commands: 'opt out')",t3_mjwhag,2021-04-04 22:37:00,2021-04-04
582,gtcnply,t1_gtcl5fq,Thank you!,t3_mjwhag,2021-04-04 22:47:28,2021-04-04
583,gtco544,t1_gtcndtu,"I have no plans yet 😂
I don’t know anyone there but I heard about a few cities that got my attention like Bologna, Naples, Palermo and Lucca
I think when I get there I’ll try to make some friends, work and travel for a bit before choosing a city to stay!",t3_mjwhag,2021-04-04 22:51:18,2021-04-04
597,gtclran,t1_gtcjljg,"Thank you! But I think it’s a bad idea to depend on someone for it 
Maybe it would be faster but then I would depend on her forever 😂😂",t3_mjwhag,2021-04-04 22:29:24,2021-04-04
599,gtconte,t1_gtcjljg,Yeah but then you are married lol,t3_mjwhag,2021-04-04 22:55:58,2021-04-04
601,gtcmti8,t1_gtck5r2,"Thank you! I’m really surprised by how many italians commented here, I’m really happy because of that. Since I started the citizenship process I always imagined how would be the reactions when I get there because I’ll be Italian but not really. I know some words in Italian because of my grandad and am currently studying to speak well by the time I get there! 
But why do you say that I should go as soon as I can to other european countries?
Thank you again!!",t3_mjwhag,2021-04-04 22:39:14,2021-04-04
608,gtcp5iv,t1_gtcnxfr,"Guy sitting on BTC and collecting unemployment, SMDH",t3_mjwhag,2021-04-04 23:00:20,2021-04-04
609,gtcnocn,t1_gtcjk4h,Thanks so much!,t3_mjwhag,2021-04-04 22:47:09,2021-04-04
610,gtcm45e,t1_gtclhqo,"I’m not holding Euro, I sold and this week I’ll pay my lawyer to start the process! But I’m pretty sure it’s better to hold Euro than Argentinian Pesos 😂😂",t3_mjwhag,2021-04-04 22:32:42,2021-04-04
611,gtcofbc,t1_gtcn2tb,"Thank you!
So my great-grandfather came from Marradi, near Florence but I don’t have any family or friends in Italy anymore
I plan to go there to know where he came from but I don’t know if I’ll stay there! 😂",t3_mjwhag,2021-04-04 22:53:49,2021-04-04
612,gtcm0ce,t1_gtcl5qy,Yes I thought a lot about it but this first part of the process can take 1 year. So the faster I send the papers to the judge to sign the faster I can go to Europe. It’s not only about money but life quality! Thank you,t3_mjwhag,2021-04-04 22:31:42,2021-04-04
613,gtclvb5,t1_gtckt55,Not more money but hopefully a better quality of life! And living and working in Europe gives me a better chance of getting what I want (I hope so),t3_mjwhag,2021-04-04 22:30:23,2021-04-04
617,gtcmjkg,t1_gtcma6b,Stugots! That’s all I know my friend. Congrats though!,t3_mjwhag,2021-04-04 22:36:41,2021-04-04
626,gtcp1l9,t1_gtco544,"Good plan, there are so many amazing places in Italy. What Italy does better than many is gorgeous large towns.",t3_mjwhag,2021-04-04 22:59:22,2021-04-04
638,gtcp20i,t1_gtconte,"In Italy you don't marry a woman, you marry a whole family. Hence the automatic citizenship.",t3_mjwhag,2021-04-04 22:59:28,2021-04-04
642,gtcntuh,t1_gtcmti8,"Because Italy is (and has for a good few decades been) a financial sh*t hole. Oh and forget the UK for work if you become a EU citizen, they just pushed the eject button on their EU membership, although I presume you know this already...",t3_mjwhag,2021-04-04 22:48:31,2021-04-04
651,gtcp6bs,t1_gtclvb5,Maybe you should think about what benefit you can bring to Italy instead of what Italy can do for you.,t3_mjwhag,2021-04-04 23:00:31,2021-04-04
777,gtcls6x,t3_mjw7w5,I comfort myself knowing I would’ve sold or lost these way before 60k was breached.,t3_mjw7w5,2021-04-04 22:29:38,2021-04-04
780,gtcp53h,t3_mjw7w5,"I tried emailing libertystandard ,  offered to buy BTC at the price listed.  Hope it did not change too much.",t3_mjw7w5,2021-04-04 23:00:13,2021-04-04
785,gtcksfw,t3_mjw7w5,Don’t beat yourself up.  I don’t think anyone who bought back then would of still held on to all their BTC until today.  I’m sure would have sold early on IMO.  Still pretty cool to see this though.  😀,t3_mjw7w5,2021-04-04 22:20:11,2021-04-04
788,gtcftog,t3_mjw7w5,"I wonder how many people are kicking themselves today for not spending $10 back when this site was up

*edit: holy sh** nearly a 100+ upvotes. Appreciate it, I'm not the only one hurting 🤣",t3_mjw7w5,2021-04-04 21:28:24,2021-04-04
789,gtclgx5,t3_mjw7w5,I need a time machine!,t3_mjw7w5,2021-04-04 22:26:37,2021-04-04
790,gtcior3,t3_mjw7w5,"Back in my day, I could buy a bag of bitcoins at the local tuck shop... and we thought that was expensive! Crikey...",t3_mjw7w5,2021-04-04 21:59:33,2021-04-04
791,gtcjau5,t3_mjw7w5,Just think if you dollar cost averaged your way in every day on that chart.,t3_mjw7w5,2021-04-04 22:05:44,2021-04-04
796,gtckfys,t3_mjw7w5,I’m fuckign sick,t3_mjw7w5,2021-04-04 22:16:55,2021-04-04
797,gtcfwwo,t3_mjw7w5,That's assuming that the price didn't fractuate for even a second.,t3_mjw7w5,2021-04-04 21:29:22,2021-04-04
807,gtco875,t3_mjw7w5,This makes me nauseous,t3_mjw7w5,2021-04-04 22:52:02,2021-04-04
808,gtcongy,t3_mjw7w5,DYING of FOMO!!,t3_mjw7w5,2021-04-04 22:55:53,2021-04-04
809,gtcoyjv,t3_mjw7w5,"Guys don’t be sad, let’s hodle another coin at this rate and hold for another decade, sure you will be happy.",t3_mjw7w5,2021-04-04 22:58:37,2021-04-04
811,gtchrjf,t3_mjw7w5,[**Image source: Documenting Bitcoin**](https://twitter.com/DocumentingBTC/status/1376991558948556801?s=20),t3_mjw7w5,2021-04-04 21:49:15,2021-04-04
812,gtcnqen,t3_mjw7w5,Imagine spending 5 bucks on here and forgetting about till it hit 20k a few years back.,t3_mjw7w5,2021-04-04 22:47:40,2021-04-04
814,gtcmvk7,t3_mjw7w5,Oh man..!!..time machine ..please..,t3_mjw7w5,2021-04-04 22:39:47,2021-04-04
815,gtcoaas,t3_mjw7w5,I cried when I read this. Does anyone have a time machine,t3_mjw7w5,2021-04-04 22:52:33,2021-04-04
821,gtcke2p,t3_mjw7w5,The third week on January 2009 I came across a small article talking about bitcoin. I’m one of the first humans to know about it.,t3_mjw7w5,2021-04-04 22:16:25,2021-04-04
822,gtcnynl,t3_mjw7w5,Ah those were the days.,t3_mjw7w5,2021-04-04 22:49:41,2021-04-04
823,gtcojjm,t3_mjw7w5,I wish someone put me to understanding Bitcoin a long time Ago.,t3_mjw7w5,2021-04-04 22:54:52,2021-04-04
882,gtcomkt,t3_mjw7w5,Just open coinbase today and take a screenshort. 10 years later yiu can say again the same. 10$ bought today would be a 100 mill 10 years from today nothing changed,t3_mjw7w5,2021-04-04 22:55:39,2021-04-04
884,gtcoorz,t3_mjw7w5,"I want to buy all of them at once.. at the rate published... lol 😂 in fact I will pay instead of $1, as a bonus, I’ll pay $1000 for each lot",t3_mjw7w5,2021-04-04 22:56:12,2021-04-04
915,gtcgai8,t1_gtcftog,I am so bad. I was so intrigued. I’m kicking myself in the ass big time,t3_mjw7w5,2021-04-04 21:33:26,2021-04-04
916,gtcowoj,t1_gtcftog,"+1 over here. Still remember my conversation with my friend while browsing the darkweb for fun and seeing those BTC beeing used to hire killers. 

Regretting to this day.",t3_mjw7w5,2021-04-04 22:58:10,2021-04-04
926,gtcgi29,t1_gtcfwwo,Reality is at the time the price didn't fluctuate as much. It was the very very early days,t3_mjw7w5,2021-04-04 21:35:31,2021-04-04
966,gtcp25n,t1_gtcowoj,Where time machine,t3_mjw7w5,2021-04-04 22:59:30,2021-04-04
1163,gtb8pp3,t3_mjlr6h,Once Tesla bought in and the announcement of Bitcoin ETFs. All my anxieties went away and I continue to plow in huge amounts of money every dip.,t3_mjlr6h,2021-04-04 11:11:46,2021-04-04
1164,gtawzzy,t3_mjlr6h,"it’s not becoming numb, it’s realizing you’re playing the long game. The daily/weekly/monthly fluctuations begin to not matter.
It really is a learning curve tho.",t3_mjlr6h,2021-04-04 09:12:51,2021-04-04
1165,gtb1o6r,t3_mjlr6h,"""I have become comfortably numb.""",t3_mjlr6h,2021-04-04 09:59:42,2021-04-04
1166,gtb2meh,t3_mjlr6h,"Becoming numb like you have happens over time because the price goes up over longer periods and solidifies in certain regions.

You were probably waking up a lot and over thinking it when you bought in because the pice hovered around your buy-in.

Now that time has passed, your buy-in price is (hopefully) long surpassed and there isn’t much risk of it dropping back to those lows again.

It’s also a bull market, everyone sleeps easier and is more positive when there are new highs and price discovery phases.",t3_mjlr6h,2021-04-04 10:09:21,2021-04-04
1167,gtbqdaf,t3_mjlr6h,"1. Set limit buy orders at 5% less than current price. 
2. Set to buy more at 10% less.
3. Buy Bitcoin in your sleep.
4. Profit.",t3_mjlr6h,2021-04-04 15:02:27,2021-04-04
1168,gtb1o5x,t3_mjlr6h,"Agreed. Up, down, doesn’t matter. Make my normal weekly buys and chill. Long term investing helps take the short term focus out of price movements. I admit I still look once or twice a day tho!",t3_mjlr6h,2021-04-04 09:59:41,2021-04-04
1169,gtbc03w,t3_mjlr6h,"When this started happening to me I thought I was losing interest, and got worried because I lose interest easily, then I realized I was just gaining patience.",t3_mjlr6h,2021-04-04 11:47:04,2021-04-04
1170,gtb2oym,t3_mjlr6h,"Personally, I love it when the market makes big moves. I don't care if it's up or down, I'm using Nicehash to mine ETH and getting paid in BTC. When the market's making moves, I get paid a lot more, since people are buying and selling more ETH which means more gas fees. Made 46,000 SAT today mining, a new all time high. Good stuff.",t3_mjlr6h,2021-04-04 10:10:05,2021-04-04
1171,gtb3c1u,t3_mjlr6h,i literally forget i’ve thrown half my yearly salary into this stuff,t3_mjlr6h,2021-04-04 10:16:37,2021-04-04
1172,gtbf3h5,t3_mjlr6h,"I bought back in 2019 I'm looking at 57 like ""damn bitcoin you cray!!""",t3_mjlr6h,2021-04-04 12:23:22,2021-04-04
1173,gtbyqby,t3_mjlr6h,"Having my net worth swing up and down $10,000s by the hour doesn't even make me flinch anymore, I love it.",t3_mjlr6h,2021-04-04 17:23:14,2021-04-04
1174,gtb0dzb,t3_mjlr6h,Who else is drunk on a Saturday night rn reading this sorta hype? Let’s make some poor/possibly great decisions but stay safe out there fam,t3_mjlr6h,2021-04-04 09:46:51,2021-04-04
1175,gtazcro,t3_mjlr6h,This is the way.,t3_mjlr6h,2021-04-04 09:36:34,2021-04-04
1176,gtayg1f,t3_mjlr6h,This is the way-,t3_mjlr6h,2021-04-04 09:27:26,2021-04-04
1177,gtbaxjd,t3_mjlr6h,"Like honestly we know it'll go up, so why sell when it starts to go down?",t3_mjlr6h,2021-04-04 11:35:07,2021-04-04
1178,gtbju2l,t3_mjlr6h,"I became number after I experienced my first crash. Research and logic showed that it was bound to happen and that the rebound is always bigger each time, so once I had this realization, I immediately stopped worrying about it. 

I have noticed that when the price is low, I rarely check my portfolio. Sometimes I don't know it's on the move until I see threads or news articles about it. Then when the price is high, I noticed that I'm checking my portfolio 1-10 times per day. Not because I'm anxious about the price, but because it's exciting to see it move up.",t3_mjlr6h,2021-04-04 13:24:56,2021-04-04
1179,gtblus0,t3_mjlr6h,Hodl & numb,t3_mjlr6h,2021-04-04 13:53:30,2021-04-04
1180,gtbmimv,t3_mjlr6h,It's really easy to be numb to Bitcoin price when you understand the difference between Bitcoin's scarcity and inflationary money/assets https://storeoftime.com,t3_mjlr6h,2021-04-04 14:03:13,2021-04-04
1181,gtbzid2,t3_mjlr6h,"I check the state of BTC from the title of posts on subreddits I follow.

I buy weekly no matter the price, automated, since 2014.

I'll reevaluate in 2025!",t3_mjlr6h,2021-04-04 17:36:42,2021-04-04
1182,gtb5o3q,t3_mjlr6h,HODL,t3_mjlr6h,2021-04-04 10:40:32,2021-04-04
1183,gtb7qjj,t3_mjlr6h,If you can buy the dip you can buy the now. Buy now !,t3_mjlr6h,2021-04-04 11:01:39,2021-04-04
1184,gtb8mpg,t3_mjlr6h,"It was a great day, the first time I smiled when I saw a correction",t3_mjlr6h,2021-04-04 11:10:58,2021-04-04
1185,gtc0l4e,t3_mjlr6h,I eat red candles for breakfast.,t3_mjlr6h,2021-04-04 17:55:19,2021-04-04
1186,gtb0i5s,t3_mjlr6h,This is the way.. I bought more BTC from the profit I made from BCH this week.. I see all such dips opportunity.. The time is far gone when people used to say there is no future it BTC or crypto..,t3_mjlr6h,2021-04-04 09:47:58,2021-04-04
1187,gtb1cq3,t3_mjlr6h,To sum it up... Bitcoin breathes and so should you.,t3_mjlr6h,2021-04-04 09:56:27,2021-04-04
1188,gtbhjls,t3_mjlr6h,Truth. I only pay attention to price to pick up a sale if I can. The price means absolutely nothing for years. It's just a matter of how much we can  accumulate in that time. That is my only concern.,t3_mjlr6h,2021-04-04 12:54:09,2021-04-04
1189,gtbif4o,t3_mjlr6h,"I’ve become so numb, I can’t feel you there",t3_mjlr6h,2021-04-04 13:05:34,2021-04-04
1190,gtbmsnv,t3_mjlr6h,Great post. I put aside what I can afford each week. If There’s dip of 10% + I buy more. It just feels like I’m making some decisions. It may not matter much in the long run but fuck it I feel some control. one day it’s going to buy me a plot of land in Costa Rica and I’m going to build a house and surf every day.,t3_mjlr6h,2021-04-04 14:07:20,2021-04-04
1191,gtbnefn,t3_mjlr6h,Spoken like a true Hodler. Welcome!,t3_mjlr6h,2021-04-04 14:16:34,2021-04-04
1192,gtbp3js,t3_mjlr6h,This is the way,t3_mjlr6h,2021-04-04 14:42:35,2021-04-04
1193,gtbs485,t3_mjlr6h,Bingo. Bango. Bongo.,t3_mjlr6h,2021-04-04 15:31:03,2021-04-04
1194,gtbv89q,t3_mjlr6h,"$100,000 will look cheap very soon",t3_mjlr6h,2021-04-04 16:23:12,2021-04-04
1197,gtb8cb3,t3_mjlr6h,Alexa play Numb by Linkin Park,t3_mjlr6h,2021-04-04 11:08:01,2021-04-04
1198,gtbfj1g,t3_mjlr6h,"Never check the markets before bed. Never check them first thing in the morning. Ever. It's terrible for your mental health, and is not beneficial to your holdings. 

Check in the middle of the day, set some limit buys or sells, and log off.",t3_mjlr6h,2021-04-04 12:28:37,2021-04-04
1199,gtb0web,t3_mjlr6h,Same way. I mine it and don’t look. I might check once a month.,t3_mjlr6h,2021-04-04 09:51:52,2021-04-04
1200,gtb5bel,t3_mjlr6h,i approve this,t3_mjlr6h,2021-04-04 10:36:53,2021-04-04
1201,gtb6vpz,t3_mjlr6h,"Best Advice:
https://www.youtube.com/watch?v=0akBdQa55b4",t3_mjlr6h,2021-04-04 10:52:51,2021-04-04
1202,gtb9t7q,t3_mjlr6h,"Bitcoin is delish, numb numb numb",t3_mjlr6h,2021-04-04 11:23:01,2021-04-04
1203,gtbaifs,t3_mjlr6h,"yee, stack em",t3_mjlr6h,2021-04-04 11:30:34,2021-04-04
1204,gtbc5it,t3_mjlr6h,This is the way.,t3_mjlr6h,2021-04-04 11:48:46,2021-04-04
1205,gtbcquf,t3_mjlr6h,This is the way,t3_mjlr6h,2021-04-04 11:55:38,2021-04-04
1206,gtbdiwj,t3_mjlr6h,Great advice thank you.,t3_mjlr6h,2021-04-04 12:04:38,2021-04-04
1207,gtbdqpj,t3_mjlr6h,"Great advice, I’m new to BTC and planning to be a very long term holder, but still check it all the time.  Does cause anxiety!",t3_mjlr6h,2021-04-04 12:07:12,2021-04-04
1208,gtbgsn2,t3_mjlr6h,True and same,t3_mjlr6h,2021-04-04 12:44:31,2021-04-04
1209,gtbisq4,t3_mjlr6h,I actually have alerts set for 50% drop. The drops make me so happy,t3_mjlr6h,2021-04-04 13:10:43,2021-04-04
1210,gtbjmu8,t3_mjlr6h,I wonder if the majority of the volitility in Bitcoin's history is behind us.,t3_mjlr6h,2021-04-04 13:22:11,2021-04-04
1211,gtbkdwp,t3_mjlr6h,"Long time holder, i dont even care anymore. It does what it wants.",t3_mjlr6h,2021-04-04 13:32:32,2021-04-04
1212,gtbkuzq,t3_mjlr6h,"Knowing that you win both ways makes it easier on your brain when facing the red days. 

Diamond hands and hodl till you die my friend",t3_mjlr6h,2021-04-04 13:39:12,2021-04-04
1213,gtbmber,t3_mjlr6h,I’ve been numb for 10 years 🤙,t3_mjlr6h,2021-04-04 14:00:21,2021-04-04
1214,gtbna82,t3_mjlr6h,"Same for me. Back in 2019 i hop into the crypto space, i remember i was so excited about charts and ta and literally spent days watching the price, making the most trivial mistakes you could make as a noob managing a position. I did survive the 2020 match crash, and short after that i made the best decision so far: BUY ALL IN  and stop worring about fluctuactions. Now i can manage my position with much more tranquility and the fluctuactions doesn't bother me anymore, Instead every retracement is a Blessing from the lord! 
[Blessing ](https://i.imgur.com/lNZFu4b.jpg)",t3_mjlr6h,2021-04-04 14:14:45,2021-04-04
1215,gtbnnja,t3_mjlr6h,I feel ya,t3_mjlr6h,2021-04-04 14:20:19,2021-04-04
1216,gtbob4u,t3_mjlr6h,"I’ve lost several year salary the last 2 weeks
I’m numb to it",t3_mjlr6h,2021-04-04 14:30:21,2021-04-04
1217,gtbq2ha,t3_mjlr6h,Truth. This can also be applied to other aspects of life with great results.,t3_mjlr6h,2021-04-04 14:57:46,2021-04-04
1218,gtbsij3,t3_mjlr6h,"At this point I really don’t care about the price, i will wait till next year. If it goes up, great. If it goes down, adios. I can’t take the anxiety of price fluctuations anymore.",t3_mjlr6h,2021-04-04 15:37:32,2021-04-04
1219,gtbsjbh,t3_mjlr6h,OMG! bitcoin dropped 1000 dollars! Sell sell sell. Nope.,t3_mjlr6h,2021-04-04 15:37:53,2021-04-04
1220,gtbt2t3,t3_mjlr6h,Hodler,t3_mjlr6h,2021-04-04 15:46:49,2021-04-04
1221,gtbw7er,t3_mjlr6h,"Woke up this evening. Look at computer screen. BTC down $3,000. ""Eh, whatever.""",t3_mjlr6h,2021-04-04 16:39:41,2021-04-04
1222,gtbw9ci,t3_mjlr6h,"As Above, so below 
The Sell high, we buy low 

Am numb to all, if red I buy if green I wait to buy",t3_mjlr6h,2021-04-04 16:40:37,2021-04-04
1223,gtbx36g,t3_mjlr6h,"I have about 5 coins I follow - BTC, ETH, ADA, ALGO, and DOT.

I never sell any of them.

At paycheck day, I check a few days before and after, and if anything seems underpriced, I buy it.

I also constantly mine ETH and convert into btc.",t3_mjlr6h,2021-04-04 16:54:39,2021-04-04
1224,gtc0fdc,t3_mjlr6h,"This is an interesting psychological analysis.  This is how I now feel about bitcoin.  It took awhile and I still check the price quite often.  But I just don't care anymore.    
I've been investing in the stock market for 30 years.  I've made a lot of mistakes.  Missed out on a lot of things.  Not this time.   
If I go broke, well then OK.  No problem.  I've lost a lot of money on other stupid stuff.    
I believe in Bitcoin, so I'll be all in...DCA.  Never sell.",t3_mjlr6h,2021-04-04 17:52:34,2021-04-04
1225,gtc1kmx,t3_mjlr6h,This is The Way.,t3_mjlr6h,2021-04-04 18:12:03,2021-04-04
1226,gtc1qij,t3_mjlr6h,"If you've bought at a low price you don't have much to worry about. 

This is me",t3_mjlr6h,2021-04-04 18:14:42,2021-04-04
1227,gtc3i4i,t3_mjlr6h,This is the way,t3_mjlr6h,2021-04-04 18:43:56,2021-04-04
1228,gtc4e2m,t3_mjlr6h,The exchanges must love you.,t3_mjlr6h,2021-04-04 18:58:18,2021-04-04
1229,gtc7155,t3_mjlr6h,"I would not say I'd be happy if it dropped. We want it to go up, not just for gains but it also represents mass adoption and maturity for the asset as well as people taking it seriously. 

Future is Here.",t3_mjlr6h,2021-04-04 19:38:42,2021-04-04
1230,gtc7ggb,t3_mjlr6h,"""So how's your BTC investing turning out to be?"".   
- ""I have no fucking idea"" is the correct answer to keep your sanity long term. Which your BTC investment outlook should be.",t3_mjlr6h,2021-04-04 19:44:52,2021-04-04
