,comment_id,comment_parent_id,comment_body,comment_link_id,created,date
86,grg8zjz,t3_m89qlp,We should all be thankful that we are so early into the most groundbreaking idea of the century. The future global currency of the world.,t3_m89qlp,2021-03-19 13:26:04,2021-03-19
87,grhdive,t3_m89qlp,"Gonna go to the bank today and cash 6-7 bonds I’ve been holding since 2005, and they’re all going to be turned into BTC. After the latest stimulus check, I thought it’s probably the safest option.",t3_m89qlp,2021-03-19 22:20:21,2021-03-19
88,grhi4k3,t3_m89qlp,"That's it, nice and steady, nothing too dramatic, good Bitcoin.",t3_m89qlp,2021-03-19 22:57:03,2021-03-19
89,grgchlp,t3_m89qlp,Im ready for BTC to take over.,t3_m89qlp,2021-03-19 14:14:25,2021-03-19
91,grg7ucf,t3_m89qlp,btc would literally be at 75k if it wasnt for the nasdaq taking a shit every other day. Always trying to moon at night and falling on market open,t3_m89qlp,2021-03-19 13:11:19,2021-03-19
93,grgzqla,t3_m89qlp,"Supply shock incoming.
Insatiable institutional demand in play.
Retail investor FOMO to follow. 
This will be one for the ages",t3_m89qlp,2021-03-19 20:11:12,2021-03-19
94,grh0x08,t3_m89qlp,59k again - slow and steady as she goes 🤠🤠🤠,t3_m89qlp,2021-03-19 20:24:13,2021-03-19
97,grgkxvy,t3_m89qlp,On a serious note thank you Bitcoin Reddit for getting me through shit nights at my shit job,t3_m89qlp,2021-03-19 16:26:12,2021-03-19
100,grgk10f,t3_m89qlp,I've done my watch. Please dont dump when I sleep.,t3_m89qlp,2021-03-19 16:10:37,2021-03-19
101,grgtp0k,t3_m89qlp,"Can someone explain to me the ridiculous interest blockfi is paying for stablecoin accounts? 8.6% for stablecoins is on par to the best index fund, with the added benefit of flexibility and no volatility. Shouldn't I just get all my money from bank savings to leave on  blockfi as stablecoins to earn interest DAILY?",t3_m89qlp,2021-03-19 18:53:48,2021-03-19
105,grgn08v,t3_m89qlp,"Does anyone earn interest on their bitcoin? I looked at Blockfi, 8.6% is attractive, what is the downside? Thanks",t3_m89qlp,2021-03-19 17:02:17,2021-03-19
106,grh4yt9,t3_m89qlp,"You’ll need $93 million to move bitcoin’s price by 1%. 

Hopeful that dumpers are losing their grip on the pricing by the day.

https://www.bloomberg.com/news/articles/2021-03-18/have-93-million-you-may-be-able-to-boost-bitcoin-s-price-by-1",t3_m89qlp,2021-03-19 21:05:31,2021-03-19
117,grgn41z,t3_m89qlp,"Can someone fill me in on what happened with the Yahoo Finance price discrepancy yesterday?   

What happened there?",t3_m89qlp,2021-03-19 17:04:13,2021-03-19
118,grgzfby,t3_m89qlp,Let hit $60k today and make it the floor.,t3_m89qlp,2021-03-19 20:07:39,2021-03-19
119,grgzglf,t3_m89qlp,You’re early! Bitcoin is the best thing that has ever happened to me,t3_m89qlp,2021-03-19 20:08:04,2021-03-19
120,grh94d1,t3_m89qlp,Lord please grant me the strength to resist temptation to buy more when I already bought four days ago!,t3_m89qlp,2021-03-19 21:43:27,2021-03-19
121,grhb0sm,t3_m89qlp,Time to buy some corn!🌽,t3_m89qlp,2021-03-19 21:59:26,2021-03-19
129,grgfgq3,t3_m89qlp,"NFTs are a joke and when that bubble pops the media will FUD hard, I hope the fallout doesn't affect us",t3_m89qlp,2021-03-19 14:58:22,2021-03-19
130,grgeyqb,t3_m89qlp,"Really annoyed coronavirus stopped me getting a pay rise this year, just a little pay increase and I'd be in such a good place to buy more. This economy just hates savers",t3_m89qlp,2021-03-19 14:50:52,2021-03-19
131,grgkrex,t3_m89qlp,Feels like whales fighting whales over whether 58k holds,t3_m89qlp,2021-03-19 16:23:06,2021-03-19
132,grgo192,t3_m89qlp,Mid-day mini pump ! Like it!,t3_m89qlp,2021-03-19 17:20:24,2021-03-19
133,grh73dl,t3_m89qlp,I just went thru all my emails of various small things ive purchased with BTC over the last 3 years..  came out to be worth 5 figures now. Ughh lol,t3_m89qlp,2021-03-19 21:25:31,2021-03-19
134,grhhj3q,t3_m89qlp,Under 60k on payday 😍🤑yessir,t3_m89qlp,2021-03-19 22:52:26,2021-03-19
148,grglvgg,t3_m89qlp,Decided that my wife gets a laser treatment for her eyes worth €2K. Wanted to buy more sats actually but health is also important.,t3_m89qlp,2021-03-19 16:42:24,2021-03-19
150,grg76u7,t3_m89qlp,Other than the 1.5% fee difference is there any reason why GBTC is trading at a discount and OBTC is trading at a premium? The difference is well over 10% seems kind of extreme for 1.5% in fees?,t3_m89qlp,2021-03-19 13:03:06,2021-03-19
151,grg7q8k,t3_m89qlp,"Ready to buy this weekend, early Monday morning.",t3_m89qlp,2021-03-19 13:09:54,2021-03-19
152,grgyz64,t3_m89qlp,"Dig up you idiots, 59 rush appears to be incoming",t3_m89qlp,2021-03-19 20:02:21,2021-03-19
153,grgzllt,t3_m89qlp,"I'm a newbie, but what strategy do most people use. Sell when high and buy when it dips? Hodl and only buy when it dips? I have rookie numbers, but I'd love to pump those numbers up",t3_m89qlp,2021-03-19 20:09:39,2021-03-19
154,grh07v1,t3_m89qlp,"Relatively still new to this. I see posts from people slagging fiat, which I sympathize with, but I’m confused about the endgame those posters envision. 

I would never use BTC to buy groceries today. I could spend 20 worth today that could be 30 worth tomorrow. Is the idea and hope that crypto will surpass fiat and at that point it will stabilize? I guess the fluctuation now is because it’s being compared to fiat, but it fiat ever goes, how does society all of the sudden decide how much BTC everything costs?

Pardon me if my question indicates kindergarten levels of economic understanding. I’d be really grateful for even just links to information that relates to this question. Thanks!",t3_m89qlp,2021-03-19 20:16:36,2021-03-19
155,grh9n9e,t3_m89qlp,"sigh, bitcoin following the mood of the nasdaq again lol.",t3_m89qlp,2021-03-19 21:47:56,2021-03-19
156,grhgvnp,t3_m89qlp,100k is programmed.. hold spot and you will be fine!,t3_m89qlp,2021-03-19 22:47:18,2021-03-19
157,grhhd5g,t3_m89qlp,"Analysis: Bitcoin Price Could Top $250,000 According to an Important Indicator - CryptoPotato via BTCnews on iOS  https://cryptopotato.com/analysis-bitcoin-price-could-top-250000-according-to-an-important-indicator/

Opinions?",t3_m89qlp,2021-03-19 22:51:08,2021-03-19
169,grgdh5z,t3_m89qlp,Who wants to bet BTC $69k on 4/20?,t3_m89qlp,2021-03-19 14:28:42,2021-03-19
170,grh5eos,t3_m89qlp,I’m telling you...my penis grows just a little bit longer with every satoshi I buy. I’m finally up to an inch and 3/4.,t3_m89qlp,2021-03-19 21:09:44,2021-03-19
174,grga5m0,t3_m89qlp,94k soon ?,t3_m89qlp,2021-03-19 13:41:43,2021-03-19
175,grgeoxp,t3_m89qlp,"So I set up a buy order before going to bed with some more cash I had deposited, just in case it dropped during my beauty sleep.... nope it was a sell order as I was too tired setting it to max and of course it went instantly. Live and learn.

P.s. Istarting to wonder if I'm becoming colour blind.",t3_m89qlp,2021-03-19 14:46:45,2021-03-19
176,grgk4ay,t3_m89qlp,Bitcoin's getting some great buy volume now!,t3_m89qlp,2021-03-19 16:12:09,2021-03-19
177,grgp2oo,t3_m89qlp,Anyone keep seeing $400 jumps back and forth?,t3_m89qlp,2021-03-19 17:38:35,2021-03-19
178,grh1m8y,t3_m89qlp,It’s Friday!,t3_m89qlp,2021-03-19 20:31:49,2021-03-19
193,grg98a1,t3_m89qlp,Bitcoin is the most solid technology that I've ever come across.,t3_m89qlp,2021-03-19 13:29:17,2021-03-19
194,grgweg8,t3_m89qlp,Few years ago i was betting with my brother that you can pay with BTC in the future. He bet 1000€. This weekend i will show him the Visa news.  And the 1k going directly into BTC 🤤,t3_m89qlp,2021-03-19 19:30:48,2021-03-19
195,grh0ka8,t3_m89qlp,"For any newbies; let those who sold at 56.5 yesterday serve as a lesson, learn from your mistakes or learn from the mistakes of others. Either way hold until you absolutely need the money... and then go sell some blood and continue holding.",t3_m89qlp,2021-03-19 20:20:22,2021-03-19
196,grh0v5f,t3_m89qlp,Fiat is the real shitcoin!,t3_m89qlp,2021-03-19 20:23:39,2021-03-19
199,grg86t0,t3_m89qlp,"Bitcoin will rise exponentially based on factors like 
-Inflation (fuck the fed)
-Golds decline (fuck shiff)
-Saylor says so (God)
-Bond markets are down (whats new)
-no other asset is better then BTC (obvious)
- Wall st has fomo (buy more btc hurry)
pc and prosper",t3_m89qlp,2021-03-19 13:15:45,2021-03-19
200,grgdvmy,t3_m89qlp,"Мoves a million Satoshis to cold storage 
-*whale alert!*",t3_m89qlp,2021-03-19 14:34:37,2021-03-19
203,grggfa9,t3_m89qlp,2030 ill be referred to as a bitcoinologist,t3_m89qlp,2021-03-19 15:12:58,2021-03-19
204,grh615d,t3_m89qlp,"As a family we've got cash in the bank which we treat it as safe cushion (around 6 month worth of living expenses). 

I am seriously considering converting all (or at least 5 months) to a stable coin (TrueGBP maybe) and then put that into Celcius/Blockfi/Crypto (to diversify and lower risk). 

With interests rates above 10%, it seems like a waste living that sitting in the bank. 

Besides the 'not your keys not your coins, they will hack it, etc' are there any other risks I should be aware?",t3_m89qlp,2021-03-19 21:15:39,2021-03-19
208,grg8526,t3_m89qlp,Where can I find the cheapest fees for purchasing Bitcoin?,t3_m89qlp,2021-03-19 13:15:07,2021-03-19
209,grgdz0a,t3_m89qlp,🦀 IYKYK,t3_m89qlp,2021-03-19 14:35:59,2021-03-19
210,grgz9i3,t3_m89qlp,rocket!,t3_m89qlp,2021-03-19 20:05:45,2021-03-19
211,grgzhlp,t3_m89qlp,Having Deja vu from a similar spike past 59k yesterday,t3_m89qlp,2021-03-19 20:08:23,2021-03-19
212,grhapr4,t3_m89qlp,The keep dangling this carrot https://www.bloomberg.com/news/articles/2021-03-19/fortress-said-to-offer-earlier-payout-on-mt-gox-creditor-claims,t3_m89qlp,2021-03-19 21:56:52,2021-03-19
213,grhd9q9,t3_m89qlp,Starting to get fucked off with the £300 buy limit on CB 👍,t3_m89qlp,2021-03-19 22:18:16,2021-03-19
221,grgaiq3,t3_m89qlp,For kryptonite there's Superman. For bitcoin there's people like myself.,t3_m89qlp,2021-03-19 13:46:42,2021-03-19
223,grgonds,t3_m89qlp,"People who are invested in POS coins will attack proof of work coins. 

They will do it by proposing ban on proof of work. 

Think again when you spread fud against NFTs, because NFT owners that are on POS chains will have all the incentive to spread FUD against bitcoin. 

This is beyond some ICO bullshit, sentimental value is real, we know it. Network effects are the only thing that matters. They give bitcoin value.

You want people to be emotionally invested in assets that are on bitcoin.",t3_m89qlp,2021-03-19 17:31:06,2021-03-19
224,grg9n96,t3_m89qlp,A friend said in his country he will have to pay around 15% of profit in taxes.. U think exchanges fees are high but thats a cut,t3_m89qlp,2021-03-19 13:34:49,2021-03-19
225,grgmh3q,t3_m89qlp,I want to buy for 30k. Should I wait or buy know?,t3_m89qlp,2021-03-19 16:52:56,2021-03-19
226,grgyiof,t3_m89qlp,How's BTC doing today?,t3_m89qlp,2021-03-19 19:56:55,2021-03-19
227,grh2e5y,t3_m89qlp,Questions: if you and and your kids have wallets can you transfer BTC to them without reporting requirements/taxes. If you use BTC to buy a Tesla is it considered a sell of BTC?,t3_m89qlp,2021-03-19 20:39:52,2021-03-19
228,grh8egy,t3_m89qlp,"Was reading some random articles, and came across this:  
 

>**Could Satoshi Become the Richest Man in the World?**  
>  
>BTC would need to hit a market value of $60,000 per coin to make Nakamoto the richest man in the world. Currently, he doesn’t even rank in the top 1000 richest people according to Forbes “[Richest People](https://www.forbes.com/billionaires/list/)” rankings.

[https://coincentral.com/how-rich-is-satoshi-nakamoto-today/](https://coincentral.com/how-rich-is-satoshi-nakamoto-today/)  


Of course the goalpost has shifted, but the author definitely did not think BTC would hit $60,000...",t3_m89qlp,2021-03-19 21:37:14,2021-03-19
229,grhfnnh,t3_m89qlp,"Just curious what is everyone's ""goal"" amount of bitcoin to hold over time? 1 full coin? Half a coin? I am slowly trying to stack some sats every week for the past month.",t3_m89qlp,2021-03-19 22:37:32,2021-03-19
230,grhgl13,t3_m89qlp,"Really confused on whether I should by now, or wait for a better price",t3_m89qlp,2021-03-19 22:44:58,2021-03-19
234,grg9ski,t3_m89qlp,"Been an interesting couple of days. I watch the candles for fun sometimes, I don’t let it affect my investing decision though. I don’t swing trade and only practice DCA’ing and the art of HODL. It hasn’t let me down yet. Not like my wife’s boyfriend did when he peed in my butt last night.",t3_m89qlp,2021-03-19 13:36:48,2021-03-19
235,grgnno9,t3_m89qlp,Bitcoin is about to blast up to ATH today,t3_m89qlp,2021-03-19 17:13:46,2021-03-19
239,grgahdl,t3_m89qlp,Does anyone have any more recent resources that you’d recommend researching to learn the basics of trying out mining at home?,t3_m89qlp,2021-03-19 13:46:13,2021-03-19
240,grh1ff4,t3_m89qlp,Dick hard,t3_m89qlp,2021-03-19 20:29:45,2021-03-19
241,grh2vu3,t3_m89qlp,"Maybe this is an odd question, but how would institutional investors navigate the possible(this time different^tm) bear years after this bull cycle?

I think the reason institutes are joining in is that this bull run proves the corn shows a reliable cyclical pattern following halvings, and they know another one is coming in ~4 years, but how do they factor in the bear years in between the bull run peaks?

I expect they will be holding though it all, but is there some sort of (tax) advantage for them having their btc reserves at low value for a few years? Would they plan on casing out next run? Do they just accept the bear years without any specific strategy?

Undoubtedly these questions come up in gigachad board rooms but i've never seen any interpretation on their strategies. Would be a lot cooler if there were",t3_m89qlp,2021-03-19 20:44:49,2021-03-19
243,grh51ff,t3_m89qlp,My girlfriend and I are buying some today,t3_m89qlp,2021-03-19 21:06:13,2021-03-19
249,grhh94m,t3_m89qlp,"Dear US government,

Please confiscate the domestic real estate property of even one Chinese human rights violator so all the rest will move their holdings to BTC.

Skinning prisoners and displaying their bodies in a traveling museum exhibit is nearly as bad as when a black man sells a whole marijuana and should be punished just as severely.

Love,

A. Hodler, Esq.",t3_m89qlp,2021-03-19 22:50:15,2021-03-19
251,grh1mhr,t3_m89qlp,"https://www.tradingview.com/x/oa2VhnKm

Let's go!",t3_m89qlp,2021-03-19 20:31:53,2021-03-19
252,grh9vri,t3_m89qlp,I have a coinbase pro and the ledger nano s.  I was able to move my bitcoin to the ledger nano but the fees were high.  I was thinking if I am going to do cold storage I thought maybe I would buy bitcoin through ledger s on coinfly. However went to go buy and said I am not able to buy because I am in the state of GA in the USA. Is this right what is the point of the ledger if I can't buy directly into it.  Amy ideas to get bitcoin in my ledger nano without paying over a 100 in fees?  I only transferred about 700.00  dollars.  Crazy,t3_m89qlp,2021-03-19 21:49:56,2021-03-19
260,grgr4r8,t3_m89qlp,"I'm looking to get back into crypto investing again. I believe in the future of cryptocurrency, but not necessarily bitcoin. Why should a consumer use bitcoin? Last time I used it, transactions took hours and started to became costly. Isn't that increasing even more?",t3_m89qlp,2021-03-19 18:13:35,2021-03-19
261,grg7rqn,t3_m89qlp,Poip,t3_m89qlp,2021-03-19 13:10:25,2021-03-19
262,grgmdh1,t3_m89qlp,could NFT's theoretically work on the bitcoin blockchain?,t3_m89qlp,2021-03-19 16:51:10,2021-03-19
265,grg94lh,t3_m89qlp,"Is there any site where only news about bitcoin and crypto are collected and kept up to date?

I mean apart from here. Here it's a lot of work to sift through all the individual threads that come from private entities. I want an easier overview about reaction from governments and generally large entities.

**EDIT:** I mean up to now I still don't know if India has really banned Bitcoin or if they have deliberately left so man loopholes that it is effectively not banned at all. It's a little difficult to get a reliable overview.",t3_m89qlp,2021-03-19 13:27:56,2021-03-19
266,grgqetl,t3_m89qlp,[removed],t3_m89qlp,2021-03-19 18:01:35,2021-03-19
267,grgt5gf,t3_m89qlp,Can I have your suggestions for bitcoin podcasts and audiobooks,t3_m89qlp,2021-03-19 18:45:43,2021-03-19
275,grgb3nr,t1_grg8zjz,I feel so blessed to be born at this point in history with the knowledge and ability to stack some fuckin sats,t3_m89qlp,2021-03-19 13:54:45,2021-03-19
276,grgikxw,t1_grg8zjz,Unreal. I have this fire raging inside of me because I’ve finally realized how genuinely profound bitcoin is and that I get to be a part of it. It’s hard to describe.,t3_m89qlp,2021-03-19 15:46:54,2021-03-19
277,grgqb36,t1_grg8zjz,"I'm so excited that i'm shouting ""bitcoin, decentralisation"" instead of ""Oh, Ah"" when I'm coming!",t3_m89qlp,2021-03-19 17:59:48,2021-03-19
280,grgdhwb,t1_grgchlp,"Considering how many people simp for btc, I'm gonna name my first born child bitcoin, whether boy or girl.",t3_m89qlp,2021-03-19 14:29:00,2021-03-19
281,grg92z6,t1_grg7ucf,Indeed. Perhaps it’s too early to call it an uncorrelated asset. The degree to which it is correlated to market activity seems to be declining though.,t3_m89qlp,2021-03-19 13:27:21,2021-03-19
285,grh1wsf,t1_grgzqla,Institutional FOMO incoming I’d say...,t3_m89qlp,2021-03-19 20:34:52,2021-03-19
291,grglavn,t1_grgkxvy,Night shift gang. The best dips exist on nights.,t3_m89qlp,2021-03-19 16:32:31,2021-03-19
292,grgmbux,t1_grgkxvy,That what we're here for,t3_m89qlp,2021-03-19 16:50:21,2021-03-19
293,grgpntu,t1_grgkxvy,"Eye on the prize, BoujeePleb. Stay focused, be kind to yourself and internalize all situations - including your shit ones - are temporary. And that you are in control. In the meantime, keep stacking those sats.",t3_m89qlp,2021-03-19 17:48:47,2021-03-19
295,grgy7sc,t1_grgtp0k,The person borrowing your stablecoin is paying more than 8.6% interest. As simple as that really.,t3_m89qlp,2021-03-19 19:53:21,2021-03-19
296,grgtztx,t1_grgtp0k,Thats the price they pay to have liquidity because they are not an FDIC insured account.,t3_m89qlp,2021-03-19 18:58:11,2021-03-19
297,grgz653,t1_grgtp0k,"Not insured and they are not as well capitalized as banks, they need the fiat-backing to provide stablecoin liquidity to their clients.",t3_m89qlp,2021-03-19 20:04:39,2021-03-19
298,grgxjki,t1_grgtp0k,"Believe it or not, BlockFi is actually among the *lower* interest rate providers paid for stablecoins, though it is the best for Bitcoin interest. Celsius for example, offers 10.5% like-for-like interest on USDC, and a whopping 13.3% if you take the interest in their native token. Nexo offers similar.",t3_m89qlp,2021-03-19 19:45:15,2021-03-19
299,grgy24a,t1_grgtp0k,"That's the risk for instead of holding us dollars in an fdic insured bank account,  you 
- hold a cryptocurrency
- on an exchange,  not your keys not your coins
- not insured
- its a stablecoin that can't go up (only down)
- its tied to some fiat backing service and the whole thing could fail or be a fraud.

Personally the 8% isn't even enough to entice me",t3_m89qlp,2021-03-19 19:51:27,2021-03-19
300,grgy2rx,t1_grgtp0k,"If you look at how a traditional bank works, they offer credit card fees at around 24%, and interest on traditional accounts at around 2% (well now 0.2). They offer cash APR at 24%. There's a huge spread there that BlockFi doesn't dump on their customers , also 80% of funds generated by investors are returned to it's user base very much unlink a traditional bank. With that in mind, those rates aren't that crazy. Traditional banks make a ton of money off of people and BlockFi doesn't.",t3_m89qlp,2021-03-19 19:51:41,2021-03-19
301,grh19go,t1_grgtp0k,"8.6% is actually not that good.  You can get nearly that yield in 100 days by buying btc and then 1x shorting the June quarterly future at your favorite exchange. Doing something similar on the perpetual swap will likely given you much higher yield, especially on uber bullish exchanges like bybit.",t3_m89qlp,2021-03-19 20:28:01,2021-03-19
302,grh29fl,t1_grgtp0k,"I don't like, it smells funny",t3_m89qlp,2021-03-19 20:38:29,2021-03-19
303,grgwrxg,t1_grgtp0k,"You are generally going to get a lot of ""Not your keys, not your coins"" responses to this question but the truth is it depends on your risk tolerance.   Personally I am ok with risking a % of my holdings (not the full stack mind you) in something like this and if I were to lose those sats it would suck but it wouldn't ruin me.",t3_m89qlp,2021-03-19 19:35:40,2021-03-19
306,grgncxv,t1_grgn08v,"100% counterparty risk in case the funds are lost, also I think that's not holding bitcoin only I thought I read bitcoin was lower, like 6% or something. if you convert your bitcoin into a stablecoin to do this you lose all the benefit of price appreciation and its considered a taxable event.",t3_m89qlp,2021-03-19 17:08:35,2021-03-19
307,grgqt9l,t1_grgn08v,"8.5% is if you hold stablecoin with them, as soon as you convert it to BTC its 6% interest",t3_m89qlp,2021-03-19 18:08:18,2021-03-19
308,grgnobx,t1_grgn08v,It’s interesting. It’s only 6% for Bitcoin though. Risk is if they’re hacked or go out of business. Both unlikely in the short to midterm. So the question is how much risk you’re willing to take with your coins.,t3_m89qlp,2021-03-19 17:14:05,2021-03-19
309,grgno7q,t1_grgn08v,Not your keys. Not insured. I use it for a (small) portion of my holdings. You need to evaluate your risk tolerance.,t3_m89qlp,2021-03-19 17:14:02,2021-03-19
310,grha3w9,t1_grh4yt9,Most of the bitcoin articles I read on Bloomberg have a condensing tone. Can tell that publication hates the coin.,t3_m89qlp,2021-03-19 21:51:50,2021-03-19
311,grh6ane,t1_grh4yt9,Daily volume is over $50B. 90 million is a drop in the bucket.,t3_m89qlp,2021-03-19 21:18:05,2021-03-19
321,grgnzm0,t1_grgn41z,Yahoo sucks and is never accurate in real time,t3_m89qlp,2021-03-19 17:19:36,2021-03-19
322,grgzit1,t1_grgzfby,Seeing the movement as the US wakes up im starting to feel confident we'll see 60 today,t3_m89qlp,2021-03-19 20:08:46,2021-03-19
323,grhcvff,t1_grh94d1,"if you have cash you’re foolish *not* to buy


the hell",t3_m89qlp,2021-03-19 22:14:57,2021-03-19
329,grgftcd,t1_grgfgq3,I'm a 3D artist and even I don't get it.,t3_m89qlp,2021-03-19 15:03:39,2021-03-19
330,grgkrms,t1_grgfgq3,"It’s not so obvious to me that NFT’s as a whole are a joke. I think they could have solid use with future implications, but the ones going around now are definitely silly. Kind of like when YouTube started, it was just weird shit, usually pranks or just home filmed videos of random things, but evolved later on into much more.",t3_m89qlp,2021-03-19 16:23:12,2021-03-19
331,grglt5l,t1_grgfgq3,I think the biggest boom in NFTs will come in the music industry. Ultimate way to protect your music rights imo.,t3_m89qlp,2021-03-19 16:41:18,2021-03-19
332,grggdhk,t1_grgfgq3,">NFTs are a joke

Doge is $7B+ joke. 

Collectibles will be on bitcoin because network effects matter. Not having collectibles on bitcoin is an open attack vector that's already being exploited by competing chains.",t3_m89qlp,2021-03-19 15:12:11,2021-03-19
333,grgg1my,t1_grgfgq3,Its what they said about Bitcoin,t3_m89qlp,2021-03-19 15:07:10,2021-03-19
334,grgjuwk,t1_grgfgq3,"wtf, other crypto projects are friendly to BTC and are win/win for bitcoiners because

if they work = whole crypto space grows and BTC grows with them

if they fail = money from them will go into BTC because it will be the only or one of the few reliable crypto projects",t3_m89qlp,2021-03-19 16:07:45,2021-03-19
335,grhc4x0,t1_grh73dl,"In early 2012 I got paid 4.6btc for ads on a website I ran, and immediately cashed out all of it. That would be over $260k today.",t3_m89qlp,2021-03-19 22:08:52,2021-03-19
336,grhh8a0,t1_grh73dl,I refuse to do this. It wouldn’t be pretty.,t3_m89qlp,2021-03-19 22:50:04,2021-03-19
343,grgmgjm,t1_grglvgg,"Nice of you to allow her 🤣🤣
Buy more bitcoin, hold it and buy her eyes that shoot lasers",t3_m89qlp,2021-03-19 16:52:39,2021-03-19
344,grgq8fv,t1_grglvgg,Maybe just average in and get one eye done?,t3_m89qlp,2021-03-19 17:58:33,2021-03-19
345,grgq63d,t1_grglvgg,"Health is more important than bitcoin ;)
My wife’s about to do the same.
Also, the money saved on contacts can go into bitcoin :)",t3_m89qlp,2021-03-19 17:57:24,2021-03-19
346,grgv0hi,t1_grglvgg,Nothing is more important than the health of your partner and your own ofc. Can't enjoy sats if you're sick and tired anyways.,t3_m89qlp,2021-03-19 19:12:44,2021-03-19
348,grg8arc,t1_grg76u7,"GBTC premium will return, so buy on discount.  Grayscale is buying back $250M in GBTC which should help a bit as well.  So with the gap to NAV closing soon as money comes in, and the premium returning, all good things.  You have to compare different products to NAV, that is all that should matter when buying in.  GBTC is cheap to NAV.  Would suck to sell GBTC at a discount, but great to buy in.",t3_m89qlp,2021-03-19 13:17:08,2021-03-19
349,grg890s,t1_grg7q8k,Same same,t3_m89qlp,2021-03-19 13:16:32,2021-03-19
350,grh1np3,t1_grgzllt,Buy high buy low,t3_m89qlp,2021-03-19 20:32:15,2021-03-19
351,grgzz5j,t1_grgzllt,"Buy high, panic sell on dips.",t3_m89qlp,2021-03-19 20:13:52,2021-03-19
352,grh13ew,t1_grgzllt,"Only buy, never sell. Think of Bitcoin as the ultimate savings account. Always add more bitcoin to your savings while you can. Never sell to time the market, only because you hit your personal milestones,  and never sell for fiat.

The best days to buy are when there is a lot of negativity, but you never know when you are in the beginning or middle of a bullrun.",t3_m89qlp,2021-03-19 20:26:12,2021-03-19
