,comment_id,comment_parent_id,comment_body,comment_link_id,created,date
3143,gpoy16i,t3_lxs9za,"People also don't factor in the current environmental cost of our current system. Its somewhat of a theoretical argument, but if bitcoin replaced the current financial system, then that's ALOT of resources we no longer need to support. The idea of bitcoin is, at least in theory, a replacement for the current financial system. Not an addition.",t3_lxs9za,2021-03-05 04:13:29,2021-03-05
3144,gppbh74,t3_lxs9za,"💎 Bitcoin's power comes from cheap electricity from regions such as China or Quebec, Canada. Electricity there is not cheap because it is easier to create, it is cheap because they have excess of it.

💎 Without Bitcoin using that cheap energy it would go to waste.

💎 Bitcoin is not using a country's like Argentina in energy volume, Bitcoin is funding energy at the scale of a country.",t3_lxs9za,2021-03-05 05:49:00,2021-03-05
3145,gppibie,t3_lxs9za,"Gold mining is a shit of a lot worse for the environment. Not just the consumption of fossil fuels, but also the disruption of landscapes and ecosystems. 

Anyway, after a few more halvings the power consumption of mining BTC should come down substantially.",t3_lxs9za,2021-03-05 06:41:11,2021-03-05
3146,gppfa6v,t3_lxs9za,People who put those articles out are propagandists and deserve the gulag,t3_lxs9za,2021-03-05 06:17:23,2021-03-05
3147,gppkudg,t3_lxs9za,Its big money trying to get the price down so they can get in. Its not real/unpaid people. They do the same thing in other investments. Its constant and annoying. Politicians too. Just shit talk.,t3_lxs9za,2021-03-05 07:01:14,2021-03-05
3148,gpptiz9,t3_lxs9za,"I for one only buy the finest unsustainable commodities.  Rhino horns for knife handles, blue whale oil for heating my house, and panda testicles make great swizzle stick toppers.",t3_lxs9za,2021-03-05 08:14:10,2021-03-05
3149,gppfw1s,t3_lxs9za,Cathie Wood just released an awesome video about the current market bs going on. She spent about 5 mins talking about how hypocritical it was for fiat to talk about how much energy BTC consumes when fiat requires so much more energy plus it takes thousands of times longer to complete and verify a fiat transaction than it does a crypto. Her vid is here if you wanna check it out: https://youtu.be/dynmtlO2_3c,t3_lxs9za,2021-03-05 06:22:03,2021-03-05
3150,gpphcqm,t3_lxs9za,"Does anyone understand why the price of Bitcoin and Ethereum are not moving? Or not moving in a positive direction, the last 3 weeks it has been consistently between 45k and 51k. Are we in a bear market? Or are the institutions not investing like they have led us to believe?",t3_lxs9za,2021-03-05 06:33:32,2021-03-05
3151,gppj9d0,t3_lxs9za,"People often don’t learn or research info. They parrot 🦜 it. When I’m told this I ask where and show it to me?

Not cause I’m trying to be a dick but I’ve heard this from both sides and honestly looking for proof that allows me to reliably form an idea",t3_lxs9za,2021-03-05 06:48:44,2021-03-05
3152,gppkrg6,t3_lxs9za,BTC needs to go proof of stake.,t3_lxs9za,2021-03-05 07:00:35,2021-03-05
3153,gppodk4,t3_lxs9za,They can't find anything else to complain about.,t3_lxs9za,2021-03-05 07:30:24,2021-03-05
3154,gpps5to,t3_lxs9za,"It's a bold face lie... bitcoin as the catalyst for world peace and green energy, don't @ me.",t3_lxs9za,2021-03-05 08:02:31,2021-03-05
3155,gpq2jqs,t3_lxs9za,"They're just noise manufacturers. They don't have valid points or views. To them it makes them think, and other dumb people around them, they sound smart, and they know what they're talking about.

They don't. They're often populist anti-fact morons with their own agendas.

Now why do I say what I just did? Because I've seen it before in other heavily related areas: where concern trolls point out Environmental impacts caused by Wind or solar. They are correct, even purported ""green energy"" has Environmental impact, like extracting the steel ore, melting and casting it, shipping it out to a windfarm and assembling it. All Environmental impacts. If it goes defunct and left abandoned on site, again Environmental impacts. They bring up bird strikes (apparently painting the blades a visible color to birds helps immensely). But when you dig a bit deeper, they criticize green energy, because their intelligent political opposition supports it and recognize it as a profoundly better technology for electricity production than fossil fuels. 

And so knee jerk reaction they hate green energy out of spite.

They do it out of spite. They want to watch the world burn, either by stupidity, malice or both. Often enough they're not intense environmentalists or neo-luddites. They're just intense partisans for their own extreme Anti-science/anti-environmentalism political agenda. 

The concern trolls don't deserve a seat at the table in these conversations.",t3_lxs9za,2021-03-05 09:31:24,2021-03-05
3156,gpq3io1,t3_lxs9za,I can't help but laugh either. To be competitive in the mining space you have to utilize underutilized energy. for my operation in particular we literally only use energy that would otherwise be wasted. Then I see articles attack btc based on energy per transaction (which is effectively the equivalent of: pick any non-coorelated analogy) and I'm like wow you guys really have no sense of where the space actually is or the good it does in the world...,t3_lxs9za,2021-03-05 09:39:45,2021-03-05
3157,gpq6rqv,t3_lxs9za,"Deeply invested in commodities yes. 
And also deeply brainwashed by gov sponsored manipulated “science” articles",t3_lxs9za,2021-03-05 10:08:10,2021-03-05
3158,gpq9wno,t3_lxs9za,Air conditioners and refrigerators are bad.,t3_lxs9za,2021-03-05 10:35:31,2021-03-05
3159,gpqbisa,t3_lxs9za,It freaks the oligarchs out that this is something they fight invent and can’t control and manipulate.,t3_lxs9za,2021-03-05 10:49:32,2021-03-05
3160,gpqlx83,t3_lxs9za,Bill gates is literally spreading this shit every day. What’s his angle??? He’s a world class ass wipe either way.,t3_lxs9za,2021-03-05 12:27:06,2021-03-05
3161,gpqmc16,t3_lxs9za,Especially from those who drive these eco friendly 3 years lasting BMW's. Shiiiiiiiiieeeeeeeeet.,t3_lxs9za,2021-03-05 12:31:19,2021-03-05
3162,gpqq2cn,t3_lxs9za,Whats way worse is switching a cell phone every year. And upgrading your lease every year.,t3_lxs9za,2021-03-05 13:10:56,2021-03-05
3163,gpqv6k1,t3_lxs9za,Bitcoin uses less power than all home clothes dryers in the US. Not even taking about the entire banking system,t3_lxs9za,2021-03-05 14:11:11,2021-03-05
3164,gpqx95v,t3_lxs9za,">Bitcoin is so bad for the environment

BTC mining is mostly powered by renewables like hydroelectrical power. And the power-requirement for mining a pound of gold are far, FAR higher than mining a BTC.",t3_lxs9za,2021-03-05 14:38:19,2021-03-05
3165,gpqxjcr,t3_lxs9za,"If you want to see how bad gold is for both the environment and people, search YouTube for ”gold colombia”, ”gold burkina faso”, ”gold Philippines” (documentaries from BBC et al).",t3_lxs9za,2021-03-05 14:42:02,2021-03-05
3166,gpotc3g,t1_gpoos71,Probably because AI can't advocate for itself. Doctors getting put out of business by computers can just lobby their politicians. AI cannot,t3_lxs9za,2021-03-05 03:40:48,2021-03-05
3167,gppy68m,t1_gpoos71,"Lol, I’ve been saying for a while that doctors that laugh at “burger flippers” need to get off their high horse. Advances in automation and AI are coming for ALL our jobs and they are next on the chopping block after McDonald’s employees they love to jeer at. 
(And no before any naysayers come, it’s not going to get rid of ALL doctors but a large culling is in the not too distant future.)",t3_lxs9za,2021-03-05 08:53:47,2021-03-05
3168,gpqjo6h,t1_gpoos71,"Spot on! Bitcoin explained. Courtesy of Elon Musk!
https://youtu.be/YHjYt6Jm5j8",t3_lxs9za,2021-03-05 12:05:00,2021-03-05
3169,gpr8fau,t1_gpoos71,My problem with self driving cars is google and the fact I’ve actually attempted to use their GPS/other products lol,t3_lxs9za,2021-03-05 17:20:15,2021-03-05
3170,gppkzho,t1_gpozrry,In more than half of the places in the USA you can get clean energy with just a phone call agreement to your utility. I have done it at dozens of my offices. And the bigger you are the easier/cheaper it is. They will even put up a solar or wind project for you if you can buy over 20 MW of production.,t3_lxs9za,2021-03-05 07:02:22,2021-03-05
3171,gpppywu,t1_gpozrry,"I recently read an article how BTC was banned in Abchasia, because mining got so rampant there that the power lines burnt up. However, turns out it is mined there because they have hydroelectric power thats 0.5 cts/kWh. 0.5 cts!!!!!! It's not only green but also abundant there. And this pattern holds true for most BTC mining operations. Unless you're the Saudis you probably wont get cheaper fossil than hydro or solar.",t3_lxs9za,2021-03-05 07:43:44,2021-03-05
3172,gpr32ox,t1_gpozrry,"The most profitable bitcoin miners already use renewables as it is, and the ones that don't are typically either illegally jacked into power supplies or are located in China (although many of these facilities are being shut down). It's bad journalistic practice to compare bitcoin power usage to that of other institutions without going into the fact that bitcoin isn't built on oil like other commodities, thus having a much smaller carbon footprint. Fact of the matter is .1% of all energy consumed in a year is spent mining bitcoin, and 75% of bitcoin miners use renewables because it's much cheaper (argo blockchain has 80% mining margins on majority hydroelectric, which are margins that are unheard of at their scale).",t3_lxs9za,2021-03-05 16:00:54,2021-03-05
3173,gpr2xi4,t1_gppktj5,"I'm sure the main motivation is ""Bitcoin is in a lot of headlines now, we can make a big stir if we find some reason to call it a moral crisis""",t3_lxs9za,2021-03-05 15:58:47,2021-03-05
3174,gppojk7,t1_gppktj5,"

I think I'm warranted in saying it's hypocritical, as these media companies could be focusing on the environmental impact of fracking or that of coal or oil (if you wikipedia global energy consumption, you will see that about 65% of all energy usage is coal/oil) instead of bitcoin. Assuming bitcoin uses roughly 130 Terawatt hours of electric a year, this is about .1% of all energy consumption on the planet. You can look these figures up yourself if you doubt me. Also, in most places, bitcoin is at least partially mined with renewable energy, so this energy consumption isn't as bad for the planet (China is the exception but that's more of a China problem than a bitcoin problem). Here's an article that touches on that https://news.bitcoin.com/bitcoin-energy-consumption-is-far-more-efficient-and-greener-than-todays-banking-system/

As for the finance industry, I've seen estimates of about 100-150 terawatt hours per year, but this probably only accounts for the power it takes to keep banks and atms functional. I won't pretend like I can tell you how much it is, but I would be willing to bet the amount when accounting for all variables it is many times higher. That being said, it's probably about as negligible as bitcoin's energy consumption.

In conclusion I think it's hypocritical because there is clearly an agenda at play. The media tries to scare people by saying bitcoin energy consumption is higher than that of Argentina's, but only accounts for electric and doesn't focus on the types of energy being used (aka renewables aren't nearly as problematic). When accounting for these, bitcoin's energy consumption has a relatively small  environmental impact. I'm sure that amount will increase unless there's a huge fundamental bitcoin change, but it will likely be built on new energy and therefore isn't as much of a climate concern.",t3_lxs9za,2021-03-05 07:31:46,2021-03-05
3175,gpri783,t1_gppuiq1,"yeah,.... its totaly time to get megahystericalpanickybastshitcrazy.... over that 0,xysomething% of the global energy consumed... while its also mainly driven by renewables (and driving their development faster).",t3_lxs9za,2021-03-05 19:48:41,2021-03-05
3176,gpqqj8r,t1_gppx3n5,Well that's probably Ethers fault.,t3_lxs9za,2021-03-05 13:16:09,2021-03-05
3177,gpqjl29,t1_gppfp12,People claim that mining is completely useless and has no point. They clearly do not understand it. They will say your car does something useful for that environmental cost.,t3_lxs9za,2021-03-05 12:04:10,2021-03-05
3178,gpp9g4j,t1_gpoqkqa,"It's not. We have to get rid of fossil fuels completely regardless of what happens with bitcoin. We can shut off bitcoin today and we'd still be screwed if we keep burning coal. But it's only a matter of time until we're fossil free, and then energy usage becomes a non-issue.",t3_lxs9za,2021-03-05 05:34:13,2021-03-05
3179,gppuf6h,t1_gpopy7f,All you have to do is not be a goddamned idiot and you realize that journalists suck.,t3_lxs9za,2021-03-05 08:21:37,2021-03-05
3180,gpqgry4,t1_gpopy7f,Journalism is great. The only problem is that the only real journalist that we have left has been thrown in jail because he dared exposing US war crimes in Iraq. No wonder journalism isn't that popular anymore and is being shun by wannabe reporters in favor of propagandism which pays much better and doesn't land you in jail.,t3_lxs9za,2021-03-05 11:37:34,2021-03-05
3181,gppr7yh,t1_gppkvg9,"I think we're eventually going to have to turn to nuclear energy or find a substitute for a lot of the rare minerals that are used in renewable energy. I'd argue that solar/wind are still better than using oil though, as they effect regions moreso than CO2, which is more on a global scale. CO2 has the potential to completely change biomes, cause water/food shortages, and start a 6th mass extinction (which is arguably already happening). I definitely agree with you though, and think that it's ridiculous that we don't have a standardized model for nuclear power plants that are safe enough to plop anywhere on the planet.",t3_lxs9za,2021-03-05 07:54:25,2021-03-05
3182,gpq1c51,t1_gpq0u5g,"Maybe in China, but almost 75% of bitcoin miners are  using renewable energy. 
https://news.bitcoin.com/bitcoin-energy-consumption-is-far-more-efficient-and-greener-than-todays-banking-system/",t3_lxs9za,2021-03-05 09:20:58,2021-03-05
3183,gporpl7,t1_gponpqn,Not to mention how much energy all the infrastructure of our current financial system uses...,t3_lxs9za,2021-03-05 03:30:03,2021-03-05
3184,gposo9j,t1_gponpqn,"One twentieth of one percent is still a lot.

Don‘t get me wrong. I am not saying Bitcoin is bad, been loving it since 2016.
Recently I noticed that many people are not willing to accept systems that have downsides.
It‘s a matter of fact that no system is perfect, and every system has disadvantages. This is just fine.
They are just cherry picking those bad points to claim the whole system is worthless, which is very stupid of /them/.


The best would be to ignore the media. Like everything they write about, the bad news about Bitcoin will fade veeeeeeryyyy soon. They just want to earn clicks. Soon, the topic is too boring to write anything about it.",t3_lxs9za,2021-03-05 03:36:19,2021-03-05
3185,gpop2qu,t1_gponpqn,"Wow... I figured it was a lot more electricity than that even while holding this opinion. Thanks for sharing, really puts this into perspective for me.",t3_lxs9za,2021-03-05 03:11:59,2021-03-05
3186,gppeft3,t1_gponpqn,You gave the example: “6 cents out of 100 dollars” and since then it’s been my go to. People can understand that wow 6 cents out of $100 is extremely negligible. Otherwise they have no context as to the proportion of bitcoin’s usage relative to total energy consumption.,t3_lxs9za,2021-03-05 06:11:00,2021-03-05
3187,gpqr087,t1_gponpqn,"The vast majority of scientists (99%+) agrees that there are serious to catastrophic environmental damage that will affect us during our lives.

What exactly is phony about that?",t3_lxs9za,2021-03-05 13:21:24,2021-03-05
3188,gprio38,t1_gponpqn,"Hi Mark,
your first link seems to be broken:

https://en.wikipedia.org/wiki/World_energy_consumption#/media/File:Global-primary-energy\_(1).png

should work.

EDIT: and digiconomist is the worst source of all (overestimating by orders of magnitude, please see Mark Bevands criticism of it and also Hass McCooks sustainability data and researches).",t3_lxs9za,2021-03-05 19:55:01,2021-03-05
3191,gpp8uy2,t1_gpotofa,PoS is more vulnerable to a 51% attack. Even something like ETH would stand no chance if a nation-state for example decided to fuck with it.,t3_lxs9za,2021-03-05 05:29:52,2021-03-05
3192,gpp85gj,t1_gpotofa,Proof of stake is garbage for a currency use-case. To difficult to prevent inflationary activity.,t3_lxs9za,2021-03-05 05:24:42,2021-03-05
3193,gpouamt,t1_gpotofa,"I ultimately don't think that just because some of these other cryptos are better in different regards that they will surpass bitcoin (at least any time soon). There's already so much money in bitcoin and people hardly understand blockchain right now, which would make it hard for any other crypto to pull ahead. In theory I definitely agree with you though.",t3_lxs9za,2021-03-05 03:47:20,2021-03-05
3194,gppi4r5,t1_gpphl0r,Die hippies!,t3_lxs9za,2021-03-05 06:39:42,2021-03-05
3195,gpq102r,t1_gppznm7,"The estimates I've seen tend to be around 140 terawatt hours (which I would argue is very conservative and doesn't account for all variables), which is only a little more than bitcoin's 100-130 terawatt hours. That being said, almost all bitcoin miners outside of China are at least somewhat trying to use sustainable energy, while the banking system is built on older power. Also, 140 terawatt hours is only .1% of power used in the world, or .6% if you exclude oil and coal, which are by far the worst types of power we use.",t3_lxs9za,2021-03-05 09:18:04,2021-03-05
3196,gpoohlc,t1_gponp79,"While I think this will eventually start happening, if you were to look at S&P 500 companies I would be willing to bet the majority still aren't holding bitcoin yet. There are some exceptions like Square and Tesla, but for now I believe their goal is to keep the US dollar as relevant and possible and push their margins up as far as they can. Either that or you're right, but they're manipulating the shit out of the USD so they can get as much leverage as possible before making the switch.",t3_lxs9za,2021-03-05 03:07:52,2021-03-05
3197,gppvbb3,t1_gponp79,Or maybe they just don't like how much power it uses...,t3_lxs9za,2021-03-05 08:29:08,2021-03-05
3198,gpqba3a,t1_gpqa2oh,"Completely agree with you, with all this stock market shit and inflation in the USD I'd be willing to bet that bitcoin adoption accelerates. Some of the most profitable miners are also using renewables already. My favorite, argo blockchain, had over 80% mining margins last month using majority hydroelectric.",t3_lxs9za,2021-03-05 10:47:25,2021-03-05
3199,gppsuww,t1_gppibie,"Unless of course the price doubles by then, which I think we all assume it will",t3_lxs9za,2021-03-05 08:08:30,2021-03-05
3200,gpqhcmu,t1_gpptiz9,You are forgetting the grand piano made with elephant tusks,t3_lxs9za,2021-03-05 11:42:55,2021-03-05
3201,gppkddh,t1_gpphcqm,[https://www.reddit.com/r/Bitcoin/comments/lximtr/bitcoin\_selling\_pressure/](https://www.reddit.com/r/Bitcoin/comments/lximtr/bitcoin_selling_pressure/),t3_lxs9za,2021-03-05 06:57:27,2021-03-05
3202,gpppond,t1_gpphcqm,Wtf were up 10% in the last 3 weeks and you need an explanation for why it’s not higher? You are wondering if this is a bear market? Do you know what a bear market is? Have you ever looked at a chart of bitcoin from before literally 2021?,t3_lxs9za,2021-03-05 07:41:20,2021-03-05
3203,gpoubsf,t1_gpotc3g,AI has no moral agency,t3_lxs9za,2021-03-05 03:47:33,2021-03-05
3204,gpr5ba2,t1_gpr2xi4,What do you base that assumption upon? You're reading a conspiracy into something that is very likely just a slightly flat article about BTC energy consumption. The Guardian is a pretty stand-up publication doing serious journalistic work. They're not in the business of doing hit pieces just for the sake of doing them.,t3_lxs9za,2021-03-05 16:34:37,2021-03-05
3205,gpr09ob,t1_gppojk7,"That's not how journalism works, though. It's not like the Guardian isn't **also** highlighting the environmental impact of fracking, oil, off-shore drilling and so on, so forth. 

You're asking the journalists to ignore a relevant story because it might impact Bitcoin negatively, while you're expecting them to highlight every other relevant environmental story, and that's just not how anything works in journalism. 

You need to cover as many aspects as possible of every story if you want to be a legitimate, honest journalist, and that means also talking about the uncomfortable aspects of tomorrow's technology. 

If you tolerate the newspapers going after oil, fracking, deforestation and agriculture, you must also accept them coming after the negative aspects of the things you like, such as bitcoin. You can't have just one or just the other. That's what's really hypocritical.",t3_lxs9za,2021-03-05 15:19:55,2021-03-05
3206,gpqx1b2,t1_gpqjl29,Yes but if Proof of stake turns out to work equally well then in fact this energy is wasted.,t3_lxs9za,2021-03-05 14:35:25,2021-03-05
3207,gppvs99,t1_gpp9g4j,This is silly the more energy we use the longer it'll take to switch to renewables. Like with your logic I should just leave my lights on all the time.,t3_lxs9za,2021-03-05 08:33:05,2021-03-05
3208,gppj755,t1_gpp9g4j,"I think there are definitely advantages to ""renewable"" energy but there's still a lot of major environmental impacts from all the material that are mined, processed and transported to build renewable energy sources and which have to be maintained and replaced on a regular basis. It's not all fairy dust and unlimited free energy without impacts.",t3_lxs9za,2021-03-05 06:48:14,2021-03-05
3209,gppuhr1,t1_gpp9g4j,"Or, as they say, burn the coal, pay the toll.",t3_lxs9za,2021-03-05 08:22:13,2021-03-05
3210,gpq87f7,t1_gppr7yh,Nuclear fission would solve the problem but I get the feeling it’s always ‘5 years away’,t3_lxs9za,2021-03-05 10:20:47,2021-03-05
3211,gpq2j0i,t1_gpq1c51,You trust the Chinese? Lol,t3_lxs9za,2021-03-05 09:31:14,2021-03-05
3212,gpp42gi,t1_gporpl7,Yes.,t3_lxs9za,2021-03-05 04:55:49,2021-03-05
3213,gppl79a,t1_gporpl7,There are literally several sub-industries just to account for the delay settlement process.,t3_lxs9za,2021-03-05 07:04:08,2021-03-05
3214,gppv250,t1_gporpl7,Our financial system also does a lot more than bitcoin does and serves billions of people. Silly to even compare the two,t3_lxs9za,2021-03-05 08:26:59,2021-03-05
3215,gppv5ji,t1_gporpl7,Our financial system also does a lot more than bitcoin does and serves billions of people. Silly to even compare the two,t3_lxs9za,2021-03-05 08:27:47,2021-03-05
3216,gppkra5,t1_gposo9j,"People generally underestimate small percentages. I'm also surprised its so high. I would have thought it would be so negligible that you almost couldn't calculate it.

But still small enough that I don't see a problem. It's like telling people to take shorter showers and stop watering their lawns to save water when like 99.9% of all water is going towards farming and commercial/industrial use.",t3_lxs9za,2021-03-05 07:00:33,2021-03-05
3217,gpp40f0,t1_gposo9j,"If you're worried about the environment, you'd be MORE concerned with huge chunks of the 99.95%.  But you're not.  You're a phony environmentalist.",t3_lxs9za,2021-03-05 04:55:26,2021-03-05
3218,gpp4cq7,t1_gpop2qu,"They're worried about a little fly in the room when there's a dead, rotting buffalo in the middle of the room.  They're stupid hypocrites.",t3_lxs9za,2021-03-05 04:57:49,2021-03-05
3219,gprtsa4,t1_gpqr087,"Fuck you.  You are a phony environmentalist.  
If you were sincere, you'd be spending your time trying to deal with real and significant issues - but you're not.",t3_lxs9za,2021-03-05 21:55:12,2021-03-05
3220,gppqcdr,t1_gpp85gj,Also proof of stake dilutes the value of the currency in order to reward the wealthiest owners/corporations. Basically artificially generates wealth inequality.,t3_lxs9za,2021-03-05 07:46:54,2021-03-05
3221,gppjplm,t1_gppi4r5,"“Dem damn hippies ova der huggin that tree doin sumtin weird.... dale,... that dudes fuckin that tree hole man”",t3_lxs9za,2021-03-05 06:52:13,2021-03-05
3222,gpq8a0e,t1_gpq102r,Interesting... I’m pretty confident that sustainable bitcoin mining will be a very profitable industry in the near future. Definitely will spark innovation in this space.,t3_lxs9za,2021-03-05 10:21:24,2021-03-05
3223,gpop47t,t1_gpoohlc,All I wish is that crypto will become the people's currency :D,t3_lxs9za,2021-03-05 03:12:16,2021-03-05
3224,gpq3fht,t1_gppvbb3,They know. They aren't toddlers lol. They can't just make tons of articles without knowing anything can they? 😕,t3_lxs9za,2021-03-05 09:38:59,2021-03-05
3225,gpprpro,t1_gpppond,It was at 57 3 weeks ago,t3_lxs9za,2021-03-05 07:58:39,2021-03-05
3226,gpr08oy,t1_gpoubsf,Arguably humans neither. Or both can.,t3_lxs9za,2021-03-05 15:19:32,2021-03-05
3227,gpra03w,t1_gpoubsf,"Why not? Also look at doctors. My little brother got an updated prescription, after 5+ years so my mom asked me to look into it. Turns out the new drug basically the same the problem was the patent had run out on the OG one so it was about to become much cheaper and more accessible. AI won’t be motivated by kickbacks.",t3_lxs9za,2021-03-05 17:44:30,2021-03-05
3228,gpptq6s,t1_gpoubsf,But apparently AI is racist when it points out who's likely to commit more crimes again after being released from prison.  Silicon is literally Hitler!,t3_lxs9za,2021-03-05 08:15:51,2021-03-05
