,comment_id,comment_parent_id,comment_body,comment_link_id,created,date
18,gu0q4li,t3_krqrmf,This is just incredible. Thank you so much for taking the time to put this together.,t3_krqrmf,2021-04-10 14:42:58,2021-04-10
594,gu0o3r5,t3_mnyn5h,Imagine the fees the company is earning,t3_mnyn5h,2021-04-10 14:13:15,2021-04-10
595,gu0llsf,t3_mnyn5h,"This guy ain't got shit on the bear whale.

https://www.cnbc.com/2014/10/09/bitcoins-bearwhale-and-the-future-of-a-cryptocurrency.html

I remember like it was yesterday",t3_mnyn5h,2021-04-10 13:38:21,2021-04-10
596,gu0kh3j,t3_mnyn5h,"Yes, we are seeing it right now --- LIVE!!!",t3_mnyn5h,2021-04-10 13:23:20,2021-04-10
597,gu0l6c1,t3_mnyn5h,What am I lookin at cuz,t3_mnyn5h,2021-04-10 13:32:42,2021-04-10
598,gu0mbf2,t3_mnyn5h,Shaka! When the walls fell! I watched it go too. Exciting. Did you see the two buy orders for 48 coins each tear through at 59600?,t3_mnyn5h,2021-04-10 13:48:08,2021-04-10
599,gu0owjn,t3_mnyn5h,You aren't even on the trade history panel so we can't see if the orders were just filled or cancelled,t3_mnyn5h,2021-04-10 14:24:36,2021-04-10
600,gu0l1vb,t3_mnyn5h,"Nom nom.

Btw, the people putting a limit sell order at $60,001 must really hate money. Does not make a lick of sense to put a sell order right above a resistance level.",t3_mnyn5h,2021-04-10 13:30:59,2021-04-10
601,gu0qzgs,t3_mnyn5h,Please add Pump It Up song to background,t3_mnyn5h,2021-04-10 14:56:10,2021-04-10
602,gu0ls2h,t3_mnyn5h,I watched 30k BTC melt away as the BearWhale gorged during the MTGOX collapse. Good times.,t3_mnyn5h,2021-04-10 13:40:41,2021-04-10
603,gu0qzea,t3_mnyn5h,Some Corp is buying - the buy order amount is repeating -,t3_mnyn5h,2021-04-10 14:56:08,2021-04-10
604,gu0ttpr,t3_mnyn5h,My pupils dilated watching that 🤤,t3_mnyn5h,2021-04-10 15:41:25,2021-04-10
605,gu0k9ux,t3_mnyn5h,Oh oh its Magic,t3_mnyn5h,2021-04-10 13:20:45,2021-04-10
606,gu0kx15,t3_mnyn5h,It was pretty exciting for a few seconds. Was waiting for the moon. 🌙,t3_mnyn5h,2021-04-10 13:29:13,2021-04-10
607,gu0shzm,t3_mnyn5h,"I was watching it live but not looking at the depth chart. I thought that CBP glitched, it sat in 61K for so long.",t3_mnyn5h,2021-04-10 15:20:05,2021-04-10
608,gu0wyas,t3_mnyn5h,In a month you'll wish you hadn't sold it.,t3_mnyn5h,2021-04-10 16:33:41,2021-04-10
609,gu10j98,t3_mnyn5h," the consolidation was strong, especially yesterday. let's hope that it finally stays above 60k.",t3_mnyn5h,2021-04-10 17:35:24,2021-04-10
610,gu1qb84,t3_mnyn5h,you forgot the NSFW tag my man,t3_mnyn5h,2021-04-10 22:52:36,2021-04-10
612,gu0pjm7,t3_mnyn5h,I'm not sure what I'm looking at but all I know is I must BUY MORE BITCOIN!,t3_mnyn5h,2021-04-10 14:34:15,2021-04-10
613,gu0qc91,t3_mnyn5h,What app/website is being used here?,t3_mnyn5h,2021-04-10 14:46:15,2021-04-10
614,gu0u73n,t3_mnyn5h,"haven't seen something like end of bull market in 2018 yet... from 10K to 20 K.. that was crazy... all the walls getting eaten in seconds all the way up to top, literally unstoppable move for days",t3_mnyn5h,2021-04-10 15:47:37,2021-04-10
615,gu0v7kr,t3_mnyn5h,Premature... sry I will try to last longer next time. But it was good for me. How about you?,t3_mnyn5h,2021-04-10 16:04:28,2021-04-10
616,gu0vncz,t3_mnyn5h,I have now. This reminds me of the great [slaying of the bear whale.](https://youtu.be/ulimNuaKIQM) A huge 30k BTC sell Wall just being eaten up.,t3_mnyn5h,2021-04-10 16:11:46,2021-04-10
617,gu0w7gm,t3_mnyn5h,"It's always fun to watch when the market is crazy and the buy and sell order are in a tug of war, and I am just sitting here watching",t3_mnyn5h,2021-04-10 16:21:04,2021-04-10
618,gu0yxt5,t3_mnyn5h,can someone explain this for a noob?,t3_mnyn5h,2021-04-10 17:07:19,2021-04-10
619,gu1otm9,t3_mnyn5h,"'Drop ze sell wall'

    'He thinks we are going up'

'We are, let him in'",t3_mnyn5h,2021-04-10 22:40:02,2021-04-10
621,gu0tnhc,t3_mnyn5h,"That is proof that BTC is mature and difficult to manipulate:

if a 4 million $ market order does not move the price even for a second.

On the stock and bond market you can do that only for very liquid large cap assets.",t3_mnyn5h,2021-04-10 15:38:34,2021-04-10
622,gu0o3tv,t3_mnyn5h,That's s sexy,t3_mnyn5h,2021-04-10 14:13:17,2021-04-10
623,gu0o6m3,t3_mnyn5h,What app is this?,t3_mnyn5h,2021-04-10 14:14:21,2021-04-10
624,gu0tslj,t3_mnyn5h,Im jizzin,t3_mnyn5h,2021-04-10 15:40:54,2021-04-10
625,gu0v909,t3_mnyn5h,"Oh man i dont get any of this, im a fucking moron",t3_mnyn5h,2021-04-10 16:05:06,2021-04-10
626,gu0vbxk,t3_mnyn5h,Guatafak! Hilarious,t3_mnyn5h,2021-04-10 16:06:27,2021-04-10
627,gu0xbsj,t3_mnyn5h,lol 4m a wall. jfc the new coiners,t3_mnyn5h,2021-04-10 16:39:54,2021-04-10
628,gu103b8,t3_mnyn5h,Holding above $60k is better than sex.,t3_mnyn5h,2021-04-10 17:27:29,2021-04-10
629,gu12wxk,t3_mnyn5h,Better than a trip to your local massage parlor.,t3_mnyn5h,2021-04-10 18:17:19,2021-04-10
630,gu13nql,t3_mnyn5h,"I have never seen such a nicely defined reverse head-and-shoulders chart pattern, as we've had over the past month since the last high at $61635 on March 12/13.  Check it out",t3_mnyn5h,2021-04-10 18:29:50,2021-04-10
631,gu1465y,t3_mnyn5h,But why is the video 69 secs long?,t3_mnyn5h,2021-04-10 18:38:09,2021-04-10
632,gu15tni,t3_mnyn5h,"Mad, that slightly turned me on for some reason",t3_mnyn5h,2021-04-10 19:04:58,2021-04-10
636,gu0ryie,t3_mnyn5h,"I devour my girlfriend in 15 seconds. Try that, you amateur BTC wall eaters!",t3_mnyn5h,2021-04-10 15:11:19,2021-04-10
637,gu0kr1i,t3_mnyn5h,And it stopped,t3_mnyn5h,2021-04-10 13:27:02,2021-04-10
638,gu0p9kc,t3_mnyn5h,[removed],t3_mnyn5h,2021-04-10 14:30:02,2021-04-10
639,gu0mjkv,t3_mnyn5h,"Yes, 65 BTC ""wall"" is nothing.  
back in the early MTGOX days, anything less than 10000 BTC is not a wall.",t3_mnyn5h,2021-04-10 13:51:16,2021-04-10
640,gu0r2jz,t3_mnyn5h,"lol. with sex, you have an orgasm (men most of the time), with this, you also had one? :D",t3_mnyn5h,2021-04-10 14:57:33,2021-04-10
641,gu0xd48,t3_mnyn5h,"Its not necessarily a good thing. The faster we go up, the harder we are gonna come down. And sooner.",t3_mnyn5h,2021-04-10 16:40:30,2021-04-10
643,gu0ukev,t3_mnyn5h,"65btc is not a wall... I dont really call anything under 1000btc a wall. I miss back when we had 30,000btc walls, which could be eaten in seconds. This is pathetic.",t3_mnyn5h,2021-04-10 15:53:43,2021-04-10
644,gu0wjvs,t3_mnyn5h,Your wife and your wife’s boy friend have much more fun than you seeing this and you will never know.,t3_mnyn5h,2021-04-10 16:26:53,2021-04-10
645,gu0kr4p,t3_mnyn5h,Seems artificial,t3_mnyn5h,2021-04-10 13:27:03,2021-04-10
646,gu0ph5w,t3_mnyn5h,Oh my god scary as fuck,t3_mnyn5h,2021-04-10 14:33:12,2021-04-10
647,gu0q7xf,t3_mnyn5h,Why isn t the cheapest bid always matching with the highest ask?,t3_mnyn5h,2021-04-10 14:44:24,2021-04-10
648,gu0qs4h,t3_mnyn5h,Shit I should of bought more this morning.,t3_mnyn5h,2021-04-10 14:52:58,2021-04-10
649,gu0rcdy,t3_mnyn5h,"There was no time to think, gulp gulp gulp",t3_mnyn5h,2021-04-10 15:01:43,2021-04-10
650,gu0szha,t3_mnyn5h,that was sexyier than shit,t3_mnyn5h,2021-04-10 15:27:45,2021-04-10
651,gu0tgb7,t3_mnyn5h,Pure greed 🤓,t3_mnyn5h,2021-04-10 15:35:23,2021-04-10
652,gu0tp7k,t3_mnyn5h,😍,t3_mnyn5h,2021-04-10 15:39:22,2021-04-10
653,gu0ttih,t3_mnyn5h,Insane!,t3_mnyn5h,2021-04-10 15:41:19,2021-04-10
654,gu0ueiz,t3_mnyn5h,\^\^,t3_mnyn5h,2021-04-10 15:51:06,2021-04-10
655,gu0uyuj,t3_mnyn5h,Ahhhh thats hot thats hot,t3_mnyn5h,2021-04-10 16:00:23,2021-04-10
656,gu0v11u,t3_mnyn5h,u/getvideo,t3_mnyn5h,2021-04-10 16:01:25,2021-04-10
657,gu0xa90,t3_mnyn5h,r/sellwallsgw (nsfw),t3_mnyn5h,2021-04-10 16:39:09,2021-04-10
658,gu0xuei,t3_mnyn5h,Bruhh,t3_mnyn5h,2021-04-10 16:48:43,2021-04-10
659,gu0y0ji,t3_mnyn5h,Nice,t3_mnyn5h,2021-04-10 16:51:36,2021-04-10
660,gu0ya5w,t3_mnyn5h,Sexy,t3_mnyn5h,2021-04-10 16:56:03,2021-04-10
661,gu0yypr,t3_mnyn5h,as a crypto noob where can I view this?,t3_mnyn5h,2021-04-10 17:07:46,2021-04-10
662,gu0yzbw,t3_mnyn5h,"Impressive, very nice. Now let's see the actual trade history.",t3_mnyn5h,2021-04-10 17:08:04,2021-04-10
663,gu0z0l1,t3_mnyn5h,"We're all in it for the Long

The bull is stronger than the bear in here",t3_mnyn5h,2021-04-10 17:08:39,2021-04-10
664,gu0zksl,t3_mnyn5h,ASMR,t3_mnyn5h,2021-04-10 17:18:36,2021-04-10
665,gu109hm,t3_mnyn5h,Thank you for posting!  I was sleeping and missed it!,t3_mnyn5h,2021-04-10 17:30:34,2021-04-10
666,gu10fy7,t3_mnyn5h,"Im too much of a beginner to understand what is going on here, could someone pls explain?",t3_mnyn5h,2021-04-10 17:33:48,2021-04-10
667,gu10p2z,t3_mnyn5h,Nom nom nom,t3_mnyn5h,2021-04-10 17:38:10,2021-04-10
668,gu110dl,t3_mnyn5h,Nice!!!,t3_mnyn5h,2021-04-10 17:43:49,2021-04-10
669,gu117jb,t3_mnyn5h,"I feel so fortunate to finally be able to understand (barely) what this even means. So interesting to see, and exciting. I don't care if there's a bear market or not lol, I'm gonna accumulate either way",t3_mnyn5h,2021-04-10 17:47:23,2021-04-10
670,gu11kbv,t3_mnyn5h,Juicy!!!!😂,t3_mnyn5h,2021-04-10 17:53:33,2021-04-10
671,gu12gqy,t3_mnyn5h,"Good to know, let's see the actual trade history.",t3_mnyn5h,2021-04-10 18:09:24,2021-04-10
672,gu12hik,t3_mnyn5h,u/getvideo,t3_mnyn5h,2021-04-10 18:09:46,2021-04-10
673,gu13c99,t3_mnyn5h,Have you ever had sex?,t3_mnyn5h,2021-04-10 18:24:23,2021-04-10
674,gu13ou2,t3_mnyn5h,This is so sexy 🍆💧,t3_mnyn5h,2021-04-10 18:30:19,2021-04-10
675,gu14cfu,t3_mnyn5h,Or maybe the order get slowly cancelled by whale,t3_mnyn5h,2021-04-10 18:41:05,2021-04-10
676,gu14esh,t3_mnyn5h,"This is Awesome ! Thanks for sharing ! I'm a new trader as are so many here, I've recently within the last week been testing and running crypto bots in a paper account ! This truly peaks my interest !",t3_mnyn5h,2021-04-10 18:42:11,2021-04-10
677,gu15234,t3_mnyn5h,"That's cute

https://imgur.com/jhpw3aQ",t3_mnyn5h,2021-04-10 18:52:45,2021-04-10
678,gu1537c,t3_mnyn5h,This one sparks joy,t3_mnyn5h,2021-04-10 18:53:15,2021-04-10
679,gu16i25,t3_mnyn5h,That’s just very common in financial markets.,t3_mnyn5h,2021-04-10 19:15:25,2021-04-10
680,gu17215,t3_mnyn5h,I love Bitcoin!,t3_mnyn5h,2021-04-10 19:23:44,2021-04-10
681,gu17c3z,t3_mnyn5h,"I've watched a [30,000 BTC sell order](https://www.cnbc.com/2014/10/09/bitcoins-bearwhale-and-the-future-of-a-cryptocurrency.html) get devoured.",t3_mnyn5h,2021-04-10 19:27:51,2021-04-10
682,gu17id0,t3_mnyn5h,💪💪,t3_mnyn5h,2021-04-10 19:30:21,2021-04-10
683,gu17q56,t3_mnyn5h,"you are sick bro, buy a whore that give you a better 20 senconds",t3_mnyn5h,2021-04-10 19:33:28,2021-04-10
684,gu17u2s,t3_mnyn5h,"That was a cool video. I was sleeping and woke up pleasantly surprised. I did have a dream about watching a chart take off, but that chart was GME",t3_mnyn5h,2021-04-10 19:34:59,2021-04-10
685,gu1875j,t3_mnyn5h,"You want to go check out binance spot with tradinglite or similar. You get a heat map view of walls like this. I use them for trading, interesting to know when large orders are getting in and out, increases strike rate on buys and sells tenfold.",t3_mnyn5h,2021-04-10 19:40:10,2021-04-10
686,gu18nt9,t3_mnyn5h,Oh yeah 🥰,t3_mnyn5h,2021-04-10 19:46:41,2021-04-10
687,gu19rmn,t3_mnyn5h,I just came by watching it,t3_mnyn5h,2021-04-10 20:01:32,2021-04-10
688,gu1a7dy,t3_mnyn5h,only 65 😂😂😂😂,t3_mnyn5h,2021-04-10 20:07:12,2021-04-10
689,gu1b2ql,t3_mnyn5h,Damn.  That is sexy.,t3_mnyn5h,2021-04-10 20:18:06,2021-04-10
690,gu1bbcs,t3_mnyn5h,What app is this?,t3_mnyn5h,2021-04-10 20:20:53,2021-04-10
691,gu1c9o1,t3_mnyn5h,r/killthecameraman vertical videos in horizontal format,t3_mnyn5h,2021-04-10 20:32:16,2021-04-10
692,gu1fqrf,t3_mnyn5h,"It's a lot more fun watching the green & red shelves have a tug of war against each other.  Try it sometime, it will be a like a new position.",t3_mnyn5h,2021-04-10 21:11:35,2021-04-10
693,gu1fvdt,t3_mnyn5h,Im passing through from r/all and I have no idea what this means,t3_mnyn5h,2021-04-10 21:12:59,2021-04-10
694,gu1gs0b,t3_mnyn5h,🤣👏🏻🍻,t3_mnyn5h,2021-04-10 21:22:40,2021-04-10
695,gu1hcii,t3_mnyn5h,"i feel like a dummy for asking this late in the game, but can someone please explain the market size/price to me? when we say that bitcoin is currently X price, is that just the average of the open sell orders for that day? or the most recent transaction?",t3_mnyn5h,2021-04-10 21:28:25,2021-04-10
696,gu1hiro,t3_mnyn5h,Could someone ELI5 please?,t3_mnyn5h,2021-04-10 21:30:12,2021-04-10
697,gu1hk13,t3_mnyn5h,65 BTC is not a wall. 500000 is a wall.,t3_mnyn5h,2021-04-10 21:30:33,2021-04-10
698,gu1im9n,t3_mnyn5h,I don’t even know what I’m looking at,t3_mnyn5h,2021-04-10 21:41:13,2021-04-10
699,gu1jefz,t3_mnyn5h,Like dropping In a long piece in Tetris. Ding!!!,t3_mnyn5h,2021-04-10 21:49:05,2021-04-10
700,gu1jyff,t3_mnyn5h,I’m trying to understand this order book. Does it mean that someone was selling 62 BTC at 61k each? And that’s what’s being eaten up in this video?,t3_mnyn5h,2021-04-10 21:54:30,2021-04-10
701,gu1loaa,t3_mnyn5h,Why does Coinbase charge such high fees?,t3_mnyn5h,2021-04-10 22:11:09,2021-04-10
702,gu1ms3g,t3_mnyn5h,"meh, sex is still better bro.",t3_mnyn5h,2021-04-10 22:21:29,2021-04-10
703,gu1mw1e,t3_mnyn5h,You should Google “the bear whale” it’s kind of a thing. Makes 65 btc look like a sad joke ;),t3_mnyn5h,2021-04-10 22:22:29,2021-04-10
704,gu1no3c,t3_mnyn5h,i have no idea what im looking at here,t3_mnyn5h,2021-04-10 22:29:43,2021-04-10
705,gu1ocsm,t3_mnyn5h,"I mean, the end result is still cumming.",t3_mnyn5h,2021-04-10 22:35:55,2021-04-10
706,gu1ou1q,t3_mnyn5h,Possible that some of those orders were moved up by the sellers when they saw the wall collapsing.,t3_mnyn5h,2021-04-10 22:40:08,2021-04-10
707,gu1q6sy,t3_mnyn5h,Is this a call option?,t3_mnyn5h,2021-04-10 22:51:38,2021-04-10
751,gu0r3tn,t3_mnyn5h,Tesla?,t3_mnyn5h,2021-04-10 14:58:06,2021-04-10
752,gu1pt4o,t3_mnyn5h,this bitcoin pump killed my alt coins...woke up to 5% in the red...fuckin btc man,t3_mnyn5h,2021-04-10 22:48:31,2021-04-10
754,gu1b0cx,t1_gu0o3r5,The house always wins,t3_mnyn5h,2021-04-10 20:17:17,2021-04-10
755,gu1or24,t1_gu0o3r5,This is bullish for coinbase IPO,t3_mnyn5h,2021-04-10 22:39:24,2021-04-10
756,gu1niyt,t1_gu0o3r5,It's the same story with every gold rush. The richest people are the ones selling the shovels or enabling the markets.,t3_mnyn5h,2021-04-10 22:28:23,2021-04-10
758,gu1afrn,t1_gu0o3r5,"Looks like Coinbase pro, so not as much as you think.",t3_mnyn5h,2021-04-10 20:10:11,2021-04-10
761,gu0puq9,t1_gu0llsf,That chart is hilarious,t3_mnyn5h,2021-04-10 14:38:47,2021-04-10
762,gu18lvu,t1_gu0llsf,"I love all the ""BiTcOiN iS tAnKiNg"" articles that branch off that one because the price went from $630 to $350 during that stretch. See you at $61,000 suckers.",t3_mnyn5h,2021-04-10 19:45:56,2021-04-10
764,gu0xqh1,t1_gu0llsf,"arrrrrr, the good old (dead) bear whale!",t3_mnyn5h,2021-04-10 16:46:50,2021-04-10
765,gu0xwoq,t1_gu0llsf,">I remember like it was yesterday

Twas a glorious day, brother!",t3_mnyn5h,2021-04-10 16:49:48,2021-04-10
766,gu1psuc,t1_gu0llsf,What ever they were doing they sold in 2014 for $7.8 million what would have been worth $1.56 Billion today!,t3_mnyn5h,2021-04-10 22:48:27,2021-04-10
767,gu10v45,t1_gu0llsf,I wonder how BearWhale is feeling these days.,t3_mnyn5h,2021-04-10 17:41:11,2021-04-10
768,gu1mnsy,t1_gu0llsf,Great read,t3_mnyn5h,2021-04-10 22:20:23,2021-04-10
771,gu1c52a,t1_gu0llsf,Is that related to the manbearpig? Asking for science,t3_mnyn5h,2021-04-10 20:30:42,2021-04-10
772,gu1h6t0,t1_gu0llsf,1.8 Billion in today's dollars.,t3_mnyn5h,2021-04-10 21:26:48,2021-04-10
775,gu13yie,t1_gu0kh3j,Sex?,t3_mnyn5h,2021-04-10 18:34:47,2021-04-10
776,gu15grf,t1_gu0kh3j,I have sex as I am buying BTC on Coinbase pro.,t3_mnyn5h,2021-04-10 18:59:21,2021-04-10
777,gu0liaa,t1_gu0l6c1,"The red lines are sell orders.  So it's people that want to sell BTC.  The green lines are buy orders. So it's people that want to buy BTC.

The price of BTC goes up when the sell orders are quickly fulfilled at the requested price while the buy orders are not as quickly fulfilled (if the opposite happens, the price of BTC can go down).  In this video, the sell orders are quickly fulfilled by buyers so the price of BTC naturally goes up.

This is how the market works, not just for BTC, but for stocks as well.",t3_mnyn5h,2021-04-10 13:37:05,2021-04-10
778,gu0nyo1,t1_gu0l6c1,The bottom most red sell price shows 65 btc get bought up.,t3_mnyn5h,2021-04-10 14:11:14,2021-04-10
779,gu0qu4o,t1_gu0mbf2,Darmok and jillad at Tanagra. His arms wide open.,t3_mnyn5h,2021-04-10 14:53:50,2021-04-10
780,gu0qgix,t1_gu0mbf2,The Beast at Tanagra!,t3_mnyn5h,2021-04-10 14:48:07,2021-04-10
781,gu0t8qn,t1_gu0mbf2,Picard and Dathon at El-Adrel,t3_mnyn5h,2021-04-10 15:31:56,2021-04-10
782,gu0zphc,t1_gu0mbf2,Shaka when my pants exploded!,t3_mnyn5h,2021-04-10 17:20:48,2021-04-10
783,gu11l84,t1_gu0mbf2,Hey i just watched that trek episode! With open arms!,t3_mnyn5h,2021-04-10 17:53:58,2021-04-10
784,gu1hvfj,t1_gu0owjn,Exactly. 24h volume sitting at a paltry 12k lol.,t3_mnyn5h,2021-04-10 21:33:45,2021-04-10
785,gu0wkzb,t1_gu0owjn,Order books mean nothing. Shitpost.,t3_mnyn5h,2021-04-10 16:27:24,2021-04-10
786,gu0tidv,t1_gu0owjn,Lol,t3_mnyn5h,2021-04-10 15:36:19,2021-04-10
787,gu0l4q7,t1_gu0l1vb,"They need lambos and pizza, I guess.",t3_mnyn5h,2021-04-10 13:32:06,2021-04-10
788,gu0q8c6,t1_gu0l1vb,Is it like effect and cause? Isn't it a resistance level because people have those sell orders?,t3_mnyn5h,2021-04-10 14:44:34,2021-04-10
789,gu0zu07,t1_gu0l1vb,"But again, different people see different prices on different exchanges",t3_mnyn5h,2021-04-10 17:22:56,2021-04-10
790,gu11yyi,t1_gu0l1vb,Probably they are following their trading strategy. You sell at resistance and buy at support. They forgot resistance and support can break .,t3_mnyn5h,2021-04-10 18:00:43,2021-04-10
791,gu1c00u,t1_gu0l1vb,"Resistance levels aren't exact prices, they are areas. Going to 60001 isn't ""breaking resistance"", the sell wall is part of the resistance around 60k. Resistance is literally the supply of bitcoin whether it's at 59912 or 60400.",t3_mnyn5h,2021-04-10 20:28:59,2021-04-10
792,gu0rum3,t1_gu0l1vb,It does if you bought anytime last year.,t3_mnyn5h,2021-04-10 15:09:36,2021-04-10
793,gu0qu0u,t1_gu0l1vb,"It does make a lot of sense, you have a long way to go, my friend.",t3_mnyn5h,2021-04-10 14:53:47,2021-04-10
794,gu102vp,t1_gu0l1vb,Or maybe 50k euros? They round it up differently in different currencies,t3_mnyn5h,2021-04-10 17:27:17,2021-04-10
795,gu1aao4,t1_gu0l1vb,It makes sense if their target is over 60. We don't know their cost basis or their strategy.,t3_mnyn5h,2021-04-10 20:08:22,2021-04-10
798,gu0pqpp,t1_gu0ls2h,https://m.youtube.com/watch?v=tnbnq33DZ1Q   The slaying of the bear whale... amen...,t3_mnyn5h,2021-04-10 14:37:10,2021-04-10
799,gu0uo9f,t1_gu0ls2h,"If you actually traded on mtgox itself there were 30,000btc walls all the time. They werent called bearwhales. It was just business as usual.",t3_mnyn5h,2021-04-10 15:55:30,2021-04-10
800,gu0zmaw,t1_gu0ls2h,"Been there, epic times!",t3_mnyn5h,2021-04-10 17:19:20,2021-04-10
801,gu18f8n,t1_gu0qzea,"Wouldn’t a single corporation feed the order in, in smaller slices so as not to move the price upwards like that?",t3_mnyn5h,2021-04-10 19:43:21,2021-04-10
802,gu0ylb9,t1_gu0ttpr,My anus went wet watching it,t3_mnyn5h,2021-04-10 17:01:21,2021-04-10
803,gu0peng,t1_gu0kx15,"The moon comes soon.

$60k and €50k resistance got burned through; now were waiting for ¥400k resistance (currently $61k) to get eaten. It took a month to break the former; it shouldn’t take more than 2-3 days to break the latter given the relative volume in China compared to US/Europe. Then the rocket flies to...$80k? $100k?",t3_mnyn5h,2021-04-10 14:32:10,2021-04-10
804,gu0tnxi,t1_gu0shzm,"Haha, yeah, that 20 seconds seems like an eternity when you’re price watching.",t3_mnyn5h,2021-04-10 15:38:48,2021-04-10
806,gu0w0k3,t1_gu0pjm7,Have you considered leveraged margin trading .,t3_mnyn5h,2021-04-10 16:17:53,2021-04-10
807,gu0tje9,t1_gu0qc91,Coinbase Pro,t3_mnyn5h,2021-04-10 15:36:45,2021-04-10
808,gu11v9k,t1_gu0u73n,What does that look like?,t3_mnyn5h,2021-04-10 17:58:56,2021-04-10
809,gu0ypbw,t1_gu0tnhc,"interesting but not sure I get you. It moved the price, slowly but it did, right?",t3_mnyn5h,2021-04-10 17:03:19,2021-04-10
810,gu0oi49,t1_gu0o6m3,looks like coinbase pro,t3_mnyn5h,2021-04-10 14:18:54,2021-04-10
811,gu0yq04,t1_gu0tslj,Where?,t3_mnyn5h,2021-04-10 17:03:38,2021-04-10
812,gu0xte5,t1_gu0v909,"Nah, I didn’t know what a sell wall was a year ago either, my dude. All this is showing is the people who have BTC up for sale (in red) and the people who are willing to buy (in green) at a set price. Anyone who’s getting on there to buy BTC at the market price, gets it for whatever the lowest red price shown is. My vid is just showing that in that 20 sec, $4M of BTC was bought up at that sell wall (“wall”, because there was a LOT at one price) and when that wall is breached, the following sell prices typically fall quickly, as you saw it go past $61,200 as well. Just a micro price action, but fun as hell to watch.",t3_mnyn5h,2021-04-10 16:48:14,2021-04-10
813,gu14cdv,t1_gu0v909,"What happens is some  traders with lots and lots of coins, put a massive trade into the order books, not expecting it to be filled, but instead to shake the market, make others look at it and influence their perception of btc value. 

In the early days this was done quite a bit, and often those walls would disappear just as soon as they appeared when the seller or buyer pulled them when they got the market to swing the way they wanted.

So to see one wrecked @ 61K that fast, speaks volumes of how far bitcoin has grown in strength and how these tactics are fast becoming impractical for folks with large holdings.  It's a come to papa moment!",t3_mnyn5h,2021-04-10 18:41:04,2021-04-10
814,gu0yka1,t1_gu0ryie,"You last 15 seconds? Wow! I'm done on 2 seconds, and that time also includes the post intercourse cigarette",t3_mnyn5h,2021-04-10 17:00:51,2021-04-10
815,gu0vjmm,t1_gu0p9kc,"Eh, I'm hoping to do the same, but my instinct tells me that by Monday it will be back to crabbing between 55-60k.",t3_mnyn5h,2021-04-10 16:10:01,2021-04-10
816,gu0pgsv,t1_gu0mjkv,We're not in the early mt gox days anymore,t3_mnyn5h,2021-04-10 14:33:03,2021-04-10
817,gu0qrmz,t1_gu0mjkv,That means nothing if a BTC was 1 dollar at the time.,t3_mnyn5h,2021-04-10 14:52:46,2021-04-10
818,gu0t4ev,t1_gu0mjkv,It’s almost like price has gone up,t3_mnyn5h,2021-04-10 15:30:00,2021-04-10
819,gu0njij,t1_gu0mjkv,wouldnt that be less value?,t3_mnyn5h,2021-04-10 14:05:16,2021-04-10
820,gu14lq4,t1_gu0xd48,"That is actually not what happens, the bigger you grow, the harder it is to take down the price with fud.  More money and users mean that it becomes harder to manipulate and push the market around.",t3_mnyn5h,2021-04-10 18:45:23,2021-04-10
821,gu153vt,t1_gu0wjvs,"He earns the big bucks so that the wifey can have her fantasy and not show her ugliness by imposing financial demands on her boy toy... every one wins in the above scenario.   

When you get older, you will realize that the ultimate freedom is to never be forced into fucking when you don't feel like it.",t3_mnyn5h,2021-04-10 18:53:34,2021-04-10
822,gu0lhot,t1_gu0kr4p,"Considering it was made by humans, then yes, you are technically correct. 

(The best kind)",t3_mnyn5h,2021-04-10 13:36:53,2021-04-10
823,gu0n4ll,t1_gu0kr4p,"Bots.

Knowing they exist can save you a lot of money, IMO. They'll freak someone out, just like this video does, making you irrational.  To some degree, you just have to realize that you need to buy now because others are buying now, and it's the most useful scarce asset.

... So maybe the bots are helping you in the end.  Thank you, bots!",t3_mnyn5h,2021-04-10 13:59:28,2021-04-10
824,gu0xmx5,t1_gu0q7xf,"Because that's when a trade happens, so it doesn't show as an ""offer"" at the same price as a bid, it's a TRADE, and then both the bid and offer are decreased by the amount of the trade, or removed.",t3_mnyn5h,2021-04-10 16:45:10,2021-04-10
825,gu10blx,t1_gu0yypr,On Coinbase pro,t3_mnyn5h,2021-04-10 17:31:37,2021-04-10
826,gu13j55,t1_gu0yypr,"[quote.yahoo.com](https://quote.yahoo.com) has a great running chart of every move in a graph...just click on BTC on the main indexes line on the top of the top main page, it constantly refreshes",t3_mnyn5h,2021-04-10 18:27:42,2021-04-10
827,gu1k5lc,t1_gu14esh,How do you set up a paper account?,t3_mnyn5h,2021-04-10 21:56:28,2021-04-10
828,gu1ino1,t1_gu17c3z,"Wow… $7.8 million would be a dream. 

But $1.8 BILLION if he had diamond hands. 

I hope he held on to at least a few thousand. If it were me I’d sell off half, invest in traditionally stable assets and forget about the rest of the bitcoin while I live a comfortable life. 

Hell, selling half would mean $3,000,000 at 4% growth - $120,000 a year in just interest. You could live a very comfortable life with that. 

And forget about the other 15,000 coins you have, lol. 

And then you open your wallet today and find it’s worth $900,000,000 lol. 

What… what even would you do at that point?",t3_mnyn5h,2021-04-10 21:41:38,2021-04-10
829,gu1fpyz,t1_gu1bbcs,GDAX (coinbase pro),t3_mnyn5h,2021-04-10 21:11:21,2021-04-10
832,gu0sdmi,t1_gu0r3tn,Tata?,t3_mnyn5h,2021-04-10 15:18:09,2021-04-10
833,gu1oh9c,t1_gu1b0cx,"This is so true.  I tried picking a fight with my house once, got locked the fuck out.",t3_mnyn5h,2021-04-10 22:37:01,2021-04-10
837,gu1pcm8,t1_gu1afrn,Do you have any clue how profitable Coinbase has become?? They reported $1b in revenue in 2020. Also reported $1.8b in revenue in Q1 2021 ALONE 😳,t3_mnyn5h,2021-04-10 22:44:36,2021-04-10
