,comment_id,comment_parent_id,comment_body,comment_link_id,created,date
2737,gprz3ld,t3_lxiou4,"Whatever u expect will not happen, whatever you dont expect will happen.

I was in on the first btc run, missed the 2nd.  Definitely bullish on BTC though.

But its all BS, no-one knows.  Too many known and unknown variables.  Especially the unknown unknown.  I am looking to put in 50k and forgot about it.  Its a bet, but a good bet.  50k -> to 10k, my life does not change.  50k -> to 1 mill, yea my life changed.  Thats how I view it.  But otherwise dont kid yourself.  No-one knows, if you have it you hype it up, if you didnt have it you hype it down.  Just like every other thing in history.

blah blah blah.  Buy it and dont look at it for 5 years.  Its a good bet.",t3_lxiou4,2021-03-05 22:40:15,2021-03-05
2738,gpnuwvc,t3_lxiou4,Never,t3_lxiou4,2021-03-04 23:37:09,2021-03-04
2739,gpnyqux,t3_lxiou4,"Lel.

Translation: 
It's VERY possible that boomers might give up all their real wealth for your computer codes.",t3_lxiou4,2021-03-05 00:05:05,2021-03-05
2740,gpovvw6,t3_lxiou4,"Bitcoin isn't a currency. Its value comes in the hope that someone else will eventually pay more for it.

It used to be close to a currency. I've personally spent thousands of BTC. It is mostly useless now.",t3_lxiou4,2021-03-05 03:58:16,2021-03-05
2741,gpq4o69,t3_lxiou4,"Bitcoin is more likely to go to $1000 than $1,000,000!

Funny that someone with a vested interest in people trading bitcoin will pump its tires!",t3_lxiou4,2021-03-05 09:49:51,2021-03-05
2742,gpnuei0,t3_lxiou4,Lol,t3_lxiou4,2021-03-04 23:33:24,2021-03-04
2743,gpotvfc,t3_lxiou4,So is that $100 per Satoshi?,t3_lxiou4,2021-03-05 03:44:27,2021-03-05
2744,gpow5n3,t3_lxiou4,"at that price, bitcoin will only be using about 65% of the planet's electricity.  Can't wait!",t3_lxiou4,2021-03-05 04:00:09,2021-03-05
2745,gppz7xi,t3_lxiou4,It comes out very legit when a project can start their work without external investments or IEO like Graphene mainnet. They even haven’t any pre-mine! Just a legit and speedy mainnet architecture,t3_lxiou4,2021-03-05 09:02:43,2021-03-05
2748,gpnvadw,t1_gpn8jiy,"Saying it will reach infinity is silly, it is better to say that after Bitcoin is adopted as a standart things will be priced correctly. Comparing to a fiat dollar won't make any sense anymore. Either you adapt or die long before the ""infinity"" moment.",t3_lxiou4,2021-03-04 23:39:54,2021-03-04
2749,gpo040b,t1_gpn8jiy,"> replacing all of the world’s fiat currencies and its value would eventually reach “infinity” after inflation weakened fiat money and more people turned to Bitcoin as an investment.

That's the dumbest thing I've ever read. No way he actually believes that",t3_lxiou4,2021-03-05 00:15:07,2021-03-05
2750,gpqfso4,t1_gpn8jiy,Even bots get upvotes,t3_lxiou4,2021-03-05 11:28:24,2021-03-05
2751,gpo07e5,t1_gpn8jiy,video of the interview: https://youtu.be/NC9NjOf7evo,t3_lxiou4,2021-03-05 00:15:47,2021-03-05
2752,gpowusz,t1_gpn8jiy,How do you calculate long term capital gains on infinity?,t3_lxiou4,2021-03-05 04:05:07,2021-03-05
2753,gpq4vud,t1_gpn8jiy,I smell a massive network disruption and dump coming to clean up some more retailers,t3_lxiou4,2021-03-05 09:51:43,2021-03-05
2754,gpqa89g,t1_gpn8jiy,Still if the Govts ban crypto Bitcoin will crash. Cryptos are giving ways to corruption and illegal transactions and that makes several Governments collapse and creates Confusion.,t3_lxiou4,2021-03-05 10:38:18,2021-03-05
2756,gpoe5px,t1_gpn6z48,It will most likely be somewhere in the set of real numbers,t3_lxiou4,2021-03-05 01:55:40,2021-03-05
2757,gpoj66k,t1_gpn6z48,"Future me: Hmm, let's see which solar system I'll buy today...",t3_lxiou4,2021-03-05 02:30:41,2021-03-05
2759,gpo6yld,t1_gpn6z48,OnionNN - Bitcoin now worth √-1,t3_lxiou4,2021-03-05 01:04:14,2021-03-05
2760,gpoetst,t1_gpn6z48,Watch bitcoin confound us all once again and somehow take on a negative value lmao,t3_lxiou4,2021-03-05 02:00:19,2021-03-05
2761,gpoemzl,t1_gpn6z48,Except that it isn't mathematically possible for bitcoin to reach infinity.,t3_lxiou4,2021-03-05 01:59:01,2021-03-05
2762,gpotdig,t1_gpn6z48,Half way between zero and infinity is infinity.,t3_lxiou4,2021-03-05 03:41:03,2021-03-05
2763,gpp9nnr,t1_gpn6z48,Even if you split the difference between zero and infinity we’re looking pretty good.,t3_lxiou4,2021-03-05 05:35:43,2021-03-05
2764,gpqid95,t1_gpn6z48,Why are they ruling out negative prices to pay for past CO2 emissions? Negative infinity is a more realistic bottom.,t3_lxiou4,2021-03-05 11:52:30,2021-03-05
2765,gpoosew,t1_gpnymqu,You can survive for ten more years! I believe in you!,t3_lxiou4,2021-03-05 03:10:00,2021-03-05
2766,gpoxmli,t1_gpnymqu,Well at least you're young.,t3_lxiou4,2021-03-05 04:10:37,2021-03-05
2767,gporol8,t1_gpnymqu,"10 years and 1 harelip too late 😂.

Jk, me too",t3_lxiou4,2021-03-05 03:29:52,2021-03-05
2768,gpo75oi,t1_gpnz01p,"The FEE I payed to Coinbase for my first BTC purchase would already be $150 and that was not that long ago, so why not.",t3_lxiou4,2021-03-05 01:05:40,2021-03-05
2769,gpo2uc8,t1_gpnk5v9,- Micheal scott,t3_lxiou4,2021-03-05 00:34:47,2021-03-05
2770,gpoahve,t1_gpnfzlw,"In his defense, the dude has been saying this since like 2011. So it’s not like he’s just jumping on the bandwagon. He does have some credibility.",t3_lxiou4,2021-03-05 01:29:37,2021-03-05
2772,gpo4p5j,t1_gpnfzlw,Except everyone who has made a reasonably high prediction has been right. You're acting like this is going to be the exception. Why?,t3_lxiou4,2021-03-05 00:48:01,2021-03-05
2773,gpo3f4v,t1_gpnfzlw,"> ""CEO of cryptocurrency exchange says cryptocurrencies are going to perform well""

Cryptocurrencies are most certainly going to fare poorly. They will all probably approach zero value. 

Bitcoin, on the other hand, will replace all world currencies. 

These are very different things.",t3_lxiou4,2021-03-05 00:38:56,2021-03-05
2774,gpqb0n6,t1_gpnfzlw,"Usually when I see people making these statements, my thoughts are the same. However, Kraken behaves much more maturely than most in the cryptospace, so I give them a little more regard.

With that said, I also think BTC hitting $1m is very reasonable. I don't think it's definitely going to happen. Neither did Kraken's CEO. It's just a fairly reasonable statement based on the current state of things.",t3_lxiou4,2021-03-05 10:45:06,2021-03-05
2775,gpqgika,t1_gpoeds4,Stop reading dude,t3_lxiou4,2021-03-05 11:35:07,2021-03-05
2776,gpqi8wi,t1_gpoeds4,Read more articles!,t3_lxiou4,2021-03-05 11:51:21,2021-03-05
2777,gpo8b16,t1_gpo3dcw,"Sure we will.  That's only a $20 trillion market cap for BTC; while a very large number its not unfathomable.  Hell that the market caps of the Top 7 assets currently (Gold, Saudi Aramco, Apple, Microsoft, Amazon, Silver, Google).  

My medium term target is the market cap of gold which is \~$500K",t3_lxiou4,2021-03-05 01:13:55,2021-03-05
2779,gpo2tv0,t1_gpnzjqo,"An astounding number of adults still haven't figured out basic things like credit card interest, balancing a budget, or how tax brackets work. 


Telling them to download an exchange, completing the KYC, to buy 0.247263 of a Bitcoin funded through bank transfer, then setting up a hardware wallet that needs two factor authentication, recording down a 24 word seed phrase, and transferring to merchant via QR code, awaiting for confirmation, and calculating fees in the meantime, sounds comically impossible for those. 

People like to crap on Paypal being not real bitcoin but without services like those, Bitcoin could never ever reach widespread distribution for the rest of us.",t3_lxiou4,2021-03-05 00:34:41,2021-03-05
2780,gpo1qk5,t1_gpnzjqo,"To be fair, I might look like a Becky.. don’t know honestly.. but I’m a mom that shops at target and ive been holding Bitcoin since 2017 🤷‍♀️",t3_lxiou4,2021-03-05 00:26:47,2021-03-05
2781,gpo6iaw,t1_gpnzjqo,"My roommate’s GF casually dropped she bought a mining rig back in 2016, I was totally caught off guard. I asked if her roommates made her pay extra for utilities, she started trying to change the topic... haha! I think Bitcoin is secretly mainstream lol",t3_lxiou4,2021-03-05 01:01:00,2021-03-05
2782,gpp2m03,t1_gpnzjqo,"I suspect that ""ordinary people"" using BTC will be as common as ""ordinary people"" running their own SMTP servers to use email.  It's possible, but highly unusual.

If Bitcoin goes truly mainstream, I expect we'll see the bank and credit card industry morph into custodial wallet providers.",t3_lxiou4,2021-03-05 04:45:33,2021-03-05
2783,gpovdhn,t1_gpnzjqo,I’m friends with my bank’s branch manager. He admits to still not knowing what Bitcoin is.,t3_lxiou4,2021-03-05 03:54:46,2021-03-05
2784,gporlmt,t1_gpnzjqo,My wife is call Becky and she does own any! I think she is hoping mine do well as she can claim half ownership!,t3_lxiou4,2021-03-05 03:29:19,2021-03-05
2785,gppssr6,t1_gpnzjqo,I'm the youngest in my family. I've got a father who is a financial advisor..a sister who is a CPA...a brother who is noted for his saving abilities and investing. Then there's me...the youngest who was working as waiter up until a few years ago. Guess which one got on the bitcoin train back in the day? I've got you folks to converse with but i literally know nobody in person who is into bitcoin. I think i may be early.,t3_lxiou4,2021-03-05 08:07:59,2021-03-05
2786,gpolvl5,t1_gpnzjqo,I’ve been looking for a cpa to help do taxes and the majority of places I called didn’t even know what “cryptocurrency” was. I specifically ask for that because I want someone somewhat knowledgeable and at this point most people recognize bitcoin. This is in a major city as well not some backwoods town,t3_lxiou4,2021-03-05 02:49:37,2021-03-05
2787,gpnst8b,t1_gpnscfy,Dont be conservative. Thats no fun. Less upvotes too.,t3_lxiou4,2021-03-04 23:21:40,2021-03-04
2788,gpnz1w7,t1_gpnscfy,I will sleep now every night with your beautiful words in my head.,t3_lxiou4,2021-03-05 00:07:18,2021-03-05
2789,gpo89dm,t1_gpnscfy,Next halving we’ll probable see 1m,t3_lxiou4,2021-03-05 01:13:35,2021-03-05
2790,gpnvmke,t1_gpnscfy,Not an unreasonable estimate considering the next halving will occur in 2024,t3_lxiou4,2021-03-04 23:42:23,2021-03-04
2791,gpokd3i,t1_gpnscfy,Stock to flow models agree. And I agree with stock to flow.,t3_lxiou4,2021-03-05 02:39:05,2021-03-05
2792,gpoepyp,t1_gpnscfy,"What if we take into consideration Moore's law, or the end of it, and the soon to be exponential rate of tech advancement? It might be fair to say that future adoption, growth and value of certain cryptos could be accelerating.",t3_lxiou4,2021-03-05 01:59:35,2021-03-05
2793,gpnvriq,t1_gpnscfy,!remind me 3 years,t3_lxiou4,2021-03-04 23:43:24,2021-03-04
2794,gpo3emd,t1_gpnscfy,"""Conservatively I expect a 5000% increase YoY.""

On some level you have to understand how stupid you sound.",t3_lxiou4,2021-03-05 00:38:49,2021-03-05
2795,gpo165i,t1_gpnscfy,I think I just came.,t3_lxiou4,2021-03-05 00:22:43,2021-03-05
2796,gpo7qwa,t1_gpnscfy,"Nov 2024 seems a little early considering the next halving will be earlier that year, but pretty spot on if you ask me!!",t3_lxiou4,2021-03-05 01:09:53,2021-03-05
2797,gppbq2m,t1_gpnscfy,"What other currency, asset or security you can think of appreciates exponentially forever until the end of time? None. And it would be a terrible feature of a currency if it did, it'd never get used as a medium of exchange.",t3_lxiou4,2021-03-05 05:50:50,2021-03-05
2798,gpo4fxc,t1_gpnldb4,"1 BTC is **181,576,840** Ugandan Shilling",t3_lxiou4,2021-03-05 00:46:14,2021-03-05
2799,gpo72sm,t1_gpnzub8,"It's possible but with hyper inflation. 


We'll see how the Fed react once inflation start to ramp up but i'm not confident.",t3_lxiou4,2021-03-05 01:05:05,2021-03-05
2800,gpo6grb,t1_gpnzse9,This is the dip... possibly...,t3_lxiou4,2021-03-05 01:00:42,2021-03-05
2801,gpo7zmy,t1_gpnzse9,You had your chance,t3_lxiou4,2021-03-05 01:11:39,2021-03-05
2803,gpnwu64,t1_gpngi7i,"So you think Bitcoin is going to not increase a lot because... people are buying in and using it?

People who thought it was a scam who now want Bitcoin is exactly what we need to happen. The more people adopt it, the more it becomes accepted as a currency, the more it is used, the more it is worth. Quantity doesn't change, but users are growing, while the difficulty to get BTC as a mining reward increases, it's getting harder to get a hold of BTC, the value increases.",t3_lxiou4,2021-03-04 23:51:10,2021-03-04
2804,gpnxfnx,t1_gpngi7i,I started in early 2018 and have been seeing these predictions just about everyday. I really don't think anything has changed bull cycle or bear cycle. Believers be believin'.,t3_lxiou4,2021-03-04 23:55:31,2021-03-04
2805,gpo3pvp,t1_gpngi7i,"I've been on this ride since 2013 and, though I am speculating based on what I've seen, I feel like we are at the doorstep just about to enter the hysteria phase. I see bitcoin setting an ATH somewhere north of 150k this run (maybe as high as 350k?). All that said, I do believe we'll see 1 million in the next 10-15 years (which is both awesome and so crazy). We're turning that corner where real adoption is starting to slowly creep in.",t3_lxiou4,2021-03-05 00:41:05,2021-03-05
2806,gpoa570,t1_gpngi7i,[I think what you're trying to say is that we are in the euphoric stage](https://cryptopotato.com/wp-content/uploads/2018/04/p4_2.jpg),t3_lxiou4,2021-03-05 01:27:09,2021-03-05
2807,gppfvl3,t1_gpngi7i,I hope hope hope hope we are near a top and about to hit another bear market. Would love to dump even more money into cheap crypto for the long term hold.,t3_lxiou4,2021-03-05 06:21:57,2021-03-05
2808,gpqco5h,t1_gpp67xu,"Nah, Bitcoin is like TCP/IP while ETH is like HTML. Old, but both very much as essential for the WWW today as they were in the 90s.",t3_lxiou4,2021-03-05 10:59:49,2021-03-05
2810,gpqc9bn,t1_gpp6zq2,"Normal people don't have 10 BTC. Hell, normal people don't have 1 BTC.",t3_lxiou4,2021-03-05 10:56:07,2021-03-05
2811,gpr6zc7,t1_gpqes00,"Well, that's not always a good thing. Some billionaires are invested in some weeiiird stuff.",t3_lxiou4,2021-03-05 16:59:01,2021-03-05
2812,gprxiip,t1_gprb6s6,"That's his opinion. Anyone can have their own opinion, but it doesn't mean any of those opinions are true.",t3_lxiou4,2021-03-05 22:27:08,2021-03-05
2813,gpnujhn,t1_gpnfnrp,Yeah idk why people suggest kraken. It's such a piece of shit. Fuck kraken,t3_lxiou4,2021-03-04 23:34:24,2021-03-04
2814,gpoe5vz,t1_gpnfnrp,"Perfect buying opportunity, I'll be able to scoop up 21M BTC for $0. Neat!",t3_lxiou4,2021-03-05 01:55:43,2021-03-05
2815,gpo1fg3,t1_gpnwaal,Funk and Wagnalls did us good until the internet did them dirty.,t3_lxiou4,2021-03-05 00:24:35,2021-03-05
2817,gpnzrdl,t1_gpndc7e,"If you value Bitcoin in USD, it's always going to go up, because USD is guaranteed to lose value.

We win when we stop valuing Bitcoin in USD.  Instead, we will value goods and services in Bitcoin.",t3_lxiou4,2021-03-05 00:12:32,2021-03-05
2818,gppdwqy,t1_gpp715x,I think bitcoins popularity is linked to it being the first of its kind. There are plenty of better coins with more features out there yet Bitcoin perseveres. I think we’ll see another coin surpass Bitcoin in the future but not for a while. As to what coin that’ll be will be anyone’s guess. Right now I’d say Bitcoin is like yahoo or AOL but there is a “google” lurking in the shadows waiting to take the market from Bitcoin. It’s only a matter of time.,t3_lxiou4,2021-03-05 06:07:07,2021-03-05
2819,gpo23on,t1_gpnv5ki,2011 called... they want their opinion back.,t3_lxiou4,2021-03-05 00:29:26,2021-03-05
2820,gpnxhu4,t1_gpnv5ki,Is the dollar is backed by gold or something?,t3_lxiou4,2021-03-04 23:55:58,2021-03-04
2821,gpo1jae,t1_gpnv5ki,It’s backed by belief same as anything else.,t3_lxiou4,2021-03-05 00:25:22,2021-03-05
2822,gpqbzuj,t1_gpo31fc,I think so too. It’s 20x from here. I am 34. Hope to see it in my lifetime but honestly would not care if it happens when I’m 70+,t3_lxiou4,2021-03-05 10:53:45,2021-03-05
2823,gpqbq5i,t1_gppt835,$1M after next halving is more reasonanle but let’s see first where the price tops after 2020 halving. Will it keep 10x after each halving? Remains to be seen.,t3_lxiou4,2021-03-05 10:51:21,2021-03-05
2824,gprxns2,t1_gpr4ur1,There will be never more then a little bit less than $21M bitcoin in circulation.,t3_lxiou4,2021-03-05 22:28:20,2021-03-05
2825,gpo178g,t1_gpnc5m4,"Although this is true, he has been consistent with his actions and has been a believer in Bitcoin since 2011, when he was saying what he is saying today, but back then it took quite a lot more than now to publicly espouse his investment thesis into Bitcoin and to stake his career into it, back when everyone seeing what he was doing would have thought he was crazy.

So although it's true, this is no bandwagon fan boy. 

That he has been right all along and continues to believe this has not yet even started might tell you a lot more than those who have been negative about it. 

In the end this story is very similar to the story of the internet. Old people don't get it and over time the new generations can't live without it. Same story.",t3_lxiou4,2021-03-05 00:22:56,2021-03-05
2826,gpo70bz,t1_gpnc5m4,">is a person with a vested interest in the price of bitcoin going up, making a prediction that the pri

Or in other words he puts his money where his mouth is.",t3_lxiou4,2021-03-05 01:04:35,2021-03-05
2827,gpo5t34,t1_gpnc5m4,"Thank you

It's also true of the majority of content on this subreddit.

People who own Bitcoin want Bitcoin to go up... Shocking.",t3_lxiou4,2021-03-05 00:55:59,2021-03-05
2828,gpp8adx,t1_gpnc5m4,"Exactly, and everyone saying that bitcoin itself will replace all fiat currency is highly unlikely, precisely because of its noninflationary nature. It'll be traded like a commodity. Just like there's a finite amount of gold available, there's a finite amount of bitcoin, and because of that, it'll be unlikely for bitcoin to replace fiat.

Having said that, it's entirely possible and way more likely for governments to start their own cryptocurrencies that back their money.

(Also I also believe that bitcoin itself will fly to Andromeda and it's why I hodl)",t3_lxiou4,2021-03-05 05:25:43,2021-03-05
2829,gppir6d,t1_gpnc5m4,"I mean, true, but any Bitcoin believer is going to want the same.",t3_lxiou4,2021-03-05 06:44:43,2021-03-05
2830,gppkwrg,t1_gpnc5m4,"If looking at this cycle to repeat over the next halving; he's perfectly correct. [S2F](https://digitalik.net/btc/) 

How many BTC do you own?",t3_lxiou4,2021-03-05 07:01:47,2021-03-05
2831,gppssxd,t1_gpnc5m4,First thought i had when i read this elsewhere. BS article.,t3_lxiou4,2021-03-05 08:08:02,2021-03-05
2832,gppt8t3,t1_gpnc5m4,"The idea that the fed is just going to let this happen is devoid of reality, bitcoin is just rattling the USD once the fed adopts cryptocurrency dollars, bitcoin is going to deflate, there are too many forces working against it for it to be the winner. 

Wait till the CME starts shorting it again.",t3_lxiou4,2021-03-05 08:11:44,2021-03-05
2833,gpqaqjw,t1_gpnc5m4,Like how people who own dollars don't analyze the projected strength of the dollar - because they couldn't remain objective.,t3_lxiou4,2021-03-05 10:42:39,2021-03-05
2834,gpoxknr,t1_gpnvadw,standart is silly,t3_lxiou4,2021-03-05 04:10:14,2021-03-05
2835,gpotqqp,t1_gpnvadw,“ To infinity and beyond” buzz lightyear.  I’ll be stopping by the moon and Mars on the way. How bout u??,t3_lxiou4,2021-03-05 03:43:34,2021-03-05
2836,gpq8znp,t1_gpo040b,Actually btc has already replaced some world currencies,t3_lxiou4,2021-03-05 10:27:35,2021-03-05
2838,gpo1ps3,t1_gpnbh5y,Who wouldn't want to own a share of infinity.,t3_lxiou4,2021-03-05 00:26:37,2021-03-05
2839,gpqgkku,t1_gpnbh5y,thats not how risk works.,t3_lxiou4,2021-03-05 11:35:39,2021-03-05
2840,gpob30k,t1_gpnc5rq,"It'll never be zero and I can gaurantee it because if the price gets to $0.000000167/btc, then I'll buy all 21 million for three fitty.^((yes, I know 21,000,000 will never be available to buy))",t3_lxiou4,2021-03-05 01:33:48,2021-03-05
2842,gpo8cdq,t1_gpo2uc8,Username checks out.,t3_lxiou4,2021-03-05 01:14:12,2021-03-05
2843,gppklfl,t1_gpoahve,"The dude has consistency, but is anybody credible when it comes to predicting prices?",t3_lxiou4,2021-03-05 06:59:16,2021-03-05
2844,gpo7lct,t1_gpo3f4v,"Idk man, with bitcoin fees being as high as they are, I really think something like ethereum ot nano would make a better widely adopted crypto.",t3_lxiou4,2021-03-05 01:08:47,2021-03-05
2845,gpoeip2,t1_gpo8b16,"I think he’s saying that due to inflation, a million won’t be what it used to be when BTC hits it. The future million could easily be todays 650k or something atrocious like that.",t3_lxiou4,2021-03-05 01:58:11,2021-03-05
2846,gpnv70l,t1_gpnfrxr,"No please not this, I barely survived last time I saw this in the curriculum.",t3_lxiou4,2021-03-04 23:39:14,2021-03-04
2847,gpnxvth,t1_gpnfrxr,"It was i , Dio",t3_lxiou4,2021-03-04 23:58:49,2021-03-04
2848,gpocq1r,t1_gpo2tv0,I have mine on an online wallet. What brand do you recommend for hardware?,t3_lxiou4,2021-03-05 01:45:30,2021-03-05
2849,gpo1w9t,t1_gpo1qk5,Fair. Can’t judge a Becky by their cover!,t3_lxiou4,2021-03-05 00:27:56,2021-03-05
2850,gpockur,t1_gpo1qk5,But do you got that good hair?,t3_lxiou4,2021-03-05 01:44:28,2021-03-05
2851,gprisuj,t1_gpo1qk5,"Me too.  Forty something, three kids and actually hilarious how every other post assumes everyone posting and reading is a dude (um of either 20 or 50+)",t3_lxiou4,2021-03-05 19:56:45,2021-03-05
2852,gpp2ppb,t1_gpp2m03,Fully agreed. This is the only path to mainstream adoption.,t3_lxiou4,2021-03-05 04:46:16,2021-03-05
2853,gpp9e8r,t1_gpp2m03,">il.  It's possible, but highly unusual.  
>  
>If Bitcoin goes truly mainstream, I expect we'll see the bank and credit card industry morph into custodial wallet providers.

That's ultimately what I've been thinking is required - most people value convenience and speed over control of their assets, and the greatest risk to security is losing your keys or your wallet. (Hell, I've lost some Bitcoin when a HD died ).

Sadly, I believe the bank and credit card industry is key to adoption.  Still an improvement over the current system where your total balance is held hostage by a single institution, but not the total shift that we may have imagined ten years ago.",t3_lxiou4,2021-03-05 05:33:49,2021-03-05
2854,gpnwuay,t1_gpnst8b,Yeah we only want euphoric tribal maximalism here.,t3_lxiou4,2021-03-04 23:51:12,2021-03-04
2855,gpoeadg,t1_gpnst8b,BTC $1mil next week.,t3_lxiou4,2021-03-05 01:56:34,2021-03-05
2857,gpor1n3,t1_gpnvmke,Can't wait,t3_lxiou4,2021-03-05 03:25:32,2021-03-05
2858,gpo0wgj,t1_gpnvriq,!remind me 3 years,t3_lxiou4,2021-03-05 00:20:47,2021-03-05
2859,gpp936u,t1_gpnvriq,!remind me 3 years,t3_lxiou4,2021-03-05 05:31:34,2021-03-05
2860,gpoieu5,t1_gpo3emd,I’m so glad I didn’t listen to people like you when it hit $1k.,t3_lxiou4,2021-03-05 02:25:23,2021-03-05
2861,gpocia5,t1_gpo3emd,"That’s not a 5000% YoY growth though...? If that were the case, BTC would be worth $312.5 **billion** in four year’s time. $2.5 million within one year. 20x by itself is “just” 2000%. 

Assuming relatively consistent growth to a price target of $1 million in four years, you’d “only” need a growth rate of ~212.5% YoY.* It’s obviously still a lot, but nowhere near 5000%. 

*(Which would actually be pretty consistent with its  past YoY growth overall. ~272.5% to reach that price target in 3 years, ~153.5% for 7 years.)

**EDIT**: Just because BTC has grown in value exponentially in the past doesn’t mean it will continue to do so in the future. But it also doesn’t mean that it *won’t*.",t3_lxiou4,2021-03-05 01:43:58,2021-03-05
2862,gpo4j5e,t1_gpo3emd,"Yeahhhh not saying it won't go up by any means, but this sub is delusional",t3_lxiou4,2021-03-05 00:46:51,2021-03-05
2863,gpo5xkw,t1_gpo3emd,"Definitely not a bubble or manipulated though.

Totally usable as a currency when the price is so volatile also...",t3_lxiou4,2021-03-05 00:56:54,2021-03-05
2864,gpo4w26,t1_gpo165i,My pants,t3_lxiou4,2021-03-05 00:49:24,2021-03-05
2865,gppjhvk,t1_gpo7qwa,I think that's the point that he is trying to make. Hop on before the next halving or lose your chance.,t3_lxiou4,2021-03-05 06:50:34,2021-03-05
2866,gpor89b,t1_gpo4fxc,Ah yes the currency of the gods I say we all exchange our bitcoins to Ugandan Shillings,t3_lxiou4,2021-03-05 03:26:48,2021-03-05
2867,gppzlto,t1_gpo4fxc,"1 BTC is ***87,616,057,580*** Bolivars.

https://www.google.com/search?q=1+btc+to+ves",t3_lxiou4,2021-03-05 09:06:06,2021-03-05
2868,gpquyi2,t1_gpo4fxc,"1 Bitcoin equals

**193,241,048.00**

Cambodian Riel

[https://www.google.com/search?q=1+btc+to+KHR](https://www.google.com/search?q=1+btc+to+KHR)",t3_lxiou4,2021-03-05 14:08:26,2021-03-05
2869,gpo861q,t1_gpo72sm,100%. It’s possible in a few decades but other digital currencies will probably steal the market cap by then.,t3_lxiou4,2021-03-05 01:12:54,2021-03-05
2870,gpo7otd,t1_gpo6grb,"I know but I just bought, so now it’s the “peak” for me.... lol",t3_lxiou4,2021-03-05 01:09:29,2021-03-05
2871,gpo9f5n,t1_gpo7zmy,Shame me!!!! I agree lol - never took the time to learn about it - thought you had to buy a full coin etc. Should have taken the couple hours to learn,t3_lxiou4,2021-03-05 01:21:59,2021-03-05
2873,gpnx86o,t1_gpnwu64,That's not what I said. I said I'm NOT saying it's not going to go up.,t3_lxiou4,2021-03-04 23:54:01,2021-03-04
