,comment_id,comment_parent_id,comment_body,comment_link_id,created,date
2129,gs15v54,t1_gs15fo4,"They use separate address for every transaction. Order recording and tracking what address was used, and customer's information, amounts, and dates, has existed for a long time.",t3_mc16l9,2021-03-24 18:08:40,2021-03-24
2130,gs164rc,t1_gs15fo4,Unique address for each payment,t3_mc16l9,2021-03-24 18:12:56,2021-03-24
2131,gs1kh0x,t1_gs1hwyg,"The nodes literally \*are\* the ""worldwide bitcoin ecosystem of transaction verification"". If no one was running nodes, there would be no such ecosystem/network.

Of course, these days you can partake in that ecosystem without running a node, by relying on the nodes other people run, but then you:

a) have to trust whichever node you use (the entity running it could show you fake transactions) and

b) would expose all addresses you are interested in (that you lookup on the blockchain), essentially giving lots of private information to the entity that runs the node, like showing which addresses are yours, i.e. how much BTC you have, where else you transfer these BTC to, etc.

It makes sense for a company like Tesla to neither trust other nodes, nor to give the owners of those nodes access to the knowledge of which addresses Tesla uses.",t3_mc16l9,2021-03-24 21:00:40,2021-03-24
2132,gs1nnnn,t1_gs1lsjh,"No. Miners create blocks, nodes verify them and the consensus rules of the network.

Andreas Antonopolous:
https://www.youtube.com/watch?v=oX0Yrv-6jVs",t3_mc16l9,2021-03-24 21:28:05,2021-03-24
2135,gs1bxlx,t1_gs1bok8,"For what? Operating nodes? You realize that's not the same as mining, right?",t3_mc16l9,2021-03-24 19:32:59,2021-03-24
2136,gs1sq53,t1_gs1mdpp,"Stop gate keeping Bitcoin. If it's to be widely adopted everyone is going to use it, doesn't matter how rich you are. The only reason billionaires can noticably move the price is because the market cap is still small, if you buy a billion dollars worth of Bitcoin that isn't manipulation, that's just buying Bitcoin. Once it gets to a certain point the price will stabilize.",t3_mc16l9,2021-03-24 22:07:54,2021-03-24
2140,gs1ymq1,t1_gs1w14n,Ever heard of the lightning network?,t3_mc16l9,2021-03-24 22:51:22,2021-03-24
2142,gs176ks,t1_gs170d2,Surely it's both?,t3_mc16l9,2021-03-24 18:29:03,2021-03-24
2144,gs1qz3w,t1_gs1fdz3,"Also to verify the total supply. That whole ""scarcity"" thing.",t3_mc16l9,2021-03-24 21:54:37,2021-03-24
2149,gs1750t,t1_gs16i92,"Because without everyone running nodes for the last 12 years, Elon would not be buying Bitcoin. Bitcoin could not and would not have grown without the nodes. Miners are totally important, but securing the network and making it censorship resistant is about nodes. The more the better. It's great that Elon and the big boyz are playing now, but it's the little guys that built out the network. I guess that's what I was trying to say.",t3_mc16l9,2021-03-24 18:28:23,2021-03-24
2152,gs161k0,t1_gs15tbw,"No shortage of guides. bitcoincore.org

For receiving payments btcpayserver.org",t3_mc16l9,2021-03-24 18:11:29,2021-03-24
2153,gs169ej,t1_gs15tbw,"If you are going to just run a node, there are a few popular ones using Raspberry Pi:

- RaspiBolt

- ~~RaspiBolt~~ RaspiBlitz

- MyNode

Just google/duckduckgo them.

But you may want to take a look at this:

https://btcpayserver.org/",t3_mc16l9,2021-03-24 18:14:58,2021-03-24
2154,gs1738f,t1_gs15tbw,"The easiest is probably Bitcoin Core, because you just have to install the client.

If you don't want to use a fully fledged computer, use Umbrel on a Rasperry Pi. I don't think it gets much easier and cheaper than that, currently.",t3_mc16l9,2021-03-24 18:27:39,2021-03-24
2155,gs1fite,t1_gs15tbw,Yes plenty. If you’re not tech savvy then just buy one premade and learn to verify the signatures of Bitcoin.,t3_mc16l9,2021-03-24 20:13:25,2021-03-24
2158,gs1i6pa,t1_gs1esoh,"Well, then it might be a(nother) document I hope never gets leaked, since it might contain very sensitive information: The buyers name, home address and life savings to be monitored in real time!",t3_mc16l9,2021-03-24 20:39:41,2021-03-24
2159,gs1hu9t,t1_gs1frw6,"Yes but let's hope not the following occur:

- One day Tesla needs fiat but one deposit they got years ago gets flagged - sure, they can get all info etc. but the process might be a burden.

- One day Tesla gets hacked and little unaware hodler purchased directly from his cold wallet containing millions of USD (or just sent directly from cold to hot wallet making the cold wallet obvious) and this is leaked with his name and home address.",t3_mc16l9,2021-03-24 20:36:23,2021-03-24
2160,gs17jcf,t1_gs16grb,"I have read several tweets and messages that coinjoin funds now gets flagged! Even a year old deposit to Bitmex got flagged according to one guy (former Bitcoin developer I think)!

See for yourself!",t3_mc16l9,2021-03-24 18:34:18,2021-03-24
2163,gs1p6zr,t1_gs1ony6,Yes it is.,t3_mc16l9,2021-03-24 21:40:34,2021-03-24
2164,gs1zc3b,t1_gs1kh0x,Thank you for the explanation,t3_mc16l9,2021-03-24 22:56:23,2021-03-24
2166,gs1wvog,t1_gs1bxlx,Sorry thanks. You’re correct...missed my coffee and up at 3 am. Should have looked more closely,t3_mc16l9,2021-03-24 22:38:38,2021-03-24
2171,gs1ywhu,t1_gs1ymq1,Yeah. Do you know how much it costs today to move some bitcoin to the LN?,t3_mc16l9,2021-03-24 22:53:19,2021-03-24
2173,gs17y5b,t1_gs176ks,"It helps the network, but running a node cannot be solely based on altrustic reasons. It's a financial system and if we have learnt anything, a financial system doesn't run well on altruism.",t3_mc16l9,2021-03-24 18:40:20,2021-03-24
2176,gs17cdk,t1_gs1750t,"Ah, the English language strikes again. Ambiguity of the word “those”. Carry on",t3_mc16l9,2021-03-24 18:31:25,2021-03-24
2179,gs1gcuj,t1_gs169ej,You wrote raspibolt twice?,t3_mc16l9,2021-03-24 20:21:54,2021-03-24
2180,gs1apyh,t1_gs1738f,"> The easiest is probably Bitcoin Core, because you just have to install the client.

It's also [the most optimized](https://blog.lopp.net/2020-bitcoin-node-performance-tests/) with the shortest Initial Block Download (IBD) time.",t3_mc16l9,2021-03-24 19:18:01,2021-03-24
2181,gs1c50d,t1_gs1738f,"Will confirm, my first experience with using a Raspberry Pi was getting Umbrel installed for my first Bitcoin/Lightning node. It was super easy: https://getumbrel.com/",t3_mc16l9,2021-03-24 19:35:29,2021-03-24
2182,gs18fty,t1_gs17jcf,well its logical for people to want to protect their balance,t3_mc16l9,2021-03-24 18:47:29,2021-03-24
2183,gs1qgd2,t1_gs17jcf,"But that would be Tesla's problem. If you send BTC to them and they give you a Tesla back, they will then at some point have to use an exchange to change those BTC for USD. But will no longer be your problem and your BTC will be pooled with all of Tesla's BTC.",t3_mc16l9,2021-03-24 21:50:35,2021-03-24
2191,gs18fos,t1_gs17y5b,"I see your point, though was Bitcoin not built out of altruistic reasons? After all Satoshi has so far not cashed out, and so the network is for the people not just the user? Or like I believe for both. For me it's about sharing an ideal, an ideology of sovereignty. Of disruptive tech being used to over throw a legacy system that has out grown its use. If I used it purely to check my transactions, then I may as well switch it off, when not being used, and thereby not help the network, and only myself.",t3_mc16l9,2021-03-24 18:47:25,2021-03-24
2194,gs1dpjk,t1_gs17cdk,"Those that threw through those tough troughs, though, thought thoroughly otherwise.

English sucks",t3_mc16l9,2021-03-24 19:53:41,2021-03-24
2195,gs1bore,t1_gs17cdk,I ate English language!,t3_mc16l9,2021-03-24 19:29:59,2021-03-24
2199,gs1ixuw,t1_gs1gcuj,"I think they intended one of them to be RaspiBlitz. I recently set one up and it's great. Full BTC and Lightning node, and it even has a little touchscreen that shows node status and some other details.",t3_mc16l9,2021-03-24 20:46:49,2021-03-24
2201,gs1sib4,t1_gs1qgd2,"Yes, coinjoin would be Tesla's problem. Hack would be customers problem.",t3_mc16l9,2021-03-24 22:06:14,2021-03-24
2207,gs18o0z,t1_gs18fos,"Bitcoin may or may not have been built based on altrustic reasons. However, this doesn't matter. What matters is if it can continue existing without altrustic reasons.

> If I used it purely to check my transactions, then I may as well switch it off, when not being used, and thereby not help the network, and only myself.

A business cannot just switch of its nodes, unless they shut down Bitcoin payments. 

You may switch it off, but if it's switched of for too long, it takes some time to catch up with the latest blocks. Thus you have an incentive to keep your node online ""long enough"".

> For me it's about sharing an ideal, an ideology of sovereignty. 

Some people may have other reasons, that's not the point. Game theory requires that the game be stable if every actor acts individually rational. And imo that's the case with Bitcoin.",t3_mc16l9,2021-03-24 18:50:41,2021-03-24
2208,gs1ox9s,t1_gs18fos,Satoshi dead bro,t3_mc16l9,2021-03-24 21:38:26,2021-03-24
2209,gs1h813,t1_gs18fos,I don’t see the benefit in shutting down the node. For now they can test it while nobody is really using it I guess. But even later down the road they’re not gonna say “oh someone’s buying one  hold on let us boot up our node”. They’re going to leave it on,t3_mc16l9,2021-03-24 20:30:24,2021-03-24
2210,gs1pd5y,t1_gs1dpjk,Buffalo buffalo Buffalo buffalo buffalo buffalo Buffalo buffalo,t3_mc16l9,2021-03-24 21:41:57,2021-03-24
2212,gs1k5td,t1_gs1ixuw,"Could you tell me a bit more? Even if in DM. Total hardware cost? Which version did you choose? You say full btc and lightning, does it run both simultaneously?",t3_mc16l9,2021-03-24 20:57:57,2021-03-24
2219,gs1uucm,t1_gs1ox9s,The heart beat continues every ten mins.,t3_mc16l9,2021-03-24 22:23:48,2021-03-24
2221,gs1y4ev,t1_gs1pd5y,🐼 🐼 🐼 🐼,t3_mc16l9,2021-03-24 22:47:39,2021-03-24
2223,gs1rblb,t1_gs1k5td,"Sure! I used the guide here: [https://github.com/rootzoll/raspiblitz](https://github.com/rootzoll/raspiblitz)

Yes, it does run a full BTC node and Lightning Node simultaneously, and it's easy to enable other services like BTCpay (open source app for commercial transactions on the Lightning Network). I used a Pi4 with 8GB RAM, but that's overkill. It will work just fine with the 2GB or 4GB version.

All the parts cost me about $280 on Amazon. That includes: a 64GB SD card (also overkill, you probably only need a 16GB), Pi4 8GB, power supply, heat-sink case for the Pi, a 1TB SSD (the blockchain is only 350GB, so a 500GB SSD would work), an enclosure for the SSD, and a 3.5"" touchscreen.

The 1TB SSD and enclosure was a significant portion of the cost (\~$120).

The guide gives an Amazon parts list with specific hardware recommendations that they have tested and are known to work well. I think they also sell pre-assembled ones that are ready to go, if you're not so interested in setting it all up yourself.",t3_mc16l9,2021-03-24 21:57:14,2021-03-24
2228,gs1spsa,t1_gs1rblb,I really appreciate the response. Now to convince my wife...,t3_mc16l9,2021-03-24 22:07:50,2021-03-24
2233,gs1ue2n,t1_gs1spsa,"Happy to help!

>Now to convince my wife...

Sorry, *that* I can't help with. :D Good luck!

I recommend running a full node if you can, but it's also possible to run a lightweight node that does not contain the full blockchain:

[https://en.bitcoin.it/wiki/Lightweight\_node](https://en.bitcoin.it/wiki/Lightweight_node)

The lightweight node wouldn't require the SSD and you might be able to run it on cheaper hardware. I haven't looked into it much myself.",t3_mc16l9,2021-03-24 22:20:27,2021-03-24
2237,gs1wj82,t1_gs1ue2n,"Her hangup is, ""if there are already thousands of nodes, why do we need to run one?"" When I said, ""do you want to trust someone else, or yourself?"" She re-emphasized that adding one to thousands would be a drop in the bucket. She doesn't see the big picture. I'm pretty sure I'm going to still buy the stuff and run one, I just want her on my side. We're not hard up for money",t3_mc16l9,2021-03-24 22:36:09,2021-03-24
2242,gs1u502,t3_mc6p5c,Glad you're still here with us!,t3_mc6p5c,2021-03-24 22:18:35,2021-03-24
2244,gs1wqn5,t3_mc6p5c,haha nicely done 🚀,t3_mc6p5c,2021-03-24 22:37:38,2021-03-24
2254,gs1vf1b,t1_gs1u502,I'm still here on this wild coaster ride!,t3_mc6p5c,2021-03-24 22:27:59,2021-03-24
2255,gs1y05h,t1_gs1wqn5,Thank you!,t3_mc6p5c,2021-03-24 22:46:47,2021-03-24
2392,grzj30g,t3_mbqknd,Infinity divided by 21 million is........,t3_mbqknd,2021-03-24 07:02:57,2021-03-24
2393,grzp3mw,t3_mbqknd,fiat with no bottom == bitcoin with no top,t3_mbqknd,2021-03-24 07:53:06,2021-03-24
2394,grzfy1u,t3_mbqknd,"[Document Bitcoin Twitter](https://twitter.com/DocumentingBTC/status/1374403906671808515?s=20)

The price of Bitcoin has gone up $50,000 since this interview.

[Video link.](https://www.cbsnews.com/news/coronavirus-and-economy-best-and-worst-case-scenarios-60-minutes-2020-03-22/)",t3_mbqknd,2021-03-24 06:37:36,2021-03-24
2395,grziroz,t3_mbqknd,""" Neel Kashkari: You don't need to. Your ATM is safe. Your banks are safe.  There's enough cash in the financial system. And there's an infinite  amount of cash at the Federal Reserve. We will do whatever we need to do  to make sure that there's enough cash in the banking system. ""  


What a fucking idiot.",t3_mbqknd,2021-03-24 07:00:21,2021-03-24
2396,grzkwyi,t3_mbqknd,Is that a human?,t3_mbqknd,2021-03-24 07:18:04,2021-03-24
2397,grzz6jk,t3_mbqknd,If this is the case than someone explain to me why we bother paying taxes. Same with the multi-trillion bail outs. Why bother pay taxes if this shit just gets printed.,t3_mbqknd,2021-03-24 09:19:29,2021-03-24
2398,grzz6qv,t3_mbqknd,"“USD is backed by nukes.”

... well we don’t see people in the US running around and buying the North Korean won bonds, don’t we?",t3_mbqknd,2021-03-24 09:19:32,2021-03-24
2399,grzkt0l,t3_mbqknd,The start of a new era .,t3_mbqknd,2021-03-24 07:17:09,2021-03-24
2400,grzs09q,t3_mbqknd,$$$$$$$$$$$$$$$$$$$ to infinity and beyond,t3_mbqknd,2021-03-24 08:17:51,2021-03-24
2401,grzwhko,t3_mbqknd,You can tell by the look on his face that he doesn’t believe in this bullshit either.,t3_mbqknd,2021-03-24 08:55:52,2021-03-24
2402,grzje15,t3_mbqknd,He basically destroyed the $  on that one ...,t3_mbqknd,2021-03-24 07:05:31,2021-03-24
2403,grzxqmx,t3_mbqknd,You ever get the feeling this whole thing is a scripted comedy? I mean the guy’s name is Kashkari (Cash Carry).,t3_mbqknd,2021-03-24 09:06:49,2021-03-24
2404,grzumsl,t3_mbqknd,Thought that was bezos at first glance,t3_mbqknd,2021-03-24 08:40:05,2021-03-24
2405,gs0phav,t3_mbqknd,He's the Kirkland Signature Bezos,t3_mbqknd,2021-03-24 13:50:14,2021-03-24
2406,grzg3s3,t3_mbqknd,Can i get a link to the actual video?,t3_mbqknd,2021-03-24 06:38:52,2021-03-24
2407,grznkj1,t3_mbqknd,Haha. Money printer go brrrrrrrrr,t3_mbqknd,2021-03-24 07:40:12,2021-03-24
2408,grzuq5f,t3_mbqknd,"To be honest, I don't even think this was news worthy... Everyone has known for a long time that the Federal Reserve doesn't have a hard cap on the number of dollars it can create. It's common knowledge.",t3_mbqknd,2021-03-24 08:40:52,2021-03-24
2409,gs01yaf,t3_mbqknd,Good picture for a NFT,t3_mbqknd,2021-03-24 09:43:36,2021-03-24
2410,grzughd,t3_mbqknd,Well he aint wrong. There is an infinite amount of cash. But hey whos paying for the printer ink? Must be expensive. Where do they get the money for that? Lmao,t3_mbqknd,2021-03-24 08:38:34,2021-03-24
2411,grzlfv8,t3_mbqknd,"technically not true.  functionally, he isn't wrong.  As long as the feds have the right to print currency, they have the ability to have an infinite number of cash to give out.  They do not currently own an infinite amount,  but have the ability to print a near infinite amount.",t3_mbqknd,2021-03-24 07:22:24,2021-03-24
2412,gs0a9ye,t3_mbqknd,The look of a man who realized they said the quiet part out loud,t3_mbqknd,2021-03-24 10:57:39,2021-03-24
2413,gs0b9bx,t3_mbqknd,"Everyone talks about the money printer. And they should. Haven't we learned from Zimbabwe, or Argentina, or Venezuela, or \_\_\_\_ etc. ?

But what I want to know is: is that guy on coke, or adderal or what? I mean, he has given over 100% of his attention to the interviewer and I didn't think that was possible.",t3_mbqknd,2021-03-24 11:06:48,2021-03-24
2414,gs08gux,t3_mbqknd,OMG who put Lex Luther in charge of the Federal Reserve?!?!,t3_mbqknd,2021-03-24 10:41:09,2021-03-24
2415,gs09w39,t3_mbqknd,"That's that dude in Astapor that Dany torched when she took the Unsullied, right?",t3_mbqknd,2021-03-24 10:54:07,2021-03-24
2416,gs0anmv,t3_mbqknd,He could have been my Senator ^(except he ran as a Republican in California.),t3_mbqknd,2021-03-24 11:01:10,2021-03-24
2417,gs0dc1f,t3_mbqknd,Why does he look like a cheap knock off of Jeff bezos?,t3_mbqknd,2021-03-24 11:26:49,2021-03-24
2418,gs0djrf,t3_mbqknd,That’s why Modern Monetary Theory needs to be known everywhere.,t3_mbqknd,2021-03-24 11:29:00,2021-03-24
2419,gs0gtol,t3_mbqknd,"This mother fucker looks like my sisters boyfriend after i found him up in a tree hiding... Awake 4 and a half days. Lol true story


This guy just screams DO NOT TRUST ME!",t3_mbqknd,2021-03-24 12:03:00,2021-03-24
2420,gs0jodc,t3_mbqknd,Bitcoin is my bank account,t3_mbqknd,2021-03-24 12:35:00,2021-03-24
2421,gs16vr0,t3_mbqknd,And yet you still have to pay taxes,t3_mbqknd,2021-03-24 18:24:32,2021-03-24
2422,gs1bf3w,t3_mbqknd,"If it's infinite, that means I can just pass by and take $20,000 and everything good? That's all I need. But seriously, that ""infinite cash"" thinking is what get us in trouble",t3_mbqknd,2021-03-24 19:26:40,2021-03-24
2423,gs1dp06,t3_mbqknd,That guy looks like he just saw his grandmother naked,t3_mbqknd,2021-03-24 19:53:32,2021-03-24
2426,grzkyk4,t3_mbqknd,“SIR Can you look at me when I’m talking to you!”,t3_mbqknd,2021-03-24 07:18:26,2021-03-24
2427,grzsouk,t3_mbqknd,Moments in late stage American empire,t3_mbqknd,2021-03-24 08:23:40,2021-03-24
2428,gs014oa,t3_mbqknd,guy got brainwashed too much by government stonks,t3_mbqknd,2021-03-24 09:36:31,2021-03-24
2429,gs0a7ef,t3_mbqknd,"He looks like an actor they would pick to play king tut. Maybe he came back to life after his tomb was disturbed... maybe I’d look into it, if I wasn’t too busy trying to tap into that infinite amount of cash.",t3_mbqknd,2021-03-24 10:57:00,2021-03-24
2430,grzgkx3,t3_mbqknd,"Currency is just digits on a screen, and machines can be manipulated as we all know so 🤷🏼‍♂️

Anyway does anyone know how I can make a few hundred relatively quickly from let’s say £100? I’m kind of broke and figured I’d ask since I’m on the sub with investors 😂 any idea is appreciated!",t3_mbqknd,2021-03-24 06:42:42,2021-03-24
2431,gs087kk,t3_mbqknd,I once met a gorgeous cute young woman. She truly believed money was an infinite resource and her hero was AOC.,t3_mbqknd,2021-03-24 10:38:48,2021-03-24
2432,gs0rzsi,t3_mbqknd,.... anyone with a even basic understanding of monetary policy already knew this. It’s not historic. The people in cryptocurrency just don’t know shit about economics.,t3_mbqknd,2021-03-24 14:27:00,2021-03-24
2433,grzn56w,t3_mbqknd,"Good old Neel Kashkari, MN Fed President.",t3_mbqknd,2021-03-24 07:36:35,2021-03-24
2434,grzonav,t3_mbqknd,"Best that can be said about this is ""Former Treasury official""",t3_mbqknd,2021-03-24 07:49:19,2021-03-24
2435,grzp2wv,t3_mbqknd,The beginnings of a new meme,t3_mbqknd,2021-03-24 07:52:56,2021-03-24
2436,grztb4o,t3_mbqknd,A stroke will do that for ya,t3_mbqknd,2021-03-24 08:28:52,2021-03-24
2437,grzvw3g,t3_mbqknd,O_O,t3_mbqknd,2021-03-24 08:50:44,2021-03-24
2438,grzwnuf,t3_mbqknd,Such an important moment for the history of money.,t3_mbqknd,2021-03-24 08:57:24,2021-03-24
2439,grzwo64,t3_mbqknd,These eyes..... cry every night.....for you (bitcoin),t3_mbqknd,2021-03-24 08:57:29,2021-03-24
2440,grzxe08,t3_mbqknd,Expression says it all.,t3_mbqknd,2021-03-24 09:03:45,2021-03-24
2441,grzxl6r,t3_mbqknd,Man I think about all the people who no bought a boatload of Bitcoin when it was a 100$ man I’m so jealous hahahah just think a Starcraft tournament gave out Bitcoin for winning. They are rich now hahaha,t3_mbqknd,2021-03-24 09:05:28,2021-03-24
2442,grzxtr1,t3_mbqknd,I guess if you’re printing trillions of dollars every month he’s not wrong 🤷🏻‍♂️ lol,t3_mbqknd,2021-03-24 09:07:35,2021-03-24
2443,grzyqez,t3_mbqknd,His eyes say it all.,t3_mbqknd,2021-03-24 09:15:31,2021-03-24
2444,grzyrfb,t3_mbqknd,Those eyes though,t3_mbqknd,2021-03-24 09:15:46,2021-03-24
2445,grzza5e,t3_mbqknd,Fr,t3_mbqknd,2021-03-24 09:20:22,2021-03-24
2446,gs00fe1,t3_mbqknd,The expression of his face says it all.,t3_mbqknd,2021-03-24 09:30:26,2021-03-24
2447,gs01j38,t3_mbqknd,This man about to wreck a reserve currency’s whole career,t3_mbqknd,2021-03-24 09:39:58,2021-03-24
2448,gs05gkv,t3_mbqknd,"The irony. 

Everything in existence can be multiplied or divided. It doesn't matter what the currency or exchange. Decentralized or centralized. It's all perception. 

What truly matters is balancing order and chaos. Interpretation of that will vary.",t3_mbqknd,2021-03-24 10:14:21,2021-03-24
2449,gs064bh,t3_mbqknd,I dont understand what is going on here. Can someone eli5 me this?,t3_mbqknd,2021-03-24 10:20:11,2021-03-24
2450,gs06r3k,t3_mbqknd,Infinite money = btc 🚀,t3_mbqknd,2021-03-24 10:25:49,2021-03-24
2451,gs0733w,t3_mbqknd,"The fear in his eyes. 

He knows the dollar is toilet paper..",t3_mbqknd,2021-03-24 10:28:46,2021-03-24
2452,gs09ogm,t3_mbqknd,"That’s the issue with the fed. They create illusion by printing cash, soon you see prices going to the sky. 

Resources are limited I don’t get why politicians take the easy way, printing money creates more and more inflation. 

The issue is that our society now expects to get cash form government in difficult times, with bitcoin that would never happen because u can’t print more bitcoin, then the system becomes more evil from
The perspective of the poor.",t3_mbqknd,2021-03-24 10:52:08,2021-03-24
2453,gs0adyc,t3_mbqknd,Crypto  is worthless. U fkd the wrong guy,t3_mbqknd,2021-03-24 10:58:40,2021-03-24
2454,gs0bw7j,t3_mbqknd,I still use cash for day to day transactions but I don’t trust it as a store of value.,t3_mbqknd,2021-03-24 11:12:50,2021-03-24
2455,gs0ctrn,t3_mbqknd,His face is pure gold. Kashkari the crazy fiat man,t3_mbqknd,2021-03-24 11:21:46,2021-03-24
2456,gs0cz7o,t3_mbqknd,scary face,t3_mbqknd,2021-03-24 11:23:15,2021-03-24
2457,gs0d7hi,t3_mbqknd,Mmt,t3_mbqknd,2021-03-24 11:25:32,2021-03-24
2458,gs0k1d6,t3_mbqknd,They just keep printing,t3_mbqknd,2021-03-24 12:39:16,2021-03-24
2459,gs0k1pw,t3_mbqknd,🚀🚀🚀🌑🌒🌗🌕🌔🌖🌘🌓🦍🦍💎💎👋👋,t3_mbqknd,2021-03-24 12:39:23,2021-03-24
2460,gs0kk5v,t3_mbqknd,"For those NOT in the know, what's the background?",t3_mbqknd,2021-03-24 12:45:18,2021-03-24
2461,gs0mx88,t3_mbqknd,$Free .ninety nine,t3_mbqknd,2021-03-24 13:15:11,2021-03-24
2462,gs0o1yb,t3_mbqknd,"Criminals, the lot of them.",t3_mbqknd,2021-03-24 13:30:21,2021-03-24
2463,gs0qmrj,t3_mbqknd,😂,t3_mbqknd,2021-03-24 14:06:46,2021-03-24
2464,gs0rwfw,t3_mbqknd,Link,t3_mbqknd,2021-03-24 14:25:37,2021-03-24
2465,gs0shr7,t3_mbqknd,Inflation is infinite too,t3_mbqknd,2021-03-24 14:34:40,2021-03-24
2466,gs0t8ez,t3_mbqknd,"This is the Jeff Bezos that says, ""YARRRP!""",t3_mbqknd,2021-03-24 14:46:08,2021-03-24
2467,gs0uoj1,t3_mbqknd,can someone post a link to this interview please?,t3_mbqknd,2021-03-24 15:08:40,2021-03-24
2468,gs0upcm,t3_mbqknd,the quiet part loud,t3_mbqknd,2021-03-24 15:09:00,2021-03-24
2469,gs0wd35,t3_mbqknd,a proof how 1 BTC is always 1 BTC,t3_mbqknd,2021-03-24 15:34:04,2021-03-24
2470,gs0yh4m,t3_mbqknd,This dude looks coked out. The eyes give it away.,t3_mbqknd,2021-03-24 16:07:06,2021-03-24
2471,gs0z7f7,t3_mbqknd,Means BTC == $ Infinity :D,t3_mbqknd,2021-03-24 16:18:46,2021-03-24
2472,gs100eo,t3_mbqknd,"LOL. This happened when watching the video.

https://i.imgur.com/YA2XCGh.jpg",t3_mbqknd,2021-03-24 16:31:36,2021-03-24
2473,gs123pz,t3_mbqknd,I keep thinking of [this clip](https://www.youtube.com/watch?v=GI7sBsBHdCk). Before it's time!,t3_mbqknd,2021-03-24 17:06:27,2021-03-24
2474,gs12mz9,t3_mbqknd,"https://m.youtube.com/watch?v=VkuWlky5MXI

30second clip and cartoon of him with the money printer! Bbbbrrrrrrrrrrr 🖨💸💸💸💸💸💸",t3_mbqknd,2021-03-24 17:15:28,2021-03-24
2475,gs13t9h,t3_mbqknd,"Improve your financial status with your little capital, make your dreams of investments come through today by joining a live changing platform,and get 90-95% accurate signals daily and massive return on investment, for more info DM ME 

privezatrading.com",t3_mbqknd,2021-03-24 17:35:15,2021-03-24
2476,gs13wtr,t3_mbqknd,Link to full interview?,t3_mbqknd,2021-03-24 17:36:54,2021-03-24
2477,gs16duc,t3_mbqknd,That is not a human being speaking...,t3_mbqknd,2021-03-24 18:16:54,2021-03-24
2478,gs16hc9,t3_mbqknd,That's true tho. Infinite amounts of paper currency = Just some piece of horse shit.,t3_mbqknd,2021-03-24 18:18:24,2021-03-24
2479,gs16q08,t3_mbqknd,"But in fact, this interview did not have much impact on the crypto industry.",t3_mbqknd,2021-03-24 18:22:06,2021-03-24
2480,gs16vjg,t3_mbqknd,1 satoshi = 1 dollar,t3_mbqknd,2021-03-24 18:24:27,2021-03-24
