,comment_id,comment_parent_id,comment_body,comment_link_id,created,date
1409,gs1sw5z,t3_mbznz6,"for all you hackers out there, dont look to target the guys who claim they would never sell their btc for a tesla.  They clearly haven't been in the game long enough and dont have enough to afford buying a tesla",t3_mbznz6,2021-03-24 22:09:14,2021-03-24
1410,gs1t0x4,t3_mbznz6,"Moon Lambo is so 2017, Now we have Mars Tesla!",t3_mbznz6,2021-03-24 22:10:15,2021-03-24
1411,gs1u3hb,t3_mbznz6,Meh,t3_mbznz6,2021-03-24 22:18:17,2021-03-24
1412,gs1ua7p,t3_mbznz6,Elon wants to get to Mars so he can set up his Solar panels and mine bitcoin then he will take over the universe😂😂,t3_mbznz6,2021-03-24 22:19:40,2021-03-24
1413,gs1unst,t3_mbznz6,"Tesla has always \*been\* the ""Lambo""",t3_mbznz6,2021-03-24 22:22:27,2021-03-24
1414,gs1uqpz,t3_mbznz6,No elon can now buy your bitcoin for a tesla,t3_mbznz6,2021-03-24 22:23:04,2021-03-24
1415,gs1uw02,t3_mbznz6,Bullish fo sho,t3_mbznz6,2021-03-24 22:24:08,2021-03-24
1416,gs1vh3z,t3_mbznz6,"People here are way more excited than on the Tesla subs, but I think this will be great for Tesla, and Bitcoin.",t3_mbznz6,2021-03-24 22:28:24,2021-03-24
1417,gs1w33k,t3_mbznz6,"I can imagine a point where Elon Musk has the maximum Bitcoins from every exchange, wallet, coin ... and he gets to decide what the new Martian currency will be without any bank or country telling him what his new fiat currency is actually worth.... 

He can ship minerals from Mars and Asteroids and sell it off against either Bitcoins or against the world economy stock market ... he won't be controlled by Terran governments that cant get off the rock without SpaceX.",t3_mbznz6,2021-03-24 22:32:54,2021-03-24
1418,gs1x823,t3_mbznz6,"Indeed you can, just tested ;)",t3_mbznz6,2021-03-24 22:41:07,2021-03-24
1419,gs1xifj,t3_mbznz6,It a high risk for Tesla when bitcoin crashes and there going to be left holding the losses. That will also effect the Tesla stock. Or he will just cash out the bitcoin back to 1.5 billion which means this won’t matter.,t3_mbznz6,2021-03-24 22:43:13,2021-03-24
1420,gs1xils,t3_mbznz6,Yeah but will they be accepting Doge? If Elon is so bullish on Doge surely he will sell you a Tesla in exchange for Doge coin.,t3_mbznz6,2021-03-24 22:43:15,2021-03-24
1421,gs1ymtn,t3_mbznz6,I want to buy a Tesla with bitcoin investments and a Japanese dog with dogecoin. These are my crypto goals.,t3_mbznz6,2021-03-24 22:51:24,2021-03-24
1422,gs1yngd,t3_mbznz6,"Huge news for Bitcoin. As of now, BTC is up +4,20% (lmao). Probably the market thinks that it’s positive that a big company is accepting bitcoin.",t3_mbznz6,2021-03-24 22:51:31,2021-03-24
1423,gs1ypi0,t3_mbznz6,"He is pumping BTC, it went to $57k",t3_mbznz6,2021-03-24 22:51:56,2021-03-24
1424,gs1z351,t3_mbznz6,"Elon can now 'print' teslas for bitcoin, genius he is!",t3_mbznz6,2021-03-24 22:54:38,2021-03-24
1425,gs1zsqc,t3_mbznz6,"Papa Elon. Can we pay with Doge?

All it takes is you Elon. Accept the Doge.. send it to the moon!",t3_mbznz6,2021-03-24 22:59:37,2021-03-24
1505,gs160io,t3_mbznz6,Maybe time to really invest into dogecoin? 🤔,t3_mbznz6,2021-03-24 18:11:01,2021-03-24
1506,gs1llmr,t3_mbznz6,Tesla and bitcoin will crash together,t3_mbznz6,2021-03-24 21:10:37,2021-03-24
1515,gs1e0vk,t1_gs19xv2,Teslas are the new tether?,t3_mbznz6,2021-03-24 19:57:13,2021-03-24
1516,gs1utcs,t1_gs19xv2,"This is exactly the right thinking to have.

Elon Musk has found a way to get BTC from weak hands.",t3_mbznz6,2021-03-24 22:23:36,2021-03-24
1517,gs1f0dv,t1_gs19xv2,This is the way it will be viewed in the future.,t3_mbznz6,2021-03-24 20:07:58,2021-03-24
1518,gs1u06x,t1_gs19xv2,Thats smart,t3_mbznz6,2021-03-24 22:17:35,2021-03-24
1521,gs0zdza,t1_gs0yrj6,Extremely bullish just because of elon remark,t3_mbznz6,2021-03-24 16:21:40,2021-03-24
1522,gs1g7hj,t1_gs0yrj6,"This is the moment you know they get it, they're invested and not just doing some simple cash grab partnering with some crypto payment processor.",t3_mbznz6,2021-03-24 20:20:22,2021-03-24
1523,gs18dbt,t1_gs0yrj6,Technoking of Tesla!,t3_mbznz6,2021-03-24 18:46:28,2021-03-24
1524,gs11nyo,t1_gs0yrj6,This is the way.,t3_mbznz6,2021-03-24 16:59:08,2021-03-24
1525,gs13jw8,t1_gs0yrj6,"Elon is such a boss, anyone betting against this guy right now deserves to lose money and credibility.",t3_mbznz6,2021-03-24 17:30:50,2021-03-24
1526,gs15w9g,t1_gs0yrj6,Papa Elon,t3_mbznz6,2021-03-24 18:09:10,2021-03-24
1527,gs1cs8l,t1_gs0yrj6,"This motherfucker is about to mine in space to reduce cooling costs or some crazy shit like that. 

This explains the internet satellites - no internet in space, can't mine in space.",t3_mbznz6,2021-03-24 19:43:08,2021-03-24
1528,gs1dln5,t1_gs0yrj6,a spring must compress before it can release its energy.,t3_mbznz6,2021-03-24 19:52:29,2021-03-24
1529,gs1ezxu,t1_gs0yrj6,Yes this is crazy no dumbass bitpay and their circus of having to pick a wallet to send from.,t3_mbznz6,2021-03-24 20:07:50,2021-03-24
1530,gs1f8ju,t1_gs0yrj6,Everyone HODL!!!,t3_mbznz6,2021-03-24 20:10:26,2021-03-24
1531,gs1irki,t1_gs0yrj6,No discount. Thanks but no thanks,t3_mbznz6,2021-03-24 20:45:10,2021-03-24
1532,gs1neha,t1_gs0yrj6,Waiting for when I can buy my model Y with Dogecoin,t3_mbznz6,2021-03-24 21:25:59,2021-03-24
1533,gs1r5l5,t1_gs0yrj6,How would Tesla pay its bills if everyone paid in bitcoin and expenses are in fiat?  Will it borrow against its bitcoin holdings?,t3_mbznz6,2021-03-24 21:55:59,2021-03-24
1534,gs1x6ny,t1_gs0yrj6,Wow. I wonder how they will recognize revenue for those sales.,t3_mbznz6,2021-03-24 22:40:50,2021-03-24
1537,gs12pbh,t1_gs0zsfa,"But...whoever pays for a Tesla first (using Bitcoin) is going to have a very, very cool story to tell. 

I can’t wait for Elon to send tweets updating how many cars were purchased with Bitcoin. 

I’m sure there’s a way to track how much BTC is sent to their wallet, right?",t3_mbznz6,2021-03-24 17:16:32,2021-03-24
1538,gs10v5d,t1_gs0zsfa,🙏,t3_mbznz6,2021-03-24 16:45:48,2021-03-24
1541,gs1a00d,t1_gs128de,\*MIC DROPPED\*,t3_mbznz6,2021-03-24 19:08:48,2021-03-24
1542,gs1p4wz,t1_gs128de,Btc is the only one that will make it long term 😂 km surprised ETH is still around.,t3_mbznz6,2021-03-24 21:40:08,2021-03-24
1543,gs1iwa2,t1_gs1a5br,Currency can be exchanged for goods and services,t3_mbznz6,2021-03-24 20:46:23,2021-03-24
1544,gs1e11u,t1_gs1a5br,Spend then replace.,t3_mbznz6,2021-03-24 19:57:17,2021-03-24
1545,gs1di9s,t1_gs1a5br,"Soon it will be worth 2 Tesla... then 3, then 4...",t3_mbznz6,2021-03-24 19:51:24,2021-03-24
1546,gs1jzpq,t1_gs1a5br,"I can't possibly be the only one who sees the irony in these kinds of statements. If everyone is still HODLing even when companies start accepting BTC as payment, where's the incentive for mass adoption?",t3_mbznz6,2021-03-24 20:56:24,2021-03-24
1547,gs1f2eu,t1_gs1a5br,"I’d buy the roadster but never for all my stash, those cars last a long time the only thing you need to change is the tires and battery assuming it doesn’t crash.",t3_mbznz6,2021-03-24 20:08:34,2021-03-24
1548,gs1hwqx,t1_gs1a5br,What will you do when a Tesla is 0.1 BTC?,t3_mbznz6,2021-03-24 20:37:03,2021-03-24
1550,gs1ctgw,t1_gs1a5br,i bought my first btc back in 2012 but i was spending them. Why do people want to keep holding? treat it like a currency n spend it no?,t3_mbznz6,2021-03-24 19:43:31,2021-03-24
1551,gs1kju5,t1_gs1a5br,"I said the same thing - that I wouldn't buy a Tesla without a nice discount, and got downvoted to oblivion.",t3_mbznz6,2021-03-24 21:01:20,2021-03-24
1553,gs1en7h,t1_gs1alff,That's some rpg sentence if I haven't seen one,t3_mbznz6,2021-03-24 20:04:00,2021-03-24
1555,gs1pjft,t1_gs1mnxb,Maybe that’s the big one for the next cycle in 4 years.,t3_mbznz6,2021-03-24 21:43:22,2021-03-24
1557,gs18t37,t1_gs18kd2,It's definitely there. Perhaps it's limited to certain countries?,t3_mbznz6,2021-03-24 18:52:36,2021-03-24
1559,gs1dkf0,t1_gs18qlh,"> Why don't people use bitcoin instead of fiat, they're so stupid, bitcoin should be adopted worldwide

Company accepts bitcoin as payment.

> Haha only idiots would exchange their bitcoins for goods",t3_mbznz6,2021-03-24 19:52:06,2021-03-24
1560,gs195nk,t1_gs18qlh,"That's true of fiat currency too, especially if they keep printing more.",t3_mbznz6,2021-03-24 18:57:27,2021-03-24
1561,gs1awb5,t1_gs18qlh,Exactly my thoughts😅 potentially the most expensive car ever.,t3_mbznz6,2021-03-24 19:20:13,2021-03-24
1562,gs1ng2h,t1_gs18qlh,Or the opposite can happen.,t3_mbznz6,2021-03-24 21:26:21,2021-03-24
1563,gs14mya,t1_gs126f4,"It would be considered as business barter transaction, still taxable.",t3_mbznz6,2021-03-24 17:48:56,2021-03-24
1564,gs19h69,t1_gs126f4,"Maybe you will get a tax refund, buy BTC for the sole purpose of buying a tesla (to send a message),claim fees as a loss and if Btcusd goes down when making the purchase claim a loss.",t3_mbznz6,2021-03-24 19:01:53,2021-03-24
1567,gs1w1tx,t1_gs1dom5,"> Otherwise, Tesla will reap any change in BTC price. Seems like Elon has found new way to hedge against inflation and earn more $$$ per vehicle ...

I'm super new to Bitcoin. Just bought in the other night. But, to a newbie like me, this seems like incredible news. Musk, and Tesla as a whole, are essentially convinced that the value of Bitcoin will continue to rise, even after this huge climb it has had. Even for people who are just holding on to their coins, this seems like a huge boon.",t3_mbznz6,2021-03-24 22:32:39,2021-03-24
1568,gs1kva1,t1_gs19671,"Oh man, what are they gonna do about it lmao",t3_mbznz6,2021-03-24 21:04:09,2021-03-24
1570,gs0xzhm,t1_gs0xsej,They make tessie's for 35K now. So .7BTC,t3_mbznz6,2021-03-24 15:59:28,2021-03-24
1571,gs1vo69,t1_gs15urx,"Da fuq you talkin bout?  Lambo dealers have been taking BTC since 2013.

You do know the difference between Tesla and *every other car company in the world*, right?  Tesla owns and controls all the dealerships.  Every other car company got antitrusted into having to have separate manufacturing that merely delivers to sales outlets.

This is also why I would never buy a Tesla.  Every other car company, if something breaks, there are aftermarket parts manufacturers.  With Tesla, your only two options are to buy the sole-source part from Tesla, or find a junkyard with a wrecked vehicle you can cannibalize.  And Tesla's prices range from ridiculous to ""no we won't sell you that, buy a new car or fuck off.""",t3_mbznz6,2021-03-24 22:29:51,2021-03-24
1572,gs1lb5t,t1_gs1cjn4,This would be a great incentive to buy in Bitcoin. And good for Tesla as it would incentivize sales during dips.,t3_mbznz6,2021-03-24 21:08:05,2021-03-24
1573,gs1y2vo,t1_gs1lmhp,What's a Lambo/pambo?,t3_mbznz6,2021-03-24 22:47:20,2021-03-24
1574,gs1y7gn,t1_gs13i7w,Someone is offended. 🤣,t3_mbznz6,2021-03-24 22:48:17,2021-03-24
1576,gs1hsw3,t1_gs1gmtk,Yes,t3_mbznz6,2021-03-24 20:36:01,2021-03-24
1577,gs1bj8a,t1_gs167vd,"There will always be ppl selling their BTC. Especially if you're an early adopter. You can now buy a Tesla with your 100 dollar investment lol.

Aside from that, I am confident other institutions will follow. Bullish news both in isolation that it is now deemed a payment system (so has utility), to the wider implications of price apprecation for all holders at the retail and institutional level. More PR will lead to more adoption.",t3_mbznz6,2021-03-24 19:28:06,2021-03-24
1578,gs1xyv3,t1_gs1ge52,What is a lambo?,t3_mbznz6,2021-03-24 22:46:32,2021-03-24
1583,gs1em3e,t1_gs1cft3,"Think about it more as being able to store all your money as BTC and spend out of it without having to hold depreciating fiat.

Meaning, if you’re gonna buy a Tesla anyway all cash this doesn’t change anything except it makes it easier to only hold BTC",t3_mbznz6,2021-03-24 20:03:39,2021-03-24
1584,gs1evsn,t1_gs1e97t,Its only in the US atm that might be why,t3_mbznz6,2021-03-24 20:06:36,2021-03-24
1585,gs1p7j5,t1_gs1flkq,That's a privately owned trademark. It's legally centralized. It's a scam when it's sold as cryptocurrency because cryptocurrency is all about decentralization.,t3_mbznz6,2021-03-24 21:40:42,2021-03-24
1587,gs1dsc6,t1_gs1d4bo,"Hello sir, may I interested you in a door?",t3_mbznz6,2021-03-24 19:54:33,2021-03-24
1588,gs1k65v,t1_gs1eqv9,Try it in incognito mode. Looks like they’re rolling it out right now,t3_mbznz6,2021-03-24 20:58:02,2021-03-24
1589,gs1lbe2,t1_gs1eqv9,Try pressing Alt+F4 when you get to the payments page,t3_mbznz6,2021-03-24 21:08:08,2021-03-24
1590,gs1petc,t1_gs1nsp4,"Honestly, there’s some of us here that were following him on Twitter when he had under 10,000 followers. Agree it seems dumb, but to all of us that were there before he became a household name it does feel like we personally know him a bit.

That’s not to say we don’t cringe hard when he does something dickish like spread COVID nonsense or ‘take the red pill’ tweets.",t3_mbznz6,2021-03-24 21:42:19,2021-03-24
1592,gs1a31y,t1_gs17qhe,Tesla’s are a lot cheaper lol,t3_mbznz6,2021-03-24 19:09:53,2021-03-24
1593,gs19p5n,t1_gs15v3m,gtfo,t3_mbznz6,2021-03-24 19:04:56,2021-03-24
1594,gs1d836,t1_gs15v3m,Sorry bud only assets that are worth anything,t3_mbznz6,2021-03-24 19:48:09,2021-03-24
1595,gs1da7o,t1_gs1bmlz,"If you acquired .65 btc back in September, $6,500 for a model 3 doesn’t sound so bad. 

That’s the sentiment at least.",t3_mbznz6,2021-03-24 19:48:49,2021-03-24
1596,gs1d349,t1_gs1bmlz,"Eh if all of their extra cash is in bitcoin, in a lot of cases it saves them time/money/energy from not having to convert it to fiat. If I had to buy a new car all of a sudden I would have to dip into my bitcoin, so I get it. Personally I would just Uber, but some people need a car. 

More importantly, anyone who does decide to buy a car with their bitcoin will be giving it directly to someone who is gonna hodl.",t3_mbznz6,2021-03-24 19:46:34,2021-03-24
1597,gs1vq1h,t1_gs1bmlz,"It's about adoption dude, That's what drives bitcoins price fundamentaly.",t3_mbznz6,2021-03-24 22:30:14,2021-03-24
1598,gs15ohh,t1_gs15knz,u ok bro?,t3_mbznz6,2021-03-24 18:05:45,2021-03-24
1599,gs1jxnn,t1_gs1j7gk,You can get laughed at. Enjoy lol,t3_mbznz6,2021-03-24 20:55:54,2021-03-24
1600,gs18fhv,t1_gs15yhk,No we don’t.,t3_mbznz6,2021-03-24 18:47:20,2021-03-24
1601,gs1d907,t1_gs15yhk,Sorry bud only assets that are worth anything,t3_mbznz6,2021-03-24 19:48:25,2021-03-24
1602,gs159gl,t1_gs11dng,Well technically all world can see your account but they wont know this account is your account,t3_mbznz6,2021-03-24 17:59:06,2021-03-24
1605,gs16pkq,t1_gs160io,"As much as I have a soft spot for that particular joke-alt, I'd be absolutely miffed if Tesla did that. 

But then again, you can make your Tesla fart so who knows.",t3_mbznz6,2021-03-24 18:21:55,2021-03-24
1610,gs1ytw2,t1_gs1e0vk,I own 1.75 tesla's 😏🤔😉,t3_mbznz6,2021-03-24 22:52:50,2021-03-24
1611,gs1iw3r,t1_gs1e0vk,"Not the new but have become the based standard for the phrase ""when Lambo"". Such a bullish statement by Musk will definitely take the bull off this chart.
>New tether? [MARK](http://benchmarkprotocol.finance) is the new tether; stable and secured🙂",t3_mbznz6,2021-03-24 20:46:21,2021-03-24
1614,gs1p6f2,t1_gs1g7hj,"bitcoiners knew Elon got it a long time ago.

this is the moment Elon slaps the general public across the face with bitcoin's cock.",t3_mbznz6,2021-03-24 21:40:27,2021-03-24
1615,gs1xrig,t1_gs1g7hj,I just hope they are properly securing and auditing their wallets.,t3_mbznz6,2021-03-24 22:45:03,2021-03-24
1618,gs1now2,t1_gs18dbt,"This guy wants to create a techno feudalist empire on Mars, complete with indentured servitude, and piggybacked off of decades of taxpayer funded government research and private inheritance to get where he is today. And temporarily frustrated millionaire tech bros ironically laud this guy as a king.

 The billionaire genius auteur is a myth and this tax dodging scum is no exception. The subsidies granted to Tesla should have gone into hospitals, schools, and infrastructure. Not to some unelected piece of shit who wants to play spaceman and privately real the gains. ""Papa Elon"" lmao.",t3_mbznz6,2021-03-24 21:28:22,2021-03-24
1619,gs1nh3j,t1_gs18dbt,Also former CEO of Dodgecoin,t3_mbznz6,2021-03-24 21:26:35,2021-03-24
1620,gs1dsk1,t1_gs11nyo,This is the way.,t3_mbznz6,2021-03-24 19:54:37,2021-03-24
1621,gs15nug,t1_gs13jw8,Na he is a dick just cos he's been positive for crypto don't mean he's a great guy,t3_mbznz6,2021-03-24 18:05:28,2021-03-24
1622,gs1xo8a,t1_gs15w9g,I love it when you call me that.,t3_mbznz6,2021-03-24 22:44:24,2021-03-24
1623,gs1fgr2,t1_gs1cs8l,Sorry to break it to ya but heat management in space is orders of magnitude more challenging then on Earth due to no convection and direct solar irradiation. Bitcoin mining in space would be inefficient and much more challenging than just doing it on the surface. Literally no reason to mine in space. =),t3_mbznz6,2021-03-24 20:12:49,2021-03-24
1624,gs1ck22,t1_gs12pbh,Surely someone has by now right? It’s been available for like 5-6 hours,t3_mbznz6,2021-03-24 19:40:27,2021-03-24
1625,gs1afis,t1_gs12pbh,NFT that purchase and buy 100 more Teslas,t3_mbznz6,2021-03-24 19:14:18,2021-03-24
1627,gs1z9ko,t1_gs1p4wz,I diversified 10% of my portfolio into shit coins. That was a mistake.,t3_mbznz6,2021-03-24 22:55:53,2021-03-24
1628,gs1ul88,t1_gs1iwa2,"Awwww, but I wanted a peanut.",t3_mbznz6,2021-03-24 22:21:55,2021-03-24
1631,gs1m6o6,t1_gs1di9s,Value needs to be in roadsters,t3_mbznz6,2021-03-24 21:15:40,2021-03-24
1632,gs1ixr6,t1_gs1di9s,Correct ! you know what to do,t3_mbznz6,2021-03-24 20:46:47,2021-03-24
1633,gs1lhgo,t1_gs1di9s,😂,t3_mbznz6,2021-03-24 21:09:36,2021-03-24
1634,gs1nnlu,t1_gs1di9s,Then 6 then 8...,t3_mbznz6,2021-03-24 21:28:05,2021-03-24
1635,gs1q35k,t1_gs1jzpq,"""everyone else spend Bitcoin so you can increase the value of me hoarding it""",t3_mbznz6,2021-03-24 21:47:43,2021-03-24
1637,gs1y5q6,t1_gs1jzpq,It's almost like currency needs some inflation so it is widely used as a currency,t3_mbznz6,2021-03-24 22:47:55,2021-03-24
1638,gs1yez0,t1_gs1f2eu,"I think you'll have to replace the interior, and possibly the body and frame of the car before you'll replace the batteries. The drivetrain and batteries are nearing 1 million mile life, which at 12,000 miles a year gives you roughly one human lifespan to drive the vehicle. Seats will wear out before that!",t3_mbznz6,2021-03-24 22:49:49,2021-03-24
1640,gs1uxmw,t1_gs1hwqx,Honestly if I have .1BTC at that point I would probably buy one.,t3_mbznz6,2021-03-24 22:24:27,2021-03-24
1641,gs1dkil,t1_gs1ctgw,Some people see it as a storage of value - which is why Bitcoin is often referred to as “digital gold”.,t3_mbznz6,2021-03-24 19:52:08,2021-03-24
1642,gs1djgk,t1_gs1ctgw,Asset appreciation. I don’t understand how you don’t know this.,t3_mbznz6,2021-03-24 19:51:47,2021-03-24
1643,gs1j6l8,t1_gs1ctgw,to each his own my friend,t3_mbznz6,2021-03-24 20:49:05,2021-03-24
1645,gs191fb,t1_gs18t37,Ah. Perhaps. So not in Europe we can't.,t3_mbznz6,2021-03-24 18:55:50,2021-03-24
1646,gs1d41x,t1_gs18t37,The article I read says buying with bitcoin won’t be an option until late 2021,t3_mbznz6,2021-03-24 19:46:52,2021-03-24
1647,gs1nkoq,t1_gs1dkf0,It's almost like there are two different people commenting!,t3_mbznz6,2021-03-24 21:27:25,2021-03-24
1649,gs19bs4,t1_gs195nk,Ya great point! It’s a win win for Elon either way smart man no wonder he’s heading for Mars and skipping the moon!!!🚀🚀🚀🚀,t3_mbznz6,2021-03-24 18:59:50,2021-03-24
1650,gs1dk3r,t1_gs195nk,Normal currency is way more stable than bitcoin though,t3_mbznz6,2021-03-24 19:51:59,2021-03-24
1651,gs1liie,t1_gs195nk,"Fiat is designed to depreciate though...money has to to encourage economic activity. It's why bitcoin can never be a real currency, because if people think it will be more valuable in the future no one will ever spend it",t3_mbznz6,2021-03-24 21:09:52,2021-03-24
1653,gs1xn0m,t1_gs1awb5,Not really. I would buy bitcoin for the sole purpose of buying the tesla. It would even go to a separate wallet when I buy it. Simple as that.,t3_mbznz6,2021-03-24 22:44:09,2021-03-24
1654,gs1rgi1,t1_gs14mya,And the government will only accept USD which will reduce Tesla's USD assets and BTC will occupy a larger percentage potentially rebalancing Tesla's books (depending on how BTC is viewed either as a foreign currency or some other asset class).,t3_mbznz6,2021-03-24 21:58:17,2021-03-24
1655,gs1j6n9,t1_gs19h69,You should definitely stick to holding.,t3_mbznz6,2021-03-24 20:49:06,2021-03-24
1657,gs0ybgx,t1_gs0xzhm,In the U.K. it’s pretty much 1:1 right at this moment.,t3_mbznz6,2021-03-24 16:04:37,2021-03-24
1658,gs1azuv,t1_gs0xzhm,"You have calculated at 5k instead of 50k... One is enough, keep your 6BTC. You have got À tesla and 6 coins to spare",t3_mbznz6,2021-03-24 19:21:26,2021-03-24
1659,gs1vz1g,t1_gs1vo69,[deleted],t3_mbznz6,2021-03-24 22:32:05,2021-03-24
1661,gs1jpxm,t1_gs1hsw3,Well then elon will not be getting my magic internet money,t3_mbznz6,2021-03-24 20:54:00,2021-03-24
1664,gs1ey45,t1_gs1evsn,I’m here! 😂,t3_mbznz6,2021-03-24 20:07:17,2021-03-24
1665,gs1eki3,t1_gs1dsc6,I am glad you asked! Is it one with an unbreakable window? Because otherwise I wouldn't be interested!,t3_mbznz6,2021-03-24 20:03:10,2021-03-24
1666,gs1wqq9,t1_gs1petc,didn't Papa Elon setup something like a Mumble server or Whisper protocol or something that only the High-Class club are members of and he talks to them over it all the time ?,t3_mbznz6,2021-03-24 22:37:39,2021-03-24
1667,gs1h3iv,t1_gs1a31y,I mean id rather have a plaid+ then pretty much any lambo.,t3_mbznz6,2021-03-24 20:29:10,2021-03-24
1668,gs1dkfo,t1_gs1da7o,"Yeah but the point is that they probably won't put a fixed price, like 2 btc, which when it drops will be worth less than it is now. The price in bitcoin will probably change when the bitcoin drops or goes up. If the bitcoin drops by 50% they will probably ask for 4 bitcoins. The only advantage would be what the other person said: saving the time and money need to convert into fiat then sent it to them if your extra cash was already in bitcoin.",t3_mbznz6,2021-03-24 19:52:06,2021-03-24
1669,gs1wx8b,t1_gs1da7o,Buying something at -86% is almost always a bad idea,t3_mbznz6,2021-03-24 22:38:56,2021-03-24
1670,gs1d9br,t1_gs1d349,"I see, it would be a small advantage as you don't need to pay the convertion fee and wait till it's in your account then theirs, but other than that I don't see the hype.",t3_mbznz6,2021-03-24 19:48:32,2021-03-24
1671,gs1evs4,t1_gs159gl,"Did you mean, wont**",t3_mbznz6,2021-03-24 20:06:35,2021-03-24
1672,gs1uulc,t1_gs16pkq,Why be miffed though? I’m not OP and I think dogecoin is a silly one but an honest question to me is why not? As it’s a store of value. Not trying to be rude,t3_mbznz6,2021-03-24 22:23:51,2021-03-24
1678,gs1rx7o,t1_gs1iw3r,Funding secured,t3_mbznz6,2021-03-24 22:01:47,2021-03-24
1681,gs1x5jy,t1_gs1now2,Go outside and get some fresh air,t3_mbznz6,2021-03-24 22:40:36,2021-03-24
1682,gs1rl2h,t1_gs1now2,"Shh. You know what sub you're on, right?

But yeah, well said. Musk and the like are insanely dangerous for society.",t3_mbznz6,2021-03-24 21:59:15,2021-03-24
1683,gs1on4j,t1_gs1now2,You are fake news! 😁,t3_mbznz6,2021-03-24 21:36:11,2021-03-24
1684,gs1q764,t1_gs1now2,Do you think the Martian Bitcoin farms will compete against F2Pool?,t3_mbznz6,2021-03-24 21:48:36,2021-03-24
1686,gs1phno,t1_gs1now2,Sam?,t3_mbznz6,2021-03-24 21:42:57,2021-03-24
1688,gs1ccz0,t1_gs15nug,"You disagreed with a comment saying he was a boss with nah, he’s a dick.  I don’t know that I would like to hang out with the guy, but he is most certainly a boss.  He has managed to advance industries and technologies far beyond where they would be without him.  I’ll take musks style of billionaire over most other most any day.",t3_mbznz6,2021-03-24 19:38:07,2021-03-24
1689,gs19eph,t1_gs15nug,And why would he be a dick ?,t3_mbznz6,2021-03-24 19:00:57,2021-03-24
1690,gs16rk3,t1_gs15nug,"A man doesn't care what other people think, but driven by a purpose and/or goal.   Those who are preoccupied about how others perceive them don't accomplish shit.",t3_mbznz6,2021-03-24 18:22:45,2021-03-24
1691,gs1avcz,t1_gs15nug,"He's put satellites in space so people can get high speed anywhere, he's well on his way to get humans to Mars; you just seem small minded",t3_mbznz6,2021-03-24 19:19:53,2021-03-24
1692,gs1gjg6,t1_gs15nug,What specifically makes him a dick?,t3_mbznz6,2021-03-24 20:23:44,2021-03-24
1693,gs18d2h,t1_gs15nug,"Improving industries that are essential in the fight against climate change makes him pretty great.

I suppose he is awfully rude on Twitter, nvm he's just the worst.",t3_mbznz6,2021-03-24 18:46:22,2021-03-24
1694,gs16i3s,t1_gs15nug,He's good enough.,t3_mbznz6,2021-03-24 18:18:43,2021-03-24
1695,gs1cgsv,t1_gs15nug,"He's obviously extremely successful and is trying to move our society further at a major scale, and he deserves all the praise and respect for that. At a personal level though... well, I wouldn't want to be his friend.",t3_mbznz6,2021-03-24 19:39:23,2021-03-24
1696,gs1jn4w,t1_gs15nug,"I hear this all the time, is he perfect?  No.  But he is significantly better of a human being than a lot of people in his position.",t3_mbznz6,2021-03-24 20:53:17,2021-03-24
1697,gs186zq,t1_gs15nug,Why I cant downvote ur pathetic ass?,t3_mbznz6,2021-03-24 18:43:57,2021-03-24
1698,gs1uycu,t1_gs1fgr2,Not to mention that the radiation means it's hard to run high density chips.  They're still using 486's and other chips of that era for a lot of space-based systems because the feature size means that the computations don't get scrambled by cosmic and gamma.,t3_mbznz6,2021-03-24 22:24:36,2021-03-24
1699,gs1kkf7,t1_gs1fgr2,Dammit!,t3_mbznz6,2021-03-24 21:01:28,2021-03-24
