,comment_id,comment_parent_id,comment_body,comment_link_id,created,date
3221,gnq772b,t3_llklxa,I’ve made more from btc than anything else in life. So many ppl missing out,t3_llklxa,2021-02-17 11:54:01,2021-02-17
3222,gnqcq42,t3_llklxa,"tldr; Tesla purchased $1.5 billion in Bitcoin in January. Tesla hasn't revealed its average purchase price of how many Bitcoin it holds. Tesla reported its first profitable year in fiscal 2020 with $721 million, which came after a loss of $862 million in fiscal 2019.

*This summary is auto generated by a bot and not meant to replace reading the original article. As always, DYOR.*",t3_llklxa,2021-02-17 12:46:12,2021-02-17
3223,gnqgig4,t3_llklxa,"Elon Musk is a master manipulator of the system, and I do not mean that as an insult. He became the world's richest human being through a company that has barely managed to make profits for the majority of its existence by playing the corrupt and hyper-inflated stock market like a fiddle. Then he buys $1b+ of BTC via his company, which gains hundreds of millions of value over night simply by announcing the purchase.

On top of it all, Musk is likely heavily personally invested in cryptocurrency outside of Tesla, and was able to use Tesla corporate funds/influence to pump the asset.

We cannot see what Musk personally is doing with his crypto investments, only what Tesla the corporation does.",t3_llklxa,2021-02-17 13:22:36,2021-02-17
3224,gnqs5ra,t3_llklxa,GM announced buying 1.500.000 bitconnect,t3_llklxa,2021-02-17 15:38:46,2021-02-17
3225,gnq6j14,t3_llklxa,"Let's make an evaluation of Tesla. Say:

$300 Bil for Car Business (as is)
$300 Bil for FSD
$300 Bil for Factory completion (baked in), Berlin, Shanghai

That's hardly any val for Austin. Hardly any for batteries... becoming a monopolized resource (Nickel), with insane 'first rights' advantages... India factory not priced in. Bitcoin not priced in. Tesla Games not priced in. Solar not priced in...

Tesla could be looking at $5 T value come 2023.

Now image if Tesla owned $50 Bil bitcoin off 1% notes payable.

Tesla might sell a mil cyber trucks / tesla from the perceived 'bitcoin / tesla community' partnership, and profit $50 Bil from Bitcoin appreciation as others follow.

Tesla could do this over 3 years, strengthening it's Balance Sheet position, while increasing sales insanely (far cheaper than super bowl ads), and get a perceived quick return on investment allowing excess profits to be spent on either stock buybacks or bitcoin, whichever is more suitable, as opposed to largely 'building cash' which is of little purpose (save buybacks).

Tesla can't spend $50 Bil, but they can borrow it and buy Bitcoin.

At 1%.",t3_llklxa,2021-02-17 11:47:51,2021-02-17
3226,gnqspku,t3_llklxa,They only made profit if they sold...,t3_llklxa,2021-02-17 15:46:12,2021-02-17
3228,gnqwzrh,t3_llklxa,seems easy when tesla has been unprofitable up until last year?,t3_llklxa,2021-02-17 16:51:41,2021-02-17
3229,gnr8u37,t3_llklxa,Wait till they lose more money on bitcoin that they would lose sans gov incentives,t3_llklxa,2021-02-17 20:02:50,2021-02-17
3230,gnrc1sn,t3_llklxa,"In other words its just legal market speculation, they bought when Bitcoin was dumping and pumped it by announcing it to the world. Not so difficult to make profit.",t3_llklxa,2021-02-17 20:44:30,2021-02-17
3231,gnrf84i,t3_llklxa,"This is what everyone eventually learns. You make more ""profits"" as you're in Bitcoin. Cause fiat is a burning dumpster fire.",t3_llklxa,2021-02-17 21:20:09,2021-02-17
3234,gnqf59n,t3_llklxa,Does it mean they sold a fraction of their BTC? Because you only profit when you sell.,t3_llklxa,2021-02-17 13:09:18,2021-02-17
3235,gnqyl2z,t3_llklxa,"For every person that made profit, another has to take a loss.. someone eventually will have to hold the bag at the top, and it's unlikely to be the rich..

Crypto will just exacerbate wealth inequality as all our big surges comes from news of whales buying in",t3_llklxa,2021-02-17 17:17:55,2021-02-17
3236,gnqiqxr,t3_llklxa,This I can believe.  They were bleeding money selling cars for most of their existence.,t3_llklxa,2021-02-17 13:45:53,2021-02-17
3237,gnqok6h,t3_llklxa,My friend were asking IF he got 893 bitcoins should he sell it all off or wait?,t3_llklxa,2021-02-17 14:52:30,2021-02-17
3238,gnrhc6r,t3_llklxa,Electric vehicles are just as bad as gas vehicles.  You’re paying a premium to feel smug,t3_llklxa,2021-02-17 21:41:51,2021-02-17
3239,gnr5gig,t1_gnq772b,"I bought some a week ago, and I’m already 1k profit",t3_llklxa,2021-02-17 19:12:38,2021-02-17
3240,gnrndpg,t1_gnq772b,"Funny, my best investment is all the ammo I bought 2.5 years ago. Ammo has gone way up in value this past year. I’ve been thinking about off loading a bunch and buying more crypto.",t3_llklxa,2021-02-17 22:37:40,2021-02-17
3241,gnqr3lt,t1_gnq772b,[removed],t3_llklxa,2021-02-17 15:24:51,2021-02-17
3242,gnr9vwp,t1_gnq772b,[deleted],t3_llklxa,2021-02-17 20:17:11,2021-02-17
3244,gnqub3j,t1_gnqcq42,[deleted],t3_llklxa,2021-02-17 16:08:52,2021-02-17
3245,gnqp0xf,t1_gnqgig4,This! But still love the guy and all his work,t3_llklxa,2021-02-17 14:58:19,2021-02-17
3246,gnqvawp,t1_gnqgig4,"Elon Musk also made it so he gets 1% of Tesla's entire stock float every time the company appreciates in value 100 billion USD.

Rewording that, Elon Musk gets 2% of Tesla's entire stock float every year, because USD debases 20% annually increasing the share price of all existing companies by 20-30%.

Ruthless. He has a stake in seeing the US dollar collapse.",t3_llklxa,2021-02-17 16:23:49,2021-02-17
3247,gnqtm7h,t1_gnqgig4,Tesla hasn’t profited much because it’s still in its development phase. Check and see how long it took Amazon to turn a profit,t3_llklxa,2021-02-17 15:58:58,2021-02-17
3248,gnrk9b2,t1_gnqgig4,Seems like it should be illegal? I mean I shouldn't complain I'm in Bitcoin. Being able to tweet and instantly rise any asset by 20% seems like too much power for a man.,t3_llklxa,2021-02-17 22:09:47,2021-02-17
3249,gnqtaoh,t1_gnqgig4,Tesla is a growing business. Increasing deliveries of expensive to build automobiles 50% every year since they started. You’re an idiot to not realize this. Sorry bud. Musk haters are the dumbest.,t3_llklxa,2021-02-17 15:54:24,2021-02-17
3250,gnrm32e,t1_gnqgig4,🤔🤔🤔,t3_llklxa,2021-02-17 22:26:14,2021-02-17
3251,gnqs4t7,t1_gnqgig4,"Another potential trickstery, getting into the crypto club to poke at new crowd (and potentially growing) of wealthy people who couldn't be happier buying the cryptocar.. 

buying btc to profit to sell more cars to profit .. two birds one stone",t3_llklxa,2021-02-17 15:38:26,2021-02-17
3252,gnrfpjb,t1_gnqgig4,Why vilify the man who is single handedly battling global warming?,t3_llklxa,2021-02-17 21:25:21,2021-02-17
3253,gnqq763,t1_gnqgig4,He is for sure not heavily invested in crypto himself.,t3_llklxa,2021-02-17 15:13:11,2021-02-17
3254,gnr0mpb,t1_gnqs5ra,BITCONEEEEEEEEEEEECT,t3_llklxa,2021-02-17 17:52:27,2021-02-17
3255,gnqyj9w,t1_gnqs5ra,gme diamond hands or is it silver or amc or,t3_llklxa,2021-02-17 17:17:04,2021-02-17
3258,gnqij5n,t1_gnqf59n,BtC is not a stock.  It IS money.  So you don't have to sell for a profit.  This is a fucking stupid argument for btc.,t3_llklxa,2021-02-17 13:43:34,2021-02-17
3259,gnqff7d,t1_gnqf59n,Or borrow against it.,t3_llklxa,2021-02-17 13:11:58,2021-02-17
3260,gnr0bu6,t1_gnqyl2z,">For every person that made profit, another has to take a loss..

Not everything is a zero sum game.",t3_llklxa,2021-02-17 17:47:18,2021-02-17
3261,gnrewpu,t1_gnqyl2z,The ones taking the loss are banks and credit card companies when people stop using their overpriced services and pay using Bitcoin.,t3_llklxa,2021-02-17 21:16:47,2021-02-17
3262,gnqykye,t1_gnqiqxr,look at amazons history,t3_llklxa,2021-02-17 17:17:52,2021-02-17
3265,gnrly1j,t1_gnr5gig,How much did you put in initially? I just dropped my first $200 into it lol 😆,t3_llklxa,2021-02-17 22:25:00,2021-02-17
3267,gnqrov8,t1_gnqr3lt,"This is the Bitcoin sub, not the shitcoin sub.

Once you understand why Bitcoin is better than everything else, you'll understand why 'earning a ton from crypto but not from BTC' was a massive gamble on your part.",t3_llklxa,2021-02-17 15:32:34,2021-02-17
3268,gnrexyx,t1_gnr9vwp,"I don't consider the fruits of my hard work a ""privilege"".",t3_llklxa,2021-02-17 21:17:08,2021-02-17
3269,gnrlhr7,t1_gnr9vwp,[deleted],t3_llklxa,2021-02-17 22:21:02,2021-02-17
3270,gnrbifh,t1_gnr9vwp,"true, most people living paycheck to paycheck.  A lot of people are hurting rn.",t3_llklxa,2021-02-17 20:37:59,2021-02-17
3273,gnr1xla,t1_gnqub3j,"Apparently you missed that that post was a hoax. It made the news, it was some random guy in Germany shitposting.",t3_llklxa,2021-02-17 18:14:53,2021-02-17
3274,gnqq1w8,t1_gnqp0xf,fuck elon musk.,t3_llklxa,2021-02-17 15:11:18,2021-02-17
3275,gnqxinz,t1_gnqvawp,Could you ELI5 this? Or share a good summary link?,t3_llklxa,2021-02-17 17:00:16,2021-02-17
3276,gnqyese,t1_gnqvawp,goddamn this is true!?? i’d love to look at his accounting books,t3_llklxa,2021-02-17 17:15:02,2021-02-17
3277,gnr9no6,t1_gnqtm7h,"Most people don't realise this, but the reason why some companies don't post a profit is because they pour every dollar right back into their own growth (because why not).",t3_llklxa,2021-02-17 20:14:06,2021-02-17
3278,gnrnqei,t1_gnrk9b2,He has the power to do that because people listen to him. Outlawing that would be the same as outlawing popularity.,t3_llklxa,2021-02-17 22:40:36,2021-02-17
3281,gnr6lb4,t1_gnr0mpb,WASA WASA WASAAAAAA,t3_llklxa,2021-02-17 19:30:04,2021-02-17
3283,gnqmiwa,t1_gnqij5n,If it is money then they didn’t make a profit 1BTC = 1BTC.,t3_llklxa,2021-02-17 14:28:01,2021-02-17
3287,gnqu18w,t1_gnqrov8,"Yup definitely a gamble, if I never touched altcoins I'd have been a millionaire right now, but I wasted my precious BTC on them out of greed, can't complain though, still doing quite well.",t3_llklxa,2021-02-17 16:04:53,2021-02-17
3288,gnqsfnv,t1_gnqrov8,[removed],t3_llklxa,2021-02-17 15:42:27,2021-02-17
3290,gnqugaf,t1_gnqrov8,Why are you so angry?,t3_llklxa,2021-02-17 16:10:51,2021-02-17
3291,gnr2p9j,t1_gnqrov8,You sound like someone saying: 'once you understand the legacy financial sytem you see that FIAT is the only true money'. In my modest opinion bitcoin maximalism is inherently false.,t3_llklxa,2021-02-17 18:27:47,2021-02-17
3292,gnqtbnb,t1_gnqrov8,"Do you really think btc is ""better than everything else""?

Its a 1st gen coin, with a lot of fundamental problems.

Moreover, it can't / refuses to adapt to the growing needs of the crypto market.

1st in the game is important, and probably will be for the next few decades, but it's definitely not ""the best"" coin.",t3_llklxa,2021-02-17 15:54:47,2021-02-17
3293,gnravqn,t1_gnqrov8,"Lol

Btc was a gamble too

It's been a pretty fucking rocky road to get to this point.",t3_llklxa,2021-02-17 20:30:05,2021-02-17
3294,gnriz28,t1_gnrexyx,Thank you. That “privilege” guy is an idiot.,t3_llklxa,2021-02-17 21:57:36,2021-02-17
3295,gnrk1qd,t1_gnrexyx,"You're out of touch.

You're unintentionally implying here that people who do not have enough to save are not working hard enough, which is not what happens in reality.",t3_llklxa,2021-02-17 22:07:51,2021-02-17
3296,gnrfyv8,t1_gnrexyx,[deleted],t3_llklxa,2021-02-17 21:28:03,2021-02-17
3297,gnrhhb6,t1_gnrexyx,The fact that you live in a country that allows you to have fruits from your hard work is a privilege.,t3_llklxa,2021-02-17 21:43:16,2021-02-17
3298,gnr2a6w,t1_gnr1xla,heres the link: [https://nypost.com/2021/02/09/reddit-user-says-post-on-800m-tesla-bitcoin-buy-was-a-hoax/](https://nypost.com/2021/02/09/reddit-user-says-post-on-800m-tesla-bitcoin-buy-was-a-hoax/),t3_llklxa,2021-02-17 18:20:50,2021-02-17
3299,gnr4335,t1_gnr1xla,[deleted],t3_llklxa,2021-02-17 18:50:38,2021-02-17
3300,gnqtgq2,t1_gnqq1w8,"Out of all the horrible ultra capitalists out there, he's definitely one of the least shitty.",t3_llklxa,2021-02-17 15:56:48,2021-02-17
3301,gnqygb4,t1_gnqxinz,"Musk probably doesn't get a paycheck for being the CEO of Tesla, instead he receives stock options.  If the value of the company goes up by $100 billion, he can exercise those options which would be equivalent to 1% of the value of the company.  This encourages him to grow the value of the company.

Since the US is printing new money like crazy, we are probably devaluing the dollar by 20% per year and all that freshly printed money is going into companies like tesla- increasing their price in dollars by 20% per year.  The less each dollar is worth, the higher his companies value goes when measured in dollars, and the more stock options he can exercise. 

There are probably many other CEO's and upper management in the same boat right now- everyone getting super rich in this way as the country destroys its currency so there is very little motivation to stop this feedback loop that we've been in since at least 2008.  The good news is, if those people are smart then they move that money they are making over into bitcoin to preserve its value, making the price of bitcoin keep going up too.  If they are really smart like Musk, then they move their companies money into bitcoin too, then the value of the company goes up faster, they make money faster, bitcoin goes up faster and it becomes a positive feedback loop that rapes the value of the dollar into oblivion.",t3_llklxa,2021-02-17 17:15:44,2021-02-17
3302,gnreann,t1_gnr9no6,Which is what Tesla does,t3_llklxa,2021-02-17 21:10:03,2021-02-17
3305,gnrfxsg,t1_gnr6lb4,My wife still doesn't believe in me.,t3_llklxa,2021-02-17 21:27:45,2021-02-17
3307,gnr6fau,t1_gnqmiwa,"But they did. Profit isn't just increasing the number of X. It's increasing value. By switching to BTC, the value of what they moved from USD to BTC increased. That is a profit.

You can profit off of fiat trading. Literally switching from one fiat currency to another.

Unrealized profit is still profit, because you could realize it at any moment if you wanted to.

Were they to spend that BTC, they would be able to buy more with it than they would have been able to had they kept it in fiat.",t3_llklxa,2021-02-17 19:27:35,2021-02-17
3308,gnqw86h,t1_gnqmiwa,"true that bro, just blew my mind a little bit",t3_llklxa,2021-02-17 16:38:55,2021-02-17
3309,gnqqmp4,t1_gnqmiwa,"Depends if wallstreet determines profit in dollars or BTC.  If wallstreet  still values companies in dollars on their books, then their BTC holdings get converted into dollar equivalents to determine profit for the quarter/year, even if they didn't _actually_ sell them.

The time will come that so much of business will be about accumulating BTC, that all that will matter in determining profits is if their BTC balance increased or not....

Once that happens, we/wall street will start to denominate everything in BTC, or at least durable goods like land/investments/art/precious metals.  Consumables like food, rent and power will likely remain denominated in fiat for far longer.",t3_llklxa,2021-02-17 15:18:43,2021-02-17
3314,gnqumsq,t1_gnqu18w,I thought I was alone in getting sucked in to the shit coin hype of 2017. Luckily it was a small amount but it always pisses me off thinking about it.,t3_llklxa,2021-02-17 16:13:27,2021-02-17
3315,gnrav24,t1_gnqu18w,"And for every people like you there's a person that made cash on altcoins, no need to be elitists...",t3_llklxa,2021-02-17 20:29:51,2021-02-17
3316,gnqt2uh,t1_gnqsfnv,"Your first sentence is absolutely untrue.

Do you not agree that Bitcoin is more decentralized than dogecoin? Do you not agree that Bitcoin has less inflation than dogecoin? Do you not agree that bitcoin has more security than dogecoin?

If you don't agree, you haven't done your research, and the extent to which BTC is a gamble comparable with shitcoins like that is laughable.",t3_llklxa,2021-02-17 15:51:21,2021-02-17
3317,gnrlrpw,t1_gnqtbnb,"btc is store of value, digital gold. And for that job, its the best store of value ever created",t3_llklxa,2021-02-17 22:23:28,2021-02-17
3318,gnqtubv,t1_gnqtbnb,"LMAO.

Billion dollar hedge funds haven't done their DD as good as you and that's why they're stupidly buying Bitcoin and nothing else, right?

Bitcoin is the ONLY reason these other cryptocurrencies even exist.

Bitcoin is the revolution, everything else is ""backed"" by a metric ton of buzzwords like ""DeFi"" or ""dApps"" or has ""Oracles"" and has zero substance and was created to lure people who think they're smarter than the hedge funds.

The game changer here was decentralized money. Bitcoin does it the best because of its decentralization and therefore security. Nothing else even comes close.",t3_llklxa,2021-02-17 16:02:08,2021-02-17
3319,gnrlizi,t1_gnrk1qd,"You are implying that, I am not talking about anyone else but myself. 

I am stating that my hard work isn't a privilege.",t3_llklxa,2021-02-17 22:21:20,2021-02-17
3320,gnrkjqb,t1_gnrfyv8,always some dickhead like you trying to throw negativity around,t3_llklxa,2021-02-17 22:12:30,2021-02-17
3321,gnrluly,t1_gnrfyv8,Do you feel guilt for being that person lol? Leeching on family,t3_llklxa,2021-02-17 22:24:10,2021-02-17
3322,gnrgap0,t1_gnrfyv8,"You would lose that bet as I was on my own in my teens.

Sounds like you are very young with not much experience in the real world.",t3_llklxa,2021-02-17 21:31:26,2021-02-17
3323,gnrj4z1,t1_gnrhhb6,"Stupid train of thought. Everything is a privilege than. The fact earth supports life , you are alive. Lol",t3_llklxa,2021-02-17 21:59:09,2021-02-17
3324,gnr65tr,t1_gnr4335,"Read the article little boner. He wasn’t right about anything, except that Tesla had bought bitcoin, which any of us could have guessed",t3_llklxa,2021-02-17 19:23:37,2021-02-17
3325,gnqurlv,t1_gnqtgq2,"got rich from his father emerald mine, which exploited poor, slave like african mine workers, horrible report from former employees at spcaex, tesla, pump and dumb dogcoins without any shits given to his dumb cult followers who loses money again and again listening to his stupid ego driven garbaage meme tweets...",t3_llklxa,2021-02-17 16:15:23,2021-02-17
3326,gnr5lsv,t1_gnqtgq2,Ah yes the cleanest boot to lick!,t3_llklxa,2021-02-17 19:14:58,2021-02-17
3329,gnqywva,t1_gnqygb4,So this is the bit that I thought I’d misunderstood: is the 20% devaluation you’re referring to just a random number illustrating this concept? Or is that based in the actual numbers? I know the fed has been printing money like crazy. But this much? 20% y.o.y ?,t3_llklxa,2021-02-17 17:23:21,2021-02-17
3332,gnrpvc5,t1_gnr6fau,"Well BTC is valued as intangibles according to US GAAP and intangibles are valued at cost and routinely checked for impairment. You literally cannot recognize an increase in value or profit until you sell, per the accounting standards. There was a good session about it during the MSTR conference, you should go watch.",t3_llklxa,2021-02-17 22:58:19,2021-02-17
3335,gnrayf2,t1_gnrav24,"How is that elitist, it's just a more riskier gamble. I made lots with altcoins too, but I'd have more if I never touched them.",t3_llklxa,2021-02-17 20:31:01,2021-02-17
3336,gnqyo7c,t1_gnqt2uh,"Neither if you are wrong — UK pound is a gamble just like gourd futures are a gamble, just in wildly different degrees.",t3_llklxa,2021-02-17 17:19:22,2021-02-17
3337,gnqu9vk,t1_gnqtubv,"Well that last bit is just not true, and shows that you haven't done your DD at all.

As per corporate investment, I get the interest in btc. It's basically guaranteed returns over the next 10-20 years.

But that doesn't mean it's the best out there... The tech is old and quite frankly kind of shitty compared to new coins. 

Idk man. Sounds to me like you're just an emotional investor.",t3_llklxa,2021-02-17 16:08:22,2021-02-17
3339,gnrm47x,t1_gnrluly,[deleted],t3_llklxa,2021-02-17 22:26:32,2021-02-17
3340,gnrigt2,t1_gnrgap0,[removed],t3_llklxa,2021-02-17 21:52:50,2021-02-17
3341,gnrnqw9,t1_gnrj4z1,"Calling me stupid don't change the fact most people on earth live with less than a dollar at day, and yes, the fact that earth supports life is a privilege most planets don't have, stop being an asshole and start thinking the things you're allowed to do compare to most people.",t3_llklxa,2021-02-17 22:40:43,2021-02-17
3342,gnqwezm,t1_gnqurlv,"Still better than all the kings of old, and still better than most other billionaires.

I have a very low standard for rich people.",t3_llklxa,2021-02-17 16:42:02,2021-02-17
3343,gnrdf5p,t1_gnqywva,Yeah that's not how it works at all. The inflation rate for the USD in 2020 was about 1.4%. The purchasing power of the dollar decreased by ~16% over the last 10 years. Stocks don't increase in value by 20% per year just because money is printed.,t3_llklxa,2021-02-17 21:00:14,2021-02-17
3344,gnqzihl,t1_gnqywva,"Ah, my bad... that number might be pretty accurate.  

https://www.somagnews.com/9-trillion-story-22-of-us-dollars-printed-in-2020/

Of course people will say there is deflation and blah blah blah but either way we all know that this money is flowing directly into the stock market because there is no other good place for it to go and that explains the insane stock valuations we are seeing right now.",t3_llklxa,2021-02-17 17:33:32,2021-02-17
3347,gnrbq94,t1_gnrayf2,"Look at the message you were replying to

""This is the Bitcoin sub, not the shitcoin sub""

""Once you understand why Bitcoin is better then everything else""

That's elitism and diminutive to people who believe there's money to be made elsewhere. Many made more on Doge this year then Bitcoin.",t3_llklxa,2021-02-17 20:40:39,2021-02-17
3348,gnr3s6s,t1_gnqyo7c,"Agree. BTC -is- the best crypto, but no one can see the future so everything is a gamble",t3_llklxa,2021-02-17 18:45:40,2021-02-17
3350,gnqugad,t1_gnqu9vk,"I could say the same about you 🤷🏼‍♂️

But what you really don't get that it's not about the ""tech"".

Any new ""tech"" that a coin brings over Bitcoin is incremental at best compared to the game changer that Bitcoin brought.

In 99% of cases it's actually a detriment to the newer technology coin because it sacrifices security.",t3_llklxa,2021-02-17 16:10:51,2021-02-17
3351,gnrmltc,t1_gnrm47x,"Life dealt you a hand, scheme and play with it as best as you can but stop being stuck in the past crying about it, its gonezo, move forward guy.

Nobody wants to be a shitty parent, they probably have shitty parents too, flip it from anger to gratitude as you mentioned earlier but its time to drop old narratives and move freshly forward.",t3_llklxa,2021-02-17 22:30:53,2021-02-17
3352,gnrl163,t1_gnrigt2,[deleted],t3_llklxa,2021-02-17 22:16:54,2021-02-17
3355,gnqybif,t1_gnqwezm,yeah as far as billionaires go he’s pretty low on the disgusting list,t3_llklxa,2021-02-17 17:13:34,2021-02-17
3358,gnrmpfn,t1_gnrdf5p,"Sigh, I'm not even going to bother explaining inflation vectors to this person. It's basic monetary fundamentals 101. Someone step in?",t3_llklxa,2021-02-17 22:31:47,2021-02-17
3359,gnrmt4o,t1_gnqzihl,Even crazier is that collateralization requirements are zero. So those trillions are getting multiplied a lot more.,t3_llklxa,2021-02-17 22:32:42,2021-02-17
3360,gnr0r5k,t1_gnqzihl,"Wow. This is worse than I thought. Guess I have reading to do tonight.

Thanks for the link!",t3_llklxa,2021-02-17 17:54:33,2021-02-17
3362,gnrlno0,t1_gnrbq94,"Who cares plz


also if you made more money on doge, literally a pump and dump coin vs btc you should check and balance your portfolio abit lol",t3_llklxa,2021-02-17 22:22:28,2021-02-17
3363,gnrfqmo,t1_gnrbq94,"Responding to a comment doesn't mean I agree. But it's true it's the bitcoin sub not the shitcoin sub, no need to shill doge here, doesn't mean all altcoins are worthless. I think some might even surpass Bitcoin one day, but shitcoins are shitty altcoins, not all altcoins.",t3_llklxa,2021-02-17 21:25:40,2021-02-17
3364,gnrlrup,t1_gnrl163,You seem to have a lack of understanding of what hard work is.,t3_llklxa,2021-02-17 22:23:30,2021-02-17
3367,gnr1ht7,t1_gnqybif,"My thoughts exactly. We've got to remember just how shitty all of his ultra-rich and powerful peers (current and in the past) are.

He's awful, but compared to his contemporaries, it's really not so bad.",t3_llklxa,2021-02-17 18:07:23,2021-02-17
3369,gnrp6dr,t1_gnrmpfn,Does not matter inflation is not strongly correlated to a specific stock. Also money that is printed are loans a bunch is corporate bonds that corporation have to pay back over time.,t3_llklxa,2021-02-17 22:52:37,2021-02-17
3371,gnrm4f6,t1_gnrlno0,"I've got no stake in this game myself, 5 doge that were gifted to me a couple of days ago, 0.007 eth that I've been mining for the past couple of days because I need to heat my apartment anyway and electricity is the cheapest in North America where I'm at... I'm just saying that people do make money with what the ""Bitcoin elite"" considers to be shitcoins, sometimes a lot more than they make.",t3_llklxa,2021-02-17 22:26:34,2021-02-17
3372,gnrm8qq,t1_gnrlrup,[deleted],t3_llklxa,2021-02-17 22:27:37,2021-02-17
3376,gnrmb6h,t1_gnrm4f6,"Just look at the chart of doge and then btc on a log scale monthly chart, plz dont compare the two because some irrelevant sample size that you got gifted doge but own 0 btc so u made ""more"" money therefor doge is not shitcoin, lol",t3_llklxa,2021-02-17 22:28:13,2021-02-17
3377,gnrmm64,t1_gnrm8qq,"Yeah I do lack the understanding of an abstract comment like that.

Are you saying people living in poverty cannot work to get themselves out of poverty?

Have you lived below the poverty line? I have, and I took public transportation everyday to get out of it.",t3_llklxa,2021-02-17 22:30:59,2021-02-17
3380,gnrnaao,t1_gnrmb6h,"That's not what I said, holy crap, reading comprehenshun is hurd.",t3_llklxa,2021-02-17 22:36:51,2021-02-17
