,comment_id,comment_parent_id,comment_body,comment_link_id,created,date
1080,gt0kb1c,t1_gt0acib,"do you have any concept of how bitcoin works? There is no such thing as unobtainably high level, nor is it too high today. It is only getting started.",t3_mhoo6v,2021-04-01 18:13:50,2021-04-01
1081,gt0frb0,t1_gt0acib,It is never high because the government will keep printing forever. Specially in this time were the socialists are taking over.,t3_mhoo6v,2021-04-01 17:15:18,2021-04-01
1083,gt0p6mq,t1_gt0gjan,[deleted],t3_mhoo6v,2021-04-01 19:12:27,2021-04-01
1084,gt10i0n,t1_gt0moaf,Move to a part of society that will let you be more free with your BTC.,t3_mhoo6v,2021-04-01 21:16:59,2021-04-01
1085,gt10g6f,t1_gt0o42n,Yeah if you live in a country where capital gains tax exists.,t3_mhoo6v,2021-04-01 21:16:29,2021-04-01
1086,gt10bw2,t1_gt0uqgb,You don't need to pay taxes if you HODL like someone with a brain in their head,t3_mhoo6v,2021-04-01 21:15:20,2021-04-01
1087,gt1291t,t1_gt11ztx,"Free from the crushing burden of debt and financial ruin, amiright?",t3_mhoo6v,2021-04-01 21:33:09,2021-04-01
1090,gt0aomv,t1_gt0adlx,Can't help but wonder how you posted with -1 karma and a day old account.  Or are you just a bot that tries to reply as an ordinary user but accidentally got quoted automod instead?,t3_mhoo6v,2021-04-01 16:04:36,2021-04-01
1091,gt10kdc,t1_gt0lq8o,"If you buy as much of it as you can within the next four years and have the patience to wait another 10, you can still get very rich.",t3_mhoo6v,2021-04-01 21:17:36,2021-04-01
1097,gt0bgdb,t1_gt0aiul,Inflation is certainly not a mere 2% per year.,t3_mhoo6v,2021-04-01 16:17:50,2021-04-01
1098,gt1455z,t1_gt0aiul,"there is no â€œactualâ€ value, there is the value when your 1 unit of money is going to be worth more tomorrow, and the value when 1 unit is going to be worth less.

Saying â€œthe policy is making you a slaveâ€ is absurd, and the rhetoric by a disenfranchised middle class who have the benefit of a powerful money unit that buys far more power and energy than it used to.

What people donâ€™t acknowledge is the leaps and bounds and class growth of yesteryear came with a pricetag of sacrifice and work. They focus on the exclusionary side of things like that doesnâ€™t go back to prehistory. 

Sure, your grandfather had a house and two cars with a slef-paid for college education at the age of 23: and the real slaves were in the fields and the wife was in the kitchen.

Open that up and equalize things and of course the residue is flooding the labor market and increasing competition. And now the people who saw pure advantage are getting diminished simultaneously while technology filters you out and creates a buyerâ€™s market simultaneously.


But yes itâ€™s the â€œmonetary policyâ€ doing this. pfffffft",t3_mhoo6v,2021-04-01 21:50:05,2021-04-01
1099,gt11ohk,t1_gt0aiul,Inflation isnâ€™t so much a bad thing. Inflation incentivizes growth of the economy.,t3_mhoo6v,2021-04-01 21:27:59,2021-04-01
1100,gt0vuev,t1_gt0aiul,"Things donâ€™t have an inherent value. Read some value theory. If you think bitcoinâ€™s value is unlinked from global monetary policy and manufactured scarcity, youâ€™re not reading it correctly. Bitcoin is a metaphor for how capitalist value theory is accelerating climate disaster. Bitcoin was made to make you free? Who cares what the original intention was? Itâ€™s become a major contributor of climate disaster, used and abused by the same corporations who have led the petro-fueled climate catastrophes of the 20th century and are now going â€œelectricâ€. Shed the ideology, learn value theory.",t3_mhoo6v,2021-04-01 20:29:44,2021-04-01
1101,gt19x71,t1_gt0aiul,"â€œWe all ought to be richer than we thought.â€

Iâ€™m using this moving forward.",t3_mhoo6v,2021-04-01 22:37:59,2021-04-01
1108,gt0olah,t1_gt08cle,I thought the Reddit hivemind banned 'THIS' comments long ago.,t3_mhoo6v,2021-04-01 19:05:47,2021-04-01
1109,gt0txhs,t1_gt08cle,[Someone's been taking notes.](https://youtu.be/KqXJmE45Ngw),t3_mhoo6v,2021-04-01 20:07:58,2021-04-01
1110,gt0sic8,t1_gt0f0d2,This is the way,t3_mhoo6v,2021-04-01 19:50:38,2021-04-01
1114,gt0gt68,t1_gt0efp9,Better to be a slave to MY money than slaving our best years so Jerry Mcgolderberstein can buy a third yacht,t3_mhoo6v,2021-04-01 17:29:07,2021-04-01
1115,gt1adtd,t1_gt10v85,Yup it's never enough,t3_mhoo6v,2021-04-01 22:41:37,2021-04-01
1117,gt13088,t1_gt10v85,Yet hunter gatherer societies existed without excess accumulation of material possessions. Curious.,t3_mhoo6v,2021-04-01 21:40:05,2021-04-01
1118,gt0q3sp,t1_gt0ojpi,Iâ€™m guessing inflation?,t3_mhoo6v,2021-04-01 19:22:23,2021-04-01
1119,gt0syx5,t1_gt0ojpi,Cuz a dollar is worth less overtime (inflation) while crypto-currencies (for the most part) will be worth more overtime (deflationary)!,t3_mhoo6v,2021-04-01 19:56:19,2021-04-01
1120,gt0rgrq,t1_gt0ojpi,"Because of inflation. The value can go up or down but its always the case that we find ourselves in, in terms of fiat currency . The value of the effort we put in to work become less valuable with time, if we are converting that value to the fiat system. We never say money is the ultimate entity, we say money is something with which we can buy or acquire things and services of value. So won't it be better to buy stuff at the earliest, which are of more value compared to some paper money. 

All things aside, yes, this ""paper money"" was valuable at one point in history, and with the flow of time, things change. At one point of time people sold cows in exchange for rice, but it was a difficult process in the long run, so they resorted to gold coins and sovereigns and such. Compared to that, yes, this paper money is of value, as it is easier to carry fiat rather than sacks of gold. But the times have changed and the way in which we think about money also changes. Fiat currencies have started accumulating in the hands of the rich, and they are a small minority in terms of population. So history is forcing the change to move on to efficient methods of how we value money, and thus we see a rise in value for crypto. The earlier a person understands that, the better. It's true that people like Satoshi had a huge part to play in this history, but if it was not him, someone else would pave way to better systems. In the end, good shall prevail, and corruption, in people or systems, will ultimately degrade the system or the person. So in the near future, yes, fiat will be punishing if accumulated. 





PS: Pardon my grammar mistakes",t3_mhoo6v,2021-04-01 19:37:15,2021-04-01
1121,gt0pp3d,t1_gt0ojpi,Yeah wth pls explain.,t3_mhoo6v,2021-04-01 19:17:59,2021-04-01
1122,gt13hcd,t1_gt0ojpi,"Inflation and the fact minimum wages are becoming more of a struggle to live on while the cost of housing, bills, cars and even basic stuff like entertainment carry on rising.",t3_mhoo6v,2021-04-01 21:44:19,2021-04-01
1127,gt13wzx,t1_gt0twcf,"This is what turned me off of Bitcoin 10 years ago. Its incredibly cultish.

Its not an investment or a hedge for some people, its a way of life.",t3_mhoo6v,2021-04-01 21:48:07,2021-04-01
1134,gt0alwk,t1_gt040fd,"Pretty sure that most altcoins are a scam. Sry, there you go, I just said it.",t3_mhoo6v,2021-04-01 16:03:19,2021-04-01
1135,gt0edl0,t1_gt040fd,Why is real estate inflated?,t3_mhoo6v,2021-04-01 16:57:36,2021-04-01
1136,gt0x8li,t1_gt0s6lq,"What a load of delusional garbage. How old are you, 15?",t3_mhoo6v,2021-04-01 20:44:34,2021-04-01
1137,gt10qjv,t1_gt0lc1k,"I'll be honest, I breathed heavy through my nose on this one.",t3_mhoo6v,2021-04-01 21:19:13,2021-04-01
1138,gt0ps1k,t1_gt01zwi,"I've only recently gotten involved in bitcoin. But once I learned how it worked I started to see it as a poison pill for the legacy financial system. It brings a sense of reality back into the market. From CDO's to people betting on the CDO's built on CDO's. Our current financial system is just this cluster fuck of mismanaged resources.

One of the things people may be overlooking, is that for bitcoin to be successful, it first needs to be adopted by the system that it was designed override. The injection of a finite nigh unto indestructible virtual banknote is just what the world needs right now. It needs to be accepted first though.

Bankers will try to control it with legacy mechanisms. I'm betting its not going to go the way they think.",t3_mhoo6v,2021-04-01 19:18:54,2021-04-01
1139,gt0a6xr,t1_gt0486c,"If the whole world switched to BTC I'm still pretty sure there'd be debt.

Debt which would get higher and higher every year cos BTC gets more valuable over time ðŸ˜¬",t3_mhoo6v,2021-04-01 15:56:26,2021-04-01
1140,gt0mj07,t1_gt0gklq,"Still half a slave here, but working on it. Good for you, man.",t3_mhoo6v,2021-04-01 18:41:43,2021-04-01
1141,gt0q9ai,t1_gt0nrkg,"I agree and couldn't of said it better. Giving something back to the community is important, that's defo a big problem here in the UK and feels like most areas don't have a positive community/society anymore.",t3_mhoo6v,2021-04-01 19:24:02,2021-04-01
1143,gt0ol7f,t1_gt0kmb8,[deleted],t3_mhoo6v,2021-04-01 19:05:45,2021-04-01
1144,gt0p9yw,t1_gt0frb0,Which socialists are taking over?,t3_mhoo6v,2021-04-01 19:13:27,2021-04-01
1145,gt0rgex,t1_gt0p6mq,"True. But only works with access to natural resources and livestock. What if you are born in place where there is little fish and little other animals to hunt? And maybe on top of that there is only low quality soul so its difficult to grow grain? What will you do? You will have to migrate somewhere else, but other people will have arrived before you. You have to convince them to let you participate in their fisheries or crop planting. The access to plenty of fish is simply a different form of access to money.",t3_mhoo6v,2021-04-01 19:37:07,2021-04-01
1146,gt18ces,t1_gt10i0n,Which is what part?,t3_mhoo6v,2021-04-01 22:25:20,2021-04-01
1148,gt14txz,t1_gt1291t,Financial ruin? Quite the hyperbole. You're certainly entitled to have your opinion on the future of crypto and what it represents. I just see it as a means of making a few extra dollars.,t3_mhoo6v,2021-04-01 21:56:02,2021-04-01
1157,gt0hnmb,t1_gt0bgdb,True that. http://www.shadowstats.com/ for anyone interested.,t3_mhoo6v,2021-04-01 17:39:51,2021-04-01
1158,gt151ku,t1_gt0bgdb,"It's 2% compared to customer price index. Even if inflation was 0%, it means that the money loses value as fast as customer goods.",t3_mhoo6v,2021-04-01 21:57:52,2021-04-01
1161,gt12zl8,t1_gt11ohk,That is a belief held by the Keynesian economic perspective. The Austrian economic perspective asserts that inflation encourages wasteful spending while saving promotes investment and economic growth.,t3_mhoo6v,2021-04-01 21:39:55,2021-04-01
1162,gt1c2p6,t1_gt11ohk,"By penalizing saving, and destroying wealth. Therefore, to beat inflation we compel everyone in the US to gamble their retirement savings on the stock market. This is an efficient funnel of wealth from the bottom to the top in exchange for barely breaking even if you're lucky.

Social security if you aren't.",t3_mhoo6v,2021-04-01 22:54:42,2021-04-01
1163,gt15wz5,t1_gt0vuev,"If anything BTC is/will help accelerate the use of clean and renewable energy. Look at all these mining farms that are gravitating towards renewables for their energy. Some estimates in 2019 say around 75% of the network runs on renewables. [https://coinshares.com/research/bitcoin-mining-network-june-2019](https://coinshares.com/research/bitcoin-mining-network-june-2019)

This will compund as it gets harder and harder to mine therefore feeding the cycle for the need for cheaper and renewable energy sources in order to remain profitable.

I'll also venture to guess that the mainstream buzz word headlines that say it's a pollution technology doesn't really consider the footprint of today's monetary system in comparison. Think of all the bank buildings, the workers who have to drive and sit in those electrified buildings, the land cleared to make space, the clients who have to drive there to transact, the paper trails, cash printing, severs/network infrastructure to manage the transactions and the list can go on vs crypto thats relatively flat in comparison and can be instantly transfered without the need for all that infrastructure and people to facilitate it and it's open 24/7.

Dont kid yourself and fall for the buzzword headlines. They want you feeling guilty for using it while loading up themselves.",t3_mhoo6v,2021-04-01 22:05:14,2021-04-01
1164,gt0w7gt,t1_gt0vuev,But the value has increased by 500% this year! Oh wait increased in value based on the USD. I'm free !,t3_mhoo6v,2021-04-01 20:33:41,2021-04-01
1165,gt10dzd,t1_gt0vuev,Tell us more,t3_mhoo6v,2021-04-01 21:15:54,2021-04-01
1166,gt1251z,t1_gt0vuev,"Value theory isn't one philosophy. There are tons of value theorists and philosophers that believe in 'intrinsic' value, notably, feminist theorists who believe that  earth, persons, and non-human species have intrinsic value. Other than that, I agree with everything else that you said. Bitcoin doesn't have intrinsic value, we assign value to it, that's how it works.",t3_mhoo6v,2021-04-01 21:32:07,2021-04-01
1168,gt0rhao,t1_gt0olah,This,t3_mhoo6v,2021-04-01 19:37:26,2021-04-01
1169,gt0thtg,t1_gt0olah,One can dream,t3_mhoo6v,2021-04-01 20:02:45,2021-04-01
1171,gt166ok,t1_gt0gt68,Its the anti-semitism for me,t3_mhoo6v,2021-04-01 22:07:32,2021-04-01
1172,gt0h26a,t1_gt0gt68,"Well you got a point. 
Just don't forget the pitfalls of richess",t3_mhoo6v,2021-04-01 17:32:16,2021-04-01
1175,gt0qgla,t1_gt0q3sp,Ding ding ding,t3_mhoo6v,2021-04-01 19:26:10,2021-04-01
1179,gt0sk2c,t1_gt0pp3d,"Meaning we are incentivized to not save. With the prospect of your monies purchasing power declining year after year, why save. We are encouraged to spend and consume since in the future it wonâ€™t buy as much",t3_mhoo6v,2021-04-01 19:51:14,2021-04-01
1188,gt0gk2c,t1_gt0alwk,"But how can I identify which are ?

&#x200B;

Edit : Why am i being dowvoted for a legitimate question stop acting like a goddamn cult

Re : Thank you",t3_mhoo6v,2021-04-01 17:25:47,2021-04-01
1189,gt0l1j5,t1_gt0edl0,"For the same principle of Bitcoin, people view real-estate like a limited resource (deflation) first, and second because it can be used to generate additional income (rent).

Till now, we have seen an increase in demand for housing in cities, which then lead to an increase in people investing in real-estate, inflating that demand.

What a lot of people tend to say is that the demand for housing in the cities will not grow forever, birth rate is getting lower, and with the increase in smart working, a portion of the ones living in the cities are starting to move outside.

tl;dr real estate prices are inflated due to investors pumping up the demand",t3_mhoo6v,2021-04-01 18:23:22,2021-04-01
1190,gt0jxl5,t1_gt0edl0,"Because cash is trash and rich people need to put their money somewhere. At the same time, money is basically free (no interest). Last year, more people in China bought their second home than their first one.",t3_mhoo6v,2021-04-01 18:09:07,2021-04-01
1191,gt0xmoe,t1_gt0ps1k,Not even just the bankers. Governments will shut it down when it gets larger and roll back institutional adoption. At the moment itâ€™s half the size of apple and not a threat. People donâ€™t seem to realize this. Bitcoin was likely made a proof of concept. Blockchain tech that will succeed will be those that integrate seamlessly into the current power structures and act as niche specialized currency. Niche and not controlling.,t3_mhoo6v,2021-04-01 20:48:38,2021-04-01
1192,gt0buyp,t1_gt0a6xr,This.,t3_mhoo6v,2021-04-01 16:23:57,2021-04-01
1194,gt0pos3,t1_gt0ol7f,"Every person has the freedom to make their choices. Do as Bitcoin was designed, be your own bank, or spend your money on coins you store in a bitcoin bank, recreating a part of the problem that was supposed to be fixed.

You also don't need to spend money hiring people to code audit bitcoin projects. You can simply do something you can manage yourself. Instead of watching netflix you could test out different software and file bug reports. Etc. It's not the objective amount you can achieve, it's the principle.

This is why i respect musk much more than saylor, even when saylor is much more vocal and visibly advocating. But he just does not care enough to do it right, nor does he offer his company's products for Bitcoin.

Rich or poor, does not matter. There is no such thing as hoarding Bitcoin. Bitcoin is for everyone. What matters is HOW you participate.",t3_mhoo6v,2021-04-01 19:17:54,2021-04-01
1195,gt0rl67,t1_gt0rgex,"Basically you need to be rich enough already to be able to start thinking about this ""be more with less"" nonsense.",t3_mhoo6v,2021-04-01 19:38:51,2021-04-01
1196,gt18hs1,t1_gt18ces,"There are several countries embracing Bitcoin and many more will in the future. You will have to research this yourself and make that kind of decision for you, there isn't one right answer.",t3_mhoo6v,2021-04-01 22:26:34,2021-04-01
1197,gt15ji1,t1_gt14txz,Relax guy. Itâ€™s a joke amiright,t3_mhoo6v,2021-04-01 22:02:04,2021-04-01
1205,gt18qjp,t1_gt151ku,Problem is the consumer price index is full of government subsidized goods so inflation doesnâ€™t seem as bad as it really is,t3_mhoo6v,2021-04-01 22:28:31,2021-04-01
1206,gt1811h,t1_gt151ku,"Please, this is r/bitcoin not r/economist or r/crypto markets. We don't like economic literacy here",t3_mhoo6v,2021-04-01 22:22:46,2021-04-01
1212,gt1clkx,t1_gt1c2p6,Lol ok dude,t3_mhoo6v,2021-04-01 22:58:43,2021-04-01
1213,gt17575,t1_gt15wz5,A good article on the subject. https://bitcoinmagazine.com/business/bitcoin-will-save-our-earth,t3_mhoo6v,2021-04-01 22:15:33,2021-04-01
1215,gt0toe5,t1_gt0h26a,Like what?,t3_mhoo6v,2021-04-01 20:04:56,2021-04-01
1216,gt0k7kz,t1_gt0h26a,"Gold digging whores, thereâ€™s a epidemic of them.",t3_mhoo6v,2021-04-01 18:12:43,2021-04-01
1221,gt1205r,t1_gt0sk2c,"That is not entirely true. You can save, i.e. invest in stocks, bonds, real estates or commodities.",t3_mhoo6v,2021-04-01 21:30:53,2021-04-01
1228,gt0h8q3,t1_gt0gk2c,"Most people need to burn their fingers with alts once in order to dig deeper and to discover that *what the world needs is a stable uncensorable fixed-supply crypto currency*. This is Bitcoin. All those fancy features that people use to sell their alts are mere decoration (I am saying this while having a solid understanding of computer science). They do not solve *the* one big problem, which is monetary policy. 

Alts advertise themselves as a technology. Bitcoin is a money. It is a life saving rescue boat, a hedge against a very very big sinking ship. Believe it or not, time will tell.",t3_mhoo6v,2021-04-01 17:34:43,2021-04-01
1229,gt0hhjh,t1_gt0gk2c,"Take a look at the list of altcoins that were the 'top' coins seven years ago.

https://www.coindesk.com/top-altcoins-2013

How many exist today?  That tells you the future of the shitcoins of today.",t3_mhoo6v,2021-04-01 17:37:44,2021-04-01
1230,gt0npex,t1_gt0gk2c,"Atop crying about downvotes. 

They donâ€™t matter.",t3_mhoo6v,2021-04-01 18:55:41,2021-04-01
1232,gt15qz5,t1_gt15ji1,Hah ya got me. Never can tell sarcasm via text,t3_mhoo6v,2021-04-01 22:03:50,2021-04-01
1247,gt0kjym,t1_gt0k7kz,Well that and ones own greed that can ruin the soul,t3_mhoo6v,2021-04-01 18:16:54,2021-04-01
1248,gt0sfae,t1_gt0k7kz,I read that in Billâ€™s voice,t3_mhoo6v,2021-04-01 19:49:34,2021-04-01
1249,gt1ckx7,t1_gt0k7kz,I think they are all over the world making it more of a pandemic.,t3_mhoo6v,2021-04-01 22:58:35,2021-04-01
1256,gt0i3zz,t1_gt0h8q3,"Ok so if I got that correctly all alts are useless without exception. But the only thing that makes Bitcoin particularily legitimate is that it came first, right ?",t3_mhoo6v,2021-04-01 17:45:42,2021-04-01
1257,gt1cdd9,t1_gt0h8q3,">	All those fancy features that people use to sell their alts are mere decoration (I am saying this while having a solid understanding of computer science)

Sorry but this is bullshit. First, whatever your understanding of computer science is doesnâ€™t really have anything to do with this. And then, saying those â€œfancy featuresâ€ are mere decoration is just absurd. 

For example, Bitcoin is not scalable. Right now weâ€™re relying on some extra layers which are completely unproven and which promote centralization to solve this problem. Yet you say a coin being scalable is just â€œmere decorationâ€. 

Like it or not, Bitcoin isnâ€™t perfect. It canâ€™t be used for daily transactions. Itâ€™s expensive and slow. It does have its great features, but it also has problems. Claiming Bitcoin is somehow going to change how the world works is pretty stupid. It might make the rich even richer, Iâ€™ll give you that. 

Iâ€™ll probably get downvoted by â€œomg Bitcoin to the moon ðŸš€ Elon muskâ€ people who only care about pumping Bitcoin to get money, but who cares. Iâ€™ve been supporting Bitcoin since the early days, and each year less of the community cares about fixing Bitcoinâ€™s issues to make it a viable currency, and more care just about getting rich. 

And by the way,

>	what the world needs is a stable uncensorable fixed-supply crypto currency

The world needs many things. And this one isnâ€™t in the top one million of them.",t3_mhoo6v,2021-04-01 22:56:59,2021-04-01
1258,gt0td89,t1_gt0h8q3,"They're not the same. Bitcoin is a currency and store of value and it's great at that. Altcoins are (for the most part) projects that all have different use cases and you can also buy them. If you want to speculate on altcoins that's fine but remember that before being speculative assets they're just blockchain projects trying to solve different problems the world has right now!

TL;DR: Bitcoin is a solid store of value while altcoins are projects withs goals, and solve problems. While you can invest in altcoins, they're not guaranteed to retain their value. On the other hand, I believe Bitcoin will continue to go up in the very very long term.

Damn my TLDR is almost as long as my main reply lol",t3_mhoo6v,2021-04-01 20:01:13,2021-04-01
1259,gt0oemr,t1_gt0npex,"Well, crying about me doesn't matter either yet here you are",t3_mhoo6v,2021-04-01 19:03:39,2021-04-01
1266,gt1aa75,t1_gt0sfae,Lol you mean Kill Gates?,t3_mhoo6v,2021-04-01 22:40:48,2021-04-01
1270,gt0iipb,t1_gt0i3zz,"> it came first

No, I would say it's a lot more than that. I kind of don't want to go into this discussion because it's been debated a billion times already but I'll do it anyways. Many of the reasons below are correlated with being the first but people forget that before Bitcoin, there were many attempts of building a digital cash. They all failed, due to one or the other reason. All altcoins are based on Bitcoin's technology, so you could say ""Why are they all not worth more if they do *more* than Bitcoin???"". I think if you think like that, you don't really get the value proposition of Bitcoin. 

Nevertheless, no other coin 

* was announced 3 months before it started and had no pre-mine 
* has had 18 months of time of existence without having a price 
* has a insane hash rate securing it
* is extremely cautious with new updates (I love this one)
* has no central authority that governs development (Satoshi is gone)
* has a market cap of 1 trillion (this is interesting for institutions)
* the largest user base / developer base / community (network effect)

If you're looking for technical solutions to niche cryptocurrency problems, you will find many solutions in the altcoin space (therefore, no, not all altcoins are useless). If you want to revolutionize money globally, Bitcoin is the solution, you don't need to look any further. Everyone else claiming to be the solution is a copy cat, and unfortunately, there is nothing they can do against that. 

The solution is here. I'm sorry but it doesn't add any value solving the same solved problem again.",t3_mhoo6v,2021-04-01 17:51:00,2021-04-01
1279,gt0m84e,t1_gt0iipb,"You know sir... i'm guessing you've been in this space for a while, so it kinda baffles me that you can't distinguish use cases. 

BTC, LTC, BCH and all that jazz => Store of value 

ETH, DOT, ADA etc => Decentralised network for applications and smart contracts. => You actually need these to use what's it's supposed to be doing

USDT/TUSD/BUSD etc => stablecoins 

ENJI, TETHA etc => NFTS 

VET etc logistics

Basically the list goes on and on..

All i see is a bitcoin maximalist that only looks at the things as a store of value, revolutionize money etc while alt coins differ in use cases. 

Calling them a scam is just quite frankly 'uneducated'.",t3_mhoo6v,2021-04-01 18:38:06,2021-04-01
1280,gt0ir0w,t1_gt0iipb,Alright thanks it does make sense,t3_mhoo6v,2021-04-01 17:53:54,2021-04-01
1283,gt0wwuw,t1_gt0m84e,"For me, web3 and decentralized communication infrastructure is part of being free. Owning your labor is huge, it's revolutionary, but it's not everything. The further away I can get from the oculus of control, the better. Lest I am free to spend all my newly claimed energy to be farmed for data in every waking moment. That's how it's designed right now.",t3_mhoo6v,2021-04-01 20:41:08,2021-04-01
1284,gt0n0hu,t1_gt0m84e,"> BTC, LTC, BCH and all that jazz => Store of value

I stopped reading here.",t3_mhoo6v,2021-04-01 18:47:31,2021-04-01
1285,gt0okbn,t1_gt0m84e,[removed],t3_mhoo6v,2021-04-01 19:05:28,2021-04-01
1288,gt0n2ls,t1_gt0n0hu,Thanks for confirming yet again what i mean,t3_mhoo6v,2021-04-01 18:48:13,2021-04-01
1289,gt0vphw,t1_gt0n0hu,Lmao same. Wtf happened to this sub,t3_mhoo6v,2021-04-01 20:28:14,2021-04-01
