,comment_id,comment_parent_id,comment_body,comment_link_id,created,date
804,gu5c8an,t3_mor4lo,Finally someone that gets it. It almost sound like she reddits.,t3_mor4lo,2021-04-11 22:27:01,2021-04-11
805,gu5cx9b,t3_mor4lo,"Don't ever underestimate the government's willingness to attempt stupid, impossible things.",t3_mor4lo,2021-04-11 22:33:24,2021-04-11
806,gu5bngj,t3_mor4lo,"Well that’s quite a shock from the SEC, maybe they are just excited for the tax people gunna have to pay",t3_mor4lo,2021-04-11 22:21:40,2021-04-11
808,gu5b7ya,t3_mor4lo,"Choking all fiat onramps would be highly annoying.

Cashless society in combination.",t3_mor4lo,2021-04-11 22:17:35,2021-04-11
809,gu5fsg7,t3_mor4lo,"Wow, she is awesome. This is exactly the kind of government officials we need.",t3_mor4lo,2021-04-11 22:58:38,2021-04-11
812,gu5f2ug,t3_mor4lo,"Well this will be the biggest hurdle to bitcoin. Will the US go full stupid and try tax bitcoin 100% or embrace it and let you pay taxes in it. Neither of these are likely and as established you can't stop it and you dont want to trigger the creation of an underground marketplace that isnt taxed or let competitor nations get the upperhand.

If the US recognises the value of bitcoin as an innovation and realises they can't just make a copy they can cheat with then the logical conclusion they'll incrementally have to accept bitcoin. Which this interview indicates will be the likely position the US takes. She seems very well read though on the topic to my knowledge and I dont necessarily understand how far up she is alongside whoever makes the big decisions, but it would seem the US will be bullish on bitcoin.",t3_mor4lo,2021-04-11 22:52:30,2021-04-11
815,gu5clqf,t3_mor4lo,Let’s get this show on the road,t3_mor4lo,2021-04-11 22:30:31,2021-04-11
1316,gu5b0nv,t3_morc7z,I wonder how much btc are traded in Venezuela from Runescape gold farmers 🤔,t3_morc7z,2021-04-11 22:15:38,2021-04-11
1325,gu5c0gs,t3_morc7z,"These figures you are giving in Bolivares are extremely high. It sounds like the currency is failing, and Venezualans could really benefit from Bitcoin -",t3_morc7z,2021-04-11 22:24:59,2021-04-11
1329,gu5ehug,t1_gu5b0nv,Runescape gold is a real digital currency for venezuelans and the gold sinks do a better job at slowing inflation in Runescape than the Venezuelan government.,t3_morc7z,2021-04-11 22:47:24,2021-04-11
1360,gu5ek10,t3_morl3a,"Understandable, but no one (not even the blockchain) knows EXACTLY how much BTC is in circulation either...",t3_morl3a,2021-04-11 22:47:57,2021-04-11
1383,gu5f470,t1_gu5ek10,"Writing this comment after I showed everyone exactly how many bitcoins are in circulation, is a bit suicidal no? Can you explain your statement?",t3_morl3a,2021-04-11 22:52:48,2021-04-11
1398,gu5ffqo,t1_gu5f470,"I think they mean just because they've been minted, doesn't mean they're in circulation.  There's absolutely BTC out there where the owner lost the keys and most likely will never be recovered.  Those coins are on the blockchain, but they're not in circulation.",t3_morl3a,2021-04-11 22:55:35,2021-04-11
1480,gu57wl8,t3_monzk0,How many hashes per second?,t3_monzk0,2021-04-11 21:02:48,2021-04-11
1481,gu56507,t3_monzk0,I minted this crochet piece as an NFT with physical item over at mintable. If anybody is interested I will post the link here (I’m currently unsure whether it’s allowed by the sub/ the mods),t3_monzk0,2021-04-11 20:42:29,2021-04-11
1482,gu54yfw,t3_monzk0,I am strangely fascinated by this...,t3_monzk0,2021-04-11 20:28:07,2021-04-11
1483,gu54df6,t3_monzk0,Clever..👏👏,t3_monzk0,2021-04-11 20:20:48,2021-04-11
1484,gu59cxn,t3_monzk0,It looks dangerous :],t3_monzk0,2021-04-11 21:59:08,2021-04-11
1485,gu5baa4,t3_monzk0,"This is so random, i love it.",t3_monzk0,2021-04-11 22:18:12,2021-04-11
1486,gu5celd,t3_monzk0,The cutest little Bitcoin miner I've ever seen! 🤗,t3_monzk0,2021-04-11 22:28:40,2021-04-11
1491,gu5a61b,t3_monzk0,"Awesome job, OP. 
Can it boil oceans too? Asking for a friend.

Edit: words are hard.",t3_monzk0,2021-04-11 22:07:23,2021-04-11
1498,gu55zga,t3_monzk0,You could put a fleshlamp in it if you wanted to...,t3_monzk0,2021-04-11 20:40:39,2021-04-11
1499,gu5da24,t1_gu57wl8,"English is really letting us down here. In German, a crotchet stitch is called a Masche. Could have been a really good ""how many mashes per second?"" joke if English were a bit closer to that...",t3_monzk0,2021-04-11 22:36:34,2021-04-11
1500,gu58cv2,t1_gu57wl8,Awww many!,t3_monzk0,2021-04-11 21:44:29,2021-04-11
1501,gu568pl,t1_gu56507,"Hey, NFTs are considered off topic here, so please don't :)  

Awesome crocheting skills though!",t3_monzk0,2021-04-11 20:43:43,2021-04-11
1504,gu5df4r,t1_gu5a61b,"What's an oceans loo, and why does it need boiling? Is the answer even SFW?",t3_monzk0,2021-04-11 22:37:50,2021-04-11
1507,gu59zz5,t1_gu568pl,"Won’t do, I can respect that :)",t3_monzk0,2021-04-11 22:05:45,2021-04-11
1519,gu3hgsq,t3_moeo1u,0 wasted energy,t3_moeo1u,2021-04-11 08:00:56,2021-04-11
1520,gu38ssu,t3_moeo1u,Please pet the kitty for me.,t3_moeo1u,2021-04-11 06:39:31,2021-04-11
1521,gu3ft7w,t3_moeo1u,"Damn, even a cat figured out how to set up a mining rig before I did!",t3_moeo1u,2021-04-11 07:45:24,2021-04-11
1522,gu3kmng,t3_moeo1u,Your cat looks very cute and sweet. Cats are the best.,t3_moeo1u,2021-04-11 08:29:33,2021-04-11
1523,gu3bb0j,t3_moeo1u,[Cryptokitty incubator](http://imgur.com/a/AR4xbVO),t3_moeo1u,2021-04-11 07:03:02,2021-04-11
1524,gu3mheb,t3_moeo1u,$NALA,t3_moeo1u,2021-04-11 08:46:32,2021-04-11
1525,gu3mqc4,t3_moeo1u,Be sure to thank kitty for the NFT that just fell into your lap...,t3_moeo1u,2021-04-11 08:48:55,2021-04-11
1526,gu3y1b3,t3_moeo1u,Do u have any tips on how to set this up?,t3_moeo1u,2021-04-11 10:36:02,2021-04-11
1527,gu40k2w,t3_moeo1u,Your cat guards your cryptocurrency lol,t3_moeo1u,2021-04-11 11:00:21,2021-04-11
1528,gu3g0h3,t3_moeo1u,Cryptopussy,t3_moeo1u,2021-04-11 07:47:14,2021-04-11
1529,gu49el1,t3_moeo1u,Stacking cats,t3_moeo1u,2021-04-11 12:33:03,2021-04-11
1530,gu50ce6,t3_moeo1u,Crypto Kittie 🚀🤑,t3_moeo1u,2021-04-11 19:25:47,2021-04-11
1531,gu55gvu,t3_moeo1u,He's just in it for the heat of the moment.,t3_moeo1u,2021-04-11 20:34:29,2021-04-11
1532,gu44tqb,t3_moeo1u,Kitty is mining heat and crypto is  just a by-product.,t3_moeo1u,2021-04-11 11:43:03,2021-04-11
1533,gu3kzop,t3_moeo1u,Must love the heat that the mining creates,t3_moeo1u,2021-04-11 08:32:51,2021-04-11
1534,gu4b2pk,t3_moeo1u,"My cat, also named Nala sits on my PC like this too 😂",t3_moeo1u,2021-04-11 12:52:44,2021-04-11
1535,gu4z5ly,t3_moeo1u,You shud name her 'Crypto',t3_moeo1u,2021-04-11 19:07:33,2021-04-11
1536,gu54g0a,t3_moeo1u,Is it worth it to try and get a rig to mine with today? I just feel that I’m late to the party. Well not so much late but it’s like I went to the party and I didn’t think it would be cool so I left it there when I drove back by im like damn.,t3_moeo1u,2021-04-11 20:21:42,2021-04-11
1537,gu3zpl3,t3_moeo1u,"I use that same audio monitor, you make music?",t3_moeo1u,2021-04-11 10:52:00,2021-04-11
1538,gu3ioig,t3_moeo1u,yes cat,t3_moeo1u,2021-04-11 08:12:03,2021-04-11
1539,gu3n2tt,t3_moeo1u,NO WAY I HAVE A CAT NAMED NALA,t3_moeo1u,2021-04-11 08:52:11,2021-04-11
1540,gu3u0me,t3_moeo1u,Crypto Kitty?,t3_moeo1u,2021-04-11 09:57:31,2021-04-11
1541,gu3vo6z,t3_moeo1u,That's a sweet case.,t3_moeo1u,2021-04-11 10:13:16,2021-04-11
1542,gu4562c,t3_moeo1u,\+ no carbon pawprints...!,t3_moeo1u,2021-04-11 11:46:39,2021-04-11
1543,gu46b27,t3_moeo1u,Omg so cute 😍,t3_moeo1u,2021-04-11 11:58:44,2021-04-11
1544,gu48txp,t3_moeo1u,Sexy neck roll up for me though,t3_moeo1u,2021-04-11 12:26:24,2021-04-11
1545,gu4ez6r,t3_moeo1u,you mine with the same pc you use to record with that interface?,t3_moeo1u,2021-04-11 13:42:31,2021-04-11
1546,gu4gl60,t3_moeo1u,Cats vote 1000% crypto miners in every house!,t3_moeo1u,2021-04-11 14:05:15,2021-04-11
1547,gu4krxx,t3_moeo1u,NALA get that Coins!,t3_moeo1u,2021-04-11 15:07:33,2021-04-11
1548,gu4mcnv,t3_moeo1u,I have the same mouse. 304 I guess,t3_moeo1u,2021-04-11 15:32:11,2021-04-11
1549,gu4wewl,t3_moeo1u,MeowCoin,t3_moeo1u,2021-04-11 18:22:47,2021-04-11
1550,gu5ayou,t3_moeo1u,"What do you mine, dude?",t3_moeo1u,2021-04-11 22:15:06,2021-04-11
1551,gu5cokz,t3_moeo1u,"I am interested in learning how to mine cryptocurrency.
Can anybody recommend a good link for me to learn.
I am as green as the  incredible hulk LOL so bear with me please",t3_moeo1u,2021-04-11 22:31:13,2021-04-11
1552,gu5dbvg,t3_moeo1u,Looks like he just like warm places :),t3_moeo1u,2021-04-11 22:37:01,2021-04-11
1559,gu3n2cg,t3_moeo1u,"First, your cat is adorable.  Second, can you tell me your gear (specs)?",t3_moeo1u,2021-04-11 08:52:04,2021-04-11
1560,gu3qrha,t3_moeo1u,"Huh domestic mining is still profitable?

Cute cat :)",t3_moeo1u,2021-04-11 09:26:58,2021-04-11
1561,gu3r2na,t3_moeo1u,Are you enjoying the 23¢,t3_moeo1u,2021-04-11 09:29:51,2021-04-11
1562,gu3qbun,t3_moeo1u,"This is a bitcoin sub. not ""Crypto"" But since i love cats i will not report u :)",t3_moeo1u,2021-04-11 09:22:56,2021-04-11
1563,gu3qimo,t3_moeo1u,I love her,t3_moeo1u,2021-04-11 09:24:42,2021-04-11
1564,gu3qm8j,t3_moeo1u,They love the warmth.,t3_moeo1u,2021-04-11 09:25:38,2021-04-11
1565,gu3qvrk,t3_moeo1u,Soo warrm,t3_moeo1u,2021-04-11 09:28:06,2021-04-11
1566,gu3te29,t3_moeo1u,Where would one go to learn about/start mining crypto?,t3_moeo1u,2021-04-11 09:51:33,2021-04-11
1567,gu3tk2n,t3_moeo1u,Seems unrelated to this sub,t3_moeo1u,2021-04-11 09:53:07,2021-04-11
1568,gu3bfdt,t3_moeo1u,Gen 0 #1 cryptokitty,t3_moeo1u,2021-04-11 07:04:12,2021-04-11
1569,gu3zxbo,t3_moeo1u,"So this is the guy who’s destroying our planet by mining Bitcoin, I’ll allow it.",t3_moeo1u,2021-04-11 10:54:05,2021-04-11
1570,gu3uk97,t3_moeo1u,Already took herself power saving mode,t3_moeo1u,2021-04-11 10:02:50,2021-04-11
1571,gu3vspu,t3_moeo1u,Took my glass off.  Dropped the temp in Phoenix Miner 5° C.,t3_moeo1u,2021-04-11 10:14:28,2021-04-11
1572,gu43eds,t3_moeo1u,Googler?,t3_moeo1u,2021-04-11 11:28:32,2021-04-11
1573,gu48xlk,t3_moeo1u,"Current mood for me right now. 


Busy watching my coins grow up

While do the watching😉",t3_moeo1u,2021-04-11 12:27:34,2021-04-11
1574,gu49mnk,t3_moeo1u,r/Catloaf 🍞,t3_moeo1u,2021-04-11 12:35:41,2021-04-11
1575,gu4b52s,t3_moeo1u,Nice mining loaf,t3_moeo1u,2021-04-11 12:53:33,2021-04-11
1576,gu4bv3b,t3_moeo1u,Kitty :3,t3_moeo1u,2021-04-11 13:02:26,2021-04-11
1577,gu4idih,t3_moeo1u,"What case is that? I'm looking for one in this exact style. Also, how does it manage temps?",t3_moeo1u,2021-04-11 14:31:09,2021-04-11
1578,gu4kq0e,t3_moeo1u,"I was just looking at setting up a mining rig, more for fun than profit.  What GPU are you using and how many?",t3_moeo1u,2021-04-11 15:06:44,2021-04-11
1579,gu4lkar,t3_moeo1u,So warm........,t3_moeo1u,2021-04-11 15:19:52,2021-04-11
1580,gu4m9d7,t3_moeo1u,"Beautiful kitty, clearly protecting the mining PC.",t3_moeo1u,2021-04-11 15:30:43,2021-04-11
1581,gu4mk2g,t3_moeo1u,Warm CAT,t3_moeo1u,2021-04-11 15:35:26,2021-04-11
1582,gu4muvk,t3_moeo1u,The hair 😬,t3_moeo1u,2021-04-11 15:40:08,2021-04-11
1583,gu4pqn9,t3_moeo1u,You mean your pussy 🐱😉,t3_moeo1u,2021-04-11 16:27:50,2021-04-11
1584,gu4rbu0,t3_moeo1u,cute :),t3_moeo1u,2021-04-11 16:54:39,2021-04-11
1585,gu4rgkc,t3_moeo1u,She's probably deaf by now.,t3_moeo1u,2021-04-11 16:56:57,2021-04-11
1586,gu4rwy3,t3_moeo1u,kitties and bitcoin  😻,t3_moeo1u,2021-04-11 17:04:55,2021-04-11
1587,gu4rz1n,t3_moeo1u,She is up there for the heat,t3_moeo1u,2021-04-11 17:05:53,2021-04-11
1588,gu4sqwt,t3_moeo1u,How much crypto can he mine?😏,t3_moeo1u,2021-04-11 17:19:14,2021-04-11
1589,gu4srr9,t3_moeo1u,Bitcoin mining cat,t3_moeo1u,2021-04-11 17:19:39,2021-04-11
1590,gu4tkkd,t3_moeo1u,That pussy needs a bath,t3_moeo1u,2021-04-11 17:33:40,2021-04-11
1591,gu4u2en,t3_moeo1u,"I love cats, this made my day, thank you <3",t3_moeo1u,2021-04-11 17:42:12,2021-04-11
1592,gu507pf,t3_moeo1u,You have a personal guard for your mining rig lol,t3_moeo1u,2021-04-11 19:23:51,2021-04-11
1593,gu53xen,t3_moeo1u,Might be blocking your airflow. Could cause overheating :/,t3_moeo1u,2021-04-11 20:15:07,2021-04-11
1594,gu54on4,t3_moeo1u,r/catswithjobs,t3_moeo1u,2021-04-11 20:24:41,2021-04-11
1595,gu55cxz,t3_moeo1u,Brazil?,t3_moeo1u,2021-04-11 20:33:08,2021-04-11
1596,gu55jbj,t3_moeo1u,"That is the reason, why we can't buy graphic cards....",t3_moeo1u,2021-04-11 20:35:19,2021-04-11
1597,gu59xzj,t3_moeo1u,"Hi you all! Thanks for your amazing support!
Nala sends you a big purr of thanks!!

For those curious I’m from Argentina, and that’s my personal gaming pc (were I also work, edit photos and mix some music) that I’ve built a few years ago.

It’s running a GTX 1080 and a 1 gen Ryzen 5 1600, so you can calculate how old is my rig ;) 

With Btc prices so high (and climbing) I’ve decided to give it a shot at mining as I already have the hardware that I’ve pay for it, and the electricity here in Argentina it’s quite cheap (also winter is coming so...)

As you may now Argentina’s currency is really devalued compare to the USD so the forex really helps.

Thanks you all for the awards and the amazing good energy! Stay safe and HOLD!",t3_moeo1u,2021-04-11 22:05:12,2021-04-11
1598,gu5bgro,t3_moeo1u,u better pay him good treats,t3_moeo1u,2021-04-11 22:19:56,2021-04-11
1603,gu3sa2p,t3_moeo1u,Kitty Mining his own,t3_moeo1u,2021-04-11 09:41:12,2021-04-11
1604,gu3sq33,t3_moeo1u,ASIC miner purring?,t3_moeo1u,2021-04-11 09:45:18,2021-04-11
1605,gu3wreb,t1_gu3hgsq,Agree. This is the happiest and warmest pussy ever.,t3_moeo1u,2021-04-11 10:23:46,2021-04-11
1606,gu3zyy7,t1_gu38ssu,"Kitty wants more hashes, treats, and pats",t3_moeo1u,2021-04-11 10:54:32,2021-04-11
1607,gu4s96l,t1_gu3ft7w,"No, she ordered her human to make one for her. You can also find help from a friend",t3_moeo1u,2021-04-11 17:10:36,2021-04-11
1608,gu3csvo,t1_gu3bb0j,Awww! So cute!,t3_moeo1u,2021-04-11 07:17:01,2021-04-11
1609,gu3q7wt,t1_gu3bb0j,i love the cat,t3_moeo1u,2021-04-11 09:21:55,2021-04-11
1610,gu3miu8,t1_gu3mheb,Awwwwww,t3_moeo1u,2021-04-11 08:46:56,2021-04-11
1611,gu405ee,t1_gu3mqc4,🚫🍄♟️,t3_moeo1u,2021-04-11 10:56:17,2021-04-11
1612,gu49nw9,t1_gu3y1b3,"Step 1 - get a cat
Step 2 - profit

I may have missed a step or two.",t3_moeo1u,2021-04-11 12:36:05,2021-04-11
1613,gu4shqn,t1_gu3y1b3,Ask the cat for help. It is solo mining Dogecoin,t3_moeo1u,2021-04-11 17:14:50,2021-04-11
1614,gu4w4oq,t1_gu40k2w,/r/catsbeingbanks,t3_moeo1u,2021-04-11 18:18:04,2021-04-11
1615,gu4tphh,t1_gu44tqb,It is mining $CAT coin,t3_moeo1u,2021-04-11 17:36:02,2021-04-11
1616,gu46sth,t1_gu3kzop,thanks sherlock,t3_moeo1u,2021-04-11 12:04:04,2021-04-11
1617,gu5all6,t1_gu54g0a,"Yes, kinda same question. Will PoS kill off the idea of reasonable profits from a small mining rig? Truly interested.",t3_moeo1u,2021-04-11 22:11:38,2021-04-11
1618,gu3zxy4,t1_gu3zpl3,Yes! On my spare time I make orchestral tracks with my brother! He also sings to once in a while we record some stuff as well :),t3_moeo1u,2021-04-11 10:54:15,2021-04-11
1619,gu4f1ve,t1_gu4ez6r,"wait you game, maybe stream?.... even more mind blowing.",t3_moeo1u,2021-04-11 13:43:33,2021-04-11
1620,gu598sz,t1_gu4mcnv,"Almost, it’s a G305",t3_moeo1u,2021-04-11 21:57:52,2021-04-11
1621,gu5b7vs,t1_gu5ayou,If I understand it correctly NiceHash mines ETH but pays you in BTC,t3_moeo1u,2021-04-11 22:17:34,2021-04-11
1623,gu3saet,t1_gu3qrha,I’m just giving it a shot as here in Argentina electricity is quite cheap compared to usd.,t3_moeo1u,2021-04-11 09:41:18,2021-04-11
1624,gu4qsvr,t1_gu3qrha,I don't see why it wouldn't be. If you already have the hardware for gaming anyway and live somewhere you need to heat your house it's basically free.,t3_moeo1u,2021-04-11 16:45:43,2021-04-11
1625,gu4444x,t1_gu3r2na,Cat sure is,t3_moeo1u,2021-04-11 11:36:01,2021-04-11
1626,gu58w1l,t1_gu3qbun,"Right, but if you have graphics cards that can mine ETH, you can just take any profits and buy more bitcoin.",t3_moeo1u,2021-04-11 21:53:44,2021-04-11
1627,gu4sqw9,t1_gu3qm8j,"That's why it is mining, not for the crypto but the warmth.",t3_moeo1u,2021-04-11 17:19:14,2021-04-11
1628,gu43rr7,t1_gu3te29,"Youtube, r/miningbitcoin or r/miningrig",t3_moeo1u,2021-04-11 11:32:27,2021-04-11
1629,gu595pv,t1_gu4idih,It’s a [Corsair 400C](https://www.corsair.com/us/en/Categories/Products/Cases/carbide-400c-config/p/CC-9011081-WW),t3_moeo1u,2021-04-11 21:56:54,2021-04-11
1630,gu4steh,t1_gu4kq0e,I'm assuming your parents pay your electricity then,t3_moeo1u,2021-04-11 17:20:26,2021-04-11
1631,gu59bc9,t1_gu55cxz,Im from Argentina,t3_moeo1u,2021-04-11 21:58:39,2021-04-11
1633,gu4b05f,t1_gu3zyy7,Clean energy!,t3_moeo1u,2021-04-11 12:51:55,2021-04-11
1634,gu3vgl9,t1_gu3q7wt,I love the cat,t3_moeo1u,2021-04-11 10:11:16,2021-04-11
1635,gu4bsvs,t1_gu405ee,Stop doing mushrooms you pawn,t3_moeo1u,2021-04-11 13:01:41,2021-04-11
1636,gu4b8dy,t1_gu49nw9,nope this is right,t3_moeo1u,2021-04-11 12:54:40,2021-04-11
1637,gu4dfs7,t1_gu49nw9,This is the way.,t3_moeo1u,2021-04-11 13:22:14,2021-04-11
1641,gu46zl4,t1_gu46sth,You're welcome Watson,t3_moeo1u,2021-04-11 12:06:04,2021-04-11
1643,gu4o6wk,t1_gu3zxy4,Pretty neat! Where could I find some of your work?,t3_moeo1u,2021-04-11 16:01:48,2021-04-11
1644,gu5927q,t1_gu4f1ve,"It’s my gaming pc. I build it a few years ago. I work on it, game, edit photos and mix music. And now I was just giving a shot to mining as I already have the hardware and electricity here is really cheap",t3_moeo1u,2021-04-11 21:55:47,2021-04-11
1646,gu45epk,t1_gu3saet,Try to set up or make some form of regeneration and you may be able to save even more cost,t3_moeo1u,2021-04-11 11:49:10,2021-04-11
1648,gu5a3io,t1_gu59bc9,"I was going to say the shutters are very Latin America.

Salud neighbour!",t3_moeo1u,2021-04-11 22:06:42,2021-04-11
1650,gu4efaa,t1_gu4bsvs,🚫💩🤴,t3_moeo1u,2021-04-11 13:35:08,2021-04-11
1651,gu4pqay,t1_gu46zl4,"only meant that in a playful manner, sorry if it came off dickish",t3_moeo1u,2021-04-11 16:27:40,2021-04-11
1652,gu58tel,t1_gu4o6wk,We have some tracks in Spotify and most music online stores. Look for The Millan Brothers ;),t3_moeo1u,2021-04-11 21:52:47,2021-04-11
1653,gu5agec,t1_gu5927q,So you built this? Not exactly something I could look at with a link? Mind saying where you’re located? I have solar and would like to set up a smallish rig.,t3_moeo1u,2021-04-11 22:10:14,2021-04-11
1655,gu489gv,t1_gu45epk,Give me some of that solar,t3_moeo1u,2021-04-11 12:20:07,2021-04-11
1656,gu5a75h,t1_gu5a3io,Hahahah yes! The broken net at the windows gives it the final touch. abraços!,t3_moeo1u,2021-04-11 22:07:41,2021-04-11
1657,gu4idjr,t1_gu4efaa,You're no shit king,t3_moeo1u,2021-04-11 14:31:09,2021-04-11
1658,gu4wy9n,t1_gu4pqay,No offense taken. Response was playful 😀,t3_moeo1u,2021-04-11 18:31:48,2021-04-11
1660,gu5b5mn,t1_gu5agec,"Yeah, it’s my gaming pc, not something pre- built.

I’m from Argentina. I post a comment with more details ;)",t3_moeo1u,2021-04-11 22:16:58,2021-04-11
1663,gu59tll,t1_gu4wy9n,"response was elementary, my dear.",t3_moeo1u,2021-04-11 22:03:57,2021-04-11
1761,gu4uq5l,t3_moo1x7,Tales from the crypt??,t3_moo1x7,2021-04-11 17:53:45,2021-04-11
1762,gu5c61t,t3_moo1x7,"Worse it’s a government manipulated, rehypothicated, high inflation shitcoin that leaves behind toxic waste and isn’t programmable or portable or divisible or spendable or protectable.",t3_moo1x7,2021-04-11 22:26:26,2021-04-11
1763,gu5csgl,t3_moo1x7,Laughed reading this hehe,t3_moo1x7,2021-04-11 22:32:11,2021-04-11
1772,gu4vjx8,t1_gu4uq5l,"Sort of.
It was actually ‘What Bitcoin Did - With Peter McCormack’, but his guests were Marty Bent and Matt Odell",t3_moo1x7,2021-04-11 18:08:02,2021-04-11
1778,gu4xf3m,t1_gu4vjx8,"Great shows, gold is definitely a shit coin haha",t3_moo1x7,2021-04-11 18:39:29,2021-04-11
1780,gu53qvi,t1_gu4xf3m,I don’t know if it’s definitely a shit coin it’s been the best available coin for thousands of years. it is no longer the best. If you had a billion dollars and you wanted to make sure your great grandchildren got the wealth it’s probably the safest bet.,t3_moo1x7,2021-04-11 20:12:43,2021-04-11
1959,gu5dlek,t3_mortma,Courtesy of: https://twitter.com/plan_marcus/status/1381239180865515520,t3_mortma,2021-04-11 22:39:24,2021-04-11
