,comment_id,comment_parent_id,comment_body,comment_link_id,created,date
2455,gszpac4,t1_gswugw7,This is like bots getting in trouble in a video game. Oh well banned or in trouble. Pay to play fee. And tomorrow is another day to do it all over again,t3_mh4vyk,2021-04-01 11:24:01,2021-04-01
2456,gsy0w43,t1_gswugw7,A fine for ants,t3_mh4vyk,2021-04-01 02:52:10,2021-04-01
2457,gsxtgt2,t1_gswym4n,It was also done in 2016. The only reason they are paying for it now is because they are going to be on the public market so they have to be treated like a real company would.,t3_mh4vyk,2021-04-01 01:55:29,2021-04-01
2459,gt0j5pz,t1_gswqfhr,seriously underrated comment.,t3_mh4vyk,2021-04-01 17:59:04,2021-04-01
2461,gsxjy50,t1_gswod24,"I use Coinbase only as of now and i fully agree. Im not surprised. I think they do this especially when people place buy and sell orders to trick clients into buying back in or selling. Essentially making money off the fees.   Edit: apparently it was related to washing trading LTC and even BTC. And also to falsely boost liquidity levels. Might have a been a huge ploy to increase appeal to institutional investors. Not happy about it, bit as long as they knock it off snd hopefully they have then im not going to sweat it. (i should probably create an account on Gemini or Kraken to be safe, you know for exit reasons)",t3_mh4vyk,2021-04-01 00:44:15,2021-04-01
2463,gsy23fn,t1_gswt65i,Any idea how this will impact their upcoming IPO?,t3_mh4vyk,2021-04-01 03:01:14,2021-04-01
2464,gsy4862,t1_gsxxwj8,It's unfortunate that only 3 people will actually read this comment before posting,t3_mh4vyk,2021-04-01 03:17:39,2021-04-01
2465,gszlb6x,t1_gsxxwj8,"Not to mention that it was just some bots which happened to occasionally sell to each other.

This is the usual bureaucrats justifying themselves and seeking rent.",t3_mh4vyk,2021-04-01 10:45:13,2021-04-01
2466,gsxeev2,t1_gsws0nk,"I pay attention to crypto on a daily basis and this is the first time I've heard of it. I guess repeating ~~old~~ recent news isn't so annoying after all, eh?",t3_mh4vyk,2021-04-01 00:02:54,2021-04-01
2467,gsxbaxp,t1_gsws0nk,Yeah not sure why Iâ€™m seeing so much institutional hate. I understand the sentiment but gotta read past the headline. I suppose I expect too much these days.,t3_mh4vyk,2021-03-31 23:39:43,2021-03-31
2468,gsy210w,t1_gsws0nk,"Who benefitted more from this, Coinbase or this employee?",t3_mh4vyk,2021-04-01 03:00:43,2021-04-01
2469,gsy28fm,t1_gsws0nk,"Any idea how this will effect their upcoming IPO or future outlook of the company?

I have a bunch of Roth/401k funds that I can't buy BTC with so figured getting in on Coinbase was the next best thing.",t3_mh4vyk,2021-04-01 03:02:18,2021-04-01
2470,gsxe6w1,t1_gsx7p27,"From 43 million registered users on coinbase, you'd receive 15 cents, nice",t3_mh4vyk,2021-04-01 00:01:15,2021-04-01
2471,gsx7z3g,t1_gsx7p27,"You have a point here, indeed",t3_mh4vyk,2021-03-31 23:14:26,2021-03-31
2472,gsyzvgr,t1_gsws3uj,Last minute schedule down time just at the price dumps. Nothing to see here,t3_mh4vyk,2021-04-01 07:34:41,2021-04-01
2473,gsxj3pz,t1_gsxftsy,This.,t3_mh4vyk,2021-04-01 00:37:59,2021-04-01
2476,gsyp7en,t1_gsxo8rk,What should people use instead?,t3_mh4vyk,2021-04-01 06:01:11,2021-04-01
2477,gsxmnba,t1_gsx3rpj,"> his is simply the result of the settlement/agreement with the CFTC - what was agreed by both parties would become public as a result of the guilty plea.
> 
> 
> 
> What they were actually caught doing would make Bernie Madoff look like a street corner coin-shaver.
> 
> 
> 
> Only keep on Coinbase that which you can afford to lose.

Some reading if you're interested: https://mises.org/library/not-so-wild-wild-west",t3_mh4vyk,2021-04-01 01:04:22,2021-04-01
2478,gsxdoby,t1_gsxdmco,us gov,t3_mh4vyk,2021-03-31 23:57:23,2021-03-31
2479,gsxtl8p,t1_gsxtavd,"IPO or not, there are mounting class auction lawsuits towards Coinbase... those will last through the IPO and beyond",t3_mh4vyk,2021-04-01 01:56:24,2021-04-01
2480,gt0i8nr,t1_gsykju3,waaa' :-o,t3_mh4vyk,2021-04-01 17:47:22,2021-04-01
2481,gsynzb6,t1_gsykpzh,Itâ€™s not.,t3_mh4vyk,2021-04-01 05:51:02,2021-04-01
2482,gsx83xy,t1_gswukmk,"When gambling the house always wins. Stop day trading people. You're being manipulated into losses.

!lntip 500

edit: Tip bot responding again.",t3_mh4vyk,2021-03-31 23:15:29,2021-03-31
2483,gszklqh,t1_gswukmk,Ethereum Network and BSC already have huge DEX volume. Huobi Network and Avalanche are slowly increasing in DEX vole. Were getting there.,t3_mh4vyk,2021-04-01 10:38:28,2021-04-01
2484,gt08xfp,t1_gswukmk,"Hmm, ive been daytrading next to my job a bit and make around 60 to 100 euro p/day and if i have less time atleast per week. Its not much but adds to my salary ofc. Never really had any troubles so far. Maby im on a decent exchange i guess lol i use bitvavo",t3_mh4vyk,2021-04-01 15:35:33,2021-04-01
2487,gsyjo8f,t1_gswxi37,"The problem is that the issue is most likely two or three orders of magnitude larger within Asian countries.

I'd guess China and Korea alone have a huge amount of channel stuffing volume that's basically trading it back and forth to juice and fuzzy transactions.

When it's basically free to send... There's little disincentive... Meanwhile there are big advantages for speculative value when you can show the network is being used extensively.",t3_mh4vyk,2021-04-01 05:15:58,2021-04-01
2488,gsxj9vz,t1_gsxj6ul,"Coinbase facilited, otherwise only the employee would've been accused",t3_mh4vyk,2021-04-01 00:39:17,2021-04-01
2489,gsxomlf,t1_gsxnun6,"although it's from 19th of March 2021 it was not posted on /r/bitcoin
if you have other channels which you found out from, it doesn't mean it's old..  after all there are 2000+ people who found it new",t3_mh4vyk,2021-04-01 01:19:13,2021-04-01
2490,gsxxgf9,t1_gsxtsg1,Bonk,t3_mh4vyk,2021-04-01 02:25:54,2021-04-01
2491,gsxgry3,t1_gsx942k,"Coinbase is one of only a few exchanges in the US, and they are reaponsible for a considerable amount of liquidity.

I blame this on Bitcoin being so young. As the space matures, more options become available. Decentralization doesn't stop people from being shitty, it just means that they can't be shitty AND retain a monopoly to force their shittiness on everyone. Anyone can trade Bitcoon, so a new exchange can pop up; there's no barrier to entry except local law, which is also different from locale to locale.",t3_mh4vyk,2021-04-01 00:20:40,2021-04-01
2496,gsxq7e3,t1_gswsn8m,What do you recommend for buying bitcoin?,t3_mh4vyk,2021-04-01 01:30:59,2021-04-01
2497,gsxkffn,t1_gsx6a86,ofc,t3_mh4vyk,2021-04-01 00:47:50,2021-04-01
2500,gsyo5oo,t1_gsyjyba,Youâ€™re right. It should be more like 200k by now.,t3_mh4vyk,2021-04-01 05:52:29,2021-04-01
2501,gt01c0c,t1_gszufrv,Lol /s,t3_mh4vyk,2021-04-01 13:42:15,2021-04-01
2502,gsxm8j0,t1_gsxfypk,What kind of dumbass logic is this?,t3_mh4vyk,2021-04-01 01:01:16,2021-04-01
2503,gsxhmuw,t1_gsxghok,Because Bitcoin isnâ€™t an average asset? ðŸ¤·ðŸ¾â€â™‚ï¸,t3_mh4vyk,2021-04-01 00:27:06,2021-04-01
2504,gsxkx7g,t1_gsxkcqp,it is happening https://www.reddit.com/r/Bitcoin/comments/mh957d/petition_cal_coinbase_has_been_locking_accounts/,t3_mh4vyk,2021-04-01 00:51:31,2021-04-01
2505,gsxml83,t1_gsxmgum,And yet only  handful of  people know about this,t3_mh4vyk,2021-04-01 01:03:55,2021-04-01
2506,gsxmygw,t1_gsxmvm0,They haven't been caught... yet!,t3_mh4vyk,2021-04-01 01:06:43,2021-04-01
2507,gsxpsqe,t1_gsxpnzk,"yeap, i can relate
/me such idiot",t3_mh4vyk,2021-04-01 01:27:57,2021-04-01
2508,gsxppob,t1_gsxpoaq,BTC/LTC pair,t3_mh4vyk,2021-04-01 01:27:20,2021-04-01
2509,gsxuyno,t1_gsxuarp,what are HFTs?,t3_mh4vyk,2021-04-01 02:06:47,2021-04-01
2510,gsxvtrm,t1_gsxvdpl,"it's all about few zeros

at the end of sum :`)",t3_mh4vyk,2021-04-01 02:13:27,2021-04-01
2511,gsybx8h,t1_gsy5zpw,Somebody talked,t3_mh4vyk,2021-04-01 04:16:17,2021-04-01
2512,gsza3c4,t1_gsyiq90,Wondering the same thing.,t3_mh4vyk,2021-04-01 09:04:59,2021-04-01
2513,gsz94xr,t1_gsyjq01,"Same here., So, far I heard Kraken but i wish more people will reply.",t3_mh4vyk,2021-04-01 08:56:45,2021-04-01
2514,gsynsho,t1_gsymsc3,Kraken. Excellent support. Lower fees. They don't crash every time price goes crazy.,t3_mh4vyk,2021-04-01 05:49:28,2021-04-01
2515,gszcdua,t1_gsz0rwe,*coinbase*,t3_mh4vyk,2021-04-01 09:24:56,2021-04-01
2516,gsza1vi,t1_gsz8s1z,I've been looking at BitPay.  It is registered in the US and seems OK so far,t3_mh4vyk,2021-04-01 09:04:38,2021-04-01
2517,gt0iwvd,t1_gsxanob,Whats with all the removed replies?,t3_mh4vyk,2021-04-01 17:56:00,2021-04-01
2518,gsxwkcg,t1_gsxanob,[removed],t3_mh4vyk,2021-04-01 02:19:06,2021-04-01
2519,gsxdasi,t1_gsxanob,[deleted],t3_mh4vyk,2021-03-31 23:54:34,2021-03-31
2520,gsxrqpv,t1_gsx9tz1,These kind of shady dealings still happen today. This is just the one they got caught on. Coinbase is such a terrible company,t3_mh4vyk,2021-04-01 01:42:33,2021-04-01
2521,gsxfma0,t1_gsxeo82,This has been the truth for far longer then any of us can even imagine!,t3_mh4vyk,2021-04-01 00:12:01,2021-04-01
2522,gsxkxtu,t1_gsxeo82,You mean the whole world is a scam,t3_mh4vyk,2021-04-01 00:51:38,2021-04-01
2523,gsxprc1,t1_gsxeo82,Yeah soo whereâ€™s my cut for this scam,t3_mh4vyk,2021-04-01 01:27:41,2021-04-01
2524,gszhud8,t1_gsxeo82,"If I wasn't a cheap bastard, I'd give you a THIS award. Remember the occupy wall street protests? It's much worse now. And honestly it's the whole flipping planet at this point.",t3_mh4vyk,2021-04-01 10:12:55,2021-04-01
2525,gsxn1nl,t1_gsxeo82,"Indeed, shouldn't we be getting that money? Not the Bidens?",t3_mh4vyk,2021-04-01 01:07:22,2021-04-01
2526,gszo73m,t1_gsxtgt2,"Also coinbase were doing it because everyone else in the world at the time was using the same bots 100X more than coinbase ever did, to create fake volumes and rank their shitty exchange on top of the volume chart. I didn't even know coinbase was also creating some fake volume because they always rank pretty low on volume. I guess coinbase were just testing their bots in case they wanted to do the fake volume too, but eventually decided to not compete on that front.",t3_mh4vyk,2021-04-01 11:13:15,2021-04-01
2529,gsxwr73,t1_gswzrck,Not your keys not your coins,t3_mh4vyk,2021-04-01 02:20:34,2021-04-01
2531,gsx8t9t,t1_gswyr7e,"They should be paying it to their customers, if not to charity. 

Why does a government agency get the money for the fine, how is any better than Coinbase having it? Either way doesnt do much good imo.",t3_mh4vyk,2021-03-31 23:20:50,2021-03-31
2534,gsxdn63,t1_gswyr7e,"> coinbase provides their service all around the world, right?

Yes, but ""all around the world"" includes the US, doesn't it? So, they're subject to US law if they operate in the US, even if they also operate elsewhere, just like every other business...",t3_mh4vyk,2021-03-31 23:57:08,2021-03-31
2535,gsx93d2,t1_gswyr7e,Because Coinbase is incorporated in the US? Seems pretty obvious to me.,t3_mh4vyk,2021-03-31 23:22:58,2021-03-31
2536,gsxnrk1,t1_gswyr7e,"I suspect it is a ""fine"" paid to the CFTC, which then protects coinbase from being sued by individual victims. I'm not an expert in how these things work, but that's the kind of bullshit I would expect.",t3_mh4vyk,2021-04-01 01:12:45,2021-04-01
2537,gszxy8s,t1_gswyr7e,"Coin base operated partially within the U.S.

If you operate in the U.S., you need to follow the rules or else you are punished as a way to disincentivize breaking the rules. 

A fine is used as a punishment. The fine goes to the CFTC, partially as an incentive for the CFTC to enforce the rules, but mainly as a way to fund the organization so that it can continue to enforce the rules without needing tax payer money to keep it afloat. 

Really itâ€™s not too awful or illogical of a system to incentivize the enforcement and proper adherence to the rules and regulations, ultimately protecting consumers.",t3_mh4vyk,2021-04-01 12:58:39,2021-04-01
2538,gsxibkc,t1_gswzyid,Should be like pass interference. Place at the spot of the foul and then add 15 yard penalty for unsportsmanlike conduct.,t3_mh4vyk,2021-04-01 00:32:07,2021-04-01
2539,gsyl6ny,t1_gsy23fn,"none.  if you read the article, the title is extremely misleading.  It sounds as if the company intentionally frauded prices.  This event happened in 2016 and it was caused by 1 former employee.",t3_mh4vyk,2021-04-01 05:28:00,2021-04-01
2540,gsybtmp,t1_gsy4862,Welcome to the 'new normal',t3_mh4vyk,2021-04-01 04:15:31,2021-04-01
2541,gsz08hw,t1_gsy4862,"Pretty sure only 10% will even read half the article before jumping straight into the comments with a ""fully informed"" opinion and much less than that will finish the whole article. Welcome to Reddit",t3_mh4vyk,2021-04-01 07:37:53,2021-04-01
2542,gsxp3yq,t1_gsxeev2,"I think what he/she was saying is a lot of important info was left off of that headline and the article. 

It was made up volume on Litecoin and then Coinbase purposefully waited just long enough so that they wouldn't have to disclose this when going public.  It's very shady behavior for a company getting the valuations it is getting.",t3_mh4vyk,2021-04-01 01:22:50,2021-04-01
2543,gsxejnw,t1_gsxe6w1,"Well thatâ€™s not much, but if Coinbase did an airdrop of say 2-5$ of a shitcoin they just got on, or something like that. Iâ€™m quite sure it would make them look much better but at the mo I will always remember them for this. Currently I have 90% of my portfolio on Coinbase but I think Iâ€™m going to change this. That said Iâ€™m quite sure most exchanges are guilty of some sort of weirdness in crypto lol.",t3_mh4vyk,2021-04-01 00:03:55,2021-04-01
2544,gsxgwww,t1_gsxe6w1,It's also not like the average user lost more than 15 cents due this bot. It's the principle. People worldwide lost money but murica world police wants the fine.,t3_mh4vyk,2021-04-01 00:21:42,2021-04-01
2545,gsx8ti6,t1_gsx059z,">The order also finds that over a six-week periodâ€”August through September 2016â€”a former Coinbase employee used a manipulative or deceptive device by intentionally placing buy and sell orders in the Litecoin/Bitcoin trading pair

...and Charlie left Coinbase in 2017, making him a former Coinbase employee.  Things that make you go hmmmm.",t3_mh4vyk,2021-03-31 23:20:53,2021-03-31
2546,gsxwnvl,t1_gswqlpc,Thanks pooh bear,t3_mh4vyk,2021-04-01 02:19:50,2021-04-01
2547,gszpytw,t1_gsyp7en,Coinbase Pro,t3_mh4vyk,2021-04-01 11:30:44,2021-04-01
2548,gsx9ogj,t1_gsx83xy,Can you expand on the manipulation?,t3_mh4vyk,2021-03-31 23:27:26,2021-03-31
2549,gsxh8ma,t1_gsx83xy,"Yeah I used to work for a big exchange, won't mention the name, for the very successful and profitable traders, we used to have to access peoples actual trading platforms in real-time, to the point we could actually see where their mouse pointers were moving in real time. And then we'd analyse the traders previous trades and counter their new trades, it was like winning at poker because you could see the other guys hand.",t3_mh4vyk,2021-04-01 00:24:09,2021-04-01
2550,gsxvz3p,t1_gswwdnq,It's still around !! WTF !! :D,t3_mh4vyk,2021-04-01 02:14:35,2021-04-01
2551,gsx785a,t1_gswwdnq,Such a hilarious alternative realty they live in. I sometimes go to that sub for entertainment. Some of them have even convinced themselves that Bitcoin Cash has the consensus and are the rightful Bitcoin.,t3_mh4vyk,2021-03-31 23:08:39,2021-03-31
2552,gsyjt1m,t1_gsx0x4u,"Literally any of the Asian companies. I'd wager this is one of the major fraudulent downsides to platforms like Bitcoin.

There's little disincentive to do so basically its inexpensive and yields great returns. Plus it's loosely regulated.",t3_mh4vyk,2021-04-01 05:17:00,2021-04-01
2557,gsx6yxc,t1_gswznem,Cash app and paypal are trash,t3_mh4vyk,2021-03-31 23:06:40,2021-03-31
2558,gsxaod6,t1_gsx035x,"Coinbase is fine. Its recommended that you do not keep your bitcoins on any exchange though.

If you are not savvy enough I wouldn't recommend not having them on a reliable exchange though. (coinbase, in my opinion, is actually quite reliable, but there are a few more reliable options probably)",t3_mh4vyk,2021-03-31 23:35:01,2021-03-31
2563,gsxa1g8,t1_gswyncg,I'm looking into Kraken and Voyager. TBD though,t3_mh4vyk,2021-03-31 23:30:11,2021-03-31
2564,gsxhuqx,t1_gsxhmuw,Avoid the fee and shop with a better company? Kiss away your 8% itâ€™s not my money lol,t3_mh4vyk,2021-04-01 00:28:42,2021-04-01
2565,gsxmqz6,t1_gsxml83,"To be expected from the Bitcoin crowd lol, wait until they hear about DeFi!",t3_mh4vyk,2021-04-01 01:05:09,2021-04-01
2566,gsxto3m,t1_gsxpsqe,"Wasnâ€™t a jab at you or anyone in particular. More a statement about how they can easily pay these small fines being levied against them due to the money theyâ€™ve raped from people in fees, myself included when I first got into crypto in â€˜17. As long as people keep using their platform weâ€™ll see them easily paying these fines that are peanuts to them.",t3_mh4vyk,2021-04-01 01:57:00,2021-04-01
2567,gsxv6df,t1_gsxuyno,It's a acronym for High Frequency Trading. Trading that is taking place in the span of nanoseconds. Basically all of which is done by bots now.,t3_mh4vyk,2021-04-01 02:08:26,2021-04-01
2568,gsznngs,t1_gszcdua,I'll be sure to tell my autocorrect that it was wrong.,t3_mh4vyk,2021-04-01 11:07:52,2021-04-01
2569,gt0wcqp,t1_gt0iwvd,[removed],t3_mh4vyk,2021-04-01 20:35:15,2021-04-01
2571,gsysru4,t1_gsxwkcg,[removed],t3_mh4vyk,2021-04-01 06:31:31,2021-04-01
2572,gsy38yo,t1_gsxwkcg,[removed],t3_mh4vyk,2021-04-01 03:10:05,2021-04-01
2573,gsxz7iy,t1_gsxwkcg,[removed],t3_mh4vyk,2021-04-01 02:39:17,2021-04-01
2574,gsxfuk7,t1_gsxdasi,Managed to mention an exchange that is shittier than coinbase. Congrats on going full retard.,t3_mh4vyk,2021-04-01 00:13:46,2021-04-01
2575,gsxdkuy,t1_gsxdasi,Whatâ€™s bsc?,t3_mh4vyk,2021-03-31 23:56:39,2021-03-31
2576,gsxicep,t1_gsxdasi,No.,t3_mh4vyk,2021-04-01 00:32:17,2021-04-01
2577,gsylpe1,t1_gsxrqpv,What company would be better? I have been having issues with Coinbase. Gemini?,t3_mh4vyk,2021-04-01 05:32:13,2021-04-01
2579,gsylton,t1_gsxrqpv,every exchange is doing it (That doesnt make it okay though). You just have to watch the order books to see it.,t3_mh4vyk,2021-04-01 05:33:13,2021-04-01
2580,gsyu08r,t1_gsxfma0,so much so itâ€™s been studied! https://represent.us/theproblem ðŸ¥´,t3_mh4vyk,2021-04-01 06:42:17,2021-04-01
2581,gsxnbs8,t1_gsxkxtu,"The entire global economic system is a ponzi scheme ran by the feds.

Edit: Federal reserve, not the feds.",t3_mh4vyk,2021-04-01 01:09:29,2021-04-01
2582,gsxunlh,t1_gsxkxtu,"Now that you mention it, NWO is coming real soon",t3_mh4vyk,2021-04-01 02:04:24,2021-04-01
2583,gszi60s,t1_gsxkxtu,Short the ponzi!,t3_mh4vyk,2021-04-01 10:15:51,2021-04-01
2584,gsxl6ym,t1_gsxkxtu,There are countries that actually educate and care for their citizens.  But I mostly agree.,t3_mh4vyk,2021-04-01 00:53:32,2021-04-01
2585,gsxwofm,t1_gsxkxtu,Iâ€™m gonna go out on a limb here and say the whole universe is a scam.,t3_mh4vyk,2021-04-01 02:19:58,2021-04-01
2586,gsxwq6o,t1_gsxprc1,In the pockets of some CEO somewhere.,t3_mh4vyk,2021-04-01 02:20:21,2021-04-01
2589,gsxmqwg,t1_gsx319m,"You want decentralized? Develop your own currency and hold it!

Oh wait..",t3_mh4vyk,2021-04-01 01:05:08,2021-04-01
2591,gsxn8tp,t1_gsx319m,So the approach here is to put BTC into hardware wallet and then trade in ledger live using notifications from another app like blockfolio?,t3_mh4vyk,2021-04-01 01:08:52,2021-04-01
2592,gsx7sd2,t1_gsx5b0k,exchanges can be regulated. wallets not so much.,t3_mh4vyk,2021-03-31 23:12:59,2021-03-31
2594,gsx84gw,t1_gsx2cbc,That's what lawsuits are for.,t3_mh4vyk,2021-03-31 23:15:35,2021-03-31
2595,gsx6q8s,t1_gsx2cbc,This,t3_mh4vyk,2021-03-31 23:04:46,2021-03-31
2596,gsxf0sa,t1_gsx2cbc,"(probably) They are, and it's not only them.

This will only change if people use BTC to its maximum potential and stop feeding the centralized exchanges their BTC.  Until the trading puts more BTC in the hands of those who will not convert it to less robust value stories, BTC will ""suffer"" these kinds of problems.  (Obviously I don't think BTC is an entity itself capable of suffering, I am reifying individual BTC users as gestalt to some extent - but to make the point.  Blah.)

I am skeptical this will ever happen in sufficient quantities to maximize the potential of BTC as a robust value story.  Would ""enjoy"" being proven absolutely wrong though.",t3_mh4vyk,2021-04-01 00:07:29,2021-04-01
2597,gsyvyn3,t1_gsx8t9t,That's just how fines work. Individual customers can still recover damages if they can prove them in court.,t3_mh4vyk,2021-04-01 06:59:30,2021-04-01
2598,gsx7nop,t1_gsx1thz,Because Coinbase is a centralized exchange? When does it become decentralized lol? After it is acquired or when it goes into your own wallet? Or I am all wrong... thanks!,t3_mh4vyk,2021-03-31 23:11:59,2021-03-31
2599,gsxaser,t1_gsx1thz,Do us all a favor and look up the decentralized exchanges already running.,t3_mh4vyk,2021-03-31 23:35:51,2021-03-31
2600,gsxdx61,t1_gsx93d2,Even if they weren't they operate in the US and are thus subject to it's laws. Just like every other company in the world that does the same thing.,t3_mh4vyk,2021-03-31 23:59:14,2021-03-31
2601,gsysta7,t1_gsxnrk1,Paying a fine doesnâ€™t shield a company from lawsuits. They can also be sued. Paying a civil fine doesnâ€™t even protect them from the government going after them for criminal penalties. There are many cases of companies fighting both the SEC and DOJ at the same time for the same incident.,t3_mh4vyk,2021-04-01 06:31:51,2021-04-01
2602,gsxmrdk,t1_gsxibkc,Damn. Fine amount = 115% of profits would be great actually. Maybe more.,t3_mh4vyk,2021-04-01 01:05:14,2021-04-01
2603,gsxl4y4,t1_gsxibkc,Super good analogy actually.,t3_mh4vyk,2021-04-01 00:53:07,2021-04-01
2604,gsxu9p4,t1_gsxejnw,"My brain ran out of breath while reading this, waiting for a punctuation mark.",t3_mh4vyk,2021-04-01 02:01:28,2021-04-01
2605,gsxtt94,t1_gsxgwww,"You do realize that coinbase is going to be a publicly traded company on the stock market correct?

The market ran by the US government?

It's as simple as the US government telling coinbase, ""sure you can join the our market, just pay us X amount of money for Y reasons!""

Why do you think their IPO got pushed back from March? Because they want their money first.",t3_mh4vyk,2021-04-01 01:58:04,2021-04-01
2606,gsxeuqe,t1_gsx9ogj,When someone can literally pay to see your trades before you've even made them it might be cause to think you're playing a game that's rigged against you.,t3_mh4vyk,2021-04-01 00:06:13,2021-04-01
2607,gsxdsgc,t1_gsx9ogj,"in stocks at least, u got very advanced algorithms trading for them and you will not beat them. thatâ€™s why real day traders prefer to trade mid float stock because institutions arenâ€™t trading them nearly as much.",t3_mh4vyk,2021-03-31 23:58:14,2021-03-31
2608,gsxr4nz,t1_gsx9ogj,They can change the price of the actual fill as they are the exchange themselves front running your order. Besides that there are lots of ways of manipulating people into selling such as posting fake orders that are removed before they are filled. They can also manipulate the price down or up to scare you into buying/selling based on emotions.,t3_mh4vyk,2021-04-01 01:37:56,2021-04-01
2609,gsys4ng,t1_gsxh8ma,Wtf this comment should get more attention. If not larp then this is scary. I knew they do trade against thier users but cmon this is distopian shit. I don't put stop loss anymore because mine always triggered while I was asleep and then you wake up to a +20% but your coins are gone... I'm so disgusted by crypto sometimes.,t3_mh4vyk,2021-04-01 06:26:01,2021-04-01
2610,gsyg6ml,t1_gsxh8ma,Holy shit. Can anyone back this up?,t3_mh4vyk,2021-04-01 04:48:52,2021-04-01
2611,gsy6urz,t1_gsxvz3p,"Yeah they spend 50% of their time criticising bitcoin and the other 50% talking about "",what Satoshi wanted""",t3_mh4vyk,2021-04-01 03:37:43,2021-04-01
2612,gsxezu7,t1_gsx5u3b,"If it is for long term hodling, my suggestion is almost always a hardware wallet in a location that you won't forget. Super secure.",t3_mh4vyk,2021-04-01 00:07:17,2021-04-01
2614,gsx75bu,t1_gswy5zd,"The Binance infrastructure is Chinese, you would be able to tell if you knew what I knew. The office in Malta doesn't mean it's a Maltese business.

What is a racist? I'm concerned you may have offended me, but once you define what a racist is, then I will know whether or not I am offended.

You are correct in saying:
Bitcoin is a global currency for everyone and, like the internet itself, does not care about race, flags or petty border disputes.",t3_mh4vyk,2021-03-31 23:08:03,2021-03-31
2615,gsx6oa0,t1_gswvh9a,"The regulators can be too often part of the problem.

They collaborated with the Hedgefunds to pull of the great Gamestop heist.

We need decentralised exchanges.",t3_mh4vyk,2021-03-31 23:04:20,2021-03-31
2616,gsxi3by,t1_gsxhuqx,I definitely donâ€™t buy there but even people who do are likely to see more than 8% appreciation if they hold for any decent period of time.,t3_mh4vyk,2021-04-01 00:30:27,2021-04-01
2617,gsxvaum,t1_gsxv6df,"got it... I remember I saw a movie describing how one company moved really close to a trading office so they can have this HFT faster than ever
some hidden under-buildings cables shit",t3_mh4vyk,2021-04-01 02:09:24,2021-04-01
2618,gsz4azj,t1_gsysru4,[removed],t3_mh4vyk,2021-04-01 08:13:54,2021-04-01
2619,gsy41kg,t1_gsy38yo,[removed],t3_mh4vyk,2021-04-01 03:16:15,2021-04-01
