,comment_id,comment_parent_id,comment_body,comment_link_id,created,date
1231,gtcbf30,t3_mjlr6h,"My in laws panic sold at the bottom a few years ago.   MIL was checking the price about 15 times a day for months, no joke.  Sold everything during the $3500 crash. 

Then in 2020 FIL pushed to buy more, but left the decision to MIL.  MIL then planned to buy on a day it was $6000.  Buy the time the money was ready to go that day the price had ""spiked"" to $6300 so she didn't buy because she ""missed the boat.""  They still own none.

Lessons.",t3_mjlr6h,2021-04-04 20:37:50,2021-04-04
1232,gtcbof2,t3_mjlr6h,I see this bull run ending soon and so pulled out what I had in Litecoin to buy when the price drops.  It has completely neutralized the way I feel every time I look at my wallet.  Price goes up? Good! price goes down? Good!,t3_mjlr6h,2021-04-04 20:41:04,2021-04-04
1233,gtcdbsn,t3_mjlr6h,"To be fair, it's easy for those who have the brunt of their investment in pre 20k to ""ignore the price"" when it bounces around 40-60k. Much harder for those newer to th game or those with bigger buys recently.

My point is if we want BTC to continue appreciating we really should root for stability and steady growth to attract more and more new interest into it. There are only so many people willing to ""take the ride"" and that could potentially limit BTC'S upside if it doesn't stabilize. That said, most of us should get too butt hurt 60 to 57k.",t3_mjlr6h,2021-04-04 21:00:41,2021-04-04
1234,gtcdj2r,t3_mjlr6h,"I love roller coasters, Bitcoin s is the best ride!",t3_mjlr6h,2021-04-04 21:03:01,2021-04-04
1235,gtck2nz,t3_mjlr6h,I was like that from Jan 2018 all the way until my portfolio went 8X. Now I care.,t3_mjlr6h,2021-04-04 22:13:21,2021-04-04
1236,gtcmd3g,t3_mjlr6h,Yeah I'm not numb to price I just have a written plan for taking profit. Therefore I couldn't care less about the price until the plan tells me I do.,t3_mjlr6h,2021-04-04 22:35:00,2021-04-04
1237,gtcog16,t3_mjlr6h,You're saying this because it's on a steady uptrend. Your butthole will be tight when this bullrun is over.,t3_mjlr6h,2021-04-04 22:53:59,2021-04-04
1243,gtbdqrm,t3_mjlr6h,"On the contrary, when btc dips it takes all the alt coins with it, giving us daytraders sitewide discounts. I fucking love when BTC tanks.",t3_mjlr6h,2021-04-04 12:07:13,2021-04-04
1244,gtbfk29,t3_mjlr6h,"I look at it and then look at all the crap I've spent for my hobbies. I then compare how much I've spent on them and crypto. It's not much but I see I have still spent way more on my hobbies. Stuff I haven't been using and collecting dust. Some have increased in value some have depreciated. I'd just keep them than sell at a loss. At this point,  some of the more known cryptocurrencies are getting accepted by mainstream institutions. So I equate my money spent on crypto to spending for my hobbies that has a better chance of increasing in value if I do my job investing in the right cryptocurrency.",t3_mjlr6h,2021-04-04 12:28:57,2021-04-04
1245,gtb2w0k,t3_mjlr6h,What is butcoin?,t3_mjlr6h,2021-04-04 10:12:05,2021-04-04
1246,gtbkw2j,t3_mjlr6h,#SAFEMOON 🚀🚀🚀,t3_mjlr6h,2021-04-04 13:39:38,2021-04-04
1247,gtb22m6,t3_mjlr6h,lol easy to say now that it's stabilizing,t3_mjlr6h,2021-04-04 10:03:42,2021-04-04
1248,gtbcj0j,t3_mjlr6h,"I just know now that when I buy, the price will drop. I feel stupid, but then it goes back up and ...whatever!",t3_mjlr6h,2021-04-04 11:53:07,2021-04-04
1249,gtbhghv,t3_mjlr6h,Pretty easy to be “numb” when we’re a year deep into a bull market. This is the easy part.,t3_mjlr6h,2021-04-04 12:53:00,2021-04-04
1250,gtbs1vr,t3_mjlr6h,"Same, trying my hand in penny stocks made me the same way. I’ve seen big gains and big losses. It’s all about the long game.",t3_mjlr6h,2021-04-04 15:29:59,2021-04-04
1251,gtawwwh,t3_mjlr6h,"Coinbase used to be great to allow buying and selling at predetermined prices, even on the free version. Then they got rid of it entirely which is bs.",t3_mjlr6h,2021-04-04 09:11:59,2021-04-04
1252,gtbe9vd,t3_mjlr6h,"Or maybe you didn't change, your average buy in price is now comfortably low. Most of these posts are basically a humble-brag about how long you've been in crypto. 

""DIAMOND HANDS BRUZ"" says the guy that bought his Btc when it was $5000 or much lower.",t3_mjlr6h,2021-04-04 12:13:32,2021-04-04
1253,gtcbpd2,t3_mjlr6h,"
HELP!!! COINBASE WANTS TO CLOSE ACCOUNT. ALL MY FUNDS ARE STILL IN THERE!!!!!!!!!!!! HELP!!!!!!!!Today I received ‘notice of account closure’ when I try to proceed with the instructions I’m unable to do so as it says can’t send bitcoin contact support ! Case #04919267",t3_mjlr6h,2021-04-04 20:41:24,2021-04-04
1254,gtbmc3y,t3_mjlr6h,Noticing the incorrect usage of *you're* and *your* already consumes my life.,t3_mjlr6h,2021-04-04 14:00:37,2021-04-04
1255,gtbxq9x,t3_mjlr6h,"I hope it drops to 25,000",t3_mjlr6h,2021-04-04 17:05:41,2021-04-04
1256,gtb34jk,t3_mjlr6h,"I still need to buy .21 to hit my BTC holdings target, so while I love the ATH action, I'd also appreciate a few more organic dips to hit.",t3_mjlr6h,2021-04-04 10:14:30,2021-04-04
1257,gtb3zxq,t3_mjlr6h,"I sold off too many bitcoin miners and have the remorse lol always hodl, but I too could use a 2 day 60%er",t3_mjlr6h,2021-04-04 10:23:20,2021-04-04
1258,gtb83o5,t3_mjlr6h,Yeh I agree but when you’re trying to swing trade to get more fiat to get more btc it makes sense.  We just have a a bunch of inexperienced traders doing what they feel is the right thing.  Ultimately the markets will reach their lessons one way or another.,t3_mjlr6h,2021-04-04 11:05:30,2021-04-04
1259,gtbi4zf,t3_mjlr6h,I'm complexly inoculated against dumps I couldn't care less but price pumps make me super nervous. All the sudden my my well thought out backup and security procedures seem deficient. Any one else?,t3_mjlr6h,2021-04-04 13:01:55,2021-04-04
1260,gtbjh9q,t3_mjlr6h,Try real gambling for a day and you learn to appreciate crypto for what it truely is,t3_mjlr6h,2021-04-04 13:20:02,2021-04-04
1261,gtbjl08,t3_mjlr6h,How did you become numb... cocaine?,t3_mjlr6h,2021-04-04 13:21:26,2021-04-04
1262,gtbpf8p,t3_mjlr6h,Would you guys keep all your portfolio in Bitcoin?! I have about 90% Bitcoin and 3-4% on some other random ones.,t3_mjlr6h,2021-04-04 14:47:34,2021-04-04
1263,gtbt2pb,t3_mjlr6h,What if you don't have enough to buy more? Should you try to sell before the big correction comes in then buy again once it falls (even if just try to approximate)?,t3_mjlr6h,2021-04-04 15:46:47,2021-04-04
1264,gtbteyg,t3_mjlr6h,"Which coin is good buy, as I am new to this . Please suggest",t3_mjlr6h,2021-04-04 15:52:26,2021-04-04
1265,gtbuf2e,t3_mjlr6h,"If you ever want to diversify into stocks, look into value investing. It is the same attitude. You decide something is over 2x undervalued based on math, so you buy and if price falls you buy more.",t3_mjlr6h,2021-04-04 16:09:24,2021-04-04
1266,gtbv9qg,t3_mjlr6h,"This is true when it comes to long-term investing in general. I started investing in Bitcoin early 2016. Summer 2017 was exciting but it ended the year on a rollercoaster. 2017 was rough because the dip after new year is painful. Even if I did sell after the dip, I still made a lot of money. But I didn’t. Investing is long-term afterall.  There’s no hurry to get rich. I tend not to respond to my impulse until I do my homework, whether it’s for a buy or a sale. I also don’t plan my life according to how much I’ve gained so far. I think long-term investing is a lot more enjoyable when people don’t really need the money they invested.",t3_mjlr6h,2021-04-04 16:23:54,2021-04-04
1267,gtbvimu,t3_mjlr6h,I got 30 yrs left mofo this shit hit 200k. Construction worker finally worthy with smartness  watch.,t3_mjlr6h,2021-04-04 16:28:11,2021-04-04
1268,gtbxt9j,t3_mjlr6h,Then you should look into gamestop hehe,t3_mjlr6h,2021-04-04 17:07:10,2021-04-04
1269,gtbyt2s,t3_mjlr6h,"you could buy for 50 usd per week, like a savings-plan. so you get more bitcoin when it drops.",t3_mjlr6h,2021-04-04 17:24:33,2021-04-04
1270,gtbz493,t3_mjlr6h,Same here. Started trading alts but no sell button for BTC. However as per my experience things are never so simple and straight forward. There will come a time when all of our resolve will be tested to the core and it's winning in those moments that matters the most.,t3_mjlr6h,2021-04-04 17:30:01,2021-04-04
1271,gtbz96s,t3_mjlr6h,"Technically, there could be 90% value write off.",t3_mjlr6h,2021-04-04 17:32:25,2021-04-04
1272,gtbzaud,t3_mjlr6h,"When it's down, you don't need to worry, no one's in a hurry... my momma told me there'd be days like this",t3_mjlr6h,2021-04-04 17:33:11,2021-04-04
1273,gtbzhrk,t3_mjlr6h,Super,t3_mjlr6h,2021-04-04 17:36:25,2021-04-04
1274,gtbzzcq,t3_mjlr6h,I already invested in crypto too much to just ignore it price,t3_mjlr6h,2021-04-04 17:45:04,2021-04-04
1275,gtc07kj,t3_mjlr6h,"This will be studied years from now as a new type of cult, lmao.",t3_mjlr6h,2021-04-04 17:48:51,2021-04-04
1276,gtc19h0,t3_mjlr6h,Cognitive and perceptive skills: seaweed level,t3_mjlr6h,2021-04-04 18:06:45,2021-04-04
1277,gtc1jo4,t3_mjlr6h,"I’m numb too, because the only way I can lose is if it drops to zero.",t3_mjlr6h,2021-04-04 18:11:35,2021-04-04
1278,gtc3is2,t3_mjlr6h,"Honestly, until I have hit my personal BTC accumulation targets I am very happy for it to tread water, or even dip.

For me it was always a long time proposition, so I have to laugh about these people freaking out at not breaching 60k, or 2 percent drops. I can only conclude that...

A) they bought in late, and it is their first time investing in anything

Or B) they are playing with options, shorts, futures, which is a very dangerous game and everyone has to learn sometime.",t3_mjlr6h,2021-04-04 18:44:14,2021-04-04
1279,gtc3tiy,t3_mjlr6h,Since I don’t invest I won’t lose sleep over it. I mine and sell at peaks.  Yes people like me cause BTC to become a bear market.  But so far most profitable.  Once I have enough to oh my debts and ROI on equipment I will hodl some.,t3_mjlr6h,2021-04-04 18:49:03,2021-04-04
1280,gtc48ja,t3_mjlr6h,same,t3_mjlr6h,2021-04-04 18:55:50,2021-04-04
1281,gtc5ex6,t3_mjlr6h,Yeah tbh I'm like this with btc as well and eth I've been investing a lot in to,t3_mjlr6h,2021-04-04 19:14:39,2021-04-04
1282,gtc5ofp,t3_mjlr6h,https://youtu.be/kXYiU_JCYtU,t3_mjlr6h,2021-04-04 19:18:43,2021-04-04
1283,gtc6p8o,t3_mjlr6h,"Try margin trading at 85% and 100x leverage.  See if that does it for you.

But dont really.",t3_mjlr6h,2021-04-04 19:33:52,2021-04-04
1284,gtc6uhh,t3_mjlr6h,It's easy to feel this way when you're so far in the green and the future is looking bright.,t3_mjlr6h,2021-04-04 19:36:02,2021-04-04
1285,gtc74je,t3_mjlr6h,Agreed. People need to stop putting money you need in. Use money you don’t,t3_mjlr6h,2021-04-04 19:40:03,2021-04-04
1286,gtc99tw,t3_mjlr6h,"Make your decision, set your LIMIT,  go to sleep",t3_mjlr6h,2021-04-04 20:10:11,2021-04-04
1287,gtcab6p,t3_mjlr6h,When Bitcoin is your denominator everything else just gets cheaper by the year.,t3_mjlr6h,2021-04-04 20:23:54,2021-04-04
1288,gtcasco,t3_mjlr6h,"Recent serious dips have been a little sad for me.  
I didn't have the resources to BUY MORE.",t3_mjlr6h,2021-04-04 20:29:59,2021-04-04
1289,gtcaz3e,t3_mjlr6h,The POC - power of conviction.,t3_mjlr6h,2021-04-04 20:32:19,2021-04-04
1290,gtcd4ug,t3_mjlr6h,Too bad I can't buy anything. Indian govt banned it.,t3_mjlr6h,2021-04-04 20:58:26,2021-04-04
1291,gtcf8dv,t3_mjlr6h,I first got in buying crypto 2 months ago and was down 10g before realizing I bought everything at the wrong prices.people invested in crypto years ago have a different  strategy cause they are always in the green due to the low prices they purchased a long time ago.but the new investors just getting in at bitcoin between  50 to 60g average you ain't gonna see brighter days for a while.,t3_mjlr6h,2021-04-04 21:21:57,2021-04-04
1292,gtcfnx3,t3_mjlr6h,When price dips I just think of it as BTC is on sale/discounted and buy more. Over the long run it’s only headed in one direction and that is up.,t3_mjlr6h,2021-04-04 21:26:40,2021-04-04
1293,gtchumy,t3_mjlr6h,"They say a negative, like -30%, psychologically stings 5x more than the same relative opposite, like a +30%. But after the numbness kicks in, it’s the opposite. And yes, I love it :)",t3_mjlr6h,2021-04-04 21:50:15,2021-04-04
1294,gtci2a0,t3_mjlr6h,"I've never paid attention to the price. I read a lot before my first cryptocurrency purchase and decided to go with the DCA strategy. I make 2 purchases daily - 1 AM and 1 PM. I purchase at the same times every day, regardless of price - don't even check, I just pull the trigger. Coincidentally, this method has yielded decent prices for that day.

I consider myself lucky. I get anxious reading so much of the anxiety and FOMO posts here on reddit. I'd stop altogether if I lived like some of these posts I read. Not to mention how some people are dumping funds that they don't have either consciously or because of FOMO.

It's a long-term play folks. Stop trying to time the market - you won't wind. Just be in the market and long term.",t3_mjlr6h,2021-04-04 21:52:57,2021-04-04
1295,gtcip0n,t3_mjlr6h,I just recently started buying with a monthly cadence and the fluctuations are still stressing me out a bit. It feels like there never is a good time to buy these days.,t3_mjlr6h,2021-04-04 21:59:38,2021-04-04
1296,gtcji30,t3_mjlr6h,"I kind of want it to drop 60%. I know it'll go back up double. And I can double my position
Maybe even achieve my goal of joining the 1.0 club!",t3_mjlr6h,2021-04-04 22:07:41,2021-04-04
1297,gtckdhu,t3_mjlr6h,"Go in with a plan and stick to it. I was too busy 'chasing' when I started, lost some cash that way. Now I buy all and hold. I check prices throughout the day, but I don't fret, it's too stressful. Holding for the long is a lot less stressful than chasing",t3_mjlr6h,2021-04-04 22:16:15,2021-04-04
1298,gtckxu0,t3_mjlr6h,"Gotta become unemotional about it, and that becomes really easy once youve been in the market for awhile and really understand the technology. All I see are buying opportunities now.",t3_mjlr6h,2021-04-04 22:21:37,2021-04-04
1299,gtcm74l,t3_mjlr6h,I wonder at what % gain the average person who is buying bitcoin as an investment stops worrying about these little swings.  Is it once you have had 100-200% gains and therefore useless there is a Bitcoin apocalypse your initial outlay is safe? I only began buying in Jan and after a few weeks of being shaken by the volatility I have settled  down into a monthly buying routine.  I still however check the price daily (to my own annoyance) despite accepting I’m doing this as a five year project (5 years at least hopefully).,t3_mjlr6h,2021-04-04 22:33:28,2021-04-04
1300,gtcn75r,t3_mjlr6h,Exactly. Price today means nothing. I just buy ... And buy more. I'll worry about the price in 2030.,t3_mjlr6h,2021-04-04 22:42:43,2021-04-04
1301,gtcna2z,t3_mjlr6h,https://piratecash.io/?pirate=1265848,t3_mjlr6h,2021-04-04 22:43:28,2021-04-04
1302,gtcnf7i,t3_mjlr6h,I denominate my wealth in btc. All my alt gainz go into btc. All my saving go into btc. I’m in my young 20’s. I’m trying to retire by 40 btc is the answer.,t3_mjlr6h,2021-04-04 22:44:46,2021-04-04
1303,gtcollr,t3_mjlr6h,"i'm kind of numb, but i do have an end goal.  if it hits $120k, I'm likely selling as we've all doubled our current investment.  that's good enough for me.  i want to buy a house and don't want to wait until i'm 80 to do that.  i'll probably always leave a *little* in BTC just in case it hits $1m or something, but my investment serves a specific purpose for me.",t3_mjlr6h,2021-04-04 22:55:24,2021-04-04
1304,gtcozdw,t3_mjlr6h,If a person had a collectible car that he was selling for $60k and two buyers approached you to purchase it. One offers a bank check for $60k and the other offers to transfer 1 bitcoin to his wallet. Which transaction would he choose?,t3_mjlr6h,2021-04-04 22:58:50,2021-04-04
1319,gtazn5m,t3_mjlr6h,[removed],t3_mjlr6h,2021-04-04 09:39:26,2021-04-04
1320,gtbavw3,t3_mjlr6h,Yeah what if it drops to zero,t3_mjlr6h,2021-04-04 11:34:36,2021-04-04
1321,gtces5l,t3_mjlr6h,"I cashed out all of it last night,freed up 25g ready to dive back in whenever dips are worth it,you loose your prophet like it never existed watching the fluctuations.most the the time you cash out shit hits the same low again or lower than buy back in.you make more money that way. Now my coinbase account never gets sold that sits forever.now on robinhood I gamble",t3_mjlr6h,2021-04-04 21:16:59,2021-04-04
1322,gtbovhp,t3_mjlr6h,"Wonderful. Easy to do if you started accumulating at sub $20k. Harder if you first came in at $60k.
All well and good to act like a wise battle hardened investor, but you have to walk though the fire yourself.",t3_mjlr6h,2021-04-04 14:39:04,2021-04-04
1323,gtb25sg,t3_mjlr6h,"This is the way...!

[https://www.youtube.com/watch?v=dBVlnpdtAhM](https://www.youtube.com/watch?v=dBVlnpdtAhM)",t3_mjlr6h,2021-04-04 10:04:34,2021-04-04
1324,gtbw779,t3_mjlr6h,Its only dropped 2k. Its literally sitting at where its been averaging for nearly two months. It surges and retracts. Imo I dont think there will be anymore huge 30-60% dips. Way to many high profile billionaires and corporations have put their hats in the game. Only if they started backing out then will things really start to tumble.,t3_mjlr6h,2021-04-04 16:39:35,2021-04-04
1325,gtbxjer,t3_mjlr6h,That sucks,t3_mjlr6h,2021-04-04 17:02:26,2021-04-04
1326,gtcg2dc,t3_mjlr6h,"Easy to say when the price has been rising for months on end. Lets see that discipline if it drops 80%. If you’re not trembling then, that’s when you’re numb.",t3_mjlr6h,2021-04-04 21:31:02,2021-04-04
1327,gtcj8nv,t3_mjlr6h,"You know, you could just not buy Bitcoin and you won’t have anxiety about loosing money. I mean, I personally do own some Bitcoin but not as a store of value or an investment.",t3_mjlr6h,2021-04-04 22:05:07,2021-04-04
1329,gtbwcjo,t1_gtb8pp3,[removed],t3_mjlr6h,2021-04-04 16:42:09,2021-04-04
1330,gtcier5,t1_gtb8pp3,Didn't Tesla buy in at like $50k? There's not really been a dip since then?,t3_mjlr6h,2021-04-04 21:56:43,2021-04-04
1331,gtbot25,t1_gtb8pp3,"My thoughts exactly.
Before Tesla bought I was always just a bystander, now I believe wholeheartedly this is here to stay.",t3_mjlr6h,2021-04-04 14:38:00,2021-04-04
1336,gtb5kdr,t1_gtawzzy,Took me a couple years to reach this mindset. All about risk management IMO,t3_mjlr6h,2021-04-04 10:39:28,2021-04-04
1337,gtb111b,t1_gtawzzy,"Ye, i'm actually looking foward for that 60% drop op mentions",t3_mjlr6h,2021-04-04 09:53:10,2021-04-04
1338,gtbocup,t1_gtawzzy,Bitcoin fluctuations don't matter when you count the depreciation of fiat system. https://storeoftime.com,t3_mjlr6h,2021-04-04 14:31:06,2021-04-04
1339,gtbb4m0,t1_gtawzzy,"Learning curve is a great way to put it. It's like literally everything else: the more experience you have, the more composed you naturally are.",t3_mjlr6h,2021-04-04 11:37:16,2021-04-04
1340,gtbp17m,t1_gtawzzy,It is a learning curve. Im BTC class of 2020. Only in the last month have I stopped looking every hour.,t3_mjlr6h,2021-04-04 14:41:32,2021-04-04
1341,gtbuupd,t1_gtawzzy,"He probably also bought below 1k, by now he’s made so much, the mentality would be screw it, it is what it is😭",t3_mjlr6h,2021-04-04 16:16:52,2021-04-04
1342,gtc11xs,t1_gtawzzy,I think Numb is correct. Im actually the same. after a while u get numb. and playing with bigger number will be so easy for u,t3_mjlr6h,2021-04-04 18:03:13,2021-04-04
1343,gtbo6p1,t1_gtawzzy,"This is also how I think about it. I prefer to think about ""worth"" rather than price where ""worth"" of bitcoin to me has more to do with all of its potential applicability and how it can be utilized, including non-monetary aspects as well that are transformative in nature for society. Its worth to me has nothing to do with price anymore.",t3_mjlr6h,2021-04-04 14:28:24,2021-04-04
1344,gtbsdew,t1_gtawzzy,Agree,t3_mjlr6h,2021-04-04 15:35:10,2021-04-04
1345,gtcaon6,t1_gtawzzy,"Thanks to these reddit channels, I developed this mindset in a couple of months when I got into crypto space",t3_mjlr6h,2021-04-04 20:28:40,2021-04-04
1347,gtbin4f,t1_gtb1o6r,The lessons,t3_mjlr6h,2021-04-04 13:08:35,2021-04-04
1348,gtboctt,t1_gtb1o6r,"""There is no pain; you are receding""",t3_mjlr6h,2021-04-04 14:31:05,2021-04-04
1349,gtbvlg0,t1_gtb1o6r,"When I was a child, I had a fever",t3_mjlr6h,2021-04-04 16:29:30,2021-04-04
1350,gtb9twr,t1_gtb1o6r,Underrated comment.,t3_mjlr6h,2021-04-04 11:23:13,2021-04-04
1351,gtbql0r,t1_gtb1o6r,Spoken like a true holder,t3_mjlr6h,2021-04-04 15:05:55,2021-04-04
1352,gtcdn5m,t1_gtb1o6r,🎶*I’ve become so numb*🎶,t3_mjlr6h,2021-04-04 21:04:17,2021-04-04
1357,gtb4p53,t1_gtb2oym,"I second this, although I'm just running my lone rig.",t3_mjlr6h,2021-04-04 10:30:34,2021-04-04
1358,gtb2xg7,t1_gtb2oym,How many computers you running?,t3_mjlr6h,2021-04-04 10:12:30,2021-04-04
1359,gtbgrth,t1_gtb2oym,"I used to mine on NiceHash on the work computer and then they got hacked. I wonder if it would be worth finding my login, possibly there is some sats there..",t3_mjlr6h,2021-04-04 12:44:14,2021-04-04
1360,gtbk3ip,t1_gtb2oym,This. I told a friend that I love the chaos when it moons or tanks because I'm numb to the price movement because it's exciting to watch and interesting see people freak out about it,t3_mjlr6h,2021-04-04 13:28:35,2021-04-04
1361,gtbxcj3,t1_gtb2oym,I'm just mining eth directly and trading to BTC,t3_mjlr6h,2021-04-04 16:59:09,2021-04-04
1362,gtbca4h,t1_gtb3c1u,The top half or the bottom half?,t3_mjlr6h,2021-04-04 11:50:14,2021-04-04
1363,gtbkjwa,t1_gtb3c1u,"It’s been a good year to do it, with the lockdowns and all. Crypto is the best thing that came out of the terrible situation.",t3_mjlr6h,2021-04-04 13:34:49,2021-04-04
1364,gtck8u3,t1_gtb3c1u,"Haha same. 

I became a slave to bitcoin",t3_mjlr6h,2021-04-04 22:15:01,2021-04-04
1365,gtbcbzu,t1_gtb0dzb,Just change your ebay password before you feed the GPU scalpers.,t3_mjlr6h,2021-04-04 11:50:50,2021-04-04
1366,gtcofzt,t1_gtb0dzb,"Drunk bitcoining gave us the HODL meme.  An epic moment in Bitcoin history!

https://bitcointalk.org/index.php?topic=375643.0",t3_mjlr6h,2021-04-04 22:53:59,2021-04-04
1368,gtbq2kn,t1_gtayg1f,This is the way.,t3_mjlr6h,2021-04-04 14:57:49,2021-04-04
1369,gtbj84a,t1_gtbaxjd,"I always sell on the highs and buy back the dips.  I have increased my holdings significantly doing this.  Of course my anxiety is through the roof on the daily but bitcoin is like people, predictable when it gets going.",t3_mjlr6h,2021-04-04 13:16:38,2021-04-04
1370,gtbrf3h,t1_gtbju2l,I was imagining you becoming the number 6,t3_mjlr6h,2021-04-04 15:19:28,2021-04-04
1371,gtco41x,t1_gtbju2l,Refreshing blockfolio is the best game I have in my phone. You make arbitrary goals for your portfolio and get a bit of dopamine when it hits. Then the price goes down and stabilizes and you forget about it for a while.,t3_mjlr6h,2021-04-04 22:51:02,2021-04-04
1373,gtbjglz,t1_gtb8mpg,You mean ‘cause it didn’t scare you?,t3_mjlr6h,2021-04-04 13:19:48,2021-04-04
1374,gtbzswi,t1_gtbs485,Wiser words have never been spoken,t3_mjlr6h,2021-04-04 17:41:53,2021-04-04
1375,gtbzt4t,t1_gtbs485,Wiser words have never been spoken,t3_mjlr6h,2021-04-04 17:41:59,2021-04-04
1376,gtb8d33,t1_gtb8cb3,ɴᴏᴡ ᴘʟᴀʏɪɴɢ: [Numb (Official Video) - Link](https://www.youtube.com/watch?v=kXYiU_JCYtU) ─────────⚪───── ◄◄⠀[▶](https://www.youtube.com/watch?v=kXYiU_JCYtU)⠀►►⠀ 2:04 / 3:07 ⠀ ───○ 🔊 ᴴᴰ ⚙️,t3_mjlr6h,2021-04-04 11:08:14,2021-04-04
1377,gtb8d01,t1_gtb8cb3,"Now playing: [Numb [Official Music Video] - Linkin Park](https://youtube.com/watch?v=kXYiU_JCYtU).

^^[&nbsp;stop&nbsp;messaging&nbsp;me](https://reddit.com/message/compose/?to=AlexaPlayBot&subject=Blacklist+me&message=!blacklist)&nbsp;|&nbsp;[programmer](https://reddit.com/message/compose/?to=bspammer)&nbsp;|&nbsp;[source](https://gist.github.com/bspammer/97f1dc8c676ca93af9289a77a0d4e93a)&nbsp;|&nbsp;[banlist](https://reddit.com/r/AlexaPlayBot/comments/92euyo/subs_the_bot_has_been_banned_from/)",t3_mjlr6h,2021-04-04 11:08:13,2021-04-04
1378,gtbqwam,t1_gtbfj1g,What exchanges allow limit buys? I am new abd trying to buy next week. Should I DCA or just buy and be done with it?,t3_mjlr6h,2021-04-04 15:11:01,2021-04-04
1379,gtbbpty,t1_gtbaifs,damn bro,t3_mjlr6h,2021-04-04 11:43:48,2021-04-04
1380,gtbp1p4,t1_gtbjmu8,"Nah, as soon as all institutions including countries are in, then it's behind you.",t3_mjlr6h,2021-04-04 14:41:46,2021-04-04
1381,gtbqsrh,t1_gtbq2ha,☝️This guy lifes,t3_mjlr6h,2021-04-04 15:09:24,2021-04-04
1382,gtc0swn,t1_gtc0fdc,"I said never sell.  But I don't really mean that.  If you need to sell for personal reasons - down payment for a house, need a cheap car, paying for surgery etc. - then fine.  But don't sell unless you have to.",t3_mjlr6h,2021-04-04 17:59:00,2021-04-04
1383,gtbk3cp,t1_gtbfk29,I’m very sure you said it all !!,t3_mjlr6h,2021-04-04 13:28:31,2021-04-04
1384,gtax8d5,t1_gtawwwh,You can still do that on coinbase pro,t3_mjlr6h,2021-04-04 09:15:14,2021-04-04
1385,gtax28g,t1_gtawwwh,I can place limit orders of 0.0001 BTC,t3_mjlr6h,2021-04-04 09:13:30,2021-04-04
1386,gtazxmy,t1_gtawwwh,Try coinbase pro. It’s free and has the functionality you mentioned,t3_mjlr6h,2021-04-04 09:42:20,2021-04-04
1387,gtbjadq,t1_gtawwwh,Yeah limit buying and selling is the only way on Coinbase pro,t3_mjlr6h,2021-04-04 13:17:29,2021-04-04
1388,gtceu37,t1_gtcd4ug,Didnt Supreme Court overturn that?  Also is it just bitcoin or all cryptos?,t3_mjlr6h,2021-04-04 21:17:34,2021-04-04
1390,gtazuk9,t1_gtazn5m,Yes. Hand it over to someone who cares.,t3_mjlr6h,2021-04-04 09:41:28,2021-04-04
