,comment_id,comment_parent_id,comment_body,comment_link_id,created,date
1566,gu0e2fu,t3_mnwgej,"You really made me laugh...

Hope your will be lucky, dunno with all people holding it.",t3_mnwgej,2021-04-10 12:06:12,2021-04-10
1567,gu0g2sq,t3_mnwgej,"But, I just bought more, and I am a primary target for old Bogdanoff.",t3_mnwgej,2021-04-10 12:28:49,2021-04-10
1568,gu0ik2v,t3_mnwgej,"I thought I was reading a Gme post, works either way I guess😂👌🚀🚀🚀🚀🚀🚀",t3_mnwgej,2021-04-10 12:58:47,2021-04-10
1569,gu0l27w,t3_mnwgej,I just sold a little bit a few days ago so I’m on the exact same page LOL,t3_mnwgej,2021-04-10 13:31:08,2021-04-10
1570,gu0m15h,t3_mnwgej,You are the man,t3_mnwgej,2021-04-10 13:44:08,2021-04-10
1571,gu0m3sc,t3_mnwgej,61k: womp womp,t3_mnwgej,2021-04-10 13:45:09,2021-04-10
1572,gu0mn7x,t3_mnwgej,It’s already started. Get this man a crystal ball...STAT!,t3_mnwgej,2021-04-10 13:52:38,2021-04-10
1573,gu0nbpi,t3_mnwgej,\+5% thanks for sacrifice,t3_mnwgej,2021-04-10 14:02:11,2021-04-10
1574,gu0ngwq,t3_mnwgej,"Wow, I don't mean to rub it in, but it's starting to happen now...",t3_mnwgej,2021-04-10 14:04:14,2021-04-10
1575,gu0o4zy,t3_mnwgej,Called it. Thanks man,t3_mnwgej,2021-04-10 14:13:43,2021-04-10
1576,gu0o6xz,t3_mnwgej,ARE YOU A WIZARD?,t3_mnwgej,2021-04-10 14:14:29,2021-04-10
1577,gu0pp6m,t3_mnwgej,Me too buddy,t3_mnwgej,2021-04-10 14:36:32,2021-04-10
1578,gu0ravi,t3_mnwgej,Such a unique joke. Never heard before.,t3_mnwgej,2021-04-10 15:01:03,2021-04-10
1579,gu0s76l,t3_mnwgej,Give us the lottery numbers,t3_mnwgej,2021-04-10 15:15:16,2021-04-10
1580,gu0sfmk,t3_mnwgej,Teach us your ways 🖖🏼,t3_mnwgej,2021-04-10 15:19:02,2021-04-10
1581,gu0t7v6,t3_mnwgej,He is the one,t3_mnwgej,2021-04-10 15:31:31,2021-04-10
1582,gu0u4a0,t3_mnwgej,This is the way 🚀🚀,t3_mnwgej,2021-04-10 15:46:18,2021-04-10
1583,gu0ujpe,t3_mnwgej,"Well, you did it.",t3_mnwgej,2021-04-10 15:53:24,2021-04-10
1584,gu0uyvu,t3_mnwgej,But it will tank afterwards :)).,t3_mnwgej,2021-04-10 16:00:24,2021-04-10
1585,gu0virn,t3_mnwgej,Same situation.   Ahhhhh,t3_mnwgej,2021-04-10 16:09:37,2021-04-10
1586,gu0y1ik,t3_mnwgej,please more tips,t3_mnwgej,2021-04-10 16:52:03,2021-04-10
1587,gu0yvs3,t3_mnwgej,It’s working…..,t3_mnwgej,2021-04-10 17:06:22,2021-04-10
1588,gu0ywrl,t3_mnwgej,You sir are doing God's work,t3_mnwgej,2021-04-10 17:06:50,2021-04-10
1589,gu0z0cf,t3_mnwgej,Hahaha this made my day,t3_mnwgej,2021-04-10 17:08:33,2021-04-10
1590,gu0z3l3,t3_mnwgej,Thank you for your service 🙏,t3_mnwgej,2021-04-10 17:10:08,2021-04-10
1591,gu112aj,t3_mnwgej,This post will age good. Thanks for your service.,t3_mnwgej,2021-04-10 17:44:47,2021-04-10
1592,gu11c4b,t3_mnwgej,"Thank you for your service. I also have this ability, and will get you on the next one.",t3_mnwgej,2021-04-10 17:49:38,2021-04-10
1593,gu14gqh,t3_mnwgej,Dude..What the actual fuck ahahah,t3_mnwgej,2021-04-10 18:43:05,2021-04-10
1594,gu152sk,t3_mnwgej,This is a legit buy signal.   Every time.  I feel your pain man.,t3_mnwgej,2021-04-10 18:53:04,2021-04-10
1595,gu164hx,t3_mnwgej,This guy.... 👆🏼 god damn prophet!! Preach it bother!! 😆😆,t3_mnwgej,2021-04-10 19:09:36,2021-04-10
1596,gu16jf8,t3_mnwgej,Can confirm. Im exactly in the same situation.,t3_mnwgej,2021-04-10 19:16:01,2021-04-10
1597,gu1as85,t3_mnwgej,"Well don't worry, I was thinking about buying about 4k of btc so you might want to wait till after I do that so you can buy when it dips down 15% seconds after I buy.",t3_mnwgej,2021-04-10 20:14:31,2021-04-10
1598,gu1cz2r,t3_mnwgej,Sick prediction bro,t3_mnwgej,2021-04-10 20:40:34,2021-04-10
1599,gu1dqqm,t3_mnwgej,Do you work for marketwatch?,t3_mnwgej,2021-04-10 20:49:27,2021-04-10
1600,gu1fg5h,t3_mnwgej,<spongebob voice> 1 hour later,t3_mnwgej,2021-04-10 21:08:22,2021-04-10
1601,gu1gfum,t3_mnwgej,"You are safe, because I need to exit some short term $RIOT calls this week and so Bitcoin is all but guaranteed to be shit by 9:30 EST Monday morning and stay that way until 4:00pm EST on Friday ;)",t3_mnwgej,2021-04-10 21:19:08,2021-04-10
1602,gu1mwyc,t3_mnwgej,thank you for the pump. another please! :-),t3_mnwgej,2021-04-10 22:22:43,2021-04-10
1603,gu1o4az,t3_mnwgej,Tell when you get paid next time too!,t3_mnwgej,2021-04-10 22:33:47,2021-04-10
1604,gu1pelr,t3_mnwgej,"I mean, if you can do this on a regular basis, feel free.",t3_mnwgej,2021-04-10 22:45:04,2021-04-10
1605,gu1pjtf,t3_mnwgej,HAHAHAHAA omg... This is hilarious but so true. It's okay OP it happens to me too.,t3_mnwgej,2021-04-10 22:46:19,2021-04-10
1606,gu1r93q,t3_mnwgej,Same brother I’m expecting money this week and would u look at that it fucking going up soon as We buy in here comes the dip,t3_mnwgej,2021-04-10 23:00:34,2021-04-10
1607,gu1r9ua,t3_mnwgej,"Don't worry, it goes up, it goes down, it goes sideways. You can't time the market, just jump in and be patient.",t3_mnwgej,2021-04-10 23:00:45,2021-04-10
1613,gu090j7,t3_mnwgej,"Im hoping it will dip %50 this weekend, so I can buy the shit like it was going out of style.",t3_mnwgej,2021-04-10 11:12:48,2021-04-10
1614,gu0jpkb,t3_mnwgej,"I have completely changed the way Im living thanks to btc. Conversation with mum:
Me: I dont feel conmortable anymoreif if I dont have 100 in my account 
Mum: 100 quid is always handy to have
Me: 100 thousand mum",t3_mnwgej,2021-04-10 13:13:27,2021-04-10
1615,gu0iyau,t3_mnwgej,I'm predicting anywhere from a 100k to 400k by the end of this year,t3_mnwgej,2021-04-10 13:03:47,2021-04-10
1616,gu0nie2,t3_mnwgej,These posts are always so funny and they’re always so exactly the same it’s so hilarious and creative and original I love it,t3_mnwgej,2021-04-10 14:04:50,2021-04-10
1617,gu0rp4h,t3_mnwgej,"Whenever I hear farmers on the news complain that there's a drought, I go wash my car. You're welcome, farmers.",t3_mnwgej,2021-04-10 15:07:11,2021-04-10
1619,gu0b94u,t3_mnwgej,[deleted],t3_mnwgej,2021-04-10 11:35:26,2021-04-10
1620,gu0dooq,t3_mnwgej,Then buy on margin already and with the money you receive later you close the margin.,t3_mnwgej,2021-04-10 12:01:57,2021-04-10
1621,gu0e6q3,t3_mnwgej,Definitely,t3_mnwgej,2021-04-10 12:07:31,2021-04-10
1622,gu0g35o,t3_mnwgej,Yikes,t3_mnwgej,2021-04-10 12:28:55,2021-04-10
1623,gu0hnj4,t3_mnwgej,I feel like bitcoin is linked to social security distributions in South america but I havent found anything to back it up. I havrnt read enough to see if south American counties are getting unemployment or corona stimulus but I see these bumps all occuring near the 2nd weekend of the month.,t3_mnwgej,2021-04-10 12:47:32,2021-04-10
1624,gu0j4ib,t3_mnwgej,"Dude, don't buy yet, give it a little more time to moon!",t3_mnwgej,2021-04-10 13:05:56,2021-04-10
1625,gu0kymz,t3_mnwgej,so it's a gut feeling. good luck.,t3_mnwgej,2021-04-10 13:29:48,2021-04-10
1626,gu0ljyg,t3_mnwgej,he's getting money wired to the exchange. pump it before he can buy,t3_mnwgej,2021-04-10 13:37:42,2021-04-10
1627,gu0mkfb,t3_mnwgej,"Too late. You missed it. Already have ignition, and lift off",t3_mnwgej,2021-04-10 13:51:35,2021-04-10
1628,gu0my2o,t3_mnwgej,Hilarious,t3_mnwgej,2021-04-10 13:56:54,2021-04-10
1629,gu0nu0f,t3_mnwgej,And than tank,t3_mnwgej,2021-04-10 14:09:22,2021-04-10
1630,gu0ogax,t3_mnwgej,Thank you for letting the corn know you want to buy.,t3_mnwgej,2021-04-10 14:18:10,2021-04-10
1631,gu0ph9a,t3_mnwgej,"Sounds Good,",t3_mnwgej,2021-04-10 14:33:15,2021-04-10
1632,gu0qcad,t3_mnwgej,"cursed reddit post, upvote and award for 1 hour of good luck.",t3_mnwgej,2021-04-10 14:46:16,2021-04-10
1633,gu0qdos,t3_mnwgej,Just 1 hour.,t3_mnwgej,2021-04-10 14:46:53,2021-04-10
1634,gu0qubs,t3_mnwgej,My man is cursed,t3_mnwgej,2021-04-10 14:53:55,2021-04-10
1635,gu0qwod,t3_mnwgej,Lmfao this is hilarious,t3_mnwgej,2021-04-10 14:54:56,2021-04-10
1636,gu0ryew,t3_mnwgej,"Hi everyone,
So I’m a beginner here - should I invest in Bitcoin right now? I am a recent grad w a decent job and I’ve been thinking about financial independence a lot and what I need to do to get there etc, so I’ve been thinking a lot about investing, which is how I got into crypto. My question is: how can I learn more about crypto? I’ve already watched a decent amount of videos.",t3_mnwgej,2021-04-10 15:11:16,2021-04-10
1637,gu0tdrx,t3_mnwgej,it's Friday night. I really feel for all the hookers and blow dealers missing out on income tonight.,t3_mnwgej,2021-04-10 15:34:15,2021-04-10
1638,gu0u0gl,t3_mnwgej,"After LBRY incident, everything can be fucked up...",t3_mnwgej,2021-04-10 15:44:32,2021-04-10
1639,gu0vkd8,t3_mnwgej,Keep doing this shit and you will be paid for predicting.,t3_mnwgej,2021-04-10 16:10:22,2021-04-10
1640,gu0yrvo,t3_mnwgej,Don't you know pump it up,t3_mnwgej,2021-04-10 17:04:32,2021-04-10
1641,gu104j0,t3_mnwgej,Coinbase IPO should push the price up still a bit for Wednesday's direct listing. How big the correction will be after?,t3_mnwgej,2021-04-10 17:28:05,2021-04-10
1642,gu10q3s,t3_mnwgej,We need more truthful posts like these!!!,t3_mnwgej,2021-04-10 17:38:42,2021-04-10
1643,gu11brx,t3_mnwgej,this guy fuqs,t3_mnwgej,2021-04-10 17:49:29,2021-04-10
1644,gu11j81,t3_mnwgej,It's about to reach a new ATH now anytime,t3_mnwgej,2021-04-10 17:53:00,2021-04-10
1645,gu11sp8,t3_mnwgej,You should have bought it before telling. People are pumping it for you now,t3_mnwgej,2021-04-10 17:57:39,2021-04-10
1646,gu12lq9,t3_mnwgej,BTC = Baby Trafficking Coin per Mike Pena,t3_mnwgej,2021-04-10 18:11:52,2021-04-10
1647,gu13gjp,t3_mnwgej,Was expecting this to be a genuine price prediction and almost took it as a bearish signal.,t3_mnwgej,2021-04-10 18:26:26,2021-04-10
1648,gu1548f,t3_mnwgej,A fellow chartist says he sees it hitting $69K by 4/20  :),t3_mnwgej,2021-04-10 18:53:44,2021-04-10
1649,gu1567i,t3_mnwgej,Wow nostradamus,t3_mnwgej,2021-04-10 18:54:38,2021-04-10
1650,gu15cyq,t3_mnwgej,It’s bc I took all those coins off the exchange last week,t3_mnwgej,2021-04-10 18:57:40,2021-04-10
1651,gu15y5e,t3_mnwgej,Rock solid DD!,t3_mnwgej,2021-04-10 19:06:52,2021-04-10
1652,gu16t4w,t3_mnwgej,How'd you know,t3_mnwgej,2021-04-10 19:20:10,2021-04-10
1653,gu18lhi,t3_mnwgej,Haha,t3_mnwgej,2021-04-10 19:45:46,2021-04-10
1654,gu1ajhj,t3_mnwgej,"I closed on my house yesterday and was anxiously waiting for the wire to go through yesterday afternoon. I was finally able to buy at $58,100, just in time for the pump up to $61,500. For those that don’t know find whalepump reborn for best crypto signals.",t3_mnwgej,2021-04-10 20:11:30,2021-04-10
1655,gu1lcyq,t3_mnwgej,"Luck? Nah, you should just invest in something else. Or stop it and leave your money alone on your bank.",t3_mnwgej,2021-04-10 22:08:12,2021-04-10
1664,gu0gp7g,t3_mnwgej,"Look, Coinbase IPO lends vadility to crypto!!! Get in now! Buy the rumors now! Coinbase IPO ON THURSDAY, buy it or stay poor!

&#x200B;

coinbase IPO will send this well above 60k! Holding since 2017 here in case you think I’m a newb",t3_mnwgej,2021-04-10 12:36:05,2021-04-10
1666,gu0h3i7,t1_gu0fcf1,Buy his trading class,t3_mnwgej,2021-04-10 12:40:44,2021-04-10
1667,gu0ita6,t1_gu0fcf1,This guy is our crystal ball quick protec him at all costs,t3_mnwgej,2021-04-10 13:02:01,2021-04-10
1668,gu0zioa,t1_gu0fcf1,"I remember a few years ago just after a boom, there was a guy making BTC Trading Class ads on YT. His first video was like ""Yo, look at me, see how I got 60 btc! Yeah! Buy my class and get rich like me!!""

2 months later the same guy had another ad that said ""Be like me! I got 45 btc! Get rich!

Never saw another ad from him.",t3_mnwgej,2021-04-10 17:17:35,2021-04-10
1669,gu0g4ep,t1_gu0fcf1,He did it,t3_mnwgej,2021-04-10 12:29:20,2021-04-10
1670,gu141os,t1_gu0fcf1,Shut up and take my money.,t3_mnwgej,2021-04-10 18:36:13,2021-04-10
1671,gu0omy6,t1_gu0fcf1,I’m following this guy for ever,t3_mnwgej,2021-04-10 14:20:50,2021-04-10
1672,gu0m6x3,t1_gu0fcf1,The payday spike!,t3_mnwgej,2021-04-10 13:46:22,2021-04-10
1674,gu0fwfd,t1_gu0fb7h,Literally just stared at the chart for 5 mins. Insane how much money is being poured in right now. Hit a pretty good sell wall at 60400.,t3_mnwgej,2021-04-10 12:26:47,2021-04-10
1675,gu0cerb,t1_gu06a6q,His name was u/patriceac.,t3_mnwgej,2021-04-10 11:47:51,2021-04-10
1676,gu0fhmm,t1_gu0ccl9,apparently this comment did it,t3_mnwgej,2021-04-10 12:22:10,2021-04-10
1677,gu0m146,t1_gu0ccl9,Dammit Bog! Why you gotta do this everytime!,t3_mnwgej,2021-04-10 13:44:07,2021-04-10
1678,gu10tz8,t1_gu0ccl9,"On your command, it has been pumped",t3_mnwgej,2021-04-10 17:40:37,2021-04-10
1679,gu0ievl,t1_gu0g7e1,"$60,772 as I type this. Is that the new record high?

Edit: $61,104!

Edit: $61,218!

Edit: $61,240!",t3_mnwgej,2021-04-10 12:56:58,2021-04-10
1680,gu0k9ai,t1_gu0aleo,Nah when you sell it goes to 100k,t3_mnwgej,2021-04-10 13:20:33,2021-04-10
1681,gu0jlpp,t1_gu0aleo,"it doesnt have to tank, it can just keep pumping.",t3_mnwgej,2021-04-10 13:12:04,2021-04-10
1682,gu0ird9,t1_gu0czff,It’s gonna dip *after* he buys some,t3_mnwgej,2021-04-10 13:01:20,2021-04-10
1683,gu0pwbo,t1_gu09dnw,"Don't worry about this, I think in the end it'll all work out just fine.",t3_mnwgej,2021-04-10 14:39:28,2021-04-10
1684,gu0guw7,t1_gu09dnw,it could add up to a lot over time...,t3_mnwgej,2021-04-10 12:37:53,2021-04-10
1685,gu0ucic,t1_gu0jq2s,"This guy gets it. I do this with smaller coins too. Start going down, ""F it, if it hits .45 cents or lower on this dip, I get to double up and go long. I'm gonna plan here... $500 for .45 cents, $500 for .40, and..."" 

Price goes to .82 cents, drops, and stays range bound well above .45. Happened to me with CVC. 

Even Stellar Lumens... range bound for months with a few big dips. I finally say, ""ok, do that again and I'm increasing all the way down""... pops to 59 cents, drops to a higher range bound again.

I swear, working with and even against my own intentions or having none at all and looking at it like it's the bark of a tree has worked wonders.",t3_mnwgej,2021-04-10 15:50:10,2021-04-10
1687,gu0jmy8,t1_gu0iyau,YEA BOYYYY,t3_mnwgej,2021-04-10 13:12:31,2021-04-10
1688,gu0uk01,t1_gu0iyau,"I've been setting aside money for some big dips, my chart days we can go back to $40k, so I have dry powd- HOLY MOLY, it's nearing a million a coin, ok, just have to adjust expec- AAAAAAND it's 2 million.

This is how it will go for me, so I expect you're more right than you know.",t3_mnwgej,2021-04-10 15:53:32,2021-04-10
1689,gu0fv25,t1_gu0b94u,I like this one. The one hour chart is nuts,t3_mnwgej,2021-04-10 12:26:20,2021-04-10
1691,gu0scww,t1_gu0ryew,"I'm not an expert, but IMO, there's no BEST time to invest, just buy an amount that you're willing to loose.",t3_mnwgej,2021-04-10 15:17:51,2021-04-10
1693,gu0m027,t1_gu0h3i7,And then do the opposite,t3_mnwgej,2021-04-10 13:43:42,2021-04-10
1694,gu0ogww,t1_gu0h3i7,We gotta help support him done he’s gonna miss the boat and all...,t3_mnwgej,2021-04-10 14:18:24,2021-04-10
1695,gu17zao,t1_gu0h3i7,Like and subscribe,t3_mnwgej,2021-04-10 19:37:04,2021-04-10
1696,gu0zkrs,t1_gu0ita6,AT ALL COATS!,t3_mnwgej,2021-04-10 17:18:35,2021-04-10
1697,gu0gx56,t1_gu0g4ep,you did it,t3_mnwgej,2021-04-10 12:38:38,2021-04-10
1698,gu0wmvj,t1_gu0m6x3,Is that usually a consistent thing for Fridays in general? I know there are so many other factors that it isn’t always the case. PS. I am not being a smart ass in any way if I came off that way I am curious.,t3_mnwgej,2021-04-10 16:28:18,2021-04-10
1699,gu0g4fp,t1_gu0fwfd,"Dude it's fkin nuts haha 

I'm watching it happen and it's still hard to comprehend.",t3_mnwgej,2021-04-10 12:29:21,2021-04-10
1700,gu0e0ln,t1_gu0cerb,Never forget.,t3_mnwgej,2021-04-10 12:05:37,2021-04-10
1701,gu1p3b3,t1_gu0cerb,F,t3_mnwgej,2021-04-10 22:42:23,2021-04-10
1702,gu0omlc,t1_gu0fhmm,"For the bitcoin historians of the future here, the referenced comment was made just before an important breakout after trading sideways for weeks. This breakout was a critical moment in the 2021 crypto bull run.",t3_mnwgej,2021-04-10 14:20:42,2021-04-10
1703,gu0kfuv,t1_gu0ievl,"Ath is $61,788 on Coinbase from about a month ago",t3_mnwgej,2021-04-10 13:22:53,2021-04-10
1704,gu0kl0v,t1_gu0k9ai,Yeh it’s gonna dip then boom after I sell it. Always does.,t3_mnwgej,2021-04-10 13:24:49,2021-04-10
1705,gu0o6wn,t1_gu0jmy8,Actually to be honest it's a quite vague guess if you know what I mean,t3_mnwgej,2021-04-10 14:14:28,2021-04-10
1706,gu0she6,t1_gu0scww,I was thinking about budgeting $100 per paycheck for investment,t3_mnwgej,2021-04-10 15:19:50,2021-04-10
1709,gu0iz2r,t1_gu0gx56,*Life finds a way*,t3_mnwgej,2021-04-10 13:04:04,2021-04-10
1711,gu0m3l6,t1_gu0g4fp,"I saw a couple buys of $680k and $975k when btc was at $61,000.... who buys THAT much Bitcoin when it’s at it’s almost all time high?!?!",t3_mnwgej,2021-04-10 13:45:04,2021-04-10
1712,gu0euox,t1_gu0e0ln,We who are about to buy salute you!,t3_mnwgej,2021-04-10 12:15:03,2021-04-10
1713,gu1pukd,t1_gu0kl0v,"That's the Universe telling you to HODL.

You really should listen to the Universe.",t3_mnwgej,2021-04-10 22:48:51,2021-04-10
1714,gu0sl0z,t1_gu0she6,"Sounds fair to me, if that’s the amount that comfortable with, good luck man!",t3_mnwgej,2021-04-10 15:21:22,2021-04-10
1717,gu0or7k,t1_gu0iz2r,This is the way,t3_mnwgej,2021-04-10 14:22:29,2021-04-10
1718,gu0mi0b,t1_gu0m3l6,People who want to catch the ride to $100k and were waiting until the resistance was broken.,t3_mnwgej,2021-04-10 13:50:40,2021-04-10
1719,gu0ptjt,t1_gu0m3l6,People who know not to time the market,t3_mnwgej,2021-04-10 14:38:18,2021-04-10
1720,gu1kf6c,t1_gu0m3l6,"Privately I’m thinking the same thing, but I will never say that about BTC again, because I said it in December in the low 20K range.. never felt dumber",t3_mnwgej,2021-04-10 21:59:07,2021-04-10
1721,gu1ku47,t1_gu0m3l6,Fraud,t3_mnwgej,2021-04-10 22:03:09,2021-04-10
1724,gu0ihb5,t1_gu0euox,"For those of you, who know what it takes
Those in the bullrun we salute you",t3_mnwgej,2021-04-10 12:57:48,2021-04-10
1725,gu0mz9r,t1_gu0mi0b,"I am mad now that I sold when it hit $61k. I thought it would drop hard again like last time. Now, I seriously am concerned it won’t ever dip back under $60,000 and I had a lot of money invested at $51,000 a coin. Oh well. I’m gonna go to sleep and hopefully wake up and it’s back down to mid $50’s so I can spend my entire portfolio plus the profits from selling earlier on more Bitcoin lol",t3_mnwgej,2021-04-10 13:57:22,2021-04-10
1727,gu0n6cu,t1_gu0mz9r,"Take a look at the chart when it broke back through $20k a few weeks after touching it for the first time.

Take a look at the chart where it broke through $40k a month after touching it for the first time.

Then come back and tell me why you expect a drop after it breaks through 60k a month after touching it for the first time.",t3_mnwgej,2021-04-10 14:00:09,2021-04-10
1728,gu0n18n,t1_gu0mz9r,Why not just buy right back in now? Otherwise you’re going to have to buy the dip to $75k in a couple weeks.,t3_mnwgej,2021-04-10 13:58:09,2021-04-10
1729,gu1d1ro,t1_gu0mz9r,Give it about 12 to 18 months btc will be back at 10kish and the whole market will recycle in 4 years.. btc get outta the way its alt season time,t3_mnwgej,2021-04-10 20:41:27,2021-04-10
1731,gu0ngl0,t1_gu0n6cu,Good point... we’ll see what happens.,t3_mnwgej,2021-04-10 14:04:07,2021-04-10
1732,gu0n4qc,t1_gu0n18n,"Because I am hoping it drops, I mean I don’t think it’s going to, but I am hoping it does. If it stays steady ($60k-$62k) for 2 whole days then I’ll buy back in but a small part of me thinks it will go back to its past month average of $57.5k within a day",t3_mnwgej,2021-04-10 13:59:31,2021-04-10
1734,gu0nl7w,t1_gu0ngl0,"It could seriously go to $70k overnight tonight or tomorrow, and you miss out on $10k because you’re hoping to scalp an extra $4k by timing it.

Maybe you’re better at it than me, but I’ve tried it and it was a bad idea.",t3_mnwgej,2021-04-10 14:05:56,2021-04-10
1735,gu0ss8k,t1_gu0ngl0,What is the point though? The first 20k break looks completely different. We haven‘t entered euphoria stage yet.,t3_mnwgej,2021-04-10 15:24:30,2021-04-10
1736,gu0oogp,t1_gu0n4qc,Timing the market is the best way to miss the ride,t3_mnwgej,2021-04-10 14:21:26,2021-04-10
1737,gu0ney9,t1_gu0n4qc,"When this happened at $20k the next big dip was to $33k. That would be the percentage equivalent of $100k right now.

When this happened at $40k it did drop back to $45k a few weeks later, which would be the equivalent of about $67k now.

In neither case did it drop below the previous ATH at all. You’re risking dollars to save pennies.

That said, this is not investment advice, I know nothing, and it could always drop to zero.",t3_mnwgej,2021-04-10 14:03:28,2021-04-10
1738,gu0suvm,t1_gu0n4qc,"Stop 'hoping' asap my friend, it saves you money",t3_mnwgej,2021-04-10 15:25:40,2021-04-10
1739,gu0sypa,t1_gu0n4qc,It eventually will drop below again - but you‘ll probably miss the ride to this cycles top. It has traded in that 50-59 range for weeks. It had to make a move - and decided to go up. It‘s likely to continue...,t3_mnwgej,2021-04-10 15:27:23,2021-04-10
1740,gu1631c,t1_gu0nl7w,"Trying to time markets is next to impossible, especially bitcoin. It's seriously fucking pointless. Just buy it when you can.

I bought some when it went to 50k. How did I know it would go up? I fucking didn't. 

Then I bought some at 55k. It then went up to 59k. Am I a genius. No. I have no fucking clue what's happening. None. 

I just bought some at 60,500. Who gives a shit. Just buy it when you can.",t3_mnwgej,2021-04-10 19:08:57,2021-04-10
1741,gu10l3o,t1_gu0nl7w,You are expecting the history to repeat. It's all luck for him,t3_mnwgej,2021-04-10 17:36:16,2021-04-10
1742,gu14058,t1_gu0nl7w,He also owes taxes on the sale unfortunately.,t3_mnwgej,2021-04-10 18:35:33,2021-04-10
1823,gu1060h,t3_mo07a5,"For real: you're excited, and now you'll check on the price every 30 minutes, and you'll obsess...

Just ignore the price for a few months. Try to forget about it.",t3_mo07a5,2021-04-10 17:28:50,2021-04-10
1824,gu1e5o3,t3_mo07a5,Always buy the top,t3_mo07a5,2021-04-10 20:54:06,2021-04-10
1825,gu0ts8y,t3_mo07a5,You go glen coco,t3_mo07a5,2021-04-10 15:40:45,2021-04-10
1826,gu0uqf2,t3_mo07a5,Welcome to the fomo,t3_mo07a5,2021-04-10 15:56:29,2021-04-10
1827,gu0t6xw,t3_mo07a5,I did this at 20-30k. Best decision of my life.,t3_mo07a5,2021-04-10 15:31:07,2021-04-10
1828,gu0t1po,t3_mo07a5,Gogogo put all your 10 dollars into it,t3_mo07a5,2021-04-10 15:28:47,2021-04-10
1829,gu1jk6j,t3_mo07a5,"I wouldn't want to spoil the enthusiasm, but can I ask you why? Couldn't you just diversify? I would understand if you started from 0, but since you had already your stocks, you could at least have kept 50%, 30%, or even 10%, just for the sake of diversification.",t3_mo07a5,2021-04-10 21:50:40,2021-04-10
1830,gu0trou,t3_mo07a5,"From 0 to 100 always a ballsy and probably stupid move. In this case however I believe you did good! But why wait for the 60k, if you wanted to do it anyway :)",t3_mo07a5,2021-04-10 15:40:30,2021-04-10
1831,gu143hj,t3_mo07a5,Can you teach me how to sell stocks on a Saturday??,t3_mo07a5,2021-04-10 18:36:59,2021-04-10
1832,gu0u81u,t3_mo07a5,Lock it up until 2025 and 10x your money,t3_mo07a5,2021-04-10 15:48:04,2021-04-10
1833,gu0wn2d,t3_mo07a5,I sold $TSLA to buy Bitcoin. That’s how you know someone’s serious.,t3_mo07a5,2021-04-10 16:28:23,2021-04-10
1834,gu0y9sl,t3_mo07a5,"Just make sure not to have a boating accident. 

GLHF",t3_mo07a5,2021-04-10 16:55:52,2021-04-10
1836,gu0t5z4,t3_mo07a5,Markets are closed..?,t3_mo07a5,2021-04-10 15:30:42,2021-04-10
1838,gu0wvs6,t3_mo07a5,"If this is a long term plan for you, read the book “The Bitcoin Standard”.",t3_mo07a5,2021-04-10 16:32:31,2021-04-10
1839,gu13d40,t3_mo07a5,HODL 😎 trust me if you can’t for the next 5 years your in trouble 😂,t3_mo07a5,2021-04-10 18:24:47,2021-04-10
1840,gu169fh,t3_mo07a5,Did the same at 50k!,t3_mo07a5,2021-04-10 19:11:45,2021-04-10
1844,gu0zame,t3_mo07a5,So you are convinced just because it hit 60k regardless of the technology at what it stands for?,t3_mo07a5,2021-04-10 17:13:37,2021-04-10
1845,gu1dd10,t3_mo07a5,"Hitting 60K again is very bullish, and waiting for resistance to turn into support before buying is a great strategy.  I can see why you waited for 60K.   However, it's a bit early to know if 60K will hold.

I wish you would have scaled in. By scaling in, you could have kept some powder dry for 50K or 40K or even 30K if we (I hope not) revisit them.   You chose a riskier way, but to the risk takers goes the rewards, so you're not wrong.

But you wanted to go all in, so you must have strong hands now.  Do not sell for a loss.  Yes you could theoretically lose it all, but it's far, far, more likely you'll not lose a dime if you're patient.

You might cross a desert or two in the near to mid term, and watching your USD balance cut in half is not for the faint of heart.  But you're a hodler now, there is no sell button on your computer, not at a loss there isn't.

Best to you. I admire your courage.",t3_mo07a5,2021-04-10 20:45:05,2021-04-10
1846,gu0trbn,t3_mo07a5,"Congratulations, welcome to the clan.",t3_mo07a5,2021-04-10 15:40:20,2021-04-10
1847,gu0yhqy,t3_mo07a5,This is the best kind of news! Happy you’re here - just hold tight and enjoy a yearly average return if 200% per year,t3_mo07a5,2021-04-10 16:59:39,2021-04-10
1848,gu15l38,t3_mo07a5,balls deep,t3_mo07a5,2021-04-10 19:01:17,2021-04-10
1849,gu1bmk7,t3_mo07a5,"Nice, make me rich! Im kidding, hold on as long as you can.",t3_mo07a5,2021-04-10 20:24:33,2021-04-10
1850,gu1dtlo,t3_mo07a5,Same rush people get when they go to the casino...,t3_mo07a5,2021-04-10 20:50:20,2021-04-10
1851,gu1e82r,t3_mo07a5,Proof,t3_mo07a5,2021-04-10 20:54:50,2021-04-10
1852,gu1ex4f,t3_mo07a5,Same bro and now it’s falling I’m so scared,t3_mo07a5,2021-04-10 21:02:37,2021-04-10
