,comment_id,comment_parent_id,comment_body,comment_link_id,created,date
1391,gtb00j4,t1_gtazn5m,No ethereum was premined and has no supply cap,t3_mjlr6h,2021-04-04 09:43:09,2021-04-04
1392,gtb1qig,t1_gtazn5m,BTC looks heavy right now. Not saying it will dip it just looks questionable.,t3_mjlr6h,2021-04-04 10:00:20,2021-04-04
1393,gtbbt1q,t1_gtbavw3,Then I’ll be re enlisting in the military for a 45k bonus,t3_mjlr6h,2021-04-04 11:44:50,2021-04-04
1394,gtbwcjc,t1_gtbavw3,It's only a loss if you sell. Keep Hodling!!,t3_mjlr6h,2021-04-04 16:42:09,2021-04-04
1395,gtcmfqz,t1_gtces5l,"Robinhood is duplicitous as it has a larger spread. It’s a bit like those money houses in airports that say: no fee! But do the conversion at outrageous values. Robinhood spread is 0.2% on top of real market spread which is lower than Coinbase but there is a fee.

Binance, for comparison charges 0.1%. 

I personally prefer transparency (fee) instead of the hidden spread.",t3_mjlr6h,2021-04-04 22:35:41,2021-04-04
1396,gtbpyo9,t1_gtbovhp,For who entered the market in 2018-2019-2020 buying sub 20k was like buying now at 58k. We are all on the same ship making the same decisions.,t3_mjlr6h,2021-04-04 14:56:07,2021-04-04
1398,gtcnndt,t1_gtcier5,"No, was in the 30’s when it was announced I believe.",t3_mjlr6h,2021-04-04 22:46:54,2021-04-04
1401,gtbpr3h,t1_gtbot25,"Tesla can sell at any point, how they see fit. For me the impulse was Visa and Mastercard.",t3_mjlr6h,2021-04-04 14:52:45,2021-04-04
1404,gtb5ur7,t1_gtb5kdr,"yeah. And realizing you’re now playing a game that can have 30%+ swings both ways within 24 hrs. I ain’t numb to them tho. Still watch them, but that “oh f” feeling leaves. It’s more like “oh f, I didn’t have any cash deposited to take advantage of this” now. Ha",t3_mjlr6h,2021-04-04 10:42:27,2021-04-04
1405,gtb5qln,t1_gtb5kdr,"honestly took me a few months to realize this. i’m glad i did. it’s so easy now , just buying on dips and letting it do its thing lol",t3_mjlr6h,2021-04-04 10:41:15,2021-04-04
1406,gtc2u0h,t1_gtb5kdr,Me too!,t3_mjlr6h,2021-04-04 18:32:49,2021-04-04
1408,gtbe4um,t1_gtb111b,"Yea, it's gonna be nice to buy the 60% dip at $120k. Much better than buying now at all time highs of around $60k.  Better wait for that dip!",t3_mjlr6h,2021-04-04 12:11:51,2021-04-04
1409,gtbega1,t1_gtb111b,"SAME. Finally I’ve found someone else with the same mindset. I’m not going to panic sell on the way down either. I just plan to meet everyone at the bottom of the well and buy buy buy as much as I possibly can before it rockets back up again!

As much as I would LOVE for that to happen, I highly doubt it will just because of all of the massive financial investors that are now involved. Unfortunately for the rest of us, their presence likely means most (note: not all) of the huge fluctuations are likely gone from the market. I guess that could be for better or for worse depending on how you look at it.",t3_mjlr6h,2021-04-04 12:15:41,2021-04-04
1410,gtbnbfq,t1_gtb111b,Coinbase used to have alerts even though there weren’t the greatest it was a reminder to buy the  dip. It’s all about the long term play imo.,t3_mjlr6h,2021-04-04 14:15:17,2021-04-04
1411,gtbyz4c,t1_gtbp17m,"You probably haven't ""learned"" anything. It's just not as exciting to look at it at the moment.

If we ever see December-February like movement again, you'll be checking every 5 minutes.",t3_mjlr6h,2021-04-04 17:27:29,2021-04-04
1412,gtcmy7q,t1_gtbvlg0,My hands felt just like two balloons,t3_mjlr6h,2021-04-04 22:40:26,2021-04-04
1413,gtb4t49,t1_gtb4p53,"And by rig, I mean my gaming/overclocking PC.  Not an actual mining rig.",t3_mjlr6h,2021-04-04 10:31:43,2021-04-04
1414,gtb3843,t1_gtb2xg7,"3, no mining rigs, I'm just running PC's I've got around the house with as many GPU's as I can get my hands on for MSRP. 260 MH/s over 4 GPU's right now. Hopefully I can buy another one or two to add to the pile. I've got room for 2 more GPU's before I'll have to consider buying a mining case and motherboard.",t3_mjlr6h,2021-04-04 10:15:31,2021-04-04
1415,gtbxq7b,t1_gtbgrth,"Definitely, according to LTT they recovered/repaid all user funds",t3_mjlr6h,2021-04-04 17:05:39,2021-04-04
1416,gtbdgjm,t1_gtbca4h,The empty half,t3_mjlr6h,2021-04-04 12:03:51,2021-04-04
1417,gtbyv4b,t1_gtbq2kn,*Didgeridoo sounds*,t3_mjlr6h,2021-04-04 17:25:33,2021-04-04
1418,gtbl233,t1_gtbj84a,Yeah but doing so eats away 26% for taxes or whatever it is in it country,t3_mjlr6h,2021-04-04 13:42:01,2021-04-04
1419,gtcjlty,t1_gtbrf3h,I became a number when I smoked DMT,t3_mjlr6h,2021-04-04 22:08:43,2021-04-04
1420,gtc0q1z,t1_gtbqwam,Coinbase Pro,t3_mjlr6h,2021-04-04 17:57:40,2021-04-04
1421,gtbr8ge,t1_gtbqsrh,Haha. Unfortunately that’s because I have more years behind me than I do ahead.,t3_mjlr6h,2021-04-04 15:16:32,2021-04-04
1422,gtay84a,t1_gtax8d5,Yep yep. I use CBP,t3_mjlr6h,2021-04-04 09:25:12,2021-04-04
1423,gtb4en6,t1_gtazxmy,I wonder why they have two different  platforms.,t3_mjlr6h,2021-04-04 10:27:35,2021-04-04
1424,gtb22p4,t1_gtb1qig,Why so bearish?,t3_mjlr6h,2021-04-04 10:03:43,2021-04-04
1425,gtbekb0,t1_gtbbt1q,Bwahahah,t3_mjlr6h,2021-04-04 12:17:03,2021-04-04
1426,gtco21v,t1_gtcnndt,"Nice! So there really hasn't been a dip since then at all then we've been on a straight rocketship for a while now.

I hope everyone is prepared for the -35% type dip. That's the juicy kind.",t3_mjlr6h,2021-04-04 22:50:31,2021-04-04
1427,gtbpwdp,t1_gtbpr3h,"Tesla was more of a milestone for me, like “ok, this is real” type thing.

Finally a 1 coiner and proud",t3_mjlr6h,2021-04-04 14:55:07,2021-04-04
1429,gtb6lr6,t1_gtb5ur7,"Yep, I think I was more upset I didn’t buy more on that 43k~ dip then joyful when we hit 60k lol",t3_mjlr6h,2021-04-04 10:50:05,2021-04-04
1430,gtbwcoj,t1_gtb5ur7,the dip is part of the fun like any 🎢,t3_mjlr6h,2021-04-04 16:42:13,2021-04-04
1431,gtcmerw,t1_gtb5ur7,"I don't think we've had a 24 hour 30% swing in quite a long time, but do correct me if I'm wrong. Yes we do swing thousands of dollars either way, but $15-20k in one direction in one 24 hour period these days would be insane. Pretty much the only thing I could think that could do that would be if the cryptography supporting Bitcoin gets utterly defeated somehow.",t3_mjlr6h,2021-04-04 22:35:26,2021-04-04
1432,gtb6iqa,t1_gtb5qln,"Yeah, any moves now aren’t life changing but if history is anything to go by then they will be in 5-10 years.",t3_mjlr6h,2021-04-04 10:49:13,2021-04-04
1433,gtbgi3c,t1_gtbe4um,Lol this. People cant math.,t3_mjlr6h,2021-04-04 12:40:48,2021-04-04
1434,gtbjeyq,t1_gtbe4um,Is this sarcasm,t3_mjlr6h,2021-04-04 13:19:11,2021-04-04
1435,gtbk51d,t1_gtbe4um,This is the way.,t3_mjlr6h,2021-04-04 13:29:10,2021-04-04
1436,gtbzgsp,t1_gtbe4um,Lol people said the same when it was at 20k. It dropped to 3.7k afterwards. People are so naive about volatility. We will see 20k at the very least at some point in the future. Price never just goes up.,t3_mjlr6h,2021-04-04 17:35:59,2021-04-04
1437,gtbis1u,t1_gtbega1,It’s absolutely for the better.,t3_mjlr6h,2021-04-04 13:10:28,2021-04-04
1438,gtbnsbd,t1_gtbnbfq,Why did Coinbase get rid of that? It used to be nice,t3_mjlr6h,2021-04-04 14:22:18,2021-04-04
1441,gtbc8gb,t1_gtb3843,"Can you actually make money? I had thought that electricity costs so much compared to China(along with GPU prices) 
That it’s impossible to make a profit",t3_mjlr6h,2021-04-04 11:49:42,2021-04-04
1442,gtbon6v,t1_gtb3843,Do you know what’s the best way to start on this?,t3_mjlr6h,2021-04-04 14:35:26,2021-04-04
1444,gtbkm7f,t1_gtbdgjm,haha 😂,t3_mjlr6h,2021-04-04 13:35:42,2021-04-04
1445,gtbmgnn,t1_gtbl233,26% of your profit only though right?,t3_mjlr6h,2021-04-04 14:02:28,2021-04-04
1446,gtclxk6,t1_gtbl233,But you only owe taxes when those gains are realized.,t3_mjlr6h,2021-04-04 22:30:59,2021-04-04
1449,gtb6r3q,t1_gtb4en6,I think just to make more money by offering a higher fee for people who rush and for people who want a discount if they look around they can find it. Sort of like a grocery atore with coupons,t3_mjlr6h,2021-04-04 10:51:35,2021-04-04
1450,gtb2fgh,t1_gtb22p4,Nothing too bearish about a retracement to last month's price or lower.,t3_mjlr6h,2021-04-04 10:07:21,2021-04-04
1456,gtb6ye5,t1_gtb6lr6,Captain hindsight will always be there to ruin any parade.,t3_mjlr6h,2021-04-04 10:53:38,2021-04-04
1458,gtbm8pd,t1_gtbgi3c,"I'm buying Bitcoin daily regardless of price, believing in the end game of 1₿ = $10,000,000.  

When you envision such a price, does it make much difference whether it's 60k or 30k? Either way the price of Bitcoin is peanuts right now. 

Also, what if the dip never comes? Anybody who thinks they can accurately predict the market on this thing is clueless and talking out of their arse.",t3_mjlr6h,2021-04-04 13:59:13,2021-04-04
1459,gtbk0eb,t1_gtbjeyq,It’s both sarcasm and psychology. He’s not wrong.,t3_mjlr6h,2021-04-04 13:27:21,2021-04-04
1460,gtcdwdq,t1_gtbzgsp,"I remember someone who lamented having sold at 2.5K when the price was 2.8K. He was waiting for the price to fall back so he could get back in, and I told him that bitcoin might never go back to 2.5K again. That was the last time bitcoin was under 3K.",t3_mjlr6h,2021-04-04 21:07:10,2021-04-04
1461,gtceg7x,t1_gtbzgsp,"$20k was the top. We haven't even started this bull run yet. If you think we're ever seeing $20k again, have fun staying poor!",t3_mjlr6h,2021-04-04 21:13:20,2021-04-04
1462,gtc06o0,t1_gtbnsbd,"Was it just me or did the dip alerts always seem 6 hours old?

But BTC would increase by $.97 and the alert would be near instant...",t3_mjlr6h,2021-04-04 17:48:26,2021-04-04
1463,gtbd20g,t1_gtbc8gb,"Yep. Like I said above, I made 46,000 SAT today, which is like $26.41 USD. Across my 3 computers, let's assume I'm using 1KW of power (a high assumption, but lets roll with it). I pay 0.094 USD per KW/h of power, so $2.25 USD per day in power costs, for a profit of $24.16. I have spent $2800 on my 4 GPU's so far, and have already made ~$800 in BTC from mining payments.

Today was abnormally high in payments, so let's assume the average profit is like $20 per day. At this rate, in 100 days I will hit the break even point. That's effectively the same thing as me doing $2800 in DCA investing into Bitcoin, at the end of which I get $2800 in free GPU's as well. 

This isn't without risk, since if ETH mining becomes unprofitable before I hit that return on investment point I do not break even, but since the GPU's have value of their own, I feel that as long as I get 50% of the way to breakeven point I can sell the GPU's to recoup any losses and at least come out where I started. The potential upside is that I could mine all the way until 2022 before ETH goes to proof of stake and mining isn't profitable. EIP1559 is coming in July as well, meaning profits will be cut in half. It's why that 100 day thing is so important... I wanna hit profitability before profits are cut in half, because at that point I'm already in the black.

It's also very difficult to buy GPU's right now. I've been entering the Newegg Shuffle, and have gotten lucky 3 times so far. I also bought my 3080 back late last year, when the scalped price was ""only"" $1200, so I was able to get that at half what they currently go for fortunately.",t3_mjlr6h,2021-04-04 11:59:13,2021-04-04
1464,gtbo82j,t1_gtbmgnn,"Yes but it's risky if you don't prepare for tax report.
Must know what you're doing. Also must be careful about wash sales. A noob daytrading got taxed 800k with a 40k net profit it was quite popular some days ago. Taxes is no joke.",t3_mjlr6h,2021-04-04 14:29:00,2021-04-04
1465,gtb885u,t1_gtb6r3q,Are you familiar with the fees? I want to just buy Crypto at the current price but on CB it's always sold at like a higher rate by $300. Even if it's at a dip and I hate it.,t3_mjlr6h,2021-04-04 11:06:48,2021-04-04
1469,gtbdb60,t1_gtb6ye5,Wasn’t hindsight for me. I just didn’t have to money to buy more,t3_mjlr6h,2021-04-04 12:02:10,2021-04-04
1470,gtbqxr8,t1_gtbm8pd,agreed.  I just buy when I have cash and the price doesn’t matter much,t3_mjlr6h,2021-04-04 15:11:42,2021-04-04
1471,gtcd6so,t1_gtbm8pd,"True, I remember how I used to wait for the dip when it was about 32k, I finally got in at 29k and I was so pleased, but now I realise how little those price fluctuations matter in the grand scheme.",t3_mjlr6h,2021-04-04 20:59:04,2021-04-04
1472,gtc8cqr,t1_gtbm8pd,Is $10 000 000 the actual predicted “endgame” of BItcoin? Like where it will still just end up being and staying? I have tried to read about it but have never found much. I always just see 1 mill by $2030 etc etc.,t3_mjlr6h,2021-04-04 19:57:29,2021-04-04
1473,gtbk5gs,t1_gtbk0eb,"So he is advocating buying at 60k to just get time in the market rather than waiting for a dip from a higher price?

If so then i agree w him",t3_mjlr6h,2021-04-04 13:29:20,2021-04-04
1475,gtbehfz,t1_gtbd20g,"The GPU scalpers are honestly horrible. I usually don’t have a problem with people scalping things, but GPU’s have had a Shortage for wayyyy too long",t3_mjlr6h,2021-04-04 12:16:04,2021-04-04
1476,gtbgzzy,t1_gtbd20g,"This is profitable until ETH 2.0. What then? Also, would make more sense to keep the profits in eth for higher potential returns.",t3_mjlr6h,2021-04-04 12:47:06,2021-04-04
1477,gtbel0l,t1_gtbd20g,"There's a few changes coming up for eth in the next few months. Eth atm is profitable especially if you have cheap power.
On the upside though, those changes to eth will most likely have a positive impact on its price.",t3_mjlr6h,2021-04-04 12:17:17,2021-04-04
1478,gtbqp9i,t1_gtbo82j,"Interesting point, I want to get started next week with Bitcoin. What exchange you suggest? I will most likely just hold, the wash sales was important.",t3_mjlr6h,2021-04-04 15:07:53,2021-04-04
1479,gtcjiua,t1_gtbo82j,Wash sales on BTC?,t3_mjlr6h,2021-04-04 22:07:53,2021-04-04
1480,gtckd6m,t1_gtbo82j,That was day trading stocks different entirely.,t3_mjlr6h,2021-04-04 22:16:10,2021-04-04
1481,gtbb2uz,t1_gtb885u,The coinbase pro fee is .5%. Cashapp fee is 1.5%,t3_mjlr6h,2021-04-04 11:36:43,2021-04-04
1482,gtbaz7t,t1_gtb885u,Use coinbase pro. It’s free with lower fees than coinbase.,t3_mjlr6h,2021-04-04 11:35:36,2021-04-04
1483,gtbbhzf,t1_gtb885u,"Coinbase Pro starts at .5% fees, three times lower than the 1.5% on regular Coinbase. You sign into Coinbase Pro using your Coinbase login credentials, so you basically already have an account.",t3_mjlr6h,2021-04-04 11:41:22,2021-04-04
1484,gtbivty,t1_gtbdb60,You could have sold some Bitcoin to buy more ^^^/s,t3_mjlr6h,2021-04-04 13:11:55,2021-04-04
1485,gtcasao,t1_gtc8cqr,1 mil in 2030. What will be the price by 2040,t3_mjlr6h,2021-04-04 20:29:57,2021-04-04
1486,gtbkeee,t1_gtbk5gs,"Essentially yes, no time is a bad time to buy in the long run. Now is a good time as any, or you can wait for it to blast to 200k, wait for a dip to 120k and pat yourself on the back you bought the dip when you could have been stacking now until then.",t3_mjlr6h,2021-04-04 13:32:43,2021-04-04
1487,gtbet56,t1_gtbehfz,"Scalpers don't really bother me... because even without them, there would still be a shortage. Otherwise the prices would come down. Look at the Ryzen CPU's. The 5600x was being scalped for like 500-600, and eventually as demand was met the price dropped lower and lower until you can frequently buy them from AMD directly. 

So without scalpers, instead of seeing crazy prices on ebay and amazon, you'd just see nothing for sale at all at any price.",t3_mjlr6h,2021-04-04 12:19:56,2021-04-04
1488,gtbh2q6,t1_gtbgzzy,"Well then you either find something new to mine or hope you have already made a profit, and then sell extra GPU's for what you can get for them. ETH 2.0 is not until 2022 at the earliest.",t3_mjlr6h,2021-04-04 12:48:02,2021-04-04
1489,gtbwa1t,t1_gtbqp9i,"I haven’t had to use the feature yet, but Gemini offers your tax documentation and also tracks your trades in downloadable Excel docs which is a really nice feature. Unrelated, their free monthly withdrawal (10x) are a nice perk too.",t3_mjlr6h,2021-04-04 16:40:56,2021-04-04
1490,gtcjiw4,t1_gtbivty,"You could have sold your body to buy more 

/s",t3_mjlr6h,2021-04-04 22:07:54,2021-04-04
1491,gtbkgvr,t1_gtbkeee,Nice. That’s exactly what I was thinking. I just need to work on being patient instead of checking the price so much,t3_mjlr6h,2021-04-04 13:33:40,2021-04-04
1492,gtcj6pu,t1_gtbwa1t,"Here in Canada, we just have to send the file to a place like Koinly then they do the whole job for taxes... and 50% of gains are taxable.. so its like 15% of 50%... (if i'm right). I'll be waiting next year after stacking, then to the same : Buy low, sell high.",t3_mjlr6h,2021-04-04 22:04:35,2021-04-04
1494,gtckpeg,t1_gtbkgvr,"Yeah, if you’re not looking to sell soon, the only reason I check it is when I’m buying more",t3_mjlr6h,2021-04-04 22:19:24,2021-04-04
1495,gtbo123,t1_gtbkgvr,Wait... Bitcoin costs money?,t3_mjlr6h,2021-04-04 14:26:03,2021-04-04
1505,gtcif5h,t3_mjw04f,"do what makes you happy, just make sure to help your parents out as much as possible, while you saving up. trust me it helps out the whole situation alot. plus your parents will love having you around and will be sad when you leave.",t3_mjw04f,2021-04-04 21:56:50,2021-04-04
1506,gtcfvs4,t3_mjw04f,"Do what you believe is right. No one should be giving you advice on what to do, especially people who don't know you",t3_mjw04f,2021-04-04 21:29:01,2021-04-04
1508,gtchiew,t3_mjw04f,It’s very common for people to do this to save for a house deposit. I don’t see this as being any different. More sensible actually. Buy bitcoin for a couple of years and buy a house outright.,t3_mjw04f,2021-04-04 21:46:03,2021-04-04
1510,gtcg37o,t3_mjw04f,"If you guys have a great relationship I would do it,
Did the same thing you're doing, now I have over 30k.... Don't listen to these yuppies, everyone has their own journey.",t3_mjw04f,2021-04-04 21:31:17,2021-04-04
1513,gtch7o1,t3_mjw04f,"There's nothing wrong with moving back in with your parents, but if you can afford $1000/month your folks might appreciate a bit of that as rent.  If they decline, set up a little bitcoin fund for them that you pay a pittance into regularly.

Your parents raised your arse, so you owe them even if they say you don't.

If you're not sure, just don't tell them about it until, like, the day they retire or something.  If you still don't agree with me by then, well you still have the keys so it's still your bitcoin.  But if that's the case, at least remember to get your mum some flowers on Mothers Day. ;)",t3_mjw04f,2021-04-04 21:42:57,2021-04-04
1514,gtckzx1,t3_mjw04f,Good decision. Living at home is great. Don’t forget to take care of the parents,t3_mjw04f,2021-04-04 22:22:09,2021-04-04
1515,gtcf8ge,t3_mjw04f,"Some bemoan others moving back home with the parents but the “American way” on having a generation in their own housing is unsustainable and financially stupid. Boomers in particular like to complain about how the younger generations aren’t achieving the American Dream fast enough for their liking; too bad they are the ones that destroyed the system after they got theirs. 

Multigenerational housing has its benefits. Chief among them saving money.",t3_mjw04f,2021-04-04 21:21:59,2021-04-04
1516,gtcjdoa,t3_mjw04f,"Do it. Corona fucked me over and kinda forced me to move back in with my parents. Had this happened to me ten years ago. I probably would have scraped by for months blowing through my savings. Which I basically did now as well. Was living with a mate who couldnt hold a job and was a general mess acting like he was still 20, broke and carefree. Every cent he had went to partying. To each his own I guess. So wanted to get out of that situation as well, so kinda used corona as an excuses as well. Mind you we are both 36 years old.
 Anyways moved back in with my folks, we have a great bond. I buy the groceries. 3 months later I land a new better paying job. And now I save over 2k a month which I now partially invest in stocks/coins. Probs gonna live with them for another year while looking for my own place and just saving all that money.
Tldr: fuck people's opinion about you. Its your life. Your friends frown upon you? They never were your friends to begin with. Do what you want, just stand by your choices and don't look back. Learn, don't regret. At one point you will realisme only the opinion of a few select people have gravity.",t3_mjw04f,2021-04-04 22:06:29,2021-04-04
1517,gtcf2me,t3_mjw04f,"Not good idea. There is much more to it than a money. It might be even just a good excuse. By moving back to your prents in your 30s you are basicaly asking for troubles. Your subconcious confidence level will drop. Your chance of dating solid partner will plummet. Your motivation to do anything will drop. Your mindset and behavior will start to align with your boomer parents. You cant prevent this. In deep down you know its a move of losers. Self independence no matter how difficult will make you a better man, more confident that you can take care of yourself and your future family. Hardship makes man. Having your mother wash your underwears dont. Period",t3_mjw04f,2021-04-04 21:20:12,2021-04-04
1518,gtcewog,t3_mjw04f,"You’re definitely not alone. With the inflation in real estate prices this is becoming more and more common among young people. Also unless you need your own place for a job or a relationship, it’s pretty common to live with your parents in many cultures!",t3_mjw04f,2021-04-04 21:18:22,2021-04-04
1525,gtcl59p,t3_mjw04f,"While I can really see where you are coming from, please also do not lose sight of the fact that we all only get 80 years or so in this life. Sacrificing a few of those for future benefit can be the right way, but in your thirties, while you are in your prime health and abilities, moving back to your parents is in most cases not beneficial for your advancement in your career, relationships, personal development, mental health and general life. Make sure its temporary and try not to shut yourself off from the world. Be especially careful once bitcoin start crashing again. Which we all know if very possible.",t3_mjw04f,2021-04-04 22:23:33,2021-04-04
1530,gtci14u,t3_mjw04f,"$1000 a month and all you have to give up is a portion of your freedom, some self worth and a dash of self respect.
But you can FOMO into some BTC and share it with your virtual Reddit friends for some upvotes and maybe build up your self esteem that way!",t3_mjw04f,2021-04-04 21:52:36,2021-04-04
1532,gtclvw7,t3_mjw04f,"Why don’t you just ask mommy and daddy to give you the money for playing with crypto? Will you request them your weekly allowance too and charge them when you wash their car? You are not talking about going back because you can’t live by your self or because you have a shitty situation but because you prefer to live from them. Pretty sure you are not giving up a lot of things in your life to save money for crypto, just taking advantage of your parents.",t3_mjw04f,2021-04-04 22:30:32,2021-04-04
1545,gtciwr5,t3_mjw04f,If your 30 and living at home and your parents are healthy...somewhere something went wrong for you.  Gotta make your own mark in this world and leave the nest.  22 to 25 is pushing it...but 30..its time,t3_mjw04f,2021-04-04 22:01:48,2021-04-04
1546,gtcequ7,t3_mjw04f,Stack those sats!,t3_mjw04f,2021-04-04 21:16:35,2021-04-04
1547,gtckqo1,t3_mjw04f,Wise move.,t3_mjw04f,2021-04-04 22:19:44,2021-04-04
1548,gtcigjk,t3_mjw04f,"Be extra nice to your parents, help them out every chance you get, make them dinner or order food in sometimes, the happier you make them the better they will treat you.",t3_mjw04f,2021-04-04 21:57:14,2021-04-04
1549,gtcga7s,t3_mjw04f,honestly.. I wish that I could do this but it just isn't really an option for me   : /,t3_mjw04f,2021-04-04 21:33:20,2021-04-04
1550,gtclotg,t3_mjw04f,Good plan! As long as you’re supporting BTC I’m happy,t3_mjw04f,2021-04-04 22:28:45,2021-04-04
1554,gtchzzf,t3_mjw04f,"$1000 a month and all you have to give up is a portion of your freedom, some self worth and a dash of self respect.
But you can FOMO into some BTC and share it with your virtual Reddit friends for some upvotes and maybe build up your self esteem that way!",t3_mjw04f,2021-04-04 21:52:19,2021-04-04
1555,gtcm7ln,t3_mjw04f,Tough call. Good for you. You’re investing in your future.  right call. Maybe have an end date in your own mind (end of bull run). But I’m like you - taking every opportunity to make the most of this.  Think you’re doing the right thing. Also - the best time of my life was 31 to 33. The best is yet to come and will be better when you have some money. Money can’t buy you happiness but it can buY you choices/options. Nothing is more freeing than that. Good luck. May the bitcoin gods be with you.,t3_mjw04f,2021-04-04 22:33:35,2021-04-04
1556,gtcnpuv,t3_mjw04f,I’ve lost 5 pounds not eating because I’m buying crypto,t3_mjw04f,2021-04-04 22:47:32,2021-04-04
1602,gtcilir,t1_gtcfvs4,Man he is writing on reddit. I guess he expect advices from people or why is he here afterall?,t3_mjw04f,2021-04-04 21:58:37,2021-04-04
1610,gtcjc5c,t1_gtcg37o,His only journey will be to his parents fridge. But dont worry every biography of a successful person starts with “So I moved to my parents house and saved my way to my first million dollars”.,t3_mjw04f,2021-04-04 22:06:05,2021-04-04
1614,gtchk9n,t1_gtcf8ge,Chief among them being cooked for and having your washing done.,t3_mjw04f,2021-04-04 21:46:36,2021-04-04
