,comment_id,comment_parent_id,comment_body,comment_link_id,created,date
1616,gtcfoy7,t1_gtcf2me,"You have a point. But dude's idea is very good. I'm close to 30 as well and if I could I'd live with my parents for at least a few months so I can save some money and invest it later in something that could improve my life. 
Living a few months or a year with your parents for a better future after that, it's a great idea.
I live by myself for 5 years now and my paycheck is barely enough for rent and food... Forget the 100$ I planned to invest in crypto monthly... Its just impossible for some people...",t3_mjw04f,2021-04-04 21:26:59,2021-04-04
1617,gtcofj6,t1_gtcf2me,This is such a narrow minded viewpoint,t3_mjw04f,2021-04-04 22:53:52,2021-04-04
1620,gtciy49,t1_gtcf2me,I agree with this 100%. Life is to be lived. Hurting your social life and depending on your parents as an adult to invest in new internet money is not something I would do.,t3_mjw04f,2021-04-04 22:02:11,2021-04-04
1622,gtcfql7,t1_gtcf2me,"so yeah, bitcoin..?",t3_mjw04f,2021-04-04 21:27:29,2021-04-04
1625,gtcg8o8,t1_gtcf2me,Are you an incel or do you just talk like one?,t3_mjw04f,2021-04-04 21:32:54,2021-04-04
1627,gtcoq17,t1_gtcl59p,"How does sharing a residence with your parents hinder those things? I could easily see how it would actually improve your career, relationships, personal development, mental health and life in general.",t3_mjw04f,2021-04-04 22:56:31,2021-04-04
1636,gtclbv3,t1_gtcigjk,"Yes be the maid/butler, at the end of the day you are living from them... or maybe grow up and stop living from them. What you are talking about is just trying to squeeze them just a little bit more, when probably they thought they finally stabilized their economy, just because you want to join the hype of the crypto. Instead of actually making an effort, you are asking your parents to keep busting their assess for you. Asshole move.",t3_mjw04f,2021-04-04 22:25:16,2021-04-04
1637,gtckxdd,t1_gtcigjk,Exchange word parents with partner and it will start to make sense for a man of his age.,t3_mjw04f,2021-04-04 22:21:29,2021-04-04
1638,gtci57u,t1_gtcga7s,Be glad that you can stand on your own two feet.,t3_mjw04f,2021-04-04 21:53:54,2021-04-04
1649,gtckbkm,t1_gtcilir,Karma farming,t3_mjw04f,2021-04-04 22:15:44,2021-04-04
1657,gtcm0qa,t1_gtcjc5c,Indians do it and they are one of the most successful groups in US.,t3_mjw04f,2021-04-04 22:31:49,2021-04-04
1664,gtclwcc,t1_gtchk9n,"Just because an adult decides to live with their parents doesn't mean they are incapable of caring for themselves. I did it through my early twenties, washed my own clothes, bought and cooked my own food, worked full time, college full time and I was able to graduate with a BS in chemistry, zero student loan debt, actually owned my vehicle and had enough in savings to live for 6 months without needing to work (of coarse I always had a job). While my peers who were such responsible adults and moved out of their parents to take on massive debt, got a worthless degree, never worked to save up money and now expect society to take care of them because they are incapable to do so, but yeah people who live at home with their parents are the problem.",t3_mjw04f,2021-04-04 22:30:40,2021-04-04
1667,gtcicar,t1_gtcfoy7,"You totaly misses the point. The very idea that the best way to increase your wealth is to exploit your parents house as a free place to stay is absolutely terrible minset. You should not be asking a question “who can give me something for free to better myself” but rather “ how can I better myself to earn more money so I dont have to exploit others mercy”. The very hardship of not having money because you must pay rent and take care of yourself because there is no other who will is the way how to work harder on yourself and become a real man. 
I have lived with my parents only to age of 19 and I have troubles paying rent but that was the very reason that motivated me to get to a state where a rent is peanuts for me. Your goal is not to save on a rent by delegating it to other but to make a rent payment irelevant portion of your monthly payment as your income rise year by a year. Parent should never let their children stay at home “to save some money”, its the worst “monkey love” service they can do for them.",t3_mjw04f,2021-04-04 21:56:04,2021-04-04
1670,gtchmr4,t1_gtcg8o8,What kind of a bs response is this? Calling him an incel for offering his well meaning opinion? You’re a crappy person who pulls the Reddit community down.,t3_mjw04f,2021-04-04 21:47:46,2021-04-04
1672,gtcjojw,t1_gtcg8o8,Go get some beer from your parents fridge if you feel inferior.,t3_mjw04f,2021-04-04 22:09:27,2021-04-04
1673,gtcgx2l,t1_gtcg8o8,Yes.,t3_mjw04f,2021-04-04 21:39:56,2021-04-04
1691,gtcl3ph,t1_gtckbkm,What will he do with this karma? Pay his parents a rent with it?:),t3_mjw04f,2021-04-04 22:23:08,2021-04-04
1708,gtcm63b,t1_gtcicar,"Your ignorance level is high af
Dude, not everyone is like you. You managed to do it that way, others do it differently. 
Like I said, some don't even have the possibility to even work extra hours, much less to increase their paycheck significantly.
Ignorant af dude...
There is so much more to take into consideration... You obviously grew up differently and in a health state totally different...",t3_mjw04f,2021-04-04 22:33:12,2021-04-04
1709,gtcp7cq,t1_gtcicar,"Where I lived before (and where I live now but with much more racist overtones) people bitch about the ethnicity of those who own the convenience stores and how they got that; multigenerational housing is how they got that and they are building multigenerational wealth by not being wage slaves to have temporary independence. 

Having independence certainly has its value, but saving money early in one’s life and leaving the nest on a solid financial footing pays much more dividends than struggling for independence early. 

Over half of this country doesn’t have enough money to cover a $500 emergency...",t3_mjw04f,2021-04-04 23:00:45,2021-04-04
1712,gtck8s7,t1_gtcicar,"Great on point comment, but most ppl are like ""dude stop drinking coffee to have $30 more for crypto""
Moving back is totally a step back as you said...",t3_mjw04f,2021-04-04 22:15:00,2021-04-04
1734,gtcmdpb,t1_gtcl3ph,"Not really, but nowadays you see this kind of shitty content on Reddit everywhere. There is no real question or post, just some bs looking to get Karma because it is cool. There is a shitton of post with “confessions” of whatever situations. What do you think is the objective of this post? I mean, I agree with you, you won’t get anything from it, the same happened with the likes on FB and Instagram, but people goes crazy about them sharing whatever shit they can for a like.",t3_mjw04f,2021-04-04 22:35:09,2021-04-04
1855,gtci4rb,t3_mjwiv1,"I am totally in this category. Regretful that I didn't DCA throughout the major dips after 2017/2018. 

I do however wonder if we'll all remember this if we do see our holdings take a major dip again. Many of us should have learned a strong lesson. Let's make sure we utilize our new information.",t3_mjwiv1,2021-04-04 21:53:46,2021-04-04
1856,gtcjp7e,t3_mjwiv1,"This is nothing new nor unique. It is seen in the stock market as well. Everyone's banking on historical trends to continue, to buy more Btc in time for next ath post halving.",t3_mjwiv1,2021-04-04 22:09:38,2021-04-04
1857,gtcimts,t3_mjwiv1,"I want some stocks I own to dip,  so I can average down. Lol. Also bitcoin.",t3_mjwiv1,2021-04-04 21:59:01,2021-04-04
1861,gtcoyvx,t3_mjwiv1,We want it to go up and down 🙂🙃,t3_mjwiv1,2021-04-04 22:58:42,2021-04-04
1865,gtcku1l,t3_mjwiv1,I have this feeling since february. Only because I didn't keep buying when I started in 2018,t3_mjwiv1,2021-04-04 22:20:36,2021-04-04
1915,gtcp0fk,t3_mjxqf5,I use the alts to make me more BTC,t3_mjxqf5,2021-04-04 22:59:05,2021-04-04
1920,gtcoyzw,t3_mjxqf5,Here's why: [https://armantheparman.com/why-bitcoin-only/](https://armantheparman.com/why-bitcoin-only/),t3_mjxqf5,2021-04-04 22:58:44,2021-04-04
1925,gtcopvl,t3_mjxqf5,Yes because BTC is hard money and the rest are just promises,t3_mjxqf5,2021-04-04 22:56:28,2021-04-04
2422,gtbjxzz,t3_mjom8c,This may be the thing that forces Wall Street to legitimize bitcoin. The largest bitcoin exchange listing alongside Apple and Microsoft. Every company is running out of reasons not to put bitcoin on their balance sheet.,t3_mjom8c,2021-04-04 13:26:26,2021-04-04
2423,gtbfaed,t3_mjom8c,"If this helps BTC adoption then it's yet more accelerant in the black hole effect.

But hopefully nobody here is sufficiently distracted to actually choose buying Coinbase stock instead of BTC. If they have the choice. 

Most IPO investors lose money: https://www.ft.com/content/4cc46770-017a-11ea-b7bc-f3fa4e77dd47

I guess some people may have investments trapped in traditional pensions schemes or similar that can't be used to buy crypto yet. In which case this might be an option. Personally however I would have thought MSTR or Galaxy Digital Holdings is a better vehicle?",t3_mjom8c,2021-04-04 12:25:43,2021-04-04
2424,gtbm9s5,t3_mjom8c,coinbase is already a crazy valuation. and my least favorite exchange,t3_mjom8c,2021-04-04 13:59:40,2021-04-04
2427,gtbhxde,t3_mjom8c,"Yea never buy an IPO I guess. Wait for the dust to settle.

But really this is excellent news. It's great that they're hyping bitcoin because bitcoin's value is based off people's belief in it. It's just a shame that some retail investors will likely lose money on COIN.",t3_mjom8c,2021-04-04 12:59:08,2021-04-04
2428,gtc2ba0,t3_mjom8c,Who else would be underwriting it? C’mon now.,t3_mjom8c,2021-04-04 18:24:20,2021-04-04
2429,gtbdm9x,t3_mjom8c,Anything to help the coins is a good thing. I'm here for it.,t3_mjom8c,2021-04-04 12:05:44,2021-04-04
2430,gtcbuxm,t3_mjom8c,"People believe that banks will 'help' bitcoin destroy their 2000 year system? Really? 

Still it doesn't mean that changing tactics will help them. 🤣🤣🤣🤣",t3_mjom8c,2021-04-04 20:43:18,2021-04-04
2431,gtbrfs7,t3_mjom8c,"I think in the future Age of Bitcoin, companies P/Es are going to have to go back down to about 10, not 30, not 1000.

So let's see what happens

EDIT: well I guess you can have a stock mania at whatever PE and using any base money. But with bitcoin they're not getting bailouts, they can just suck it.",t3_mjom8c,2021-04-04 15:19:46,2021-04-04
2432,gtc7wuz,t3_mjom8c,"Ive been HODLin for four year. Recently with the pandemic and unemployment i started playing with Wall Street. Learned alot about the market. Its manipulated.  Its corrupt. Theres very little logic even though they said there is.  Made some wins, pulled those wins back into Bitcoin. Fuck Wall Street.  Wall street is unstable,  its value is based on perceived value.... basically insert every argument AGAINST BTC and it fits as a criticism of the Markets. HODL to Saturn guys and gals. The power goes to those that control the currrency. Time to take that back",t3_mjom8c,2021-04-04 19:51:19,2021-04-04
2433,gtbrg64,t3_mjom8c,"I'm a pathetic noob (2 months) here, but I have noticed that wild rides are promised pretty much every day. I hope you're right—I have a third of my meager savings in BTC! But it does seem like we're pretty optimistic in these parts.",t3_mjom8c,2021-04-04 15:19:57,2021-04-04
2434,gtcl6uh,t3_mjom8c,"I think Coinbase direct listing will cause regulatory issues for the next 2-3 years.  Here's why I think so:

The main issue is that Coinbase is being direct listed during a boom year.  First, for direct listing you have initial price discovery.  During this price discovery Coinbase is believed to be overpriced by 3x.  The overpricing is likely due to the boom year happening.  

The interesting question that arises from the issue, what will happen to Coinbase stock price once cryptos crash after the boom?  If Coinbase stock price prices in Crypto prices then Coinbase stock will be significantly overpriced.  Once boom stops then Coinbase stock is likely to drop.  Lots of people will lose money on Coinbase speculation.  What will be the result?  Crypto will be set back 2-3, maybe more, years based on possible regulations to protect the public.

In conclusion, I'm not really excited about the Coinbase direct listing.  It's very possible that a lot of people will get burned and it will set a bad precedent for Cryptos - just because the damn direct listing is in a boom year.",t3_mjom8c,2021-04-04 22:23:57,2021-04-04
2435,gtbwj8o,t3_mjom8c,"Who do you think is buying the bitcoin at 50k? LOL 

Goldman and JPM duhhh 

Goldman will have to announce that publicly on the 14th during their earnings call but it has been OBVIOUS that someone with deep pockets has been on the buy side for a few months?",t3_mjom8c,2021-04-04 16:45:20,2021-04-04
2436,gtc346j,t3_mjom8c, I guess,t3_mjom8c,2021-04-04 18:37:26,2021-04-04
2439,gtc6w0e,t3_mjom8c,"People from Goldman Sach and JP Morgan are pretty appreciated in the crypto world! I know some people behind the Unido were working in Goldman Sach, and that is one of the reasons I bought it! I agree with you that pump is coming. Big pump. Better prepeare yourself!",t3_mjom8c,2021-04-04 19:36:40,2021-04-04
2440,gtbx0e4,t1_gtbjxzz,"the trillion dollar market cap of bitcoin already legitimizes it

Wall street just wants to find a way to manipulate it eventually, which looks quite difficult, to near impossible",t3_mjom8c,2021-04-04 16:53:20,2021-04-04
2441,gtcif10,t1_gtbjxzz,This is the best comment I've read in weeks. I'm sorry I have no awards to offer you.,t3_mjom8c,2021-04-04 21:56:48,2021-04-04
2443,gtbrhds,t1_gtbfaed,"Or MARA, HUT, lots of good ones that have outperformed bitcoin itself so far",t3_mjom8c,2021-04-04 15:20:29,2021-04-04
2444,gtbz3ii,t1_gtbm9s5,"Same here. Was using Binance and tried Kucoin and Coinbase. Least fav was Coinbase. Kucoin is really good, I love the tabs you can have but the min deposit of fiat put me off using it. I like to top up a lot over the month when I have spare money",t3_mjom8c,2021-04-04 17:29:39,2021-04-04
2445,gtboqiv,t1_gtbm9s5,What're your favorites? You from the US?,t3_mjom8c,2021-04-04 14:36:53,2021-04-04
2446,gtc8w74,t1_gtbhxde,Yeah it would have been terrible to buy Tesla IPO....,t3_mjom8c,2021-04-04 20:04:58,2021-04-04
2447,gtcj0hn,t1_gtcbuxm,"I don't think it's as much as that as it is a competitive world and they worry they might get lost if they don't keep up. 

You're not wrong, of course companies will try their hardest to not have to change",t3_mjom8c,2021-04-04 22:02:51,2021-04-04
2448,gtcoayz,t1_gtcbuxm,"I read that Kodak developed digital photography way earlier than any other, but they did not want it to compete with their film industry, as it would get destroyed... and they miss out, and it happen anyway.",t3_mjom8c,2021-04-04 22:52:43,2021-04-04
2449,gtcgejl,t1_gtbrfs7,Why? Because of the limited supply of Bitcoin?,t3_mjom8c,2021-04-04 21:34:33,2021-04-04
2451,gtbrzsj,t1_gtbrg64,"bitcoin is a long term game, if you are here to make money quickly you will lose it all.",t3_mjom8c,2021-04-04 15:29:02,2021-04-04
2452,gtcjieo,t1_gtbrg64,"Don’t know if you noticed, but it has been a wild ride pretty much each day last year. We are operating at 10x compared to this time last year. Pretty wild imo.",t3_mjom8c,2021-04-04 22:07:46,2021-04-04
2460,gtbtbam,t1_gtbrhds,"> Or MARA,

is pretty anti-bitcoin because they censor transactions",t3_mjom8c,2021-04-04 15:50:42,2021-04-04
2461,gtby7a7,t1_gtbrhds,Sure Bro you go that pump and dump route.,t3_mjom8c,2021-04-04 17:14:05,2021-04-04
2462,gtbwtt8,t1_gtbrhds,Bitcoin is doing 200% gains on average over the last 10 years and you're claiming that something outperformed it? BLOCKED,t3_mjom8c,2021-04-04 16:50:13,2021-04-04
2463,gtbox9z,t1_gtboqiv,Kraken,t3_mjom8c,2021-04-04 14:39:50,2021-04-04
2464,gtc6vkw,t1_gtboqiv,Cash app or a decentralized exchange,t3_mjom8c,2021-04-04 19:36:29,2021-04-04
2465,gtcgnyy,t1_gtboqiv,Bittrex is the best imo. I find it easy to use. Lots of listings too.,t3_mjom8c,2021-04-04 21:37:16,2021-04-04
2466,gtbx9l2,t1_gtboqiv,"I'd buy from friends or family or go to a bitcoin meetup and buy in cash before dealing with coinbase, to each their own though 

In US I'd probably check Bisq, Paxful, Hodlhodl and Bluewallet with their P2P function in the wallet before I deal with Cashapp, Kraken or Gemini to get bitcoin --- Im  a bit of a purist though 

Coinbase setup their exchange specifically to fit into the banking infrastructure it also will be marketed as disrupting, I just dont trust them or their employees and seed round investors on ANY level here

The things they did when the bitcoin fork happened, that the SEC does not appear to care about the BCASH thing (they didnt let customers withdraw funds), it's just weird and odd to support an exchange like that",t3_mjom8c,2021-04-04 16:57:47,2021-04-04
2469,gtcowyq,t1_gtcoayz,Seems like you talk about Ethereum and their connection with banking industry... 😉,t3_mjom8c,2021-04-04 22:58:14,2021-04-04
2472,gtbssl2,t1_gtbrzsj,"Oh, no; I'm dumb but I'm not that dumb. I'm in for the foreseeable future—years if not decades. But I do have to chuckle about how  every week there's always somebody to insist we're on the verge of a 1000% gain. But in real life, ya, it seems clear that HODL is the best play.",t3_mjom8c,2021-04-04 15:42:05,2021-04-04
2478,gtbut63,t1_gtbox9z,"I tried kraken , you can’t send what you buy to a wallet. So i prefer coinmama. Im in the uk",t3_mjom8c,2021-04-04 16:16:10,2021-04-04
2483,gtc3q47,t1_gtbssl2,Yeah don’t listen to that noise. The market acts on information and if an already expected event doesn’t trigger the price then it’s priced in.,t3_mjom8c,2021-04-04 18:47:33,2021-04-04
2485,gtbv8mv,t1_gtbut63,What do you mean? I use Kraken and frequently move cryptos in and out of Kraken.,t3_mjom8c,2021-04-04 16:23:23,2021-04-04
2486,gtbxm3e,t1_gtbut63,no coinfloor or bittylicious for you there in the UK huh? Interesting because I have heard both are decent there,t3_mjom8c,2021-04-04 17:03:41,2021-04-04
2491,gtbxvou,t1_gtbv8mv,Where are you based,t3_mjom8c,2021-04-04 17:08:22,2021-04-04
2492,gtbxs8y,t1_gtbxm3e,Not tried those yet. Coinbase is sound as a wallet but i have real trouble getting my bank to allow the payments........,t3_mjom8c,2021-04-04 17:06:40,2021-04-04
2495,gtbz0bf,t1_gtbxvou,EU,t3_mjom8c,2021-04-04 17:28:03,2021-04-04
2496,gtchkno,t1_gtbxvou,"Ive asked kraken how to do it, im waiting for a response",t3_mjom8c,2021-04-04 21:46:43,2021-04-04
2497,gtbyx26,t1_gtbxs8y,"100% I have looked at all countries favourites/popular/early adopters and those two are popular in the UK (they cater specific to the countries banking system) 

Coinbase is a US company that tries to get into a market like the UK, Germany etc... its still a US company catering to US banks THEN scales out to other countries, the difference is huge in some countries",t3_mjom8c,2021-04-04 17:26:30,2021-04-04
2498,gtc9lr7,t1_gtbxs8y,"I'm in the UK too, I use revolut as a free intermediary between my bank and coinbase.",t3_mjom8c,2021-04-04 20:14:38,2021-04-04
2500,gtci3x8,t1_gtchkno,"Hey u/Aggressive_East2352,  


Totally can help ya out with this. What's going on? If you'd like, post on the r/KrakenSupport subreddit and we can take a look. You should be able to move stuff around no problem.   


\-Leo",t3_mjom8c,2021-04-04 21:53:29,2021-04-04
2590,gtcbgh4,t3_mjuz20,You might find it safer to not mention Bitcoin to your tinder matches,t3_mjuz20,2021-04-04 20:38:18,2021-04-04
2591,gtcefbq,t3_mjuz20,"Scam for sure. If investment comes looking for you, it is a scam no matter how it's packaged. You should be the one doing the looking!",t3_mjuz20,2021-04-04 21:13:03,2021-04-04
2592,gtc8w6n,t3_mjuz20,Scammers playing the long game lol,t3_mjuz20,2021-04-04 20:04:57,2021-04-04
2593,gtca8cn,t3_mjuz20,"The part where she said she made 21 Bitcoin could be true, I just feel sorry for the guys she scammed it from....",t3_mjuz20,2021-04-04 20:22:53,2021-04-04
2594,gtcbo9y,t3_mjuz20,"Wait, this story sounds very familiar.. like I had this but I wasn't too interested in her so I didn't engage much.(I'm based in Ireland)

She was Asian,  and same story staying with family near me.

She never mentioned crypto and I didn't talk about money. but occasionally she mentioned she was doing her ""investments"" for the day. I always found it odd and didn't engage further as I thought it might be the start of a scam.",t3_mjuz20,2021-04-04 20:41:01,2021-04-04
2595,gtcon3c,t3_mjuz20,"Nudes can be faked. See if she'll send you her private keys because ""that is the true sign of love!""",t3_mjuz20,2021-04-04 22:55:47,2021-04-04
2596,gtcnw1t,t3_mjuz20,"come on, why would you ever mention money of any kind on tinder, that's just asking for trouble.",t3_mjuz20,2021-04-04 22:49:03,2021-04-04
2597,gtcme71,t3_mjuz20,"She sounds friendly. Rich too. 

Click that link fella!",t3_mjuz20,2021-04-04 22:35:17,2021-04-04
2598,gtclqlx,t3_mjuz20,Simple. FaceTime,t3_mjuz20,2021-04-04 22:29:14,2021-04-04
2599,gtcbk0l,t3_mjuz20,Ask for a picture of underwear she shat in... to prove shes legit,t3_mjuz20,2021-04-04 20:39:32,2021-04-04
2600,gtcnjfo,t3_mjuz20,Most Bitcoin adopters are nerds slash anime weebs. These scammers know techies disgustingly fetishize Asians lol,t3_mjuz20,2021-04-04 22:45:52,2021-04-04
2611,gtcj7ia,t3_mjuz20,Did you video chat with her? How do you even know she really is a pretty asian girl apart from the photos she sent you? Could have been someone else’s photos...,t3_mjuz20,2021-04-04 22:04:48,2021-04-04
2630,gtcl6el,t1_gtcj7ia,I think op knows this.,t3_mjuz20,2021-04-04 22:23:50,2021-04-04
2655,gtcou9a,t3_mjxi92,Infinite,t3_mjxi92,2021-04-04 22:57:36,2021-04-04
2656,gtcp7q3,t3_mjxi92,No upper limit.  There is no central node.,t3_mjxi92,2021-04-04 23:00:51,2021-04-04
2659,gtcoa64,t3_mjxi92,I don't know why there would be an upper limit. Ten minutes is plenty of time for all nodes to be in agreement.,t3_mjxi92,2021-04-04 22:52:31,2021-04-04
2702,gtc6xr7,t3_mjt10x,true,t3_mjt10x,2021-04-04 19:37:25,2021-04-04
2703,gtcmp6q,t3_mjt10x,"And it doesn't take much for scammers to make a lot of reddit accounts to respond to the question and say ""Sure, this site gave me 850% gain in 3  days.""

Be wary and DYOR if it sounds too good to be true.",t3_mjt10x,2021-04-04 22:38:07,2021-04-04
2705,gtc40e5,t3_mjt10x,Wtf,t3_mjt10x,2021-04-04 18:52:07,2021-04-04
2706,gtchbql,t3_mjt10x,So bitmongoose.com is safe afterall?,t3_mjt10x,2021-04-04 21:44:05,2021-04-04
2707,gtclqgr,t3_mjt10x,"If you are coming here to ask, just do a post search. If you are the first person posting about it, yes it's a scam.",t3_mjt10x,2021-04-04 22:29:11,2021-04-04
2711,gtc5g77,t1_gtc40e5,"Allow me to explain further.

Scammers set up sites that lure people into giving them money for a promise of future riches.  Perhaps ""You have won 1 Bitcoin"" or ""Our trading system will give you 200% return in 2 weeks"" or somesuch bollocks.

These sites are trivial to set up and new ones appear every day.

Some of them are set up with names like existing legitimate services.  So if you want to ask if a site is safe, give us the full domain name.",t3_mjt10x,2021-04-04 19:15:13,2021-04-04
2712,gtc73hr,t1_gtc40e5,"/u/schooner-of-old no need to be so rude  


Good PSA /u/BakersDozen, thank you for elaborating on this, I remember having a scammer send me a link to a reputable reviewer website after I asked for proof that he has good reputation among his clients, with a supposed service getting good ratings. The domain was clearly different from the one they were showcasing.",t3_mjt10x,2021-04-04 19:39:38,2021-04-04
