,comment_id,comment_parent_id,comment_body,comment_link_id,created,date
3675,gnr5iwd,t1_gnr4zsy,You will be soon. I don’t think people grasp how wild these next few years can potential be,t3_lljc8p,2021-02-17 19:13:40,2021-02-17
3676,gnr5h8n,t1_gnr5bgm,Thank you so much 😊,t3_lljc8p,2021-02-17 19:12:57,2021-02-17
3677,gnr6lni,t1_gnr5ce7,"Yes I day trade altcoins and make a substantial income compared to the minimum wage of my country, land of the “free”. Thank you for the feedback. I most definitely will not sell my core bitcoin position, my wealth is important to me 😁",t3_lljc8p,2021-02-17 19:30:13,2021-02-17
3678,gnr6yoo,t1_gnr6vlw,Is there an easy setup for this or a video you can refer to me? I’m interested in mining as well 😁,t3_lljc8p,2021-02-17 19:35:39,2021-02-17
3679,gnr8n1j,t1_gnr8gp5,So awesome!! What’s it called? I’ll check it out 😁,t3_lljc8p,2021-02-17 20:00:06,2021-02-17
3681,gnqr74g,t1_gnqo834,That’s a career? 😂 Sign me up!,t3_lljc8p,2021-02-17 15:26:07,2021-02-17
3682,gnqw2tu,t1_gnqsmd4,"I hodl as well. My original post didn’t convey the fact that I’m not selling my bitcoin, it simply has provided me the security net I need to leave. I say find a passion and make that a business. You seem pretty accomplished, I’m sure your true calling is much greater!",t3_lljc8p,2021-02-17 16:36:29,2021-02-17
3683,gnr1ghx,t1_gnqcxp5,"I got enough fiat to last me a few years!!! I’ll be okay, but I won’t sell my BTC. I’m in the minority that believe we’re in a super cycle. No 85% correction, just a few years of market entries by big players. 20-60% corrections max, as retail sell their BTC to institutions. These big players will create a floor on the price, they are NOT selling, that’s not how they roll...",t3_lljc8p,2021-02-17 18:06:46,2021-02-17
3685,gnqsewa,t1_gnqjdqb,"I’m researching! Lots to sift through, but I’m so motivated to start this new journey! Thank you!",t3_lljc8p,2021-02-17 15:42:10,2021-02-17
3686,gnqruqd,t1_gnqlash,Hmmm I may need to look into that. Any idea on start up costs to run an ETH node? I assumed a small operation wouldn’t be profitable 😩,t3_lljc8p,2021-02-17 15:34:43,2021-02-17
3687,gnqranj,t1_gnqnbo8,Of course! Find your passion and make it a business! That’s the best way to live life IMO,t3_lljc8p,2021-02-17 15:27:24,2021-02-17
3688,gnqquzg,t1_gnqq5yv,"Definitely! I would never advocate people just jump ship on solely BTC, but it’s given my wealth a reliable floor, and I’m most grateful for it!",t3_lljc8p,2021-02-17 15:21:41,2021-02-17
3689,gnqvpnt,t1_gnqtl5x,"I have what I need for a few years in fiat, so no need to be tempted selling my BTC position. I’m sure those that suffered during the last bear market simply didn’t research enough. But with institutional players entering, I don’t think this correction will be as brutal as the others, just my opinion.",t3_lljc8p,2021-02-17 16:30:33,2021-02-17
3690,gnqrrho,t1_gnqlkvr,"Most definitely! My bitcoin is my wealth, not my salary!",t3_lljc8p,2021-02-17 15:33:32,2021-02-17
3692,gnqo2e2,t1_gnqcf42,Diversify as in 2 bitcoin instead of 1?,t3_lljc8p,2021-02-17 14:46:25,2021-02-17
3693,gnqksb7,t1_gnqcf42,Does buying DOGE count as diversifying? Asking for a friend.,t3_lljc8p,2021-02-17 14:08:05,2021-02-17
3695,gnr2yq0,t1_gnqlnug,"For sure. I don't understand how some people seem satisfied to work a job until they're 60. More power to them if they're happy, but I've wanted to escape the system from the moment I understood what it was.",t3_lljc8p,2021-02-17 18:32:07,2021-02-17
3696,gnqj2hw,t1_gnqi67h,"""Fuck you"" money",t3_lljc8p,2021-02-17 13:49:17,2021-02-17
3697,gnqoo5p,t1_gnqi67h,Usually staying single and childfree is one of the key steps,t3_lljc8p,2021-02-17 14:53:53,2021-02-17
3698,gnqtjlu,t1_gnqi67h,"take a look at /r/fire

sub description:
FI/RE (Financial Indpendence / Retiring Early) is a money movement that's sweeping the nation. By fighting for your financial freedom, you can begin to control your own destiny.

The basic rule of thumb to aim for is: have 25x your yearly expenses invested. History tells us you can take 4% of your starting capital every year and never run out, assuming it's invested in a safe stocks/bonds mix. That history includes the 1929 crash and the 1980s inflation.",t3_lljc8p,2021-02-17 15:57:56,2021-02-17
3699,gnr4v8k,t1_gnqi67h,Also /r/leanfire,t3_lljc8p,2021-02-17 19:03:20,2021-02-17
3700,gnr4vw7,t1_gnqnowj,"As others have mentioned: no kids, no partner, no pets. I'm not a social person. It helps enormously to have the salary of a software engineer. I won't deny that I am privileged. 

The trick was that I never expanded my lifestyle after leaving college. I just kept living like a scrappy college student, even when I could afford not to.

I've always been careful to control the **big three**: housing, transportation, and food. These are the areas where you can **unconsciously** spend large amounts of money.

Whenever I took a job, I would find the cheapest housing I could within walking or biking distance, even if it was a tiny room in someone's house. Food has always been the hardest category to control, for me.

This lifestyle... is not for everyone. It is difficult to work a job you hate when you don't even get to enjoy the fruits of your labor.",t3_lljc8p,2021-02-17 19:03:37,2021-02-17
3701,gnqo2pm,t1_gnqnowj,Probably no kids?,t3_lljc8p,2021-02-17 14:46:31,2021-02-17
3702,gnr1mwn,t1_gnqnowj,Living at home with parents ;),t3_lljc8p,2021-02-17 18:09:49,2021-02-17
3703,gnr2rh5,t1_gnqix4n,"I grew up in a military family. We moved every 2\~4 years, so I find myself getting really antsy if I stay in one place for too long. I rent because it is more flexible.

That being said, I've been considering a house lately. Now that I don't work, I kinda' want a doggo or a catto. It never felt right to abandon a pet at home for 8 hours a day, so I held off while I had a job. But maybe it makes sense now, especially if I settle down.",t3_lljc8p,2021-02-17 18:28:49,2021-02-17
3706,gnr4l36,t1_gnqe4if,A lil more than 1/10th checking in,t3_lljc8p,2021-02-17 18:58:49,2021-02-17
3707,gnr47gz,t1_gnqi7bk,"Eh. In a few years, assuming you'd be willing to relocate to a low COL country, 0.5 BTC could absolutely allow a frugal but comfortable lifestyle even for a younger person.",t3_lljc8p,2021-02-17 18:52:38,2021-02-17
3708,gnqjkl6,t1_gnqiwu3,^THIS. I expect the same. This is also in line with the stock 2 flow model which predicts BTC price will overshoot $280k by 2x-3x and average $280k until 2024 halving,t3_lljc8p,2021-02-17 13:54:39,2021-02-17
3710,gnr1hit,t1_gnqiwu3,"Yes, 6m per bitcoin is definitely realistic.",t3_lljc8p,2021-02-17 18:07:15,2021-02-17
3712,gnr9vyd,t1_gnqsph6,"I think if anything, I’m more pleased to hear that you knew that you should quit a job that makes you unhappy. Good for you and I’m pleased that Bitcoin let you do that and gave you that opportunity. Well done and here’s to you starting a new adventure on your own terms x",t3_lljc8p,2021-02-17 20:17:12,2021-02-17
3714,gnrayej,t1_gnqkqhd,"Ok so, in my experience, this doesn't happen unless you really work for a terrible employer.  Good managers retain people and can make the workplace great. If you work at a place where you don't want to work, I know it's hard, but finding another place of employment will draw out happiness for you in spades, long term.",t3_lljc8p,2021-02-17 20:31:00,2021-02-17
3715,gnra2fx,t1_gnqycbw,i can tell you it will become waaaaay smaller.,t3_lljc8p,2021-02-17 20:19:33,2021-02-17
3716,gnqj931,t1_gnqdh4k,One doesnt sell bitcoin,t3_lljc8p,2021-02-17 13:51:12,2021-02-17
3717,gnrli18,t1_gnqdh4k,Why would you ever sell your appreciating money for depreciating currency?,t3_lljc8p,2021-02-17 22:21:06,2021-02-17
3719,gnrcj1b,t1_gnr8xux,"No, if BTC ever hit $20k",t3_lljc8p,2021-02-17 20:50:06,2021-02-17
3720,gnqvev0,t1_gnqtwxl,60 is young these days. My in-laws didn’t even learn to ski until they were in their 60s,t3_lljc8p,2021-02-17 16:25:37,2021-02-17
3722,gnqprby,t1_gnqgb9x,"Eth gonna have to step it up.

> each wire can be up to $250,000. The fee is $30 though.",t3_lljc8p,2021-02-17 15:07:31,2021-02-17
3723,gnqpzad,t1_gnqgb9x,">I also wired money to the title company for my house (we’re under contract now) and they said on the website that each wire can be up to $250,000. The fee is $30 though.

Hey look at that, another use case for crypto! No limit on transaction amount.",t3_lljc8p,2021-02-17 15:10:21,2021-02-17
3724,gnqfodj,t1_gnqaz2z,Because one's consciousness and time is finite.,t3_lljc8p,2021-02-17 13:14:26,2021-02-17
3725,gnqdniw,t1_gnqaz2z,Memories of 2017? Could crash for a couple years and then your churn rate would be kinda bad especially as you could no longer lower your cost basis.,t3_lljc8p,2021-02-17 12:54:57,2021-02-17
3726,gnqqlp3,t1_gnqaz2z,"> Why would you cash out something that only grows

You must be new here.",t3_lljc8p,2021-02-17 15:18:21,2021-02-17
3727,gnqmj5q,t1_gnqaz2z,Because sometimes life needs to grow.,t3_lljc8p,2021-02-17 14:28:06,2021-02-17
3728,gnqv7d2,t1_gnqaz2z,"Until the blockchain has real estate with a pool and a beach, people are going to cash out.",t3_lljc8p,2021-02-17 16:22:14,2021-02-17
3730,gnqhzpu,t1_gnqfsyl,"When did I say I was making any income from crypto?

It's there for when I need it, but I have plenty of other money as well.",t3_lljc8p,2021-02-17 13:37:47,2021-02-17
3731,gnqily9,t1_gnqfsyl,"OP didn't say they didn't sell it, but you can earn income from BlockFi on your crypto and retire on that, or you can use your bitcoin as collateral and take a cash loan to find your lifestyle or a big purchase",t3_lljc8p,2021-02-17 13:44:23,2021-02-17
3732,gnqgsyp,t1_gnqfsyl,Nowadays you can stake digital currency for a return using the forbidden coins oooooo spooky,t3_lljc8p,2021-02-17 13:25:36,2021-02-17
3733,gnqh253,t1_gnqfsyl,"BlockFI, celcius, hodlhodl",t3_lljc8p,2021-02-17 13:28:11,2021-02-17
3734,gnr8cmh,t1_gnqiyg3,Yep,t3_lljc8p,2021-02-17 19:56:07,2021-02-17
3735,gnqrq6q,t1_gnqrf6z,"You are most welcome, and I wish you nothing but the best!",t3_lljc8p,2021-02-17 15:33:03,2021-02-17
3736,gnqqvsr,t1_gnpwcmz,"Well put, keep that drone language outta here.",t3_lljc8p,2021-02-17 15:21:58,2021-02-17
3737,gnpy3oy,t1_gnpwcmz,If you have enough Bitcoin to not worry about having marketable skills you probably wouldn’t be hanging around on Reddit. Wish you the best tho,t3_lljc8p,2021-02-17 10:32:13,2021-02-17
3738,gnqadr4,t1_gnq72pv,"It can be less if you make more money, by having that money (dividends/interest) and work just a part time job or something.",t3_lljc8p,2021-02-17 12:24:18,2021-02-17
3739,gnrjgah,t1_gnq72pv,\^ this.,t3_lljc8p,2021-02-17 22:02:09,2021-02-17
3740,gnqifms,t1_gnqg01j,I worked at Tesla for years and accumulated a lot of stock. I'll be living off of that for years before I ever need to touch my bitcorns.,t3_lljc8p,2021-02-17 13:42:31,2021-02-17
3741,gnqprey,t1_gnqi5w8,Nailed it,t3_lljc8p,2021-02-17 15:07:33,2021-02-17
3742,gnqegly,t1_gnq6f7z,"Yeah, it’s not enough. Imagine the bull run is over, I don’t think so but let’s assume worst case. It goes back to 30k and stays there for 3 years. 

Still not bad but it wouldn’t last till the next halving, even if it did you would have spend like 90% of it.

Need to tough it out a bit longer. Not easy. It’s a nasty twilight zone of not enough to stop working but enough to get your hope up. I think a lot of us are in that situation, not all of us have happy jobs either. 2x to 10x is what we need.",t3_lljc8p,2021-02-17 13:02:42,2021-02-17
3743,gnqopy4,t1_gnq6f7z,"I made enough to cover my credit card debts and capital gains tax.

I cashed out, and I'm planning on dropping my tax return and stimulus check into bitcoin this time around. Now I got extra buying power to DCA in as well. I'm stacking sats until the next halving.",t3_lljc8p,2021-02-17 14:54:29,2021-02-17
3744,gnrj59v,t1_gnr1n0j,"That's great!👍

I hope you do well!",t3_lljc8p,2021-02-17 21:59:14,2021-02-17
3745,gnqim6w,t1_gnqi0p8,"yeah, i was referring to other indicators more like fiat printing/ hyper inflation and overvaluation of property and other assets, I hope I'm wrong tho.  also I dont kbow a whole lot about this stuff but have looked a little into it.",t3_lljc8p,2021-02-17 13:44:28,2021-02-17
3747,gnqsve5,t1_gnqsr26,You degenerate. Step by step. lol. Take care.,t3_lljc8p,2021-02-17 15:48:28,2021-02-17
3748,gnquyg6,t1_gnqrye6,"Thanks. What doen't kill you.....
I guess I am lucky because I have no fear of starting over. In fact I packed a suitcase and moved to Europe with my last pennies. Now I am on the way back up after a few years of travelling adventures. 
BTC is my base and realestate is my end game. But I will not sell my BTC. :-)

Marriage is a myth.",t3_lljc8p,2021-02-17 16:18:20,2021-02-17
3749,gnrb1at,t1_gnraeq6,"Oh no, I hate my job lol... I do it because I want to be a multimillionaire in a couple years instead of 5.",t3_lljc8p,2021-02-17 20:32:01,2021-02-17
3750,gnqlvli,t1_gnq0xll,This is the slave world that we live in. People are so demoralized by the establishment that they can think of no better way to spend their limited days on this planet than slaving away for the system and consuming. Sad.,t3_lljc8p,2021-02-17 14:20:33,2021-02-17
3751,gnq2yh0,t1_gnq0xll,This 👏,t3_lljc8p,2021-02-17 11:15:01,2021-02-17
3753,gnqb1s9,t1_gnq5fef,"I recommend jumping out of a perfectly good plane at least one time in your life.

If you knew me, you'd never guess I was the kind of person to skydive. But I did it on a whim once when I was on vacation in Kauai. 

It was a blast. I couldn't get the smile off my face.",t3_lljc8p,2021-02-17 12:30:33,2021-02-17
3754,gnrlhs5,t1_gnq5fef,Agree. Those things might be dangerous and you might die. But if I were to just stay at home behind my computer screen I'm already dead.,t3_lljc8p,2021-02-17 22:21:02,2021-02-17
3755,gnqod27,t1_gnq6ql2,"I'm not the person you responded to, but the ideal scenario to me would be to accumulate enough to live comfortably on like 2-3% interest so that my wealth doesn't gradually diminish and I end up actually living to 90+ with no money in the bank. But then again, in a very real sense, YOLO and you can't take your money with you. I'd just be worried if I wasn't working that I'd burn money on stupid shit a lot more than I do now.",t3_lljc8p,2021-02-17 14:50:03,2021-02-17
3756,gnqzmxq,t1_gnqtdr6,"Ohh.... ok, thanks. Good luck! :)",t3_lljc8p,2021-02-17 17:35:37,2021-02-17
3757,gnrpfuu,t1_gnqrmzq,"I bought at around 34,000 and buying at dips, total $500 invested and I’ve made $70. That’s just in like a 2 week span. I plan to buy at even smaller dips, this coin is EXTREMELY steady. I have a little over .01",t3_lljc8p,2021-02-17 22:54:47,2021-02-17
3758,gnqulkz,t1_gnqrccb,I need that energy,t3_lljc8p,2021-02-17 16:12:57,2021-02-17
3759,gnqv5db,t1_gnqqy0u,My whole bitcoin journey has been for this purpose only. As soon as that passive income beats my full time wage cage I'm done. DONE!!! Plus with fuck you money I can be completely independent. No label. No manager. Just me in my boxer shorts at 3am writing baselines.,t3_lljc8p,2021-02-17 16:21:22,2021-02-17
3760,gnr0om3,t1_gnquoqv,"It makes me sad to see people saying that--  From day _one_ it was [pretty obvious](https://bitcointalk.org/index.php?topic=144471.0) that XRP was a scam.  Trillion pre-mined coins, completely centralized, bought an existing project's name in order to steal the reputation created through remarks people made about an entirely different system.  And in the recent litigation it's now been made public that they were, in fact, paying for the little supposed adoption they had-- in other words it's all fake.

There is absolutely a place in the world for centralized databases.  But there is no reason for some centeralized database to print a new currency out of thin air and award it to its creators--  except to make them unfathomably rich by exploiting people who don't have the time or technical background to see through the scheme.

And sure, the SEC is pathetic and weak and basically just goes away with a few million in a settlement bribe,  so it's *possible* that the remaining XRP holders will find greater fools to dump their coins on in the future and won't be too undercut by the xrp operators/founders doing the same.  But it's also extremely possible for it to go the other way.

And at the end of the day if your bet is basically that there will be enough sucker out there to keep buying it an make some more money-- well, it might be true but if that's the game you're playing then it kinda makes you a scammer too.",t3_lljc8p,2021-02-17 17:53:21,2021-02-17
3761,gnqxxgi,t1_gnquoqv,"Well XRP is worthless so if you'd make a profit from holding it, you'd be making that profit on the back of unknowing newbies, which is something my conscience would prevent me from doing.",t3_lljc8p,2021-02-17 17:07:02,2021-02-17
3762,gnr4uxh,t1_gnquoqv,🤮🤮🤮 Scam 🤮🤮🤮,t3_lljc8p,2021-02-17 19:03:11,2021-02-17
3763,gnqv8qk,t1_gnquoqv,[removed],t3_lljc8p,2021-02-17 16:22:50,2021-02-17
3764,gnrex7d,t1_gnquoqv,Pumping shitcoins will get you banned here. Final warning.,t3_lljc8p,2021-02-17 21:16:55,2021-02-17
3765,gnr0bgq,t1_gnr081y,"Yeah it starts to be a bit ridiculous when you look at what 8 hours a day of your life is worth in the rat race.

Good luck and enjoy :)",t3_lljc8p,2021-02-17 17:47:08,2021-02-17
3766,gnr0rze,t1_gnr054t,"Good job to u. 

Thks for your encouragement.

I hope so, too hard but i try to be patient.",t3_lljc8p,2021-02-17 17:54:56,2021-02-17
3767,gnr1po5,t1_gnr0wu4,That's great. And I fully agree with your supercycle stance.,t3_lljc8p,2021-02-17 18:11:08,2021-02-17
3768,gnrcc2b,t1_gnr6yoo,I mine a few coins. Some require ASIC’s some use GPUs. Both are similar but different. What coin do you want to mine? Or do you just want to mine?,t3_lljc8p,2021-02-17 20:47:53,2021-02-17
3769,gnr8qyc,t1_gnr8n1j," It's called Seajay Games. The first game I am publishing is ""Galactic Era"". [https://galacticera.net/](https://galacticera.net/)",t3_lljc8p,2021-02-17 20:01:36,2021-02-17
3770,gnr7bad,t1_gnr1ghx,"Yea that's possible. I believe in big numbers, and 10 billion people will beat all institutions that in fact have nothing of value - since we are now finding out that fiat is worthless. 10 billion people do have something of value: entrepreneurial spirit and labour power.",t3_lljc8p,2021-02-17 19:40:55,2021-02-17
3772,gnqtqbe,t1_gnqsewa,Riding in the same boat as you sir. Wish you all the best for the future !,t3_lljc8p,2021-02-17 16:00:33,2021-02-17
3774,gnqrrl2,t1_gnqquzg,"Even though it has made a lot of people a massive fortune I don’t think I’d ever retire ahead of time unless I had a couple million stacked away in something that will give me a passive income
Like properties  until then I’ll just keep a part time job to pay for small things like my car / rent / weekly food shop and things like that",t3_lljc8p,2021-02-17 15:33:34,2021-02-17
3776,gnr4g3d,t1_gnqksb7,"Short answer: no

Long answer: nope 

(Ok technically I guess yes but be prepared to lose pretty much all of it)",t3_lljc8p,2021-02-17 18:56:32,2021-02-17
3777,gnql9ie,t1_gnqksb7,I’m the friend asking,t3_lljc8p,2021-02-17 14:13:30,2021-02-17
3778,gnqlt4b,t1_gnqksb7,Say hi to Elon for me.,t3_lljc8p,2021-02-17 14:19:47,2021-02-17
3781,gnqlcoe,t1_gnqksb7,Why yes it does my fellow doge HODLer!,t3_lljc8p,2021-02-17 14:14:32,2021-02-17
3782,gnr5hef,t1_gnqoo5p,"I’m neither and I could retire today in my 30’s and support the entire family.

Helps that I bought TSLA in 2011 and BTC in 2015.

So, be single and kid free. Or buy meme investments ;)",t3_lljc8p,2021-02-17 19:13:01,2021-02-17
3783,gnr1tjn,t1_gnqoo5p,This definitely describes me.,t3_lljc8p,2021-02-17 18:12:58,2021-02-17
3785,gnrazwa,t1_gnqoo5p,"This is me.  I went backwards financially while married.  Being divorced with no kids allowed me to dig myself out of the hole and then some.  In a very real sense, the alimony I paid was the best investment of my life, since it freed me up to invest in BTC later.",t3_lljc8p,2021-02-17 20:31:31,2021-02-17
3786,gnr2xo4,t1_gnqtjlu,There should be a subreddit for fire by bitcoin,t3_lljc8p,2021-02-17 18:31:38,2021-02-17
3787,gnr1sar,t1_gnqtjlu,"Basically this. Except, when I started, it was called ERE (Early Retirement Extreme).",t3_lljc8p,2021-02-17 18:12:22,2021-02-17
3788,gnrjvpy,t1_gnqtjlu,"What happens when stocks and bonds no longer work because interest rates/macro? The reason I bought any bitcoin is because every investment has been forced up the risk curve.

I definitely think it's smart to cash out a percentage of bitcoin into something else as it inevitably takes over the portfolio, but do these people get bitcoin?",t3_lljc8p,2021-02-17 22:06:15,2021-02-17
3792,gnrc5q0,t1_gnr4vw7,"While an 80% saving of income is a nice thought, why would you waste away your youth living on the tightest budget only to, say 20 years later; retire with a shedload of money, no friends or social life, no wife or kids, a bread and butter lifestyle to look back on..

You have one life, why not use it to the fullest and actually indulge in a comfortable one, money is worthless in the grand scheme of things.

Couldn't be me..",t3_lljc8p,2021-02-17 20:45:47,2021-02-17
3793,gnqo9wv,t1_gnqo2pm,"Even with no kids that's a staggering percentage. I'd bet on a nice salary, potentially no mortgage or a small house payment, but even then, 80%!?",t3_lljc8p,2021-02-17 14:48:58,2021-02-17
3794,gnqohge,t1_gnqo2pm,No partner 😂,t3_lljc8p,2021-02-17 14:51:33,2021-02-17
3795,gnr7qd1,t1_gnr1mwn,I wish. Multi-generational housing makes way more sense than forcing every kid to buy their own.,t3_lljc8p,2021-02-17 19:47:06,2021-02-17
3796,gnrhfus,t1_gnr2rh5,"Catto takes 10% the energy to take care of compared to Doggo so they are a good start if you have never had a pet.  However Catto personalities are across the board so I would recommend either adopting and older Catto with a sweet personality or an Older Catto with sweet personality and a Kitten at the same time.  Kitto will learn from good natured Catto and you do the shelters a service since its harder for older Catto to find homes.   Make sure Kitto and Catto meet at the shelter and are a good match.  

Doggo are awesome, always excited to see you.  Sleep on your bed, happy and content with nothing but your attention.  Humans and Dogs have a special bond, its written into our DNA, we have evolved together.  No matter what life throws at me I can always count on Doggo.  We have a Catto and two Doggo, a lot by most standards, one Doggo chose us :)  I wouldn't have it any other way.",t3_lljc8p,2021-02-17 21:42:52,2021-02-17
3798,gnr9jpg,t1_gnr4l36,0.19 for me. We have a long wait.,t3_lljc8p,2021-02-17 20:12:37,2021-02-17
3799,gnr145i,t1_gnqjkl6,Mine is the gold market cap. So about 10x from the current price. So kinda depends on how much gold will be worth.,t3_lljc8p,2021-02-17 18:00:47,2021-02-17
3801,gnrk1bl,t1_gnr1hit,I wonder how ridiculous this would have sounded back when BTC was back at $500,t3_lljc8p,2021-02-17 22:07:45,2021-02-17
3804,gnr341y,t1_gnqj931,"and here‘s the fitting meme:

https://i.pinimg.com/originals/38/ab/52/38ab529815f55064db140e235a8d8820.jpg",t3_lljc8p,2021-02-17 18:34:36,2021-02-17
3805,gnrk2o8,t1_gnqj931,Like one doesn’t sell GME,t3_lljc8p,2021-02-17 22:08:06,2021-02-17
3807,gnria6k,t1_gnqvev0,20s and still dont know how to ride a bike,t3_lljc8p,2021-02-17 21:51:03,2021-02-17
3810,gnqq662,t1_gnqpzad,"Believe me, I’m hating banks right now. I know the systems are ancient and they could really benefit from crypto, but they are highly regulated and slow to adopt new technology without decades of secure services under their belt. The revolution is only getting started my friend.",t3_lljc8p,2021-02-17 15:12:50,2021-02-17
3811,gnqn1ms,t1_gnqfodj,"Sucker, I'm planning to copy my consciousness to the blockchain.",t3_lljc8p,2021-02-17 14:34:09,2021-02-17
3812,gnqre8f,t1_gnqdniw,"It crashed 80% in 2011, 2013, 2017 and it will do it again in 2021/2022.

4 year cycle, halvening in between, 2 year dump 2 year pump.",t3_lljc8p,2021-02-17 15:28:44,2021-02-17
3813,gnqs1rz,t1_gnqqlp3,Technically it does only grow if you zoom out to a 10 year period,t3_lljc8p,2021-02-17 15:37:19,2021-02-17
3814,gnqi3lc,t1_gnqhzpu,"Ohhhhh....right. I'm new to the world of investing, and making money work for you.",t3_lljc8p,2021-02-17 13:38:58,2021-02-17
3815,gnqiyv9,t1_gnqily9,"Thanks! Will do some googling on BlockFi. 

Taking cash loans against coins require it to be paid back though...so unless you have an income you can't go spending it all...? Unless there's a way that a rise in the value of BTC pays the loan back some how?",t3_lljc8p,2021-02-17 13:48:13,2021-02-17
3816,gnpzphj,t1_gnpy3oy,"You may have noticed that life as we know it is on pause, so flights to Ibiza have lost some allure. Reddit, however, has not.",t3_lljc8p,2021-02-17 10:46:17,2021-02-17
3817,gnqgml3,t1_gnpy3oy,Are you implying rich people don’t Reddit? Everyone needs to shoot the shit sometimes no matter the size of their portfolio.,t3_lljc8p,2021-02-17 13:23:47,2021-02-17
3818,gnqihhq,t1_gnpy3oy,Why wouldn't you be on Reddit just because you're rich?,t3_lljc8p,2021-02-17 13:43:04,2021-02-17
3819,gnqlz4v,t1_gnpy3oy,"Back in the early days of the sub, major players in this space were in t sub posting just like you and me.",t3_lljc8p,2021-02-17 14:21:41,2021-02-17
3821,gnqf2co,t1_gnqadr4,it’s not about the amount made but one can actually save in the long run,t3_lljc8p,2021-02-17 13:08:32,2021-02-17
3822,gnqpgiv,t1_gnqegly,"Worst case is $0, not 30k.

Don't get me wrong, hodling what I've got, but you cannot depend on your crypto holding value.  You can certainly hope though :)",t3_lljc8p,2021-02-17 15:03:41,2021-02-17
