,comment_id,comment_parent_id,comment_body,comment_link_id,created,date
1663,grejr29,t3_m7ucg3,How will bitcoin affect small community banks?,t3_m7ucg3,2021-03-19 04:24:19,2021-03-19
1664,greq5v5,t3_m7ucg3,"They’re not running. They see a money making opportunity and they’re taking it. They’re banks, that’s what banks do.",t3_m7ucg3,2021-03-19 05:12:01,2021-03-19
1665,grer0es,t3_m7ucg3,"The more of these institutions that get involved, the harder it's going to be for a government agency to ban bitcoin. Politicians don't work for the citizens, they work for the corporations with the deepest pockets and loudest lobbyists.",t3_m7ucg3,2021-03-19 05:18:37,2021-03-19
1666,grer3n3,t3_m7ucg3,"Bank of America BAC was on fire today. it cooled off later, but still. It is amazing to watch all these folks that have talked trash about Bitcoin suddenly change their tune",t3_m7ucg3,2021-03-19 05:19:18,2021-03-19
1667,grew2p8,t3_m7ucg3,DAMN RIGHT !!,t3_m7ucg3,2021-03-19 05:57:49,2021-03-19
1668,grf1f2c,t3_m7ucg3,nobody falls only halfway down the stairs,t3_m7ucg3,2021-03-19 06:40:14,2021-03-19
1669,grf4vt5,t3_m7ucg3,"Basically they created an ETF with:

Microstrategy
|Square
|Riot
|Nvidia
|Paypal
|Amd
|Tsm
|Ice
|Cme
|Overstock
|Silvergate

Then they want you to invest and rape you with their fees in this ETF, which you do not own any crypto, you don’t get any dividends and when you want to realise profits in case the ETF does well in the future, they get their fees just because they have a name and reunited all these companies in the ETF. Which is something you can do by yourself investing in all these companies and actually getting a real value in the market. Only dumb people would invest in their ETF. They basically say they don’t believe in crypto but still want to get people’s money.",t3_m7ucg3,2021-03-19 07:08:39,2021-03-19
1670,grf5aqn,t3_m7ucg3,">Bank of America believes there’s only one reason to own bitcoin: speculation on its rising price.

Um.. isn't that the only reason to own ANYTHING they sell?",t3_m7ucg3,2021-03-19 07:12:03,2021-03-19
1671,grf5egf,t3_m7ucg3,isn't that always the M.O.?,t3_m7ucg3,2021-03-19 07:12:52,2021-03-19
1672,grf60ks,t3_m7ucg3,What’s BofA?,t3_m7ucg3,2021-03-19 07:17:52,2021-03-19
1673,grf6udw,t3_m7ucg3,"Running scared? Nah, they're just trying to make a profit like most people involved in Bitcoin.",t3_m7ucg3,2021-03-19 07:24:36,2021-03-19
1674,grf88da,t3_m7ucg3,https://opensea.io/assets/0x495f947276749ce646f68ac8c248420045cb7b5e/58991992642373367548041980351788662805823849799676291683918286797379230236673,t3_m7ucg3,2021-03-19 07:36:07,2021-03-19
1675,grf8gnx,t3_m7ucg3,ALL FUCKING IN!!,t3_m7ucg3,2021-03-19 07:38:02,2021-03-19
1676,grf8zvl,t3_m7ucg3,Hey guys I recently started accepting Bitcoin as payment at my dealership. The truck that was purchased was worth approximately 3/4 of a coin and at the time of purchase Bitcoin was around 60k. I am definitely a holder but does the community believe it will drop significantly before it shoots back up? Should I sell now and wait to buy it back after the institutions manipulate it down? Thanks in advance,t3_m7ucg3,2021-03-19 07:42:22,2021-03-19
1677,grfbkkl,t3_m7ucg3,They will only buy it or hold it for its clients to manipulate its price as they do with metals...silver in particular.,t3_m7ucg3,2021-03-19 08:04:09,2021-03-19
1678,grff8o4,t3_m7ucg3,I love that they want me to pay money for an article telling me there's no reason to own BTC.,t3_m7ucg3,2021-03-19 08:35:26,2021-03-19
1679,grfhjre,t3_m7ucg3,Never underestimate your enemy.,t3_m7ucg3,2021-03-19 08:55:13,2021-03-19
1680,grfjv3h,t3_m7ucg3,No shocker there.  The F-ckers have been manipulating the markets for decades.,t3_m7ucg3,2021-03-19 09:15:29,2021-03-19
1681,grfme94,t3_m7ucg3,"I don't think they are running scared. They just see an opportunity to milk people with FOMO tendencies. 

It's hilarious how some random commoners think they know more about money than these giants who eat people like them for breakfast.",t3_m7ucg3,2021-03-19 09:37:38,2021-03-19
1682,grfms76,t3_m7ucg3,Binance Exchange: Webdollar (Webd) to be listed on Binance exchange. - Sign the Petition! chng.it/N82rz9Vn prin @Change,t3_m7ucg3,2021-03-19 09:41:01,2021-03-19
1683,grfopbo,t3_m7ucg3,"There are arguments against bitcoin but this has to be the stupidest one. “It isn’t a good store of value because it’s volatile”. It’s up 13,000% the last 5 years, why would you care if it’s volatile if overall it is massively increasing in value? So I turned $1000 into $100,000 then it volatility caused it to drop to 30,000. Oh no! What an awful store of value for my $1000 that I made 30x my investment. 

Would you rather make 1000% on your money with high volatility or 50% with no volatility? 

If you are making an argument against bitcoin, it has to be based against its future, not how it has performed so far.",t3_m7ucg3,2021-03-19 09:58:09,2021-03-19
1684,grfpk18,t3_m7ucg3,“But this time it’s different guys I swear”,t3_m7ucg3,2021-03-19 10:05:58,2021-03-19
1685,grfr0qw,t3_m7ucg3,They’re protecting the wealth of their elite clients!,t3_m7ucg3,2021-03-19 10:19:31,2021-03-19
1686,grfxop3,t3_m7ucg3,You want to make good profits via Bitcoin contact mr gilly_markson_ on IG,t3_m7ucg3,2021-03-19 11:21:51,2021-03-19
1687,grfy6s1,t3_m7ucg3,"It takes a while to 'turn around' the opinions in these traditional financial institutions. The knobs there are so entrenched in their ways and thought patterns that it has taken 11 years (and counting) for them to recognize the promise of new, programmable, distributed, trustless money.",t3_m7ucg3,2021-03-19 11:26:43,2021-03-19
1688,grfzxj0,t3_m7ucg3,"Recently seeing a building stream of fear articles about regulation risk in the financial press.
This theme could grow and create a buying opportunity",t3_m7ucg3,2021-03-19 11:43:58,2021-03-19
1689,grg0u48,t3_m7ucg3,"""running scared""

Lmao give me a break

They control a huge influence over the market and are making huge profits by manipulating assets. Like or not bug institutions like these are gonna be gaming the system for all eternity.",t3_m7ucg3,2021-03-19 11:53:08,2021-03-19
1690,grg6fky,t3_m7ucg3,“ Bitcoin is a fraud worse than tulip bulbs...it will eventually blow up” - Jamie Dimon est.2017,t3_m7ucg3,2021-03-19 12:54:01,2021-03-19
1691,grgabvx,t3_m7ucg3,"  

Never seen JP Morgan said anything bad about bitcoin but they are fools themselves",t3_m7ucg3,2021-03-19 13:44:07,2021-03-19
1692,grgd5u6,t3_m7ucg3,BTC 🚀,t3_m7ucg3,2021-03-19 14:24:08,2021-03-19
1693,grgh7cx,t3_m7ucg3,Right on,t3_m7ucg3,2021-03-19 15:25:12,2021-03-19
1694,grgo9qf,t3_m7ucg3,What’s BoA?,t3_m7ucg3,2021-03-19 17:24:31,2021-03-19
1695,grgrow2,t3_m7ucg3,I known the Bitcoin world on 2015 year.,t3_m7ucg3,2021-03-19 18:22:43,2021-03-19
1696,grgvqd6,t3_m7ucg3,Lol clients are asking questions. They don’t have a choice,t3_m7ucg3,2021-03-19 19:22:09,2021-03-19
1697,grgx4iy,t3_m7ucg3,What’s BoA?,t3_m7ucg3,2021-03-19 19:40:06,2021-03-19
1698,grh0c1p,t3_m7ucg3,Let’s make it to $100K,t3_m7ucg3,2021-03-19 20:17:53,2021-03-19
1699,grh0wo5,t3_m7ucg3,"JPmorgan just understand that they cant win, so they decide that they can join crypto industry. Thats better for us",t3_m7ucg3,2021-03-19 20:24:07,2021-03-19
1700,grh5z99,t3_m7ucg3,I would guess that they don’t have a unified front on the topic and different guys in the org are pushing different things. It’s huge.,t3_m7ucg3,2021-03-19 21:15:09,2021-03-19
1701,grhapo3,t3_m7ucg3,"Try holding BTC to Aubit freeway platform, you'll see it growing. Going to use the BTC accumulator in their Virtual Hedge Fund with 20-40% apy.",t3_m7ucg3,2021-03-19 21:56:51,2021-03-19
1703,gregfuj,t3_m7ucg3,Hahahaha you think massive financial institutions are in any way threatened by bitcoin.,t3_m7ucg3,2021-03-19 03:57:46,2021-03-19
1704,grej8jv,t3_m7ucg3,"I started trading with BMX which is an America Authorized Trading Company when I realise it  legit, I have been receiving profit without stress I'm not an expert in trading but I have made more than 10,000$ with just $1,800 I have made more than 10x of my investment capital contact the manager.",t3_m7ucg3,2021-03-19 04:20:27,2021-03-19
1705,grdwkgg,t3_m7ucg3,"archived article ([why](https://www.reddit.com/r/Journalism/comments/m0n184/contribute_to_internet_journalism_by_archiving/?)?):      

https://archive.ph/DCFE0",t3_m7ucg3,2021-03-19 01:29:14,2021-03-19
1706,grfnqfu,t3_m7ucg3,making sure i am not a bot,t3_m7ucg3,2021-03-19 09:49:23,2021-03-19
1707,grguuq9,t3_m7ucg3,All true. But let’s give the dinosaurs credit.  They did help build this country and economy,t3_m7ucg3,2021-03-19 19:10:32,2021-03-19
1708,grdusrh,t1_grdt5ky,"This right here. They never were scared of it, only appeared scared of it. They do the same thing with stocks day in and day out, and the individuals who understand that are always the ones who can make tons of money for themselves by riding the waves with these banking giants.

The same can be done with BTC in this case, even once it becomes more manipulated. I'm all for BTC, but it's the very fact that BTC is accessible by all that makes it manipulable in terms of price.",t3_m7ucg3,2021-03-19 01:16:35,2021-03-19
1709,gre4vl5,t1_grdt5ky,I love how people think that they are looking out for their customers. Customers are just tools for these people.,t3_m7ucg3,2021-03-19 02:29:37,2021-03-19
1710,gre7mci,t1_grdt5ky,"You have a point. But it's a dual pronged argument. In one corner yes, the banks like to fear monger buy the dip, hoarde and play catchup. I wouldn't be suprised if BoA is panicking since they're late to the party and lost the invitation. 

But in the long term, strategically thinking, imagine the day we don't use their PoS ""savings"" account, over inflated credit cards, personal loans and mortgages.Thats the majority of their money-makers. It's already begun with FinTech. DeFi and BTC/ETH will be the nails in the coffin. That, IMHO, is striking fear in the banking sector board rooms.",t3_m7ucg3,2021-03-19 02:49:36,2021-03-19
1711,grf0j6o,t1_grdt5ky,"Correct. They're whales, and will attempt to control the market. When they can't, they'll turn to their pals on the hill to legislate power to them",t3_m7ucg3,2021-03-19 06:32:59,2021-03-19
1712,gre2x2k,t1_grdt5ky,Then they will offer it to the average joe when it's $600k per coin.,t3_m7ucg3,2021-03-19 02:15:10,2021-03-19
1713,gred3fk,t1_grdt5ky,Came here to say this. They’re laughing while they’re strengthening their positions in an entirely new asset class that came into existence from thin air. They love it.,t3_m7ucg3,2021-03-19 03:30:38,2021-03-19
1714,grdwfsl,t1_grdt5ky,"just like YOU are in the business of making YOURSELF money, not them.  and as far as they are concerned, their money comes from their clients, which are individuals ultimately, like you and I.  so we're all self-interested. that's good.",t3_m7ucg3,2021-03-19 01:28:21,2021-03-19
1715,grefogw,t1_grdt5ky,"Here’s the thing, never trust a bank.  Do the opposite of what they say, Stock analyst reports I literally do the opposite",t3_m7ucg3,2021-03-19 03:51:31,2021-03-19
1716,grf0rhb,t1_grdt5ky,"I think they're just planning to sell cryptocurrency buying and selling for the average joe through their platforms. Just like Robin Hood. You don't have access to the actual wallet because you don't own the coins, they do. You buy and sell and the estimated average prices and they are doing the actually buying and selling in the background and making money off it.",t3_m7ucg3,2021-03-19 06:34:49,2021-03-19
1717,grfg20z,t1_grdt5ky,"> BTC hits its peak.

there is no peak",t3_m7ucg3,2021-03-19 08:42:20,2021-03-19
1718,greatac,t1_grdt5ky,"Exactly. They're not scared, they want to make money. Thats what they care about. The threat of fiat disappearing is not real, at least not yet.",t3_m7ucg3,2021-03-19 03:12:36,2021-03-19
1719,grg7b6u,t1_grdt5ky,"they are scared tho... this is something they cannot manipulate game or control, this is a system that they cant just mass manipulate and orchestrate theft and fraud on a large scale totaling TRILLIONS of dollars in bad faith deals such as when the economy collapsed in 2008 then again in 2012 ETC  


of course they are scared of a new system disabling their ability to rob everyone out in the open",t3_m7ucg3,2021-03-19 13:04:38,2021-03-19
1720,greoulz,t1_grdt5ky,Watch what institutions do not what they say? How can you see that JP Morgan or BoA are buying specific cryptos without going by what they say?,t3_m7ucg3,2021-03-19 05:02:05,2021-03-19
1721,grfva2g,t1_grdt5ky,"As an employee of a BoA affiliate, I don't know about that. Most people that I work with have a cautious but optimistic view of cryptos. Bitcoin, as well as it's currently doing, did sputter a few years back after it's initial spikes.",t3_m7ucg3,2021-03-19 10:58:59,2021-03-19
1722,gre5srb,t1_grdt5ky,Why wouldnt they have bought years ago? Its not like BTC is a secret that just came out.,t3_m7ucg3,2021-03-19 02:36:21,2021-03-19
1723,grencu5,t1_grdt5ky,"That doesn't make any sense, they'd just have bought it years ago then. It's ridiculous to think they're trying to lower the price through fear so they can buy it all slowly over time, they'd just buy it. It's not like they get a $500 allowance and need to save up.",t3_m7ucg3,2021-03-19 04:50:48,2021-03-19
1724,greggzg,t1_grdt5ky,"It's not some grand conspiracy. The rocket growth in value is only temporary and the risk of decline is real. You can call this growing pains, but there is still a certain amount of irrationality to investing in a speculative experimental asset. 

Yes it's still an investment at this time, not a currency like the dollar or store of value like gold because of volatility and limits of the network. Unless the US government launches it's own coin or adapts an existing cryptocurrency, bitcoin will struggle to gain wide usage for many years to come.",t3_m7ucg3,2021-03-19 03:58:02,2021-03-19
1725,grf75z1,t1_grdt5ky,"Exactly, follow the money.",t3_m7ucg3,2021-03-19 07:27:16,2021-03-19
1726,grfellk,t1_grdt5ky,"Ah yes Im glad someone said it, banks don’t want you to make money.. they’ll sell you the idea that it’s bad so they can buy it for a profit. banks are scams",t3_m7ucg3,2021-03-19 08:29:58,2021-03-19
1727,grffkl1,t1_grdt5ky,This is a great comment.,t3_m7ucg3,2021-03-19 08:38:17,2021-03-19
1728,grg4ynh,t1_grdt5ky,Pretty sure that this is what happened in 2017... Now they’re selling them to them lol.,t3_m7ucg3,2021-03-19 12:37:08,2021-03-19
1729,grg7p6m,t1_grdt5ky,Right!? How could OP write what he said and then say they were scared when it was extremely clear they were manipulating the market to their advantage from the start?,t3_m7ucg3,2021-03-19 13:09:32,2021-03-19
1730,grgn5cz,t1_grdt5ky,"Exactly this.

Fuck 'em all! We retards do what we want. 🤪",t3_m7ucg3,2021-03-19 17:04:52,2021-03-19
1734,grev1by,t1_grdt5ky,"Did nobody else notice when the institutions got in around 15-20k end of last year? This was them loading up. They're going to package them into inflated funds that trade above the current amount. I guess they figure their initial investment is below the floor. I would imagine the coin bouncing around between 75k and 50k and them not sweating because it it goes to 50k theyre 2-3x on their money, and the funds trade higher than the market price of the coins. This is them packaging it for boomers when anyone can just buy some in one click.",t3_m7ucg3,2021-03-19 05:49:48,2021-03-19
1735,gre810y,t1_gre512c,I left them years ago for something similar - recursive overdraft fees that were triggered by account maintenance fees. Glad to see some things never change. Fuck BofA.,t3_m7ucg3,2021-03-19 02:52:34,2021-03-19
1736,grej7bm,t1_gre512c,"All major banks suck, join a credit union instead.",t3_m7ucg3,2021-03-19 04:20:12,2021-03-19
1737,grf7v8e,t1_gre512c,When I had this issues they did nothing by phone. I actually had to go to a BoA and they deleted all the fees.,t3_m7ucg3,2021-03-19 07:33:03,2021-03-19
1738,gregion,t1_gre512c,"Wow. My banks policy returns 6 overdrafts a year. Not that i do that but once upon a time i accidentally overdrew and had a dozen overdrafts.
Leave boa asap. Theyre shit all around.",t3_m7ucg3,2021-03-19 03:58:23,2021-03-19
1739,grenzef,t1_gre512c,Wow. That’s incredible. I had them about 8 years ago and they cost me so much money in fees. I finally closed it. Try never stop amazing me.,t3_m7ucg3,2021-03-19 04:55:30,2021-03-19
1740,grgj53c,t1_gre512c,"Ive never had an issue with them. Platinum member here there investment team has always worked with me, no atm transaction fees if you keep the minimum balance. Branches allover the US. I guess those fees are from you breaking a condition of your account that you agreed too...",t3_m7ucg3,2021-03-19 15:55:58,2021-03-19
1741,grgpywc,t1_gre512c,"I forget what gov agency but there's an official recourse for stuff like this (obscene fees from banks, even if due to a mixup). They get scared of legislation so they immediately pretend like they are apologetic and then remove the overdrafts.",t3_m7ucg3,2021-03-19 17:53:57,2021-03-19
1742,grgn7h0,t1_gre512c,Sounds like you didn't maintain enough money in your bank account. Build up an emergency fund so you don't run into these kinds of situations.,t3_m7ucg3,2021-03-19 17:05:53,2021-03-19
1743,grdylcs,t1_grdvlfw,Hit the nail on the head right hurrr,t3_m7ucg3,2021-03-19 01:43:50,2021-03-19
1744,greb3pz,t1_grdvlfw,Sort of. Banks will be all over bitcoin once they own enough.,t3_m7ucg3,2021-03-19 03:14:44,2021-03-19
1745,grex0xz,t1_grdvlfw,Was that Lincoln or Einstein?,t3_m7ucg3,2021-03-19 06:05:06,2021-03-19
1746,gre9p92,t1_gre8o32,Agreed. We win by starting our own game.,t3_m7ucg3,2021-03-19 03:04:39,2021-03-19
1747,grem3uz,t1_gre8o32,"You can start your own bank.  Its a little more difficult than buying a mining machine, I know.  It involves other people and everything that isn't a software program.  But I have faith you could succeed in such an endeavor if you take the bull by the horns and continue to mine and buy and hold more bitcoins.",t3_m7ucg3,2021-03-19 04:41:31,2021-03-19
1749,grh2m58,t1_gre8o32,"Banks are more than just that. Historically, they've been a huge source of human advancement because they redistribute wealth in the form of loans.

Modern retail banking is garbage, but so are oversimplifications.",t3_m7ucg3,2021-03-19 20:42:07,2021-03-19
1750,grgcvg7,t1_grexr6z,"Y they are largely after successful assets. Banks, especially traditional banks, are in deep shit. They can’t make money in this low interest environment. Then with the digitalization their branches are liabilities and not assets.",t3_m7ucg3,2021-03-19 14:19:59,2021-03-19
1751,gre6uw3,t1_grdpoq5,Can or can’t??? Because i would argue it is not easily manipulated by a bank especially this late in the game,t3_m7ucg3,2021-03-19 02:44:05,2021-03-19
1752,grexk3s,t1_grdpoq5,"What they should fear is obsolescence. I can count on zero hands the number of times I've been surprised and delighted by their service.  Meanwhile for a competent individual Bitcoin  works great. Lightning for small retail, onchain for savings/wires. Yes volatility is an issue but only during your first cycle.",t3_m7ucg3,2021-03-19 06:09:18,2021-03-19
1753,grf64p5,t1_grelva0,Delusional libertarians,t3_m7ucg3,2021-03-19 07:18:47,2021-03-19
1754,gretn04,t1_gre4knc,"If we’re talking about boycotting banks, can we add Wells Fargo to that list?",t3_m7ucg3,2021-03-19 05:38:57,2021-03-19
1755,grgn4ri,t1_gre4knc,"Been a BoA user for nearly 2 decades now. It's fine to keep a big bank. Branch locations are good. You can in addition to a big bank have a local credit union and an internet bank if you want.

Typical /r/bitcoin seems to have zero clue about personal finance management.",t3_m7ucg3,2021-03-19 17:04:35,2021-03-19
1756,grf04g6,t1_gre6weu,Hope you bought those puts in 2008 because otherwise those don’t look profitable!,t3_m7ucg3,2021-03-19 06:29:41,2021-03-19
1757,grfkivm,t1_gre6weu,Disregard your emotions.  Bank of America is probably the worst big bank to buy puts on right now.,t3_m7ucg3,2021-03-19 09:21:15,2021-03-19
1758,gre811u,t1_gre5vks,"HODL>Trade 
🤲🏽💎",t3_m7ucg3,2021-03-19 02:52:34,2021-03-19
1759,grgd5uk,t1_grdwyzy,"A wolf disguising itself as a sheep did not change their mind, it simply wants what the sheep got.",t3_m7ucg3,2021-03-19 14:24:08,2021-03-19
1760,grg5tg7,t1_gre3z2s,They didn’t read the article or the summary from the bot lol,t3_m7ucg3,2021-03-19 12:46:51,2021-03-19
1761,grf67oi,t1_gree4r8,BoA deez nuts!,t3_m7ucg3,2021-03-19 07:19:28,2021-03-19
1762,grf574q,t1_grf1f2c,I have!,t3_m7ucg3,2021-03-19 07:11:13,2021-03-19
1763,grf9qvx,t1_grf4vt5,"Microstrategy is basically turning itself into a levered Bitcoin ETF, which is interesting. They took out a zero interest loan in the form of a convertible bond to buy Bitcoin.  It was an interesting move since you can actually get better convertible pricing because of the volatility of the stock (so they basically were harvesting the volatility in their own stock!)",t3_m7ucg3,2021-03-19 07:48:36,2021-03-19
1764,grf9ynm,t1_grf8zvl,"If you sell, let me know first so I can buy.",t3_m7ucg3,2021-03-19 07:50:25,2021-03-19
1765,grfrdcn,t1_grff8o4,Can I pay for it in bitcoin?,t3_m7ucg3,2021-03-19 10:22:47,2021-03-19
1766,grgx87v,t1_grgx4iy,Balls on ass,t3_m7ucg3,2021-03-19 19:41:25,2021-03-19
1767,gre4ain,t1_grdusrh,"The more people have Bitcoin the less volatile it becomes though, no?",t3_m7ucg3,2021-03-19 02:25:20,2021-03-19
1768,gregz02,t1_grdusrh,"Look at the massive silver hoard JPM has, all while saying precious metals are an old relic and aren’t needed anymore",t3_m7ucg3,2021-03-19 04:01:59,2021-03-19
1769,gre6git,t1_grdusrh,Just like how they are smashing the ... uh ... wsb folks and their favorite picks with negative op-eds left and right everywhere you look.,t3_m7ucg3,2021-03-19 02:41:09,2021-03-19
1770,grfoplu,t1_grdusrh,Short term maybe. Long term it’s an exponential feedback loop with no exit. Coronavirus with no cure.,t3_m7ucg3,2021-03-19 09:58:14,2021-03-19
1771,grfqne6,t1_gre4vl5,"I don't think anyone actually believes they are looking out for us, but what can we do?",t3_m7ucg3,2021-03-19 10:16:04,2021-03-19
1772,grgcqid,t1_gre7mci,Nobody is late to the party,t3_m7ucg3,2021-03-19 14:18:00,2021-03-19
1773,grhfcap,t1_gre7mci,"> imagine the day we don't use their PoS ""savings"" account

I can do better than that.

Imagine if bankers' greed were to cause them to overreach, say by making vast numbers of housing loans without performing due diligence. Imagine if they went to the Federal Treasury to be bailed out, and instead of hearing ""Yes sirs, the emergency money vats are right this way."" they hear ""Sorry, we can't print any bitcoin. Your shitting spree ends here and now.""

The notion that this world's masters attained their mastery by sheer merit is compellingly false. They attained their station by stomping those who could not resist into a pile of gore and standing on that to reach the throne. Bitcoin at last lets the downtrodden resist, and that terrifies our rulers. As it ought.",t3_m7ucg3,2021-03-19 22:35:01,2021-03-19
1774,grgnsa8,t1_grf0j6o,people have been killed for trying this. crypto is/has been used to hire hitmen ... do they really want to threaten those people?,t3_m7ucg3,2021-03-19 17:16:03,2021-03-19
1775,grejqys,t1_gre2x2k,I wonder when they will start to try to rebrand a satoshi as something else.,t3_m7ucg3,2021-03-19 04:24:18,2021-03-19
1776,grehuxo,t1_grdwfsl,"Not entirely true. They don't make any money off of individuals. Wife works at JP Morgan Corporate. If they could close all local branches, they would. They make nothing off of private banking, often operating at a loss. All money is made in commercial banking.",t3_m7ucg3,2021-03-19 04:09:21,2021-03-19
1777,gre0ttu,t1_grdwfsl,Finally some sense in these types of threads,t3_m7ucg3,2021-03-19 01:59:35,2021-03-19
1778,gre9u2r,t1_grdwfsl,"True ..but that does not give them the right to lie and mislead people. 

That should be a crime punishable by death for the fund manager.",t3_m7ucg3,2021-03-19 03:05:38,2021-03-19
1779,grei3cw,t1_grefogw,Its fucked that it works,t3_m7ucg3,2021-03-19 04:11:15,2021-03-19
1780,grg86va,t1_grf0rhb,"Not your keys, not your coins.",t3_m7ucg3,2021-03-19 13:15:46,2021-03-19
1781,gre6n6y,t1_gre5srb,"In my opinion it’s because prior to 6 months ago, BTC was thought of as a one pump chump by pretty much everyone but the hardcore believers, which was still a relatively small base compared to what it is today. For that reason, it wasn’t important enough to them to buy. In short, blissful ignorance",t3_m7ucg3,2021-03-19 02:42:32,2021-03-19
1782,grfr01x,t1_grencu5,"It takes time for hedgies to establish a large position.   If they just buy it all at once,  the price can skyrocket before they're even done buying",t3_m7ucg3,2021-03-19 10:19:20,2021-03-19
1783,greqrdg,t1_greggzg,"The only thing you have said that is true is that the dollar is a currency, the rest is utter nonsense. Shame on you

So glad I don't take advice from this forum.",t3_m7ucg3,2021-03-19 05:16:38,2021-03-19
1784,grgq8dn,t1_grfellk,"careful, this borders on anti semitism",t3_m7ucg3,2021-03-19 17:58:31,2021-03-19
1785,grer4xf,t1_gre810y,"I left Chase way back in 2008 for the same reason. They kept nickle and diming me, I'd complain and sometimes they'd correct it, but it kept happening so eventually I just left. Credit unions ever since, vastly better experience.",t3_m7ucg3,2021-03-19 05:19:35,2021-03-19
1786,grgnaf1,t1_gre810y,Keep more money in your account then? Overdraft fees shouldn't be a problem if you maintain an emergency fund.,t3_m7ucg3,2021-03-19 17:07:21,2021-03-19
