,comment_id,comment_parent_id,comment_body,comment_link_id,created,date
365,gs14ox9,t3_mbxz5b,Elon tweeting that Tesla will *keep* the bitcoin that’s used to purchase a Tesla is such a big deal. It shows trust and desire over fiat.,t3_mbxz5b,2021-03-24 17:49:50,2021-03-24
366,gs0vqa8,t3_mbxz5b,"Bitcoin paid to Tesla will be retained as Bitcoin, **not converted to fiat currency.**

Lightning + Starlink. DO IT ELON.",t3_mbxz5b,2021-03-24 15:24:20,2021-03-24
367,gs0uwhb,t3_mbxz5b,"Buckle up 

“Tesla is using only internal & open source software & operates Bitcoin nodes directly.

Bitcoin paid to Tesla will be retained as Bitcoin, not converted to fiat currency.” - Papa musk",t3_mbxz5b,2021-03-24 15:12:01,2021-03-24
369,gs0y2fp,t3_mbxz5b,"A Tesla is getting cheaper by the second for Bitcoin holders as price of Bitcoin rises. Win for Bitcoin. Win for Elon. Quite ingenious by Elon. 

Side note: Tesla will not convert a Tesla Bitcoin purchase to fiat. That's also big deal",t3_mbxz5b,2021-03-24 16:00:44,2021-03-24
371,gs0wckr,t3_mbxz5b,Elon slaughtered some shorts.,t3_mbxz5b,2021-03-24 15:33:51,2021-03-24
374,gs0zvyn,t3_mbxz5b,Shall we send Elon a thank you card ?,t3_mbxz5b,2021-03-24 16:29:36,2021-03-24
375,gs1cw09,t3_mbxz5b,"“Bitcoin paid to Tesla will be retained as Bitcoin, not converted to fiat currency”


He’s HODLing boys, him and Saylor are gonna gobble up all 21M coins.",t3_mbxz5b,2021-03-24 19:44:19,2021-03-24
381,gs0wpza,t3_mbxz5b,This is a real show of faith in Bitcoin from Tesla. Should have a knock-on effect beyond a brief pump.,t3_mbxz5b,2021-03-24 15:39:37,2021-03-24
382,gs18bg7,t3_mbxz5b,"""let's short bitcoin because of those options on Friday""

Elon: nope",t3_mbxz5b,2021-03-24 18:45:44,2021-03-24
383,gs1itkv,t3_mbxz5b,Banks: btc is to volatile and has no real value. Also banks: we need to regulate it. If btc has no value why even bother regulate it. These fucking clowns.,t3_mbxz5b,2021-03-24 20:45:41,2021-03-24
386,gs0zamv,t3_mbxz5b,I dont think elon ever sleeps. This dude is always tweeting big news at like 3 am lmao,t3_mbxz5b,2021-03-24 16:20:11,2021-03-24
387,gs0znmi,t3_mbxz5b,Is anyone here from the UK and are you looking forward to Boris Johnsons explanation of Bitcoin and block chain technology? That's gonna be a lot of waffle to handle.,t3_mbxz5b,2021-03-24 16:25:55,2021-03-24
388,gs10m42,t3_mbxz5b,"Those asking if buy now or wait for a dip? You just missed the dip, Elon just gave us a gift. A new ATH possibly? I stay bullish.",t3_mbxz5b,2021-03-24 16:41:35,2021-03-24
392,gs18g7p,t3_mbxz5b,"The term HODL is in every bitcoin company financial statement, it's hilarious 😂",t3_mbxz5b,2021-03-24 18:47:38,2021-03-24
393,gs1bjqm,t3_mbxz5b,If you are selling at the slightest dip you are over leveraging. There is a reason people say only put in what you can afford to lose! Don’t over leverage and the ride is much more smooth,t3_mbxz5b,2021-03-24 19:28:17,2021-03-24
395,gs0upnc,t3_mbxz5b,Fuck the lambos. We gonna see a massive Bitcoin Twitter Tesla’s now !!!!,t3_mbxz5b,2021-03-24 15:09:08,2021-03-24
396,gs1qso5,t3_mbxz5b,"You guys are the worst. “Raining red dildos”... have any of you seen a $300 drop? Jesus Christ. Any other level headed people, plz check out r/bitcoinmarkets",t3_mbxz5b,2021-03-24 21:53:13,2021-03-24
403,gs12arr,t3_mbxz5b,"Elon turns the table. Also, traders on youtube: “btc pumped exactly as I predicted”",t3_mbxz5b,2021-03-24 17:09:46,2021-03-24
404,gs0vb7n,t3_mbxz5b,"So, an apparent large OTC buy yesterday, followed by a Musk BTC announcement pump...coincidence?",t3_mbxz5b,2021-03-24 15:18:06,2021-03-24
405,gs0x9j9,t3_mbxz5b,I’m glad my night terror woke me up 🤪,t3_mbxz5b,2021-03-24 15:48:07,2021-03-24
406,gs0xckf,t3_mbxz5b,"Thx Elon 

https://twitter.com/elonmusk/status/1374617643446063105?s=21",t3_mbxz5b,2021-03-24 15:49:26,2021-03-24
413,gs0uh1b,t3_mbxz5b,"Welp, Elon just tweeted about bitcoin.  Let's see what happens.",t3_mbxz5b,2021-03-24 15:05:27,2021-03-24
414,gs11d0t,t3_mbxz5b,friday options expire- how will BTC will be effected of this?,t3_mbxz5b,2021-03-24 16:54:05,2021-03-24
415,gs1c91v,t3_mbxz5b,"Hey Alexa

Tell Google to announce a bitcoin buy today

Thanks",t3_mbxz5b,2021-03-24 19:36:49,2021-03-24
416,gs1edps,t3_mbxz5b,"Elon could make billions. tweet “Bitcoin is great” huge green candle and he sells, then tweet “Bitcoin is shit” huge red candle then he buys. 🤔maybe I should DM him.",t3_mbxz5b,2021-03-24 20:01:06,2021-03-24
417,gs1euff,t3_mbxz5b,F in chat to 53k panic sellers,t3_mbxz5b,2021-03-24 20:06:11,2021-03-24
425,gs0wd32,t3_mbxz5b,I keep saying it but Elon Musk is going to be terrifyingly wealthy if we actually do moon. He'll be a multi-trillionaire.,t3_mbxz5b,2021-03-24 15:34:04,2021-03-24
426,gs1ef8c,t3_mbxz5b,yes yes yes yes YES YES YES !!!!,t3_mbxz5b,2021-03-24 20:01:34,2021-03-24
427,gs1ezhu,t3_mbxz5b,"managed to buy a nice lump aorund the 54k, boy am I glad I did :D this is fun :D",t3_mbxz5b,2021-03-24 20:07:43,2021-03-24
428,gs1h1up,t3_mbxz5b,Elon knows exactly what he's doing timing wise. Wouldn't dare being short rn,t3_mbxz5b,2021-03-24 20:28:44,2021-03-24
429,gs1j6po,t3_mbxz5b,The guy that bet 0.5 btc against Willy woo feeling pretty dumb right now.,t3_mbxz5b,2021-03-24 20:49:07,2021-03-24
444,gs0mu3x,t3_mbxz5b,Dammit I wish I had 10grand to buy right now this sale is amazing 😭,t3_mbxz5b,2021-03-24 13:14:01,2021-03-24
445,gs0nopx,t3_mbxz5b,It can go up now. DCA for week done.,t3_mbxz5b,2021-03-24 13:25:20,2021-03-24
446,gs0onm0,t3_mbxz5b,The battle for $54k,t3_mbxz5b,2021-03-24 13:38:42,2021-03-24
447,gs0pk0e,t3_mbxz5b,I’m feeling good. I’m not worried...why should I worry?,t3_mbxz5b,2021-03-24 13:51:18,2021-03-24
448,gs0ufxc,t3_mbxz5b,Ok who pressed the elevator to the 100th floor,t3_mbxz5b,2021-03-24 15:04:58,2021-03-24
449,gs0uiml,t3_mbxz5b,appreciate the pump elon!,t3_mbxz5b,2021-03-24 15:06:08,2021-03-24
450,gs0vgnv,t3_mbxz5b,"Well, waking up in the middle of the night and checking BTC has been a good idea today. 🚀🌕",t3_mbxz5b,2021-03-24 15:20:19,2021-03-24
451,gs0w90l,t3_mbxz5b,Every Tesla purchase via bitcoin gets hodl'ed and decreases supply,t3_mbxz5b,2021-03-24 15:32:20,2021-03-24
452,gs0yybe,t3_mbxz5b,Wonder if we see a jump up in the morning when the east coast US wakes up to this Tesla news?,t3_mbxz5b,2021-03-24 16:14:44,2021-03-24
453,gs0z469,t3_mbxz5b,God I hope Bitcoin brings back Elvis...,t3_mbxz5b,2021-03-24 16:17:19,2021-03-24
454,gs112ef,t3_mbxz5b,"So I set a price alert on my phone (I’m
In US it is middle of the night) for different price levels but all same alarm and I picked up my phone in dread and was pleasantly surprised. Can’t wait to see the AM - thank you Elon",t3_mbxz5b,2021-03-24 16:49:11,2021-03-24
455,gs16k3c,t3_mbxz5b,"Why people are transferring 3x 3000, and 2000 btc to unknown wallets 10 hours ago on whale alert? Is this a big pump signal?",t3_mbxz5b,2021-03-24 18:19:35,2021-03-24
456,gs1xvrl,t3_mbxz5b,"I think we need one more big institutional adoption announcement, I’m really hoping it comes tomorrow, that will set Friday right and bring a new ATH. The volume is concerning me at the moment",t3_mbxz5b,2021-03-24 22:45:55,2021-03-24
487,gs0sy6f,t3_mbxz5b,Tesla is accepting bitcoin as payment for thier cars as of 1 hour ago. Go on Tesla.com and see for yourself. This is pretty awesome!!!! Showing the use case for bitcoin as a currency and not just a store of value!,t3_mbxz5b,2021-03-24 14:41:41,2021-03-24
488,gs0tx2w,t3_mbxz5b,Someone got sick of the see saw and just bought a bunch of BTC!!!,t3_mbxz5b,2021-03-24 14:56:49,2021-03-24
489,gs0uddg,t3_mbxz5b,"Support lines are holding strong, we should be off to another run to try to break ATH",t3_mbxz5b,2021-03-24 15:03:54,2021-03-24
490,gs0upx9,t3_mbxz5b,Last time before 50k €,t3_mbxz5b,2021-03-24 15:09:15,2021-03-24
491,gs11dtp,t3_mbxz5b,"On the daily chart, I was expecting the 4th wave of pump either today or tomorrow. What are the chances of Elon expect that as well and attempting to give it a boost with his announcement?",t3_mbxz5b,2021-03-24 16:54:28,2021-03-24
492,gs1ee6k,t3_mbxz5b,[deleted],t3_mbxz5b,2021-03-24 20:01:15,2021-03-24
493,gs1es9a,t3_mbxz5b,thanks elon!,t3_mbxz5b,2021-03-24 20:05:33,2021-03-24
494,gs1llkw,t3_mbxz5b,"Just started looking into how to invest in Bitcoin , what podcasts are great for knowledge?",t3_mbxz5b,2021-03-24 21:10:36,2021-03-24
495,gs1pey2,t3_mbxz5b,The shorts are going to be screwed big time on Friday,t3_mbxz5b,2021-03-24 21:42:20,2021-03-24
514,gs1cmgi,t3_mbxz5b,Bitcoin is gonna takeover the world fuckers,t3_mbxz5b,2021-03-24 19:41:15,2021-03-24
517,gs0qefx,t3_mbxz5b,tesla now accepts bitcoin as payment!,t3_mbxz5b,2021-03-24 14:03:22,2021-03-24
518,gs1a2yy,t3_mbxz5b,I have discovered that bitcoins price movement is 100% correlated to my wife's weight. Going to Mcdonalds now.,t3_mbxz5b,2021-03-24 19:09:51,2021-03-24
523,gs0odsz,t3_mbxz5b,pumpin to 57,t3_mbxz5b,2021-03-24 13:34:51,2021-03-24
524,gs0qw80,t3_mbxz5b,The next five minutes are critical,t3_mbxz5b,2021-03-24 14:10:33,2021-03-24
525,gs0sr9e,t3_mbxz5b,What’s happening,t3_mbxz5b,2021-03-24 14:38:42,2021-03-24
526,gs0u73s,t3_mbxz5b,Am i the only one who doesnt see the btc option to buy a tesla???,t3_mbxz5b,2021-03-24 15:01:12,2021-03-24
527,gs0uev0,t3_mbxz5b,Let this get bread boyz,t3_mbxz5b,2021-03-24 15:04:31,2021-03-24
528,gs0z106,t3_mbxz5b,Is buying a Tesla a taxable event?,t3_mbxz5b,2021-03-24 16:15:56,2021-03-24
529,gs10x54,t3_mbxz5b,"hold on for lift of fam :)
- thankyou for hodl ing",t3_mbxz5b,2021-03-24 16:46:42,2021-03-24
530,gs1f9rj,t3_mbxz5b,"Why would I exchange BTC for Tesla , I would prefer cash that’s depreciating anyhow .",t3_mbxz5b,2021-03-24 20:10:47,2021-03-24
531,gs1iu2y,t3_mbxz5b,Podcasts recommendations? I do “what Bitcoin did” and “tales from the crypt” currently.... need a few more,t3_mbxz5b,2021-03-24 20:45:49,2021-03-24
532,gs1tw0r,t3_mbxz5b,Seeing all these youtubers with 100s if not thousands of btc makes me want to rope my self. Anyone else ?,t3_mbxz5b,2021-03-24 22:16:44,2021-03-24
559,gs0w9ku,t3_mbxz5b,Thank you papa Elon,t3_mbxz5b,2021-03-24 15:32:34,2021-03-24
570,gs1c12r,t3_mbxz5b,So is Elon the BTC Whisperer now?,t3_mbxz5b,2021-03-24 19:34:10,2021-03-24
572,gs12794,t3_mbxz5b,[deleted],t3_mbxz5b,2021-03-24 17:08:05,2021-03-24
573,gs13bay,t3_mbxz5b,"My two satoshis: Surf's up - just HODL! (And this comment is just me guessing wildly, but I'm looking forward to see if there are any new EOM patterns this time).

I think there's going to be some real waves the coming days. Futures expire on Friday, which usually leads to downwards pressure (the days ahead) from the whales (who acquire as much as they can with their monthly ""games"").

And then, just in time for the downwards pressure, Elon tweets, and LOTS of people pay attention to Elon's tweets... So, now we have upwards pressure coming at the perfect time for the EOM.

I suspect we will see some big dumps from whales the next two days, but at the same time more buys which will keep it more steady this time. This weekend, I suspect we'll have lift-off.",t3_mbxz5b,2021-03-24 17:26:44,2021-03-24
574,gs1regc,t3_mbxz5b,"Bitcoin is renewing the concept of ownership. In the past, you could own something and no one could take it from you. Nowadays, anything can be taken from you at any time by anyone and there isn't shit you can do about it. Bitcoin fixes this",t3_mbxz5b,2021-03-24 21:57:52,2021-03-24
578,gs11gxi,t3_mbxz5b,"MODEL X ... with the suicide doors !!! 
#thankselon",t3_mbxz5b,2021-03-24 16:55:54,2021-03-24
579,gs0urw6,t3_mbxz5b,It’s midnight. I think they tweet could have been pretty crazy after NYSE close on Friday-Monday morning,t3_mbxz5b,2021-03-24 15:10:07,2021-03-24
580,gs0vl4c,t3_mbxz5b,Poip,t3_mbxz5b,2021-03-24 15:22:10,2021-03-24
581,gs0vlw6,t3_mbxz5b,How will tesla report revenue in btc if they aint converting it back to fiat??,t3_mbxz5b,2021-03-24 15:22:30,2021-03-24
582,gs0w9ji,t3_mbxz5b,Does this mean Chinese miners that’s been dumping follow Elon on twitter?,t3_mbxz5b,2021-03-24 15:32:33,2021-03-24
583,gs0witx,t3_mbxz5b,Funds are safu,t3_mbxz5b,2021-03-24 15:36:33,2021-03-24
584,gs0yv28,t3_mbxz5b,56k,t3_mbxz5b,2021-03-24 16:13:19,2021-03-24
585,gs0zff3,t3_mbxz5b,Weeeeeeeeeee,t3_mbxz5b,2021-03-24 16:22:18,2021-03-24
586,gs19m4r,t3_mbxz5b,Looks like we are on our way back up,t3_mbxz5b,2021-03-24 19:03:49,2021-03-24
587,gs1aj6w,t3_mbxz5b,HODL THE DOOR (Hodler),t3_mbxz5b,2021-03-24 19:15:36,2021-03-24
588,gs1dxea,t3_mbxz5b,Corn in Mars is not a meme,t3_mbxz5b,2021-03-24 19:56:09,2021-03-24
589,gs1uvpb,t3_mbxz5b,"How does blockfi make money off their interest bearing accounts? Their loan products are fully collateralized and would seem to be a completely seperate product from their interest bearing accounts. Are they loaning your BTC out to day traders to provide liquidity and just assuming that most day traders will loose money in the long run? 6% interest is actually pretty good, I'm just wondering how they generate that and also make some profits for themselves?",t3_mbxz5b,2021-03-24 22:24:05,2021-03-24
590,gs1zues,t3_mbxz5b,"https://mobile.twitter.com/whale_alert/status/1374736572432650262

Biggest one of these I’ve ever seen",t3_mbxz5b,2021-03-24 22:59:58,2021-03-24
613,gs14kkv,t3_mbxz5b,HODL !!!,t3_mbxz5b,2021-03-24 17:47:51,2021-03-24
614,gs1851m,t3_mbxz5b,Fun little experiment: write a bot that does /r/bitcoin sentiment analysis then executes trades doing the exact OPPOSITE of whatever the sentiment is. What are the chances the bot ends up in profit?  Probably pretty good.,t3_mbxz5b,2021-03-24 18:43:10,2021-03-24
627,gs0us9g,t3_mbxz5b,Happy about the Tesla announcement.. But is anyone else kinda frustrated that even with all the positive news it's this that sees us pump for the first time in a few weeks?,t3_mbxz5b,2021-03-24 15:10:16,2021-03-24
628,gs0wklr,t3_mbxz5b,"I get tired of hearing stuff like this.

″[T]he basic property and task for a central bank and central bank currency is to provide stability in the value of money and in the system, and that is not done by bitcoin,” Olsen told Bloomberg.

Stability? REALLY? More like legal ways to scam humans and control every aspect of their lives.",t3_mbxz5b,2021-03-24 15:37:18,2021-03-24
629,gs1rjoc,t3_mbxz5b,Good Morning all. Great job Bitcoin. Nice and steady to the top. buy and Hodl.,t3_mbxz5b,2021-03-24 21:58:58,2021-03-24
641,gs0ri46,t3_mbxz5b,"Nice support at 53k, but idk why i feal scare .",t3_mbxz5b,2021-03-24 14:19:39,2021-03-24
642,gs1imgt,t3_mbxz5b,"Elon Musk is a great man and he will go down in history as a legend. He is changing our future for the better in multiple areas. 

This will help to catalyze the move to using bitcoin as a store of value and a decentralized currency, lessening the power that corrupt big banks have over people and allowing more FREEDOM. THANK YOU ELON.",t3_mbxz5b,2021-03-24 20:43:49,2021-03-24
643,gs1mnla,t3_mbxz5b,AMERICA,t3_mbxz5b,2021-03-24 21:19:41,2021-03-24
651,gs0t8ex,t3_mbxz5b,"Lol, what the fuck just happened?!",t3_mbxz5b,2021-03-24 14:46:08,2021-03-24
652,gs0t993,t3_mbxz5b,You good Bitcoin?,t3_mbxz5b,2021-03-24 14:46:29,2021-03-24
653,gs0tah3,t3_mbxz5b,🤤🤤🤤,t3_mbxz5b,2021-03-24 14:47:01,2021-03-24
654,gs0ucuw,t3_mbxz5b,Support held twice in the 53k range after the first drop. People who are waiting to buy the dip now is the time. If you wait then you’ll probably be chasing in the 60’s,t3_mbxz5b,2021-03-24 15:03:41,2021-03-24
655,gs0wvir,t3_mbxz5b,"Yeah, I like the coin eh. Better than poutine , but it’s pretty close.",t3_mbxz5b,2021-03-24 15:42:02,2021-03-24
656,gs0x4ci,t3_mbxz5b,How will TSLA do in this news??,t3_mbxz5b,2021-03-24 15:45:52,2021-03-24
657,gs109ir,t3_mbxz5b,"UK BlockFi alternatives?  


Nexo is good at 5% but want to look at others as well.",t3_mbxz5b,2021-03-24 16:35:42,2021-03-24
658,gs1hwl2,t3_mbxz5b,Pamp it,t3_mbxz5b,2021-03-24 20:37:01,2021-03-24
659,gs1ijts,t3_mbxz5b,"Kept trying to get a nice long in yesterday but kept getting shaken out (mainly by fear of options expiry volatility in the later half of the week)..settled for a nice laddered long down to 52.5 but only a little got filled :( 

Elon’s gotta clue us leveraged idiots into when he’s gonna wreck shorts.",t3_mbxz5b,2021-03-24 20:43:07,2021-03-24
660,gs1lu2t,t3_mbxz5b,"Would I be right in saying that bitcoin is not infinitely deflationary and will have an absolute apex in valuation at some point? There are 2 scenarios which are a) Hyperbitcoinization and b) the last bitcoin being mined in 2140, where this supposed apex could be reached.",t3_mbxz5b,2021-03-24 21:12:40,2021-03-24
661,gs1p8r3,t3_mbxz5b,I’m surprised the Tesla news didn’t jump the price higher,t3_mbxz5b,2021-03-24 21:40:58,2021-03-24
662,gs1tzjy,t3_mbxz5b,Any one use a cold card? Think it’s worth it with sub $500 owned in the coin?,t3_mbxz5b,2021-03-24 22:17:28,2021-03-24
663,gs1uhan,t3_mbxz5b,"Noobs and paper hands are crying everytime they see ""red sticks""",t3_mbxz5b,2021-03-24 22:21:07,2021-03-24
685,gs0wo7s,t3_mbxz5b,"This Tesla Bitcoin thing kinda seems like another publicity stunt. I don’t have any idea why someone would want to purchase a car with Bitcoin. If you’ve been sitting on it for a couple of years, and you live in the US, you’ll then have to eat a 20-40% surtax on any gains you have. If you’re simply transferring fiat to Bitcoin and then Bitcoin to Tesla, that just seems unnecessary. Why not keep the Bitcoin for yourself? 

Now, if Tesla offered a discount when purchasing with Bitcoin, that would perk my ears. I'd be surprised if more than 1,000 Teslas this year are paid for through Bitcoin.",t3_mbxz5b,2021-03-24 15:38:52,2021-03-24
686,gs11qvr,t3_mbxz5b,"Has anyone else noticed that the number one rule about bitcoin is you don’t disclose how much you have. 

With the news about Blockfi no longer offering 6% over 1 btc, there’s a lot of noise from people looking for alternatives. This says to me that all of these people own at least 2 bitcoin.",t3_mbxz5b,2021-03-24 17:00:28,2021-03-24
687,gs1fhk5,t3_mbxz5b,Thanks again Papa Elon!,t3_mbxz5b,2021-03-24 20:13:03,2021-03-24
691,gs0vvft,t3_mbxz5b,I love green dildo,t3_mbxz5b,2021-03-24 15:26:29,2021-03-24
692,gs118ne,t3_mbxz5b,"Hi guys. Could anyone chime in on this article pls?
https://cryptobriefing.com/5-5-billion-worth-of-bitcoin-options-expire-on-friday/",t3_mbxz5b,2021-03-24 16:52:05,2021-03-24
693,gs1ng07,t3_mbxz5b,"https://finance.yahoo.com/video/very-likely-u-outlaw-bitcoin-100000280.html

This interview is such a joke.  Dude legit sounds like he has absolutely no clue what he's talking about.  Just another dumbass boomer",t3_mbxz5b,2021-03-24 21:26:20,2021-03-24
694,gs1w3pe,t3_mbxz5b,No volume on that up swing,t3_mbxz5b,2021-03-24 22:33:02,2021-03-24
705,gs10rv7,t3_mbxz5b,"And here I was,  hoping it would dip back into the 40’s....",t3_mbxz5b,2021-03-24 16:44:14,2021-03-24
707,gs0zh2k,t3_mbxz5b,"Somebody please play ""Bulls on Parade""...",t3_mbxz5b,2021-03-24 16:23:03,2021-03-24
708,gs15n94,t1_gs14ox9,That’s actually the more relevant statement.,t3_mbxz5b,2021-03-24 18:05:12,2021-03-24
709,gs0zjwv,t1_gs0vqa8,I've been thinking for a while... Couldn't they run a full node aboard the starlink satellites?,t3_mbxz5b,2021-03-24 16:24:18,2021-03-24
710,gs0v6v4,t1_gs0uwhb,“Pay by Bitcoin capability available outside US later this year“ = IDGAF what yellen and Powell have to say -Elon,t3_mbxz5b,2021-03-24 15:16:18,2021-03-24
711,gs0z87j,t1_gs0uwhb,Amazing.,t3_mbxz5b,2021-03-24 16:19:06,2021-03-24
717,gs0z7ph,t1_gs0y2fp,"And if you pay e.g. 1 btc for a Tesla today, and btc goes to the moon, that one coin would've bought you ten Teslas, right..?",t3_mbxz5b,2021-03-24 16:18:53,2021-03-24
722,gs0wx5z,t1_gs0wckr,Makes me so happy,t3_mbxz5b,2021-03-24 15:42:43,2021-03-24
727,gs122ip,t1_gs0zvyn,help to buy tesla shares,t3_mbxz5b,2021-03-24 17:05:53,2021-03-24
728,gs1dctc,t1_gs1cw09,Not gonna get my portion of BTC if I have anything to say about it.,t3_mbxz5b,2021-03-24 19:49:40,2021-03-24
734,gs1jqr2,t1_gs1itkv,"Its double talk, they do it to make it seem as if they’re not worried. Watch what they do not what they say. They’re not stupid they know whats happening they **are** worried",t3_mbxz5b,2021-03-24 20:54:11,2021-03-24
736,gs0zr1x,t1_gs0zamv,He is an alien,t3_mbxz5b,2021-03-24 16:27:27,2021-03-24
737,gs100qn,t1_gs0zamv,"Considering what that did while the US market was asleep, it makes me wonder what will happen this morning at US open.  I’m assuming this reaction mostly non-US investors/institutions.

Or maybe is was just Elon again buying up more...",t3_mbxz5b,2021-03-24 16:31:45,2021-03-24
738,gs0zrc0,t1_gs0znmi,"Wibbly wobbly, Internet memes, wobbly wobbly",t3_mbxz5b,2021-03-24 16:27:34,2021-03-24
739,gs0zysy,t1_gs0znmi,I’ve not heard about this. I did see his comment last night about the vaccine working so well because of ‘greed and capitalism’. The profit margins for the pharma companies is pretty good apparently,t3_mbxz5b,2021-03-24 16:30:52,2021-03-24
740,gs129sx,t1_gs0znmi,"The UK so far seems to be forward-thinking in regards to new tech, so I'm hoping it'll be positive when he does talk about blockchains.",t3_mbxz5b,2021-03-24 17:09:18,2021-03-24
741,gs10so6,t1_gs10m42,Been dipping for the past 2-3 days and the moment it goes up is when people ask if they should wait for a dip? Seriously lmao,t3_mbxz5b,2021-03-24 16:44:36,2021-03-24
745,gs1972f,t1_gs18g7p,Man about to change my name on HODL 😀,t3_mbxz5b,2021-03-24 18:58:00,2021-03-24
754,gs13lzq,t1_gs12arr,"""it was either going to tank below the trendline or slingshot upwards, and one of them happened just like I expected""",t3_mbxz5b,2021-03-24 17:31:51,2021-03-24
755,gs12gku,t1_gs12arr,These chart nerds need to start modeling his tweets,t3_mbxz5b,2021-03-24 17:12:31,2021-03-24
756,gs183e8,t1_gs12arr,"""my viewers got liquidated on my affiliated exchange ... exactly as predicted""  
this is old forex trash, they pretend millionaire life, they paint charts which are mostly useless, but newbies like to SEE THINGS (fundamentals are key for trading), their followers get liquidated and they get money, ez ... with youtube you cash extra for views",t3_mbxz5b,2021-03-24 18:42:28,2021-03-24
757,gs0ven0,t1_gs0vb7n,Probably. But a good thing any way you shake it,t3_mbxz5b,2021-03-24 15:19:30,2021-03-24
758,gs12g57,t1_gs11d0t,"I just kinda posted the same question seconds before you after reading these two contradicting articles
1. https://cryptobriefing.com/5-5-billion-worth-of-bitcoin-options-expire-on-friday/
2. https://www.forbes.com/sites/billybambrough/2021/03/22/bitcoin-is-braced-for-a-huge-61-billion-price-earthquake-this-week/?sh=7a016ff84225",t3_mbxz5b,2021-03-24 17:12:19,2021-03-24
761,gs125yf,t1_gs0wd32,"Tesla purchased an undisclosed number of coins at worth 1.5billion. If we assume a price of approx 35k/btc, they likely acquired around 43,000 bitcoins. 

At Elon's \~22% stake in Tesla, he'd have around 9,600 Bitcoins. If bitcoin hit 1mil that would be worth close to 10 billion.",t3_mbxz5b,2021-03-24 17:07:28,2021-03-24
762,gs0wvgb,t1_gs0wd32,"r/Bitcoin A community dedicated to Bitcoin, the currency of the Internet and Tesla. Bitcoin is a distributed, worldwide, decentralized digital money managed by Elon Musk's Twitter account.",t3_mbxz5b,2021-03-24 15:42:00,2021-03-24
763,gs1eul4,t1_gs1ef8c,I'll have what he's having.,t3_mbxz5b,2021-03-24 20:06:14,2021-03-24
764,gs1geru,t1_gs1ezhu,"Yea its only fun when number go up, lets see if you can hold through the dumps",t3_mbxz5b,2021-03-24 20:22:26,2021-03-24
765,gs1hll2,t1_gs1h1up,Hoping a bunch of shorts get liquidated on Friday,t3_mbxz5b,2021-03-24 20:34:01,2021-03-24
766,gs1juqa,t1_gs1j6po,Never bet against Willy,t3_mbxz5b,2021-03-24 20:55:11,2021-03-24
770,gs0r3pb,t1_gs0pk0e,"I dunno, you sound kind of worried 😂 But don’t worry! There’s nothing to worry about... or is there? No..yes?! *strokes out*",t3_mbxz5b,2021-03-24 14:13:42,2021-03-24
771,gs0zii5,t1_gs0yybe,I am not wondering at all. Elon launched another rocket.,t3_mbxz5b,2021-03-24 16:23:41,2021-03-24
772,gs11csp,t1_gs0z469,Bitcoin can't. If only Elon would tweet it...,t3_mbxz5b,2021-03-24 16:53:59,2021-03-24
773,gs18pkw,t1_gs16k3c,It means people with a lot of money or institutions are buying to hodl or actually use the currency as designed. It means they think it's value will continue to grow. It means if you are selling your BTC you might regret it years from now.,t3_mbxz5b,2021-03-24 18:51:16,2021-03-24
774,gs1ax51,t1_gs16k3c,"This was the real news in the last 24-48 hours, far beyond the importance of the Tesla announcement and it's not getting much attention nor impacting price action.  I think everyone's waiting for buyer to identify themselves.",t3_mbxz5b,2021-03-24 19:20:31,2021-03-24
782,gs0tl8g,t1_gs0sy6f,"Whoa! Interesting, let’s see what happens today!",t3_mbxz5b,2021-03-24 14:51:37,2021-03-24
783,gs1eq2v,t1_gs1ee6k,Buying a depreciating “asset” with an appreciating asset. To quote the legend that is Willy Woo ;). Not the best thing to do. Rather exchange fiat for BTC and add to the amount of BTC being locked up.,t3_mbxz5b,2021-03-24 20:04:53,2021-03-24
784,gs1npl1,t1_gs1llkw,We study billionaires do a bitcoin podcast every Wednesday and it’s really good. Agree with what bitcoin did.,t3_mbxz5b,2021-03-24 21:28:32,2021-03-24
785,gs1o6al,t1_gs1llkw,"Dan Held is great not sure if that qualifies as a podcast, the podcast Andreas Antonopolous is on I am forgetting the name of it.",t3_mbxz5b,2021-03-24 21:32:23,2021-03-24
786,gs1pl4f,t1_gs1pey2,holy shit ur right. maybe tesla announcement was timed on purpose lol,t3_mbxz5b,2021-03-24 21:43:44,2021-03-24
796,gs1a996,t1_gs1a2yy,Buy her some hash browns for me.,t3_mbxz5b,2021-03-24 19:12:07,2021-03-24
