,comment_id,comment_parent_id,comment_body,comment_link_id,created,date
2024,gpqrzj0,t1_gpqp83d,"I first bought a house out of school and rented out my spare bedrooms to friends. The house not only had utility by giving me a place to live, but it allowed me to essentially short the dollar by taking out a massive loan of 180k. As rent rose for my friends mine did not bc it's a fixed mortgage, now I'm renting it out at 2k a month and my payment is 1100 on a 15 year (tenants, I outgrew roomates).


I first learned about btc when it was $7 and bought in at $130, but I didnt buy much. Living well under my means (always had a free and clear reliable car, I wear clothes from costco, I dont take extravagant vacations) I just stacked sats for literally 7 years to this day. Given my low income out of school I could only buy $20 here and there, but that soon turned to $100, and now I buy around $2k a month. Trust me, those small buys you're making today feel like nothing but they are huge in the long run.

If I were to graduate right now, I'd do the same thing. First but a shitty house close to the city in a shitty neighborhood. Fix it up, everything you need to learn is on youtube. You'll learn valuable skills, save money, and increase the value of your asset. Rent out spare rooms while you're young. Eventually your neighborhood will improve (scary at first but if you're poor like I was you dont have much Choice, dont be house poor, ie over extended on your mortgage) and the house will skyrocket in value

With any excess capital you can muster buy btc.

I'd also recommend taking out a 0% credit card if you can qualify and roll that baby perpetually (I've rolled 10k for 6 years, I didnt buy btc on credit, I rolled my current debt to it which freed up capital) and buy as many sats as you can when you can. Pray for dips.

I only over extended myself once when I had to put new flooring in, and was forced to sell an entire btc at a disgusting 4500 in early 2019, sad. I try and keep as little cash in my bank account as possible. Even now with a baby on the way and a rental, making 6 figures, I keep only ~3k in my bank account. I know I can get a 0% credit card in case of emergency or worst case, I am forced to sell some btc.

I have never owned stocks. I have a 401k with company match that I max out, but since I am so overweight in btc I'm forced to hold the second worst asset besides cash, which are treasuries. That way I'm protected if shit hits the fan. I also own a small amount of gold and silver. I also shy away from stocks bc it feels rigged, from HFT to brokers front running your trades to the robbinhood fiasco.

 I dont believe in diversification when building wealth. Concentrate your investments when building wealth and diversify when you need to protect it",t3_lxwz7v,2021-03-05 13:32:29,2021-03-05
2026,gpqpvnn,t1_gpqp4ty,I wish I had a whole Bitcoin,t3_lxwz7v,2021-03-05 13:08:56,2021-03-05
2027,gpqjhs0,t1_gpq5p23,Doge to the moon baby!,t3_lxwz7v,2021-03-05 12:03:17,2021-03-05
2028,gpq6bjd,t1_gpq5p23,"I am so curious, what's the celeb push all about? And there are now Doge ATMs, and Elon buying in? And now Cuban allows Doge as payment for Mav tix and swag? I mean, for a worthless coin, its got so much more traction than other coins.

Edit, not saying doge is moving faster than other coings, Bitcoin, but its moving none the less. It's brought tons into crypto, including me. I own big chunks of 6 other cryps.",t3_lxwz7v,2021-03-05 10:04:13,2021-03-05
2029,gpqoq73,t1_gpqo2kq,"What area are you in? Are you American? I think things are a bit different here. I know someone who did a residency and works in a cancer centre and he started at 125k but his resume was wayyyy more stacked than mine, I’d have no hope of getting that job.",t3_lxwz7v,2021-03-05 12:56:19,2021-03-05
2030,gps0vk3,t1_gpqo2kq,"Retail pharmacists make more than clinical pharmacists in California. My fiance gets paid $70/hr and it's here first job out of school. We are both 2018 grads too. It's nuts.

I went the industry route and I get paid well but not that well compared to her.",t3_lxwz7v,2021-03-05 22:54:26,2021-03-05
2031,gpqn9oh,t1_gpqm8h0,"I’m aware of the situation in America, your first mistake is assuming I live in America. I’ll work in the arctic if I have to, I don’t care. I already come from the middle of nowhere, the arctic wouldn’t be much worse... and I’m not saying that sarcastically. 

I do appreciate the concern, it’s easy to read this and see “young 25yo with no life experience thinks he’s going to make 100k” but trust me when I say this, I’ve done my homework. “Real life” hit me years ago when my bank accounts were all at 0 and I had to live off of a $2000 line of credit while somehow managing to keep myself in school and working over 20 hours / week to not suffer catastrophic financial failure. I don’t have anyone helping me, I’ve done this all on my own and I’m fucking proud of myself. You can say a lot of things about me but naive is not one of them.",t3_lxwz7v,2021-03-05 12:40:51,2021-03-05
2032,gpqyzlv,t1_gpqyvu6,Yes I’m an AI that is trying to trick people into going to pharmacy school and dump all of their money into Bitcoin,t3_lxwz7v,2021-03-05 15:01:49,2021-03-05
2033,gpqt0g0,t1_gpqm71a,"Nobody really cares about the GPA, but the school is really important. Also, a lot of graduates can walk into FAANG and make $100k+ out of the gate. The overall tone (and expectations) from this individual does not make me think he is of that ilk, though.",t3_lxwz7v,2021-03-05 13:44:35,2021-03-05
2035,gpqodl7,t1_gpqm71a,Lol. Most cs jobs at any company that’s not trash is 100+ starting with a masters,t3_lxwz7v,2021-03-05 12:52:33,2021-03-05
2036,gpqpoga,t1_gpqm71a,"With a little frugality and being smart with your money, that’s enough to invest 20-30k+ annually.",t3_lxwz7v,2021-03-05 13:06:43,2021-03-05
2037,gprzhtt,t1_gpqm71a,Depends where you live and what sort of CS you're dealing with. 100k is def not unreasonable in a large American city as a starting salary for a software developer.,t3_lxwz7v,2021-03-05 22:43:25,2021-03-05
2038,gpqki0m,t1_gpqf8zv,"I graduated in June 2020, couldn’t even get an interview for 6 months I think mostly cause Covid slowed hiring, then got a job that pays solidly over 100k at <big tech company>. I feel very lucky now, but those 6 months of just sending out resumes and hearing nothing were brutal.",t3_lxwz7v,2021-03-05 12:13:03,2021-03-05
2039,gprlqgp,t1_gpr3ql9,I think about going to college sometimes still. I wish I could tbh and get a chem e degree or be a EE. But I am having a hard time justifying it.,t3_lxwz7v,2021-03-05 20:33:34,2021-03-05
2040,gprfx9l,t1_gpr3ql9,"Skipped a greater amount of debt?

Skipped a four year degree?

Skipping college in lieu of a trade doesn’t discount the trade.",t3_lxwz7v,2021-03-05 19:16:22,2021-03-05
2041,gprwdn7,t1_gprv7b9,"I'm actually an electrician in the midwest. I never got my license but I'm what they call and ""instrumentation electrician"". It's been good to me. Basically, manufacturing facilities have measurement devices that need calibrated and maintaining. They measure pressure, level, pH, conductivity, flow, gas concentration, all kinds of stuff. I have about 3-4 years experience and specialize in emissions monitoring devices. Basically gas chromatography and mas spectrometry. Some community colleges offer instrumentation classes, so after like a two year degree you can just straight in the field, or become a licensed electrician through your local union and then learn instrumentation on the job. Salaries range from 20-40/hr",t3_lxwz7v,2021-03-05 22:17:40,2021-03-05
2042,gpr0adl,t1_gpqoch5,"You're young, but you won't be for much longer. If there's any time in your life to take risks, it's now. In 5 years, not so much.  

Take advantage of this time where you have low overhead and disposable income. I won't tell you to be risk averse- but most people should be.",t3_lxwz7v,2021-03-05 15:20:11,2021-03-05
2043,gpqiigd,t1_gpqh9kg,"The cost of living is much higher than most of the US, but if you want a high paying job in software, it's probably not going to be in a LCOL area. I don't make $200k/yr and I'm doing fine in the Bay.",t3_lxwz7v,2021-03-05 11:53:52,2021-03-05
2044,gpqjtgk,t1_gpqh9kg,"Option A: 100K pay; $1000/m rent
Option B: 200K pay; $2000/m rent

What do you prefer? That's right! That's bay area for you.",t3_lxwz7v,2021-03-05 12:06:25,2021-03-05
2045,gpqtxp2,t1_gpqinp9,"Maybe not median, but most tech sales jobs at good companies are paying $80k entry level, then promoting to $120k-$140k after 12-18 months, $160k for 3 years, $200k 5 years. That’s before stock options.",t3_lxwz7v,2021-03-05 13:55:38,2021-03-05
2046,gpqjh7x,t1_gpqinp9,"My younger brother earns $240K with stocks and has 2 yr experience. I never said everyone earns this nor did I say it is the median. All I'm saying is it is not an anamoly at all. Before you ask, no he did not go to Stanford or Ivy league. BS from random non name university. He works for Uber btw.",t3_lxwz7v,2021-03-05 12:03:08,2021-03-05
2047,gpqqs0p,t1_gpqnoem,"Your pay increases as you gain more experience. Average of 5 of my friend's pay would be 300K. Some of them make 400+. 
TIL so many people have no clue about tech industry and it's salaries in Silicon Valley. I guess good for us in a way - less competition :)",t3_lxwz7v,2021-03-05 13:18:50,2021-03-05
2048,gpqugrj,t1_gpqtbv0,It's a myth that only big boys or unicorn companies pay high. I constantly hear this myth especially from people outside bay area.,t3_lxwz7v,2021-03-05 14:02:12,2021-03-05
2049,gppy9u0,t1_gppy1co,Lol no I started in industrial blast and paint. Got into inspection for industrial blast and paint. Then got into sales for coatings and equipment. It’s a very specialized job no one wants to do. I have very little competition.,t3_lxwz7v,2021-03-05 08:54:39,2021-03-05
2050,gpqcmf2,t1_gppy1co,Typical for you to say that. Name one reason why a 22 can’t make 6 figures on his own. I’ll wait. *dies*,t3_lxwz7v,2021-03-05 10:59:22,2021-03-05
2051,gpqi92s,t1_gppy1co,"22 here, will be starting with a defense contracting company at 100k base salary + benefits a few weeks before I turn 23 in June. 

I enlisted in the military right of high school, got insanely lucky getting sent to a cyber course and ending up as an analyst under USCYBERCOM. All my friends that are getting out are starting a bit higher than me. None of us have completed our degrees yet, but most of us have some comptia certs and a lot of relevant training/experience. 

It’s not particularly common to see 20-somethings with 6-figure jobs that aren’t from nepotism, but it definitely happens.",t3_lxwz7v,2021-03-05 11:51:24,2021-03-05
2052,gpq2yar,t1_gpq2q0x,Look into NACE 1. It’s the coatings inspector course I took to get started. It’s a 1 week class the can get you going at 30 dollars an hour if your willing to travel. It takes 5 years to get through level 3. But I charge 100 dollars an hour as a level 2 with 4 years experience.,t3_lxwz7v,2021-03-05 09:34:54,2021-03-05
2053,gpqd27b,t1_gpqbmcu,He said something true but not the way you wanted to hear it **destroy him**,t3_lxwz7v,2021-03-05 11:03:19,2021-03-05
2054,gpqlz2d,t1_gppqzzs,"And he's in Pharmacy... Oof, I was thinking he was CS. Pharmacy is incredible oversaturated. Half my friends out of pharmacy school either had to move to the middle of nowhere or do a research position that pays half the price as a regular pharmacist. There is very little guarantee for jobs straight out of school for pharmacy right now.",t3_lxwz7v,2021-03-05 12:27:38,2021-03-05
2055,gpq4j8x,t1_gppqzzs,[deleted],t3_lxwz7v,2021-03-05 09:48:39,2021-03-05
2056,gppre2d,t1_gppqzzs,"Entry level is $52 and it tops out at $60, management roles will make a hair more, and most franchise owners are paid a 200k salary with profit sharing incentives but you’re right I didn’t do my homework before I went to school for over 6 years and obtained a doctoral degree",t3_lxwz7v,2021-03-05 07:55:52,2021-03-05
2057,gpqjafv,t1_gppqzzs,Same. It took me nearly 10 years to finally hit over 100k,t3_lxwz7v,2021-03-05 12:01:20,2021-03-05
2058,gpqe446,t1_gpqaln8,Lmao fr,t3_lxwz7v,2021-03-05 11:12:59,2021-03-05
2059,gpqm21u,t1_gpqaln8,"He's in pharmacy. Pharmacy is incredible oversaturated. Half my friends out of pharmacy school either had to move to the middle of nowhere or do a research position that pays half the price as a regular pharmacist. There is very little guarantee for jobs straight out of school for pharmacy right now. Yes, 100k out of school is possible... if you live in a high cost of living area, and even manage to find a position in the first place.",t3_lxwz7v,2021-03-05 12:28:29,2021-03-05
2060,gpqm4px,t1_gpq1n7u,100k a year is not a conservative estimate for pharmacy. Starting pay is around 60-80. And pharmacy is incredible oversaturated. Half my friends out of pharmacy school either had to move to the middle of nowhere or do a research position that pays half the price as a regular pharmacist. There is very little guarantee for jobs straight out of school for pharmacy right now.,t3_lxwz7v,2021-03-05 12:29:14,2021-03-05
2061,gpq9xed,t1_gpq4wux,"Yea and he also went to college for 8+ years. It’s not right out of college, it’s 4-5 years post graduate where other people were making 50k+ a year during that time and not taking on school debt. OTOH, a good software engineer in Silicon Valley is making $250k total comp their first year out of undergrad. Don’t believe me? Take a look on the blind app.",t3_lxwz7v,2021-03-05 10:35:41,2021-03-05
2062,gpr0zhb,t1_gpqxewi,"The world is a cold place, and I think it’s important people learn that early. It really sucks to have the rose tinted glasses shattered, but eventually, you find those things that truly make you happy. 

I think my perspective really changed when I realized I had plenty of money but very few close friends. There’s really some truth to “money can’t buy you happiness”. That’s something you hear a ton but really can’t understand until you experience it. 

All this to say, there’s so, so much more to life than just running the rat race. 

I hope after the dust settles here, this guy has the chance to really reflect on himself and to try to see the world from a different perspective. It’s hard, but worth it.",t3_lxwz7v,2021-03-05 15:30:15,2021-03-05
2063,gpr8bos,t1_gpqxewi,Nice advice,t3_lxwz7v,2021-03-05 17:18:44,2021-03-05
2064,gpqzc7b,t1_gpqsy2q,"Ok my plan is simple

Step 1 invest all extra money I have for 10 years into crypto

Step 2 become a millionaire",t3_lxwz7v,2021-03-05 15:06:46,2021-03-05
2067,gprzku1,t1_gprude0,"What bullet?

Please enlighten me as to how buying assets is worse than a new car, a fancy apartment, name brand clothes, etc every other young adult is buying.

It really isn’t that hard to make money if you reverse engineer your life. I need x amount by 35 years old

Therefore I need to invest in x amount of houses that pay x monthly

Therefor I need to save x amount to purchase those said cash flowing properties 

How many hours do I need to work at my corporate job to obtain that. Oh it isn’t enough? Look who’s gonna do instacart this weekend!

People over think money. It starts with the mindset first.",t3_lxwz7v,2021-03-05 22:44:04,2021-03-05
2069,gpqelas,t1_gpqa4qj,25 redditors,t3_lxwz7v,2021-03-05 11:17:22,2021-03-05
2070,gpqp2d8,t1_gpqkbu9,Thoughts and prayers 🙏🏼,t3_lxwz7v,2021-03-05 13:00:02,2021-03-05
2072,gpqgbad,t1_gpqbtzh,"It’s okay, you’re still early! We are the few!",t3_lxwz7v,2021-03-05 11:33:14,2021-03-05
2073,gpqleef,t1_gpqbtzh,Even if you did you prob would of sold at $500. Only a select couple people held from $5 all the way to $50k. I also knew about bitcoin back in 2011-2012 and if we had trading apps on cell phones at the time I prob would have got in on it. We didn't even have cell phones back then. Times have changed.,t3_lxwz7v,2021-03-05 12:21:56,2021-03-05
2074,gpqx516,t1_gpqrhs9,Don't need it we got bitcoin remember lol,t3_lxwz7v,2021-03-05 14:36:48,2021-03-05
2075,gpr39ka,t1_gpqhfpb,"i'm not sure its corrrect to say like that, for example if i invest 1k into bitcoin, the max income i can get if it reaches 1m is 20k. Not the changing life amount though.",t3_lxwz7v,2021-03-05 16:03:42,2021-03-05
2076,gpqlcjo,t1_gpqhfpb,"yeh I know, just I got in at basically the earliest time possible for me. I was still an infant in 2009",t3_lxwz7v,2021-03-05 12:21:26,2021-03-05
2077,gpqi8fq,t1_gpqgmhm,"OP will be fine. Apparently he’s going to be a pharmacist, so he can pop some Xanax if the bitcoin market tanks.",t3_lxwz7v,2021-03-05 11:51:14,2021-03-05
2078,gpqhbn0,t1_gpq3guy,"I honestly think of my BTC as a purchase rather than an investment. Move on with my life as if the money doesn’t exist. No plan on selling it, so I don’t consider it part of my buying power. We will see where it goes, but I think many in this sub don’t accept that buying BTC is still speculating. And people don’t realize you can agree that it is a speculative move to buy btc and still be a long term hodler",t3_lxwz7v,2021-03-05 11:42:39,2021-03-05
2079,gpqmkoh,t1_gpqgez5,👆The real retirement.,t3_lxwz7v,2021-03-05 12:33:44,2021-03-05
2080,gpq7gh7,t1_gppo7sf,"But why do you say you intend to retire at 35? I‘m sure you could do it with some pay raises along the way and frugal living. However, it’s impossible to say how the asset market will develop in the next 15 years. We might even get a war or big economic conflict somewhere in between. There are many known knowns... you know the... thing. All I’m saying is: don’t jinx it",t3_lxwz7v,2021-03-05 10:14:12,2021-03-05
2081,gpq5spm,t1_gpq2nsa,"when goldman sachs re-opens their trading desk, thats the top/dump signal, fyi",t3_lxwz7v,2021-03-05 09:59:39,2021-03-05
2082,gpq60cg,t1_gpq2nsa,"Yeah I have a few friends and family members that are my unwitting “indicators”, and have asked a few coin-hodlers I know to let me know if crypto starts showing up in their day to day. None of them have triggered yet - except apparently my stepfather got a spam email saying his password would be leaked if he didn’t send BTC. Stuff like that probably helps delay the FOMO trade. :)",t3_lxwz7v,2021-03-05 10:01:29,2021-03-05
2083,gpqpck5,t1_gpqno5s,"Yeah works great, rounds up your change on your debit purchases and then buys bitcoin on your exchange that you link it to.",t3_lxwz7v,2021-03-05 13:03:06,2021-03-05
2084,gppp61t,t1_gppp0ym,Cool. I don’t think you read that point as it was intended. Thank you though.,t3_lxwz7v,2021-03-05 07:37:00,2021-03-05
2085,gpq1n6e,t1_gppp0ym,"I kinda agree with you, some of us dont want to “develop ourselves”. Ive met a ton of people working breakfast shifts in hotels that owns a few houses around the country. 

To each their own. If working around your boss, coworkers and serving customers makes you happy, who’s to say you’re wrong?",t3_lxwz7v,2021-03-05 09:23:37,2021-03-05
2086,gpq54bz,t1_gppp0ym,Where do you work? Or rather what do you do?,t3_lxwz7v,2021-03-05 09:53:44,2021-03-05
2087,gppprbi,t1_gppjgka,"Exactly, maybe reduce hours but fuck not working at all.",t3_lxwz7v,2021-03-05 07:41:57,2021-03-05
2089,gpq9d0m,t1_gpq6bjd,Omg someone help this man. They print 17 million coins...A DAY! Lmao please DYOR,t3_lxwz7v,2021-03-05 10:30:45,2021-03-05
2090,gpqo50y,t1_gpq6bjd,"It could do decently during this bull market, but I think it'll be one of the coins that suffers the most during the eventual bear market. Hype doesn't really help with longevity. Plus my view is that a payment coin won't really be that successful for years. Payment coins won't be needed until crypto matures more.",t3_lxwz7v,2021-03-05 12:49:58,2021-03-05
2091,gpqovqn,t1_gpqoq73,"Oh, hmm. Might be the area I’m in. Southeast USA. High supply of pharmacists wanting to live here. But even in other states where my friends work, retail makes 20k more starting than inpatient clinical.",t3_lxwz7v,2021-03-05 12:58:00,2021-03-05
2092,gpqpejy,t1_gpqn9oh,I knew you were not American when you wrote tonnes and tonnes 😊,t3_lxwz7v,2021-03-05 13:03:44,2021-03-05
2093,gpr16ot,t1_gpqn9oh,You certainly have the attitude of a 25 year old,t3_lxwz7v,2021-03-05 15:33:09,2021-03-05
2094,gpr49as,t1_gpqn9oh,"I can understand people assuming you live in America when you say your expected salary in ""$""",t3_lxwz7v,2021-03-05 16:18:41,2021-03-05
2095,gpqp7gi,t1_gpqn9oh,I’m with you bro... (from Russia)😅,t3_lxwz7v,2021-03-05 13:01:34,2021-03-05
2096,gpriak4,t1_gpqn9oh,"“I’ll work in the Arctic if I have to”

That still doesn’t mean you can just go and start working in the Arctic whenever you want to lol",t3_lxwz7v,2021-03-05 19:49:57,2021-03-05
2097,gpqyldr,t1_gpqn9oh,Yo good shit brother,t3_lxwz7v,2021-03-05 14:56:26,2021-03-05
2098,gps0ho7,t1_gpqn9oh,"Yo there’s a lot of jealous people in this thread who wish they had the confidence you have at 25. Don’t listen to the haters, you do you man. Why not aim high.",t3_lxwz7v,2021-03-05 22:51:24,2021-03-05
2099,gpqvhdp,t1_gpqn9oh,You had to live off $2000 wow that’s tough,t3_lxwz7v,2021-03-05 14:15:02,2021-03-05
2100,gps0jhp,t1_gpqn9oh,"Props to you for keeping your head afloat and not stopping the fight even when it was grim. 

Also keep in mind that you never owe anyone an explanation of what hardships you went through to shape who you are and how far you've come. Keep on fighting and living on the BTC standard and you'll make your life happen.👍👍",t3_lxwz7v,2021-03-05 22:51:48,2021-03-05
2101,gpqoizt,t1_gpqodl7,OP didn’t say anywhere they were getting their masters.,t3_lxwz7v,2021-03-05 12:54:10,2021-03-05
2102,gpqpumn,t1_gpqpoga,Yeah if you own your house. Have you seen rental prices?,t3_lxwz7v,2021-03-05 13:08:37,2021-03-05
2103,gpqn35a,t1_gpqki0m,Good job man. Im familiar with that whole process. Glad you landed something! Stay relevant with the tech is my advice. Shit changes  consistently. 100k straight out of CS or Bootcamp is very rare outside if California!- Front End Dev,t3_lxwz7v,2021-03-05 12:38:58,2021-03-05
2104,gprzkog,t1_gpqki0m,">How much take home pay do you have after taxes, health insurance etc?",t3_lxwz7v,2021-03-05 22:44:02,2021-03-05
2106,gprshqc,t1_gprfx9l,"Didn’t skip being educated on new skills. 
Didn’t skip on sitting in classroom and getting hands on training/education.",t3_lxwz7v,2021-03-05 21:43:42,2021-03-05
2107,gpqqnwa,t1_gpqiigd,A lot of companies are moving to remote/flexible working environments though.,t3_lxwz7v,2021-03-05 13:17:34,2021-03-05
2108,gpqklzl,t1_gpqjtgk,Lmao you sweet summer child. If only the rent were $2000 lol.,t3_lxwz7v,2021-03-05 12:14:09,2021-03-05
2109,gpqkfeg,t1_gpqjtgk,I have a feeling rent for the Bay Area is a lot more expensive than that.,t3_lxwz7v,2021-03-05 12:12:19,2021-03-05
2110,gpqlh96,t1_gpqjh7x,"Right, I was trying to temper their expectations. While your brother may not be an anomaly, he also is likely not the median developer.",t3_lxwz7v,2021-03-05 12:22:41,2021-03-05
2111,gpqabem,t1_gppy9u0,Damn now thats smart,t3_lxwz7v,2021-03-05 10:39:03,2021-03-05
2112,gpr3pgt,t1_gppy9u0,"Sales is one of those unique areas that is highly skilled work, but there's no formal education for it. You can either do really well or you can flounder, and your performance directly impacts your salary moreso than almost any other job (aside from owning a business).",t3_lxwz7v,2021-03-05 16:10:20,2021-03-05
2113,gpqsfiy,t1_gpqi92s,I knew I should have joined the military out of highschool,t3_lxwz7v,2021-03-05 13:37:42,2021-03-05
2114,gpq3doy,t1_gpq2yar,"I am certainly going to take a good look into this, that is very appreciated. 🤟🏻",t3_lxwz7v,2021-03-05 09:38:34,2021-03-05
2115,gpqetf4,t1_gpq2yar,Travel or relocate?,t3_lxwz7v,2021-03-05 11:19:21,2021-03-05
2116,gpqm95x,t1_gpqlz2d,"This kid is sure is optimistic lol. However I think the fact the he acts like he is 18 is going to hurt him. But he knows everything, so he may be right.",t3_lxwz7v,2021-03-05 12:30:30,2021-03-05
2117,gpqy52b,t1_gpqlz2d,Your first mistake is assuming I’m American. Nobody in my area has issues finding jobs.,t3_lxwz7v,2021-03-05 14:50:09,2021-03-05
2118,gpq5in5,t1_gpq4j8x,IF you can find a job.  Its SATURATED.,t3_lxwz7v,2021-03-05 09:57:14,2021-03-05
2119,gpq9e7e,t1_gpq4j8x,Pharmacy is 5 years of post grad education where you’re taking on $150k in debt during that time.,t3_lxwz7v,2021-03-05 10:31:02,2021-03-05
2120,gppv3mw,t1_gppre2d,"Don't worry, he's just jealous.

Mind if I ask what it is that you do to make this kind of cheddar? Lol. I just want to know why I went to business school.",t3_lxwz7v,2021-03-05 08:27:19,2021-03-05
2121,gpqy7ny,t1_gpqm21u,I’m not American.  Nobody has issues finding work here because nobody wants to live here.,t3_lxwz7v,2021-03-05 14:51:07,2021-03-05
2122,gpqo3lk,t1_gpqm4px,"You really went and copy pasted your essay into every comment in this thread, huh? Moral here... It’s not that deep. Your anecdotes don’t make what OP said any more or less true, or any more or less possible. You’re the type of person that gets offended and defensive when they hear the starting salary for my professional degree is, for a significant number of people, 190k. Just because you believe something doesn’t make it any more of less true.",t3_lxwz7v,2021-03-05 12:49:33,2021-03-05
2123,gpqitnu,t1_gpq9xed,"He is delusional, the median salary of pharmacist is $128,090 according to U.S. Bureau of Labor Statistics but the starting pay for entry level is $56,038 in the highest paying new york state. 


This is a PharmD student thinking he earns more right out of college dispensing meds than a MD writing the prescription.",t3_lxwz7v,2021-03-05 11:56:51,2021-03-05
2125,gprkcb9,t1_gpqzc7b,Plan is flawless,t3_lxwz7v,2021-03-05 20:16:36,2021-03-05
