,comment_id,comment_parent_id,comment_body,comment_link_id,created,date
2274,gsykm46,t3_mh4vyk,"QUIT COINBASE ,they even attach a their own code onto your transaction to not get xbt from gamble pages...",t3_mh4vyk,2021-04-01 05:23:24,2021-04-01
2275,gsz6ojl,t3_mh4vyk,Oh that definitely merited a slap on the wrist.,t3_mh4vyk,2021-04-01 08:35:03,2021-04-01
2276,gszbtuv,t3_mh4vyk,Just another reason why crypto will never become the standard.,t3_mh4vyk,2021-04-01 09:20:05,2021-04-01
2277,gszu343,t3_mh4vyk,6.5m!? what that a fine for ants?,t3_mh4vyk,2021-04-01 12:13:36,2021-04-01
2278,gszuihx,t3_mh4vyk,I was charged 18$ to transfer crypto from Coinbase to my Coinbase wallet,t3_mh4vyk,2021-04-01 12:18:13,2021-04-01
2279,gt00y6h,t3_mh4vyk,"Ahhhh, untrustworthy institutions. It had been a while.",t3_mh4vyk,2021-04-01 13:37:09,2021-04-01
2280,gt06avs,t3_mh4vyk,"with the numerous times they ""crashed"" during crazy price movements, is anyone shocked?",t3_mh4vyk,2021-04-01 14:53:47,2021-04-01
2281,gt06k0c,t3_mh4vyk,Gas fees,t3_mh4vyk,2021-04-01 14:57:42,2021-04-01
2282,gt0eb52,t3_mh4vyk,I do occasionally get the sense that I'm trading against myself.,t3_mh4vyk,2021-04-01 16:56:41,2021-04-01
2285,gsx942k,t3_mh4vyk,"So stealing people's money essentially? Sounds great for all those original people who believed in decentralization right? Cause the purpose of Bitcoin was to prevent people manipulating markets and currencies correct? I always say, regardless of your intentions someone else always has their own and unless you account for every scenario ( which is near impossible) someone will take something created for the good of mankind and poison it with their greedy intentions. So to say I'm not surprised would be an understatement but this should propose the question if we move into a completely digital currency market what's preventing them or anyone from manipulation on a macro level?",t3_mh4vyk,2021-03-31 23:23:06,2021-03-31
2287,gsx6n9i,t3_mh4vyk,"This is simply the result of the settlement/agreement with the CFTC - what was agreed by both parties would become public as a result of the guilty plea.

What they were actually caught doing would make Bernie Madoff look like a street corner coin-shaver.

Only keep on Coinbase that which you can afford to lose.",t3_mh4vyk,2021-03-31 23:04:07,2021-03-31
2290,gsx6a86,t3_mh4vyk,"It seems to me that many crypto exchanges do this, don't they?",t3_mh4vyk,2021-03-31 23:01:16,2021-03-31
2291,gsx8q8e,t3_mh4vyk,Lots of Coinbase fud here,t3_mh4vyk,2021-03-31 23:20:13,2021-03-31
2292,gsxb4gq,t3_mh4vyk,I knew their market prices were always off. Def got jipped by them.,t3_mh4vyk,2021-03-31 23:38:22,2021-03-31
2293,gsxrdw2,t3_mh4vyk,"coinbase sux, robinhood also",t3_mh4vyk,2021-04-01 01:39:51,2021-04-01
2294,gsy5d2m,t3_mh4vyk,"Bitcoin is a distributed, worldwide, decentralized digital money. Bitcoins are issued and managed without any central authority whatsoever: there is no government, company, or bank in charge of Bitcoin. Now pay this fine or go to federal prison.",t3_mh4vyk,2021-04-01 03:26:19,2021-04-01
2295,gsy5x7v,t3_mh4vyk,"Instead of acting supprised and shocked, I'm going to share this link with forums, sites & everyone I know. Gemini is about to get a shout out. Coinbase never deserves our business after attempting to hold bitcoin back for the rich to scoop up bitcoin while destroying our positions.",t3_mh4vyk,2021-04-01 03:30:36,2021-04-01
2296,gsym8ff,t3_mh4vyk,Coinbase was found to be â€œvicariously liableâ€. Hahahaha. I want to be vicariously liable for living like Tom Cruise. This comes 3 years after the â€œbad behaviorâ€ was self corrected. Regulators love to appear after the â€œaccidentâ€ to collect their pins of flesh. Clowns.,t3_mh4vyk,2021-04-01 05:36:36,2021-04-01
2300,gsyjyba,t3_mh4vyk,Tip of the fucking iceberg when it comes to crypto manipulation. In no legit and sane world is bitcoin worth $50K+.,t3_mh4vyk,2021-04-01 05:18:11,2021-04-01
2301,gszufrv,t3_mh4vyk,"I'm telling you guys, we really need to start making crime illegal!!!

elect more democrats!",t3_mh4vyk,2021-04-01 12:17:24,2021-04-01
2302,gsxcl4a,t3_mh4vyk,So what. Is bots illegal? No. So there is no f**** problem.,t3_mh4vyk,2021-03-31 23:49:17,2021-03-31
2303,gsx67px,t3_mh4vyk,"When we come back and bust their asses, we are going to lock them up in the federal reserve!",t3_mh4vyk,2021-03-31 23:00:43,2021-03-31
2304,gsx6bv9,t3_mh4vyk,Tut tut tut,t3_mh4vyk,2021-03-31 23:01:37,2021-03-31
2305,gsx97lp,t3_mh4vyk,I knew something was occurred,t3_mh4vyk,2021-03-31 23:23:52,2021-03-31
2306,gsx9bos,t3_mh4vyk,Dis is why DeFi!!!!!!,t3_mh4vyk,2021-03-31 23:24:44,2021-03-31
2307,gsx9say,t3_mh4vyk,THROW YOUR DOLLARS IN THE HARBOR,t3_mh4vyk,2021-03-31 23:28:14,2021-03-31
2308,gsx9w6o,t3_mh4vyk,Damn...,t3_mh4vyk,2021-03-31 23:29:04,2021-03-31
2309,gsxa0iq,t3_mh4vyk,I'm not surprised MF's,t3_mh4vyk,2021-03-31 23:29:59,2021-03-31
2310,gsxae55,t3_mh4vyk,Shocking,t3_mh4vyk,2021-03-31 23:32:51,2021-03-31
2311,gsxaze2,t3_mh4vyk,h,t3_mh4vyk,2021-03-31 23:37:19,2021-03-31
2312,gsxbtpi,t3_mh4vyk,Marcus and Willy are back? Lmfao crypto is such shit.,t3_mh4vyk,2021-03-31 23:43:37,2021-03-31
2313,gsxby51,t3_mh4vyk,ðŸ™„,t3_mh4vyk,2021-03-31 23:44:33,2021-03-31
2314,gsxc6bp,t3_mh4vyk,Pocket change,t3_mh4vyk,2021-03-31 23:46:15,2021-03-31
2315,gsxd07w,t3_mh4vyk,Assholes. I knew it!  They all are. What a joke. Rich get richer.,t3_mh4vyk,2021-03-31 23:52:24,2021-03-31
2316,gsxdc84,t3_mh4vyk,"pocket money to them, lol",t3_mh4vyk,2021-03-31 23:54:52,2021-03-31
2317,gsxdlk6,t3_mh4vyk,No shit lmfao,t3_mh4vyk,2021-03-31 23:56:48,2021-03-31
2318,gsxe9sg,t3_mh4vyk,Shocked. I'm totally shocked. Who would have thought this. Lol.,t3_mh4vyk,2021-04-01 00:01:51,2021-04-01
2319,gsxejuh,t3_mh4vyk,So that means they got better shit to do than help me get bacc into my account ðŸ™ƒ,t3_mh4vyk,2021-04-01 00:03:57,2021-04-01
2320,gsxfd40,t3_mh4vyk,The instructions keeping an eye on Crypto!,t3_mh4vyk,2021-04-01 00:10:04,2021-04-01
2321,gsxfhrv,t3_mh4vyk,phew! at least its not conbase pro!,t3_mh4vyk,2021-04-01 00:11:03,2021-04-01
2322,gsxfk74,t3_mh4vyk,"This is old news, even if recent press release.  The news is just that they finalized a collection order.",t3_mh4vyk,2021-04-01 00:11:35,2021-04-01
2323,gsxfypk,t3_mh4vyk,This was from 2015-2018. Get over it,t3_mh4vyk,2021-04-01 00:14:38,2021-04-01
2324,gsxgf6r,t3_mh4vyk,"I have CoinBase, but Iâ€™m not thrilled with it for these reasons, can some more experienced hodlers and traders tell me how to move the $600 I have in CoinBase to Binance without paying 99% in fees?",t3_mh4vyk,2021-04-01 00:18:02,2021-04-01
2325,gsxghok,t3_mh4vyk,Why anyone would pay 8% fee (average amount an asset will appreciate in a year) beats me,t3_mh4vyk,2021-04-01 00:18:34,2021-04-01
2326,gsxh92l,t3_mh4vyk,Expected it since they ran hidden fees and stuff previously,t3_mh4vyk,2021-04-01 00:24:14,2021-04-01
2327,gsxhnw5,t3_mh4vyk,Itâ€™s funnier what Coinbase paid for Cryptsy settlement,t3_mh4vyk,2021-04-01 00:27:19,2021-04-01
2328,gsxho5i,t3_mh4vyk,Ive yet to find an exchange that isnt doing these things.,t3_mh4vyk,2021-04-01 00:27:22,2021-04-01
2329,gsxiqx8,t3_mh4vyk,Sooo I should probably move my crypto out of my Coinbase wallets...,t3_mh4vyk,2021-04-01 00:35:19,2021-04-01
2330,gsxj18o,t3_mh4vyk,Say what?,t3_mh4vyk,2021-04-01 00:37:29,2021-04-01
2331,gsxjg79,t3_mh4vyk,"Wait, this was illegal ? I thought that was the main point of crypto exchanges.. you manipulate market and collect fees. Never mind.. back to bot writing ;)",t3_mh4vyk,2021-04-01 00:40:33,2021-04-01
2332,gsxk5rw,t3_mh4vyk,Take your btc out of coinbase! They take down the platform numerous times. Cancer shitcoins,t3_mh4vyk,2021-04-01 00:45:50,2021-04-01
2333,gsxkcqp,t3_mh4vyk,how about a class action lawsuit?,t3_mh4vyk,2021-04-01 00:47:17,2021-04-01
2334,gsxkqmq,t3_mh4vyk,This is absolute bullshit. I'm so sick and tired of the deluge of shit posts trying to tear down CB.,t3_mh4vyk,2021-04-01 00:50:09,2021-04-01
2335,gsxl84x,t3_mh4vyk,So same person buying and selling in 2 accounts?,t3_mh4vyk,2021-04-01 00:53:47,2021-04-01
2336,gsxlovp,t3_mh4vyk,Good lord.,t3_mh4vyk,2021-04-01 00:57:13,2021-04-01
2337,gsxmgum,t3_mh4vyk,"Typical reddit lol, 12 day old news article.",t3_mh4vyk,2021-04-01 01:03:02,2021-04-01
2338,gsxmk7q,t3_mh4vyk,You get around same for some OSHA fine at construction site.,t3_mh4vyk,2021-04-01 01:03:44,2021-04-01
2339,gsxmukb,t3_mh4vyk,Different currency same game rules,t3_mh4vyk,2021-04-01 01:05:54,2021-04-01
2340,gsxmvm0,t3_mh4vyk,"Now, what about Robinhood's bots?",t3_mh4vyk,2021-04-01 01:06:07,2021-04-01
2341,gsxo0l8,t3_mh4vyk,2015-2018 at 6.5 million. Are they sure they didnâ€™t mix up fine with additional business cost?,t3_mh4vyk,2021-04-01 01:14:38,2021-04-01
2342,gsxoywo,t3_mh4vyk,Oh no how will they survive that hit,t3_mh4vyk,2021-04-01 01:21:48,2021-04-01
2343,gsxp9mc,t3_mh4vyk,"oh no, anyway...",t3_mh4vyk,2021-04-01 01:24:01,2021-04-01
2344,gsxpaoi,t3_mh4vyk,When they started do you think they wouldnt need market makers?,t3_mh4vyk,2021-04-01 01:24:13,2021-04-01
2345,gsxpnzk,t3_mh4vyk,At this point the only people to be mad at are the idiots still using coinbase,t3_mh4vyk,2021-04-01 01:26:59,2021-04-01
2346,gsxpoaq,t3_mh4vyk,Was it in Bitcoin?,t3_mh4vyk,2021-04-01 01:27:03,2021-04-01
2347,gsxu0hf,t3_mh4vyk,This is like 12 days ago. Why are we hearing about it now?,t3_mh4vyk,2021-04-01 01:59:33,2021-04-01
2348,gsxu9k5,t3_mh4vyk,"Goldman: 

""Welcome to the club boys, 6.5m thats it? Then you didn't make enough money, you'll do better in the future.""",t3_mh4vyk,2021-04-01 02:01:26,2021-04-01
2349,gsxuarp,t3_mh4vyk,"Just wait until you all learn about HFTs!


https://youtu.be/aMhI70KUAzw

70% of the stock market is ran by bots. To denounce the fact that the same isn't happening in crypto would be ignorant.

I invite any of you to scale the order books for a day, you will notice the order executions of these HFTs. Buys for 23 coins @ $1 being executed 10 times within seconds. That's just a broad example.

If you go and watch Matic(Polygon) the order book is cooked with HFT bots fighting it out.",t3_mh4vyk,2021-04-01 02:01:41,2021-04-01
2350,gsxucfu,t3_mh4vyk,its almost as if the current btc valuation is full of hot air ...,t3_mh4vyk,2021-04-01 02:02:03,2021-04-01
2351,gsxvdpl,t3_mh4vyk,And how much did they earn by operating these bots? Is it even close to the fine? I donÂ´t think so...,t3_mh4vyk,2021-04-01 02:09:59,2021-04-01
2352,gsxw3iq,t3_mh4vyk,Wack . Just wack .,t3_mh4vyk,2021-04-01 02:15:30,2021-04-01
2353,gsxwu78,t3_mh4vyk,Transferred my Bitcoin out of them last week. Just no good reason to trade on Coinbase any more,t3_mh4vyk,2021-04-01 02:21:11,2021-04-01
2354,gsxyj2w,t3_mh4vyk,Lol only $6.5? Thatâ€™s incentive to keep doing it. Shut them down.,t3_mh4vyk,2021-04-01 02:34:06,2021-04-01
2355,gsy1jzl,t3_mh4vyk,Ooof.,t3_mh4vyk,2021-04-01 02:57:09,2021-04-01
2356,gsy1mz4,t3_mh4vyk,So fuck coinbase?,t3_mh4vyk,2021-04-01 02:57:46,2021-04-01
2357,gsy1qtd,t3_mh4vyk,whoops,t3_mh4vyk,2021-04-01 02:58:34,2021-04-01
2358,gsy2but,t3_mh4vyk,Maybe I should send in that application for a Compliance Manager role at Coinbase ðŸ¤”,t3_mh4vyk,2021-04-01 03:03:01,2021-04-01
2359,gsy2g7e,t3_mh4vyk,wow,t3_mh4vyk,2021-04-01 03:03:57,2021-04-01
2360,gsy2oi9,t3_mh4vyk,What???,t3_mh4vyk,2021-04-01 03:05:43,2021-04-01
2361,gsy2xd2,t3_mh4vyk,Coinbase is a high risk,t3_mh4vyk,2021-04-01 03:07:36,2021-04-01
2362,gsy3f8b,t3_mh4vyk,"Every platform is corrupt, we get it.",t3_mh4vyk,2021-04-01 03:11:26,2021-04-01
2363,gsy3qk5,t3_mh4vyk,Who gets that money? Not the people who were screwed due to the manipulation.  Pay a trillion dollars... doesnâ€™t matter! Where/who gets the money?,t3_mh4vyk,2021-04-01 03:13:51,2021-04-01
2364,gsy53qy,t3_mh4vyk,fook coinbase,t3_mh4vyk,2021-04-01 03:24:23,2021-04-01
2365,gsy57gu,t3_mh4vyk,just shows you that theyre identical to the traditional finance crap everyone was trying to get away from in the first place.,t3_mh4vyk,2021-04-01 03:25:10,2021-04-01
2366,gsy5zpw,t3_mh4vyk,How did they got caught?,t3_mh4vyk,2021-04-01 03:31:08,2021-04-01
2367,gsy6dym,t3_mh4vyk,Just the costs of doing business,t3_mh4vyk,2021-04-01 03:34:09,2021-04-01
2368,gsy8r1u,t3_mh4vyk,Whatâ€™s a good alternative against Coinbase ?,t3_mh4vyk,2021-04-01 03:52:14,2021-04-01
2369,gsy95nv,t3_mh4vyk,Absolutely no surprise here. Corrupt scum.,t3_mh4vyk,2021-04-01 03:55:21,2021-04-01
2370,gsy9niq,t3_mh4vyk,"fells, investin the UnoRe project! THiâ€™re a real pearl . I feel tWazzup will take over the  defispace soon.  see em out u/unoreinsure Iâ€™ve already participated in private sale",t3_mh4vyk,2021-04-01 03:59:08,2021-04-01
2371,gsyb0ax,t3_mh4vyk,Whoa market manipulation in crypto ? Unprecedented,t3_mh4vyk,2021-04-01 04:09:19,2021-04-01
2372,gsycm4g,t3_mh4vyk,coinbase is making custodians and banks look bad. like they can't be trusted with your bitcoin or something.,t3_mh4vyk,2021-04-01 04:21:31,2021-04-01
2373,gsyd2s1,t3_mh4vyk,Anyone in ARGO blockchain?,t3_mh4vyk,2021-04-01 04:25:03,2021-04-01
2374,gsyfor7,t3_mh4vyk,What is that fine for ants? Wtf?,t3_mh4vyk,2021-04-01 04:45:05,2021-04-01
2375,gsyggwq,t3_mh4vyk,Did y'all say million? Like with an M?,t3_mh4vyk,2021-04-01 04:51:03,2021-04-01
2376,gsygtf0,t3_mh4vyk,Does this include coinbase pro?,t3_mh4vyk,2021-04-01 04:53:40,2021-04-01
2377,gsyh05j,t3_mh4vyk,I am not surprised but who gets that lawsuit money? surely not every single person they manipulated?,t3_mh4vyk,2021-04-01 04:55:08,2021-04-01
2378,gsyhtmv,t3_mh4vyk,So a slap on the wrist. Ok then,t3_mh4vyk,2021-04-01 05:01:27,2021-04-01
2379,gsyi9wl,t3_mh4vyk,I'm not even mildly surprised by this.,t3_mh4vyk,2021-04-01 05:04:57,2021-04-01
2380,gsyiq90,t3_mh4vyk,"So I ask the non financial advice question, whoâ€™s better than Coinbase?",t3_mh4vyk,2021-04-01 05:08:31,2021-04-01
2381,gsyj2ru,t3_mh4vyk,"I literally just made a video on Exchanges making false trades: https://youtu.be/BOGoXYSzRc8?t=226

EDIT: saved timestamp",t3_mh4vyk,2021-04-01 05:11:15,2021-04-01
2382,gsyjbrr,t3_mh4vyk,"My account is disabled with them, someone port attacked my phone , got into my email and reset my CB password to buy and transfer btc. They stopped the transfer after the 500 usd in btc was purchased . My bank then revoked payment after I sold the btc and transferred the money back to my account after a lengthy kyc process. So it was a wash, so since my bank revoked payment after it cleared my account CB still wants payment knowing what happened.",t3_mh4vyk,2021-04-01 05:13:13,2021-04-01
2383,gsyjl0s,t3_mh4vyk,well then guess im  switch to binance,t3_mh4vyk,2021-04-01 05:15:15,2021-04-01
2384,gsyjq01,t3_mh4vyk,"Serious question, as I recently opened a Coinbase account and bought my first crypto. Is there a better company any of you would recommend? New to this. Thanks",t3_mh4vyk,2021-04-01 05:16:20,2021-04-01
2385,gsykbie,t3_mh4vyk,Quick Google search told me that they earned 2.74 million a day in 2018 (or 2000 dollar a minute). This fine is nothing to them. They are getting away with it...,t3_mh4vyk,2021-04-01 05:21:03,2021-04-01
2386,gsykhe0,t3_mh4vyk,"Right before the IPO, gotta be better boys lol!",t3_mh4vyk,2021-04-01 05:22:21,2021-04-01
2387,gsylrh8,t3_mh4vyk,"This is what I said two weeks ago I've suspected this for a while

They prop up the prices to make the coins,  which are their inventory, look good.

This stimulates retail interest and keeps traders engaged.

I'm fine with it.",t3_mh4vyk,2021-04-01 05:32:41,2021-04-01
2388,gsymnvj,t3_mh4vyk,Oh boy,t3_mh4vyk,2021-04-01 05:40:09,2021-04-01
2389,gsymsc3,t3_mh4vyk,"Well I was opening a Coinbase account tomorrow,  ...... what is the best bitcoin platform with reasonable fees?",t3_mh4vyk,2021-04-01 05:41:10,2021-04-01
2390,gsyo3v0,t3_mh4vyk,Iâ€™m tired of Coinbaseâ€™s shit.,t3_mh4vyk,2021-04-01 05:52:04,2021-04-01
2391,gsyomr3,t3_mh4vyk,"""Let me run this program to make $20""
""Oh, I got fined $1 for using that program, that'll really deter me from doing it again in the future""",t3_mh4vyk,2021-04-01 05:56:25,2021-04-01
2392,gsyoq5q,t3_mh4vyk,A minor operational cost .,t3_mh4vyk,2021-04-01 05:57:12,2021-04-01
2393,gsyp0l9,t3_mh4vyk,wow.  how come this is not all over the place?  just now seeing this.  sighhhh :( .. this is such a shame that companies do stuff like that.  what a scam.,t3_mh4vyk,2021-04-01 05:59:37,2021-04-01
2394,gsypxi9,t3_mh4vyk,This is why DEXs is where it's really at. No pesky people.,t3_mh4vyk,2021-04-01 06:07:17,2021-04-01
2395,gsypzw8,t3_mh4vyk,"Of course we, the users, lose money but won't get a single $ from this fine",t3_mh4vyk,2021-04-01 06:07:51,2021-04-01
2396,gsyqw6u,t3_mh4vyk,wait a second...i get 6.5mil??? sick.,t3_mh4vyk,2021-04-01 06:15:30,2021-04-01
2397,gsyr8j9,t3_mh4vyk,If one exchange does it they're all guilty of it.,t3_mh4vyk,2021-04-01 06:18:27,2021-04-01
2398,gsyrbmh,t3_mh4vyk,Your fraud helped you reach a valuation of $90 billion.  Pay this pittance.,t3_mh4vyk,2021-04-01 06:19:11,2021-04-01
2399,gsyrj67,t3_mh4vyk,"Be sure to read the commissioner's Concurring Statement, which says ""Oh BTW, the CFTC has exactly zero authority to regulate Coinbase, and this Order is just for PR.""",t3_mh4vyk,2021-04-01 06:20:56,2021-04-01
2400,gsyseft,t3_mh4vyk,L,t3_mh4vyk,2021-04-01 06:28:22,2021-04-01
2401,gsysnou,t3_mh4vyk,"doesn't surprise me.

I setup a scheduled buy to just get $50 bucks worth of btc on paydays

day later it had spent 350 dollars on fucking bitcoin, even though my next payday was over a week away

didn't even fuck around, just closed the account right then.",t3_mh4vyk,2021-04-01 06:30:32,2021-04-01
2402,gsyt2vh,t3_mh4vyk,That story is 10 days old now ....,t3_mh4vyk,2021-04-01 06:34:09,2021-04-01
2403,gsytp5f,t3_mh4vyk,You're about a week or so late with this post...,t3_mh4vyk,2021-04-01 06:39:36,2021-04-01
2404,gsytrav,t3_mh4vyk,They suck so much,t3_mh4vyk,2021-04-01 06:40:06,2021-04-01
2405,gsytxyx,t3_mh4vyk,"COINBASEEEEEEEEEEEEE  


Man this is so depressing to read.",t3_mh4vyk,2021-04-01 06:41:44,2021-04-01
2406,gsyu0f8,t3_mh4vyk,"How about the pitiful ""news"" articles on Robinhood ?",t3_mh4vyk,2021-04-01 06:42:20,2021-04-01
2407,gsyug57,t3_mh4vyk,Is this bullish news for the ipo? Lol,t3_mh4vyk,2021-04-01 06:46:09,2021-04-01
2408,gsyvcup,t3_mh4vyk,Satoshi would be truly disappointed.,t3_mh4vyk,2021-04-01 06:54:08,2021-04-01
2409,gsywm8h,t3_mh4vyk,"At some point, fines like this just become part of their business model.",t3_mh4vyk,2021-04-01 07:05:22,2021-04-01
2410,gsyxwzd,t3_mh4vyk,"I can't count how many times I've put a call order in on a low volume coin/token, let's say for $1.00, only to have another order instantly populate at $1.01... sometimes I'll cancel the order and immediately post another call for $1.02... and at the exact same phucking time I hit ""Buy"" - I'm bumped by a call for $1.03. Wait a bit, cancel the order and wouldn't you know it... price action settles at $0.99.

I always thought it was users trading with bots. But that was on Bittrex **and** Binance. Never registered with the scammy bastards at CoinBase.",t3_mh4vyk,2021-04-01 07:17:02,2021-04-01
2411,gsyydqp,t3_mh4vyk,"In 2020 there was a large outrage on Twitter about a scammer asking you for your Bitcoin and promises to double it...This Year, MyCryptoMixer is making such an attempt while doing it very poorly and obviously through this website... http://mycryptomixer.com/ 

They promise to â€œmixâ€ your coins while making the transactions unidentifiable and then they rob you of your Bitcoin. Heâ€™s scammed a couple of people and one individual of his 13 bitcoins already!! Beware!! Read the narration of an unfortunate victim:

[https://bitcointalk.org/index.php?topic=5319713.0](https://bitcointalk.org/index.php?topic=5319713.0)

[https://www.reddit.com/r/Bitcoin/comments/lwerj8/user\_loses\_13\_btc650k\_to\_mycryptomixercom/](https://www.reddit.com/r/Bitcoin/comments/lwerj8/user_loses_13_btc650k_to_mycryptomixercom/)",t3_mh4vyk,2021-04-01 07:21:13,2021-04-01
2412,gsyyqff,t3_mh4vyk,"Not just bots, but they have a long history of ""accidentally"" going offline or stuffing something up when there's a rally.",t3_mh4vyk,2021-04-01 07:24:25,2021-04-01
2413,gsz0rwe,t3_mh4vyk,Literally just opened a coin base account. Who should I use instead?,t3_mh4vyk,2021-04-01 07:42:41,2021-04-01
2414,gsz1r32,t3_mh4vyk,"CB to Gov. - â€œIf I wanted a kiss, I wouldâ€™ve asked your mother.â€",t3_mh4vyk,2021-04-01 07:51:25,2021-04-01
2415,gsz303z,t3_mh4vyk,Or 1 gas fee,t3_mh4vyk,2021-04-01 08:02:34,2021-04-01
2416,gsz3vg7,t3_mh4vyk,â€œSorryyyyyâ€ as they pay from the 100M they just made.,t3_mh4vyk,2021-04-01 08:10:10,2021-04-01
2417,gsz7k8m,t3_mh4vyk,Nooooo! Not Coinbase brah brah brah........,t3_mh4vyk,2021-04-01 08:42:46,2021-04-01
2418,gsz7zy2,t3_mh4vyk,Over the next few years we are going to hear ridiculous amounts of stories like these of exchanges screwing their customers with crazy hidden fees and manipulations. The unregulated nature of crypto is a true double-edged sword,t3_mh4vyk,2021-04-01 08:46:40,2021-04-01
2419,gsz8s1z,t3_mh4vyk,wheres the best place to buy bitcoin,t3_mh4vyk,2021-04-01 08:53:36,2021-04-01
2420,gsz9u6i,t3_mh4vyk,"another words, they're assholes and cannot be trusted.",t3_mh4vyk,2021-04-01 09:02:47,2021-04-01
2421,gsza1ae,t3_mh4vyk,"Pay fine for manipulating something that is technically ""ungoverned"". Isn't the whole point of this to be unregulated?",t3_mh4vyk,2021-04-01 09:04:29,2021-04-01
2422,gszatnu,t3_mh4vyk,"Coinbase always charges me $2-400 more per coin than what is listed, and I dont see those fees listed anywhere. They claim to have a 1.5% fee but they also increase the price of BTC by another 1% without informing the customer.",t3_mh4vyk,2021-04-01 09:11:16,2021-04-01
2423,gszb714,t3_mh4vyk,"Knowing nothing about this at all and seeing it on all, I bet my house that company made more than 6.5 M with their bullshit",t3_mh4vyk,2021-04-01 09:14:30,2021-04-01
2424,gszbe3g,t3_mh4vyk,FUD,t3_mh4vyk,2021-04-01 09:16:12,2021-04-01
2425,gsze93p,t3_mh4vyk,Isnâ€™t this pretty serious? How can we built a space on trust or this shit is happening?,t3_mh4vyk,2021-04-01 09:41:23,2021-04-01
2426,gszeipn,t3_mh4vyk,The fine was peanuts compared to the gains,t3_mh4vyk,2021-04-01 09:43:46,2021-04-01
2427,gszek9u,t3_mh4vyk,Are we the stock market now?,t3_mh4vyk,2021-04-01 09:44:08,2021-04-01
2428,gszf2zv,t3_mh4vyk,Awesome. I literally just opened an account with them 3 days ago -__-,t3_mh4vyk,2021-04-01 09:48:40,2021-04-01
2429,gszfauo,t3_mh4vyk,So who gets the money? Any of that go to the millions of people who are screwed over by this price manipulation?,t3_mh4vyk,2021-04-01 09:50:34,2021-04-01
2430,gszfwg9,t3_mh4vyk,Holy fuck this is disgusting news. Fuck coinbase. And I can't believe I actually used them for my wallet in the past.,t3_mh4vyk,2021-04-01 09:55:44,2021-04-01
2431,gszhfia,t3_mh4vyk,"$6.5 MILION!!!

Oh no, ^what ^^ever ^^will ^^^they ^^^^do?",t3_mh4vyk,2021-04-01 10:09:07,2021-04-01
2432,gszhool,t3_mh4vyk,Queue the class action lawsuit. Those who traded BTC/LTC pair during the wash trading being the class.,t3_mh4vyk,2021-04-01 10:11:26,2021-04-01
2433,gsziiwt,t3_mh4vyk,"With this news, what would be the best/""least awful"" way to buy Bitcoin?",t3_mh4vyk,2021-04-01 10:19:06,2021-04-01
2434,gszij2i,t3_mh4vyk,Are people retarded? Other exchanges have been doing this since the inception wake up people =(,t3_mh4vyk,2021-04-01 10:19:08,2021-04-01
2435,gszk4d1,t3_mh4vyk,fucking charlie lee piece of shit,t3_mh4vyk,2021-04-01 10:33:51,2021-04-01
2436,gszkrps,t3_mh4vyk,scum of the citadel.,t3_mh4vyk,2021-04-01 10:40:03,2021-04-01
2437,gszkv0w,t3_mh4vyk,Arb bots arb into each other. Nothing to see here.,t3_mh4vyk,2021-04-01 10:40:56,2021-04-01
2438,gszlrbk,t3_mh4vyk,Wow,t3_mh4vyk,2021-04-01 10:49:32,2021-04-01
2439,gszm0rw,t3_mh4vyk,They make that in OTC before lunch.,t3_mh4vyk,2021-04-01 10:52:05,2021-04-01
2440,gszmdbo,t3_mh4vyk,The dates on this release is 3/19/21  What took so long for this reddit post to eventuate?,t3_mh4vyk,2021-04-01 10:55:23,2021-04-01
2441,gszmdia,t3_mh4vyk,"CFTC fines crypto currency places, yet still doesn't fine the large hedge funds that commit blatant market manipulation and crash the stock market.",t3_mh4vyk,2021-04-01 10:55:25,2021-04-01
2442,gszmk5o,t3_mh4vyk,Wtf? i already left Robinhood. Do i need to leave them too?,t3_mh4vyk,2021-04-01 10:57:13,2021-04-01
2443,gszmxu0,t3_mh4vyk,This is why i'm keeping my eyes on Beaxy. If they just had more volume. Their entire backend being on chain is interesting and honest.,t3_mh4vyk,2021-04-01 11:00:58,2021-04-01
2444,gsznrmm,t3_mh4vyk,Well what should i use to buy crypto then?,t3_mh4vyk,2021-04-01 11:09:02,2021-04-01
2445,gszp9zm,t3_mh4vyk,"""Nobody goes there anymore, it's too crowded.""",t3_mh4vyk,2021-04-01 11:23:55,2021-04-01
2446,gszqf21,t3_mh4vyk,Who should I use instead of coinbase?,t3_mh4vyk,2021-04-01 11:35:13,2021-04-01
2447,gszrpfh,t3_mh4vyk,Will they be sending us checks or direct deposit?,t3_mh4vyk,2021-04-01 11:48:21,2021-04-01
2448,gszs187,t3_mh4vyk,Only use for the Crayon Graphs,t3_mh4vyk,2021-04-01 11:51:46,2021-04-01
2449,gszti66,t3_mh4vyk,6 million what will they ever do,t3_mh4vyk,2021-04-01 12:07:22,2021-04-01
2450,gsztxsq,t3_mh4vyk,House always wins,t3_mh4vyk,2021-04-01 12:12:01,2021-04-01
2451,gsxanob,t1_gswugw7,Transactions fees from three Ethereum sales,t3_mh4vyk,2021-03-31 23:34:52,2021-03-31
2452,gsx9tz1,t1_gswugw7,"Since this happened back in 2016, I am sure it is pennies at this point.",t3_mh4vyk,2021-03-31 23:28:36,2021-03-31
2453,gsxeo82,t1_gswugw7,The government's cut.  The whole country is a scam at this point.,t3_mh4vyk,2021-04-01 00:04:52,2021-04-01
2454,gsxd39i,t1_gswugw7,I'm betting it's even less.,t3_mh4vyk,2021-03-31 23:53:01,2021-03-31
