,comment_id,comment_parent_id,comment_body,comment_link_id,created,date
0,gprx0vq,t3_ly4mb1,"Bitcoin has not just saved and increased my wealth, it changed the whole course of my life. It gave me new ambitions, opened my eyes to how fucked the financial system is, gave me a new motivation. And for that, I am forever grateful.",t3_ly4mb1,2021-03-05 22:23:06,2021-03-05
1,gprj5i5,t3_ly4mb1,"Good day to finally get sick of FOMO and buy my first SATs. It's barely a whiff, but hey, at least I've got something.",t3_ly4mb1,2021-03-05 20:01:16,2021-03-05
2,gpri4nh,t3_ly4mb1,Everyone is saying there’s a dip and I checked and it only went down $1k? It’s holding up incredibly well considering most stocks are deep in the red right now,t3_ly4mb1,2021-03-05 19:47:41,2021-03-05
3,gpqrodn,t3_ly4mb1,"This is a GME/WSB meme template free zone. Take your rocket ships, “we like the coin”, and attempts to teach mining pools a lesson back from whence you came. 

Here, we hodl until the dollar gives in. Good luck.",t3_ly4mb1,2021-03-05 13:28:57,2021-03-05
4,gprp5ay,t3_ly4mb1,Saylor: [https://www.microstrategy.com/en/investor-relations/financial-documents/microstrategy-acquires-additional-10m-in-bitcoin-at-average-price-of-48-888\_03-05-2021](https://www.microstrategy.com/en/investor-relations/financial-documents/microstrategy-acquires-additional-10m-in-bitcoin-at-average-price-of-48-888_03-05-2021),t3_ly4mb1,2021-03-05 21:11:17,2021-03-05
5,gprdx53,t3_ly4mb1,The market is a mechanisms for transferring cash from the impatient to the patient.,t3_ly4mb1,2021-03-05 18:46:13,2021-03-05
7,gprjwtl,t3_ly4mb1,Mr Satoshi tear down this wall,t3_ly4mb1,2021-03-05 20:11:08,2021-03-05
8,gpre00l,t3_ly4mb1,"Entry at 47147USDT - TP at 48.8K, SL at 46K, 20x leverage.

*cause he's a maniac, maniac on the dance floor*",t3_ly4mb1,2021-03-05 18:47:28,2021-03-05
9,gprf4fk,t3_ly4mb1,"Just averaging down little by little, and I'm now at 41,000,000 sats. It's not much, but it's something.",t3_ly4mb1,2021-03-05 19:04:32,2021-03-05
10,gps0kft,t3_ly4mb1,"My father overheard me talking about the amount of BTC I bought recently and asked why I bought such a tiny fraction. I asked him how much he thinks 1 BTC is worth. His answer?

""Five or six dollars, I think.""",t3_ly4mb1,2021-03-05 22:52:01,2021-03-05
13,gpqq9v7,t3_ly4mb1,Hello Friday my old friend.,t3_ly4mb1,2021-03-05 13:13:16,2021-03-05
14,gpr2bfp,t3_ly4mb1,Praying it doesn’t skyrocket before the 15th (my next chance to stack more SATS) will be able to double my holdings if it’s still around 50k. But I fully expect it to shoot up on the 13th. 14th is my wedding and 15th is yearly bonus check. Fml. Still buyin regardless tho!,t3_ly4mb1,2021-03-05 15:49:41,2021-03-05
15,gprxudn,t3_ly4mb1,"Just saying, below $50k institutions are gobbling up coins.",t3_ly4mb1,2021-03-05 22:29:51,2021-03-05
16,gpqtlpu,t3_ly4mb1,"One thing you can say about Bitcoin is it’s always rising rapidly, dropping rapidly, steadily climbing, steadily dropping or staying the same 100% of time.",t3_ly4mb1,2021-03-05 13:51:39,2021-03-05
17,gpqyk58,t3_ly4mb1,I see the Bitcoin a-rising,t3_ly4mb1,2021-03-05 14:55:57,2021-03-05
18,gprohh5,t3_ly4mb1,Going to be a good day and weekend.  Keeping positive vibes!!!,t3_ly4mb1,2021-03-05 21:04:19,2021-03-05
22,gpr53v1,t3_ly4mb1,GBTC is at 11% discount.. what's going on there?,t3_ly4mb1,2021-03-05 16:31:26,2021-03-05
23,gprgmit,t3_ly4mb1,"Oh my, its friday sale! :D",t3_ly4mb1,2021-03-05 19:26:41,2021-03-05
30,gprry3z,t3_ly4mb1,[https://www.businesswire.com/news/home/20210305005234/en/Cipher-Mining-Inc.-a-Newly-Formed-US-based-Bitcoin-Mining-Company-to-Become-a-Publicly-Traded-Company-via-a-Merger-with-Good-Works-Acquisition-Corp](https://www.businesswire.com/news/home/20210305005234/en/Cipher-Mining-Inc.-a-Newly-Formed-US-based-Bitcoin-Mining-Company-to-Become-a-Publicly-Traded-Company-via-a-Merger-with-Good-Works-Acquisition-Corp),t3_ly4mb1,2021-03-05 21:38:41,2021-03-05
31,gprv1bs,t3_ly4mb1,"This is probably a stupid question but someone may be able to help a non-techy person out.

I have a Trezor One with just one account set up. I want to set up a separate account (within the same wallet) for my wife but say in ten years if Trezor goes out of business or the software doesn’t work/isn’t available/I lose my Trezor...Will she or I be able to restore both accounts easily from the wallet’s recovery seed? The accounts seem like a Trezor-specific feature and I hadn’t heard of wallets having accounts before.

Couldn’t find the answer on Trezor site.",t3_ly4mb1,2021-03-05 22:06:16,2021-03-05
38,gpr8bqn,t3_ly4mb1,"Stop panic selling guys. Institutions are buying. 12k BTC outflow on the 2nd March and another 12k outflow today. These are $550m-$600m buys. We are talking about big corporations. Sell now = Selling to them.

Each long red line is an institution buy. They just haven't revealed themselves yet. From the size of the purchases, these are well know companies.

[https://twitter.com/CryptoXxxXxxX/status/1367766188495826947](https://twitter.com/CryptoXxxXxxX/status/1367766188495826947)",t3_ly4mb1,2021-03-05 17:18:45,2021-03-05
42,gpqqg60,t3_ly4mb1,"Listen, I’m high, but there is a rumored gold rush on a newly discovered deposit in Africa estimated at 25 trillion USD.  Will this cause a supply shock to gold price, and could this amount (if true) remove gold as a leading hedge asset?   What do you all know about this, or is it bullshit?",t3_ly4mb1,2021-03-05 13:15:13,2021-03-05
43,gpr22xo,t3_ly4mb1,"What's a good place to buy bitcoin using your phone in Singapore?
I want to start investing but I'm not sure which app is good.",t3_ly4mb1,2021-03-05 15:46:10,2021-03-05
44,gprt2ad,t3_ly4mb1,[https://u.today/12000-btc-acquired-at-46686-at-coinbase-as-institutions-keep-accumulating-bitcoin](https://u.today/12000-btc-acquired-at-46686-at-coinbase-as-institutions-keep-accumulating-bitcoin),t3_ly4mb1,2021-03-05 21:48:51,2021-03-05
45,gprwewd,t3_ly4mb1,Good start to Friday!,t3_ly4mb1,2021-03-05 22:17:58,2021-03-05
53,gprrcdv,t3_ly4mb1,Now is the worst possible time you could sell. I really don't get it. I truly believe we'll see a 5m bitcoin in 10 years or less,t3_ly4mb1,2021-03-05 21:32:59,2021-03-05
54,gpryo0a,t3_ly4mb1,Btc under 50k on payday 😤🤑🤑,t3_ly4mb1,2021-03-05 22:36:42,2021-03-05
56,gpri6kd,t3_ly4mb1,"BTC growing steadily at say 20% per year would do me just fine 👍🏻💰🤞🏻

(Puts down calculator) Ok make that 50%",t3_ly4mb1,2021-03-05 19:48:26,2021-03-05
64,gpr9zje,t3_ly4mb1,Why do i find it so funny watching weak hands get rekt?,t3_ly4mb1,2021-03-05 17:44:14,2021-03-05
65,gprkeb6,t3_ly4mb1,"Stock market close on weekends, btc don't. Be ready.  When above 50k people here: when will dip again? When below 50k people: should i sell? Don't be stupid, don't sell. Better, it will climb again as soon as all u weak handed get rich retards sell, because u don't deserve gains on btc if u don't know what is a BIP or how to set a good transaction fee.

Edit: thanks for the award bro. and thanks fudsters/f2pool/bad for environment  for the discount to keep stacking.",t3_ly4mb1,2021-03-05 20:17:18,2021-03-05
66,gpr43xm,t3_ly4mb1,Need some bitporn,t3_ly4mb1,2021-03-05 16:16:26,2021-03-05
67,gpr7ou1,t3_ly4mb1,"What is the best 12 word phrase crypto wallet? Reviews are so varied, security wise, I’m struggling to figure out which to use as I want to move my bitcoin off the exchange. Any recommendations?",t3_ly4mb1,2021-03-05 17:09:20,2021-03-05
68,gprr7a4,t3_ly4mb1,If people wanna panic sell then let them. Seems to be the only way to learn from a mistake but all we can do is guide them,t3_ly4mb1,2021-03-05 21:31:38,2021-03-05
70,gprs50g,t3_ly4mb1,"Have convinced the wife to invest some of her ‘personal’ stash into BTC. 

So happy we’ll have something to talk about. 🥳",t3_ly4mb1,2021-03-05 21:40:28,2021-03-05
77,gprfhj6,t3_ly4mb1,"the end is near... 

...the end of the $‘s reign",t3_ly4mb1,2021-03-05 19:09:57,2021-03-05
78,gprqna9,t3_ly4mb1,"I was recently discussing with a friend how society would work in a world with bitcoin instead of fiat money. Just think of it that everything is priced in bitcoin and there is no fiat money anymore. 

Then something like a pandemic occurs. How would we handle it? If people have to stay in a lockdown and can't work they would need money to survive to buy food... 

Currently printing money is the way to keep the society alive, how would we deal with that when we couldn't print money? (or am I already wrong with that?)

&#x200B;

Don't misunderstand me. this is no FUD, I love the idea of bitcoin. I do own and hodl bitcoin. Still I would like to know how a bitcoin-society would deal with a crisis.",t3_ly4mb1,2021-03-05 21:26:16,2021-03-05
81,gpqrk5z,t3_ly4mb1,How will the new mountain of gold found in Africa affect bitcoin and markets in general?,t3_ly4mb1,2021-03-05 13:27:40,2021-03-05
82,gprt30z,t3_ly4mb1,Good morning. Watching the chart with lines instead of candles today like a crazy man.,t3_ly4mb1,2021-03-05 21:49:02,2021-03-05
93,gpqpwgf,t3_ly4mb1,Just wait for stimulus mid to end March 👍🏽,t3_ly4mb1,2021-03-05 13:09:10,2021-03-05
95,gpr3di5,t3_ly4mb1,"Take a drink anytime someone is too lazy to do their own reading and just asks:

""What do you guys think....""

""When do you guys think...""

""Is it a good time to buy...""

""Do you guys recommend buying...""

""What do you guys think the price will go to...""

The worst:

""What are WE thinking about..."" as if they contribute ANYTHING to the group at all.",t3_ly4mb1,2021-03-05 16:05:22,2021-03-05
96,gpr74z7,t3_ly4mb1,Is BlueWallet a safe place to hold my BTC for at least 5 years? Then when time comes to sell to send them to Coinbase to do that..?,t3_ly4mb1,2021-03-05 17:01:13,2021-03-05
97,gprjvcs,t3_ly4mb1,Good morning America! Need some Coin?,t3_ly4mb1,2021-03-05 20:10:39,2021-03-05
98,gprs0qi,t3_ly4mb1,"Peter Schiff's podcast is comedy, all he does now is read his Twitter arguments about bitcoin",t3_ly4mb1,2021-03-05 21:39:22,2021-03-05
99,gprsji1,t3_ly4mb1,[https://www.coindesk.com/the-price-average-is-the-line-in-the-sand-for-bitcoin-bulls-analyst-says](https://www.coindesk.com/the-price-average-is-the-line-in-the-sand-for-bitcoin-bulls-analyst-says),t3_ly4mb1,2021-03-05 21:44:09,2021-03-05
100,gps1byn,t3_ly4mb1,So gbtc inverses btc now? Hahaha,t3_ly4mb1,2021-03-05 22:57:57,2021-03-05
104,gpqw9qu,t3_ly4mb1,When the Mongolians will stop selling already?,t3_ly4mb1,2021-03-05 14:25:16,2021-03-05
118,gprzksr,t3_ly4mb1,Is this it? Is this the big one?... Sorry for the premature excitement but I did go all in at the ATH so 🤷‍♂️,t3_ly4mb1,2021-03-05 22:44:03,2021-03-05
120,gpraqgq,t3_ly4mb1,Gimme some positive predictions pls 😂😂😂😂,t3_ly4mb1,2021-03-05 17:56:06,2021-03-05
121,gprbs9z,t3_ly4mb1,Hmm nothing much going on tonight. Let’s see what happens when America wakes up,t3_ly4mb1,2021-03-05 18:13:01,2021-03-05
122,gprchn6,t3_ly4mb1,"Bloodshed in the markets. Jerome Powell, please come to rescue!!",t3_ly4mb1,2021-03-05 18:24:08,2021-03-05
123,gprshfh,t3_ly4mb1,"Come on, try to stay above 48k!",t3_ly4mb1,2021-03-05 21:43:38,2021-03-05
124,gprt5pk,t3_ly4mb1,Annnnd just like that we going green,t3_ly4mb1,2021-03-05 21:49:42,2021-03-05
125,gprzcce,t3_ly4mb1,Choo choo all aboard the Bitcoin we are clear for take off,t3_ly4mb1,2021-03-05 22:42:12,2021-03-05
135,gpqweqz,t3_ly4mb1,"Let's say you made a profit of $100k from Bitcoin, how would you use that money if you decided to stop hodling? I'd probably buy a fancy car as I just got my driving licence 🚗",t3_ly4mb1,2021-03-05 14:27:05,2021-03-05
136,gpr9brm,t3_ly4mb1,"Told you there's gonna be another dip, y'all too optimistic thinking that the bull run start that fast. Just hold and wait",t3_ly4mb1,2021-03-05 17:33:57,2021-03-05
146,gpqtt1t,t3_ly4mb1,"We really ned to stop these mining pools from manipulating the market, these regular sharp drops is not normal anymore..",t3_ly4mb1,2021-03-05 13:54:05,2021-03-05
149,gpqqa7u,t3_ly4mb1,First time I caught the falling knife successfully!,t3_ly4mb1,2021-03-05 13:13:22,2021-03-05
150,gpqryt6,t3_ly4mb1,Why do people keep fucking saying JP powell announcement,t3_ly4mb1,2021-03-05 13:32:15,2021-03-05
151,gprun4r,t3_ly4mb1,We pumping for the dip again,t3_ly4mb1,2021-03-05 22:02:46,2021-03-05
152,gprwsc9,t3_ly4mb1,What a day this has been lol - not really a red day,t3_ly4mb1,2021-03-05 22:21:08,2021-03-05
153,gprzzh5,t3_ly4mb1,"Tax Question!

We know for the most part, US, UK, that disposing of cryptocurrency is a taxable event but what about if your BTC collateral loan was to liquidate. Forced liquidation must fall under something different surely.",t3_ly4mb1,2021-03-05 22:47:19,2021-03-05
157,gpr09jg,t3_ly4mb1, Do you recommend buying bitcorn? Is it good time to buy dip too?,t3_ly4mb1,2021-03-05 15:19:52,2021-03-05
159,gpr4dmw,t3_ly4mb1, Elon Musk is not our leader.,t3_ly4mb1,2021-03-05 16:20:32,2021-03-05
160,gpr46ot,t3_ly4mb1,"Casual observation, 4hr chart starting Jan 8.
https://postimg.cc/SJq1yXsn",t3_ly4mb1,2021-03-05 16:17:38,2021-03-05
174,gprsxkw,t3_ly4mb1,PAMP,t3_ly4mb1,2021-03-05 21:47:41,2021-03-05
176,gpqtlu2,t3_ly4mb1,[deleted],t3_ly4mb1,2021-03-05 13:51:41,2021-03-05
177,gprkmgk,t3_ly4mb1,Anyone here with us is riding a 4 wheels bought from his profits on BTC ?,t3_ly4mb1,2021-03-05 20:20:11,2021-03-05
178,gprkzji,t3_ly4mb1,Sending someone Bitcoin as a gift doesn’t trigger a taxable event for the sender correct? In the US,t3_ly4mb1,2021-03-05 20:24:36,2021-03-05
180,gpro4d8,t3_ly4mb1,Fingers crossed btc will be on sale on Sunday.,t3_ly4mb1,2021-03-05 21:00:21,2021-03-05
183,gprshdb,t3_ly4mb1,[https://www.coindesk.com/40-of-goldman-sachs-clients-reported-exposure-to-crypto-survey](https://www.coindesk.com/40-of-goldman-sachs-clients-reported-exposure-to-crypto-survey),t3_ly4mb1,2021-03-05 21:43:37,2021-03-05
184,gprzscj,t3_ly4mb1,Rocket power 💯❤🙏,t3_ly4mb1,2021-03-05 22:45:43,2021-03-05
189,gprtlco,t3_ly4mb1,I am so impatient - I want to go to the moon 🤑when we will reach 100k? 🚀,t3_ly4mb1,2021-03-05 21:53:31,2021-03-05
194,gprwq5s,t3_ly4mb1,"Well folks, guess I was wrong. Not hitting $40k this week. Thanks alot u/turdmcgurd69420 for lying to me and saying you guaranteed btc would crash after selling all of your coins.",t3_ly4mb1,2021-03-05 22:20:37,2021-03-05
195,gpry93d,t1_gprx0vq,"I had just the same thoughts today. I'm so grateful for finally doing some proper moves 2 months ago and giving my life option for better future, chance to learn many new things which might give me good opportunities in my future. Just 3 months ago I didn't have any more detailed knowledge about financial system and how it works, but every next day I'm learning new things and now I can see how world is really fucked up, and it won't be doing better in the next years.

Tbh, entering Bitcoin world is probably one of the best decisions in my life and I can sincerely say it just after 2 months. Let's see where it brings us in future :)",t3_ly4mb1,2021-03-05 22:33:16,2021-03-05
196,gprpqip,t1_gprj5i5,Welcome to the club,t3_ly4mb1,2021-03-05 21:17:18,2021-03-05
197,gpric8b,t1_gpri4nh,Too many people are glued to the 15 min chart,t3_ly4mb1,2021-03-05 19:50:35,2021-03-05
198,gpriugz,t1_gpri4nh,When they say there's a dip I thought it went below 40k lol.,t3_ly4mb1,2021-03-05 19:57:21,2021-03-05
199,gprk1ii,t1_gpri4nh,"Depends on your timeframe. 2 days ago it was at 52k so that's a 4.5k dip. Two weeks ago it was at 58k so that's a 10.5k dip.  Relative to it's all time high or even just yesterday's max price, it's a dip of a few thousand dollars.",t3_ly4mb1,2021-03-05 20:12:49,2021-03-05
200,gprkekv,t1_gpri4nh,Must buy dip,t3_ly4mb1,2021-03-05 20:17:24,2021-03-05
201,gprihn5,t1_gpri4nh,Many new people here haven't seen a real dip.,t3_ly4mb1,2021-03-05 19:52:36,2021-03-05
202,gpreooi,t1_gpqrodn,"Also ""this is the way"", ""paper/diamond hands"", etc. etc. etc...",t3_ly4mb1,2021-03-05 18:57:55,2021-03-05
203,gpqtcf9,t1_gpqrodn,This is the way.,t3_ly4mb1,2021-03-05 13:48:35,2021-03-05
204,gprrcbf,t1_gprp5ay,Wish I was DCA with 10M each.,t3_ly4mb1,2021-03-05 21:32:57,2021-03-05
205,gprpb31,t1_gprp5ay,Michae buying the dips,t3_ly4mb1,2021-03-05 21:12:57,2021-03-05
206,gprrdpo,t1_gprp5ay,Living his best life,t3_ly4mb1,2021-03-05 21:33:19,2021-03-05
208,gprhjn7,t1_gpre00l,In my extraordinarily amateurish opinion I'd say this was well placed and likely to succeed.,t3_ly4mb1,2021-03-05 19:39:38,2021-03-05
209,gprehp4,t1_gpre00l,How many BTC on the long?,t3_ly4mb1,2021-03-05 18:54:58,2021-03-05
210,gprfm0k,t1_gprf4fk,dude u are a multi millionaire,t3_ly4mb1,2021-03-05 19:11:48,2021-03-05
219,gpqsglo,t1_gpqq9v7,Bitcoin about to dump again,t3_ly4mb1,2021-03-05 13:38:03,2021-03-05
220,gpqumha,t1_gpqtlpu,And you’d be right 20% of the time easy,t3_ly4mb1,2021-03-05 14:04:10,2021-03-05
222,gpqypz7,t1_gpqyk58,green on the 6hr candle,t3_ly4mb1,2021-03-05 14:58:09,2021-03-05
235,gprvky3,t1_gprv1bs,Yes. Trezor uses BIP39 word list for the private key which is the standard protocol followed by most other wallets. Just get a wallet that says it supports BIP39.,t3_ly4mb1,2021-03-05 22:10:56,2021-03-05
236,gprveo9,t1_gprv1bs,"So there is a standard for recovery seeds, BIP39, that Trezor and other wallets follow. You can recover your private keys using other software as long as they support the BIP39 standard, which I'm sure they will long into the future.

Further reading: [https://en.bitcoin.it/wiki/Seed\_phrase](https://en.bitcoin.it/wiki/Seed_phrase)",t3_ly4mb1,2021-03-05 22:09:27,2021-03-05
237,gpr8of0,t1_gpr8bqn,I’m panic buying 😎,t3_ly4mb1,2021-03-05 17:24:02,2021-03-05
238,gpr8tf1,t1_gpr8bqn,"Eventually Bitcoin is going to settle into the hands of the big players (whales, institutions) with a smattering remaining in the hands of smaller fish who refused to sell. When that time comes, those smaller fish who refused to sell are going to be very glad they did.",t3_ly4mb1,2021-03-05 17:26:08,2021-03-05
239,gpr91oa,t1_gpr8bqn,The real party starts when they start revealing their buys. I'm seeing so many corporation buys and we really only know Tesla and Microstrategy and Square?,t3_ly4mb1,2021-03-05 17:29:39,2021-03-05
240,gprdlpq,t1_gpr8bqn,"They are absolutely buying these prices. Anybody who is panic selling here literally just as real companies are getting involved is a dead set idiot. 

But sure. Sell your Bitcoin to big companies. Then have a cry in 5 years time about “it’s unfair big companies own so much Bitcoin”",t3_ly4mb1,2021-03-05 18:41:17,2021-03-05
246,gpqqotg,t1_gpqqg60,"If it's true, I'll wait to see if the folks mining all that gold sell their supplies in massive dumps to crash the market so they can buy all that gold back at a lower price and do it again. And again. And again.",t3_ly4mb1,2021-03-05 13:17:52,2021-03-05
247,gpqrfgq,t1_gpqqg60,"I love ideas that start with ""Listen, I'm high, but-""

More of these please 🙏",t3_ly4mb1,2021-03-05 13:26:10,2021-03-05
248,gpqu1xu,t1_gpqqg60,"I have read articles that said gold isn't doing so well this year. Hopefully my congo folk crash the gold market, just like Mufasa did back in the day. Overall, I hope this favors bitcorn.",t3_ly4mb1,2021-03-05 13:57:04,2021-03-05
249,gpqr1fp,t1_gpqqg60,Source?,t3_ly4mb1,2021-03-05 13:21:47,2021-03-05
263,gprrfzv,t1_gpri6kd,I kinda like the 300% mark tbh,t3_ly4mb1,2021-03-05 21:33:55,2021-03-05
266,gprd1mc,t1_gpr9zje,"""Gotta have opposites, light and dark and dark and light, in painting. It’s like in life. Gotta have a little paper hands once in awhile so you know when the good times come. I'm waiting on the good times now."" 

—Bob Ross",t3_ly4mb1,2021-03-05 18:32:42,2021-03-05
267,gpra6zw,t1_gpr9zje,Because you're an edgy memelord with little empathy for others,t3_ly4mb1,2021-03-05 17:47:34,2021-03-05
268,gprnxx1,t1_gpr9zje,You must have had an event in your childhood where an important figure in your life rekt you for having weak hands. The cycle continues.,t3_ly4mb1,2021-03-05 20:58:27,2021-03-05
269,gprklb3,t1_gprkeb6,Parklife,t3_ly4mb1,2021-03-05 20:19:47,2021-03-05
270,gprrdlr,t1_gprkeb6,It’s like some people put in money and just expected it to climb 10% per day flawlessly,t3_ly4mb1,2021-03-05 21:33:17,2021-03-05
271,gprbwck,t1_gpr7ou1,"i use good old electrum, cuz its open-source AND mostly because you can generate a wallet on airgapped device without network to make a cold storage:

* 1) transfer electrum application via USB to your offline computer and create a wallet
* 2) save master key on USB stick
* 3) on your online computer use it to create watch-only wallet

To transfer out of your cold storage

* a) make an unsigned transaction on your online computer
* b) transfer unsigned transaction via USB stick to you offline computer
* c) sign the transaction
* d) transfer signed transaction via USB stick to online computer with watch-only wallet
* e) broadcast transaction

If you go this route i recommend going through this process with a small amount first, or maybe even electrum for EL TEE CEE or BE CASH (sry, need to trick censor bot).Also test to restore your wallet from your seed to be sure your backup works.

Also make sure you download electrum from the offical source and not from a third party website.",t3_ly4mb1,2021-03-05 18:14:49,2021-03-05
272,gpr8264,t1_gpr7ou1,https://www.ministryofnodes.com.au/2021/01/24/how-to-get-your-bitcoin-off-the-exchange-2021-edition/,t3_ly4mb1,2021-03-05 17:14:45,2021-03-05
279,gprualv,t1_gprqna9,"Exactly, we should question bitcoin like this in every possible theoretical situation, only like this we can call bitcoin a real thing. I honestly don't know the answer to this question, as for now inflation in situations like this is just the lesser of two evils.",t3_ly4mb1,2021-03-05 21:59:41,2021-03-05
281,gprqxvg,t1_gprqna9,"By having a properly funded disaster relief fund rather than one that gets pillaged yearly. Also by not disassembling the pandemic response team, but that's not necessarily a money problem.",t3_ly4mb1,2021-03-05 21:29:08,2021-03-05
285,gpruoeh,t1_gprt30z,Wild,t3_ly4mb1,2021-03-05 22:03:05,2021-03-05
298,gpr8gnm,t1_gpr3di5,"Sir, this is alcohol poisoning.",t3_ly4mb1,2021-03-05 17:20:49,2021-03-05
299,gpre6zv,t1_gpr3di5,Take a drink anytime someone complains about beginners.,t3_ly4mb1,2021-03-05 18:50:25,2021-03-05
300,gpr3st1,t1_gpr3di5,Has Anyone Really Been Far Even as Decided to Use Even Go Want to do Look More Like?,t3_ly4mb1,2021-03-05 16:11:44,2021-03-05
301,gpr80hn,t1_gpr74z7,"No. Your phone has a reasonably high risk of getting hacked which could allow an attacker to easily steal everything. Think of it like carrying a wad of cash in your pocket.

If you are planning to hold a significant amount, invest in a hardware wallet and create multiple backups of your seed words, stored in different locations in case of disaster, e.g. house fire. 

Here's a couple of guides to get started. They focus on ColdCard, but Trezor and Ledger are also good.  

https://bitcoinsecurity.guide/

https://www.ministryofnodes.com.au/2021/01/24/how-to-get-your-bitcoin-off-the-exchange-2021-edition/",t3_ly4mb1,2021-03-05 17:14:03,2021-03-05
313,gpr0jjp,t1_gpqw9qu,Have you tried building a wall?,t3_ly4mb1,2021-03-05 15:23:55,2021-03-05
314,gprh5or,t1_gpqw9qu,[Damn Mongorians always attacking my shitty warr!](https://www.youtube.com/watch?v=QRpeNjkDNX4),t3_ly4mb1,2021-03-05 19:34:11,2021-03-05
334,gprnyqz,t1_gpraqgq,"Everyone talking about the dip. Look at 21, Febr. we diped hart since then two times. After that a small recreation from 1. - 3. March and a little dip again. I would say its time to hit at least 55k in the next days.",t3_ly4mb1,2021-03-05 20:58:42,2021-03-05
349,gpqwipj,t1_gpqweqz,Hmm 🤔 I’d buy the dip baby,t3_ly4mb1,2021-03-05 14:28:31,2021-03-05
350,gpr2iqq,t1_gpqweqz,"In my country, i can build from scratch a house and also buy a fresh new car, with 100k dollars... Ah, the dreams",t3_ly4mb1,2021-03-05 15:52:39,2021-03-05
351,gpqwykx,t1_gpqweqz,"I'd use it to buy something (or some things) that would cause bitter regret later on when I see how much Bitcoin comes to be valued later. Honestly, I'd never trade an asset that appreciates in value at an insane rate over time, for something like a car--which starts dramatically depreciating in value from the moment I sign the paperwork.",t3_ly4mb1,2021-03-05 14:34:24,2021-03-05
352,gpqx9bm,t1_gpqweqz,I would use it to buy a house,t3_ly4mb1,2021-03-05 14:38:23,2021-03-05
353,gpr23v4,t1_gpqweqz,Flip a house.,t3_ly4mb1,2021-03-05 15:46:32,2021-03-05
354,gpr19ay,t1_gpqweqz,Cars don’t hold value... just HODL or otherwise real estate (your own house).,t3_ly4mb1,2021-03-05 15:34:14,2021-03-05
355,gpr5t11,t1_gpqweqz,I'd buy my own time,t3_ly4mb1,2021-03-05 16:42:08,2021-03-05
356,gpqwhe3,t1_gpqweqz,Use that as a down payment for a house. Gotta diversify!,t3_ly4mb1,2021-03-05 14:28:02,2021-03-05
357,gpqz5ws,t1_gpqweqz,Buy a house,t3_ly4mb1,2021-03-05 15:04:18,2021-03-05
358,gpr36f4,t1_gpqweqz,"I would reinvest it into the stock market (probably heavily into Bitcoin mining companies).  Honesty, 100k isn’t really much in the US if you’re planning to spend it, but it can quickly grow to millions.  Then you can worry about spending it.",t3_ly4mb1,2021-03-05 16:02:26,2021-03-05
359,gpr9hag,t1_gpr9brm,"Well there's always going to be another dip, but I agree with you--hold and wait.",t3_ly4mb1,2021-03-05 17:36:18,2021-03-05
371,gpqqw47,t1_gpqqa7u,////Waves with bloody hand////,t3_ly4mb1,2021-03-05 13:20:08,2021-03-05
375,gpr1qvh,t1_gpr09jg,"It may be a good time to buy dip, check the prices on Skoal and Copenhagen at your local gas station. If you decide to buy, make sure to check the freshness date on the can.",t3_ly4mb1,2021-03-05 15:41:20,2021-03-05
376,gpr0nxf,t1_gpr09jg,Only on the cob...,t3_ly4mb1,2021-03-05 15:25:39,2021-03-05
