,comment_id,comment_parent_id,comment_body,comment_link_id,created,date
2618,gs0xbvb,t1_grzhz1y,"Haha nice reasoning at the end, thanks man! 

My bro actually in my house*does do* this and has done for years, I’ve literally not bothered cos I thought it was long 😂 I’ll do what you described and ask him what he does specifically too 😁😁 I’m in London though so would that still be the same site or method is the same regardless?",t3_mbqknd,2021-03-24 15:49:08,2021-03-24
2619,grzmqu5,t1_grzhz1y,Scalpers are scumbags.,t3_mbqknd,2021-03-24 07:33:16,2021-03-24
2620,gs0oyoy,t1_gs01fls,You know one time I met that damn Lochness monsta and you know what he said?,t3_mbqknd,2021-03-24 13:43:00,2021-03-24
2621,gs1w4oo,t1_gs1fk8x,You did what now?! No wonder the damn Loch Ness monsta keep coming back,t3_mbqknd,2021-03-24 22:33:13,2021-03-24
2622,gs09bpg,t1_gs02186,1 Like = 1 prayer,t3_mbqknd,2021-03-24 10:48:56,2021-03-24
2623,gs1ghfc,t1_gs02186,"Conveniently 1,000,000 “bits” as 1 bit is 100 Satoshis

Because Satoshi didn’t name the cent part after himself but 21 trillion dollars was the m1 global supply and 21 trillion bits is the total supply of Bitcoin.

So the currency of the future was dreamed to be called “bits” the part that people would be familiar with at least but since Bitcoin isn’t owned by Satoshi, because Satoshi is a Nym, it’s up to consensus to decide the naming.",t3_mbqknd,2021-03-24 20:23:11,2021-03-24
2624,gs0h56c,t1_gs0b2vg,Or bananas,t3_mbqknd,2021-03-24 12:06:25,2021-03-24
2625,gs15064,t1_gs0b2vg,"Naaa, you need to realize, 10k sats = 1 big mac. That's a far more realistic index.",t3_mbqknd,2021-03-24 17:54:55,2021-03-24
2626,gs1b0su,t1_gs0b2vg,Milk and bread means nothing. Bitcoin is for seeing how high you can get the red - number to go,t3_mbqknd,2021-03-24 19:21:46,2021-03-24
2627,gs17k30,t1_gs0b2vg,By this logic im assuming you keep your entire networth in cash?,t3_mbqknd,2021-03-24 18:34:36,2021-03-24
2628,gs0b7tc,t1_gs08poi,They're fungible from the perspective of decentralized PoW. It's just that they're transparent and identifiable from the perspective of ordinary nodes and users.,t3_mbqknd,2021-03-24 11:06:24,2021-03-24
2630,gs0hbc3,t1_gs099es,"If BTC gets to 300K before the end of the year, I’ll fucking pay for it!!",t3_mbqknd,2021-03-24 12:08:18,2021-03-24
2631,gs07e5b,t1_grzxewi,How many bitcoins?,t3_mbqknd,2021-03-24 10:31:28,2021-03-24
2632,gs03awl,t1_gs029qn,Well yeah. But also... Fuck YouTube,t3_mbqknd,2021-03-24 09:55:22,2021-03-24
2633,gs0r9o8,t1_gs029qn,"The quote isn't in that clip, unfortunately.",t3_mbqknd,2021-03-24 14:16:11,2021-03-24
2635,gs05ewh,t1_grzvzy8,Everything you said here is the reason this system is designed to fail.,t3_mbqknd,2021-03-24 10:13:57,2021-03-24
2636,gs0iqtj,t1_grzvzy8,"> non-government entity

This is a pretty dumb take. The Fed is accountable to Congress and its Board follows a presidential appointment system.",t3_mbqknd,2021-03-24 12:24:22,2021-03-24
2637,gs153gi,t1_grzvzy8,">letting a foreign non-government entity control the $$$

Wut?",t3_mbqknd,2021-03-24 17:56:25,2021-03-24
2638,gs10i2d,t1_grzvzy8,The gold standard is worse than fiat,t3_mbqknd,2021-03-24 16:39:41,2021-03-24
2640,gs0fqde,t1_grzvzy8,Go read “Constitution of no Authority” by Lysander Spooner. Eye opening book,t3_mbqknd,2021-03-24 11:51:27,2021-03-24
2643,gs0ud6r,t1_gs0tqkm,No this remains true for any country as long as they issue their own currency. Everything he said is factually correct. We no longer operate under fixed exchange rates either.,t3_mbqknd,2021-03-24 15:03:49,2021-03-24
2644,gs157if,t1_gs14v6h,"Thanks for that. I've been saying supply side oversupply when what I meant was ""devaluation."" Sometimes my brain go Durrrrrrrrrrrrr",t3_mbqknd,2021-03-24 17:58:13,2021-03-24
2646,gs19biz,t1_gs0y8zk,I just scoured the comments in hopes of finding Jeff Bezos name here,t3_mbqknd,2021-03-24 18:59:44,2021-03-24
2647,gs1h162,t1_gs0ajg2,I was inspired by other names on reddit lmfaooo,t3_mbqknd,2021-03-24 20:28:33,2021-03-24
2648,gs1gxth,t1_gs0fkxl,Craaab people.. craaabb people.... craaaab people,t3_mbqknd,2021-03-24 20:27:38,2021-03-24
2650,gs19uep,t1_gs17ahl,yeah Japan has very very little inflation,t3_mbqknd,2021-03-24 19:06:46,2021-03-24
2654,gs0ko3z,t1_gs0hnh0,not in my book.,t3_mbqknd,2021-03-24 12:46:36,2021-03-24
2655,gs1cvmg,t1_gs0kl5r,I bet you are super awesome to bring to parties,t3_mbqknd,2021-03-24 19:44:12,2021-03-24
2656,gs1bv4g,t1_gs0kl5r,There are more than 3 atoms in the universe.,t3_mbqknd,2021-03-24 19:32:08,2021-03-24
2657,grzxow5,t1_grzwnj8,"> they have misinterpreted a statement meant to prevent a panic in a time of crisis as gloating or threatening

Remind me how USD is looking against EUR futures right now as compared to January 2020.   


Hint: 0.10 USD worse. Fed printed 18% of all USD last year. But yeah ""misinterpreted.""",t3_mbqknd,2021-03-24 09:06:23,2021-03-24
2658,gs0iczv,t1_grzwnj8,That statement should cause panic in and of itself. It's a threat to devalue both your time and money indefinitely.,t3_mbqknd,2021-03-24 12:20:03,2021-03-24
2659,gs09qzg,t1_gs0519b,"The US treasury prints paper bills and the federal reserve requests them to be printed, yes. But it has very little to do with modern money supply. The economy runs on credit, not paper cash.

Paper money printed in 2020 was worth about $150 billion. Obviously a pretty small portion of money supply, even before accounting for old bills being removed from circulation.",t3_mbqknd,2021-03-24 10:52:48,2021-03-24
2660,grzu7s2,t1_grzjs0p,"Just print some off on your library Xerox, save your body for that someone special",t3_mbqknd,2021-03-24 08:36:33,2021-03-24
2661,gs1cx7u,t1_gs0xbvb,Same sites. EU gets some exclusives too so that’s a big plus.,t3_mbqknd,2021-03-24 19:44:42,2021-03-24
2662,grzrhde,t1_grzmqu5,"Reselling is how I paid for food, weed, and actual clothes during high school. Everyone’s gotta eat, I don’t think reselling sneakers makes anyone a scumbag. They could definitely be selling other illegal dangerous things instead.",t3_mbqknd,2021-03-24 08:13:23,2021-03-24
2663,grzpo7n,t1_grzmqu5,It’s almost like you live in a capitalist society. Maybe hit Soviet Russia or Venezuela for your type of fiscal mindset. Why are you even in a stock thing? LOL stocks is literally buying low selling high. Imagine,t3_mbqknd,2021-03-24 07:57:55,2021-03-24
2664,grzpsq2,t1_grzmqu5,You literally dream of getting Bitcoin for .0004 and selling it 50k what are you even saying lmfaoooo I want to flame your goofy ass but I’ll let you live,t3_mbqknd,2021-03-24 07:59:00,2021-03-24
2665,gs19y14,t1_gs0oyoy,what did that bitch say,t3_mbqknd,2021-03-24 19:08:05,2021-03-24
2666,gs1iabc,t1_gs0oyoy,I need about tree fiddy.,t3_mbqknd,2021-03-24 20:40:37,2021-03-24
2667,gs0e7kv,t1_gs09bpg,Fucked,t3_mbqknd,2021-03-24 11:35:42,2021-03-24
2668,gs0xb2t,t1_gs09bpg,If you keep scrolling a kid in Africa starves,t3_mbqknd,2021-03-24 15:48:48,2021-03-24
2669,gs0pjma,t1_gs0h56c,"Don’t mind me, just making a U-turn",t3_mbqknd,2021-03-24 13:51:08,2021-03-24
2670,gs1o10a,t1_gs17k30,That’s not the logic I’m using. 1 BTC = 1 BTC is just maximalist pseudo-religious mumbo jumbo. The real measure of value is against consumer prices.,t3_mbqknd,2021-03-24 21:31:09,2021-03-24
2671,gs0ci52,t1_gs0b7tc,"Each coin/satoshi has its own history. 

If your BTC bought cp in its past, its not the same as my BTC that didn't.

Also, sorry, thay example sounds kind of attack-y, but that's not my point. Its just that all BTC histories are not equal.",t3_mbqknd,2021-03-24 11:18:39,2021-03-24
2672,gs0nx7a,t1_gs0hbc3,"If BTC gets to 300K before the end of the year, I'll make an ad banner with a picture of it and publish it on Reddit.",t3_mbqknd,2021-03-24 13:28:31,2021-03-24
2673,gs04dy8,t1_gs03awl,"agreed. fuck em all. Found the full interview on CBS website without a need for Paramount+ login: https://www.cbs.com/shows/60_minutes/video/V_Y5Ptwl1zuB30DEfCliQP9NCsinqrbB/fed-official-uncertain-how-economy-will-fare-during-the-coronavirus-crisis/

(but fuck CBS too)",t3_mbqknd,2021-03-24 10:04:51,2021-03-24
2674,gs0rjxu,t1_gs0r9o8,See my comment below for the full clip,t3_mbqknd,2021-03-24 14:20:22,2021-03-24
2676,gs0fofg,t1_gs05ewh,The system isnt designed to fail its designed to give them power over you and hold the nation hostage. When it unavoidably crashes we are the ones who will suffer while they get ready to start their scheme somewhere else or already own all the physical assets they need to ride it out.,t3_mbqknd,2021-03-24 11:50:52,2021-03-24
2677,gs1ven4,t1_gs0iqtj,The FED is literally a non-government agency...,t3_mbqknd,2021-03-24 22:27:54,2021-03-24
2678,gs1ih5r,t1_gs0iqtj,"Were the accountable when they \*LOST\* 9 trillion off of their books?  


Were they accountable when they got to decide which banks did and did not get bailed out and to what amounts?",t3_mbqknd,2021-03-24 20:42:25,2021-03-24
2680,gs1ihny,t1_gs153gi,The fed is not a part of our government.,t3_mbqknd,2021-03-24 20:42:33,2021-03-24
2681,gs1iix1,t1_gs10i2d,"No, its not. It actually kept the value of our dollar stable.",t3_mbqknd,2021-03-24 20:42:52,2021-03-24
2684,gs1dox4,t1_gs0ud6r," He’s saying that when other countries print trillions of dollars out of thin air, inflation fucks them in the ass. The US can get away with it...for now.",t3_mbqknd,2021-03-24 19:53:31,2021-03-24
2685,gs1ai2v,t1_gs19biz,Lol I do shit like that all the time,t3_mbqknd,2021-03-24 19:15:12,2021-03-24
2686,gs0ayk4,t1_grzxow5,Ironic that your comment proves my point exactly and you probably have no idea.,t3_mbqknd,2021-03-24 11:04:02,2021-03-24
2687,grzufq5,t1_grzpo7n,"> Soviet Russia or Venezuela

You can be a scalper but don't be a misinformed loon at the same time lol.",t3_mbqknd,2021-03-24 08:38:23,2021-03-24
2688,grzq5c0,t1_grzpsq2,"Are you 12? Buying up all the stock of something and then flipping isn't even remotely close to the same thing as investing in Bitcoin or stock. 

Oh no, some internet tough guy threatened to flame me.",t3_mbqknd,2021-03-24 08:01:58,2021-03-24
2690,gs0djnf,t1_gs0ci52,"I fully understand that. The point is that PoW doesn't discriminate against coins, so long as mining is sufficiently decentralized.",t3_mbqknd,2021-03-24 11:28:58,2021-03-24
2691,gs0lcpm,t1_gs0ci52,History has nothing to do with being or not being fungible.,t3_mbqknd,2021-03-24 12:54:56,2021-03-24
2692,gs0f43z,t1_gs0ci52,are you telling me btc is technically an NFT,t3_mbqknd,2021-03-24 11:45:00,2021-03-24
2693,gs13xsy,t1_gs0nx7a,Let's get these on a smart contract,t3_mbqknd,2021-03-24 17:37:20,2021-03-24
2694,gs16n5c,t1_gs0nx7a,If it gets 300k I will tattoo the three of you for free,t3_mbqknd,2021-03-24 18:20:52,2021-03-24
2695,gs06lqx,t1_gs04dy8,They literally won’t let me watch this on mobile cuz they couldn’t load the ad. Fuck CBS for real,t3_mbqknd,2021-03-24 10:24:29,2021-03-24
2696,gs0gdmk,t1_gs04dy8,This is far too much sclera,t3_mbqknd,2021-03-24 11:58:16,2021-03-24
2697,gs15ghn,t1_gs04dy8,Do you need to be in the US to watch it?,t3_mbqknd,2021-03-24 18:02:13,2021-03-24
2699,gs0jg1b,t1_gs0fofg,"...yeah basically this system is designed to fail... they reap the rewards, we get fucked and rekt, rinse and repeat",t3_mbqknd,2021-03-24 12:32:19,2021-03-24
2700,gs1paod,t1_gs0fofg,hey that sounds like a ponzi scheme,t3_mbqknd,2021-03-24 21:41:24,2021-03-24
2702,gs1u4as,t1_gs1ih5r,Yes? Just because Congress doesn't exercise their authority doesn't mean they don't have it.,t3_mbqknd,2021-03-24 22:18:26,2021-03-24
2703,gs1sf9v,t1_gs1ihny,But it's answerable to the government. It's meant to be independent for a reason. Can you imagine if a corrupt POTUS were to have direct authority on pursestrings.,t3_mbqknd,2021-03-24 22:05:36,2021-03-24
2704,gs1kjyd,t1_gs1iix1,"Can you elaborate on what your definition of stability is, how our current monetary system doesn't meet that criteria, and why the criteria you lay out is beneficial over what we have? I'm not sure if more stability for the sake of stability is beneficial, depending on what your definition is.",t3_mbqknd,2021-03-24 21:01:22,2021-03-24
2707,gs0f9tm,t1_gs0ayk4,"isn't the Euro also Fiat?   


I'd ask the other guy, but I feel I'll get a better answer here. I could google it.",t3_mbqknd,2021-03-24 11:46:37,2021-03-24
2708,gs1f1d2,t1_gs0ayk4,"I don't think the intention was actual maliciousness, but words aren't as important as actions. Infinite QE != infinite confidence in the dollar, which is already showing in tangible exchanges.",t3_mbqknd,2021-03-24 20:08:16,2021-03-24
2709,grzx4d1,t1_grzufq5,"Let’s triple down, how was I misinformed when you agree Soviet Russia and Venezuela view fiscal policies different? Lmfaoooo mental gymnastics of an olympic athlete babe",t3_mbqknd,2021-03-24 09:01:25,2021-03-24
2710,grzw6rf,t1_grzufq5,"Do Soviet Russia and Venezuela have the same type of fiscal policies as America, yes or no?",t3_mbqknd,2021-03-24 08:53:17,2021-03-24
2711,gs1e7zz,t1_grzufq5,Where it alllllll started. I KNOW why you don’t answer questions cus you’d look so fucking dumb. You came full circle to “everything is scalping to a degree” lmfaooooo god damn what an actual pussy. Your wife’s boyfriends gotta be sick of you,t3_mbqknd,2021-03-24 19:59:23,2021-03-24
2712,grzqdup,t1_grzq5c0,I can’t buy up all the stock goofy. I’m one person with one IP address. You clearly have no clue what it is you are talking abouy,t3_mbqknd,2021-03-24 08:04:00,2021-03-24
2714,gs0py41,t1_gs0djnf,BTC infrastructure does not enable any level of fungibility because the history of the coin travels with it on the un-anonymized blockchain.,t3_mbqknd,2021-03-24 13:56:52,2021-03-24
2715,gs0pchg,t1_gs0lcpm,"Histories are not interchangeable.

Do you want the coin that has a transaction history of buying meth or one that has a history of buying french presses? They're worth the same! /s

History has *exactly* to do why BTC is not fungible in our case.
A dollar bill doesn't have a public history attached to it. If dollar's came with a lil QR code you could scan that revealed everything that this dollar bought, then yeah... that dollar wouldn't be interchangeable anymore. You're interchanging histories.",t3_mbqknd,2021-03-24 13:48:21,2021-03-24
2716,gs0fj7e,t1_gs0f43z,"NFT's are not fungible either, that's the point lol

BTC pretends to be fungible, but you totally could get a dirty coin, and that's a very different coin to have",t3_mbqknd,2021-03-24 11:49:21,2021-03-24
2717,gs19e7k,t1_gs13xsy,This!,t3_mbqknd,2021-03-24 19:00:46,2021-03-24
2718,gs07bbo,t1_gs06lqx,If you have the Reddit mobile app it will play when you click the link. Otherwise it seems browsers with ad block like Brave won’t let you view it (unless you disable ad blocking). Fuck them for real,t3_mbqknd,2021-03-24 10:30:46,2021-03-24
2722,gs1vrls,t1_gs1sf9v,How is it answerable to the government? Please explain.,t3_mbqknd,2021-03-24 22:30:34,2021-03-24
2724,gs1kv2n,t1_gs1kjyd,"The value of gold is essentially very stable. When it was linked to our currency it linked the stability there.  


The value of our currency is not, because they just print money all willy nilly. And ""lose"" money off their books to the tune of 9 trillion dollars.",t3_mbqknd,2021-03-24 21:04:06,2021-03-24
2726,gs1el14,t1_gs0f9tm,"It is indeed fiat, but they haven't turned on the printers in the same way to my understanding. Pulling greenbacks out of thin air will have consequences, sooner or later.",t3_mbqknd,2021-03-24 20:03:20,2021-03-24
2727,grzwone,t1_grzw6rf,"Don't bullshit me with broad yes or no questions that mean nothing. It doesn't matter what country you live in - hoarding in demand hand sanitizer for a huge markup for example would make someone a scalping piece of garbage. You're not a capitalist, you're someone with a limited skillset trying to fuck people over.

Just say what you mean - you called that dude a commie for saying scalpers are scumbags, which they are.",t3_mbqknd,2021-03-24 08:57:35,2021-03-24
2728,grzqm62,t1_grzqdup,Is this the flame you promised me?,t3_mbqknd,2021-03-24 08:05:58,2021-03-24
2729,gs0qd1q,t1_gs0py41,"Dude, did you read any of my comments? I said that **with respect to the mining network** Bitcoin is fungible. 

What is so hard for you to understand about this? Decentralized mining is resistant or immune from blocking transactions because the network just follow profitability. 

It seems to me that you just don't understand this for some reason. I don't know what else to tell you, really. 

I'm well aware that Bitcoin transactions are pseudonymous.",t3_mbqknd,2021-03-24 14:02:48,2021-03-24
2730,gs0st35,t1_gs0pchg,You seem gravely misinformed about what is going on lol,t3_mbqknd,2021-03-24 14:39:29,2021-03-24
2731,gs0o0qu,t1_gs0fj7e,"Give it a few years and we will all be complicit in your dirty money scheme, splashing those sats around.

I hope someone bought some great drugs with mine and had a conscience expanding experience.... or a drug fuelled orgy.",t3_mbqknd,2021-03-24 13:29:53,2021-03-24
2732,gs0kjyr,t1_gs0fj7e,"What is ""very different"" about ""dirty coins""?",t3_mbqknd,2021-03-24 12:45:14,2021-03-24
2733,gs0lgfx,t1_gs0fj7e,"If I have one coin and you send me a dirty coin, and then I send 1/3 of a coin back to you, how do you know how ""dirty"" it is?",t3_mbqknd,2021-03-24 12:56:14,2021-03-24
2734,gs0p50f,t1_gs0fj7e,"No matter what BTC is spent on, its value is not decreased as a result. 

A grocery store is not in trouble if they sell food to someone who makes money illegally. The grocery transaction is legal. 

This is the case whether or not the transaction is tracable (like it is to an extent with BTC).",t3_mbqknd,2021-03-24 13:45:28,2021-03-24
2739,gs1l60o,t1_gs1kv2n,I'm still not sure what your definition of stability is or the benefits of it over current monetary policy.  What damage has our current instability (whatever metric you want to use here) done in real terms?,t3_mbqknd,2021-03-24 21:06:48,2021-03-24
2740,grzx8hg,t1_grzwone,Lmfaooooo hand sanitizer? Bro. Uninstall this app. You are embarrassing,t3_mbqknd,2021-03-24 09:02:25,2021-03-24
2741,gs03rnv,t1_grzwone,">pid. And about everything that happens with our currency just proves cryptos ar

lol, you will soon realise this IS the economy, you just dont want to admit it.   


from bread/milk to land. it is ALL scalping. shut up already dude.",t3_mbqknd,2021-03-24 09:59:25,2021-03-24
2742,grzxkcl,t1_grzwone,"Just for the onlookers to see why Russia and Venezuela are specifically chosen: https://en.m.wikipedia.org/wiki/Russia–Venezuela_relations

“Venezuela is Russia's most important trading and military ally in Latin America.”

But hey, I’m misinformed lmfaooooooooooooooo fucking idiots",t3_mbqknd,2021-03-24 09:05:17,2021-03-24
2743,grzwt9s,t1_grzwone,Lmfaoooo ohhhhh so YOU are sad cus I offended your goofy ass ? Lmfao commie cuck 🤣🤣🤣🤣,t3_mbqknd,2021-03-24 08:58:43,2021-03-24
2744,grzwzpu,t1_grzwone,"Love that you can’t answer a question as you know you’d look dumb. Maybe when dude gets the helmet from me, he will send it your way. Lmfaoooo goofy bitch 😂 I could care less about your political views but if it hurts you , then : commie biiiiitch 😂😂",t3_mbqknd,2021-03-24 09:00:15,2021-03-24
2745,grzyclb,t1_grzwone,"“Mean nothing” so I guess fiscal policies mean nothing. Lmfaoooooo god I love you idiots. You make me feel real good bout myself 😂😂😂😂 hopefully your off spring aren’t as big a pussy as yourself, and I imagine your ancestors is where you obtain this behavior lmfao goofy",t3_mbqknd,2021-03-24 09:12:10,2021-03-24
2746,grzqtf0,t1_grzqm62,I’m a man of my word. I’ll spare you.,t3_mbqknd,2021-03-24 08:07:40,2021-03-24
2747,gs0qt64,t1_gs0qd1q,"I hear you, but convince me that it matters. 

Who cares if mining is decentralized if the coins are dumped into a pseudonymous non-fungible system?",t3_mbqknd,2021-03-24 14:09:21,2021-03-24
2748,gs14lvx,t1_gs0st35,"Is his point wrong? I don't understand and would like to know.

It does worry me, I don't want a bitcoin which I can see bought ChikdPorn",t3_mbqknd,2021-03-24 17:48:28,2021-03-24
2749,gs1e2du,t1_gs0st35,"I disagree haha. As long as BTC can be tracked and surveilled it is less than fully fungible.

I love BTC, I hodl it like the best, but it still has some major design flaws that prevent it from being the global decentralized digital currency we dream of. More people are becoming aware of these issues and design flaws. Still a hot commodity, but unless BTC has privacy by design, it's going to fall short.",t3_mbqknd,2021-03-24 19:57:41,2021-03-24
2750,gs0q202,t1_gs0o0qu,I bought acid with BTC before so no doubt,t3_mbqknd,2021-03-24 13:58:25,2021-03-24
2751,gs14h1g,t1_gs0o0qu,"In Canada, the $50 bills all smell like cocaine.",t3_mbqknd,2021-03-24 17:46:12,2021-03-24
2752,gs0q3gu,t1_gs0o0qu,"This is a better point... if every coin is a little tainted, then none of them are effectively. Still doesn't make BTC fungible though :3",t3_mbqknd,2021-03-24 13:58:59,2021-03-24
2753,gs0q1ir,t1_gs0kjyr,"If you had to choose between two coins. 1a BTC and 1b BTC

1a BTC just bought a ton of meth.

1b BTC just bought a ton of french presses.

Which one would you want to have in your wallet?",t3_mbqknd,2021-03-24 13:58:13,2021-03-24
2754,gs0ppma,t1_gs0lgfx,Yes. The blockchain is a public event. There is no anonymization with BTC. Everything can be audited. Every coin and satoshi has a known history that cannot be exchanged. It travels with it everywhere.,t3_mbqknd,2021-03-24 13:53:31,2021-03-24
2755,gs0pkti,t1_gs0p50f,"That doesn't mean you can define BTC as fungible. Histories are not interchangeable.

In the case of using an illegal twenty dollar bill, there's no actual way for the cashier to look up the history of that bill and know that it's stolen or laundered, etc. 

With Bitcoin... you just look at the blockchain. 

If you had to choose between two coins. 1a BTC and 1b BTC

1a BTC just bought a ton of meth.

1b BTC just bought a ton of french presses.

Which one would you want to have in your wallet?

Histories matter. This is the consequence of a public blockchain. It's sneaky, but not anonymous, BTC is not fungible when it has a known history.",t3_mbqknd,2021-03-24 13:51:38,2021-03-24
2759,gs1le2m,t1_gs1l60o,"Less purchasing power of our dollar.  


Less faith in our dollar.",t3_mbqknd,2021-03-24 21:08:47,2021-03-24
2760,gs03yf0,t1_gs03rnv,"Everything is scalping to a degree, no secret there.

But you're saying all this to defend a clearly immature kid talking about flipping fucking sneakers.",t3_mbqknd,2021-03-24 10:01:03,2021-03-24
2762,grzqzjq,t1_grzqtf0,"No, no, please indulge me. I would hate to think you are just another internet blowhard. I beg of you super cool shoe man.",t3_mbqknd,2021-03-24 08:09:07,2021-03-24
2763,gs0rbgs,t1_gs0qt64,"Because you can still confirm transactions. It's not perfectly fungible, of course, but on this layer it is and I'm just pointing that out. 

Privacy features are available and more are being developed.",t3_mbqknd,2021-03-24 14:16:57,2021-03-24
2764,gs0s9a2,t1_gs0q1ir,Why would it matter?,t3_mbqknd,2021-03-24 14:31:02,2021-03-24
2765,gs1b0ie,t1_gs0q1ir,Unless it came from a flagged wallet how would you ever know. People don’t just advertise what they do and it’s there own business.,t3_mbqknd,2021-03-24 19:21:40,2021-03-24
2767,gs0sf1k,t1_gs0ppma,"Transactions are public events, yes. But you can't track sats in the way you are implying for the simple fact that there is no such thing as individual satoshis (or Bitcoin, for that matter). Sats don't have identifiers on the blockchain. We're only dealing with global amounts.",t3_mbqknd,2021-03-24 14:33:31,2021-03-24
2768,gs0q47v,t1_gs0pkti,Let's say the criminal uses a credit or debit card to buy his/her groceries. The grocery transaction is still legal.,t3_mbqknd,2021-03-24 13:59:17,2021-03-24
2770,gs1lwb3,t1_gs1le2m,"Faith in our dollar is backed by the most powerful military in the history of the world (dont get me started on how outrageous I think our spending is on that).  Purchasing power only matters if you're holding currency (you shouldn't be outside of an emergency fund) or wages arent increasing to meet inflation (which they arent, I agree, another problem altogether).  The levers that monetary policy give us are pretty powerful when used appropriately as well as inflation benefits borrowers (people with mortgages, for example).",t3_mbqknd,2021-03-24 21:13:12,2021-03-24
2771,gs06glc,t1_gs03yf0,"No, I am not coming into defense of anything but the constant belittling of people that ""scalp"" vs people that ""do business"". They are the same people, the same type of people in my opinion.

I just think you possess an immature attitude towards what reality is.
Being a scalper is frowned upon but is it any different than people buying land for profiteering. 

If you can't even answer the distinction (good luck btw), then you're only mad at a kid for doing something your  own morale/ethical code won't/can't let you. 

Don't be mad at a kid for choosing an option that is clearly profitable to him...
it makes you look like a loser that only views the world ""as one way"" or the ""way it should be""....


If you changed your expectations to match reality, you wouldn't even be mad at a kid talking about flipping sneakers.
You would congratulate him for making the right financial decision, sure, shame him as much as you like, it is your right. It just isn't a very good reflection of your thinking .",t3_mbqknd,2021-03-24 10:23:13,2021-03-24
2772,gs1d52v,t1_gs03yf0,"Lmfao yes, ITS ALLL A PLOY TO DEFEND A SNEAKERHead . NOT the fact it’s capitalism lmfaoooo “no secret” so you agree you fucking cuck 😂😂 your just sad",t3_mbqknd,2021-03-24 19:47:11,2021-03-24
