,comment_id,comment_parent_id,comment_body,comment_link_id,created,date
1787,gren4n3,t1_grej7bm,Do you have any recs? I use Alliant and they kinda blow. Closed all their locations and the only times I've contacted them I haven't gotten any results.,t3_m7ucg3,2021-03-19 04:49:06,2021-03-19
1788,grgcsqy,t1_grej7bm,"I've been screwed by credit unions harder than banks, so no thank you. Desert Financial (known as Desert Schools then) took money out of my account to pay for my brother's debts. Never using a credit union again. Small banks are the way to go.",t3_m7ucg3,2021-03-19 14:18:55,2021-03-19
1789,grgn892,t1_grej7bm,Wouldn't solve the fact that OP didn't have enough money in their account and was counting on a paycheck to arrive in time to be able to spend a bunch.,t3_m7ucg3,2021-03-19 17:06:16,2021-03-19
1790,grf8q1d,t1_grf7v8e,Makes sense. Sounded like they ran some program on my account and it only allowed her to remove one.,t3_m7ucg3,2021-03-19 07:40:09,2021-03-19
1791,grernz8,t1_gregion,"Yep, I’m using SoFi now. Might switch again to something else. I can’t decide.",t3_m7ucg3,2021-03-19 05:23:45,2021-03-19
1792,grgq1gj,t1_grgn7h0,"""Sounds like you were poor, and had a mixup with a paycheck. Next time, try being less poor, to stop us from making you even more poor.""",t3_m7ucg3,2021-03-19 17:55:11,2021-03-19
1793,grhakpj,t1_grgn7h0,No way? That’s how that works? Dang. Would have saved me a lot of time if I had known that. /s,t3_m7ucg3,2021-03-19 21:55:43,2021-03-19
1794,grejrxz,t1_greb3pz,Dictators can hold elections and let people vote. Doesn’t means it’s not still a dictatorship,t3_m7ucg3,2021-03-19 04:24:30,2021-03-19
1795,grgbukq,t1_greb3pz,"Y they will loan it out and make $$, they will trade and hold and make money . . The good thing is you can partake in holding without them  without stashing a giant chest of cash under your bed",t3_m7ucg3,2021-03-19 14:05:14,2021-03-19
1796,grgckb3,t1_gre6uw3,"Agreed at this point if they wanted to manipulate it, it would be much easier and less risky to go after smaller market cap assets. Doesn’t  the btc market cap surpass Wells Fargo. That’s a lot of money.",t3_m7ucg3,2021-03-19 14:15:30,2021-03-19
1797,grexrca,t1_gretn04,"Yes, Chase and Citi too pls",t3_m7ucg3,2021-03-19 06:10:54,2021-03-19
1798,grgocom,t1_grgn4ri,"What has keeping a BoA account got to do with personal financial management? 

Opt for a more Bitcoin friendly one. Heck Citi is changing their tune close BoA and move over to Citi. Close chase (because of Dimon) and move to Citi. Tell them why u are moving. Send a message.",t3_m7ucg3,2021-03-19 17:25:57,2021-03-19
1799,gre8edv,t1_gre811u,Have my HODL account and my day trade account.  I kind of hope we never need Bitcoin because that will mean the world is completely different and maybe fd😳😁,t3_m7ucg3,2021-03-19 02:55:15,2021-03-19
1800,grf6lmp,t1_grf574q,"I bet you've made half a baby too, ya halfwayer",t3_m7ucg3,2021-03-19 07:22:38,2021-03-19
1801,grgx9nh,t1_grgx87v,"Ah, thanks!",t3_m7ucg3,2021-03-19 19:41:54,2021-03-19
1802,gre6npg,t1_gre4ain,Yes also many people forget the best way to keep it from being manipulated is to not regulate it. A crypto speciality. Why are stocks manipulated so easy? Because they are regulated that way but I assume I am preaching to the choir.,t3_m7ucg3,2021-03-19 02:42:38,2021-03-19
1803,grg6z3u,t1_gre4ain,I'd say the higher the market cap the less volatile it will be.  See: gold.,t3_m7ucg3,2021-03-19 13:00:30,2021-03-19
1804,grfzmuu,t1_gre4ain,It will take more money to move the market.,t3_m7ucg3,2021-03-19 11:40:57,2021-03-19
1805,grh15bf,t1_gre4ain,"No matter how many individuals own smaller fractions of btc, there are still whales that own ~40% of the market (yes I know supply will increase for awhile which will dilute them) which poses a massive volatility risk",t3_m7ucg3,2021-03-19 20:26:46,2021-03-19
1806,grfbu4z,t1_gregz02,precisely!,t3_m7ucg3,2021-03-19 08:06:26,2021-03-19
1807,grgklc8,t1_grfqne6,Raise awareness as much as possible,t3_m7ucg3,2021-03-19 16:20:14,2021-03-19
1808,grf1ok0,t1_grejqys,"Clearly, one Satoshi will be defined as 1:10,000th of a Finney.",t3_m7ucg3,2021-03-19 06:42:23,2021-03-19
1809,grf4b2e,t1_grehuxo,"The purpose of most businesses, not to single out JP, is to make money.  There's not a customer or employee that the company doesn't use for this purpose.  Nothing wrong with that at all.",t3_m7ucg3,2021-03-19 07:03:57,2021-03-19
1810,gre6v8n,t1_gre6n6y,"Why couldnt it still be a pump and dump? 

34 of the last 40 months had bitcoin sitting -85% from ATH",t3_m7ucg3,2021-03-19 02:44:09,2021-03-19
1811,grg7s50,t1_gre6n6y,"Except this exact post was written hundreds of times in 2017 alone.... (not verbatim, but you get the idea.)",t3_m7ucg3,2021-03-19 13:10:33,2021-03-19
1812,grfvv0s,t1_grfr01x,"So you figure 9 years or so?  


55 billion worth of BTC traded in the last 24 hours.   


I swear the shit people believe is crazy.   


Also, JP Morgan, BofA...those are 'Hedgies'? lol",t3_m7ucg3,2021-03-19 11:04:28,2021-03-19
1813,grgncrx,t1_grer4xf,Some basic financial management and you shouldn't be running into overdraft fees.,t3_m7ucg3,2021-03-19 17:08:30,2021-03-19
1814,grgzqqh,t1_grgnaf1,"Ah, yes. My fault for being poor. Shame on me.",t3_m7ucg3,2021-03-19 20:11:15,2021-03-19
1815,greogxt,t1_gren4n3,It’ll be based on your location. Most credit unions are local. Just do a google search for credit union near me and look up reviews.,t3_m7ucg3,2021-03-19 04:59:12,2021-03-19
1816,grgn9ko,t1_grgcsqy,"Honestly it's all the same. Maintain enough money in your bank account so you can deal with a screwed up paycheck. Living with your finances on the edge is not a good thing, and everyone should have an emergency fund.",t3_m7ucg3,2021-03-19 17:06:57,2021-03-19
1817,grfanps,t1_grejrxz,> Dictators can hold elections and let ~~people~~ printers vote. Doesn’t means it’s not still a dictatorship,t3_m7ucg3,2021-03-19 07:56:21,2021-03-19
1818,grgk9iw,t1_grexrca,"Yes. Though Citi seems to be turning a corner. Just need to make then lift debit card purchases. Credit card ones fair enough but debit cards they need to lift the blocks. 

Overall though banks are dying. Boycott them, make them behave.",t3_m7ucg3,2021-03-19 16:14:39,2021-03-19
1819,grea65x,t1_gre8edv,"People are already needing it right now. Especially in other countries like Argentina, Lebanon, Venezuela, Zimbabwe, Nigeria, Somalia and India.

More to come I'm sure. Matter of time.",t3_m7ucg3,2021-03-19 03:08:02,2021-03-19
1820,grer9ot,t1_gre6npg,"This.  ever notice all the regulations are to ""protect retail investors"" actually prevent them from getting the returns the big boys do",t3_m7ucg3,2021-03-19 05:20:36,2021-03-19
1821,grg2j6o,t1_gre6npg,"More than anything else it's the availability of derivatives and the involvement of institutions in making markets. 

Which is why I choose NOT TO earn interest on my crypto... I don't want my crypto to be sold short, I want this stuff to go up, not down.",t3_m7ucg3,2021-03-19 12:10:58,2021-03-19
1822,grf7972,t1_gre6npg,That is some ass backwards logic you got there.,t3_m7ucg3,2021-03-19 07:27:59,2021-03-19
1823,gre6x96,t1_gre6npg,Regulation prevents manipulation.,t3_m7ucg3,2021-03-19 02:44:34,2021-03-19
1824,grflahz,t1_gre6npg,How are stocks manipulated?,t3_m7ucg3,2021-03-19 09:28:02,2021-03-19
1826,grf6xhy,t1_grf4b2e,"I'd agree. For the most part.

At the base concept of business existing to provide goods and services in exchange for profit, there is nothing wrong with that at all.

I was just making the pedantic point that banks, at least the big 4, are not making money off of you and me unless we own a rather large business. JP Morgan would rather not have any of us as customers, and retail branches merely serve as expensive billboards to bring in business owners.",t3_m7ucg3,2021-03-19 07:25:19,2021-03-19
1827,grfqtpa,t1_grf4b2e,"agree, Yet congress is questioning DFV when he said he was buying stock and it went up and here JPM call something trash and is investing in it",t3_m7ucg3,2021-03-19 10:17:42,2021-03-19
1828,gre8ryb,t1_gre6v8n,"* large market cap

* more and more mainstream payment adoption happening every day

* gradual devaluation of the USD with the inevitable rise in inflation

* world population gradually coming to the realization that centralized banking is corrupt to the core and are talking with their dollar instead of their mouth

* individual large cap companies buying large amounts of BTC, not just institutions. Institutions tend not to fuck with the big players unless they do something really bad

The reason why any currency works in the first place is based on the people’s confidence of the underlying system with which it’s based on. Plus, if it was a pump and dump, you would think the bears would’ve taken it back to sub $100 by this point",t3_m7ucg3,2021-03-19 02:57:57,2021-03-19
1829,grf0tyv,t1_greogxt,Also make sure they’re a co-op so you can use most credit unions and access your accounts out of town/state,t3_m7ucg3,2021-03-19 06:35:23,2021-03-19
1830,grfg1ai,t1_grer9ot,"""You don't know what you are doing, trust me"" - Your government",t3_m7ucg3,2021-03-19 08:42:10,2021-03-19
1831,grfp5ax,t1_grer9ot,Pattern day trader rules for the little guy. High frequency trading for the hedge funds.,t3_m7ucg3,2021-03-19 10:02:13,2021-03-19
1832,grfpxq7,t1_grer9ot,You have to have 25K to trade the same stock the same day. If I had that much I wouldn't need to do that!,t3_m7ucg3,2021-03-19 10:09:31,2021-03-19
1833,gre71yc,t1_gre6x96,Oh sweet summer child... stocks are HIGHLY regulated and HIGHLY manipulates,t3_m7ucg3,2021-03-19 02:45:31,2021-03-19
1834,greeelf,t1_gre6x96,You’re very innocent,t3_m7ucg3,2021-03-19 03:41:10,2021-03-19
1835,gredl0r,t1_gre6x96,"*regulation prevents UNAPPROVED manipulation. If we give them the power to regulate, we give them power to manipulate to THEIR best interests. I.e. when the reddit apes band together to buy gme, they were restricted from buying with multiple brokers BUT NOT SELLING, news was pushed to get them to dump for other stocks, silver, etc. The rich don't get rich by forking over their cash to the apes. If you don't see the manipulation yet you're not looking close enough.",t3_m7ucg3,2021-03-19 03:34:37,2021-03-19
1836,grei5ps,t1_gre6x96,"Someone who trades stocks knows this is 100% bullshit, you're just repeating this because you read this or someone told you but you really don't know for yourself and you should not be parroting it.",t3_m7ucg3,2021-03-19 04:11:47,2021-03-19
1837,greulq7,t1_gre6x96,"Oh ye, look at gme for example",t3_m7ucg3,2021-03-19 05:46:26,2021-03-19
1838,grf5w00,t1_gre6x96,"You should read up on ""regulatory capture""

If the regulating body is populated by those who stand to gain, they will apply those regulations in their favor. It's all over the equities market.",t3_m7ucg3,2021-03-19 07:16:49,2021-03-19
1839,greq8v8,t1_gre6x96,And the USA has free and fair elections right?,t3_m7ucg3,2021-03-19 05:12:39,2021-03-19
1840,grefbyo,t1_gre6x96,Where?,t3_m7ucg3,2021-03-19 03:48:41,2021-03-19
1841,gretkz4,t1_gre6x96,"""stick to the fundamentals""",t3_m7ucg3,2021-03-19 05:38:30,2021-03-19
1842,grf26qt,t1_gre6x96,"It prevents manipulation by you, does not prevent manipulation by people that have the means and technical know how to jump through all the loop holes in the laws purposely suggested to lawmakers (and accompanied by a fat donation) by the same people with the means and technical know how.",t3_m7ucg3,2021-03-19 06:46:31,2021-03-19
1843,grgb6ck,t1_gre6x96,"Ouch this is not the  place to make this comment. :) Laws do protect us. Pure markets would mean no laws.  no laws would be an awful place to live.  Y people find ways around laws and circumvent them but for the most part chaos and anarchy is mitigated my laws. My heart is torn , i love but also  fear decentralization .  I dont think everything should be decentralized but there really has not been a good debate about this.",t3_m7ucg3,2021-03-19 13:55:48,2021-03-19
1845,grh2hb5,t1_grflahz,"Limiting buying, or restricted to selling only. Perception is a big deal. That's the use of media to push buy or sell for results. One company went as far as to put a direct fiber line to walls street and beat buys by nano seconds, allowing the firms who signed for the fiber to game the system and get buys ahead of stock trades before they filled. Technically smart but not legit. Eventually the system adapted to prevent this. Having exchanges crash when numbers are up.. not limited to coinbase and cypto. As seen in GME.",t3_m7ucg3,2021-03-19 20:40:46,2021-03-19
1846,grgnwnp,t1_grfqtpa,congress is the legislative branch of the federal reserve/wall street,t3_m7ucg3,2021-03-19 17:18:12,2021-03-19
1847,grej9js,t1_gre8ryb,Gradual devaluation of the USD? ROFL,t3_m7ucg3,2021-03-19 04:20:40,2021-03-19
1848,grfajd0,t1_grf0tyv,Co-op is the credit union free ATM network.,t3_m7ucg3,2021-03-19 07:55:20,2021-03-19
1849,grfjssz,t1_grfg1ai,And “this time is different”. It’s probably the biggest lie ever told.,t3_m7ucg3,2021-03-19 09:14:56,2021-03-19
1850,grgzlg1,t1_grfg1ai,"Hi, I'm from the government and I'm here to help!",t3_m7ucg3,2021-03-19 20:09:37,2021-03-19
1851,grfqgyv,t1_grfpxq7,These are exactly right  Rules like pattern day trader are an excellent example of how the rules to protect us are actually designed to keep us down,t3_m7ucg3,2021-03-19 10:14:26,2021-03-19
1852,grfg20x,t1_gre71yc,"This is an over simplification. It depends on the regulations you're talking about. Some are created for the benefit of the rich, some are created to keep them in check.

Generally deregulation is actually linked to more instances of fraud and dodgy behaviour by the big players.",t3_m7ucg3,2021-03-19 08:42:20,2021-03-19
1853,gre9cfy,t1_gre71yc,"Everyone you're replying to said that...

Addendum: I'm wrong. Guess I was going crazy. Thought I double checked.",t3_m7ucg3,2021-03-19 03:02:05,2021-03-19
1854,grfxuy4,t1_gredl0r,You guys have no clue what kind of havoc unregulated markets can stir.  We will see soon. We complain about what we see but never what comes up because it was prevented.,t3_m7ucg3,2021-03-19 11:23:33,2021-03-19
1855,grevcdd,t1_greulq7,"Capital requirements are always raised for volatility to cover trading requirements
Happened to Tesla short sellers too",t3_m7ucg3,2021-03-19 05:52:12,2021-03-19
1856,grgbe1e,t1_greq8v8,A lot fairer than Russian elections,t3_m7ucg3,2021-03-19 13:58:49,2021-03-19
1857,grehjg1,t1_grefbyo,"Should be how? But dating back to the depression, enforcing proper accounting practices, leading to better ones after Enron, up to frank dod stress tests. All things to give the public better and more accurate info to prevent manipulation",t3_m7ucg3,2021-03-19 04:06:43,2021-03-19
1858,grekcwf,t1_grej9js,laugh all you want but ive been shorting the usd against the rmb and its been free money,t3_m7ucg3,2021-03-19 04:28:37,2021-03-19
1859,grh22uy,t1_grfajd0,Oh the credit union co-op network has shared branch access as well.  That’s what I meant,t3_m7ucg3,2021-03-19 20:36:35,2021-03-19
1860,grfo7nu,t1_grfg20x,"What about the [Libor scandal](https://en.wikipedia.org/wiki/Libor_scandal)? 

The mortgage crisis [fines](https://en.wikipedia.org/wiki/Subprime_mortgage_crisis#Bank_fines_and_penalties)? 

The [recent](https://www.icij.org/investigations/fincen-files/hsbc-moved-vast-sums-of-dirty-money-after-paying-record-laundering-fine/) HSBC money laundering scandal, after the [previous](https://www.theguardian.com/business/2015/jun/04/hsbc-fined-278m-over-money-laundering-claims) fines? 

Whether it's [Goldman Sachs involvement in the 1MDB fraud](https://www.washingtonpost.com/business/2020/10/22/goldman-sachs-1mdb-record-fine/), or Bank of America paying [$82 Billion in fines](https://www.nasdaq.com/articles/bofa-tops-fines-blacklist-with-us%2482bn-payouts-in-last-20-years-2021-02-15), the regulators aren't doing anything 

Look at other recent [illegal activity](http://graphics.wsj.com/lists/SEC0918), that's the national banks business model, globally",t3_m7ucg3,2021-03-19 09:53:40,2021-03-19
1862,grei01j,t1_gre9cfy,He literally replied to the comment “regulation prevents manipulation”.,t3_m7ucg3,2021-03-19 04:10:29,2021-03-19
1863,grgm4pg,t1_grgbe1e,Is that really the global standard? Better than the Russians so.... good enough?,t3_m7ucg3,2021-03-19 16:46:51,2021-03-19
1864,grfdqa6,t1_grehjg1,LMFAOOOOOOOOOOO you REALLY like choking on the dick of FDRs ghost don’t you?,t3_m7ucg3,2021-03-19 08:22:35,2021-03-19
1865,grekkrm,t1_grekcwf,I’m laughing at the gradual part. Its actually quite fast paced,t3_m7ucg3,2021-03-19 04:30:11,2021-03-19
1866,grg63gj,t1_grfo7nu,"Yes, the regulators aren't doing a very good job. I agree.

They have been made toothless.

Less regulations won't necessarily make things fairer though...",t3_m7ucg3,2021-03-19 12:50:07,2021-03-19
1867,grgom38,t1_grgm4pg, Never said it was. There’s room for improvement,t3_m7ucg3,2021-03-19 17:30:29,2021-03-19
1868,grf9orp,t1_grekkrm,Had me in the first half,t3_m7ucg3,2021-03-19 07:48:07,2021-03-19
1869,grg7amg,t1_grg63gj,"not allowing them to take fees, for being nothing more than useless rent seeking middlemen, would also make things fairer though....

stuff like strike app, using the lightning network to compete with bank wires, is going to be fun see play out over the next few years",t3_m7ucg3,2021-03-19 13:04:27,2021-03-19
1870,grh1pvn,t1_grg63gj,"By saying ""not a very good job"" it suggest they are doing a good job still. That's not true.",t3_m7ucg3,2021-03-19 20:32:53,2021-03-19
1871,grg7lvd,t1_grg7amg,"Can you see the problem here though? Through deregulation the regulators have been made useless.

And then people are like, ""See? Regulations are bad. Lets get rid of them.""

And it just makes the problem even worse.",t3_m7ucg3,2021-03-19 13:08:22,2021-03-19
1872,grg99xh,t1_grg7lvd,"[FINRA](https://en.wikipedia.org/wiki/Financial_Industry_Regulatory_Authority) had [Bernie Madoff](https://en.wikipedia.org/wiki/Bernie_Madoff#Career) on their board of governors 

The Federal Reserve backed the reserve currency of the world with gold until [Nixon Shock](https://en.wikipedia.org/wiki/Nixon_shock)

These currencies were created when personal computers, the internet and cell phones were science fiction. 

The idea that we need to print polyurethane bills every 5 years with new security features and move them in trucks to branches and ATM's constantly when we have digital EVERYTHING, is absolute insanity 

Financial crimes are still financial crimes, just ask [Ross Ulbricht](https://en.wikipedia.org/wiki/Ross_Ulbricht)

Having regulators or middlemen that need to take fees when everything should have moved digitally 20 years ago is just obvious why the gate keepers held it back. 

The police, FBI, Homeland Security, Secret Service, NSA, CIA aren't going anywhere or going to stop investigating criminals moving money, having it on an open source blockchain just makes that easier, not more difficult 

Stop the madness already and give people sound money.",t3_m7ucg3,2021-03-19 13:29:54,2021-03-19
1873,grgmfqb,t1_grg99xh,"I'm not against bitcoin or other blockchain technologies.

HODL",t3_m7ucg3,2021-03-19 16:52:15,2021-03-19
1879,grhf2qz,t3_m8funu,Amazing.,t3_m8funu,2021-03-19 22:32:55,2021-03-19
1997,grdsi0b,t3_m7ucdw,"There's a WWII museum near me with a whole wing dedicated to the value of a dollar with charts and maths.
It's truly upsetting to see how an average high-school educated guy making an average wage could have a wife at home raising 4+ kids, a new car and a mortgage free house and have a pension when he retires.",t3_m7ucdw,2021-03-19 01:00:08,2021-03-19
1998,grdssro,t3_m7ucdw,"tldr; Bitcoin has been the best-performing asset class over the past year and the past decade. In just a month following the first stimulus check back in late March 2020, Bitcoin rose over 50% as the flood of new money rushed into its arms. Bitcoin has several advantages that make it stand out as the asset of choice when investing stimulus checks.

*This summary is auto generated by a bot and not meant to replace reading the original article. As always, DYOR.*",t3_m7ucdw,2021-03-19 01:02:16,2021-03-19
1999,greh5qb,t3_m7ucdw,"Congress passes so called stimulus package, gives the working class a couple dollars while passing out billions to people and places that don’t give a fuck about America. Ya let’s give Pakistan 10 million for gender studies.They gave art museums millions. I think they really are purposely trying to hyper inflate the dollar",t3_m7ucdw,2021-03-19 04:03:31,2021-03-19
2000,gregeph,t3_m7ucdw,I wish I had more money so I could buy more bitcoin,t3_m7ucdw,2021-03-19 03:57:30,2021-03-19
2001,grejalp,t3_m7ucdw,If you used the original stimulus check to buy bitcoin it would be worth over 10k today.,t3_m7ucdw,2021-03-19 04:20:53,2021-03-19
2002,gre5s5p,t3_m7ucdw,That bitcoin percentage gain can easily make someone think you just guessed some numbers and typed them in 😂,t3_m7ucdw,2021-03-19 02:36:13,2021-03-19
2003,gresuit,t3_m7ucdw,"Well if we would have kept up wages with inflation we would have more people spend more USD all over the world, thus boosting its value.  But no, we let the corporations and government horde the money to the few that already have more than they know what to do with.  

So it sits there doing nothing, not being spent, not adding value, just slowly losing value.",t3_m7ucdw,2021-03-19 05:32:49,2021-03-19
2004,gre3zyj,t3_m7ucdw,"Using the meteoric rise in BTC over the first few years as an indicator of the future is stupid.

A Boeing 747 climbs from 0 to 40,000 feet in the first 30 minutes of a flight, it doesn't reach 320,000 feet after four hours. 

The stimmy check quite likely DOES belong in BTC above any others, but NOT because of a 4986412% rise since 2011.",t3_m7ucdw,2021-03-19 02:23:11,2021-03-19
2005,gre5x0y,t3_m7ucdw,"With respect to the purchasing power, does anyone have any decent trackers or sources that go into this with greater detail?  Saylor brings this up a lot and I try and dig into it more but haven't found very much that is definitive.",t3_m7ucdw,2021-03-19 02:37:13,2021-03-19
2006,grdp2z5,t3_m7ucdw,In some countries USD vs local currency looks like a safe heaven: https://storeoftime.com/,t3_m7ucdw,2021-03-19 00:36:27,2021-03-19
2007,grgbf05,t3_m7ucdw,"23% over the past decade!!?  More like the past 1.5 years.  What metric are you using?  CPI!?  That is not = to purchasing power, no matter how many times they try to say it is.  We’ve printed over 20% more money this year alone!",t3_m7ucdw,2021-03-19 13:59:11,2021-03-19
2008,grget52,t3_m7ucdw,"Fiat goes down in purchasing power for the masses. 

Whilst the richest people’s stocks and assets rise. 

It’s no wonder wealth disparity is a problem when the very thing we try to earn is worth less and less. 

And the only way to hedge against it is to have spare money to invest.",t3_m7ucdw,2021-03-19 14:48:31,2021-03-19
2009,grdzucf,t3_m7ucdw,The Bitcoin percentage just looks like a kid slammed on the number pad. Its wild how much it has changed in such a short time.,t3_m7ucdw,2021-03-19 01:52:32,2021-03-19
2010,grf46wb,t3_m7ucdw,Planning to put the check fully into crypto. Just waiting on it to arrive!,t3_m7ucdw,2021-03-19 07:02:59,2021-03-19
2011,gred3f2,t3_m7ucdw,"I hate inflation and fiat currency, is the biggest scam. During my life I lived 3 or 4 hiper inflation process (not USA)... was more worthy to save tuna, bullets and toilet paper than ""pesos""... 

Great (and free) book to read: https://www.jstor.org/stable/j.ctt195sdt8

 

Said this, There is a detail that they overlook, the dollar has a very solid backing: violence. If you do not accept US dollars in your country, they will invade you, kill your children, burn your cities, send drones with bombs painted with a LGBT flag and call it ""freedom."" Find out what happened to the last guy who had the idea to stop accepting dollars for oil, and who wanted to recreate a gold dinar ... I don't see that bitcoin nerds have any army ... the day the world tries to stop using dollars, the United States is going to give them ""freedom.""

edit: for those short of time, the main point is: 

https://en.wikipedia.org/wiki/Petrodollar_recycling#Petrodollar_warfare

""The term petrodollar warfare refers to the motivation of US military offensives being to preserve by force the status of the United States dollar as the world's dominant reserve currency and as the currency in which oil is priced. The term was coined by William R. Clark, who has written a book with the same title. The phrase oil currency war is sometimes used with the same meaning.""",t3_m7ucdw,2021-03-19 03:30:38,2021-03-19
2012,greaj0z,t3_m7ucdw,I wonder... did they compute inflation correctly. Cuz I suspect it's worst. They tend to leave certain metrics off the inflation report. It's gonna get a lot worst coming up. Get rdy for a 2008 collapse folks. Better have btc to actually retain your wealth!,t3_m7ucdw,2021-03-19 03:10:36,2021-03-19
2013,grdsifq,t3_m7ucdw,"Also the stock market is only being held up by low rates from the fed, won't last much longer",t3_m7ucdw,2021-03-19 01:00:13,2021-03-19
2014,grdupry,t3_m7ucdw,And that's where my stimmy went...,t3_m7ucdw,2021-03-19 01:16:01,2021-03-19
2015,gre24xg,t3_m7ucdw,"lol, 23 %, maybe in CPI terms... 24 % of USD was printed just last year, 20 % year before, from 2008 it was on average 9 % per year... tell me about 23 % in a decade XD",t3_m7ucdw,2021-03-19 02:09:18,2021-03-19
2016,gre4s0l,t3_m7ucdw,Stimmy checks going into savings is what is gonna prolong this recession...,t3_m7ucdw,2021-03-19 02:28:53,2021-03-19
2017,gre6i7p,t3_m7ucdw,"u will regret missing Yield app fund, yearly yield won't so high as now too long.",t3_m7ucdw,2021-03-19 02:41:30,2021-03-19
