,comment_id,comment_parent_id,comment_body,comment_link_id,created,date
2241,gu1f604,t1_gu1cigd,"What's going on?

BTC is going on...",t3_mo3td0,2021-04-10 21:05:21,2021-04-10
2242,gu1qrcy,t1_gu1cigd,it's around the 50k euro mark so could just be people in the eurozone taking profits?,t3_mo3td0,2021-04-10 22:56:21,2021-04-10
2243,gu1ql57,t1_gu1lz4o,Who was it or what was the podcast number?,t3_mo3td0,2021-04-10 22:54:52,2021-04-10
2245,gu1m1vi,t1_gu1ey5v,It will give more media attention. Only a small percentage of people know about / own bitcoin compared to cars.,t3_mo3td0,2021-04-10 22:14:41,2021-04-10
2246,gu1nyu1,t1_gu1ey5v,Also Uber is a human resource app...,t3_mo3td0,2021-04-10 22:32:27,2021-04-10
2247,gu1ofy1,t1_gu1ey5v,Well actually it did have an effect.  It's just marginal.,t3_mo3td0,2021-04-10 22:36:42,2021-04-10
2253,gu1qp8l,t1_gu1j3dz,"This is from wiki:  


"" Knowledge of the Fibonacci sequence was expressed as early as [Pingala](https://en.wikipedia.org/wiki/Pingala) (c. 450 BC–200 BC). Singh cites Pingala's cryptic formula *misrau cha* (""the two are mixed"") and scholars who interpret it in context as saying that the number of patterns for *m* beats (*Fm*\+1) is obtained by adding one \[S\] to the *Fm* cases and one \[L\] to the *Fm*−1 cases.[\[12\]](https://en.wikipedia.org/wiki/Fibonacci_number#cite_note-12) [Bharata Muni](https://en.wikipedia.org/wiki/Bharata_Muni) also expresses knowledge of the sequence in the [*Natya Shastra*](https://en.wikipedia.org/wiki/Natya_Shastra) (c. 100 BC–c. 350 AD).[\[13\]](https://en.wikipedia.org/wiki/Fibonacci_number#cite_note-13)[\[7\]](https://en.wikipedia.org/wiki/Fibonacci_number#cite_note-GlobalScience-7) However, the clearest exposition of the sequence arises in the work of [Virahanka](https://en.wikipedia.org/wiki/Virahanka) (c. 700 AD), whose own work is lost, but is available in a quotation by Gopala (c. 1135):[\[11\]](https://en.wikipedia.org/wiki/Fibonacci_number#cite_note-FOOTNOTELivio2003197-11) ""  


Or do you just mean prior to 1202 when Fibnoacci first wrote about it?",t3_mo3td0,2021-04-10 22:55:51,2021-04-10
2255,gu1hcqj,t1_gu1h470,English is not my spoken language* lol,t3_mo3td0,2021-04-10 21:28:29,2021-04-10
2262,gu1glkn,t1_gu1dymt,When will you buy next?,t3_mo3td0,2021-04-10 21:20:49,2021-04-10
2266,gu1r9ww,t1_gu1ql57,1631 Brian Greene,t3_mo3td0,2021-04-10 23:00:45,2021-04-10
2268,gu1qvv0,t1_gu1qp8l,"I believe he means prior to it being applied to markets as a technique, implying psychology adheres to it on a deeper level.",t3_mo3td0,2021-04-10 22:57:25,2021-04-10
2269,gu1r87v,t1_gu1qp8l,I mean prior to its use on technical analysis. Technical analysis is older than the applied fibonacci theory to it.,t3_mo3td0,2021-04-10 23:00:22,2021-04-10
2270,gu1ob5l,t1_gu1hcqj,Most english natives don't speak a second language so no worries :),t3_mo3td0,2021-04-10 22:35:30,2021-04-10
2276,gu1h26k,t1_gu1glkn,Today,t3_mo3td0,2021-04-10 21:25:32,2021-04-10
2290,gtyt8ow,t3_mnnz94,This is cool. My brother in law replaced the flooring of his old house and found a newspaper from the 1950’s underneath.,t3_mnnz94,2021-04-10 03:40:22,2021-04-10
2291,gtynjht,t3_mnnz94,Insane. Love it.,t3_mnnz94,2021-04-10 02:56:51,2021-04-10
2292,gtywiot,t3_mnnz94,"In 6 years, there will be an army of carpet installers buying bitcoin.",t3_mnnz94,2021-04-10 04:05:45,2021-04-10
2293,gtz3q7u,t3_mnnz94,you should also write 24 random words from the BIP39 word list and then smudge it.,t3_mnnz94,2021-04-10 05:02:31,2021-04-10
2294,gtyxis7,t3_mnnz94,That’s hilarious! I rehab properties and do similar. I’ll write out a note w the date and what’s happening in the world then put it in the wall before Sheetrock haha. I’m gonna start writing the BTC $ now!!,t3_mnnz94,2021-04-10 04:13:35,2021-04-10
2295,gtyo4c7,t3_mnnz94,Brilliant.,t3_mnnz94,2021-04-10 03:01:11,2021-04-10
2296,gtzctgo,t3_mnnz94,You should leave like $1 of bitcoin on a paper wallet! Would be cool to see if it turns into something of value in 20 years!,t3_mnnz94,2021-04-10 06:17:53,2021-04-10
2297,gtyvnk9,t3_mnnz94,I am replacing my own carpet and will definitely do this before laying the new stuff down!,t3_mnnz94,2021-04-10 03:59:00,2021-04-10
2298,gtyzi1c,t3_mnnz94,For a sec i thought u dig and find private keys under carpets...  tbh ive thought of hiding Seeds under carpets.,t3_mnnz94,2021-04-10 04:28:56,2021-04-10
2299,gtynsmj,t3_mnnz94,This is so cool! <3,t3_mnnz94,2021-04-10 02:58:44,2021-04-10
2300,gtze91j,t3_mnnz94,"Bro, this is brilliant. I'm an electrician and can definitely do something like this. If I'm roughing-in I get first crack at that subfloor. Or the framing members. Or enclosures, vaults, etc. All tradesmen can communicate to the future, in a non-digital, real-world way. Ha, love this idea.",t3_mnnz94,2021-04-10 06:30:02,2021-04-10
2301,gtyqsu9,t3_mnnz94,This is great,t3_mnnz94,2021-04-10 03:21:47,2021-04-10
2302,gtzef2d,t3_mnnz94,Dude I’m a plumber and I did that in tons of houses too it was when Bitcoin was around 5-7k I signed it and wrote the price and date and wrote “buy Bitcoin” on a few studs per house haha,t3_mnnz94,2021-04-10 06:31:28,2021-04-10
2303,gtyrmev,t3_mnnz94,You gonna make some poor no-coiner a sad wage slave that day.,t3_mnnz94,2021-04-10 03:28:03,2021-04-10
2304,gtz32w0,t3_mnnz94,"So you're saying you establish a new floor for the Bitcoin price everyday? So that's how bitcoin works...interesting. Do me a favor a write $93,000.01 on the next one, and by next year write an infinity symbol you know I'm not greedy I think a year to get to infinity is healthy growth don't want it to moon too fast.",t3_mnnz94,2021-04-10 04:57:18,2021-04-10
2305,gtzg7ab,t3_mnnz94,I love this idea! I just had my kitchen redone and I dated The beam on the ceiling and wrote Corona 2020 LOL I thought that would be interesting to look back at. I never thought to write other information!,t3_mnnz94,2021-04-10 06:46:52,2021-04-10
2306,gtzl4dx,t3_mnnz94,I’m an HVAC installer. I just might start doing this.,t3_mnnz94,2021-04-10 07:30:51,2021-04-10
2307,gtyqwqz,t3_mnnz94,Good reference point,t3_mnnz94,2021-04-10 03:22:37,2021-04-10
2308,gtz3u60,t3_mnnz94,"How about putting 0.0001 on a paper wallet underneath?

Or too tempting to know and in future breaking into these places to grab the wallet? 😂",t3_mnnz94,2021-04-10 05:03:24,2021-04-10
2309,gtz8k3w,t3_mnnz94,"lol. love you all my Bitcoin brethren. especially you OP!

About time we have some decent shit-posts in here rather than the ""should I buy now?! please help.... "" bullshit we see every day. 

well done OP.

Myself. I have two Bitcoin chat groups. which started spontaneously last year after friends kept asking about Bitcoin (FINALLY!). I managed to get I think 14-15 friends & family,  interested enough to buy a little BTC for themselves. 

hopefully that will have a butterfly effect and it will spread....",t3_mnnz94,2021-04-10 05:42:03,2021-04-10
2310,gtziobi,t3_mnnz94,This is hauntingly beautiful,t3_mnnz94,2021-04-10 07:08:38,2021-04-10
2311,gu09fdo,t3_mnnz94,OP you should print some paper wallets with like 10$ worth of bitcoin on them.  Someday another contractor could find a winning lotto ticket.,t3_mnnz94,2021-04-10 11:16:54,2021-04-10
2312,gtyr2g8,t3_mnnz94,Too cool,t3_mnnz94,2021-04-10 03:23:49,2021-04-10
2313,gtz0l4c,t3_mnnz94,It aint much but its honest work,t3_mnnz94,2021-04-10 04:37:34,2021-04-10
2314,gu05p8r,t3_mnnz94,"Im waiting to see those ""I wish I bought bitcoin when it was this cheap"" posts in 6-20 years",t3_mnnz94,2021-04-10 10:40:14,2021-04-10
2315,gu0o5q9,t3_mnnz94,Perhaps you could leave some satoshis in there as well. Make it a one wallet treasure hunt. Whoever changes the floors first wins. Then the other people can also see when the treasure was found.,t3_mnnz94,2021-04-10 14:14:00,2021-04-10
2316,gu0pyzc,t3_mnnz94,we just sold our house.  I had to cover the back of a wall in a storage room. I hid a old replica sword I had in there. some day they'll find it.,t3_mnnz94,2021-04-10 14:40:35,2021-04-10
2317,gu11le9,t3_mnnz94,"LOL, that is great.  10 years from now some young couple will pull your carpet up and think . . . ""well that carpet guy is retired now.""",t3_mnnz94,2021-04-10 17:54:03,2021-04-10
2318,gtysaw0,t3_mnnz94,This is A-W-E-S-O-M-E!,t3_mnnz94,2021-04-10 03:33:17,2021-04-10
2319,gtywcww,t3_mnnz94,You're one of the few here where it's actually relevant to check the price during work :D,t3_mnnz94,2021-04-10 04:04:31,2021-04-10
2320,gtz8n90,t3_mnnz94,"Previously it was newspaper clippings, now we have a better timestamp.",t3_mnnz94,2021-04-10 05:42:46,2021-04-10
2321,gtzd33z,t3_mnnz94,"A regret capsule! Shit man, he should have kept the floor boards and YOLOd the 1000 bucks on Bitcoin rather than carpets!",t3_mnnz94,2021-04-10 06:20:09,2021-04-10
2322,gtzeewk,t3_mnnz94,This is really a unique idea,t3_mnnz94,2021-04-10 06:31:25,2021-04-10
2323,gtzig9o,t3_mnnz94,"Beauty is in the small things, bro. You nailed it here.",t3_mnnz94,2021-04-10 07:06:40,2021-04-10
2324,gtzunbq,t3_mnnz94,Makes me want to buy more Bitcoin,t3_mnnz94,2021-04-10 08:57:38,2021-04-10
2325,gu051x5,t3_mnnz94,you madlad,t3_mnnz94,2021-04-10 10:34:07,2021-04-10
2326,gu0kukd,t3_mnnz94,You should write down what the floor job cost is in bitcoin. So they know what they _actually_ paid for thr floor in twenty years.,t3_mnnz94,2021-04-10 13:28:20,2021-04-10
2327,gu0r0dr,t3_mnnz94,"Would be really cool idea to make wallets with a few 1000 satoshis on, and then write the private and secret keys under the floor boards xD",t3_mnnz94,2021-04-10 14:56:36,2021-04-10
2328,gu0u5ok,t3_mnnz94,That's a great idea and i love time capsules,t3_mnnz94,2021-04-10 15:46:57,2021-04-10
2330,gtyt91r,t3_mnnz94,This is amazing. I used to be an engineer in the navy. When I went on a new ship I would draw a comedy cock on the under side of random hatches. It’s not quite the same but I feel you.,t3_mnnz94,2021-04-10 03:40:27,2021-04-10
2331,gtyvs12,t3_mnnz94,That is awesome.  When I replace my own floors I’ll do the same!,t3_mnnz94,2021-04-10 03:59:57,2021-04-10
2332,gtyyx5t,t3_mnnz94,The regret they feel for not buying btc earlier will thus be mitigated by the overwhelming reddit karma they can receive via r/mildlyinteresting,t3_mnnz94,2021-04-10 04:24:25,2021-04-10
2333,gtz2ar8,t3_mnnz94,You should write that on that date you have 4 coins just to mess with them.,t3_mnnz94,2021-04-10 04:51:06,2021-04-10
2334,gtzg5a1,t3_mnnz94,I'm a potter. I'm gonna start signing my pieces with price of btc instead of the year.  Thanks for the inspiration!,t3_mnnz94,2021-04-10 06:46:22,2021-04-10
2335,gtznmwg,t3_mnnz94,"Only thing I ever found hidden during a reno was really old timey porn. 

Like newspaper style before the sexual revolution. 

Maybe one day people will say something similar.",t3_mnnz94,2021-04-10 07:53:43,2021-04-10
2336,gtzo28k,t3_mnnz94,"You rock, man. This is supercool.",t3_mnnz94,2021-04-10 07:57:39,2021-04-10
2337,gtzqfs2,t3_mnnz94,😂I’m a carpenter and I always write different shit so the next lad will see it sometime in the future.,t3_mnnz94,2021-04-10 08:19:21,2021-04-10
2338,gu080ul,t3_mnnz94,"maybe for each job, put $5 into a wallet, then write the seed phrase on the floor and forget about it.",t3_mnnz94,2021-04-10 11:02:58,2021-04-10
2339,gu08t7q,t3_mnnz94,How wholesome I love it.,t3_mnnz94,2021-04-10 11:10:46,2021-04-10
2340,gu0axa2,t3_mnnz94,Absolute mad lad.,t3_mnnz94,2021-04-10 11:32:00,2021-04-10
2341,gu0dhn7,t3_mnnz94,That's the coolest and weirdest thing I've read in this sub for a long time. Hit me up when BTC gets to $100k and I'll buy you something special.,t3_mnnz94,2021-04-10 11:59:48,2021-04-10
2342,gu0dq34,t3_mnnz94,"Make it more fun by writing your 12 word seed phrase lol jk but seriously, cool and simple bitcoin easter egg idea",t3_mnnz94,2021-04-10 12:02:24,2021-04-10
2343,gu0dyvm,t3_mnnz94,As a roofer I can relate. Well done!,t3_mnnz94,2021-04-10 12:05:06,2021-04-10
2344,gu0h4yo,t3_mnnz94,I'm a tattoo artist. Great idea. I'm gonna secretly tattoo the price of btc in a ring around my next clients anus.,t3_mnnz94,2021-04-10 12:41:13,2021-04-10
2345,gu0njut,t3_mnnz94,Such a great though.,t3_mnnz94,2021-04-10 14:05:24,2021-04-10
2346,gu0qk2j,t3_mnnz94,Writing this to be a part of history. Hopefully this will me as memorable as the pizza story.,t3_mnnz94,2021-04-10 14:49:37,2021-04-10
2347,gu0qpxe,t3_mnnz94,"I’m a property developer I think I’m going to start doing this, will leave a note under the floor or in a void!",t3_mnnz94,2021-04-10 14:52:03,2021-04-10
2348,gu0urvb,t3_mnnz94,"Well, now I am nervous some carpet/floor installer would write Satanic symbols in my house...",t3_mnnz94,2021-04-10 15:57:09,2021-04-10
2349,gu1460n,t3_mnnz94,"I wrote under our flooring when I was 7 to let everybody know I was going to marry Daniel Radcliffe, and I did my signature so it would be worth something after I’m famous. Unfortunately it was all a lie because I haven’t married Daniel Radcliffe and my signature is still worth nothing :(",t3_mnnz94,2021-04-10 18:38:06,2021-04-10
2350,gu199ui,t3_mnnz94,I'm just imagining a Reddit post in 10 years of some unsuspecting guy replacing his old flooring and discovering this hahaha. Love it.,t3_mnnz94,2021-04-10 19:54:57,2021-04-10
2351,gu1gew4,t3_mnnz94,"""This is the Way.""",t3_mnnz94,2021-04-10 21:18:51,2021-04-10
2352,gu1iuw8,t3_mnnz94,"I love this! 

If you were in SoCal, I’d hire you for a job I have coming up (and yeah, I’d pay you in BTC!)",t3_mnnz94,2021-04-10 21:43:38,2021-04-10
2355,gtzg6rj,t3_mnnz94,"2040-Family finds it, kid says “dad what’s Bitcoin, don’t they mean dogecoin the world currency?”",t3_mnnz94,2021-04-10 06:46:44,2021-04-10
2356,gtyp2v9,t3_mnnz94,When did people stop peeing on things to Mark territory?,t3_mnnz94,2021-04-10 03:08:31,2021-04-10
2357,gu02aal,t3_mnnz94,"**Guy in 20 years:** ""Ah yes, I remember that Bitcoin bubble. Crazy times.""",t3_mnnz94,2021-04-10 10:07:55,2021-04-10
2358,gtyuiyg,t3_mnnz94,Awesome,t3_mnnz94,2021-04-10 03:50:19,2021-04-10
2359,gtz1yzk,t3_mnnz94,I'm going to start doing this in the homes I remodel. Not under the flooring but in walls and behind cabinets and such.,t3_mnnz94,2021-04-10 04:48:30,2021-04-10
2360,gtz23b9,t3_mnnz94,I have found tons of old newspapers under old linoleum. Have you?,t3_mnnz94,2021-04-10 04:49:30,2021-04-10
2361,gtz3455,t3_mnnz94,Linoleum was so ridged they just let it float. The original floating floor lol,t3_mnnz94,2021-04-10 04:57:36,2021-04-10
2362,gtz3dc4,t3_mnnz94,"Wonderful!!! In the future, some will cry...😁",t3_mnnz94,2021-04-10 04:59:38,2021-04-10
2363,gtz5b3e,t3_mnnz94,My fella is living in 2099 🤯insane,t3_mnnz94,2021-04-10 05:15:27,2021-04-10
2364,gtz6u3i,t3_mnnz94,That’s where I store my private keys,t3_mnnz94,2021-04-10 05:27:55,2021-04-10
2365,gtz91n6,t3_mnnz94,Really cool. Have you ever seen any writing from the previous carpet layer?,t3_mnnz94,2021-04-10 05:46:07,2021-04-10
2366,gtz959h,t3_mnnz94,You should write the keys for a wallet holding 0.01 Bitcoin.,t3_mnnz94,2021-04-10 05:46:57,2021-04-10
2367,gtz96t2,t3_mnnz94,"The more you do the bigger the chance that a future  carpet fitter will replace more than one of your carpets, this would make a cool signature mark.",t3_mnnz94,2021-04-10 05:47:19,2021-04-10
2368,gtzbneg,t3_mnnz94,You should charge like $10 extra and put a private key to 10$ worth of bitcoin on a piece of paper underneath,t3_mnnz94,2021-04-10 06:07:52,2021-04-10
2369,gtzbnu9,t3_mnnz94,Thats awesome man cool idea,t3_mnnz94,2021-04-10 06:07:58,2021-04-10
2370,gtzcfqi,t3_mnnz94,[deleted],t3_mnnz94,2021-04-10 06:14:37,2021-04-10
2371,gtzcise,t3_mnnz94,"This is awesome, whenever I rip out a bathroom I always hope to find something like this, have found old newspapers and coke cans/cigarette packets but you have inspired me to do BTC time/price stamps now!",t3_mnnz94,2021-04-10 06:15:21,2021-04-10
2372,gtzg6bb,t3_mnnz94,"That is so much better than mine, I just draw dicks for the next contractor to see.",t3_mnnz94,2021-04-10 06:46:37,2021-04-10
2373,gtzjajw,t3_mnnz94,You win the internet today! 😂,t3_mnnz94,2021-04-10 07:14:17,2021-04-10
2374,gtzmg20,t3_mnnz94,What a great idea!,t3_mnnz94,2021-04-10 07:42:52,2021-04-10
2375,gtztxtu,t3_mnnz94,I write bitcoin 2021 in all of the AirBnB’s I stay at. Good work,t3_mnnz94,2021-04-10 08:51:13,2021-04-10
2376,gtzvaw7,t3_mnnz94,That's way cooler than the old Pepsi can we found in the bathroom wall.,t3_mnnz94,2021-04-10 09:03:37,2021-04-10
2377,gtzvilt,t3_mnnz94,"One trait of many bitcoiners, is we tend not to tell people too much about our interest in the currency because we are convinced we will one day be rich and don't want everyone to know that. I think that can account for why belief in bitcoins is seemingly so low amongst the rest of the population. Many of bitcoin advocates are just sat here talking to each other, instead of out talking to others about this amazing development in money called Bitcoin that could literally change the course of their life. We were able to talk about it freely, I think we would be much further along in the acceptance cycle. Oh well more time to stack sats.",t3_mnnz94,2021-04-10 09:05:32,2021-04-10
2378,gtzxzze,t3_mnnz94,Dope,t3_mnnz94,2021-04-10 09:28:19,2021-04-10
2379,gtzy5su,t3_mnnz94,People like you make the world a better place,t3_mnnz94,2021-04-10 09:29:47,2021-04-10
2380,gtzzh0h,t3_mnnz94,This is brilliant man,t3_mnnz94,2021-04-10 09:41:55,2021-04-10
2381,gtzzv7f,t3_mnnz94,"Not certain if better than ""Kilroy was here"".

:D",t3_mnnz94,2021-04-10 09:45:33,2021-04-10
2382,gu00nzp,t3_mnnz94,Love it!,t3_mnnz94,2021-04-10 09:52:59,2021-04-10
2383,gu00uos,t3_mnnz94,Mad lad,t3_mnnz94,2021-04-10 09:54:43,2021-04-10
2384,gu018eb,t3_mnnz94,That’s pretty cool. Bitifacts lol.,t3_mnnz94,2021-04-10 09:58:15,2021-04-10
2385,gu019jg,t3_mnnz94,"With your message, you should also write down the details for a wallet with a small amount of BTC. $10 worth or something.",t3_mnnz94,2021-04-10 09:58:33,2021-04-10
2386,gu01wvc,t3_mnnz94,"Dude, are you bitcoin god?",t3_mnnz94,2021-04-10 10:04:31,2021-04-10
2387,gu044fh,t3_mnnz94,Iam going to start doing this s on the underside of toilet tank lids.,t3_mnnz94,2021-04-10 10:25:10,2021-04-10
2388,gu056gn,t3_mnnz94,I love this.,t3_mnnz94,2021-04-10 10:35:19,2021-04-10
2389,gu07mfr,t3_mnnz94,Did you leave your initial on it?,t3_mnnz94,2021-04-10 10:58:57,2021-04-10
2390,gu08qyg,t3_mnnz94,That's just cruel. You have my upvote and respect.,t3_mnnz94,2021-04-10 11:10:09,2021-04-10
2391,gu0a2q1,t3_mnnz94,That’s awesome! Good on you sir.,t3_mnnz94,2021-04-10 11:23:20,2021-04-10
2392,gu0au5e,t3_mnnz94,"i love finding little things like this,  old newspapers or coins when doing some sort of work in a house. purpoosely put by  a person from years ago .",t3_mnnz94,2021-04-10 11:31:06,2021-04-10
2393,gu0cp38,t3_mnnz94,Might as well write an address too.,t3_mnnz94,2021-04-10 11:51:01,2021-04-10
2394,gu0h23e,t3_mnnz94,This is awesome I want incorporate something like this in my job I’m a finance guy for a car dealership any ideas?,t3_mnnz94,2021-04-10 12:40:16,2021-04-10
2395,gu0hmib,t3_mnnz94,Great idea. Seriously,t3_mnnz94,2021-04-10 12:47:11,2021-04-10
2396,gu0hms7,t3_mnnz94,I would be looking under the floor for the Bitcoin.,t3_mnnz94,2021-04-10 12:47:16,2021-04-10
2397,gu0htz6,t3_mnnz94,Great story.,t3_mnnz94,2021-04-10 12:49:45,2021-04-10
2398,gu0jiik,t3_mnnz94,Love this!,t3_mnnz94,2021-04-10 13:10:55,2021-04-10
2399,gu0kai4,t3_mnnz94,"Brilliant! I do vinyl decks, I've always wanted to write something worthwhile on the decks. This is it.",t3_mnnz94,2021-04-10 13:20:58,2021-04-10
2400,gu0l0ca,t3_mnnz94,Talk about flooring them when they rip the carpets,t3_mnnz94,2021-04-10 13:30:25,2021-04-10
2401,gu0l0hk,t3_mnnz94,I own a heating and air conditioning company. I am going to start doing this inside every furnaces we install. I will update every time we service them. Extremely excited to see the price at replacement. Thanks for the share!,t3_mnnz94,2021-04-10 13:30:28,2021-04-10
2402,gu0lm6z,t3_mnnz94,"Make an album of photos, mint as nfts, profit, buy pokemon cards.",t3_mnnz94,2021-04-10 13:38:29,2021-04-10
2403,gu0nhk8,t3_mnnz94,"Can we talk about how disgusting carpet is after 6 years, much less two decades?  Seriously, why? Nasty.",t3_mnnz94,2021-04-10 14:04:30,2021-04-10
2404,gu0nnky,t3_mnnz94,"If you like the client, you should write the key details to access a (current) $1.00 worth of sats. Never know, may make somebody rich one day...",t3_mnnz94,2021-04-10 14:06:49,2021-04-10
2405,gu0p9yo,t3_mnnz94,I hope it's gonna get up to $60k soon because it has always been on $58 -59 and then drop down again,t3_mnnz94,2021-04-10 14:30:12,2021-04-10
2406,gu0qmc5,t3_mnnz94,"Good sort of time capsule, maybe i should do the same after my next apt renovation. Or maybe my balance in ownr wallet...",t3_mnnz94,2021-04-10 14:50:33,2021-04-10
2407,gu13u4p,t3_mnnz94,tearing up all my carpets now looking for prices. thanks,t3_mnnz94,2021-04-10 18:32:45,2021-04-10
2408,gu1g2d9,t3_mnnz94,It’s like the surgeon who carved his initials on a patient’s liver during a keyhole procedure,t3_mnnz94,2021-04-10 21:15:07,2021-04-10
2409,gu1gt2j,t3_mnnz94,No mames,t3_mnnz94,2021-04-10 21:22:58,2021-04-10
2410,gu1gztc,t3_mnnz94,The FOMO is gonna be real upon tearing up those carpets.,t3_mnnz94,2021-04-10 21:24:53,2021-04-10
2416,gtzwrnv,t3_mnnz94,You're a dick for doing this. It's like a Christian idiot writing a prayer on others property,t3_mnnz94,2021-04-10 09:16:59,2021-04-10
2417,gtzx3vm,t3_mnnz94,"I don’t hate the move, but as a builder and realtor this doesn’t reflect great on you.",t3_mnnz94,2021-04-10 09:20:06,2021-04-10
2418,gtzvxef,t3_mnnz94,Deport him!,t3_mnnz94,2021-04-10 09:09:13,2021-04-10
2419,gu0aaa0,t3_mnnz94,U should do it for dogecoin as well,t3_mnnz94,2021-04-10 11:25:29,2021-04-10
2421,gtyxct0,t1_gtyt8ow,Did they print the price of Bit in the finance page?,t3_mnnz94,2021-04-10 04:12:16,2021-04-10
2422,gtyylzb,t1_gtyt8ow,I only seem to find old carpet blades 🤨,t3_mnnz94,2021-04-10 04:22:02,2021-04-10
2423,gu0rdp3,t1_gtyt8ow,"We had to replace the baseboard heaters when my cat peed all over them, and we found some old Uno cards. They looked like they were from the 80s. I would have kept them, but...cat pee.",t3_mnnz94,2021-04-10 15:02:17,2021-04-10
2424,gu02ho8,t1_gtynjht,If reddit hasn't become 100% for only fans and porn this is going to make some great posts in 15 years.,t3_mnnz94,2021-04-10 10:09:49,2021-04-10
2425,gu0perj,t1_gtynjht,"Until the people in the future start to believe OP hid BTC somewhere nearby and that was the valuation of it or amount in dollars.

They'd be tearing up the rest of the carpets and flooring looking for a private key.",t3_mnnz94,2021-04-10 14:32:13,2021-04-10
2426,gtzrm59,t1_gtynjht,"Excelen
t",t3_mnnz94,2021-04-10 08:29:56,2021-04-10
2427,gtz5yla,t1_gtz3q7u,Haha this is GOLD. Good way to ruin someone’s year.,t3_mnnz94,2021-04-10 05:20:44,2021-04-10
2428,gu02j2h,t1_gtz3q7u,That’s the evilest thing I’ve ever heard.,t3_mnnz94,2021-04-10 10:10:12,2021-04-10
2429,gu0kkzv,t1_gtz3q7u,Jail,t3_mnnz94,2021-04-10 13:24:48,2021-04-10
2430,gu0m5b5,t1_gtz3q7u,Ensure that the checksum is valid :-),t3_mnnz94,2021-04-10 13:45:44,2021-04-10
2431,gu0r9tw,t1_gtz3q7u,You're going to hell for that! Upvoted anyway for funny.,t3_mnnz94,2021-04-10 15:00:37,2021-04-10
2433,gtyy30l,t1_gtyxis7,"That’s so cool too! I’ve been wishing to come across a dated note, regardless of the content.",t3_mnnz94,2021-04-10 04:17:57,2021-04-10
2434,gu07qmv,t1_gtyxis7,Remember to leave your initial or name. 😂,t3_mnnz94,2021-04-10 11:00:07,2021-04-10
2435,gtzrvhl,t1_gtyo4c7,Marvelous,t3_mnnz94,2021-04-10 08:32:19,2021-04-10
2436,gu0r60y,t1_gtzctgo,"Yeah, this woild be much better,",t3_mnnz94,2021-04-10 14:59:00,2021-04-10
2437,gtyycel,t1_gtyvnk9,Good luck! Message me if you have any questions!,t3_mnnz94,2021-04-10 04:19:59,2021-04-10
2438,gtz1zsx,t1_gtyzi1c,OP should put a 'negligible' amount on a seed under the carpet along with the price.,t3_mnnz94,2021-04-10 04:48:42,2021-04-10
2439,gtzmgab,t1_gtze91j,"Love this idea! Absolutely ... instead of the obscure , profane drawings that mean nothing. I even find myself carving Bitcoin on to the porta potty walls.",t3_mnnz94,2021-04-10 07:42:55,2021-04-10
2440,gtzof9q,t1_gtze91j,now one of you create a treasure map that must be pieced together from your build sites,t3_mnnz94,2021-04-10 08:01:01,2021-04-10
2441,gtzmk3p,t1_gtzef2d,They’ll find that sometime after the last bitcoin is mined. Or in the demolition yard,t3_mnnz94,2021-04-10 07:43:53,2021-04-10
2442,gtzmkoz,t1_gtzef2d,They’ll find that sometime after the last bitcoin is mined. Or in the demolition yard,t3_mnnz94,2021-04-10 07:44:04,2021-04-10
2443,gtys034,t1_gtyrmev,They’ll probably wonder if I’m still installing carpet.,t3_mnnz94,2021-04-10 03:30:57,2021-04-10
2444,gtzn2h8,t1_gtzl4dx,Why not ?,t3_mnnz94,2021-04-10 07:48:35,2021-04-10
2445,gtz61wp,t1_gtz3u60,Probably the latter ! Don’t wanna set myself up for breaking and entering charges.,t3_mnnz94,2021-04-10 05:21:31,2021-04-10
2446,gtzki1q,t1_gtz8k3w,Love your comment. I agree! About time for something different and positive. Also Love this bitcoin community. Been following for a long time.,t3_mnnz94,2021-04-10 07:25:13,2021-04-10
2447,gtz12hi,t1_gtz0l4c,"Agree. Makes me happy, keeps me in shape, and  keeps me honest.",t3_mnnz94,2021-04-10 04:41:20,2021-04-10
2448,gu14wyg,t1_gu0pyzc,"Haha, that‘s a really cool idea. I would be hyped if I found that.",t3_mnnz94,2021-04-10 18:50:30,2021-04-10
2449,gtyy6si,t1_gtywcww,That’s my “only” excuse 😉,t3_mnnz94,2021-04-10 04:18:46,2021-04-10
2450,gu074e0,t1_gu051x5,Krikey m8 !,t3_mnnz94,2021-04-10 10:54:06,2021-04-10
2451,gtyui8a,t1_gtyt91r,The cock-a-doodler strikes again!,t3_mnnz94,2021-04-10 03:50:11,2021-04-10
