,comment_id,comment_parent_id,comment_body,comment_link_id,created,date
613,grgvmt8,t1_grguo64,"Already on it, definitely the best I've found so far",t3_m89qlp,2021-03-19 19:20:54,2021-03-19
617,grgo0c1,t1_grgnmn0,It is in the US. Might be different depending on your laws.,t3_m89qlp,2021-03-19 17:19:57,2021-03-19
620,grhdqbw,t1_grhdaq5,"hey it’s your $

dca for the win",t3_m89qlp,2021-03-19 22:22:01,2021-03-19
623,grgiigb,t1_grghkd7,Sounds exactly like the dotcom bubble.,t3_m89qlp,2021-03-19 15:45:47,2021-03-19
624,grhg89a,t1_grhc847,Especially since I was 17 and ad sales on that website was my only income at the time.,t3_m89qlp,2021-03-19 22:42:08,2021-03-19
626,grgnrwl,t1_grgmr4i,"ISO is superior, 2021-04-20",t3_m89qlp,2021-03-19 17:15:51,2021-03-19
627,grgibkf,t1_grgfo0p,"they're both idiots that never get laid, we all are on reddit....right guys? Guys? hey where ya going?",t3_m89qlp,2021-03-19 15:42:43,2021-03-19
628,grgfglz,t1_grgcuii,bitcoin back,t3_m89qlp,2021-03-19 14:58:20,2021-03-19
635,grgaeev,t1_grgachg,Ahh! Say less fam,t3_m89qlp,2021-03-19 13:45:05,2021-03-19
638,grgt94e,t1_grgqch9,Blockstream's Liquid seems to be doing OK. And we have NFTs on Bitcoin almost at the protocol level - Counterparty XCP,t3_m89qlp,2021-03-19 18:47:14,2021-03-19
639,grgo17e,t1_grgnvvw,Awesome. Hold at least two or three halvings and you'll be in the green.,t3_m89qlp,2021-03-19 17:20:22,2021-03-19
640,grhhsws,t1_grhgrya,"I've spent a lot of time looking at alts. None of them are as sure a thing as BTC. They are all claiming to have these awesome use cases and features, but there's no reason BTC won't be able to achieve most of those things in the future, on a rock solid foundation rather than on tech that hasn't had to withstand the thoroughput and attacks that BTC has. The only alt I hold a decent position in is ALGO, because they seem to really have their shit together and are trying to achieve almost the opposite of what BTC is, by being very regulation friendly",t3_m89qlp,2021-03-19 22:54:33,2021-03-19
642,grgm4ar,t1_grgg7y1,It fckn sucks.,t3_m89qlp,2021-03-19 16:46:39,2021-03-19
645,grgsmz4,t1_grgrupd,Also try giving gold to someone in a different country quickly and let me know how it goes.,t3_m89qlp,2021-03-19 18:37:44,2021-03-19
646,grgtbqu,t1_grgrupd,"Salability, divisibility, portability and its more scarce (flow reduces over time).",t3_m89qlp,2021-03-19 18:48:19,2021-03-19
647,grgsewb,t1_grgrupd,"Bitcoin is limited ... gold is not really limited.  Maybe there is a lot of gold on earth, but no one has found it yet",t3_m89qlp,2021-03-19 18:34:09,2021-03-19
650,grgu7gr,t1_grglib7,"Presearch (decentralized, earns crypto while searching)",t3_m89qlp,2021-03-19 19:01:10,2021-03-19
656,grgoayi,t1_grgo17e,Thank you for helping 😊,t3_m89qlp,2021-03-19 17:25:07,2021-03-19
657,grhibj1,t1_grhhsws,Awesome thanks for the insight something to keep an eye on for sure ! Funny enough I also have very small position in Algo and some in Tezos. But idk really know what I am doing honestly very new to this even more the alts. But threw some in HaHa's,t3_m89qlp,2021-03-19 22:58:35,2021-03-19
658,grgtbhf,t1_grgsmz4,"Or even doing an international bank transfer. Costs me £20 just for the privilege and it takes a week. It's manual and I have had my bank send money to the wrong person before.

Bitcoin costs barely anything to transfer millions of $ worth anywhere in the world, no third party who can f it up either!",t3_m89qlp,2021-03-19 18:48:13,2021-03-19
659,grgsx1x,t1_grgsewb,"We will be bringing back huge amounts of resources, including gold, from asteroids sometime in the next few decades.",t3_m89qlp,2021-03-19 18:42:06,2021-03-19
666,grgvnsq,t1_grgtbhf,"There are other means of international bank transfer, I have used one to pay others in different countries and in different currencies. It cost me £50 per year to do unlimited transactions and conversions, for me that is fine as I do a fair amount you can pay nothing for a limited number and value per month. But yeah bitcoin is one option.",t3_m89qlp,2021-03-19 19:21:15,2021-03-19
667,grgteg1,t1_grgsx1x,"If that happens, the price of gold will crash.",t3_m89qlp,2021-03-19 18:49:26,2021-03-19
671,grgu2tb,t1_grgteg1,"You should look into it, Elon wants to mine an asteroid like this that already exists",t3_m89qlp,2021-03-19 18:59:22,2021-03-19
672,grgu97j,t1_grgu2tb,"If the market gets flooded with gold, gold will lose its value. So why mine it then in the first place?",t3_m89qlp,2021-03-19 19:01:51,2021-03-19
1058,grhehas,t3_m8f13v,[removed],t3_m8f13v,2021-03-19 22:28:04,2021-03-19
1059,grh1nhs,t3_m8f13v,In 2015 this would have been top post for 6 months lmao,t3_m8f13v,2021-03-19 20:32:11,2021-03-19
1060,grh1srx,t3_m8f13v,Bitcoin to Visa. Fiat to merchant. That's how Visa (and others) will be collecting Bitcoin from the open market.,t3_m8f13v,2021-03-19 20:33:42,2021-03-19
1061,grgwucf,t3_m8f13v,"This is huge news.

Right?  Or am I missing something?",t3_m8f13v,2021-03-19 19:36:31,2021-03-19
1062,grh1itt,t3_m8f13v,"Why purchase anything using BTC though, when you could use something dropping in value, like USD?",t3_m8f13v,2021-03-19 20:30:47,2021-03-19
1063,grha2ds,t3_m8f13v,"Yay, I get to pay capital gains every time I order a coffee!",t3_m8f13v,2021-03-19 21:51:29,2021-03-19
1066,grh0xhv,t3_m8f13v,So you can deposit your btc and pay at merchants using that?,t3_m8f13v,2021-03-19 20:24:22,2021-03-19
1068,grh69pz,t3_m8f13v,"Another, ""Pretend you own Bitcoins"" deal - same ""scam"" as robinhood and paypal.  

Fuck this shit.  Fuck them.",t3_m8f13v,2021-03-19 21:17:51,2021-03-19
1078,grgxym4,t1_grgwucf,100% - considering that Bitcoin could be accepted at the 70 million merchant companies worldwide which support Visa’s payment cards. I say it’s huge!,t3_m8f13v,2021-03-19 19:50:16,2021-03-19
1081,grh1y4j,t1_grh1itt,"I’ll give you a decent reason. 

We’re getting scary close to where it makes way more sense to keep all of your savings in Bitcoin. Bitcoin can get 6-8% interest rate in a “savings account.” 

If you can spend Bitcoin anywhere, why not keep all your savings in Bitcoin earning that interest?",t3_m8f13v,2021-03-19 20:35:14,2021-03-19
1087,grh1jqk,t1_grh0xhv,Yes,t3_m8f13v,2021-03-19 20:31:05,2021-03-19
1094,grgylis,t1_grgxym4,"Yeah, I'm surprised we haven't seen a surge yet - btc usually reacts pretty quickly to news like this.",t3_m8f13v,2021-03-19 19:57:52,2021-03-19
1097,grhgxgl,t1_grh1y4j,">Bitcoin can get 6-8% interest rate in a “savings account.” 

And how does it do that?",t3_m8f13v,2021-03-19 22:47:42,2021-03-19
1099,grh460m,t1_grh1y4j,"Yep, if we can avoid holding fiat we should",t3_m8f13v,2021-03-19 20:57:42,2021-03-19
1103,grh4tpm,t1_grgylis,What other news like this have you seen?,t3_m8f13v,2021-03-19 21:04:09,2021-03-19
1107,grhhq3n,t1_grhgxgl,"Hold your bitcoin on the Binance exchange. They pay you ~6-8%.

Edit: I think there is more to it. I know enough to be dangerous.

Edit 2: It’s not Binance I was thinking, it’s BlockFi.",t3_m8f13v,2021-03-19 22:53:56,2021-03-19
1112,grha1ld,t1_grh4tpm,"Here's an article that goes over some recent announcements re btc (you can compare the dates of the news with the chart movements):

https://www.msn.com/en-us/money/markets/a-new-wave-of-institutional-interest-has-boosted-bitcoin-here-are-the-key-players-getting-involved-from-jpmorgan-to-paypal/ar-BB1ezqxB",t3_m8f13v,2021-03-19 21:51:18,2021-03-19
1251,grgexg5,t3_m8aitj,He just wants friends!!😭😭😭,t3_m8aitj,2021-03-19 14:50:20,2021-03-19
1252,grgex6h,t3_m8aitj,I just feel sorry for that duckling. Those other ducks are racist.,t3_m8aitj,2021-03-19 14:50:14,2021-03-19
1253,grgb7qk,t3_m8aitj,That duckling was a border collie in it’s past life,t3_m8aitj,2021-03-19 13:56:21,2021-03-19
1254,grglgxw,t3_m8aitj,When you accidentally cough in a public space and try to talk to people.,t3_m8aitj,2021-03-19 16:35:23,2021-03-19
1255,grgzqg2,t3_m8aitj,"Hey, where’d you get this video of me when I was 18 at a bar full of women trying to talk to one of them?",t3_m8aitj,2021-03-19 20:11:10,2021-03-19
1256,grgvnjf,t3_m8aitj,Are you my dad? Are you my dad?,t3_m8aitj,2021-03-19 19:21:10,2021-03-19
1257,grgpp34,t3_m8aitj,All jokes apart. This is what racism actually feels like. (How the duck feels right now),t3_m8aitj,2021-03-19 17:49:23,2021-03-19
1258,grgy2ky,t3_m8aitj,[BTC 5 years later.](https://www.youtube.com/watch?v=BTy629JL49s),t3_m8aitj,2021-03-19 19:51:37,2021-03-19
1259,grh124j,t3_m8aitj,So you’re telling me this is the inverse of the black swan event - A white duck event ?,t3_m8aitj,2021-03-19 20:25:48,2021-03-19
1260,grgo59x,t3_m8aitj,:(,t3_m8aitj,2021-03-19 17:22:21,2021-03-19
1261,grh0z6w,t3_m8aitj,It's damn too funny. I'm sure bitcoin will continue be dreaded for years to come,t3_m8aitj,2021-03-19 20:24:54,2021-03-19
1262,grh2a1h,t3_m8aitj,"Parents: Why the fuck are you crying so loud?

Me: \*shows video\*",t3_m8aitj,2021-03-19 20:38:40,2021-03-19
1264,grgko7u,t3_m8aitj,That moment when you try and explain to boomers that GameStop is a value play.,t3_m8aitj,2021-03-19 16:21:35,2021-03-19
1265,grgqs93,t3_m8aitj,Is it duckcoin?? 🦆,t3_m8aitj,2021-03-19 18:07:50,2021-03-19
1266,grh03zf,t3_m8aitj,Girls when me:,t3_m8aitj,2021-03-19 20:15:27,2021-03-19
1267,grh0kmb,t3_m8aitj,Duck duck go in real life,t3_m8aitj,2021-03-19 20:20:28,2021-03-19
1268,grh6fs9,t3_m8aitj,Where did you get this footage of me in primary school?,t3_m8aitj,2021-03-19 21:19:25,2021-03-19
1269,grh6lo4,t3_m8aitj,hahahahaha Made my day lol Boxing ball FIAT,t3_m8aitj,2021-03-19 21:20:57,2021-03-19
1282,grgfzl9,t1_grgexg5,yeah may be 😭😭😭,t3_m8aitj,2021-03-19 15:06:17,2021-03-19
1283,grggz8p,t1_grgexg5,"Don’t think so, you don’t run on people like that if you want to be friends with them..",t3_m8aitj,2021-03-19 15:21:38,2021-03-19
1284,grgm1xo,t1_grgex6h,"Agreed, they should get their Duckfacebook account canceled and be deplatformed.",t3_m8aitj,2021-03-19 16:45:31,2021-03-19
1285,grgpoa5,t1_grgex6h,"THEY CAN'T BE RACIST CUZ THEY ARE BLACK!

Obviously the blonde one is a fascist QQK duckling abusing the poor black ones!",t3_m8aitj,2021-03-19 17:49:00,2021-03-19
1286,grgwfq8,t1_grgex6h,That's my trying to blend in at an international high school. Man those years were tough.,t3_m8aitj,2021-03-19 19:31:15,2021-03-19
1287,grgm39k,t1_grgex6h,But no one will be sorry for bitcoin once it come into mainstream!! ;),t3_m8aitj,2021-03-19 16:46:08,2021-03-19
1288,grgogl1,t1_grgex6h,Who said anti-white racism doesn't exit ?,t3_m8aitj,2021-03-19 17:27:50,2021-03-19
1289,grgm1yk,t1_grgb7qk,And the bitcoin is defi collie in this generation !! :),t3_m8aitj,2021-03-19 16:45:32,2021-03-19
1290,grgm8gm,t1_grglgxw,hahahaha... bitcoin has been coughing since a decade and still people are having it without mask !! lol :),t3_m8aitj,2021-03-19 16:48:41,2021-03-19
1291,grh0how,t1_grgzqg2,We found it wholesome with bitcoin and this situation super common :)),t3_m8aitj,2021-03-19 20:19:36,2021-03-19
1292,grgz4xv,t1_grgvnjf,hahahaha ... lol :),t3_m8aitj,2021-03-19 20:04:16,2021-03-19
1293,grh7ybw,t1_grgy2ky,...I've gotta get me some of those noodles holy shit lol,t3_m8aitj,2021-03-19 21:33:17,2021-03-19
1294,grgm6qj,t1_grgko7u,haha.. every government is explaining its people about bitcoin but who knows whats in the box.. bitcoin is the future,t3_m8aitj,2021-03-19 16:47:51,2021-03-19
1296,grgh34m,t1_grggz8p,People on here gotta argue everything😂🤨. U don’t slow down when u get close if u want to fight. Or fight someone who’s got a lot more friends and twice your size,t3_m8aitj,2021-03-19 15:23:21,2021-03-19
1297,grh4o0k,t1_grggz8p,"Yes you do. 




Turn around.",t3_m8aitj,2021-03-19 21:02:37,2021-03-19
1298,grgxgsz,t1_grgm1xo,Hahaha thanks for the laugh,t3_m8aitj,2021-03-19 19:44:20,2021-03-19
1299,grh2xwo,t1_grgm1xo,This is a great comment.,t3_m8aitj,2021-03-19 20:45:24,2021-03-19
1300,grh4lxt,t1_grgpoa5,Qu Qlucks Klan?,t3_m8aitj,2021-03-19 21:02:03,2021-03-19
1303,grgxhkc,t1_grgogl1,Liberals,t3_m8aitj,2021-03-19 19:44:35,2021-03-19
1304,grgyux3,t1_grgogl1,Everyone to the left of Biden,t3_m8aitj,2021-03-19 20:00:57,2021-03-19
1306,grgm53x,t1_grgh34m,"Bitcoin has the same going, as everyone is fighting when it arrives :))",t3_m8aitj,2021-03-19 16:47:03,2021-03-19
1307,grgok2s,t1_grgh34m,I used to do both. All the duckling needs is a glock :^),t3_m8aitj,2021-03-19 17:29:32,2021-03-19
1308,grh4qlt,t1_grh4lxt,Quack Quacks Klan :D,t3_m8aitj,2021-03-19 21:03:19,2021-03-19
1310,grh5213,t1_grh4qlt,"Ahhh, I see! The yellow one is a Supreme Grand Quacksmaster (or honestly whatever nonsense the Klan calls themselves lmao)",t3_m8aitj,2021-03-19 21:06:23,2021-03-19
1311,grh584w,t1_grh5213,Now that you mention it Quacks Clan isn't farr off that the real clan did so it's actually a passable derogatory name :D,t3_m8aitj,2021-03-19 21:08:02,2021-03-19
1340,grgqbrm,t3_m8drym,"Fellow Swede here. 
You can use the app Exodus to buy bitcoin with a Apple Pay transaction. Also no kyc/registration of personal information. But the fees are high. 

You can also use a Klarna card (digital) to buy on kraken or something else. 

Or, use Safello.se with swish. 

Good luck :)",t3_m8drym,2021-03-19 18:00:07,2021-03-19
1341,grgs95m,t3_m8drym,Close the accounts as a matter of principle,t3_m8drym,2021-03-19 18:31:41,2021-03-19
1342,grgxq3r,t3_m8drym,"The best part about this is the banks are just sealing their own fate by proving why BTC was invented in the first place. 

The irony is delicious.",t3_m8drym,2021-03-19 19:47:26,2021-03-19
1343,grgvdd4,t3_m8drym,"This is definitely an ongoing issue here in Sweden, Nordea does not have problems with it.
I think SEB is the same, a quick google will tell.
It’s insanity, and it might get worse before it gets better. Luckily in my case I’m engaged to a woman in Liechtenstein that is a banker, and the first time I asked her if they where ok with crypto there she said: Of course we are, we are investing in it ourselves.",t3_m8drym,2021-03-19 19:17:31,2021-03-19
1344,grgvh1u,t3_m8drym,"Hey, im also a swede. Check out my post from a few days ago, i go over how to use revolut as a middleman at no extra cost.

Swedbank kan dra åt helvete

https://www.reddit.com/r/Bitcoin/comments/m73q06/is_your_bank_not_allowing_you_to_buy_bitcoin/?utm_medium=android_app&utm_source=share",t3_m8drym,2021-03-19 19:18:49,2021-03-19
1345,grgqgps,t3_m8drym,"As an EU citizen, are you allowed to open a bank account in another EU country?",t3_m8drym,2021-03-19 18:02:29,2021-03-19
1346,grgsl61,t3_m8drym,Get yourself an N26 account in 5 minutes and use that,t3_m8drym,2021-03-19 18:36:57,2021-03-19
1347,grgpt8p,t3_m8drym,"Also from Sweden, got kicked out of two different banks. It is insane, I don’t know what to do",t3_m8drym,2021-03-19 17:51:21,2021-03-19
1348,grgql6s,t3_m8drym,"My brain automatically read ""Lansforsacringe"", then realized it was not read correctly. Then read the rest of the text and realized it was still cringe what these banks are doing.

So I will just go with my brain's first impressions.",t3_m8drym,2021-03-19 18:04:33,2021-03-19
1349,grgv1mx,t3_m8drym,Bisq,t3_m8drym,2021-03-19 19:13:10,2021-03-19
1350,grh38vq,t3_m8drym,Withdraw everything and get rid of this shit bank,t3_m8drym,2021-03-19 20:48:31,2021-03-19
1351,grgpyd3,t3_m8drym,All banks will get just like this. They’re desperate,t3_m8drym,2021-03-19 17:53:43,2021-03-19
1352,grgrel5,t3_m8drym,SEB working fine buying on CDC and binance so far.,t3_m8drym,2021-03-19 18:18:04,2021-03-19
1353,grgr64u,t3_m8drym,"Swede here aswell, I know the banks are very troublesome here, no denying that. But never, never EVER, say that is your purpous when you want to open international payments. They will deny you 100% of the times.

You are better of saying you will send some money to a friend who moved to England a few weeks back, and that it will be a reoccuring event so leave it open. And what is to say that is not true, you just might wanna do that before you then buy some crypto.
Or maybe you have another legit reason to open internationall payment, and to be able to buy bitcoin would just be a bonus.

The banks will come around eventally but until then never mention crypto of any kind.",t3_m8drym,2021-03-19 18:14:13,2021-03-19
1354,grgvm1g,t3_m8drym,"Ok, it's the 2nd time I see this kind of posts from Swedes and you guys need to be a bit more proactive. There's dozens of alternatives to legacy old banks.

There's a wave of online banking happening which don't have these kinds of restrictions and even help you get Crypto.

From the top of my head you have:

- Revolut
- N26
- Curve
- Monzo

And there's plenty of others but these are without a doubt the fastest adopted ones. From there send a SEPA transfer to your exchange and voilà. Easy Peasy.

No need for more drama like ""OMG banks are trying to kills us"" kind of vibe.",t3_m8drym,2021-03-19 19:20:38,2021-03-19
1355,grgxmke,t3_m8drym,having the same problem right now with ICA Banken,t3_m8drym,2021-03-19 19:46:17,2021-03-19
1356,grh0s4q,t3_m8drym,That's freaking ridiculous. Its  your money. You should be able to spend it on cocaine and hookers if you want.,t3_m8drym,2021-03-19 20:22:45,2021-03-19
1357,grgqz7w,t3_m8drym,I have Swedbank and I've never had a problem with buying with my debit card. On what website are you trying to purchase?,t3_m8drym,2021-03-19 18:11:03,2021-03-19
1358,grgs5b0,t3_m8drym,https://moonbanking.com,t3_m8drym,2021-03-19 18:29:57,2021-03-19
1359,grgt50x,t3_m8drym,Try revolut banking app together with gemini exchange,t3_m8drym,2021-03-19 18:45:32,2021-03-19
1360,grgtfny,t3_m8drym,"Since last summer I has been able to do transfers to my Bitstamp account from my Swedbank account. Sure they blocked me for one year if not even more until Bitstamp changed their IBAN, but that just caused me to change to Coinbase or BTCX and buy the Bitcoin slightly more expensive.

Last transfer I did was 10 days ago.",t3_m8drym,2021-03-19 18:49:56,2021-03-19
1361,grgu0gd,t3_m8drym,I use Safello.se with Swish thru Handelsbanken and have had no problems...yet.,t3_m8drym,2021-03-19 18:58:27,2021-03-19
1362,grgwfmf,t3_m8drym,Can you get N26 or revolut in Sweden? Use that as a middle-man,t3_m8drym,2021-03-19 19:31:12,2021-03-19
1363,grgzywe,t3_m8drym,Works with Nordea buying BTC with SEPA over Binance or Kraken,t3_m8drym,2021-03-19 20:13:48,2021-03-19
1364,grh3pc0,t3_m8drym,"swede here, never had problems with swedbank",t3_m8drym,2021-03-19 20:53:04,2021-03-19
1365,grh6vnk,t3_m8drym,"Bank <-> Revolut <-> Exchange

Or Bitwala, which is a real crypto friendly bank in Germany.

Or use Safello, 7% fee though :/",t3_m8drym,2021-03-19 21:23:32,2021-03-19
1370,grgtwdn,t3_m8drym,"Bitcoin is bad, they still think that argument works?

Are Swedish this stupid or those banks? 🤪",t3_m8drym,2021-03-19 18:56:46,2021-03-19
1371,grh5opq,t3_m8drym,"This is why leftist governments are fighting the cash.

Imagine world where you can't go into a bank and take all out as good old paper, and then spend how ever you wish, e.g. in face to face OTC trade for Bitcoins.

How close is Sweeden now to this vision anyway?",t3_m8drym,2021-03-19 21:12:22,2021-03-19
1372,grhf0cd,t3_m8drym,hodlhold or bisque,t3_m8drym,2021-03-19 22:32:22,2021-03-19
1374,grgr7ez,t3_m8drym,Try using Curve to proxy your card,t3_m8drym,2021-03-19 18:14:48,2021-03-19
1375,grgw0e4,t3_m8drym,Use a prepaid card like Revolut to get around it. Only way I found at this point. I've also yelled at them a lot but yeah fuck banks.,t3_m8drym,2021-03-19 19:25:47,2021-03-19
1376,grgw6x1,t3_m8drym,Customer of Swedbank and have been buying and selling cryptos since 15' without any issues.,t3_m8drym,2021-03-19 19:28:06,2021-03-19
1377,grgwgr5,t3_m8drym,"Handelsbanken, in Denmark at least, only stopped my first transfer to Binance and after I called them they apologized and said that if was sure I knew what I was doing then they would remove the block from my account.  


But as others have already mentioned, unless you need an old school bank account, there's plenty of other options out there. Personally I am done with Fiat and my salary comes into the bank and is SEPA transferred right into Crypto.",t3_m8drym,2021-03-19 19:31:37,2021-03-19
1378,grgzn5m,t3_m8drym,"Pretty much the same in Norway. Crypto trading is not illegal, but the banks hate it! I've heard about people getting kicked out of banks because the bank realized that they were buying BTC.   
When I'm buying/selling BTC a never write Bitcoin/BTC in the transaction, just in case the bank one day decides to take a look at my transactions.",t3_m8drym,2021-03-19 20:10:08,2021-03-19
1379,grgzubh,t3_m8drym,"Just open a Revolut account, that’s what I did in Czech rep",t3_m8drym,2021-03-19 20:12:24,2021-03-19
1380,grh08vx,t3_m8drym,"I used Swedbank account couple of months ago (as I use it to store my savings) and was able to transfer money to an exchange without any problems. Haven’t tried now, maybe it is banned. I’m from Estonia.",t3_m8drym,2021-03-19 20:16:55,2021-03-19
1381,grh1eb2,t3_m8drym,"Fellow Swede here. I have had no problem with Nordea trough Coinbase at least. Took out some money a few days ago had the money on my bank account in a day. Buying a apartment so needed the money unfortunately. Will keep investing though!
Hope you find a solution.",t3_m8drym,2021-03-19 20:29:27,2021-03-19
1382,grh1nfg,t3_m8drym,I got a N26 bank account in less than 5 minutes. It is so easy if your in the EU and you also get a free mastercard and no fees.,t3_m8drym,2021-03-19 20:32:10,2021-03-19
1383,grh2pqk,t3_m8drym,Yeah my friend had problem buying too. But SEB is working for buying and selling. Also worth mentioning im using Bitstamp.,t3_m8drym,2021-03-19 20:43:08,2021-03-19
1384,grh32ta,t3_m8drym,Which exchange are you trying to use? Kraken is good for europeans afaik maybe bitstamp is even better. And as a rule of thumb use wire transfers. SEPA if you can.,t3_m8drym,2021-03-19 20:46:48,2021-03-19
1385,grh74rx,t3_m8drym,"Get Revolut. Transfer money to them, then onto whichever exhange you want to use. Revolut has high fees for buying crypto and youcan’t transfer coins to somewhere else. So I wouldn’t buy BTC in their app.",t3_m8drym,2021-03-19 21:25:52,2021-03-19
1386,grh7s4x,t3_m8drym,You can use also this app [https://coins.coinpaprika.com/](https://coins.coinpaprika.com/),t3_m8drym,2021-03-19 21:31:43,2021-03-19
1387,grh9zjw,t3_m8drym,"Or use Bisq.network, it's a peer to peer exchange where you send/receive payments directly to/from other people. Can't block that!",t3_m8drym,2021-03-19 21:50:50,2021-03-19
1388,grha0iz,t3_m8drym,"Another fellow Swede here. Wow, what a great thread. And timely! About a month ago I started getting lots of failed purchase to CB and Binance from Swedbank via card payments. This randomly started happening. I'd attempt to make the purchase and it would work 50% of the time, or even less.

Rang Shitbank. First customer ""service"" rep basically said: ""Ohhhhhhh, crypto is dangerous. You'll loose your money."" To which I asked if this was an official stance by Shitbank or his personal opinion. Didnt really get a definitive answer.

Rang Shitbank again. Got a much better rep. He said that Shitbank wouldnt block transactions. However, he confirmed that they advise people not to buy crypto because you loose money.

He suggested that I call back and talk to tech support to do a deep dive on my account. I didnt. This felt really intrusive. Instead Ive been looking for a better work around. Great to find this thread.

Safello is well-known, but shares details with Skatteverket, so you can probably expect a bill using their service. 

Downloaded Revolut, too, but not used it yet.

Anyway, I just wanted to share my experience since we're not alone.",t3_m8drym,2021-03-19 21:51:03,2021-03-19
1389,grhai30,t3_m8drym,"Seeing the boomers and elite trying to stop bitcoin makes me laugh.. Reminds me of someone trying to remove a picture from the internet, just cant be done.",t3_m8drym,2021-03-19 21:55:06,2021-03-19
1390,grhb0la,t3_m8drym,Get Revolut. That’s what I’ve done. They have the cryptos however have not yet implemented sending and receiving crypto as of yet. But it will come soon. Just a suggestion,t3_m8drym,2021-03-19 21:59:23,2021-03-19
1391,grhb5cv,t3_m8drym,Use Binance !!,t3_m8drym,2021-03-19 22:00:29,2021-03-19
1392,grhefau,t3_m8drym,"If you can, open an account with Fidor Bank. German and partner with Kraken. Then you can send money between your own accounts (sweden to fidor) and iirc fidor does instant EUR deposits to Kraken",t3_m8drym,2021-03-19 22:27:37,2021-03-19
1393,grhgop8,t3_m8drym,"I know it's scammy, but if you want to wire me money I can buy some BTC and send it to you.

I have a (very small) online reputation to uphold. PM if you're crazy enough to accept my help.",t3_m8drym,2021-03-19 22:45:46,2021-03-19
1414,grgvg34,t3_m8drym,"Just open a binance account or kraken, bf, whatever you got a million choices, after that buy a ledger nano and transfer them to your cold wallet, after that you wait it’s not that hard.",t3_m8drym,2021-03-19 19:18:28,2021-03-19
1415,grh41au,t3_m8drym,Report them to the financial department.,t3_m8drym,2021-03-19 20:56:23,2021-03-19
1416,grh59qb,t3_m8drym,"""Basically it means I'm getting denied to use my money""

Seems like an over simplification of the situation.

Where are you trying to send money? Random people's accounts (very easy to justify as protecting you from fraud)? Or some big exchange?",t3_m8drym,2021-03-19 21:08:27,2021-03-19
