,comment_id,comment_parent_id,comment_body,comment_link_id,created,date
1979,gnr603b,t1_gnqmq0s,People who says sale Bitcoin who expecting to buy in cheap price even if it goes down to one box I will hold it,t3_llkh1v,2021-02-17 19:21:10,2021-02-17
1980,gnqywi7,t1_gnqmq0s,"Didn't sell. But why the hell didn't I notice how much the price went down over those years? At least I still bought regular (very little) bits 🤷‍♂️

Naja my holdings are still pretty respectable",t3_llkh1v,2021-02-17 17:23:10,2021-02-17
1984,gnrncsb,t1_gnqmq0s,💎,t3_llkh1v,2021-02-17 22:37:27,2021-02-17
1985,gnr7iil,t1_gnqmq0s,I'm in this and I like it!,t3_llkh1v,2021-02-17 19:43:54,2021-02-17
1986,gnqu7ij,t1_gnqmq0s,rough times.,t3_llkh1v,2021-02-17 16:07:23,2021-02-17
1987,gnqjl0s,t1_gnqe0wz,"Dude, youre already there. Peoples eyes were popping when bitcoin was worth $2700 in 2017. Keep holding forever, this is your ticket to not being poor when hyperinflation starts.",t3_llkh1v,2021-02-17 13:54:47,2021-02-17
1988,gnqvznc,t1_gnqe0wz,One year ago an entire bitcoin had the same value as your 0.1 bitcoin has now.,t3_llkh1v,2021-02-17 16:35:01,2021-02-17
1989,gnqwq8b,t1_gnqe0wz,Yup. Even if we get to $60k I will only profit a few grand since I got in so late. But I am going with the buy high sell never school of investing here. Don't quite this when I'm rocking in the corner in a fetal position when it crashes tho...,t3_llkh1v,2021-02-17 16:47:15,2021-02-17
1991,gnqig16,t1_gnqbw3e,"Back at the old 20k, 30k ATH it was these damn videos that hyped me up enough to put a few more thousand in to BTC which I thought was crazy to be buying the top like this.... I am glad they did. Onward and upward, motherfuckers. Congrats to everyone holding.",t3_llkh1v,2021-02-17 13:42:38,2021-02-17
1992,gnqd7ih,t1_gnqbw3e,The duck at the end was a good one!,t3_llkh1v,2021-02-17 12:50:44,2021-02-17
1993,gnqpl6x,t1_gnqbw3e,Yeah the duck really QUACKED me up as well 🥲,t3_llkh1v,2021-02-17 15:05:21,2021-02-17
1994,gnrn1ca,t1_gnqbw3e,"I like them, too.  However, why is it always super spastic EDM?  Is it just that no other genre can adequately capture the ADHD enthusiasm of the moment?  I'm curious to see if we can get styles in there, but, of course, I'm not going to contribute.  Entertain me, Internet!",t3_llkh1v,2021-02-17 22:34:41,2021-02-17
1995,gnqne20,t1_gnqbw3e,Can someone make a repository for these? Depository? Whatever. I live for crypto and WSB videos.,t3_llkh1v,2021-02-17 14:38:14,2021-02-17
1996,gnqzoov,t1_gnqbw3e,Internet gold,t3_llkh1v,2021-02-17 17:36:26,2021-02-17
1997,gnqrvng,t1_gnqljjs,If you hold much longer you will be blown away Sammy,t3_llkh1v,2021-02-17 15:35:03,2021-02-17
1998,gnqw1l5,t1_gnqljjs,Right? This is the point where some people who only joined in the last years also start to become rich.,t3_llkh1v,2021-02-17 16:35:55,2021-02-17
1999,gnqs29a,t1_gnqr5d0,Yes !!!🚀🚀🚀🚀,t3_llkh1v,2021-02-17 15:37:30,2021-02-17
2000,gnrggdf,t1_gnqr5d0,do we think so? i would love some input,t3_llkh1v,2021-02-17 21:33:03,2021-02-17
2001,gnqs3ql,t1_gnqjw92,"Its over 9000...

Now we need over 90000",t3_llkh1v,2021-02-17 15:38:02,2021-02-17
2002,gnr0zlq,t1_gnqjw92,$1k was an insane pipe dream for a lot longer than $10k was an insane pipe dream.,t3_llkh1v,2021-02-17 17:58:36,2021-02-17
2003,gnqpgb4,t1_gnqjw92,Yes! And the memes were the best!,t3_llkh1v,2021-02-17 15:03:36,2021-02-17
2004,gnqrxvu,t1_gnqjw92,Yes now it’s $50k too late for them 🤩,t3_llkh1v,2021-02-17 15:35:52,2021-02-17
2005,gnray98,t1_gnqgy5t,[https://www.youtube.com/watch?v=dYJH3li2zgQ&feature=youtu.be](https://www.youtube.com/watch?v=dYJH3li2zgQ&feature=youtu.be),t3_llkh1v,2021-02-17 20:30:58,2021-02-17
2006,gnr4ron,t1_gnqgy5t,Surley we can just compile them all from over the past few years?,t3_llkh1v,2021-02-17 19:01:45,2021-02-17
2007,gnqwj2d,t1_gnqs233,I only wish I’d bought more! Dammit... do I put in more $ now??,t3_llkh1v,2021-02-17 16:43:54,2021-02-17
2009,gnqwv5o,t1_gnqs233,"Same, but I got in slightly after that. I mean, I'm ""only"" going to make a few grand for hours of research and mashing some buttons on my phone and missing a few nights of sleep. That said I also went with a pick and shovels strategy with RIOT blockchain and that is up 129% so...",t3_llkh1v,2021-02-17 16:49:32,2021-02-17
2010,gnqw6od,t1_gnqmmjv,"TBH I expect a huge drop when we reach U$69,420 :-/",t3_llkh1v,2021-02-17 16:38:15,2021-02-17
2011,gnqdkzn,t1_gnq81vo,maybe...,t3_llkh1v,2021-02-17 12:54:17,2021-02-17
2012,gnqvsxh,t1_gnq81vo,Extended version and 100k sequel please!,t3_llkh1v,2021-02-17 16:32:01,2021-02-17
2013,gnqrtc4,t1_gnq81vo,Lol couldn’t have agreed more,t3_llkh1v,2021-02-17 15:34:13,2021-02-17
2014,gnqfqhc,t1_gnq4sgg,WAAOOO,t3_llkh1v,2021-02-17 13:15:00,2021-02-17
2015,gnqij72,t1_gnq4sgg,what's the original source from that. That was hilarious,t3_llkh1v,2021-02-17 13:43:34,2021-02-17
2016,gnqs4rz,t1_gnqoak5,I agree,t3_llkh1v,2021-02-17 15:38:25,2021-02-17
2017,gnqx0q9,t1_gnqqwap,"Bro. In 2013 I got a $40k windfall and for a brief moment I considered putting it all into BTC... Hell, a few weeks ago I watched an interview with raoul pal and learned he had no cash and was all crypto and considered dumping all my cash into it... Finally ended up pulling the trigger like a week ago. 🤷‍♀️",t3_llkh1v,2021-02-17 16:52:09,2021-02-17
2018,gnquoyb,t1_gnqqwap,Or you could buy again and do it right this time,t3_llkh1v,2021-02-17 16:14:19,2021-02-17
2020,gnqtem7,t1_gnqrlm3,You gonna be riiiiiiich.,t3_llkh1v,2021-02-17 15:55:57,2021-02-17
2021,gnr0uis,t1_gnqrlm3,"Hello, Mr. Bitcoin Millionaire",t3_llkh1v,2021-02-17 17:56:09,2021-02-17
2023,gnrdij6,t1_gnqp1w8,Yes! that's what I was lookin for,t3_llkh1v,2021-02-17 21:01:17,2021-02-17
2024,gnr7esp,t1_gnqp1w8,da real mvp,t3_llkh1v,2021-02-17 19:42:23,2021-02-17
2025,gnqzmky,t1_gnqxg35,I agree with you I rather invest them than sell them🤝,t3_llkh1v,2021-02-17 17:35:27,2021-02-17
2026,gnrktm3,t1_gnqe6dc,"Yes pls, or a download link",t3_llkh1v,2021-02-17 22:15:00,2021-02-17
2027,gnr7mhj,t1_gnr4qlg,54k,t3_llkh1v,2021-02-17 19:45:33,2021-02-17
2030,gnr4ess,t1_gnqy913,Yeah fuck that stupid small ass green fiat currency.,t3_llkh1v,2021-02-17 18:55:57,2021-02-17
2031,gnqw47e,t1_gnqr135,My dick already exploded long ago.,t3_llkh1v,2021-02-17 16:37:06,2021-02-17
2035,gnrb49q,t1_gnr8ehh,India banning Bitcoin will cause the price to increase at least 30% in india. Arbitrage opportunities!,t3_llkh1v,2021-02-17 20:33:03,2021-02-17
2037,gnr8zuo,t1_gnr2tc4,"Yeah, back down to 50k after we see 100k",t3_llkh1v,2021-02-17 20:05:02,2021-02-17
2038,gnqxs8n,t1_gnqvoa5,Maybe it was!!!,t3_llkh1v,2021-02-17 17:04:35,2021-02-17
2039,gnr2com,t1_gnqwjpm,"You mean when it's 400.000 ?  😂

Awesome decision btw !",t3_llkh1v,2021-02-17 18:21:58,2021-02-17
2040,gnqvhe5,t1_gnqpaxw,Classic crypto.,t3_llkh1v,2021-02-17 16:26:47,2021-02-17
2041,gnr82es,t1_gnqx8wi,"Comparing the new world reserve currency against the old one kinda makes sense, don'cha think?",t3_llkh1v,2021-02-17 19:52:03,2021-02-17
2042,gnr8unm,t1_gnr8cjr,you mean the us dollar,t3_llkh1v,2021-02-17 20:03:03,2021-02-17
2043,gnracig,t1_gnr8cjr,"His handle has blind in it, so accurate!! 🤣🤣🤣",t3_llkh1v,2021-02-17 20:23:15,2021-02-17
2044,gnqrlgg,t1_gnqqlir,man u dumb,t3_llkh1v,2021-02-17 15:31:21,2021-02-17
2045,gnr0s9t,t1_gnqqlir,"Look man, I like nano. I hold some and have held some since RaiBlocks. But you guys really need to take a chill pill with the shilling. Nano isn't relevant to the thread, so why bring it up unprompted?

Again, I like Nano. It's a cool crypto and I think it has a good future. But people will recieve your message better if you actually make sure it's relevant to the conversation at hand. Bringing Nano up in every crypto sub constantly regardless of context isn't really earning you guys a great image. 

Cool coin, but unfortunately you guys can be insufferable with your constant shilling, and tend to make it worse with acting like it's a complete surprise that people don't take kindly to you guys attempting to hijack every fucking thread. 

I also think it's cute that Nano has been going apeshit about ₿ not being usable as a currency, yet I don't see where I can buy much of anything with Nano. Again, neat project, neat idea but it really feels like it's followed by children.",t3_llkh1v,2021-02-17 17:55:04,2021-02-17
2046,gnqikgr,t1_gnqh4zk,Because things happen in stages.,t3_llkh1v,2021-02-17 13:43:57,2021-02-17
2047,gnqqaab,t1_gnqh4zk,"You're free to use your unit of measurement, like chickpeas if you want",t3_llkh1v,2021-02-17 15:14:18,2021-02-17
2048,gnr4g24,t1_gnqz5t4,Fuck off,t3_llkh1v,2021-02-17 18:56:31,2021-02-17
2049,gnqa4tz,t1_gnq5ffq,Just don't go over the board  against all ur btc  a big drop in price will get you liquidated,t3_llkh1v,2021-02-17 12:21:54,2021-02-17
2050,gnqh9sq,t1_gnq5ffq,"Never, ever, EVER take out a loan or go into any kind of debt to purchase crypto. Only use money coming out of your own pocket. You are not guaranteed returns, and if your crypto goes south, not only are you down money, but you also owe money on top of the difference.",t3_llkh1v,2021-02-17 13:30:19,2021-02-17
2051,gnqfpvh,t1_gnq5ffq,"This is an extremely bad idea. 

I very strongly urge you to reconsider. As someone who lost 300k to that sort of mentality,  I can assure you it will not go well.",t3_llkh1v,2021-02-17 13:14:51,2021-02-17
2052,gnqinsk,t1_gnq5ffq,Careful bro... I don't dabble in the dark arts of margin.,t3_llkh1v,2021-02-17 13:44:57,2021-02-17
2053,gnqe5me,t1_gnq5ffq,"Yeah, don't do that.",t3_llkh1v,2021-02-17 12:59:44,2021-02-17
2054,gnq87w3,t1_gnq5ffq,Use your 3.8k btc as collateral loan btc then repay as you get your loan done?,t3_llkh1v,2021-02-17 12:03:39,2021-02-17
2055,gnqo018,t1_gnq5ffq,"I was in the bubble of 2017.  These bull runs always have an end and you don't we the last one standing when everyone else ducks out due to a loss of 30% or more.  Are you willing to stomach that loss?  It could take years for the btc market to come back and surpass the all time high.  Why not just buy the long dip after this bull run crashes?

Think about it this way: if btc goes to the moon at 100k, you double your money.  Now imagine if you had bought in at 3, 5, 10k as some people on the sub have.  A rise to 100k is that much more meaningful.  The bear market will come in time and you won't have to take out a loan to get big money.",t3_llkh1v,2021-02-17 14:45:37,2021-02-17
2056,gnr0iac,t1_gnqsfwl,"You deserve the hard-won success you're going to have in the future, boss.",t3_llkh1v,2021-02-17 17:50:23,2021-02-17
2057,gnqv6ab,t1_gnqsfwl,You deserve a big thank you from everyone who cashes out!,t3_llkh1v,2021-02-17 16:21:46,2021-02-17
2058,gnr5bzl,t1_gnqsfwl,What about we who have lost our password? Aren't we deserving of some praise too? 🐵,t3_llkh1v,2021-02-17 19:10:42,2021-02-17
2059,gnrc08j,t1_gnqsfwl,Bogdanoff is watching you.,t3_llkh1v,2021-02-17 20:44:01,2021-02-17
2060,gnr7rhz,t1_gnqsfwl,"I should feel better, knowing that many people made the exact same mistake I did. But no, it just feels like strangers on the internet are calling me out specifically.",t3_llkh1v,2021-02-17 19:47:32,2021-02-17
2061,gnracs1,t1_gnqsfwl,"what about the people who held and bought all the way from former ath of $1.2k down to $200? don't we deserve something, a yacht maybe, as well?",t3_llkh1v,2021-02-17 20:23:21,2021-02-17
2067,gnr9tke,t1_gnqsfwl,"A bullet? /s

Welcome 🙏 we missed you.",t3_llkh1v,2021-02-17 20:16:18,2021-02-17
2068,gnr5oku,t1_gnqsfwl,Thanks for your sacrifice. And for making me laugh . You deserve more than you got.,t3_llkh1v,2021-02-17 19:16:10,2021-02-17
2071,gnriza6,t1_gnqsfwl,You belong on /r/wallstreetbets ! 😂🤣,t3_llkh1v,2021-02-17 21:57:39,2021-02-17
2072,gnqrsil,t1_gnqqw7f,Solid advice . Keep buying love this 😎,t3_llkh1v,2021-02-17 15:33:55,2021-02-17
2074,gnr78si,t1_gnqqw7f,I’d wait for the bull run to end and buy back in when it crashes back down to $15k by the middle of 2021..,t3_llkh1v,2021-02-17 19:39:54,2021-02-17
2075,gnqt88e,t1_gnqrqlf,I did after over 2 years of holding. Never planned to sell but covid became a thing and I was between jobs. Just wanted to get rid of debt. Been buying since October again. I'm up to 19% of a bitcoin... Slow and steady.,t3_llkh1v,2021-02-17 15:53:28,2021-02-17
2076,gnrmvzx,t1_gnrgc5u,"you sir, a true diamond hand legend!!",t3_llkh1v,2021-02-17 22:33:24,2021-02-17
2077,gnr3o4n,t1_gnqywi7,"As a backup to this point, it seems to me that 2017 era HODLers should bear in mind that in the long run our situation is not bad:

- we won't get FU rich off a few hundred dollars we randomly spent on some ""magical internet beans"" in 2009/2010. BUT:
- we didn't have to suffer the disruption/stress/risk of that. Like winning the lottery, suddenly coming into a huge amount of money quite often ruins people
- instead our gains have grown greatly, but not insanely
- our gains are also growing more inline with increasing mainstream acceptance
- we are still early adopters, but with some better focus

We still don't know what will happen, but along with my other investments, retirement could be an option for me at or before 50. That's no joke, considering I only got truly serious about long-term financial preparation in the last 4 years",t3_llkh1v,2021-02-17 18:43:50,2021-02-17
2078,gnqle0r,t1_gnqjl0s,"My eyes popped when it hit $100. I sold then, naturally.

Your .1 is 50x one of mine from that top.",t3_llkh1v,2021-02-17 14:14:57,2021-02-17
2079,gnr7gxk,t1_gnqjl0s,"Yo man, totally new here, what's up with the hyper inflation?!",t3_llkh1v,2021-02-17 19:43:16,2021-02-17
2080,gnqozkf,t1_gnqjl0s,"lol ""starts""",t3_llkh1v,2021-02-17 14:57:50,2021-02-17
2082,gnr63k9,t1_gnqwq8b,"But in a few years time when we are way above $200,000 your investment will be worth a handsome amount.",t3_llkh1v,2021-02-17 19:22:39,2021-02-17
2083,gnr2slu,t1_gnqwq8b,Don't worry a couple of months ago i was laughing at everyone buying at the ATH :),t3_llkh1v,2021-02-17 18:29:20,2021-02-17
2084,gnqq3go,t1_gnqig16,"We far from the top boy, keep gettin crazy",t3_llkh1v,2021-02-17 15:11:52,2021-02-17
2085,gnqtet4,t1_gnqig16,I told my mate I at $25k that it’s too late for me to join the bandwagon but the dumb inside me didn’t believe the real me and I put in $3k at $25k. Now the dumb inside me is winning and my whole life perspective has changed. I am real bad at making money but the dumb me is giving me hope,t3_llkh1v,2021-02-17 15:56:02,2021-02-17
2086,gnrklyr,t1_gnqig16,Back in the 30k days of a month ago?,t3_llkh1v,2021-02-17 22:13:03,2021-02-17
2087,gnqowef,t1_gnqd7ih,moar duck plz,t3_llkh1v,2021-02-17 14:56:45,2021-02-17
2089,gnqpnek,t1_gnqne20,Suppository.,t3_llkh1v,2021-02-17 15:06:07,2021-02-17
2090,gnqnipz,t1_gnqne20,This guy gets it. There was an absolute banger on here a few days ago and I can't find it now,t3_llkh1v,2021-02-17 14:39:48,2021-02-17
2093,gnqy48x,t1_gnqs3ql,missing maboy vegeta,t3_llkh1v,2021-02-17 17:10:14,2021-02-17
2095,gnrasgb,t1_gnqs3ql,"I'm sad there will never be the repeated experience of Vegeta over 9000 memes, ever again. But I was there and I'll always remember.",t3_llkh1v,2021-02-17 20:28:55,2021-02-17
2096,gnr7r63,t1_gnr0zlq,"For real. Took ages to break through the $1,000 barrier after the 2013/14 run up and decline. 
Took me a lot of conviction to keep dumping my ££ into bitcoin. 

Couldn't have done it without the likes of you and the other og's holding the line 🙏",t3_llkh1v,2021-02-17 19:47:24,2021-02-17
2098,gnqw3h0,t1_gnqpgb4,The lack of $50k memes disturb me.,t3_llkh1v,2021-02-17 16:36:45,2021-02-17
2100,gnr4vfc,t1_gnqwj2d,"Dude this is me RN, trying to hit .02 but want to buy low but it keeps going up!! Argh .013 and growing however",t3_llkh1v,2021-02-17 19:03:25,2021-02-17
2102,gnr1cgs,t1_gnqw6od,i expect my anus to gape,t3_llkh1v,2021-02-17 18:04:49,2021-02-17
2103,gnqi0w4,t1_gnqdkzn,need it bro,t3_llkh1v,2021-02-17 13:38:08,2021-02-17
2104,gnqqxb0,t1_gnqij72,From the Democratic primary in 2016 when she accepted her party's nomination and balloons dropped.,t3_llkh1v,2021-02-17 15:22:30,2021-02-17
2105,gnqqwki,t1_gnqij72,It’s her having a seizure as the balloons fall at the DNC I think.,t3_llkh1v,2021-02-17 15:22:15,2021-02-17
2106,gnqve8t,t1_gnquoyb,I’ll wait for the dip,t3_llkh1v,2021-02-17 16:25:21,2021-02-17
2107,gnr12tq,t1_gnr0uis,You addressed me as Mr coz of my crypto value 😂 dude cant u see my name ??,t3_llkh1v,2021-02-17 18:00:10,2021-02-17
2108,gnr7wdu,t1_gnqzmky,"Never sell your coins. If you really need money, borrow against them.",t3_llkh1v,2021-02-17 19:49:34,2021-02-17
2110,gnr5sgo,t1_gnr4ess,😂😂😂😂😂,t3_llkh1v,2021-02-17 19:17:53,2021-02-17
2111,gnrcmso,t1_gnrb49q,"But arbitages by def can either undervalue or overvalue the asset. Majority of Indians are too much of govt suckers & might panic sell just before the law comes into force. Panic selling will devalue the asset (btc here). 

Problem is Indians in general fear the govt far more than any american or european. So chances of buying back are pretty low within the country of 1.3B people. 

Add the fact of how brutally & carelessly Indian govt attacks people who don't agree with it (search up activist Disha, greta thunberg India's farmer protest case) and I feel it's unlikely that a majority of Indians are going to be able to have btc. 

If you think otherwise please elaborate.",t3_llkh1v,2021-02-17 20:51:20,2021-02-17
2112,gnr54y4,t1_gnr2com,"Haha! I hope I get in before then! People say bitcoin is too volatile but I've been able to consistently get in at the dips. Bought at 33/35 dips before Elon, then again at I think the 36/37 dip, bought more in low 40s too. I've been off by about 1000 at most from the lowest point of the dips, if you watch it, it's honestly somewhat predictable.",t3_llkh1v,2021-02-17 19:07:38,2021-02-17
2114,gnr9vd9,t1_gnr8unm,Bingo! J.P. Morgan was found laundering 2billion with a B of drug money. Who’s the real criminals here??,t3_llkh1v,2021-02-17 20:16:58,2021-02-17
2115,gnr96re,t1_gnr8unm,Dollar is the worst ever world currency,t3_llkh1v,2021-02-17 20:07:42,2021-02-17
2116,gnrbbb4,t1_gnracig,"Lol you guys on what basis this crypto is priced ? 
WTF satoshi shit",t3_llkh1v,2021-02-17 20:35:32,2021-02-17
2117,gnqrsad,t1_gnqrlgg,I am on fire. Whatchu talkin ‘bout?,t3_llkh1v,2021-02-17 15:33:49,2021-02-17
2118,gnqv9yp,t1_gnqa4tz,"How many more posts like these before we call the top on this cycle?

Check out [this](https://i.imgur.com/lvH5kSl.png) euphoria from over on /r/WallStreetBets right before the GameStop crash.",t3_llkh1v,2021-02-17 16:23:23,2021-02-17
2119,gnqopnd,t1_gnqh9sq,"Eh, depends on your situwtion. For many, especially those without dependents,  bankrupty is really not that bad a fate.",t3_llkh1v,2021-02-17 14:54:23,2021-02-17
2120,gnqkkt1,t1_gnqinsk,"Lol :-) Girl here :-) thank you though, I think it’s worth it in the long run. 1/4 of my income a month to fully buy a bitcoin in a few years.. hoping for some gains to mitigate the cost over the next few months",t3_llkh1v,2021-02-17 14:05:43,2021-02-17
2121,gnq9xwg,t1_gnq87w3,Thanks that’s a good idea :-),t3_llkh1v,2021-02-17 12:20:03,2021-02-17
2122,gnrajg1,t1_gnr5bzl,"Yes, thank you to all the people who lost their password and are hodling, even if you don't want to",t3_llkh1v,2021-02-17 20:25:43,2021-02-17
2128,gnrfoti,t1_gnrc08j,DÖMP IT,t3_llkh1v,2021-02-17 21:25:09,2021-02-17
2131,gnrfsl6,t1_gnracs1,You deserve TWO!,t3_llkh1v,2021-02-17 21:26:14,2021-02-17
2132,gnr8gys,t1_gnr78si,You actually think the institutional investors will let it drop this far? I think not.,t3_llkh1v,2021-02-17 19:57:45,2021-02-17
2133,gnraqo9,t1_gnr78si,"That's not very optimistic 😕.  If big money gets in, I think the price settles between 50k-100k after the bull run. The real question is how high will this run go",t3_llkh1v,2021-02-17 20:28:18,2021-02-17
2134,gnrhfst,t1_gnr78si,Lol,t3_llkh1v,2021-02-17 21:42:51,2021-02-17
2135,gnr15q8,t1_gnqt88e,"Just hang on, you will come around am sure 🤑",t3_llkh1v,2021-02-17 18:01:34,2021-02-17
2136,gnr7ms1,t1_gnr3o4n,"That’s where I am at now.   I have an awesome career that’s my bread and butter, but I’m not doing that for 30 years to retire.  I’m 38 and have 401k but now investing long term on all things crypto ... hopefully I can retire in my 50’s.",t3_llkh1v,2021-02-17 19:45:40,2021-02-17
2137,gnrj51x,t1_gnr3o4n,hey the whales dumped on y’all in 2017!!,t3_llkh1v,2021-02-17 21:59:11,2021-02-17
2138,gnqlj6e,t1_gnqle0r,Only sell your bitcoin if you need it to buy another asset that won’t depreciate or is extremely vital to your happiness. Also never sell all of your bitcoin.,t3_llkh1v,2021-02-17 14:16:35,2021-02-17
2139,gnr7tdh,t1_gnqle0r,"Imagine buying at $100 & holding it till today. If I bought $1000 of it (10btc) I'd be having $500,000. No more student loans T_T.",t3_llkh1v,2021-02-17 19:48:19,2021-02-17
2140,gnri234,t1_gnr7gxk,"We printed 2T USD this year, another 2T incoming. That will be over 30% of all USD in circulation. That’s hyper inflation.",t3_llkh1v,2021-02-17 21:48:51,2021-02-17
2141,gnr44nj,t1_gnqozkf,"US inflation has been around 1.5% for a decade. EU inflation is even lower.

So where is this ""hyperinflation""?",t3_llkh1v,2021-02-17 18:51:20,2021-02-17
2142,gnqp2o6,t1_gnqozkf,"It’s just barely started. Just wait, we ain’t seen nothing yet.",t3_llkh1v,2021-02-17 14:58:55,2021-02-17
2143,gnr7l4z,t1_gnr63k9,My mom thinks I'm handsome already,t3_llkh1v,2021-02-17 19:45:00,2021-02-17
2144,gnr35em,t1_gnr2slu,¯\\\_(ツ)\_/¯,t3_llkh1v,2021-02-17 18:35:13,2021-02-17
2145,gnqvhvo,t1_gnqq3go,Every paycheck!,t3_llkh1v,2021-02-17 16:27:01,2021-02-17
2146,gnqua0v,t1_gnqtet4,"About 12 months before the $25k top I was about to put a sizeable down deposit on a house. And the dumb me inside me suggested yoloing it into Bitcoin instead. 

In a parallel universe out there somewhere dumb me became a millionaire within the year.",t3_llkh1v,2021-02-17 16:08:25,2021-02-17
2147,gnr9y5g,t1_gnqtet4,Paralysis by Analysis?,t3_llkh1v,2021-02-17 20:18:00,2021-02-17
2148,gnqr9wp,t1_gnqowef,Quack.,t3_llkh1v,2021-02-17 15:27:08,2021-02-17
2151,gnraf9h,t1_gnqy48x,No dont jinx it,t3_llkh1v,2021-02-17 20:24:15,2021-02-17
2152,gnr0bxr,t1_gnqy48x,"Ahh, the good old days",t3_llkh1v,2021-02-17 17:47:21,2021-02-17
2154,gnrbrbg,t1_gnr4vfc,Just buy a little each week. It takes the emotion out of it. I bought my weekly amount yesterday and I was like  “should I really be buying at $49K?” Now I’m up 4% on that buy lol,t3_llkh1v,2021-02-17 20:41:00,2021-02-17
2155,gnqwnqc,t1_gnqve8t,"Good strategy, when it retraces from $75k to $60k you’ll be much better off....",t3_llkh1v,2021-02-17 16:46:04,2021-02-17
2156,gnr6lza,t1_gnqve8t,Enjoy being poor.,t3_llkh1v,2021-02-17 19:30:21,2021-02-17
2157,gnqx0kx,t1_gnqve8t,There’s a lot of institutional corporate money that don’t sell and buy on the small dips. I think the days of 50% crashes maybe gone.,t3_llkh1v,2021-02-17 16:52:04,2021-02-17
2158,gnrk5bt,t1_gnr12tq,You assumed that names have genders ? Wow. I’m flabbergasted,t3_llkh1v,2021-02-17 22:08:47,2021-02-17
2159,gnr1upc,t1_gnr12tq,Oh damn 0__0,t3_llkh1v,2021-02-17 18:13:31,2021-02-17
2161,gnrdip2,t1_gnr7wdu,I sent a dm,t3_llkh1v,2021-02-17 21:01:20,2021-02-17
2162,gnrd1j6,t1_gnrcmso,"I most certainly think otherwise. Did you even see the farmer protest recently? They have an order of magnitude more balls and will to stand up against corrupt government than any western country. And the cops controlling the protest were not armed, no-one got shot etc. so seems even their government is not as totalitarian as western ones.

Where did west lose it's marbles and forget that it is OK to use same kind of force against someone as they use against you? Cops need to behave and not use force multipliers like guns against unarmed citizens. If they do, you are living in tyranny.",t3_llkh1v,2021-02-17 20:55:58,2021-02-17
2163,gnrb0gy,t1_gnr9vd9,HSBC was laundering money for the zeta cartel and ISIS. the punishment was half a days profit.,t3_llkh1v,2021-02-17 20:31:43,2021-02-17
2164,gnqrt1t,t1_gnqrsad,"Hi on fire, I'm Dad! :)",t3_llkh1v,2021-02-17 15:34:07,2021-02-17
2165,gnqw7jj,t1_gnqv9yp,I had a very similar thought when I initially replied. These kinds of comments are huge red flags for anyone that went through 2017.,t3_llkh1v,2021-02-17 16:38:38,2021-02-17
2166,gnqn943,t1_gnqkkt1,"Good luck. But you should really consider the economics of what you're proposing.

What sort of interest rate are you looking at? Because you would need BTC to outperform your interest every month in order to not lose money,  and that's not taking into account the possibility for downward movement. 

Even if you think that's likely to be the case, you will need to deduct the interest you're paying from your gains, and as we pointed out above, there's no guarantee that you WILL have gains to deduct from. 

What length of loan are you looking at? With what sort of interest rates? What do you plan to do should the situation turn sour?

Again I need to reiterate that buying bitcoin or any crypto for that matter on credit or loans is a very foolish idea.",t3_llkh1v,2021-02-17 14:36:36,2021-02-17
2167,gnqdcy5,t1_gnq9xwg,🤦🏻‍♂️,t3_llkh1v,2021-02-17 12:52:11,2021-02-17
2168,gnrarnq,t1_gnrajg1,The diamondest of ALL hands!,t3_llkh1v,2021-02-17 20:28:38,2021-02-17
2169,gnrdtex,t1_gnrajg1,I diamond hand. Yes. I do. Nevermind freedom of choice!,t3_llkh1v,2021-02-17 21:04:43,2021-02-17
2174,gnr98gc,t1_gnr7ms1,Your situation sounds very very similar to mine. All the best to you. Balancing risk is the way,t3_llkh1v,2021-02-17 20:08:22,2021-02-17
2175,gnrbrrr,t1_gnqlj6e,That's my plan. Hodling to one day make it buy me a house.,t3_llkh1v,2021-02-17 20:41:09,2021-02-17
