,title,score,id,url,comms_num,created,body,date
43,"Bitcoin backer MicroStrategy initiated at a buy at BTIG, partly on the back of $95,000 forecast for the crypto by 2022",40,mhzne0,https://www.marketwatch.com/story/bitcoin-backer-microstrategy-initiated-at-a-buy-at-btig-partly-on-the-back-of-95-000-forecast-for-the-crypto-by-2022-11617295948?mod=mw_latestnews,9,2021-04-02 00:56:41,,2021-04-02
44,Anyone else miss every dip so far. Whether didn’t have access to funds that would make any real money or other shot life throws at you.,3,midobl,https://www.reddit.com/r/Bitcoin/comments/midobl/anyone_else_miss_every_dip_so_far_whether_didnt/,15,2021-04-02 13:23:20,"This song helps

Everybody knows that the dice are loaded

Everybody rolls with their fingers crossed

Everybody knows the war is over

Everybody knows the good guys lost

Everybody knows the fight was fixed

The poor stay poor, the rich get rich

That's how it goes

Everybody knows",2021-04-02
45,Coinbase ordered to pay $6.5M fine for being caught running bots to manipulate crypto prices on their platform.,11043,mh4vyk,https://cftc.gov/PressRoom/PressReleases/8369-21,885,2021-03-31 20:19:39,,2021-03-31
46,Tales from the Crypt: Rabbit Hole Recap: Bitcoin Week of 2021.03.29,8,mi93na,https://anchor.fm/tales-from-the-crypt/episodes/Rabbit-Hole-Recap-Bitcoin-Week-of-2021-03-29-eu23dh,0,2021-04-02 08:38:20,,2021-04-02
47,"From now on, it's all about stacking your SATS.",53,mhxe3v,https://www.reddit.com/r/Bitcoin/comments/mhxe3v/from_now_on_its_all_about_stacking_your_sats/,66,2021-04-01 23:11:53,"I think for most of us crypto retailers, the reality of obtaining a whole bitcoin is getting more and more difficult, and it will be unlikely for the most of us to obtain one whole bitcoin, unless you have a pretty big savings. But let me teach you guys something. 

If you guys believe bitcoin will reach a marketcap of a 100 trillion usd (most likely it will) in 10 years, then you guys better stack some SATS. Either be it 1 dollar every month or 100 dollar every month. Just keep buying bitcoins for the coming 10 years. Because in 10 years, that 0.01 bitcoin (1 million SATS) will worth about 1 million dollars.",2021-04-01
48,Morgan Stanley Files To Offer Bitcoin Exposure Through Institutional Funds,25,mi1u0s,https://bitcoinmagazine.com/business/morgan-stanley-files-to-offer-bitcoin-exposure-through-institutional-funds,0,2021-04-02 02:35:17,,2021-04-02
49,Looks like a bunch of investment banks are opening up exposure to Bitcoin. Question on if we can see what they are actually doing.,6,miawg1,https://www.reddit.com/r/Bitcoin/comments/miawg1/looks_like_a_bunch_of_investment_banks_are/,1,2021-04-02 10:25:17,"Lot of investment banks are opening investment opportunities for bitcoin. Are they also buying it themselves? It doesn’t look like it, it seems only for clients. 

My main question is - Is there a way to see if they are letting clients buy into it and shorting it themselves?  Are these type of trades public knowledge?",2021-04-02
