,title,score,id,url,comms_num,created,body,date
0,WARNING! Stay away from Blockchain.com wallet!,570,mcd99v,https://www.reddit.com/r/Bitcoin/comments/mcd99v/warning_stay_away_from_blockchaincom_wallet/,207,2021-03-25 02:43:38,"There have been numerous thefts on Blockchain.com (previously Blockchain.info) wallet. Hundreds or even thousands of customers have lost millions worth of Bitcoins and other cryptocurrencies.

The most recent reason for these thefts is 2FA malfunction. Most victims have stated that right before the theft, either 2FA email has been changed or 2FA completely disabled, after which all funds have been moved out.

[https://honestproscons.com/blockchain-com-is-losing-customers-funds](https://honestproscons.com/blockchain-com-is-losing-customers-funds)

There’s a known 2FA security flaw on Blockchain.com that allows a hacker to disable 2FA without needing to authenticate with 2FA first. This allows the hacker to login to the wallet with just Wallet ID and password.

[https://docs.google.com/presentation/d/1B7Edd-fj3wSegL2\_JMwKBglPzk3pBG9DUVLuz3HPP-w/edit#slide=id.g848d967a91\_0\_21](https://docs.google.com/presentation/d/1B7Edd-fj3wSegL2_JMwKBglPzk3pBG9DUVLuz3HPP-w/edit#slide=id.g848d967a91_0_21)

Even though Blockchain.com has been aware of this flaw since 2019, it still has not been fixed. This flaw is likely the reason for multiple hacks, though there may be other security flaws in the Blockchain.com wallet. The involvement of Blockchain.com staff or a data leak cannot be ruled out either.

As of now, Blockchain.com is unwilling to accept responsibility or admit that their system has any security flaws. Instead, Blockchain.com is threatening people who have exposed these flaws with legal actions. Here's the example of such a letter and further correspondence with their lawyers:

[https://blockchaindotcomsucks.com/legal-stuff](https://blockchaindotcomsucks.com/legal-stuff)

Blockchain.com has also been unable to provide any reasonable support to its customers and has offered absolutely no aid to the victims of the theft. As a result of this, on TrustPilot, 60% of reviews are negative 1-star reviews.

[https://www.trustpilot.com/review/blockchain.com?stars=1](https://www.trustpilot.com/review/blockchain.com?stars=1)

We strongly advise everyone to stop using Blockchain.com wallet and their other services due to the extremely low security they provide and the high risk of theft on their platform.

[https://isblockchainascam.com](https://isblockchainascam.com/)",2021-03-25
1,"Daily Discussion, April 02, 2021",22,mide1d,https://www.reddit.com/r/Bitcoin/comments/mide1d/daily_discussion_april_02_2021/,163,2021-04-02 13:04:08,"Please utilize this sticky thread for all general **Bitcoin** discussions! If you see posts on the front page or /r/Bitcoin/new which are better suited for this daily discussion thread, please help out by directing the OP to this thread instead. Thank you!

If you don't get an answer to your question, you can try phrasing it differently or commenting again tomorrow.

[Join us in the r/Bitcoin Chatroom!](https://discord.gg/qE3rWBRNqh)

Please check the [previous discussion thread](https://www.reddit.com/r/Bitcoin/comments/mhp2nd/lightning_thursday_april_01_2021_explore_the/) for unanswered questions.",2021-04-02
2,"Too bad I don’t have this luck with lottery tickets, can’t complain though 🚀",1055,mi9uxt,https://www.reddit.com/gallery/mi9uxt,132,2021-04-02 09:22:59,,2021-04-02
3,"JPMorgan Adjusts Its Bitcoin Target to $130,000, Predicting Strong Institutional Adoption",572,mibt5z,https://u.today/jpmorgan-adjusts-its-bitcoin-target-to-130000-predicting-strong-institutional-adoption,62,2021-04-02 11:21:17,,2021-04-02
4,🚀🚀🚀,4344,mhygls,https://i.redd.it/ol2buuar4lq61.jpg,142,2021-04-02 00:02:27,,2021-04-02
5,"Bitcoin is showing another historical sign of a major breakout upward. Been holding its 58500-59500 price solid, with only upward hills every month. 60k tomorrow, following new ATH by this weekend....",312,miamqa,https://www.reddit.com/r/Bitcoin/comments/miamqa/bitcoin_is_showing_another_historical_sign_of_a/,43,2021-04-02 10:09:17,Bitcoin just had its biggest first quarter gain since 2013. And past history shows April has always been a extremely bullish month. Hold on tight!🚀🚀🚀,2021-04-02
6,$60K!,230,mib5oe,https://www.reddit.com/r/Bitcoin/comments/mib5oe/60k/,49,2021-04-02 10:41:08,"Wow, what just happened it popped to $60K very sharply!",2021-04-02
7,Bitcoin and chill,69,micj9j,https://www.reddit.com/r/Bitcoin/comments/micj9j/bitcoin_and_chill/,9,2021-04-02 12:06:50,Chasing altcoin gains was making my head spin. Now  I just Bitcoin and chill. Life is good.,2021-04-02
8,"Coinbase going public on April 14 under ticker ""COIN""",229,mi4hiy,https://blog.coinbase.com/coinbase-announces-effectiveness-of-registration-statement-and-anticipated-listing-date-of-its-1509b281f760,66,2021-04-02 04:39:35,,2021-04-02
9,Friendly reminder: bitcoin wasn’t created to make you rich. It was created to make you free.,3624,mhoo6v,https://www.reddit.com/r/Bitcoin/comments/mhoo6v/friendly_reminder_bitcoin_wasnt_created_to_make/,534,2021-04-01 13:45:39,"Getting rich is a side effect

Source: https://twitter.com/baidakova/status/1377112118135201799?s=21",2021-04-01
10,Such Large Portfolio!,2556,mhpqvw,https://v.redd.it/ofpwn0sigiq61,83,2021-04-01 15:03:18,,2021-04-01
11,"There are 1,930 $1M+ Bitcoin Whale Transactions Per Day Today, Compared to 229 Per Day One Year Ago (a +743% Increase)",78,mia4ly,https://twitter.com/santimentfeed/status/1377796470305398788,9,2021-04-02 09:38:52,,2021-04-02
12,Shall I put my life savings on Crypto? (10k) age 23,105,mi7idl,https://www.reddit.com/r/Bitcoin/comments/mi7idl/shall_i_put_my_life_savings_on_crypto_10k_age_23/,143,2021-04-02 07:11:07,"A bit more context. I have been watching the markets for up to 6 months seeing the gains. I got involved 2 months ago stacking sats weekly until I've got nearly 0.1 Btc. 

I have about 10k saved in the stock market and am strongly considering lumping this into bitcoin, as from what I'm hearing the bull run is potentially only half way through so not much point waiting for dips and corrections when at the moment, there's so much demand and it seems impossible to time the market. 

I am self employed and run my own business. Make about 2.5k a month and get about 1.5k profit a month.  I  still live with my parents at 23 as I finished uni last year,  so basically have no real commitments or anyone depending on me.

Shall I lump it all on btc and hold it til 2025 and beyond..?
Would I regret by Christmas 2021 or not..?
Advice on my situation, and prediction on my regret?",2021-04-02
13,"I like that the information come from me directly. I am now an official candidate for the second most powerful position in New York City. If someone want to write something about all the Bitcoiner running for a city position in New York city, ping me!",29,midqfo,https://www.reddit.com/r/Bitcoin/comments/midqfo/i_like_that_the_information_come_from_me_directly/,9,2021-04-02 13:27:47,"**Dear Bitcoin Enthusiasts,**  


**It's official!** I am a candidate for Public Advocate of the City of New York. It's the second most powerful position in New York City. *(*[*https://www.mnn.org/blog/clip-week-what-does-public-advocate-do*](https://www.mnn.org/blog/clip-week-what-does-public-advocate-do)*)*  


I have been fighting the crypto license since it's inception. My friend Eddie is going to keep track of all the politicians over Crypto.

# [https://www.youtube.com/watch?v=vfFj1LOhTkY](https://www.youtube.com/watch?v=vfFj1LOhTkY)

Please check his twitter account and send him issue about how the #Bitlicense affect you where you are around the world. [**https://twitter.com/squidchronicle**](https://twitter.com/squidchronicle)

**Theo Chino**  
*If you are an American Citizen and want to donate to my campaign:* [*https://pubadvocate.nyc/donation*](https://pubadvocate.nyc/donation/)",2021-04-02
14,"WARNING: If you have a BitPay Card, check your balance now!",38,mibuw1,https://www.reddit.com/r/Bitcoin/comments/mibuw1/warning_if_you_have_a_bitpay_card_check_your/,18,2021-04-02 11:24:14,"Over the past 10 hours my balance was drained with very large transactions in Malaysia and Bangladesh mostly. I only found out because I tried to use the card and it was empty! I'm flabbergasted their fraud protection system didn't catch them.

I tried to call them on the phone at 10:15 Eastern, they had just closed. I'll keep you all posted tomorrow.

**Edit**: look at these transactions. I am in California, never been anywhere close to those countries. How is it even possible that these transactions went through. [https://imgur.com/a/ILx4eax](https://imgur.com/a/ILx4eax)",2021-04-02
15,Morgan Stanley officially investing in BTC,354,mhwy94,https://www.reddit.com/r/Bitcoin/comments/mhwy94/morgan_stanley_officially_investing_in_btc/,48,2021-04-01 22:50:40,"Morgan Stanley’s fund has informed to the SEC that they will have exposure in BTC. Here is the link with the notice. (No April fool’s joke) 

https://www.sec.gov/edgar/search/#/q=bitcoin&dateRange=custom&entityName=CIK%25200000836487&startdt=2021-04-01&enddt=2021-04-01",2021-04-01
16,Us with a new ATH back in our sights,312,mhwpdx,https://i.redd.it/4fkny6qtpkq61.jpg,17,2021-04-01 22:38:45,,2021-04-01
17,Buy domains with bitcoin!,10,mifcz1,https://www.reddit.com/r/Bitcoin/comments/mifcz1/buy_domains_with_bitcoin/,2,2021-04-02 15:32:40,"&#x200B;

https://preview.redd.it/o3jqg7spqpq61.png?width=976&format=png&auto=webp&s=3b13328267681634ba315dcd1a28a16fd07d5f13",2021-04-02
18,Has it really been 2 years already?,21,mibjgl,https://www.reddit.com/r/Bitcoin/comments/mibjgl/has_it_really_been_2_years_already/,4,2021-04-02 11:04:34,"It's been 2 years since my first purchase of bitcoin and I always like to read stories of people's struggles and successes on here, so here's mine.  Don't worry, it's fairly short.

4/1/2019, I had been watching the price of bitcoin go up and down for two or three months now, finally got verified on coinbase, and made my first purchase.  0.02413919 BTC @ $4,136.78 or right around $100.  That's all I could spare at the time and I figured if I could trade it day by day and make something like +$20 from it, that's really the best I could ever ask for.

What happened next sent chills down my spine.  I had studied the charts and had watched the price for months thinking I'd be ready for anything bitcoin threw at me, but as I sat there on day 1 of my new adventure, I witnessed the price jump around 25% to $5,150 in a single night.  Of course the... whatever you want to call me... that I was, I sold rather early and missed out on a majority of that amazing jump.

About 2 months went by and I continued to buy and sell during this time, learning how to read the charts better and try to predict how to make an extra dollar (and how not to quickly lose several...)  Money got tight and I was ready to cash out.  Think I made a profit of $80 or so overall from day trading, so of course I was insanely pleased with my little experiment.

Hindsight is 20/20.  If I had just bought into bitcoin and held the entire time, I would have made something like 2.2x what I put in, instead of 1.8x.  If I had continued holding until today, it'd be closer to 14x if not a little higher...  Moral of the story?  HODL!!!  I'm just glad I was one of the fortunate few that was able to turn a profit on day trading.

Recently got back into bitcoin and looking forward to seeing where this technology goes from here.  Can't believe it's been 2 years, but at the same time I thought it'd take decades to get to the prices we're seeing right now.  Still can't say it's a great time for my wallet, but it's about time I jump back on the bitcoin rocket.",2021-04-02
19,Uncomfortable realities,11,mie9s2,https://www.reddit.com/r/Bitcoin/comments/mie9s2/uncomfortable_realities/,18,2021-04-02 14:07:28,"Not investment advice.

Right now if you are a bitcoiner you probably think: I kind of get it or I get it.

If you a pure speculator that's bullish, you might think I don't agree with it, but I won't fight a crowd.

The reason most are not involved is because it forces them to fake an uncomfortable set of realities. We are getting a look under the hood-and we don't like what we see. Most people do NOT want to think/talk about this.

1. The American political system is beyond repair. It's dysfunctional and polarized to the point of all votes being along party lines. Party dissent is getting less common. This is not good.
2. We cannot stop printing for years to probably forever. We can and will slow down but we won't stop, we must print. We must incur deficits. Even in a recovered economy, a trillion yearly deficit is common. 
3. Europe-no one knows how bad the problems really are. Could be not a huge problem, could be massive.
4. Either the companies and people buying or they are smarter than us and see something coming. This is 08 part 2 and the smart people see the wreck coming. Are the rich all in on the stock market?
5. The debt is going to hurt the 2022-2025 recovery. We must print more to counteract this. 
6. Massive wealth inequality is spreading. Poverty and violence are increasing. Homelessness is rampant. These are signs that point to destabilization.
7. Wages Increase/Cost of living Increase ratio. Anything under 1 means the person is getting poorer. This is rapidly going under 1 and closer to zero for a larger and larger part of society.
8. The only real avenue to stop this is cut expenses. There is nothing that can be cut significantly without a huge shock. 1/6 people work for the government. It costs $400,000+ to house a prisoner for 1 year in NYC.
9. The bond market is in serious trouble if inflation picks up. SERIOUS TROUBLE. Talking 50 trillion trouble. If this recovery is great for 3 months then crashes, a serious economic slow down will force a highly leveraged consumer and corporate borrower to default. The commercial real estate will implode. The government will have less revenues, and face a problem where printing goes insane. I'm talking one time check to everyone for $5,000 insane. I'm talking 0 down 40 year home loans waive 1/2 the pmi interest insane.
10. What's the chance the EU/Europe/China/Russia has a major conflict or a currency collapse. Will people dump treasuries? Find out on the next 6 months episodes of the world of tomorrow.",2021-04-02
20,Malta to accept tax payments in Bitcoin,130,mhz8oy,https://twitter.com/bitcoinclubmt/status/1377509603248857088,10,2021-04-02 00:37:51,,2021-04-02
21,Bullish!,158,mhxq00,https://www.reddit.com/r/Bitcoin/comments/mhxq00/bullish/,27,2021-04-01 23:27:40,"BREAKING: MALTA FIRST COUNTRY IN THE EU TO ACCEPT TAX PAYMENTS IN #BITCOIN

Love it!",2021-04-01
22,"Once Bitcoin hits $182 000, Satoshi Nakamoto will become the richest man in the world, and we still have no idea who he is.",7,mifxgu,https://youtu.be/dzvGNaC1FiM,9,2021-04-02 16:19:20,,2021-04-02
23,Morgan Stanley files to add bitcoin exposure across a dozen institutional funds,158,mhxr5w,https://www.theblockcrypto.com/linked/100189/morgan-stanley-files-to-add-bitcoin-exposure-across-a-dozen-institutional-funds,7,2021-04-01 23:29:15,,2021-04-01
24,"Sorry Christine Lagarde, We Don’t Need Your Digital Euro, We Already Have Bitcoin",492,mhr5v0,https://www.inbitcoinwetrust.net/sorry-christine-lagarde-we-dont-need-your-digital-euro-we-already-have-bitcoin-5f37410b4c02?sk=b67f6f57dd3e1c77b8736c50cc5a7847,93,2021-04-01 16:54:23,,2021-04-01
25,"So, I made this! Just finished painting a small crypto collection which I wanted to create for a looooong time ☺️ Hopefully you'll like it! Gonna make more in future, feedback/ideas welcome! Some more details in comments if anyone wants to know more about the paintings! Cheers! [Artwork]",73,mi20vv,https://i.redd.it/0bsridmwulq61.jpg,26,2021-04-02 02:44:07,,2021-04-02
26,Cash out through online gambling? Or am I going mental?,18,mib6hx,https://www.reddit.com/r/Bitcoin/comments/mib6hx/cash_out_through_online_gambling_or_am_i_going/,12,2021-04-02 10:42:27,"Let's say the local Bitcoin ATM is charging a 10% fee for turning crypto to cash, but two bookmakers (one crypto and one fiat) each offer the same sporting event, with roughly the same odds and a 5% margin. 

Could I use the crypto bookmaker to cover the less likely outcome, the fiat bookmaker to cover the more likely outcome, watch the sporting event, (probably) lose the crypto and withdraw the cash, minus 5%?

Not to mention the sweet little bonuses both bookmakers would be vying to give me, nor the fact I could dodge taxes because ""gambling winnings are tax-free""...",2021-04-02
27,They Stopped Updating The Fiat Money Supply...,64,mi2kwz,https://www.reddit.com/r/Bitcoin/comments/mi2kwz/they_stopped_updating_the_fiat_money_supply/,43,2021-04-02 03:10:08,"M1 and M2 money stock graphs on the federal reserve's website has not been updated since data from 2/1/2021. They are supposed to update it the first of every month, and have done so since 1960. Until now. They've skipped the past two months. Now we don't know how much money is being pumped into the system. We only have the BS inflation numbers they give us....

Every month has had 3 to 5 days of data being released. Except march 2021, there was only one release. [https://www.federalreserve.gov/releases/h6/default.htm](https://www.federalreserve.gov/releases/h6/default.htm)

M1 [https://fred.stlouisfed.org/series/M1SL](https://fred.stlouisfed.org/series/M1SL#0)

M2 [https://fred.stlouisfed.org/series/M2SL](https://fred.stlouisfed.org/series/M2SL)

&#x200B;

Meanwhile, Bitcoin has an auditable supply, transparent ledger, and capped total supply... a truly honest and fair financial base layer...",2021-04-02
28,"The Fourth Amendment requires the government to get a warrant before conducting a search or seizure, so why do people accept as normal that financial institutions turn over sensitive financial data to governments without a warrant?",30,mi7sht,https://www.reddit.com/r/Bitcoin/comments/mi7sht/the_fourth_amendment_requires_the_government_to/,32,2021-04-02 07:25:27,,2021-04-02
29,"Trying to get started, a basic question would really appreciate feedback please",12,miblf8,https://www.reddit.com/r/Bitcoin/comments/miblf8/trying_to_get_started_a_basic_question_would/,3,2021-04-02 11:07:54,"I just bought a modest amount of bitcoin from an ATM and I chose the ""create a wallet"" option for the btc to be stored. How do I access these funds to make a purchase? How can I transfer from this automated wallet to a different wallet? Is that possible? How can I access these funds period. Thanks for reading",2021-04-02
30,Peter Schiff Says He Was Wrong About Bitcoin,59,mi29v4,https://www.trustnodes.com/2021/04/01/peter-schiff-says-he-was-wrong-about-bitcoin,29,2021-04-02 02:55:55,,2021-04-02
31,"Cryptocurrency venture capital financing reached 2.6 billion U.S. dollars in the first quarter, exceeding last year.",6,mifi2s,https://www.reddit.com/r/Bitcoin/comments/mifi2s/cryptocurrency_venture_capital_financing_reached/,0,2021-04-02 15:44:30,"According to data from CB Insights, in the first quarter of this year, 129 startups focusing on blockchain digital technology around the world raised a total of approximately US$2.6 billion, surpassing the entire year of 2020. In 2020, startups in this field had raised $2.3 billion in 341 venture capital investments.

　　 This growth was driven by several rounds of large-scale financing of startups, including crypto lender BlockFi, game developer Dapper Labs, and crypto wallet provider Blockchain

　　 With the price of Bitcoin hitting a record high, and companies such as Tesla (661.75, -6.18, -0.93%) investing heavily in the world's largest digital currency, Bitcoin financing has also surged.

　　 Also, Coinbase, the largest cryptocurrency exchange in the United States, is planning a direct listing, which may make many early investors earn a lot of money and encourage more venture capital to enter the field.",2021-04-02
32,Whats going on? it is rising so fast,9,mibro9,https://www.reddit.com/r/Bitcoin/comments/mibro9/whats_going_on_it_is_rising_so_fast/,28,2021-04-02 11:18:41,anyone know what causes the surge?,2021-04-02
33,"Future planning, children, and trusts",10,mibmwr,https://www.reddit.com/r/Bitcoin/comments/mibmwr/future_planning_children_and_trusts/,28,2021-04-02 11:10:32,"So, I'm getting divorced. Another Covid lockdown casually. But it hit me tonight that my soon to be ex is still my beneficiary of my will. I'm going to change that ASAP. 

I've been wanting to set my three boys each up a trust anyway. My thought was to take a little money each pay period, and add some sats to their wallet. In the event I pass, my assets would be liquidated, debts reconciled, and I'd want the remainder divided equally and placed in their wallets. 

I have no idea how this would work. I would be the trustee, unless something happens to me, then my atty becomes trustee? Who has the wallets? We'd obviously both have to have the seed phrases? Maybe I keep a stamped card in a security deposit box, with a key to the box going to my atty upon my demise? 

I really don't know the best way to do this. Any advice?",2021-04-02
34,"69,420$ April fools BTC Price",35,mi4gy5,https://www.reddit.com/r/Bitcoin/comments/mi4gy5/69420_april_fools_btc_price/,9,2021-04-02 04:38:47,"i was expecting to see a 69,420$ bitcoin price on april fools.. anyone can help make that happen?",2021-04-02
35,Not sure if this has been talked about on here but wanted your thoughts on the Federal Reserve currently creating a cryptocurrency called FedCoin,6,mid9tt,https://www.moneymetals.com/news/2021/03/09/the-fedcoin-is-coming-002239,12,2021-04-02 12:56:16,,2021-04-02
36,"Thanks to the Federal Reserve, 'savings account' is now an oxymoron. Bitcoin & Defi seems to be the future.",45,mi2a0j,https://www.reddit.com/r/Bitcoin/comments/mi2a0j/thanks_to_the_federal_reserve_savings_account_is/,16,2021-04-02 02:56:08,"Or is federal governments going to do something to save fiat currency holders?

https://twitter.com/real_vijay/status/1377630484075839489?s=21",2021-04-02
37,"Black rock, Morgan Stanley, Pay Pal, Bakkt etc.",14,mi8srb,https://www.reddit.com/r/Bitcoin/comments/mi8srb/black_rock_morgan_stanley_pay_pal_bakkt_etc/,5,2021-04-02 08:20:51,"My how our hobby has morphed into some kind of institutional playground. Yet there's a lack of topics about the short and long term effects of the big guns entering our beloved project.
Are we being set up for fractional drains or should we be spending more time endorsing the entities that are physically backing their assets with real skin in the game.
Please share your thoughts and concerns.",2021-04-02
38,Philosophy: In order to understand btc you need to understand money.,162,mht8uo,https://www.reddit.com/r/Bitcoin/comments/mht8uo/philosophy_in_order_to_understand_btc_you_need_to/,97,2021-04-01 19:26:57,"The sum on your bank account is not your money. Not your cash, not your money.
That takes a while for most people to fathom. That is how indoctrinated we are.

In fact, the bank can do whatever they want with the money you’ve given them. It is theirs now.

What you have is an IOU.
Except the IOU has no sum printed on it. The one that owes you money keeps track of the amount (because you don’t, right?)

So you don’t keep a ledger, and, in fact, I doubt you even have a printed IOU.

Buying btc from Robinhood is similar. Not your coins. What you have is an IOU.

Both of these can fail, get hacked or asked by governments not to pay to you.

You might have a system that works as an insurance against failures. Still you rely on the failing party to name the amount.

It is not ”money in the bank” it is ”the bank’s money” or ”Robinhood’s coins”.",2021-04-01
39,The question is ... do you check your bitcoins?,3,mig6u7,https://www.reddit.com/r/Bitcoin/comments/mig6u7/the_question_is_do_you_check_your_bitcoins/,12,2021-04-02 16:41:11," hey guys.

I'm completely new here, but I would like to know, if this is important for you to have a ""clean"" bitcoin, so you know your wallet is safe ? have you ever faced with a situation, of having problems after buying a coin from shady platforms?

with what programs you check it? 

thanks for all answers. ",2021-04-02
40,Fortnite now has a skin for all us gamer HODLers!,28,mi4e2q,https://i.redd.it/tpzr7tgbhmq61.jpg,5,2021-04-02 04:34:41,,2021-04-02
41,"Another Paxful warning: Paxful just did an internal drain of my Bitcoin with no explanation. It wasn’t sent out, it’s just vanished. There support deleted my post.",156,mhsab2,https://www.reddit.com/r/Bitcoin/comments/mhsab2/another_paxful_warning_paxful_just_did_an/,37,2021-04-01 18:20:53,"So another day another Paxful scam. This time from Paxful themselves? My account had a fairly random amount of BTC around $200 taken out of it. Or disappeared out of it. I use 2FA with an Authenticator and Email confirmation but it appears nothing was actually sent out. 

I reached out to Paxful about this and my post was promptly deleted. I’m reconstructing my funding from my BTC wallet logs and Paxful “past transactions” because they don’t even provide a wallet transaction history page.

Just don’t do it. Don’t fuck with Paxful. It’s not worth it.",2021-04-01
42,George Soros started to invest in Bitcoin companies,57,mhxrdk,https://digesttime.com/2021/04/01/george-soros-started-to-invest-in-bitcoin-companies/,26,2021-04-01 23:29:32,,2021-04-01
