,title,score,id,url,comms_num,created,body,date
0,"Daily Discussion, March 01, 2021",93,lva2nu,https://www.reddit.com/r/Bitcoin/comments/lva2nu/daily_discussion_march_01_2021/,1120,2021-03-01 22:07:54,"Please utilize this sticky thread for all general **Bitcoin** discussions! If you see posts on the front page or /r/Bitcoin/new which are better suited for this daily discussion thread, please help out by directing the OP to this thread instead. Thank you!

If you don't get an answer to your question, you can try phrasing it differently or commenting again tomorrow.

[Join us in the r/Bitcoin Chatroom!](https://discord.gg/qE3rWBRNqh)

Please check the [previous discussion thread](https://www.reddit.com/r/Bitcoin/comments/lumbpo/daily_discussion_february_28_2021/) for unanswered questions.",2021-03-01
1,"Mentor Monday, March 01, 2021: Ask all your bitcoin questions!",34,lva8tv,https://www.reddit.com/r/Bitcoin/comments/lva8tv/mentor_monday_march_01_2021_ask_all_your_bitcoin/,238,2021-03-01 22:15:11,"Ask (and answer!) away! Here are the general rules:

* If you'd like to learn something, ask.
* If you'd like to share knowledge, answer.
* Any question about Bitcoin is fair game.

And don't forget to check out /r/BitcoinBeginners

You can sort by new to see the latest questions that may not be answered yet.",2021-03-01
2,My Bitcoin meme art,6610,lv9fkk,https://i.redd.it/o4dh7jpv6fk61.jpg,262,2021-03-01 21:38:52,,2021-03-01
3,"Mayor FrancisSuarez, who wants Miami to embrace BTC, pushes back on Yellen calling it “extremely inefficient”: “It doesn't surprise me at all that a Treasury secretary would find a decentralized potential currency to be hostile to a currency that they control.”",1788,lv4x6l,https://twitter.com/axios/status/1366173335944593410,152,2021-03-01 17:31:55,,2021-03-01
4,"MicroStrategy Acquires Additional $15 Million in Bitcoin at Average Price of $45,710",553,lv9daa,https://www.microstrategy.com/en/investor-relations/financial-documents/microstrategy-acquires-additional-15m-in-bitcoin-at-average-price-of-45-710_03-01-2021,94,2021-03-01 21:35:49,,2021-03-01
5,Citibank have released a 106-page report on Bitcoin,589,lv7nn4,https://twitter.com/Bloqport/status/1366337344744394752,86,2021-03-01 20:11:08,,2021-03-01
6,Tim Draper predicts Netflix will be the next to add Bitcoin to their balance sheet!,211,lvfbmd,https://v.redd.it/n4udn81eegk61,32,2021-03-02 01:43:18,,2021-03-02
7,My wife is my best market indicator,4400,luw6m5,https://www.reddit.com/r/Bitcoin/comments/luw6m5/my_wife_is_my_best_market_indicator/,311,2021-03-01 09:21:19,"Been in the space since 2017. Lost a lot of cash then started learning. Hodl is the way my friends. Interestingly my wife seems to be the best indicator of the market to the general public. Whenever she asks me 'how's the bitcoin doing?' I answer ""why?"" And she's like 'elon something,' or 'i read its up, what's it worth?' I know its time to expect a dip.

 Conversely when she says ' I heard it crashed again,  should have sold ' I know its time to buy. Its hilarious. Its like having public sentiment in my house.",2021-03-01
8,Equals a company listed on the London Stock Exchange partners up with Tap to bring cryptocurrencies to their 1M users!,72,lvmya2,https://www.financemagnates.com/forex/brokers/equals-launches-cryptocurrency-exchange-services/,0,2021-03-02 06:46:28,,2021-03-02
9,If you don’t think Bitcoin STILL doesn’t confuse the crap out of investor analysts watch this segment.,323,lv9sxe,https://v.redd.it/4kxi9u6w9fk61,79,2021-03-01 21:56:12,,2021-03-01
10,If an electric vehicle is considered green then so is bitcoin mining,169,lvehz0,https://www.reddit.com/r/Bitcoin/comments/lvehz0/if_an_electric_vehicle_is_considered_green_then/,41,2021-03-02 01:09:33,"Look I'm not here to argue about electric vehicles, but my point is if I bought a Tesla TODAY and plugged it in to charge TODAY, based on the power sources in my state it would be more than 40% powered by coal and another 30% by natural gas. These are not Green power sources.

Meanwhile I keep seeing FUD about how much energy bitcoin uses and how it's not green, when a Miner would be plugged into the exact same power supply as that Tesla. Same with whatever smart phone that the FUD was tweeted with, also powered by fucking coal in pretty much any US state. 

If a Tesla can be powered by Solar, so can a Bitcoin miner.

Bitcoin is only as green as the grid, just like anything else. It shouldn't be 'ban bitcoin' or 'ban Tesla' or 'ban smartphones' because of energy usage, it should be *fix the fucking grid*.",2021-03-02
11,You already know where,75,lvk615,https://v.redd.it/gavwixzyahk61,9,2021-03-02 04:50:46,,2021-03-02
12,"Bitcoin could become the “currency of choice for international trade”, says Citi",362,lv7q1r,https://www.theblockcrypto.com/post/96599/bitcoin-international-trade-currency-citi,33,2021-03-01 20:14:45,,2021-03-01
13,AGAIN MicroStrategy Buys 328 More Bitcoins for $15M in Cash,249,lva7xp,https://coinquora.com/microstrategy-buys-328-more-bitcoins-for-15m-in-cash/,42,2021-03-01 22:14:05,,2021-03-01
14,Monday Art - Oussama Chafi,159,lvbzb4,https://i.redd.it/hwqd11y2qfk61.png,7,2021-03-01 23:27:51,,2021-03-01
15,"Cathie Wood Says Janet Yellen Doesn’t Understand Cryptocurrency, Bitcoin Far More Energy Efficient Than Gold",89,lvfxzl,https://cryptonews.net/478576/?utm_source=CryptoNews&utm_medium=app&utm_campaign=shared,10,2021-03-02 02:08:01,,2021-03-02
16,Monday Art - Arthur Zaharchuk,151,lvbz00,https://i.redd.it/349kakgxpfk61.jpg,12,2021-03-01 23:27:28,,2021-03-01
17,Bitcoin Art Mondays 💎🙌 Just HODL // My first legit Bitcoin art piece. Show me that love.,450,lv4sqp,https://v.redd.it/oopywvljudk61,53,2021-03-01 17:23:50,,2021-03-01
18,"""It’s become evident to just about everyone, that cash in the bank is nothing more than Bitcoin that is not going up. It's virtual money; frankly it isn’t even an asset. It's a liability of the bank; therefore it’s a liability,” - Anthony Deden, Swiss based Chairman of Edelweiss Holding",80,lvfhjd,https://efrontier.substack.com/p/fear-of-heights,3,2021-03-02 01:49:53,,2021-03-02
19,Fidelity advises clients to consider Bitcoin in traditional 60/40 portfolios,50,lvhsq8,https://institutional.fidelity.com/app/literature/item/9901337.html?pos=T,1,2021-03-02 03:19:14,,2021-03-02
20,"Natoshi Sakamoto? Great job, Financial Times",136,lv9n1d,https://i.redd.it/8pbekxvl8fk61.jpg,36,2021-03-01 21:48:32,,2021-03-01
21,"Twitter, Inc. Announces $1.25 Billion Convertible Notes Offering - Following Saylors playbook for Bitcoin?",172,lv7ntf,https://www.prnewswire.com/news-releases/twitter-inc-announces-1-25-billion-convertible-notes-offering-301237228.html,23,2021-03-01 20:11:24,,2021-03-01
22,E-Commerce Giant Rakuten Now Lets Users Shop With Bitcoin,197,lv6rb4,https://www.coindesk.com/e-commerce-giant-rakuten-now-lets-users-shop-with-cryptocurrency,16,2021-03-01 19:21:34,,2021-03-01
23,"Guggenheim CIO Says Bitcoin Could Eventually Climb to $600,000",54,lvf0yj,https://finance.yahoo.com/finance/news/guggenheim-cio-says-bitcoin-could-094641937.html,17,2021-03-02 01:31:06,,2021-03-02
24,Energy usage of Bitcoin compared to others,872,luxxnj,https://i.redd.it/uimywod7ybk61.jpg,242,2021-03-01 10:44:53,,2021-03-01
25,Citi : Bitcoin could be “the chosen currency for international trade”,23,lvl6so,https://digesttime.com/2021/03/01/citi-bitcoin-could-be-the-chosen-currency-for-international-trade/,1,2021-03-02 05:32:34,,2021-03-02
26,2008,49,lvem6j,https://v.redd.it/q7dw858a8gk61,15,2021-03-02 01:14:20,,2021-03-02
27,Improved version ;),48,lvfco6,https://v.redd.it/wsn85ezaegk61,6,2021-03-02 01:44:33,,2021-03-02
28,"REUTERS: Bitcoin rises 6% as risk assets rally; Citi says at a ""tipping point""",96,lv953s,https://www.reuters.com/article/crypto-currency-bitcoin-citi/update-1-bitcoin-is-at-a-tipping-point-citi-says-idUSL5N2KZ307,5,2021-03-01 21:25:04,,2021-03-01
29,"Crypto's New Wall Street Investors Completely Unbothered By This Past Week's $10,000+ Correction...",97,lv8wqz,https://www.globalcryptopress.com/2021/03/cryptos-new-wall-street-investors.html,19,2021-03-01 21:13:56,,2021-03-01
30,"Ukrainians arrested smuggling 16 kilos of gold ($900,000 USD) & cigarettes across their border. Bitcoin solves this problem, next time just memorize 12 words and walk across the border. That is the power of Bitcoin.",50,lvdqqk,https://www.reuters.com/article/ukraine-smuggle-diplomats-idUSL2N2KZ161,40,2021-03-02 00:39:45,,2021-03-02
31,I bought my first btc from 49 k usd.,50,lvdftg,https://www.reddit.com/r/Bitcoin/comments/lvdftg/i_bought_my_first_btc_from_49_k_usd/,24,2021-03-02 00:26:59,Greetings from turkey. Best wishes,2021-03-02
32,WE ARE ALL SATOSHI. 159 Bitcoiners recite the whitepaper. http://dimzayan.com/voicepaper.html for full vid.,34,lvgr12,https://v.redd.it/du6bpdfuigk61,7,2021-03-02 02:39:06,,2021-03-02
33,To the people freaking out these last few days: The way you build a house is to first lay the foundation. All green = bubble = bad. We now have a floor.,37,lve1ir,https://www.reddit.com/r/Bitcoin/comments/lve1ir/to_the_people_freaking_out_these_last_few_days/,5,2021-03-02 00:51:27,,2021-03-02
34,Goldman Sachs Relaunching Crypto Trading Desk After 3-Year Pause,27,lvh1bf,https://www.coindesk.com/goldman-relaunches-crypto-desk,4,2021-03-02 02:50:38,,2021-03-02
35,Ex-CIA economics expert gave me bitcoin advice today...,344,lv0ds6,https://www.reddit.com/r/Bitcoin/comments/lv0ds6/excia_economics_expert_gave_me_bitcoin_advice/,231,2021-03-01 12:52:05,"He said: “the thing is, with Bitcoin, you can’t view it as an investment such as a stock, like the common person. Instead, You have to view it as owning land.

Instead of cashing it out, place loans against it. This way, you don’t lose your coin, and can instead weigh how to minimize land loss through manageable smaller debts. This ensures the volatility can still chance its way into your hands”. 

Thought that was really interesting",2021-03-01
36,"Citigroup: BTC could “become the currency of choice for international trade,” thanks to its “decentralized design, lack of foreign exchange exposure, fast (and potentially cheaper) money movements, secure payment channels, and traceability.”",38,lvdgip,https://www.coindesk.com/citi-bitcoin-at-tipping-point-as-institutions-come-on-board,13,2021-03-02 00:27:44,,2021-03-02
37,Exclusive: Goldman Sachs restarts cryptocurrency desk amid bitcoin boom,18,lvicvx,https://www.reuters.com/article/crypto-currency-goldman-sachs-idUSL2N2KZ0XX,3,2021-03-02 03:39:29,,2021-03-02
38,"If bitcoins were distributed using the current global distribution of wealth, 99.9% of people would have $21.74 worth of bitcoins, and people in the top .001% would have 0.73 bitcoins each.",121,lv4zkf,http://bitcoinsperperson.com/,68,2021-03-01 17:36:04,,2021-03-01
39,Price going to Mars confirmed.,107,lv50y6,https://uk.finance.yahoo.com/news/bitcoin-price-investment-ruffer-asset-management-citi-institutional-adoption-085902238.html?guccounter=1,14,2021-03-01 17:38:27,,2021-03-01
40,"When in doubt just zoom out, HODLers never loose.",88,lv5zjb,https://www.reddit.com/r/Bitcoin/comments/lv5zjb/when_in_doubt_just_zoom_out_hodlers_never_loose/,16,2021-03-01 18:36:30,"We understand that not many of the new comers have experienced these corrections. As you’ve heard time and time again 25 - 40% corrections in this space during a bull market are absolutely normal. It is easy to go back in history and say “should have bought here or I should have sold there” 

Manage your risk properly and consider taking profits if you are sitting on life changing amounts but know that Bitcoin is here to stay and you are still early to the party.",2021-03-01
41,"About This Elegant, and 100% Legal BTC Shakedown Scheme",20,lvgq35,https://www.reddit.com/r/Bitcoin/comments/lvgq35/about_this_elegant_and_100_legal_btc_shakedown/,7,2021-03-02 02:38:01,"In bull markets we see all kinds of schemes spring up from the woodwork. From the low level, to the high-level.

On the highest levels the more refined schemes are exceptionally good at taking advantage of the weakness of the average speculator / HODL’er.

It's rather disgusting if you ask me... Let me take some time to expose one very clever scheme in particular.

When Bitcoin is going up, especially as it was earlier this year without stopping, **the average person was only able to see it going up forever without stopping**. Especially the newcomer.  Many newcomers to BTC are new to investing (speculating) in general.

*The average newcomer is not accustomed to the ""typical"" 40% pull back in BTC and the cyclical bear market.*

**This is used against them by wolves in sheep' clothing.**

BTC Lending Companies prey on unwitting BTC speculators by marketing their loan products as alternatives to hold on to your BTC while accessing some cash at the same time in the form of a loan.  The Lending Business of the leading BTC lending company exploded after Tesla bought based on the interview the Lending CEO gave on financial TV.  

Getting a loan on your BTC instead of selling it (being able to HODL) is marketed to the individual who only sees BTC going up forever and ever, OR, the individual who intends to use the loan to buy more BTC - sort of as a form of margin.

In either instance, they are marketing a ""semi-sophisticated"" product to a ""less than sophisticated"" group of investors.

Unwitting BTC investors and speculators are made aware that the loans are based on the present value of their BTC, but many overlook the inevitable; *if you're taking loans out during rallies, you're going to have to cough up more collateral (BTC), or pay off your loan in full during dips and bear markets.*

People that got loans when BTC was at $58k were screwed.

The local low for BTC is in the $43k range. That's roughly 26% decline. Inasmuch as loans are based on 30% LTV, the average person who did this was required to cough up more collateral or pay the loan off when BTC fell to $43k, in full.

BTC has a habit of ultimately correcting to bull market support levels after significant runs to the upside.  **As it stands now, that number can ultimately be in the $32k to $35k range and I surmise we'll get there in the coming weeks before beginning a surge to $100k by the end of Q3.**

Those folks who used the loans to buy more BTC will have their BTC ""liquidated"" and will walk away with 30 cents on the dollar for every dollar they put at risk in the form of a ""loan.""  Their BTC will have been ""cleverly confiscated"" and they won't be able to enjoy this run up to $100k, even though they bought at high prices.

Those folks who used the loans to buy hookers and c\*ke, will have to pay the loans in full or give the lender more collateral (BTC.)  Clearly, the ""best"" option for them in these cases is to allow their BTC to be confiscated.

&#x200B;

**WHEN IT MAKES SENSE TO TAKE BTC LOANS**

If my younger brother came to me and asked me about taking out a loan and using his BTC as collateral to buy more BTC, I'd tell him to only do it when:

1. At or around bull market support levels.
2. When there is fear and blood in the streets.

The 2nd of which is the least risky option.  I myself will be using a BTC loan when BTC corrects to bull market support levels and will allow the lender to take BTC from me when we do have the run up I expect in Q3 to pay off the loan.

**This is akin to buying BTC at a 30% discount.**",2021-03-02
42,Miami pushes Bitcoin with proposal to pay workers in crypto,267,luz3ft,https://www.livemint.com/market/cryptocurrency/miami-pushes-bitcoin-with-proposal-to-pay-workers-in-crypto-11613107484957.html,38,2021-03-01 11:43:04,,2021-03-01
43,Goldman Sachs To Launch Crypto Trading Operation This Month,10,lvln8v,https://www.reddit.com/r/Bitcoin/comments/lvln8v/goldman_sachs_to_launch_crypto_trading_operation/,8,2021-03-02 05:52:03,"More and more large corporations are going to be jumping on the crypto bandwagon now there’s a good amount of history / evidence to prove the direction it's heading in:

[https://www.forbes.com/sites/jonathanponciano/2021/03/01/goldman-sachs-to-launch-crypto-trading-operation-this-month-after-bitcoins-big-surge/?sh=6df3554c49e7](https://www.forbes.com/sites/jonathanponciano/2021/03/01/goldman-sachs-to-launch-crypto-trading-operation-this-month-after-bitcoins-big-surge/?sh=6df3554c49e7)",2021-03-02
44,Kicking Myself in the Ass,24,lvejub,https://www.reddit.com/r/Bitcoin/comments/lvejub/kicking_myself_in_the_ass/,68,2021-03-02 01:11:30,"I saw that Bitcoin had dropped to $43k+ yesterday, so I sold it at all thinking that it was going to go lower, so I could rebuy it back. It didn't, and now I'm going to buy it all back tomorrow at maybe $50k.",2021-03-02
45,For anybody thinking of selling...,14,lvi8f5,https://www.reddit.com/r/Bitcoin/comments/lvi8f5/for_anybody_thinking_of_selling/,5,2021-03-02 03:35:44,"Just a remember. At this stage in the game, there is almost certainly a 100% chance somebody has more invested then you and is HODL. It doesn’t matter if market prices continue to stagger, stump, and jump... they will continue to do so until we inevitably find ourselves in orbit of, or on the moon... 

Unless you invested more than you can afford to... in which case, pull that shit out and pay your rent bro. Bitcoin ain’t skyrocketing overnight. There will be many dips to buy in the future, and this year in particular. 


The long term ROI of bitcoin has only payed out dividends to those smart enough to stick around. 

I spent hundreds of crypto in 2016/2017 for CS:GO skins/betting and I’m the one looking goofy rn because I thought a video game market would have higher volatility than a digital currency. Wild.",2021-03-02
46,"Bitcoin could become the “currency of choice for international trade”, says Citi analysts",28,lvb86w,https://www.reddit.com/user/Fatherthinger/comments/lvb65z/bitcoin_could_become_the_currency_of_choice_for/,0,2021-03-01 22:57:17,,2021-03-01
47,"If you want low fees use native segwit ""bc1"" addresses",41,lv82ge,https://www.reddit.com/r/Bitcoin/comments/lv82ge/if_you_want_low_fees_use_native_segwit_bc1/,24,2021-03-01 20:32:27,"Native segwit ""bc1"" saves you 45% compared to legacy ""1"" addresses and 15% compared to wrapped segwit ""3"" addresses

You can also use Lightning Network or Bitcoin's sidechains like RSK and Liquid to pay very small fees",2021-03-01
48,Goldman Sachs to Restart Its Bitcoin Trading Desk and Explore ETF,16,lvfie6,https://coinfomania.com/breaking-goldman-sachs-to-restart-its-bitcoin-trading-desk-and-explore-etf/,5,2021-03-02 01:50:45,,2021-03-02
49,Investment Bank Citi: Bitcoin Is ‘At the Tipping Point’,66,lv5ovk,https://decrypt.co/59768/investment-bank-citi-bitcoin-is-at-the-tipping-point?utm_source=reddit&utm_medium=social&utm_campaign=sm,6,2021-03-01 18:19:02,,2021-03-01
